"","record_w1","uuid","T1_Date","markers","T1_Status","E1Teilnahme","E2Einwilligung1","E2Einwilligung2","E2Einwilligung3","E2Einwilligung4","E2Einwilligung5","DA1Geschlecht","DA2Alter","rec_age","DA3Qualifikation1","DA3Qualifikation1r6oe","DA3Qualifikation2","DA4Beschaeftigung1","DA4Beschaeftigung1r8oe","DA4Beschaeftigung2","DA4Beschaeftigung3","DA4Beschaeftigung4","DA4Beschaeftigung5","DA5Zeiten1A1","DA5Zeiten1A2","DA5Zeiten2","DA5Zeiten3A1","DA5Zeiten3A2","DA5Zeiten3A3","DA6OrganisationaleD1","DA6OrganisationaleD1r12oe","DA6OrganisationaleD2","DA6OrganisationaleD3","DA7Standort","DA8Familienstand","DA9Haushalt1","DA9Haushalt1r2oe","number_of_person","DA9Haushalt2","DA9Haushalt2r2oe","DA9Haushalt3ar1","DA9Haushalt3ar2","DA9Haushalt3ar3","DA9Haushalt3ar4","DA9Haushalt3ar5","DA9Haushalt3ar6","DA9Haushalt3ar7","DA9Haushalt3ar8","DA9Haushalt3ar9","DA9Haushalt3ar10","DA9Haushalt3br1","DA9Haushalt3br2","DA9Haushalt3br3","DA9Haushalt3br4","DA9Haushalt3br5","DA9Haushalt3br6","DA9Haushalt3br7","DA9Haushalt3br8","DA9Haushalt3br9","DA9Haushalt3br10","DA10Betreuung","DA11Pflege","AF1Vielseitig1","AF1Vielseitig2","AF1Vielseitig3","AF2Ganzheitlich1","AF2Ganzheitlich2","AF3SozRueck1","AF3SozRueck2","AF3SozRueck3","AF4Zusammen1","AF4Zusammen2","AF4Zusammen3","AF5QualiAB1","AF5QualiAB2","AF6QuantiAB1","AF6QuantiAB2","AF7Unterbrechung1","AF7Unterbrechung2","AF8Umgebung1","AF8Umgebung2","AF9Info1","AF9Info2","AF10Weiterbild1","AF10Weiterbild2","AGIL1Pro1","AGIL1Pro2","AGIL1Re","AGIL2AgilMeth","Demo1OrgStr1","Demo1OrgStr2","Demo1OrgStr3","Demo1OrgStr4","Demo1OrgStrB","Demo2Fuehrung1","Demo2Fuehrung2","Demo2Fuehrung3","Demo2Fuehrung4","Demo2Fuehrung5","Demo2Fuehrung6","Demo2Fuehrung7","Demo2Fuehrung8","Demo2Fuehrung9","Demo2Fuehrung10","Demo2Fuehrung11","Demo2Fuehrung12","Demo3Parti1","Demo3Parti2","Demo3Parti3","Demo3Parti4","Demo3Parti5","Demo4Auto1","Demo4Auto2","Demo4Auto3","Demo4Auto4","Demo4Auto5","Demo4Auto6","Demo4Auto7","Demo4Auto8","Demo4Auto9","Digi1IKTHaeuf1","Digi1IKTHaeuf2","Digi1IKTHaeuf3","Digi1IKTHaeuf4","Digi1IKTHaeuf5","Digi1IKTHaeuf6","Digi1IKTHaeuf7","Digi2IKTVerfuegbar","Digi2IKTFunktion","Digi3IKTNutzung1","Digi3IKTNutzung2","Digi3IKTVernetzung","Digi3IKTAutomation1","Digi3IKTAutomation2","Digi3IKTAutomation3","Digi3IKTAutomation4","Flex1ze1","Flex1ze2","Flex2oe1a","Flex2oe1b","Flex2oe1c","Flex2oe2a","Flex2oe2b","Flex2oe2c","Flex2oe2d","Flex3HO1","Flex3HO2","Flex3HO3","Flex4E1","Flex4E2","Flex4E3","Flex4E4","Flex4E5","O1ArbZu","O2ArbFaehig","O3AllGes1","O3AllGes2","O3AllGes3","O3AllGes4","O3AllGes5","O3AllGes6","O3AllGes7","O3AllGes8","O4Burnout1","O4Burnout2","O4Burnout3","O4Burnout4","O4Burnout5","O4Burnout6","O4Burnout7","O4Burnout8","O4Burnout9","O5WLB1","O5WLB2","O5WLB3","O5WLB4","O5WLB5","O5WLB6","O5WLB7","O5WLB10","O5WLB11","O5WLB12","O6WorkEng1","O6WorkEng2","O6WorkEng3","O6WorkEng4","O6WorkEng5","O6WorkEng6","O6WorkEng7","O6WorkEng8","O6WorkEng9","KR1AGK1","KR1AGK2","KR1AGK3","KR1AGK4","KR1AGK5","KR1AGK6","KR1AGK7","KR1AGK8","KR1AGK9","KR1AGK10","KR1AGK11","KR2PsyEmp1","KR2PsyEmp2","KR2PsyEmp3","KR2PsyEmp4","KR2PsyEmp5","KR2PsyEmp6","KR2PsyEmp7","KR2PsyEmp8","KR2PsyEmp9","KR2PsyEmp10","KR2PsyEmp11","KR2PsyEmp12","KR3SWE1","KR3SWE2","KR3SWE3","KR3SWE4","KR3SWE5","KR3SWE6","KR4Res1","KR4Res2","KR4Res3","KR4Res4","KR4Res5","KR4Res6","vlist","qtime.x","vos","vosr15oe","vbrowser","vbrowserr15oe","vmobiledevice.x","vmobileos","start_date","vdropout","source","decLang","list","userAgent","fp_etag","fp_html5.x","fp_flash.x","fp_browser.x","dcua.x","url.x","session.x","ID.x","record","T2_Date","T2_Status","T2_E1Teilnahme","T2_E2Einwilligung1","T2_E2Einwilligung2","T2_E2Einwilligung3","T2_E2Einwilligung4","T2_E2Einwilligung5","T2_DA1Geschlecht","T2_DA2Alter","T2_BerufSituation1","T2_BerufSituation2","T2_PrivatSituation1","T2_PrivatSituation2","T2_GES1ArbZu","T2_GES2ArbFaehig","T2_GES3AllGes1","T2_GES3AllGes2","T2_GES3AllGes3","T2_GES3AllGes4","T2_GES3AllGes5","T2_GES3AllGes6","T2_GES3AllGes7","T2_GES3AllGes8","T2_GES4Burnout1","T2_GES4Burnout2","T2_GES4Burnout3","T2_GES4Burnout4","T2_GES4Burnout5","T2_GES4Burnout6","T2_GES4Burnout7","T2_GES4Burnout8","T2_GES4Burnout9","T2_GES5Praesentismus","T2_GES6WLB1","T2_GES6WLB2","T2_GES6WLB3","T2_GES6WLB4","T2_GES6WLB5","T2_GES6WLB6","T2_GES6WLB7","T2_GES6WLB8","T2_GES6WLB9","T2_GES6WLB10","T2_GES6WLB11","T2_GES6WLB12","T2_BGM1KV","T2_BGM1AnsprechIntern","T2_BGM1AnsprechIntern_b","T2_BGM1AnsprechIntern_b2","T2_BGM1AnsprechIntern_b2r6oe","T2_BGM1AnsprechIntern_b3","T2_BGM1AnsprechIntern_b3r10oe","T2_BGM1Ansprech1a","T2_BGM1Ansprech1b","T2_BGM1Ansprech1c","T2_BGM1Ansprech1cr4oe","T2_BGM1Ansprech1d","T2_BGM1Ansprech1e","T2_BGM1Ansprech2r1","T2_BGM1Ansprech2r2","T2_BGM1Ansprech2r3","T2_BGM1Ansprech2r4","T2_BGM1Ansprech2r5","T2_BGM1Ansprech2r6","T2_BGM1Ansprech2r7","T2_BGM1Ansprech2r8","T2_BGM1Ansprech2r9","T2_BGM1Ansprech2r9oe","T2_BGM1Ansprech2a","T2_BGM1Ansprech2ar9oe","T2_BGM1AnsprechExtern1r1","T2_BGM1AnsprechExtern1r2","T2_BGM1AnsprechExtern1r3","T2_BGM1AnsprechExtern1r4","T2_BGM1AnsprechExtern1r5","T2_BGM1AnsprechExtern1r6","T2_BGM1AnsprechExtern1r7","T2_BGM1AnsprechExtern1r8","T2_BGM1AnsprechExtern1r9","T2_BGM1AnsprechExtern1r10","T2_BGM1AnsprechExtern1r10oe","T2_BGM1AnsprechExtern2","T2_BGM2Angebote1","T2_BGM3Inanspruchnahme1","T2_BGM3Inanspruchnahme2","T2_BGM3Inanspruchnahme2r5oe","T2_BGM4Covid1","T2_BGM4Covid1b","T2_BGM4Covid1c","T2_BGM4Covid1d_Inanspruch","T2_BGM4Covid1e","T2_BGM4Covid1f","T2_BGM4Covid1fr6oe","T2_BGM5Online1a","T2_BGM5Online1","T2_BGM5Online1b_Inanspruch","T2_BGM5Online1c","T2_BGM5Online1d","T2_BGM5Online1dr5oe","T2_BGM5Online1e","T2_BGM5Online1f","T2_BGM6Angebot1","T2_BGM6Angebot1a","T2_BGM6Inanspruch1a","T2_BGM6Inanspruch1b","T2_BGM6Inanspruch1c","T2_BGM6Inanspruch1cr5oe","T2_BGM6Wunsch1a","T2_BGM6Wunsch1b","T2_BGM6Wunsch1c","T2_BGM6Wunsch1d","T2_BGM6Angebot2","T2_BGM6Angebot2a","T2_BGM6Inanspruch2a","T2_BGM6Inanspruch2b","T2_BGM6Inanspruch2c","T2_BGM6Inanspruch2cr5oe","T2_BGM6Wunsch2a","T2_BGM6Wunsch2b","T2_BGM6Wunsch2c","T2_BGM6Wunsch2d","T2_BGM6Angebot3","T2_BGM6Angebot3a","T2_BGM6Inanspruch3a","T2_BGM6Inanspruch3b","T2_BGM6Inanspruch3c","T2_BGM6Inanspruch3cr5oe","T2_BGM6Wunsch3a","T2_BGM6Wunsch3b","T2_BGM6Wunsch3c","T2_BGM6Wunsch3d","T2_BGM6Angebot4","T2_BGM6Angebot4a","T2_BGM6Inanspruch4a","T2_BGM6Inanspruch4b","T2_BGM6Inanspruch4c","T2_BGM6Inanspruch4cr5oe","T2_BGM6Wunsch4a","T2_BGM6Wunsch4b","T2_BGM6Wunsch4c","T2_BGM6Wunsch4d","T2_BGM6Angebot5","T2_BGM6Angebot5a","T2_BGM6Inanspruch5a","T2_BGM6Inanspruch5b","T2_BGM6Inanspruch5c","T2_BGM6Inanspruch5cr5oe","T2_BGM6Wunsch5a","T2_BGM6Wunsch5b","T2_BGM6Wunsch5c","T2_BGM6Wunsch5d","T2_BGM6Angebot6","T2_BGM6Angebot6a","T2_BGM6Inanspruch6a","T2_BGM6Inanspruch6b","T2_BGM6Inanspruch6c","T2_BGM6Inanspruch6cr5oe","T2_BGM6Wunsch6a","T2_BGM6Wunsch6b","T2_BGM6Wunsch6c","T2_BGM6Wunsch6d","T2_BGM6Angebot7","T2_BGM6Angebot7a","T2_BGM6Inanspruch7a","T2_BGM6Inanspruch7b","T2_BGM6Inanspruch7c","T2_BGM6Inanspruch7cr5oe","T2_BGM6Wunsch7a","T2_BGM6Wunsch7b","T2_BGM6Wunsch7c","T2_BGM6Wunsch7d","T2_BGM6Angebot8","T2_BGM6Angebot8a","T2_BGM6Inanspruch8a","T2_BGM6Inanspruch8b","T2_BGM6Inanspruch8c","T2_BGM6Inanspruch8cr5oe","T2_BGM6Wunsch8a","T2_BGM6Wunsch8b","T2_BGM6Wunsch8c","T2_BGM6Wunsch8d","T2_BGM6Angebot9","T2_BGM6Angebot9a","T2_BGM6Inanspruch9a","T2_BGM6Inanspruch9b","T2_BGM6Inanspruch9c","T2_BGM6Inanspruch9cr5oe","T2_BGM6Wunsch9a","T2_BGM6Wunsch9b","T2_BGM6Wunsch9c","T2_BGM6Wunsch9d","T2_BGM6Angebot10","T2_BGM6Angebot10a","T2_BGM6Inanspruch10a","T2_BGM6Inanspruch10b","T2_BGM6Inanspruch10c","T2_BGM6Inanspruch10cr4oe","T2_BGM6Wunsch10a","T2_BGM6Wunsch10b","T2_BGM6Angebot11","T2_BGM6Angebot11a","T2_BGM6Inanspruch11a","T2_BGM6Inanspruch11b","T2_BGM6Inanspruch11c","T2_BGM6Inanspruch11cr5oe","T2_BGM6Wunsch11a","T2_BGM6Wunsch11b","T2_BGM6Wunsch11c","T2_BGM6Wunsch11d","T2_BGM6Angebot12","T2_BGM6Angebot12a","T2_BGM6Inanspruch12a","T2_BGM6Inanspruch12b","T2_BGM6Inanspruch12c","T2_BGM6Inanspruch12cr5oe","T2_BGM6Wunsch12a","T2_BGM6Wunsch12b","T2_BGM6Wunsch12c","T2_BGM6Wunsch12d","T2_BGM6Angebot13","T2_BGM6Angebot13a","T2_BGM6Inanspruch13a","T2_BGM6Inanspruch13b","T2_BGM6Inanspruch13c","T2_BGM6Inanspruch13cr5oe","T2_BGM6Wunsch13a","T2_BGM6Wunsch13b","T2_BGM6Wunsch13c","T2_BGM6Wunsch13d","T2_BGM6Angebot14","T2_BGM6Angebot14a","T2_BGM6Inanspruch14a","T2_BGM6Inanspruch14b","T2_BGM6Inanspruch14c","T2_BGM6Inanspruch14cr5oe","T2_BGM6Wunsch14a","T2_BGM6Wunsch14b","T2_BGM6Wunsch14c","T2_BGM6Wunsch14d","T2_BGM6Angebot15","T2_BGM6Angebot15a","T2_BGM6Inanspruch15a","T2_BGM6Inanspruch15b","T2_BGM6Inanspruch15c","T2_BGM6Inanspruch15cr5oe","T2_BGM6Wunsch15a","T2_BGM6Wunsch15b","T2_BGM6Wunsch15c","T2_BGM6Wunsch15d","T2_BGM6NW1r1","T2_BGM6NW1r2","T2_BGM6NW1r3","T2_BGM6NW1r4","T2_BGM6NW1r5","T2_BGM6NW1r6","T2_BGM6NW1r7","T2_BGM6NW1r8","T2_BGM6NW1r9","T2_BGM6NW1r10","T2_BGM6NW1r10oe","T2_BGM6NW2r1","T2_BGM6NW2r2","T2_BGM6NW2r3","T2_BGM6NW2r4","T2_BGM6NW2r5","T2_BGM6NW2r6","T2_BGM6NW2r7","T2_BGM6NW2r8","T2_BGM6NW2r9","T2_BGM6NW2r10","T2_BGM6NW2r10oe","T2_BGM6NW3r1","T2_BGM6NW3r2","T2_BGM6NW3r3","T2_BGM6NW3r4","T2_BGM6NW3r5","T2_BGM6NW3r6","T2_BGM6NW3r7","T2_BGM6NW3r8","T2_BGM6NW3r9","T2_BGM6NW3r19","T2_BGM6NW3r19oe","T2_BGM7BEM1","T2_BGM7BEM2","T2_BGM7BEM3","T2_BGM7BEM4","T2_BGM7BEM5","T2_BGM7BEM6","T2_BGM8BetArz1","T2_BGM8BetArz2","T2_BGM8BetArz3","T2_BGM8BetArz4","T2_BGM8BetArz4r4oe","T2_BGM8BetArz5","T2_BGM8BetArz6","T2_BGM9ArbBeur1","T2_BGM9ArbBeur2","T2_BGM10PhyBel","T2_BGM10PsyBel","T2_BGM11Nutzen1","T2_BGM11Nutzen2","T2_BGM11Nutzen3","T2_BGM11Nutzen4","T2_BGMBedarf","T2_BGMBedarfr1oe","T2_HOME1a","T2_HOME1a2","T2_HOME1a3","T2_HOME2a1","T2_HOME2a2","T2_HOME2a3","T2_HOME3GrenzMan1","T2_KR1AGK1","T2_KR1AGK2","T2_KR1AGK3","T2_KR1AGK4","T2_KR1AGK5","T2_KR1AGK6","T2_KR1AGK7","T2_KR1AGK8","T2_KR1AGK9","T2_KR1AGK10","T2_KR1AGK11","T2_KR2PsyEmp1","T2_KR2PsyEmp2","T2_KR2PsyEmp3","T2_KR2PsyEmp4","T2_KR2PsyEmp5","T2_KR2PsyEmp6","T2_KR2PsyEmp7","T2_KR2PsyEmp8","T2_KR2PsyEmp9","T2_KR2PsyEmp10","T2_KR2PsyEmp11","T2_KR2PsyEmp12","T2_KR3GesKomp1","T2_KR3GesKomp2","T2_KR3GesKomp3","T2_KR3GesKomp4","T2_KR3GesKomp5","T2_KR3GesKomp6","T2_KR4DigiKomp1","T2_KR4DigiKomp2","T2_KR4DigiKomp3","T2_KR4DigiKomp4","T2_KR4DigiKomp5","T2_KR4DigiKomp6","T2_KR4DigiKomp7","T2_KR4DigiKomp8","T2_KR4DigiKomp9","T2_KR4DigiKomp10","T2_KR4DigiKomp11","T2_KR4DigiKomp12","T2_KR4DigiKomp13","T2_KR4DigiKomp14","T2_KR4DigiKomp15","T2_KR5HolSC_A1","T2_KR5HolSC_A2","T2_KR5HolSC_A3","T2_KR5HolSC_A4","T2_KR5HolSC_A5","T2_KR5HolSC_A6","T2_KR5HolSC_V1","T2_KR5HolSC_V2","T2_KR6SOC1","T2_KR6SOC2","T2_KR6SOC3","T2_KR6SOC4","T2_KR6SOC5","T2_KR6SOC6","T2_KR6SOC7","T2_KR6SOC8","T2_KR6SOC9","T2_KR6SOC10","T2_KR6SOC11","T2_KR6SOC12","T2_KR6SOC13","T2_PR1Iso1","T2_PR1Iso2","T2_PR1Iso3","T2_PR1Iso4","T2_PR1Iso5","T2_PR1Iso6","T2_PR1Iso7","T2_PR2AvA1","T2_PR2AvA2","T2_PR2AvA3","T2_PR2AvA4","T2_PR2AvA5","T2_PR2AvA6","T2_PR3TI1","T2_PR3TI2","T2_PR4Comm1","T2_PR4Comm2","T2_PR4Comm3","T2_PR4Comm4","T2_PR4Comm5","T2_PR4Comm6","T2_PR4Comm7","T2_PR4Comm8","T2_PR4Comm9","T2_PR4Comm10","T2_PR4Comm11","T2_PR4Comm12","T2_PR4Comm13","T2_PR4Comm14","T2_PR5OHC1","T2_PR5OHC2","T2_PR5OHC3","T2_PR5OHC4","T2_PR5OHC5","T2_PR5OHC6","T2_PR5OHC7","T2_PR5OHC8","T2_PR5OHC9","T2_PR5OHC10","T2_PR6BGMPart1","T2_PR6BGMPart2","T2_PR6BGMPart3","T2_PR6BGMPart4","T2_BGM2Angebote2","qtime.y","vmobiledevice.y","fp_html5.y","fp_flash.y","fp_browser.y","dcua.y","url.y","session.y","ID.y","qtime.x_min","qtime.y_min","HOME_precovid_diff","Date_int","Date_str","Date_dt","Worktime","Worktime_years","Worktime_months","Worktime_full","unternehmensz","Date_dt_y","unternehmensz_y","AF1Vielseitig_mean","AF2Ganzheitlich_mean","AF3SozRueck_mean","AF4Zusammen_mean","AF5QualiAB_mean","AF6QuantiAB_mean","AF7Unterbrechung_mean","AF8Umgebung_mean","AFAF9Info_mean","AF10Weiterbild_mean","AGIL1_mean","AGIL1_Pro_Mean","AGIL2AgilMeth_scale","Demo1OrgStr_mean","Demo2Fuehrung_AV_mean","Demo2Fuehrung_FAG_mean","Demo2Fuehrung_PAM_mean","Demo2Fuehrung_TLIgesamt_mean","Demo3Partizipation_mean","Demo4Autonomie_mean","Demo4Autonomie_Planung_mean","Demo4Autonomie_Entscheidung_mean","Demo4Autonomie_Methoden_mean","Digi3IKT_Nutzung_Vernetzung_mean","Digi3IKTAutomation_mean","Flex1_mean","Flex1ze_mean","Flex1oe_mean","Flex1_mean_z","Flex1_mean_oe","Flex4E_mean","KR1AGK_mean","KR1AGK_Planung_mean","KR1AGK_Selbstmotivierung_mean","KR1AGK_Stressvermeidung_mean","KR2PsyEmp_mean","KR2PsyEmp_Bed_mean","KR2PsyEmp_Komp_mean","KR2PsyEmp_Selbstb_mean","KR2PsyEmp_Einfl_mean","KR3SWE_mean","KR4Res2_r","KR4Res4_r","KR4Res6_r","KR4Res_mean","O3AllGes1_r","O3AllGes2_r","O3AllGes3_r","O3AllGes4_r","O3AllGes5_r","O3AllGes6_r","O3AllGes7_r","O3AllGes8_r","MCS_SF8","MCS_SF8norm","PCS_SF8","PCS_SF8norm","O4Burnout_mean","O5WLB2_r","O5WLB6_r","O5WLB12_r","O5WLB_scale","O5WLB_private_spillover_2f","O5WLB_work_spillover_2f","O6WorkEng_mean","O6WorkEng_VI_mean","O6WorkEng_DE_mean","O6WorkEng_AB_mean","T2_GES3AllGes1_r","T2_GES3AllGes2_r","T2_GES3AllGes3_r","T2_GES3AllGes4_r","T2_GES3AllGes5_r","T2_GES3AllGes6_r","T2_GES3AllGes7_r","T2_GES3AllGes8_r","T2_MCS_SF8","T2_MCS_SF8norm","T2_PCS_SF8","T2_PCS_SF8norm","T2_GES4Burnout_mean","T2_GES6WLB2_r","T2_GES6WLB6_r","T2_GES6WLB8_r","T2_GES6WLB12_r","T2_GES6WLB_scale","T2_GES6WLB_private_spillover_2f","T2_GES6WLB_work_spillover_2f","T2_BGM11Nutzen_mean","T2_KR1AGK_mean","T2_KR1AGK_Planung_mean","T2_KR1AGK_Selbstmotivierung_mean","T2_KR1AGK_Stressvermeidung_mean","T2_KR2PsyEmp_mean","T2_KR2PsyEmp_Bed_mean","T2_KR2PsyEmp_Komp_mean","T2_KR2PsyEmp_Selbstb_mean","T2_KR2PsyEmp_Einfl_mean","T2_KR3GesKomp_mean","T2_KR4DigiKomp_mean","T2_KR5HolSC_A4_r","T2_KR5HolSC_A5_r","T2_KR5HolSC_mean","T2_KR5HolSC_Achtsamkeit_mean","T2_KR5HolSC_Verhalten_mean","T2_KR6SOC6_r","KR6SOC_mean","KR6SOC_Handhabbarkeit","KR6SOC_Balance_mean","KR6SOC_Reflexion_mean","T2_PR1Iso_mean","T2_PR2AvA_mean","T2_PR3TI_mean","T2_PR4Comm_mean","T2_PR4Comm_aff_mean","T2_PR4Comm_kogn_mean","T2_PR4Comm_norm_mean","T2_PR4Comm_vertr_mean","T2_PR5OHC4_r","T2_PR5OHC_mean","T2_PR5OHC_workgroup_mean","T2_PR5OHC_supervisor_mean","T2_PR5OHC_organization_mean","T2_PR6BGMPart_mean","virtual_mean","AGIL2AgilMeth_r","clust","T2_KR4DigKomp_Verarbeitung","T2_KR4DigKomp_Kommunikation","T2_KR4DigKomp_Erstellung","T2_KR4DigKomp_Sicherheit","T2_KR4DigKomp_Problemloesung"
"1",3,"d4tm7ac8y169898h","02/27/2023 09:52","qualified,/Gender/p47uy,/Age/gcKvr,/Total/Total",3,1,1,1,1,1,1,1,52,1,5,"",4,1,"",1,1,4,3.2022,39,40,1,2,2,2,8,"","Bautechniker",8,1,1,2,2,2,1,NA,52,NA,NA,NA,NA,NA,NA,NA,NA,NA,1,NA,NA,NA,NA,NA,NA,NA,NA,NA,NA,2,3,3,3,4,2,3,3,4,2,3,2,3,2,2,2,2,1,1,2,3,2,4,2,2,2,1,1,7,8,7,6,4,2,1,2,3,2,3,2,2,2,2,3,2,2,1,2,1,1,4,4,4,4,4,4,3,3,4,3,2,3,2,1,1,1,4,4,4,4,3,1,1,1,1,3,4,1,3,1,5,1,1,1,NA,NA,0,3,3,1,2,2,4,6,3,2,2,3,3,1,2,2,0,2,3,1,1,0,0,0,0,3,4,4,3,3,2,2,3,2,3,2,2,3,2,1,2,2,2,2,4,3,3,3,4,2,3,3,3,4,3,3,3,3,4,4,3,4,4,3,2,2,2,3,3,4,3,3,3,2,3,3,2,3,3,1,1195.91,13,NA,11,NA,5,6,"02/27/2023 09:32",NA,NA,NA,1,"Mozilla/5.0 (Macintosh; Intel Mac OS X 10_15_6) AppleWebKit/605.1.15 (KHTML, like Gecko) Version/15.6.1 Safari/605.1.15","uzyqygagf2zuyqja","mh0fhqg9errqrcsa",NA,NA,"..","/survey/selfserve/53b/g004/230146?list=1&ID=237104974326872","zp04xchyh8waqqrk","237104974326872",811,2023-04-15 09:42:00,3,1,1,1,1,1,1,1,52,2,"",2,"",4,7,3,2,1,1,3,1,2,1,2,3,3,2,3,1,4,1,0,2,3,4,3,3,2,3,2,4,2,3,2,4,1,3,NA,NA,"",NA,"",NA,NA,NA,"",3,3,NA,NA,NA,NA,NA,NA,NA,NA,NA,"",NA,"",0,0,0,0,0,0,0,1,0,0,"","",3,NA,NA,"",3,NA,NA,NA,NA,NA,"",0,3,NA,NA,NA,"",4,3,3,"",NA,NA,NA,"","","",4,3,3,"",NA,NA,NA,"","","",4,3,3,"",NA,NA,NA,"","","",3,3,3,"",NA,NA,NA,"","","",1,1,3,"",NA,NA,NA,"","","",2,1,3,"",NA,NA,NA,"","","",3,2,1,"Seminare",2,NA,5,"erst im juli","","",NA,NA,3,"",NA,NA,NA,"","","",4,4,3,"",NA,NA,NA,NA,"",NA,4,4,3,"",NA,NA,NA,"",4,3,1,"flexible Arbeitszeiten",2,NA,2,"","","",NA,NA,3,"",NA,NA,NA,"","","",1,1,3,"",NA,NA,NA,"","","",1,1,3,"",NA,NA,NA,NA,"","",2,2,3,"",NA,NA,NA,NA,"","",2,2,0,0,0,0,0,0,0,0,0,1,"Ich weiß nicht",0,0,0,0,0,0,0,0,0,1,"nichts",0,0,0,0,0,0,0,0,0,1,"nichts",3,1,NA,NA,NA,NA,3,NA,NA,NA,"",2,3,3,NA,3,3,3,3,3,2,2,"",1,1,1,1,0,0,4,3,4,4,3,4,3,4,4,3,3,4,4,4,4,4,4,3,5,5,5,4,3,3,3,3,2,3,3,3,5,4,4,4,3,3,3,2,3,3,2,3,4,3,3,4,4,5,3,4,3,3,2,4,4,4,3,4,3,4,3,3,4,3,4,4,2,2,2,1,1,1,1,2,2,3,2,1,2,1,2,4,2,4,3,3,2,2,2,2,4,2,2,3,2,3,2,3,2,2,3,3,3,2,2,3,4,3,3,3,1744.04,3,"f9cs933vkprb88m1",NA,NA,"ta","/survey/selfserve/53b/g004/230372?list=1&ID=241183254220892","f9cs933vkprb88m1","241183254220892",19.9318333333333,29.0673333333333,0,32022,"01-03-2022",2022-03-01,14,1,2,1.02,520,2022,1,3,3,3.33333333333333,2.33333333333333,2.5,2,1.5,1.5,2.5,3,1.66666666666667,2,1,6.4,1.8,2.5,2.33333333333333,2.16666666666667,1.4,3.77777777777778,4,4,3.33333333333333,3.66666666666667,1,2.4,3.5,1.66666666666667,3.5,1.66666666666667,2.2,3.18181818181818,3.4,2.66666666666667,3.33333333333333,3.08333333333333,3,3.66666666666667,3.66666666666667,2,3.16666666666667,3,4,3,3,46.43,48.33,46.92,47.67,45.16,55.25,49.59,45.66,59.5662123,49.4494623,55.8700926,46.5017026,0.777777777777778,2,4,3,2.9,3,2.83333333333333,2,1.66666666666667,2.33333333333333,2,46.43,48.33,53.98,60.77,45.16,55.25,49.59,52.42,60.6019113,50.4851613,64.04192,54.67353,2.11111111111111,2,3,2,2,2.41666666666667,2.25,2.5,2.75,3.54545454545455,3.6,3.66666666666667,3.33333333333333,4,4,3.66666666666667,5,3.33333333333333,2.83333333333333,3.26666666666667,3,2,3.25,3.5,2.5,3,3.61538461538462,3.4,3.75,3.75,1.42857142857143,2,1.5,2.64285714285714,3.2,2,2.75,2,4,2.7,2.66666666666667,3,2.5,3.25,1.6,1,1,4.33333333333333,3.5,2.66666666666667,2.66666666666667,3.25
"2",5,"b99j1yrkkhmqw556","02/27/2023 09:46","qualified,/Gender/p47uy,/Age/gcKvr,/Total/Total",3,1,1,1,1,1,1,1,36,1,3,"",3,2,"",1,1,2,8.2013,38,38,2,NA,NA,NA,4,"","Bürokauffrau",5,10,1,2,2,2,1,NA,46,NA,NA,NA,NA,NA,NA,NA,NA,NA,1,NA,NA,NA,NA,NA,NA,NA,NA,NA,NA,2,2,4,2,2,4,4,2,4,2,3,3,2,4,4,4,2,2,2,2,4,3,2,3,3,1,1,1,5,6,4,5,4,2,2,2,2,4,2,4,2,2,2,2,2,2,2,2,1,1,4,4,4,2,4,4,4,4,4,1,1,4,1,1,1,1,4,4,1,4,1,1,1,1,1,1,1,1,1,1,5,1,1,1,NA,NA,42,4,4,4,4,4,3,3,4,4,4,5,2,2,1,2,1,1,1,1,1,1,1,1,1,2,2,1,1,1,1,1,2,2,2,1,4,1,0,0,0,0,0,0,4,4,4,4,4,4,4,4,4,4,4,1,1,1,4,4,4,4,4,4,4,4,4,4,4,4,4,4,4,3,3,4,2,4,2,1,633.737,14,NA,10,NA,1,2,"02/27/2023 09:35",NA,NA,NA,1,"Mozilla/5.0 (Linux; Android 13; SM-G988B) AppleWebKit/537.36 (KHTML, like Gecko) Chrome/110.0.0.0 Mobile Safari/537.36","6t2cwcm99f9he8q6","jb9u3bpktffs73ud",NA,NA,"sa","/survey/selfserve/53b/g004/230146?list=1&ID=237104974311650","a7b7z9v8szud54au","237104974311650",2,2023-04-06 13:14:00,3,1,1,1,1,1,1,1,36,2,"",2,"",1,7,3,3,3,4,3,3,2,3,0,0,0,0,0,0,0,0,0,5,1,5,1,1,1,4,1,5,3,2,1,3,1,2,NA,NA,"",NA,"",NA,NA,NA,"",2,2,NA,NA,NA,NA,NA,NA,NA,NA,NA,"",NA,"",1,0,0,0,0,0,1,0,0,0,"","",2,NA,NA,"",2,NA,NA,NA,NA,NA,"",0,2,NA,NA,NA,"",3,4,2,"",NA,NA,NA,"","","",5,5,2,"",NA,NA,NA,"","","",4,5,2,"",NA,NA,NA,"","","",4,5,2,"",NA,NA,NA,"","","",4,4,2,"",NA,NA,NA,"","","",4,4,2,"",NA,NA,NA,"","","",4,5,2,"",NA,NA,NA,"","","",4,5,2,"",NA,NA,NA,"","","",4,5,2,"",NA,NA,NA,NA,"",NA,4,4,2,"",NA,NA,NA,"",4,5,2,"",NA,NA,NA,"","","",4,5,2,"",NA,NA,NA,"","","",5,5,2,"",NA,NA,NA,"","","",4,1,2,"",NA,NA,NA,NA,"","",2,4,2,"",NA,NA,NA,NA,"","",4,4,0,0,0,0,0,0,0,0,0,1,"Keine",1,1,1,1,1,1,1,1,1,0,"",1,1,1,1,1,1,1,1,1,0,"",1,3,2,NA,5,5,2,NA,NA,NA,"",4,4,2,NA,2,2,5,5,5,5,2,"",1,1,5,1,0,0,1,5,5,5,5,5,4,5,4,5,3,3,1,1,1,5,5,5,5,5,5,5,5,5,3,3,3,3,3,3,5,5,5,5,5,5,5,5,5,5,5,5,5,5,5,4,4,4,2,2,4,4,4,4,4,4,4,4,2,4,4,4,4,4,4,4,1,4,1,5,1,1,1,1,1,5,1,1,1,5,5,1,1,1,1,3,1,1,1,1,1,1,1,1,5,1,1,1,1,1,1,1,1,1,1,1,1,1,1,1,968.45,1,"jb9u3bpktffs73ud",NA,NA,"sa","/survey/selfserve/53b/g004/230372?list=1&ID=240475414777969","a7b7z9v8szud54au","240475414777969",10.5622833333333,16.1408333333333,-42,82013,"01-08-2013",2013-08-01,117,9,9,9.09,3654,2013,10,2.66666666666667,3,3.33333333333333,2.66666666666667,3,4,2,2,3.5,2.5,1.66666666666667,2,1,4.8,2.4,2,2.66666666666667,2.33333333333333,1.6,3.77777777777778,4,3.33333333333333,4,2,1,1,1,1,1,1,4,4,4,4,4,3.25,1,4,4,4,4,3,4,4,3.66666666666667,38.41,30.31,28.32,31.48,55.62,49.47,56.79,45.66,72.934345,62.817595,32.9781276,23.6097376,1,4,5,4,2.3,3,1.83333333333333,0.666666666666667,1.66666666666667,0.333333333333333,0,46.43,40.07,38.71,40.07,45.16,40.41,49.59,38.09,56.7027718,46.5860218,46.2610327,36.8926427,0,1,2,1,3,1.5,1.75,1.375,5,4.45454545454545,5,4.33333333333333,3.66666666666667,4,1,5,5,5,3,5,4,4,4,4,4,4,4,4,4,4,2,1.66666666666667,5,1.42857142857143,1.4,1,1,5,5,1.4,1,2.33333333333333,1,1,1.6,1,2,5,5,5,5,5
"3",6,"vjrf8u5hkg7b1e98","02/27/2023 09:48","qualified,/Gender/X0TrF,/Age/gcKvr,/Total/Total",3,1,1,1,1,1,1,2,35,1,5,"",4,1,"",2,1,4,4.2006,40,40,2,NA,NA,NA,2,"","elektriker",7,10,1,2,4,4,2,2,44,13,9,NA,NA,NA,NA,NA,NA,NA,1,2,2,NA,NA,NA,NA,NA,NA,NA,3,2,4,4,3,4,3,3,4,4,4,3,4,1,2,2,3,2,2,2,2,4,4,4,4,3,2,3,1,7,8,6,7,7,3,4,5,4,4,3,3,4,4,4,4,4,3,4,4,3,4,3,4,5,3,4,4,4,3,4,4,3,3,2,2,3,1,4,4,2,1,2,1,1,1,1,2,1,1,1,4,1,1,5,4,NA,NA,0,1,1,1,1,1,4,7,3,2,1,2,3,2,2,2,1,2,1,3,2,1,0,3,1,2,2,2,1,1,2,2,2,1,2,3,4,4,4,4,3,4,4,4,3,4,4,4,3,3,4,4,4,3,4,3,4,4,5,4,4,3,3,4,5,4,4,3,4,5,4,4,4,3,2,2,2,2,4,1,742.147,4,NA,12,NA,5,6,"02/27/2023 09:36",NA,NA,NA,1,"Mozilla/5.0 (Windows NT 10.0; Win64; x64; rv:109.0) Gecko/20100101 Firefox/110.0","hcnftvmz1dgad3ye","xj48tjkcc61am0u7",NA,NA,"..","/survey/selfserve/53b/g004/230146?list=1&ID=237104974312688","xj48tjkcc61am0u7","237104974312688",576,2023-04-14 14:32:00,3,1,1,1,1,1,1,2,35,2,"",2,"",4,8,3,2,2,2,2,2,1,1,1,3,0,3,0,0,0,0,0,2,2,1,1,2,2,2,1,3,3,2,2,3,1,2,NA,NA,"",NA,"",NA,NA,NA,"",2,2,NA,NA,NA,NA,NA,NA,NA,NA,NA,"",NA,"",1,1,0,0,0,0,0,0,0,0,"","",2,NA,NA,"",2,NA,NA,NA,NA,NA,"",1,2,NA,NA,NA,"",3,3,2,"",NA,NA,NA,"","","",3,4,2,"",NA,NA,NA,"","","",4,3,2,"",NA,NA,NA,"","","",4,3,2,"",NA,NA,NA,"","","",4,3,2,"",NA,NA,NA,"","","",3,4,2,"",NA,NA,NA,"","","",4,3,2,"",NA,NA,NA,"","","",3,3,2,"",NA,NA,NA,"","","",4,3,2,"",NA,NA,NA,NA,"",NA,3,4,2,"",NA,NA,NA,"",3,3,2,"",NA,NA,NA,"","","",3,4,2,"",NA,NA,NA,"","","",4,3,2,"",NA,NA,NA,"","","",3,3,2,"",NA,NA,NA,NA,"","",4,3,2,"",NA,NA,NA,NA,"","",3,3,0,1,1,0,0,0,0,0,0,0,"",0,0,1,0,0,0,0,0,0,0,"",1,0,0,0,0,0,0,0,0,0,"",2,1,NA,NA,NA,NA,2,NA,NA,NA,"",4,3,2,NA,2,2,4,3,4,3,2,"",1,1,2,1,0,0,3,3,4,3,3,4,5,3,3,4,4,4,3,4,3,4,5,4,4,5,3,3,4,4,3,4,3,3,3,3,3,4,2,4,3,3,4,5,3,3,4,4,3,5,4,3,4,5,4,4,3,3,4,3,2,3,4,4,2,2,3,3,4,3,2,3,3,4,2,2,3,2,2,2,1,2,2,2,2,1,1,4,4,2,2,3,3,4,3,3,2,2,3,3,4,3,2,3,4,4,3,4,3,3,4,3,4,4,3,4,669.14,5,"xj48tjkcc61am0u7",NA,NA,"..","/survey/selfserve/53b/g004/230372?list=1&ID=241183254207610","xj48tjkcc61am0u7","241183254207610",12.3691166666667,11.1523333333333,0,42006,"01-04-2006",2006-04-01,205,17,1,17.01,6333,2006,17,3.66666666666667,3.5,3.66666666666667,3.66666666666667,1.5,2.5,2,2,4,4,2.66666666666667,2.5,1,7,3.6,4,4,3.83333333333333,3.6,3.77777777777778,4,3.66666666666667,3.66666666666667,1.66666666666667,1,1.8,1.5,2,1.5,2,1,3.63636363636364,3.6,3.66666666666667,3.66666666666667,3.91666666666667,3.66666666666667,4.33333333333333,3.33333333333333,4.33333333333333,4,4,4,2,2.83333333333333,46.43,48.33,53.98,53.35,45.16,49.47,49.59,45.66,56.9896631,46.8729131,61.2139978,51.8456078,1.55555555555556,4,4,4,2.3,2.5,2.16666666666667,3.77777777777778,3.66666666666667,4,3.66666666666667,46.43,48.33,46.92,53.35,55.62,49.47,56.79,52.42,68.6188665,58.5021165,56.9371956,47.5688056,0.777777777777778,5,4,3,3,2.5,2.75,2.375,3.5,3.63636363636364,3.4,3.66666666666667,4,3.83333333333333,3.33333333333333,4.33333333333333,4,3.66666666666667,3.16666666666667,3.6,2,2,3.25,3.16666666666667,3.5,4,3.07692307692308,3,3.25,3,2.57142857142857,1.83333333333333,1,3,3,3.25,2.5,4,2,3.1,2.66666666666667,3,3.5,3.5,2.2,1,1,3,3.5,4,3.33333333333333,4
"4",7,"8v33v1y7m6gy28yp","02/27/2023 10:01","qualified,/Gender/X0TrF,/Age/gcKvr,/Total/Total",3,1,1,1,1,1,1,2,35,1,5,"",6,1,"",4,1,5,5.2013,41,45,2,NA,NA,NA,9,"","Personalreferent",7,3,1,2,5,5,2,3,36,16,11,3,NA,NA,NA,NA,NA,NA,1,2,2,2,NA,NA,NA,NA,NA,NA,4,2,5,4,3,3,4,4,3,3,3,4,4,2,3,3,3,4,4,2,2,3,4,3,3,2,2,2,3,6,7,5,6,7,4,4,3,3,3,3,4,4,3,3,4,3,3,2,3,4,2,4,5,3,4,5,3,4,3,4,4,5,5,5,5,5,3,4,4,2,2,2,3,1,1,2,3,4,4,3,3,5,3,3,4,2,57,62,5,4,5,4,5,4,8,2,1,1,1,2,1,1,1,1,0,0,0,0,0,4,0,0,2,4,2,1,2,3,3,2,3,3,4,4,4,4,4,4,4,4,4,5,4,5,5,4,5,4,5,5,4,5,5,4,5,4,5,5,4,4,4,4,3,4,4,5,4,4,5,4,4,2,4,4,2,4,1,1402.461,14,NA,10,NA,1,2,"02/27/2023 09:37",NA,NA,NA,1,"Mozilla/5.0 (Linux; Android 11; SM-A127F) AppleWebKit/537.36 (KHTML, like Gecko) Chrome/105.0.0.0 Mobile Safari/537.36","ggxg33a58dxbej7w","k6x2rbtasbq3f5sj",NA,NA,"sa","/survey/selfserve/53b/g004/230146?list=1&ID=237104974332085","k6x2rbtasbq3f5sj","237104974332085",491,2023-04-14 13:24:00,3,1,1,1,1,1,1,2,35,2,"",2,"",4,9,3,2,2,2,2,2,1,2,2,3,3,2,2,2,3,1,1,2,4,5,3,4,4,5,3,4,5,4,4,3,1,1,2,NA,"",NA,"",1,4,NA,"",NA,NA,0,1,0,1,0,1,0,0,0,"",4,"",0,1,1,0,0,0,1,0,0,0,"","",1,2,4,"",1,6,5,1,4,NA,"",3,1,1,5,NA,"",NA,NA,1,"Etwas Bestimmtes",2,NA,4,"","","nichts Spezielles",NA,NA,1,"nichts Spezielles",2,NA,1,"","","",NA,NA,2,"",NA,NA,NA,"","","",5,3,2,"",NA,NA,NA,"","","",1,1,2,"",NA,NA,NA,"","","",3,1,2,"",NA,NA,NA,"","","",4,3,2,"",NA,NA,NA,"","","",2,3,2,"",NA,NA,NA,"","","",3,4,2,"",NA,NA,NA,NA,"",NA,3,3,2,"",NA,NA,NA,"",3,4,2,"",NA,NA,NA,"","","",4,2,2,"",NA,NA,NA,"","","",2,4,1,"nichts Spezielles",2,NA,2,"","","",NA,NA,2,"",NA,NA,NA,NA,"","",2,3,2,"",NA,NA,NA,NA,"","",2,2,0,0,1,0,0,1,0,0,0,0,"",0,0,1,0,1,0,0,0,0,0,"",0,0,1,0,1,0,0,0,0,0,"",2,1,NA,NA,NA,NA,2,NA,NA,NA,"",3,2,2,NA,2,3,4,2,3,2,2,"",1,1,4,1,0,0,2,3,3,2,4,2,3,3,4,2,2,3,3,2,3,3,3,3,3,4,2,3,2,3,3,2,3,2,2,3,3,4,4,3,3,3,3,3,3,3,4,3,3,3,2,3,3,4,2,3,4,2,3,4,2,3,4,2,4,2,2,2,3,3,3,2,4,5,3,4,2,3,3,3,4,2,4,3,2,3,4,4,5,4,4,3,4,4,3,3,4,3,2,2,2,4,3,3,4,4,4,3,3,4,3,4,4,3,3,4,1137.57,1,"pt6w64579j3rgu9z",NA,NA,"sa","/survey/selfserve/53b/g004/230372?list=1&ID=241183254225070","pt6w64579j3rgu9z","241183254225070",23.37435,18.9595,-62,52013,"01-05-2013",2013-05-01,120,10,0,10,3746,2013,10,4,3.5,3.33333333333333,3.66666666666667,2.5,3,4,2,3.5,3,2,2,3,6.2,3.6,3.25,3.33333333333333,3.41666666666667,2.8,3.88888888888889,4,4,3.66666666666667,2,1.75,3.4,3.5,3.33333333333333,3.5,3.33333333333333,4.6,4.63636363636364,4.6,4.66666666666667,4.66666666666667,4.25,4.66666666666667,4.66666666666667,4,3.66666666666667,4.33333333333333,4,2,2,3,52.83,54.05,53.98,60.77,55.62,55.25,56.79,52.42,67.5970951,57.4803451,66.0444512,56.6760612,0.555555555555556,2,3,3,2.3,2.75,2,4,4,4,4,46.43,48.33,46.92,53.35,55.62,49.47,56.79,45.66,66.0524325,55.9356825,56.7016772,47.3332872,2.11111111111111,1,1,2,3,3.16666666666667,3,3.25,2.75,2.81818181818182,2.8,3.33333333333333,2.33333333333333,2.83333333333333,2.66666666666667,3,3,2.66666666666667,2.5,3.13333333333333,4,3,3.25,3.5,2.5,2,2.61538461538462,2.4,2.75,2.75,3.42857142857143,3,3.5,3.35714285714286,4,3.5,2.75,2,2,3.3,3.33333333333333,3.33333333333333,3.25,3.5,4.6,3,3,3.66666666666667,3,3,3.33333333333333,2.75
"5",9,"s7v40f8zk2bxkkue","02/27/2023 09:57","qualified,/Gender/X0TrF,/Age/gcKvr,/Total/Total",3,1,1,1,1,1,1,2,42,1,5,"",6,1,"",4,1,6,4.2008,38,46,2,NA,NA,NA,1,"","Leiter IT",8,7,1,2,3,3,2,1,38,12,NA,NA,NA,NA,NA,NA,NA,NA,1,2,NA,NA,NA,NA,NA,NA,NA,NA,3,2,4,5,5,4,3,4,4,5,5,4,4,3,3,5,4,1,3,1,1,4,5,5,4,5,5,4,3,8,4,8,8,8,4,4,3,5,3,4,4,4,5,3,3,3,5,5,4,3,4,3,5,4,4,5,5,5,5,5,4,4,4,3,2,2,3,5,5,5,5,5,1,1,2,2,4,2,3,4,3,4,4,3,3,2,24,0,6,5,2,6,5,5,9,2,1,1,1,1,1,1,1,1,2,0,2,0,0,2,1,0,1,4,2,2,1,4,3,3,2,5,5,5,4,5,4,5,6,4,5,4,4,4,4,4,5,3,4,4,4,3,5,5,5,5,5,5,5,5,4,5,5,5,5,5,4,5,4,5,5,2,4,2,4,1,1,958.22,4,NA,10,NA,5,6,"02/27/2023 09:41",NA,NA,NA,1,"Mozilla/5.0 (Windows NT 10.0; Win64; x64) AppleWebKit/537.36 (KHTML, like Gecko) Chrome/110.0.0.0 Safari/537.36 Edg/110.0.1587.57","ce3x30ud74nyzemt","zhqh107zx04sb4ys",NA,NA,"..","/survey/selfserve/53b/g004/230146?list=1&ID=237104974311658","ju8pqe30sf0npjbb","237104974311658",969,2023-04-17 08:59:00,3,1,1,1,1,1,1,2,42,2,"",2,"",4,9,2,1,1,1,2,1,1,1,1,1,1,0,0,0,1,0,0,2,2,4,2,2,2,4,3,4,2,3,2,4,1,1,2,NA,"",NA,"",1,3,NA,"",NA,NA,1,0,0,0,0,0,0,0,0,"",1,"",1,0,0,0,0,1,1,0,0,0,"","",1,2,4,"",2,NA,NA,NA,NA,NA,"",3,1,1,3,NA,"",NA,NA,1,"Pilates",2,NA,4,"","","durch ein Gremium der Beschäftigten",NA,NA,2,"",NA,NA,NA,"","","",NA,NA,1,"kantinenessen unter Beteiligung eines Ernährungsexperten",1,4,NA,"","","",NA,NA,2,"",NA,NA,NA,"","","",2,1,1,"Jährliche Schulung für alle beschäftigten",1,5,NA,"","","",NA,NA,2,"",NA,NA,NA,"","","",4,5,1,"Führungskräftetraining, Fremdsprachenkurse, Timemanagement, SAP-Schulungen",1,5,NA,"","","",NA,NA,2,"",NA,NA,NA,"","","",3,3,1,"Einführungskurse im Umgang mit Internetaktivitäten",1,5,NA,NA,"",NA,NA,NA,1,"Betriebsrat",1,4,NA,"",NA,NA,1,"flexible Arbeitszeiten, home-office",1,5,NA,"","","",NA,NA,1,"keine",2,NA,4,"","","weiß nicht",NA,NA,2,"",NA,NA,NA,"","","",3,2,2,"",NA,NA,NA,NA,"","",3,1,2,"",NA,NA,NA,NA,"","",3,2,0,0,0,1,0,1,0,1,1,0,"",0,1,1,0,0,0,0,0,0,0,"",0,1,1,1,1,1,0,0,1,0,"",2,1,NA,NA,NA,NA,1,1,5,NA,"",NA,NA,1,1,3,3,4,3,3,3,2,"",4,1,3,2,30,0,4,5,5,5,4,4,5,4,4,3,4,5,5,5,5,5,5,5,5,5,4,5,4,4,2,2,2,3,3,3,5,4,5,5,5,5,5,5,5,5,5,4,4,4,3,4,5,5,2,2,4,4,4,4,5,5,3,4,2,4,5,5,5,5,5,5,2,3,2,2,2,3,3,1,1,1,1,3,1,1,2,5,5,5,5,5,2,1,2,2,4,3,3,4,3,3,3,3,2,4,4,4,4,4,5,4,5,4,5,4,1429.49,5,"zhqh107zx04sb4ys",NA,NA,"..","/survey/selfserve/53b/g004/230372?list=1&ID=241166931201246","ju8pqe30sf0npjbb","241166931201246",15.9703333333333,23.8248333333333,0,42008,"01-04-2008",2008-04-01,181,15,1,15.01,5602,2008,15,4.66666666666667,3.5,4.33333333333333,4.33333333333333,3,4.5,2,1,4.5,4.5,4.66666666666667,5,3,7.2,4,4,3,3.75,4.2,4.55555555555556,4,4.66666666666667,5,5,1.5,3.2,3,3.33333333333333,3,3.33333333333333,4.8,3.90909090909091,4,4,3.66666666666667,4.91666666666667,5,5,4.66666666666667,5,4.66666666666667,4,4,5,4.33333333333333,52.83,54.05,53.98,60.77,61.83,55.25,56.79,52.42,69.193003,59.076253,66.6843296,57.3159396,0.888888888888889,2,2,1,1.9,1.5,2.16666666666667,4.77777777777778,4.66666666666667,5,4.66666666666667,52.83,54.05,53.98,60.77,55.62,55.25,56.79,52.42,67.5970951,57.4803451,66.0444512,56.6760612,0.444444444444444,2,2,2,2,2.16666666666667,2,2.25,3.25,4.36363636363636,4.6,4.33333333333333,4,4.75,5,5,4.66666666666667,4.33333333333333,2.5,4.6,4,4,4.25,4.33333333333333,4,4,4.53846153846154,4.4,4.25,5,2.42857142857143,1.33333333333333,1.5,3.5,5,1.75,3.5,3,4,3.8,3,4,4.25,4.5,2.8,3,4,4.66666666666667,5,5,5,3.75
"6",10,"z499sxzmzv6n4npk","02/27/2023 10:07","qualified,/Gender/X0TrF,/Age/b3xfu,/Total/Total",3,1,1,1,1,1,1,2,55,2,3,"",4,1,"",1,1,6,7.2017,40,42,2,NA,NA,NA,9,"","Controller",7,4,1,2,2,2,1,NA,54,NA,NA,NA,NA,NA,NA,NA,NA,NA,1,NA,NA,NA,NA,NA,NA,NA,NA,NA,NA,2,4,5,3,5,3,4,4,4,5,4,3,2,2,3,3,1,3,1,1,4,4,4,3,4,3,4,5,7,2,2,8,8,4,4,4,4,4,4,4,4,4,4,4,4,4,4,4,1,3,4,3,4,3,2,2,3,4,4,3,3,4,2,4,1,4,5,5,4,4,4,1,1,1,1,4,5,5,5,4,4,4,2,1,2,66,5,2,2,4,4,5,5,10,2,1,1,1,2,1,1,1,1,1,1,1,0,0,1,0,1,1,5,2,1,1,4,1,2,2,2,3,5,5,4,5,4,6,4,4,5,4,5,4,4,4,4,4,3,4,4,5,5,4,5,5,5,4,3,3,4,4,4,4,4,5,5,4,5,4,2,4,3,4,2,1,1421.132,4,NA,12,NA,5,6,"02/27/2023 09:43",NA,NA,NA,1,"Mozilla/5.0 (Windows NT 10.0; Win64; x64; rv:109.0) Gecko/20100101 Firefox/110.0","t32d0upsrn4jjq3d","9vudukrcr8u1en6t",NA,NA,"..","/survey/selfserve/53b/g004/230146?list=1&ID=237104974311648","dq4vs9expbc6ktjk","237104974311648",965,2023-04-17 07:54:00,3,1,1,1,1,1,1,2,55,2,"",2,"",4,9,3,1,1,2,2,1,1,1,1,1,1,1,0,0,1,0,0,2,1,5,1,1,2,5,1,5,2,2,1,2,1,3,NA,NA,"",NA,"",NA,NA,NA,"",3,3,NA,NA,NA,NA,NA,NA,NA,NA,NA,"",NA,"",0,0,0,0,0,0,0,1,0,0,"","",1,4,NA,"",1,5,3,2,NA,2,"",2,3,NA,NA,NA,"",3,3,2,"",NA,NA,NA,"","","",3,3,3,"",NA,NA,NA,"","","",4,4,2,"",NA,NA,NA,"","","",3,3,3,"",NA,NA,NA,"","","",3,3,3,"",NA,NA,NA,"","","",3,3,3,"",NA,NA,NA,"","","",3,3,1,"fachspezifisch",1,5,NA,"","","",NA,NA,1,"höhenverstellbare Tische",1,5,NA,"","","",NA,NA,3,"",NA,NA,NA,NA,"",NA,3,3,3,"",NA,NA,NA,"",3,3,1,"flexible Arbeitszeiten, Stundenreduzierung",1,5,NA,"","","",NA,NA,3,"",NA,NA,NA,"","","",3,3,3,"",NA,NA,NA,"","","",3,3,3,"",NA,NA,NA,NA,"","",3,3,3,"",NA,NA,NA,NA,"","",3,3,0,0,0,0,0,1,0,0,0,1,"Grippeschutzimpfung",0,1,0,0,0,0,0,0,0,0,"",0,1,0,0,0,0,0,0,0,0,"",1,1,NA,NA,NA,NA,1,1,3,NA,"",NA,NA,1,1,3,3,4,4,4,4,2,"",5,3,3,2,60,1,4,5,4,5,5,5,4,4,4,3,4,3,5,5,4,5,5,5,3,4,4,3,5,5,2,3,2,2,3,3,3,4,3,3,3,3,1,2,4,4,4,4,4,4,3,4,4,4,2,2,4,4,4,3,2,3,3,3,2,4,4,4,4,4,4,4,1,3,1,3,1,3,4,1,2,3,1,1,1,1,1,4,4,5,5,4,1,1,4,1,3,3,4,4,3,4,4,3,2,3,3,3,3,3,3,4,4,3,4,3,1454.74,5,"f0jnpfbkz0y2yzy2",NA,NA,"..","/survey/selfserve/53b/g004/230372?list=1&ID=241183254202444","f0jnpfbkz0y2yzy2","241183254202444",23.6855333333333,24.2456666666667,-4,72017,"01-07-2017",2017-07-01,70,5,10,5.1,2224,2017,6,4,4,4,4,2,3,2,1,4,3.5,3.66666666666667,3.5,NA,5.4,4,4,4,4,3.2,3.22222222222222,3.66666666666667,2.33333333333333,3.66666666666667,4,1,4.6,4.5,4.66666666666667,4.5,4.66666666666667,3.4,4.09090909090909,4.4,4,3.66666666666667,4.25,4.66666666666667,5,3.33333333333333,4,4.5,4,3,4,3.83333333333333,52.83,54.05,53.98,60.77,55.62,55.25,56.79,52.42,67.5970951,57.4803451,66.0444512,56.6760612,0.666666666666667,1,2,4,1.7,2.25,1.33333333333333,4.44444444444444,4.33333333333333,5,4,46.43,54.05,53.98,53.35,55.62,55.25,56.79,52.42,67.5511145,57.4343645,62.2440228,52.8756328,0.555555555555556,1,1,1,4,1.5,2,1.25,4,4.18181818181818,4.8,4,3.33333333333333,4.41666666666667,4.66666666666667,5,3.66666666666667,4.33333333333333,2.5,3.26666666666667,4,4,4,4,4,4,3.53846153846154,3.8,2.75,4,2.28571428571429,1.5,1,3.28571428571429,4.4,1.75,3.5,3,4,3.3,3.66666666666667,3.33333333333333,3,3.75,3,1,5,3.33333333333333,3,2,4,3.75
"7",11,"ajb7bbxukgzk8zcv","02/27/2023 10:57","qualified,/Gender/p47uy,/Age/gcKvr,/Total/Total",3,1,1,1,1,1,1,1,30,1,5,"",4,1,"",1,1,6,12.202,40,40,1,2,2,2,8,"","Sachbearbeiter",4,9,4,1,NA,NA,NA,NA,NA,NA,NA,NA,NA,NA,NA,NA,NA,NA,NA,NA,NA,NA,NA,NA,NA,NA,NA,NA,NA,2,3,3,3,4,3,4,5,3,3,4,3,3,2,3,4,3,5,1,2,1,2,4,4,2,2,1,1,4,1,3,6,4,2,4,4,5,3,3,4,4,4,3,3,3,2,3,2,2,2,4,3,4,4,3,3,3,2,3,4,4,4,1,1,1,2,4,1,2,2,2,1,1,1,1,4,2,2,1,1,1,2,1,1,1,20,0,6,1,2,1,1,4,6,5,2,3,3,3,3,5,4,4,2,5,5,3,3,3,3,1,4,3,4,3,3,2,1,3,2,3,3,3,5,3,2,2,3,3,2,4,4,4,3,4,2,2,3,3,2,3,4,4,3,5,4,4,4,4,2,2,3,2,4,4,4,4,5,4,4,4,4,5,4,4,1,2483.377,14,NA,10,NA,3,2,"02/27/2023 09:52",NA,NA,NA,1,"Mozilla/5.0 (Linux; Android 12; SM-P610) AppleWebKit/537.36 (KHTML, like Gecko) Chrome/101.0.0.0 Safari/537.36 (Ecosia android@101.0.4951.41)","w28x1xgwujqawfp3","7wfrrfr38a5t46nv",NA,NA,"ta","/survey/selfserve/53b/g004/230146?list=1&ID=237104974330001","7wfrrfr38a5t46nv","237104974330001",600,2023-04-14 15:18:00,3,1,1,1,1,1,1,1,30,2,"",2,"",3,6,5,2,2,3,4,4,5,3,3,3,4,2,2,1,1,1,2,3,4,3,4,4,4,1,2,3,4,4,4,2,1,1,2,NA,"",NA,"",2,NA,3,"",NA,NA,1,1,0,0,0,0,0,1,0,"",8,"",1,0,0,0,0,0,1,1,0,0,"","",1,2,1,"",1,3,3,2,NA,3,"",2,1,1,3,NA,"",NA,NA,1,"Vergünstigtes Fitnessstudio, Spazierganggruppen, Fußball, Yoga, Massagen, Kurse",2,NA,4,"","","in meiner Nähe",NA,NA,1,"Kurse",1,4,NA,"","","",NA,NA,3,"",NA,NA,NA,"","","",4,4,3,"",NA,NA,NA,"","","",1,1,1,"Vorträge, Schulungen",2,NA,2,"","","",NA,NA,3,"",NA,NA,NA,"","","",3,4,1,"Fortbildungen (Aufstieg im Betrieb), Word, Kommunikation, Programme, Rechtsgebiete",1,5,NA,"","","",NA,NA,1,"Tisch, Schreibtisch",1,4,NA,"","","",NA,NA,1,"word schulungen",2,NA,2,NA,"",NA,NA,NA,3,"",NA,NA,NA,"",1,1,1,"Teilezit, Gleitzeit, Homeoffice",1,5,NA,"","","",NA,NA,3,"",NA,NA,NA,"","","",5,5,1,"Kita, Ferien Programm",2,NA,2,"","","",NA,NA,3,"",NA,NA,NA,NA,"","",5,5,3,"",NA,NA,NA,NA,"","",4,4,0,0,0,1,0,1,0,0,0,0,"",0,0,0,0,1,0,1,1,1,0,"",1,0,0,1,1,1,1,1,1,0,"",1,2,NA,NA,NA,NA,1,2,NA,2,"",NA,NA,1,1,1,3,4,4,5,4,2,"",3,1,4,1,10,0,4,4,5,5,5,5,4,3,3,3,3,4,4,4,3,5,4,4,3,4,4,4,3,3,3,3,1,3,3,3,4,4,4,4,4,5,3,3,4,4,4,3,4,4,4,4,3,4,5,4,4,3,2,1,2,5,1,2,3,2,3,3,4,4,4,4,2,2,4,2,3,2,2,1,1,1,3,3,2,1,2,3,2,1,3,3,2,1,1,1,2,2,2,2,4,2,2,3,3,3,4,3,3,2,3,2,4,3,4,3,1414.76,5,"v8mak9gn0g30mw71",NA,NA,"..","/survey/selfserve/53b/g004/230372?list=1&ID=241183254224025","v8mak9gn0g30mw71","241183254224025",41.3896166666667,23.5793333333333,0,122020,"01-12-2020",2020-12-01,29,2,5,2.05,975,2020,3,3,3.5,4,3.33333333333333,2.5,3.5,4,1.5,1.5,4,1.66666666666667,2,1,3.6,3.4,4,3,3.5,2.2,3.22222222222222,3.66666666666667,3.33333333333333,2.66666666666667,2,1,2,3,1.33333333333333,3,1.33333333333333,2.2,3.09090909090909,3.8,2.33333333333333,2.66666666666667,3.41666666666667,3.66666666666667,4.33333333333333,3.33333333333333,2.33333333333333,4.16666666666667,2,1,2,2.83333333333333,32.56,48.33,38.71,47.67,45.16,40.41,21.4,29.25,30.8176983,20.7009483,56.515294,47.146904,3.22222222222222,3,4,3,3,3,3,2.88888888888889,2.66666666666667,3.66666666666667,2.33333333333333,32.56,48.33,46.92,47.67,35.81,29.53,21.4,38.09,28.0540392,17.9372892,59.7788587,50.4104687,2.11111111111111,3,5,3,4,3.75,4.25,3.5,4.25,4,4.8,3.33333333333333,3.33333333333333,3.75,3.66666666666667,4.33333333333333,3.66666666666667,3.33333333333333,2.66666666666667,3.86666666666667,1,2,2.875,3,2.5,3,2.92307692307692,2.4,2.5,4,2.42857142857143,1.83333333333333,1.5,2.07142857142857,2.4,1.25,2,4,3,2.8,2.33333333333333,3.33333333333333,2.75,3.25,1.8,1,2,4,4,3.66666666666667,4,3.75
"8",12,"mq4y9cu7x5q17br0","02/27/2023 10:10","qualified,/Gender/X0TrF,/Age/gcKvr,/Total/Total",3,1,1,1,1,1,1,2,29,1,5,"",3,1,"",2,1,4,7.202,40,42,2,NA,NA,NA,8,"","Polizeibeamter",5,16,4,1,NA,NA,NA,NA,NA,NA,NA,NA,NA,NA,NA,NA,NA,NA,NA,NA,NA,NA,NA,NA,NA,NA,NA,NA,NA,2,4,4,4,3,4,4,4,4,3,4,4,2,2,1,3,2,2,2,2,3,4,3,4,3,4,3,2,4,5,8,5,4,3,3,4,3,4,5,4,3,4,4,4,4,4,3,4,4,4,3,3,2,4,4,3,4,4,3,3,2,2,2,2,2,2,4,4,2,3,2,2,2,2,2,2,2,2,2,2,3,2,2,2,1,7,3,5,5,5,5,4,4,8,1,2,2,1,1,2,2,2,1,1,1,2,1,1,1,1,1,1,2,1,2,1,3,3,3,2,2,4,4,3,4,3,3,3,4,3,4,4,4,3,4,5,4,4,2,4,4,3,4,3,4,4,4,2,3,2,4,3,3,4,4,4,4,4,5,4,2,2,2,4,2,1,1031.085,14,NA,10,NA,1,2,"02/27/2023 09:53",NA,NA,NA,1,"Mozilla/5.0 (Linux; Android 9; ANE-LX1 Build/HUAWEIANE-L21; wv) AppleWebKit/537.36 (KHTML, like Gecko) Version/4.0 Chrome/106.0.5249.126 Mobile Safari/537.36","7ccbq849r13jr5zx","7j2d24qqawn2g4bb",NA,NA,"sa","/survey/selfserve/53b/g004/230146?list=1&ID=237104974335210","r1b9k3nvtp0dshxw","237104974335210",990,2023-04-17 14:20:00,3,1,1,1,1,1,1,2,29,2,"",2,"",4,9,2,1,1,1,1,1,1,1,1,1,1,2,1,0,0,0,0,1,1,1,2,1,2,4,2,4,2,2,1,2,2,1,2,NA,"",NA,"",1,4,NA,"",NA,NA,0,0,1,1,0,0,0,0,0,"",3,"",1,0,0,1,0,1,0,0,0,0,"","Um so einige",1,4,NA,"",1,7,3,1,4,NA,"",4,1,1,4,NA,"",NA,NA,1,"Um so einige",1,4,NA,"","","",NA,NA,1,"Wo viele sein",1,4,NA,"","","",NA,NA,1,"Manchem mal",1,4,NA,"","","",NA,NA,1,"Manche Dinge",2,NA,2,"","","",NA,NA,1,"Diese Fragen",1,4,NA,"","","",NA,NA,1,"Ich verstehe es",1,4,NA,"","","",NA,NA,1,"So ziemlich alles",1,5,NA,"","","",NA,NA,1,"Immer mehr",1,4,NA,"","","",NA,NA,1,"Unglaublich wie es sich bei",1,4,NA,NA,"",NA,NA,NA,1,"Friends and family",1,4,NA,"",NA,NA,1,"Der Polizei und",2,NA,2,"","","",NA,NA,1,"Immer mehr",2,NA,2,"","","",NA,NA,1,"Keine Ahnung was ich",2,NA,2,"","","",NA,NA,1,"Was denn",NA,NA,NA,NA,"","",NA,NA,1,"Frei und is a",1,4,NA,NA,"","",NA,NA,1,0,1,0,0,1,1,0,0,0,"",1,0,0,0,0,1,0,0,0,0,"",0,1,0,1,0,0,1,1,0,0,"",1,1,NA,NA,NA,NA,1,1,4,NA,"",NA,NA,1,1,1,1,4,4,5,4,1,"Mehr Geld",2,3,2,1,12,12,4,4,4,5,4,5,4,4,5,4,4,4,3,4,5,4,4,5,5,4,4,5,5,3,4,3,3,4,4,3,5,4,5,4,4,4,5,4,4,4,4,4,5,4,4,5,4,5,5,4,5,5,5,4,2,4,2,2,2,1,2,1,2,4,2,1,2,1,2,4,1,2,1,1,1,1,2,1,1,1,1,4,5,4,5,5,5,4,3,3,3,5,3,3,4,4,4,4,5,4,5,4,5,5,5,4,3,4,4,4,865.97,1,"7j2d24qqawn2g4bb",NA,NA,"sa","/survey/selfserve/53b/g004/230372?list=1&ID=241183254226111","r1b9k3nvtp0dshxw","241183254226111",17.18475,14.4328333333333,9,72020,"01-07-2020",2020-07-01,34,2,10,2.1,1128,2020,3,4,3.5,4,3.66666666666667,2,2,2,2,3.5,3.5,3.33333333333333,3.5,2,5.2,3.6,3.75,4,3.75,3.8,3.33333333333333,2.66666666666667,3.66666666666667,3.66666666666667,2.33333333333333,2,2,2,2,2,2,4.8,3.81818181818182,3.8,4.33333333333333,3.33333333333333,3.25,3.33333333333333,4,2.33333333333333,3.33333333333333,4.16666666666667,4,4,4,3.66666666666667,59.45,48.33,46.92,60.77,61.83,49.47,49.59,45.66,62.76196,52.64521,64.5692794,55.2008894,1.11111111111111,4,3,4,2.4,2.5,2.33333333333333,3.44444444444444,3.66666666666667,3.33333333333333,3.33333333333333,52.83,54.05,53.98,60.77,61.83,55.25,56.79,52.42,69.193003,59.076253,66.6843296,57.3159396,0.666666666666667,5,2,2,4,2.16666666666667,2.25,2.125,4.25,4.27272727272727,4.4,4.33333333333333,4,4.25,4,4.33333333333333,4.33333333333333,4.33333333333333,3.5,4.26666666666667,1,2,4,3.66666666666667,5,4,2.38461538461538,2.4,2.5,2.25,1.85714285714286,1.16666666666667,1,4,4.6,3.75,3.5,4,1,4.1,4,3.33333333333333,4.75,3.75,2,2,3,4.66666666666667,4,4.33333333333333,4,4.25
"9",14,"vrzf684tnbqx0a1s","02/27/2023 11:00","qualified,/Gender/X0TrF,/Age/gcKvr,/Total/Total",3,1,1,1,1,1,1,2,43,1,4,"",4,1,"",2,1,6,6.2014,40,40,2,NA,NA,NA,11,"","Vertriebsleiter",7,2,3,1,NA,NA,NA,NA,NA,NA,NA,NA,NA,NA,NA,NA,NA,NA,NA,NA,NA,NA,NA,NA,NA,NA,NA,NA,NA,2,3,5,2,5,5,5,5,5,5,5,4,2,1,3,2,1,3,1,1,4,4,4,3,4,4,5,1,7,5,8,10,10,2,4,5,5,4,5,4,5,3,4,4,4,5,5,5,3,5,5,5,5,5,5,5,5,5,5,4,5,5,2,1,1,3,5,5,5,5,4,1,1,1,1,5,4,5,5,5,2,5,3,3,3,85,40,5,2,2,2,6,5,10,1,1,1,1,1,1,1,1,0,1,0,1,0,0,0,1,1,1,5,1,1,1,5,1,1,1,2,5,6,5,4,4,5,6,3,4,5,5,5,5,5,5,5,4,4,4,5,4,4,4,5,5,5,5,5,5,5,5,5,5,5,5,5,5,5,5,1,5,1,5,1,1,2629.121,12,NA,13,NA,1,1,"02/27/2023 10:15",NA,NA,NA,1,"Mozilla/5.0 (iPhone; CPU iPhone OS 16_3_1 like Mac OS X) AppleWebKit/605.1.15 (KHTML, like Gecko) Mobile/15E148","axhh32t7jqm6sv1m","v0xx71584fexn6m2",NA,NA,"si","/survey/selfserve/53b/g004/230146?list=1&ID=237104974336005","v0xx71584fexn6m2","237104974336005",915,2023-04-16 18:24:00,3,1,1,1,1,1,1,2,43,2,"",2,"",5,10,1,1,1,1,1,1,1,1,0,0,1,1,0,1,1,0,0,1,1,5,1,1,1,5,1,5,1,1,1,1,1,1,2,NA,"",NA,"",2,NA,3,"",NA,NA,0,0,0,0,0,0,0,0,1,"Sozialcoach",3,"",0,0,0,0,0,0,1,0,0,0,"","",2,NA,NA,"",2,NA,NA,NA,NA,NA,"",0,3,NA,NA,NA,"",2,3,2,"",NA,NA,NA,"","","",4,3,1,"Individuelle auf Mitarbeiter",2,NA,2,"","","",4,3,2,"",NA,NA,NA,"","","",4,4,2,"",NA,NA,NA,"","","",3,1,1,"Schulungen",1,4,NA,"","","",NA,NA,2,"",NA,NA,NA,"","","",1,1,1,"Geprüfter Objektleiter   Sales",1,4,NA,"","","",NA,NA,3,"",NA,NA,NA,"","","",4,3,2,"",NA,NA,NA,NA,"",NA,4,3,1,"GF",1,5,NA,"",NA,NA,1,"Teilzeit  Freie Zeiteinteilung",1,5,NA,"","","",NA,NA,3,"",NA,NA,NA,"","","",1,1,1,"Sozialcoach",2,NA,2,"","","",NA,NA,2,"",NA,NA,NA,NA,"","",1,1,2,"",NA,NA,NA,NA,"","",1,1,0,0,0,1,1,1,0,0,1,0,"",0,0,0,0,0,0,0,0,1,0,"",0,0,0,0,0,1,0,0,1,0,"",3,1,NA,NA,NA,NA,2,NA,NA,NA,"",1,2,3,NA,1,1,4,4,3,3,2,"",5,5,5,3,100,80,1,5,5,5,5,5,5,4,5,5,4,4,5,5,5,5,5,5,5,5,5,5,5,5,4,4,4,4,4,4,4,4,5,3,4,2,2,3,3,3,3,4,4,3,3,5,5,5,2,2,5,5,5,5,3,5,4,5,1,5,5,5,5,4,3,4,1,3,1,1,1,1,1,1,1,1,1,1,1,1,1,5,5,5,5,5,1,1,5,1,4,3,3,4,1,4,4,3,1,4,4,4,4,3,3,5,5,5,5,4,2154.44,1,"nfu6sw7ecjp8qsj9",NA,NA,"si","/survey/selfserve/53b/g004/230372?list=1&ID=241183254226126","nfu6sw7ecjp8qsj9","241183254226126",43.8186833333333,35.9073333333333,40,62014,"01-06-2014",2014-06-01,107,8,11,8.11,3350,2014,9,3.33333333333333,5,5,4.66666666666667,1.5,2.5,2,1,4,3.5,4.33333333333333,4,1,8,3.4,5,4,4.08333333333333,4.6,5,5,5,5,4.66666666666667,1,4.8,4.5,5,4.5,5,3.4,4.72727272727273,5,4.66666666666667,4.33333333333333,4.75,4,5,5,5,5,5,5,5,5,59.45,54.05,53.98,60.77,61.83,55.25,56.79,52.42,69.432978,59.316228,68.008793,58.640403,0.444444444444444,1,1,4,1.3,1.75,1,4.66666666666667,5,5,4,59.45,54.05,53.98,60.77,61.83,55.25,56.79,52.42,69.432978,59.316228,68.008793,58.640403,0.444444444444444,1,1,1,5,1.33333333333333,2,1,3.5,4.72727272727273,5,4.66666666666667,4.33333333333333,5,5,5,5,5,4,3.33333333333333,4,4,4.75,4.66666666666667,5,5,4.46153846153846,5,4.25,4,1.28571428571429,1,1,3.42857142857143,5,2,3.5,1,5,3.8,3.66666666666667,4.33333333333333,3.5,5,2.4,1,5,4.33333333333333,3.5,2.33333333333333,3,3.5
"10",15,"verbzqqg4gy9gtew","02/27/2023 10:59","qualified,/Gender/X0TrF,/Age/gcKvr,/Total/Total",3,1,1,1,1,1,1,2,38,1,5,"",4,2,"",3,1,6,7.2009,40,45,2,NA,NA,NA,10,"","Heilerziehungspfleger",7,16,3,2,1,1,1,NA,NA,NA,NA,NA,NA,NA,NA,NA,NA,NA,NA,NA,NA,NA,NA,NA,NA,NA,NA,NA,NA,2,4,4,4,4,3,4,4,3,4,4,4,4,4,5,4,4,3,4,3,4,4,4,4,2,3,3,1,8,8,3,8,3,2,2,4,3,2,3,4,3,3,3,4,2,2,2,3,3,4,4,2,3,3,3,4,2,3,2,4,2,2,3,5,2,2,4,3,3,4,3,4,1,1,2,4,4,1,4,4,5,1,1,1,NA,NA,0,5,4,5,6,4,4,7,3,2,2,3,3,2,3,1,4,5,5,2,4,2,5,3,1,2,2,3,3,2,2,3,3,2,2,4,4,5,5,3,3,4,5,3,5,4,4,4,5,4,3,4,4,4,4,4,4,2,4,3,4,3,4,3,4,3,3,3,4,4,3,4,5,2,4,4,3,4,2,1,1227.586,14,NA,10,NA,1,2,"02/27/2023 10:38",NA,NA,NA,1,"Mozilla/5.0 (Linux; Android 13; SM-G985F) AppleWebKit/537.36 (KHTML, like Gecko) Chrome/110.0.0.0 Mobile Safari/537.36","yw5wr2wftkcxwzkp","jwf6j3u6ty74w8be",NA,NA,"sa","/survey/selfserve/53b/g004/230146?list=1&ID=237104974325835","jwf6j3u6ty74w8be","237104974325835",654,2023-04-14 16:27:00,3,1,1,1,1,1,1,2,38,2,"",2,"",4,8,2,2,2,2,1,2,2,2,3,4,4,3,3,2,2,3,3,2,2,2,1,2,2,2,2,2,2,1,2,2,1,2,NA,NA,"",NA,"",NA,NA,NA,"",4,4,NA,NA,NA,NA,NA,NA,NA,NA,NA,"",NA,"",1,0,0,0,0,0,0,0,0,0,"","",2,NA,NA,"",2,NA,NA,NA,NA,NA,"",1,2,NA,NA,NA,"",2,2,2,"",NA,NA,NA,"","","",4,4,2,"",NA,NA,NA,"","","",4,4,2,"",NA,NA,NA,"","","",4,4,2,"",NA,NA,NA,"","","",4,4,2,"",NA,NA,NA,"","","",4,4,2,"",NA,NA,NA,"","","",4,4,2,"",NA,NA,NA,"","","",4,5,2,"",NA,NA,NA,"","","",5,5,2,"",NA,NA,NA,NA,"",NA,5,4,2,"",NA,NA,NA,"",5,4,2,"",NA,NA,NA,"","","",4,5,2,"",NA,NA,NA,"","","",5,4,2,"",NA,NA,NA,"","","",4,5,2,"",NA,NA,NA,NA,"","",4,4,2,"",NA,NA,NA,NA,"","",4,3,0,0,0,0,0,1,0,0,0,0,"",1,1,1,1,1,1,1,1,1,0,"",1,1,1,1,1,1,1,1,1,0,"",2,1,NA,NA,NA,NA,1,2,NA,2,"",NA,NA,2,NA,1,1,4,4,3,4,2,"",1,1,2,1,0,0,1,4,4,5,4,4,4,5,5,4,4,4,4,4,5,5,5,4,4,5,5,3,4,4,3,3,2,2,1,2,4,4,5,5,4,4,3,4,5,4,4,4,5,3,4,3,2,4,3,3,4,3,3,4,4,5,3,4,4,4,5,3,4,4,4,5,2,3,2,2,1,2,2,1,1,2,1,1,1,1,1,4,3,4,3,3,5,4,4,3,4,4,5,3,4,4,3,2,3,3,2,3,3,3,3,2,2,3,2,2,867.72,5,"brm6jvwuvf85tex5",NA,NA,"..","/survey/selfserve/53b/g004/230372?list=1&ID=241183254218824","advnjs9zyawcgqv8","241183254218824",20.4597666666667,14.462,0,72009,"01-07-2009",2009-07-01,166,13,10,13.1,5146,2009,14,4,3.5,3.66666666666667,4,4,4.5,3.5,3.5,4,4,2.66666666666667,2.5,1,6,2.8,3.25,2.66666666666667,2.91666666666667,2.8,2.88888888888889,3,3.33333333333333,2.33333333333333,3.33333333333333,2,3.4,4,3,4,3,4.8,4.09090909090909,4.4,3.66666666666667,4,3.41666666666667,3.33333333333333,3.66666666666667,3.33333333333333,3.33333333333333,3.83333333333333,2,3,4,3.16666666666667,46.43,48.33,46.92,47.67,45.16,49.47,41.53,52.42,55.1106699,44.9939199,58.3871912,49.0188012,3.44444444444444,4,4,4,3,3,3,4,3.66666666666667,4.66666666666667,3.66666666666667,52.83,48.33,46.92,53.35,61.83,49.47,49.59,45.66,62.7080044,52.5912544,60.7248356,51.3564456,3,4,4,4,4,2.5,3,2.25,3.75,4.27272727272727,4.2,4.66666666666667,4,4.33333333333333,4.33333333333333,4.66666666666667,4.66666666666667,3.66666666666667,2.16666666666667,4.13333333333333,3,3,3.125,3.16666666666667,3,2,3.92307692307692,3.6,4,4.25,2,1.16666666666667,1,3.78571428571429,3.4,4,4,4,3,2.9,3,2.66666666666667,3,2.25,2.8,1,3,4.33333333333333,4.5,3.66666666666667,4.33333333333333,4
"11",16,"k27vkxg2c5dcserc","02/27/2023 11:12","qualified,/Gender/X0TrF,/Age/gcKvr,/Total/Total",3,1,1,1,1,1,1,2,33,1,5,"",6,4,"",4,1,6,12.2015,35,35,2,NA,NA,NA,5,"","IT",8,2,1,2,4,4,2,2,30,7,1,NA,NA,NA,NA,NA,NA,NA,1,2,2,NA,NA,NA,NA,NA,NA,NA,5,2,5,5,5,5,4,5,4,4,5,5,5,5,4,5,5,4,5,4,3,4,4,5,5,5,4,5,4,8,6,10,6,8,3,5,5,5,5,4,5,5,4,5,5,5,4,5,5,4,5,4,5,5,4,5,5,4,5,5,4,5,3,4,5,4,5,5,4,4,5,5,5,5,4,5,5,4,5,4,4,4,5,4,5,2,30,65,6,7,7,6,7,5,9,1,2,1,2,1,1,1,1,0,0,0,0,1,0,1,2,3,1,2,1,1,3,3,1,4,4,2,6,5,6,6,6,5,6,6,6,5,5,5,5,4,4,5,5,3,1,5,5,5,5,5,5,5,5,5,5,5,5,5,5,4,4,5,5,5,5,1,4,1,5,4,1,1726.742,14,NA,10,NA,1,2,"02/27/2023 10:41",NA,NA,NA,1,"Mozilla/5.0 (Linux; Android 7.0; SM-J701F) AppleWebKit/537.36 (KHTML, like Gecko) Chrome/107.0.0.0 Mobile Safari/537.36","fb6d1z65qyp83tc3","35c13xx8twz69ggd",NA,NA,"sa","/survey/selfserve/53b/g004/230146?list=1&ID=237104974336254","35c13xx8twz69ggd","237104974336254",688,2023-04-14 17:35:00,3,1,1,1,1,1,1,2,31,1,"...",1,"...",4,10,2,3,3,4,2,2,1,2,0,1,1,0,1,1,1,0,1,1,1,2,2,1,2,2,1,2,1,2,1,2,1,2,NA,NA,"",NA,"",NA,NA,NA,"",2,4,NA,NA,NA,NA,NA,NA,NA,NA,NA,"",NA,"",0,1,0,1,0,0,0,0,0,0,"","...",1,2,3,"",2,NA,NA,NA,NA,NA,"",1,1,1,2,NA,"",NA,NA,1,"..",1,3,NA,"","","",NA,NA,2,"",NA,NA,NA,"","","",NA,NA,1,"...",1,1,NA,"","","",NA,NA,1,"...",1,3,NA,"","","",NA,NA,1,"...",2,NA,2,"","","",NA,NA,1,"...",1,2,NA,"","","",NA,NA,1,"..",1,2,NA,"","","",NA,NA,2,"",NA,NA,NA,"","","",2,3,1,"..",2,NA,2,NA,"",NA,NA,NA,1,"..",1,1,NA,"",NA,NA,1,".",1,3,NA,"","","",NA,NA,1,".",1,2,NA,"","","",NA,NA,2,"",NA,NA,NA,"","","",3,2,1,".",NA,NA,NA,NA,"","",NA,NA,1,"..",2,NA,2,NA,"","",NA,NA,1,0,0,0,1,0,0,0,0,0,"",0,0,1,0,0,0,0,0,0,0,"",0,0,1,0,0,0,0,0,0,0,"",1,2,NA,NA,NA,NA,1,2,NA,2,"",NA,NA,2,NA,1,1,2,1,2,1,2,"",4,5,4,1,95,79,5,4,5,4,5,5,5,4,3,4,5,4,5,4,4,5,4,5,4,5,5,4,5,4,1,2,1,1,2,2,5,4,5,5,5,4,4,3,4,4,5,5,4,4,5,5,4,5,5,4,5,5,4,5,4,5,4,5,5,5,4,5,4,5,4,5,5,4,3,4,5,4,5,5,4,4,5,5,4,5,4,5,4,4,5,4,5,5,5,4,4,5,4,5,5,5,4,5,5,5,4,5,4,3,4,5,4,5,4,5,685.42,5,"35c13xx8twz69ggd",NA,NA,"..","/survey/selfserve/53b/g004/230372?list=1&ID=241183254226119","35c13xx8twz69ggd","241183254226119",28.7790333333333,11.4236666666667,14,122015,"01-12-2015",2015-12-01,89,7,5,7.05,2802,2015,8,5,4.5,4.33333333333333,5,4.5,5,4.5,3.5,4,5,4.66666666666667,4.5,4,7.6,4.4,4.75,5,4.66666666666667,4.6,4.66666666666667,4.66666666666667,4.66666666666667,4.66666666666667,4.66666666666667,4.75,4.4,4.5,4.33333333333333,4.5,4.33333333333333,6.6,4.27272727272727,4.8,4.66666666666667,3,5,5,5,5,5,4.66666666666667,5,5,2,4.33333333333333,59.45,48.33,53.98,53.35,61.83,55.25,56.79,52.42,70.716265,60.599515,63.7416958,54.3733058,0.777777777777778,4,3,4,2.6,3.5,2,5.77777777777778,5.66666666666667,6,5.66666666666667,52.83,40.07,38.71,40.07,55.62,49.47,56.79,45.66,69.6000409,59.4832909,46.8937077,37.5253177,0.666666666666667,4,4,4,4,2.25,2.75,2,1.5,4.36363636363636,4.6,4,4.33333333333333,4.5,4.33333333333333,4.66666666666667,4.66666666666667,4.33333333333333,1.5,4.4,1,2,3.875,3.66666666666667,4.5,1,4.30769230769231,4,4.5,4.5,4.28571428571429,4.5,4.5,4.57142857142857,4.4,4.75,4.5,5,1,4,4.66666666666667,3.33333333333333,4,4.5,4.2,4,6,4.66666666666667,5,3.66666666666667,4.33333333333333,4.5
"12",17,"a5n5fs65j8jmst89","02/27/2023 11:21","qualified,/Gender/p47uy,/Age/gcKvr,/Total/Total",3,1,1,1,1,1,1,1,33,1,3,"",2,1,"",1,1,2,11.2015,30,30,2,NA,NA,NA,12,"Handwerk","Bürokauffrau",4,11,4,1,NA,NA,NA,NA,NA,NA,NA,NA,NA,NA,NA,NA,NA,NA,NA,NA,NA,NA,NA,NA,NA,NA,NA,NA,NA,2,3,3,3,3,3,2,2,2,2,3,2,3,2,2,2,1,2,1,1,3,2,1,1,3,2,2,1,4,1,1,1,3,1,1,2,2,1,2,2,1,2,1,1,2,2,2,3,1,2,4,4,3,3,3,3,2,3,3,5,5,4,2,2,2,1,5,4,3,5,4,1,1,1,1,1,1,1,1,1,5,1,1,1,NA,NA,0,3,1,1,1,1,4,8,3,2,2,4,3,2,2,2,2,2,1,1,1,1,1,0,1,3,4,2,2,2,3,1,1,1,1,0,2,2,0,2,2,2,1,1,4,4,4,4,5,3,4,3,3,3,3,3,3,3,3,4,5,4,4,2,1,3,1,3,2,3,2,3,4,3,2,4,1,2,4,1,1542.481,12,NA,11,NA,1,1,"02/27/2023 10:54",NA,NA,NA,1,"Mozilla/5.0 (iPhone; CPU iPhone OS 16_3_1 like Mac OS X) AppleWebKit/605.1.15 (KHTML, like Gecko) Version/16.3 Mobile/15E148 Safari/604.1","dd0kskpmqqx045su","yund715wnq9jra56",NA,NA,"si","/survey/selfserve/53b/g004/230146?list=1&ID=237104974334171","5uht9yjzks5pavqv","237104974334171",8,2023-04-06 17:03:00,3,1,1,1,1,1,1,1,33,2,"",2,"",3,7,3,3,1,4,3,3,3,1,2,2,3,2,2,1,1,0,1,3,2,5,3,3,3,3,1,4,1,1,1,1,1,3,NA,NA,"",NA,"",NA,NA,NA,"",3,3,NA,NA,NA,NA,NA,NA,NA,NA,NA,"",NA,"",1,0,0,0,0,0,1,0,0,0,"","",2,NA,NA,"",2,NA,NA,NA,NA,NA,"",0,2,NA,NA,NA,"",1,2,2,"",NA,NA,NA,"","","",3,3,2,"",NA,NA,NA,"","","",3,3,2,"",NA,NA,NA,"","","",3,3,2,"",NA,NA,NA,"","","",3,3,2,"",NA,NA,NA,"","","",3,3,2,"",NA,NA,NA,"","","",3,3,1,"Schulungen",2,NA,4,"","","Keine Ahnung",NA,NA,2,"",NA,NA,NA,"","","",3,3,2,"",NA,NA,NA,NA,"",NA,3,3,2,"",NA,NA,NA,"",3,3,2,"",NA,NA,NA,"","","",3,3,2,"",NA,NA,NA,"","","",3,3,2,"",NA,NA,NA,"","","",3,3,2,"",NA,NA,NA,NA,"","",3,3,2,"",NA,NA,NA,NA,"","",3,3,0,0,0,0,0,0,0,0,0,1,"Keine",0,0,0,0,0,0,0,0,0,1,"Keine",0,0,0,0,0,0,0,0,0,1,"Keine",2,2,NA,NA,NA,NA,1,2,NA,2,"",NA,NA,1,2,2,1,3,3,3,3,2,"",1,1,3,1,0,0,1,4,4,4,4,4,3,3,3,3,3,3,3,3,2,5,5,5,4,4,3,1,1,1,3,3,3,3,3,3,3,3,3,3,3,3,1,1,4,3,3,3,3,1,1,4,4,4,3,4,4,3,3,4,1,5,1,3,3,3,3,3,4,3,4,4,1,1,4,1,1,1,1,4,3,4,1,2,3,2,2,3,1,3,3,2,2,4,2,2,1,1,3,2,1,1,1,1,4,1,1,1,2,1,1,1,3,1,1,1,1931.59,1,"yund715wnq9jra56",NA,NA,"si","/survey/selfserve/53b/g004/230372?list=1&ID=240475414780051","5uht9yjzks5pavqv","240475414780051",25.7080166666667,32.1931666666667,0,112015,"01-11-2015",2015-11-01,90,7,6,7.06,2832,2015,8,3,3,2,2.33333333333333,2.5,2,1.5,1,2.5,1,2.33333333333333,2.5,1,2,1.4,1.75,1.33333333333333,1.5,2,3.11111111111111,3.66666666666667,3,2.66666666666667,4,1,1,1,1,1,1,1.4,3.63636363636364,4.2,3.33333333333333,3,3,3,4,3.33333333333333,1.66666666666667,2.83333333333333,4,5,2,3.33333333333333,46.43,48.33,46.92,40.07,45.16,49.47,49.59,45.66,58.5249107,48.4081607,53.2165572,43.8481672,1.11111111111111,2,3,5,2.2,2.75,1.83333333333333,1.33333333333333,1.33333333333333,1.33333333333333,1.33333333333333,46.43,40.07,53.98,40.07,45.16,40.41,41.53,52.42,53.7525325,43.6357825,56.65691,47.28852,1.55555555555556,1,3,2,5,2.16666666666667,3,1.75,3,3.45454545454545,4,3,3,3.08333333333333,2.66666666666667,5,3.66666666666667,1,3,2.53333333333333,3,2,3.375,3.5,3,3,3.15384615384615,3.2,2.5,3.75,1.42857142857143,2.83333333333333,2,2.14285714285714,2.4,2.5,1.75,1,2,1.2,1,1.33333333333333,1.25,1.5,2.2,1,2,3,3,1.66666666666667,3.33333333333333,2
"13",20,"197xgqnahwzy48cz","02/27/2023 11:31","qualified,/Gender/X0TrF,/Age/b3xfu,/Total/Total",3,1,1,1,1,1,1,2,65,2,3,"",4,3,"",2,1,6,10.1985,41,41,2,NA,NA,NA,8,"","Polizeibeamter",7,10,1,2,2,2,1,NA,63,NA,NA,NA,NA,NA,NA,NA,NA,NA,1,NA,NA,NA,NA,NA,NA,NA,NA,NA,NA,2,4,4,4,4,4,4,4,4,4,4,4,2,2,2,2,2,3,2,2,4,4,4,4,3,4,4,5,9,9,9,9,8,4,4,4,4,3,4,4,4,4,4,4,4,4,4,4,4,4,4,4,4,4,4,4,4,4,4,4,4,4,4,4,4,4,4,4,4,4,4,4,4,4,4,4,4,4,4,4,4,1,1,4,NA,NA,1,2,5,2,1,1,4,9,3,1,1,1,2,1,1,1,0,0,0,0,0,0,0,0,0,1,1,1,1,1,1,1,1,1,1,4,5,5,5,5,5,5,5,5,4,4,4,4,4,4,4,4,4,4,4,4,4,4,4,4,4,4,4,4,4,4,4,4,4,4,4,4,4,4,2,4,2,4,2,1,809.947,4,NA,10,NA,5,6,"02/27/2023 11:17",NA,NA,NA,1,"Mozilla/5.0 (Windows NT 10.0; Win64; x64) AppleWebKit/537.36 (KHTML, like Gecko) Chrome/110.0.0.0 Safari/537.36 Edg/110.0.1587.57","sjmdc254zxc7wvr7","d855gzx40v7wk2d0",NA,NA,"..","/survey/selfserve/53b/g004/230146?list=1&ID=237111539454081","by39jh5f9h7m3346","237111539454081",1090,2023-04-19 13:34:00,3,1,1,1,1,1,1,2,65,2,"",2,"",4,8,3,2,1,2,2,2,2,1,0,0,0,0,0,0,0,0,0,2,1,5,1,1,1,4,1,4,2,2,1,3,2,1,2,NA,"",NA,"",1,4,NA,"",NA,NA,1,0,0,0,0,0,0,0,0,"",1,"",0,0,0,0,0,0,1,0,0,0,"","",1,2,3,"",1,5,4,2,NA,3,"",2,1,2,NA,3,"",NA,NA,1,"Fitnessangebote im eigenen Fitnessraum",1,4,NA,"","","",NA,NA,1,"Gesprächskreise",1,4,NA,"","","",NA,NA,2,"",NA,NA,NA,"","","",2,3,1,"Suchtprävention",2,NA,2,"","","",NA,NA,2,"",NA,NA,NA,"","","",3,3,1,"Gesprächskreise",2,NA,2,"","","",NA,NA,1,"Neue Gesetzeslagen",1,4,NA,"","","",NA,NA,2,"",NA,NA,NA,"","","",2,3,2,"",NA,NA,NA,NA,"",NA,3,3,1,"Personalrat",2,NA,2,"",NA,NA,1,"zeitlich versetztes Arbeiten",1,4,NA,"","","",NA,NA,2,"",NA,NA,NA,"","","",2,2,2,"",NA,NA,NA,"","","",2,1,2,"",NA,NA,NA,NA,"","",2,1,2,"",NA,NA,NA,NA,"","",2,2,0,0,0,0,0,0,1,0,0,0,"",0,0,0,0,0,0,1,0,0,0,"",0,1,0,0,0,0,0,0,0,0,"",1,1,NA,NA,NA,NA,1,1,4,NA,"",NA,NA,1,1,2,2,3,3,3,3,2,"",1,1,1,1,0,0,1,4,4,4,4,4,4,2,4,4,4,4,4,4,4,4,4,4,4,4,4,4,4,4,3,3,3,3,3,3,4,4,4,4,4,4,4,4,4,4,4,4,4,4,4,4,4,4,2,2,4,3,4,3,3,4,4,4,2,4,4,4,4,4,4,4,2,2,2,1,1,1,1,1,1,1,1,1,1,1,1,4,4,4,4,4,4,4,4,4,4,4,4,4,4,4,4,4,2,4,4,4,4,4,4,4,4,4,4,4,1293.21,5,"d855gzx40v7wk2d0",NA,NA,"..","/survey/selfserve/53b/g004/230372?list=1&ID=241183254214897","u98s2hpvmarn6nj9","241183254214897",13.4991166666667,21.5535,-1,101985,"01-10-1985",1985-10-01,451,37,7,37.07,13820,1985,38,4,4,4,4,2,2,2.5,2,4,4,3.66666666666667,3.5,NA,8.8,4,4,3.66666666666667,3.91666666666667,4,4,4,4,4,4,4,4,4,4,4,4,2.2,4,4,4,4,4,4,4,4,4,4,4,4,4,4,46.43,54.05,53.98,60.77,55.62,55.25,56.79,52.42,67.3650951,57.2483451,64.7640032,55.3956132,0,5,5,5,2.2,3,1.66666666666667,4.88888888888889,4.66666666666667,5,5,46.43,48.33,53.98,53.35,55.62,49.47,49.59,52.42,62.2442125,52.1274625,62.5273146,53.1589246,0,1,2,2,3,1.5,1.75,1.375,3,3.81818181818182,4,3.33333333333333,4,4,4,4,4,4,3,4,4,4,3.875,4,3.5,4,3.84615384615385,3.8,3.75,4,1.42857142857143,1,1,4,4,4,4,4,4,4,4,4,4,4,4,1,6,4,4,4,4,4
"14",24,"u3xgm0z62tad5hv4","02/27/2023 12:02","qualified,/Gender/X0TrF,/Age/gcKvr,/Total/Total",3,1,1,1,1,1,1,2,54,1,2,"",2,1,"",1,1,3,4.1999,37,38,2,NA,NA,NA,7,"","Hauswart",4,16,2,1,NA,NA,NA,NA,NA,NA,NA,NA,NA,NA,NA,NA,NA,NA,NA,NA,NA,NA,NA,NA,NA,NA,NA,NA,NA,2,3,4,4,4,4,4,3,4,3,4,3,2,1,3,2,2,3,2,1,3,3,4,3,3,3,4,5,6,5,5,6,7,3,3,4,3,3,3,3,3,3,3,4,4,5,4,3,2,4,4,4,5,5,5,5,5,5,5,4,4,3,2,1,1,1,4,4,5,4,4,1,1,1,1,5,5,1,1,1,5,1,1,5,NA,NA,0,2,1,1,1,1,5,9,2,3,1,4,2,2,2,1,1,1,1,1,1,0,0,0,0,2,4,2,2,1,4,1,2,1,4,5,5,5,5,5,5,5,5,5,4,4,4,5,5,4,4,4,4,3,4,5,5,5,5,5,5,5,5,5,5,4,5,4,4,5,5,5,5,5,2,5,4,5,3,1,1725.162,14,NA,12,NA,1,2,"02/27/2023 11:33",NA,NA,NA,1,"Mozilla/5.0 (Android 10; Mobile; rv:109.0) Gecko/110.0 Firefox/110.0","d4awqrqv6pgcp94g","vm07w67pmft98qcr",NA,NA,"sa","/survey/selfserve/53b/g004/230146?list=1&ID=237104974311649","vm07w67pmft98qcr","237104974311649",621,2023-04-14 16:06:00,3,1,1,1,1,1,1,2,54,2,"",2,"",5,10,3,2,1,3,2,2,1,1,1,1,1,1,0,0,0,0,0,3,2,4,3,2,2,4,1,4,2,2,2,3,1,1,2,NA,"",NA,"",1,2,NA,"",NA,NA,0,0,1,0,0,0,0,0,0,"",3,"",0,0,0,0,0,0,0,0,1,0,"","",1,4,NA,"",2,NA,NA,NA,NA,NA,"",1,2,NA,NA,NA,"",1,1,2,"",NA,NA,NA,"","","",3,4,2,"",NA,NA,NA,"","","",2,2,2,"",NA,NA,NA,"","","",2,2,2,"",NA,NA,NA,"","","",1,1,1,"Arbeitsschutzbelehrng",1,5,NA,"","","",NA,NA,1,"Gemeinsame Ausflüge.  Team Bindung",1,5,NA,"","","",NA,NA,1,"Unterschiedlich, je nach Qualifikation.",2,NA,4,"","","......",NA,NA,1,"......",2,NA,2,"","","",NA,NA,1,"......",2,NA,2,NA,"",NA,NA,NA,1,".....",1,5,NA,"",NA,NA,1,"Gleitzeit",1,5,NA,"","","",NA,NA,1,".......",2,NA,2,"","","",NA,NA,2,"",NA,NA,NA,"","","",2,1,2,"",NA,NA,NA,NA,"","",1,1,2,"",NA,NA,NA,NA,"","",1,1,0,0,0,0,0,1,0,0,0,0,"",0,0,0,0,0,0,0,0,0,1,"keine",0,0,0,0,0,0,0,0,0,1,"keine",3,1,NA,NA,NA,NA,1,1,5,NA,"",NA,NA,2,NA,2,2,5,5,5,4,2,"",3,2,2,1,0,0,1,5,5,5,5,5,5,4,4,4,4,5,5,5,5,5,5,5,5,5,5,5,5,5,2,2,2,2,3,3,5,5,4,4,4,3,2,1,5,4,4,4,4,4,3,5,5,5,2,2,4,4,4,4,4,5,3,3,2,4,4,5,5,3,3,3,1,1,1,1,1,2,3,1,1,1,1,1,1,1,1,5,5,5,5,5,5,3,4,2,4,4,5,4,1,4,3,3,1,3,2,2,4,4,2,3,4,3,3,3,2650.12,1,"c7dpsdgbhhrsv81g",NA,NA,"sa","/survey/selfserve/53b/g004/230372?list=1&ID=241166931200213","8xfasc3464zuc552","241166931200213",28.7527,44.1686666666667,0,41999,"01-04-1999",1999-04-01,289,24,1,24.01,8890,1999,24,3.66666666666667,4,3.66666666666667,3.33333333333333,1.5,2.5,2.5,1.5,3,3.5,3.33333333333333,3,NA,5.8,3,3.25,3.66666666666667,3.25,3.6,4.77777777777778,4.33333333333333,5,5,4.33333333333333,1,2.6,5,1,5,1,1.2,4.09090909090909,4.4,4,3.66666666666667,4.91666666666667,5,5,5,4.66666666666667,4.66666666666667,4,2,3,4,52.83,40.07,53.98,40.07,55.62,49.47,49.59,52.42,64.3936579,54.2769079,56.7746746,47.4062846,0.555555555555556,2,2,2,1.7,1.5,1.83333333333333,5,5,5,5,46.43,48.33,53.98,47.67,55.62,49.47,56.79,52.42,67.5589461,57.4421961,58.495441,49.127051,0.444444444444444,2,2,2,3,2.08333333333333,2.25,2,4.75,4.63636363636364,5,4.33333333333333,4.33333333333333,5,5,5,5,5,2.33333333333333,3.73333333333333,4,4,4.375,4.5,4,4,3.84615384615385,4.2,3.75,3.5,1.42857142857143,1,1,4.07142857142857,5,3.5,4.25,1,5,3.2,3.33333333333333,3.33333333333333,3,3.25,1.6,1,5,4.66666666666667,4,2,4.33333333333333,3.75
"15",25,"zj0kmntmkfj0sunm","02/27/2023 12:36","qualified,/Gender/p47uy,/Age/gcKvr,/Total/Total",3,1,1,1,1,1,1,1,26,1,5,"",3,1,"",1,1,5,7.2021,39,43,2,NA,NA,NA,6,"","Sachbearbeiterin Sparabteilung",4,10,4,1,NA,NA,NA,NA,NA,NA,NA,NA,NA,NA,NA,NA,NA,NA,NA,NA,NA,NA,NA,NA,NA,NA,NA,NA,NA,2,4,4,4,4,3,4,4,4,4,4,4,2,2,3,3,1,2,1,1,3,3,3,3,4,4,3,1,3,1,1,2,5,3,2,4,4,3,4,3,3,3,3,3,3,3,3,3,3,3,4,5,4,4,4,3,3,3,3,3,3,4,3,3,2,3,5,4,4,5,5,1,1,1,3,3,5,5,2,2,4,4,1,1,2,40,0,1,1,1,1,1,4,8,3,2,2,3,2,1,3,3,1,1,0,1,0,1,0,1,0,1,4,1,1,1,2,1,1,1,2,2,3,2,2,2,2,2,2,2,4,3,3,3,3,4,4,4,4,3,3,3,3,3,5,5,4,5,5,5,3,4,4,3,4,4,4,4,4,3,3,3,4,3,3,1,3363.863,14,NA,10,NA,1,2,"02/27/2023 11:39",NA,NA,NA,1,"Mozilla/5.0 (Linux; Android 13; SAMSUNG SM-G991B) AppleWebKit/537.36 (KHTML, like Gecko) SamsungBrowser/20.0 Chrome/106.0.5249.126 Mobile Safari/537.36","aj4bxjat3ab039v7","tub5fyu3pmkjfzt2",NA,NA,"sa","/survey/selfserve/53b/g004/230146?list=1&ID=237111539455111","tub5fyu3pmkjfzt2","237111539455111",691,2023-04-14 18:09:00,3,1,1,1,1,1,1,1,26,2,"",2,"",4,8,3,1,1,2,2,2,3,2,1,1,1,2,0,1,0,2,0,2,1,5,1,2,2,4,1,5,1,1,1,3,1,3,NA,NA,"",NA,"",NA,NA,NA,"",2,2,NA,NA,NA,NA,NA,NA,NA,NA,NA,"",NA,"",1,0,0,0,0,1,0,0,0,0,"","",1,3,NA,"",1,8,2,2,NA,2,"",3,3,NA,NA,NA,"",3,4,1,"Anteilige Übernahme fitnessstudio",2,NA,2,"","","",NA,NA,3,"",NA,NA,NA,"","","",NA,NA,3,"",NA,NA,NA,"","","",4,4,3,"",NA,NA,NA,"","","",2,3,1,"Ersthelferseminar",2,NA,3,"","Allgemeine Angebote in Online","",NA,NA,1,"Meetings, Feiern",1,4,NA,"","","",NA,NA,1,"Schulungsangebote",2,NA,4,"","","-",NA,NA,1,"PC, verstellbarer Tisch, ergonomische stühle",1,5,NA,"","","",NA,NA,3,"",NA,NA,NA,NA,"",NA,3,3,3,"",NA,NA,NA,"",4,4,1,"Gleitzeit",1,4,NA,"","","",NA,NA,3,"",NA,NA,NA,"","","",2,2,2,"",NA,NA,NA,"","","",2,1,3,"",NA,NA,NA,NA,"","",4,4,2,"",NA,NA,NA,NA,"","",3,3,0,0,0,1,0,0,0,0,0,0,"",1,0,0,0,0,0,0,1,0,0,"",1,1,0,1,1,1,1,1,0,0,"",1,1,NA,NA,NA,NA,2,NA,NA,NA,"",3,3,3,NA,3,1,4,4,4,2,2,"",3,1,3,2,66,2,2,4,4,4,4,5,4,4,4,3,4,4,3,3,2,4,4,4,4,4,5,5,5,5,3,3,3,3,3,3,3,3,4,4,4,3,3,3,3,3,3,3,3,3,3,4,4,4,2,3,4,5,5,3,3,4,4,4,3,4,4,4,4,4,4,4,2,3,2,2,2,3,3,2,2,2,2,2,2,2,2,4,3,3,3,3,3,2,3,3,3,3,3,3,3,4,3,4,3,4,3,3,3,3,3,4,5,4,4,4,2652.92,1,"tub5fyu3pmkjfzt2",NA,NA,"sa","/survey/selfserve/53b/g004/230372?list=1&ID=241183254214907","tub5fyu3pmkjfzt2","241183254214907",56.0643833333333,44.2153333333333,2,72021,"01-07-2021",2021-07-01,22,1,10,1.1,763,2021,2,4,3.5,4,4,2,3,1.5,1,3,3,3.66666666666667,4,1,2.4,2.8,3.75,3,3.16666666666667,3,3.66666666666667,4.33333333333333,3.66666666666667,3,4.66666666666667,1.5,3.4,4,3,4,3,1,3.45454545454545,3.2,4,3.33333333333333,4.08333333333333,3,4.66666666666667,5,3.66666666666667,3.83333333333333,3,2,3,2.83333333333333,46.43,48.33,46.92,47.67,55.62,55.25,41.53,38.09,53.5902344,43.4734844,59.0381558,49.6697658,0.555555555555556,2,4,4,1.7,2.5,1.16666666666667,2.11111111111111,2.33333333333333,2,2,46.43,54.05,53.98,53.35,55.62,49.47,41.53,45.66,52.7903681,42.6736181,66.3929166,57.0245266,0.888888888888889,1,2,1,3,1.41666666666667,2,1.125,3.5,4,4.2,4,3.66666666666667,4,2.66666666666667,4,4.33333333333333,5,3,3.2,4,3,4.125,3.83333333333333,5,3,3.76923076923077,3.6,3.75,4,2.42857142857143,2,2,3,3.2,2.75,3,3,3,3.3,3.66666666666667,3.33333333333333,3,4.25,3,1,3,3.33333333333333,4,3,3,3
"16",26,"qn6mruuxatd997zv","02/27/2023 12:03","qualified,/Gender/p47uy,/Age/gcKvr,/Total/Total",3,1,1,1,1,1,1,1,34,1,4,"",4,1,"",1,1,6,7.2012,15,16,2,NA,NA,NA,1,"","Personalsachbearbeitung",8,15,1,2,3,3,2,1,38,1,NA,NA,NA,NA,NA,NA,NA,NA,1,2,NA,NA,NA,NA,NA,NA,NA,NA,4,2,3,4,3,3,3,3,3,4,4,4,3,3,3,3,3,2,3,3,3,3,3,3,3,3,2,3,3,3,5,6,5,6,3,3,2,2,2,3,3,2,2,3,2,3,2,3,3,3,2,4,4,3,3,3,3,3,3,3,3,4,3,2,2,2,2,3,3,3,3,3,1,1,1,1,3,4,4,2,1,4,3,1,1,2,40,50,4,3,3,1,3,3,7,3,2,2,2,3,2,2,2,1,2,1,1,1,1,0,1,0,2,2,2,2,3,3,2,2,3,2,2,3,2,2,2,3,3,2,2,3,3,3,3,3,3,2,3,3,3,3,3,3,4,4,4,4,4,4,4,3,3,3,3,3,4,4,4,3,3,3,3,2,4,2,1,1072.835,14,NA,10,NA,1,2,"02/27/2023 11:44",NA,NA,NA,1,"Mozilla/5.0 (Linux; Android 13; SAMSUNG SM-A725F) AppleWebKit/537.36 (KHTML, like Gecko) SamsungBrowser/20.0 Chrome/106.0.5249.126 Mobile Safari/537.36","tdgjdssrj8gt6yn5","upzk6qhegs7c2d6m",NA,NA,"sa","/survey/selfserve/53b/g004/230146?list=1&ID=237111539462160","x0bzksa99qh0q47q","237111539462160",1008,2023-04-17 20:12:00,3,1,1,1,1,1,1,1,34,2,"",2,"",4,7,3,2,2,2,3,1,2,2,1,1,1,1,1,0,0,0,0,3,2,3,2,2,2,2,1,3,2,3,2,3,1,2,NA,NA,"",NA,"",NA,NA,NA,"",3,3,NA,NA,NA,NA,NA,NA,NA,NA,NA,"",NA,"",1,0,0,0,0,0,1,0,0,0,"","",1,2,3,"",2,NA,NA,NA,NA,NA,"",3,2,NA,NA,NA,"",4,4,2,"",NA,NA,NA,"","","",4,4,2,"",NA,NA,NA,"","","",4,4,2,"",NA,NA,NA,"","","",4,3,2,"",NA,NA,NA,"","","",2,2,1,"Sprechstunde beim Betriebsrat und Sicherheitssitzung",2,NA,2,"","","",NA,NA,2,"",NA,NA,NA,"","","",3,3,1,"Je nach Bedarf",1,3,NA,"","","",NA,NA,2,"",NA,NA,NA,"","","",4,3,2,"",NA,NA,NA,NA,"",NA,3,3,1,"IT Fachmann",1,4,NA,"",NA,NA,1,"Mobiles Arbeiten und Gleitzeit für Angestellte",1,4,NA,"","","",NA,NA,2,"",NA,NA,NA,"","","",4,4,2,"",NA,NA,NA,"","","",4,4,2,"",NA,NA,NA,NA,"","",4,4,2,"",NA,NA,NA,NA,"","",3,3,0,0,0,0,0,0,0,0,0,1,"Gesundheitstag",0,0,0,0,0,0,0,0,1,0,"",1,0,0,0,0,0,0,0,0,0,"",1,1,NA,NA,NA,NA,1,1,3,NA,"",NA,NA,1,2,3,2,3,4,3,3,2,"",3,1,3,2,15,0,4,4,4,4,4,4,4,3,4,3,3,3,3,4,4,4,4,4,4,4,4,3,3,2,2,3,2,2,2,2,3,2,3,3,3,3,2,3,3,3,3,3,3,2,3,4,3,3,2,3,3,3,3,3,4,4,3,4,3,4,3,4,3,4,3,3,3,3,3,3,2,3,3,2,2,2,2,2,3,2,2,3,3,4,3,3,3,2,3,3,3,3,4,3,2,3,3,3,2,3,3,3,3,3,3,3,4,3,3,3,1162.82,1,"upzk6qhegs7c2d6m",NA,NA,"sa","/survey/selfserve/53b/g004/230372?list=1&ID=241183254224040","x0bzksa99qh0q47q","241183254224040",17.8805833333333,19.3803333333333,-50,72012,"01-07-2012",2012-07-01,130,10,10,10.1,4050,2012,11,3.33333333333333,3,3.33333333333333,3.66666666666667,3,3,2.5,3,3,3,2.66666666666667,2.5,3,5,2.8,2.25,2.33333333333333,2.5,2.6,3.22222222222222,3.66666666666667,3,3,3,1,2.8,3.5,2.33333333333333,3.5,2.33333333333333,2.8,2.90909090909091,3,2.66666666666667,3,3.58333333333333,3.33333333333333,4,4,3,3.5,3,4,4,3.5,46.43,48.33,46.92,53.35,45.16,49.47,49.59,45.66,58.1919811,48.0752311,57.7267108,48.3583208,0.888888888888889,4,3,4,2.7,3.25,2.33333333333333,2.33333333333333,2.33333333333333,2.33333333333333,2.33333333333333,46.43,48.33,46.92,53.35,45.16,55.25,49.59,45.66,59.4238147,49.3070647,57.7991342,48.4307442,0.555555555555556,3,4,3,3,2.41666666666667,2.75,2.25,3.25,3.63636363636364,4,3.66666666666667,3,3.58333333333333,3.66666666666667,4,4,2.66666666666667,2.16666666666667,2.8,4,3,3.25,3.33333333333333,3,3,3.46153846153846,3.4,3.75,3.25,2.85714285714286,2.16666666666667,2,3,3.2,2.75,3.25,2,4,3.1,3,3.33333333333333,3,3.25,2.2,3,4,2.66666666666667,3,2.66666666666667,3,2.75
"17",30,"df8sr0dp26m2f4g1","02/27/2023 12:19","qualified,/Gender/p47uy,/Age/gcKvr,/Total/Total",3,1,1,1,1,1,1,1,26,1,5,"",1,1,"",1,2,4,5.2016,40,40,1,1,2,2,11,"","Selbstangl",5,3,1,2,4,4,2,2,30,8,5,NA,NA,NA,NA,NA,NA,NA,1,2,2,NA,NA,NA,NA,NA,NA,NA,3,1,4,4,4,4,4,5,3,3,4,4,4,4,5,4,4,3,2,3,4,3,3,4,4,4,4,4,2,7,6,6,5,7,NA,NA,NA,NA,NA,NA,NA,NA,NA,NA,NA,NA,4,3,3,4,3,4,3,4,3,4,4,3,4,2,3,4,3,3,3,3,3,4,4,4,3,4,3,4,4,3,4,4,4,4,4,5,4,4,4,1,85,70,6,5,5,5,5,4,10,2,4,4,2,2,2,3,2,2,1,2,2,0,1,2,2,2,2,3,2,3,2,2,2,3,2,2,5,4,4,5,5,5,5,5,5,4,3,4,4,4,3,3,3,4,3,3,4,4,4,3,4,4,4,3,4,4,3,4,4,4,4,4,3,4,3,1,3,2,3,4,1,1218.203,14,NA,10,NA,1,2,"02/27/2023 11:57",NA,NA,NA,1,"Mozilla/5.0 (Linux; Android 8.1.0; Venus E4) AppleWebKit/537.36 (KHTML, like Gecko) Chrome/108.0.0.0 Mobile Safari/537.36","xv4m4h5bbnd4x7kx","pcwq2jarwrvp32v9",NA,NA,"sa","/survey/selfserve/53b/g004/230146?list=1&ID=237104974335216","pcwq2jarwrvp32v9","237104974335216",666,2023-04-14 17:07:00,3,1,1,1,1,1,1,1,27,1,"Selbstangl",2,"",5,10,1,3,2,3,1,2,2,3,1,1,1,2,2,2,1,2,1,3,2,2,2,4,4,4,4,4,4,4,4,3,1,1,1,3,"",4,"",NA,NA,NA,"",NA,NA,NA,NA,NA,NA,NA,NA,NA,NA,NA,"",NA,"",0,0,1,1,1,0,0,0,0,0,"","Hakk",1,2,3,"",1,5,1,1,2,NA,"",1,1,1,3,NA,"",NA,NA,1,"Roys",1,3,NA,"","","",NA,NA,1,"Suhweg",1,5,NA,"","","",NA,NA,1,"Alle gut",1,5,NA,"","","",NA,NA,1,"Gut",1,4,NA,"","","",NA,NA,1,"Sehr gut",1,4,NA,"","","",NA,NA,1,"Gut",1,3,NA,"","","",NA,NA,1,"Abitur",1,4,NA,"","","",NA,NA,1,"Sehr gut",1,5,NA,"","","",NA,NA,1,"Alle gut",1,4,NA,NA,"",NA,NA,NA,1,"Sehr gut",1,4,NA,"",NA,NA,1,"Duks",1,5,NA,"","","",NA,NA,1,"Faygw",1,3,NA,"","","",NA,NA,1,"Gulk",1,4,NA,"","","",NA,NA,1,"Darkw",1,5,NA,NA,"","",NA,NA,1,"Dasg",1,4,NA,NA,"","",NA,NA,0,1,1,1,1,1,0,0,0,0,"",1,1,1,0,1,1,0,0,0,0,"",0,1,0,1,1,1,0,0,0,0,"",2,1,NA,NA,NA,NA,1,1,4,NA,"",NA,NA,1,1,1,1,4,4,4,4,1,"Ja",3,2,3,1,94,81,4,3,4,4,5,5,4,4,4,4,3,4,5,5,5,5,4,4,4,4,5,5,5,5,4,4,3,3,4,4,4,5,5,4,5,4,4,5,5,5,5,5,5,5,4,4,3,4,5,5,4,4,3,5,5,3,3,3,5,5,5,5,4,5,5,5,5,5,5,5,5,4,4,5,4,4,4,5,5,3,1,3,4,4,4,3,5,5,5,4,4,4,4,5,5,4,4,4,4,4,4,3,4,5,5,4,4,4,4,5,1642.05,5,"74ychktzwwqmhkps",NA,NA,"..","/survey/selfserve/53b/g004/230372?list=1&ID=241183254226113","74ychktzwwqmhkps","241183254226113",20.3033833333333,27.3675,11,52016,"01-05-2016",2016-05-01,84,7,0,7,2650,2016,7,4,4,3.66666666666667,4,4.5,4,2.5,3.5,3,4,4,4,2,6.2,NA,NA,NA,NA,3.4,3.44444444444444,3.66666666666667,3.66666666666667,3,3.66666666666667,3.5,4,4,4,4,4,5.2,3.45454545454545,3.8,3,3.33333333333333,3.75,4,3.66666666666667,3.66666666666667,3.66666666666667,3.83333333333333,5,4,2,3.33333333333333,52.83,30.31,28.32,53.35,55.62,49.47,41.53,45.66,61.9463103,51.8295603,47.747462,38.379072,1.55555555555556,3,4,4,2.7,3,2.5,4.77777777777778,4.66666666666667,4.66666666666667,5,59.45,40.07,46.92,47.67,61.83,49.47,49.59,38.09,61.8009423,51.6841923,57.3335842,47.9651942,1.44444444444444,4,2,2,3,3.25,3.25,3.25,4,4,4.2,4,3.66666666666667,4.66666666666667,5,4.33333333333333,4.33333333333333,5,3.66666666666667,4.66666666666667,1,1,3,2.83333333333333,3.5,1,4.15384615384615,4.2,3.5,4.75,4.71428571428571,4.5,2,4.21428571428571,3.6,4.75,4.25,5,2,3.9,4,3.33333333333333,4.25,4,3,2,6,4.66666666666667,4.5,4.33333333333333,5,4.75
"18",31,"1chjaepe7aawbb52","02/27/2023 12:55","qualified,/Gender/p47uy,/Age/gcKvr,/Total/Total",3,1,1,1,1,1,1,1,44,1,3,"",2,1,"",1,1,6,4.2009,40,41,2,NA,NA,NA,12,"Biotech","Technische Mitarbeiterin Qualitätskontrolle",5,1,3,1,NA,NA,NA,NA,NA,NA,NA,NA,NA,NA,NA,NA,NA,NA,NA,NA,NA,NA,NA,NA,NA,NA,NA,NA,NA,2,3,4,3,5,4,5,3,4,3,5,4,2,1,3,3,3,3,5,5,2,1,2,1,3,4,4,1,6,2,6,2,2,3,3,2,4,2,2,3,2,2,2,2,2,3,4,3,1,3,3,5,4,3,3,2,2,2,2,4,2,3,2,1,1,3,3,3,4,4,3,4,3,2,4,3,4,2,1,1,5,2,1,1,1,4,0,3,2,1,1,1,3,7,3,3,2,2,4,3,5,4,3,2,3,0,1,4,1,0,0,2,5,3,2,3,2,1,2,2,3,1,2,1,1,1,3,1,0,0,5,5,5,5,4,2,2,2,3,2,4,3,3,2,3,4,4,4,4,3,2,2,2,2,4,3,3,3,4,4,2,4,2,2,3,1,3282.457,4,NA,10,NA,5,6,"02/27/2023 12:01",NA,NA,NA,1,"Mozilla/5.0 (Windows NT 10.0; Win64; x64) AppleWebKit/537.36 (KHTML, like Gecko) Chrome/110.0.0.0 Safari/537.36 Edg/110.0.1587.56","7w3vfvacfjjjdeba","q65qkshh6uhcqhn4",NA,NA,"..","/survey/selfserve/53b/g004/230146?list=1&ID=237111539465303","q65qkshh6uhcqhn4","237111539465303",466,2023-04-15 09:48:00,3,1,1,1,1,1,1,1,44,2,"",2,"",2,7,4,4,4,4,3,4,3,3,5,4,4,0,3,5,1,0,5,3,3,3,3,3,2,4,2,2,2,1,3,4,1,1,2,NA,"",NA,"",2,NA,3,"",NA,NA,1,0,0,0,0,0,0,0,0,"",1,"",0,0,0,0,0,0,1,0,0,0,"","",1,3,NA,"",2,NA,NA,NA,NA,NA,"",3,1,2,NA,3,"",NA,NA,1,"Hanse Fit",1,3,NA,"","","",NA,NA,3,"",NA,NA,NA,"","","",NA,NA,1,"wöchentlicher Obstkorb",1,5,NA,"","","",NA,NA,3,"",NA,NA,NA,"","","",3,1,3,"",NA,NA,NA,"","","",4,5,2,"",NA,NA,NA,"","","",3,3,1,"verschiedene, kann man sich zum Teil selbst raussuchen. Werden nur nicht immer genehmigt, kommt auf die Sympathie des Vorgesetzten an.",2,NA,5,"Meine Vorgesetzte unterstützt mich nicht","","",NA,NA,2,"",NA,NA,NA,"","","",4,5,3,"",NA,NA,NA,NA,"",NA,3,3,3,"",NA,NA,NA,"",3,3,1,"Gleitzeit, Teilzeit.",2,NA,2,"","","",NA,NA,1,"kenne ich mich nicht aus aber es gibt etwas.",2,NA,2,"","","",NA,NA,2,"",NA,NA,NA,"","","",3,1,2,"",NA,NA,NA,NA,"","",4,3,2,"",NA,NA,NA,NA,"","",3,3,0,0,0,0,0,0,0,0,0,1,"Hanse Fit",0,0,0,0,0,0,0,1,0,0,"",0,0,0,0,0,0,0,1,0,0,"",3,1,NA,NA,NA,NA,1,1,3,NA,"",NA,NA,1,1,1,3,3,3,4,3,2,"",4,1,3,1,0,0,2,5,5,4,4,5,2,2,2,5,2,3,2,4,2,2,4,5,4,3,3,3,3,3,1,1,1,3,4,3,4,4,5,4,4,3,3,3,2,2,2,3,4,3,2,5,5,5,4,3,5,5,5,4,3,5,4,4,3,5,5,4,5,4,4,4,3,5,4,3,1,3,3,2,3,3,2,2,3,3,5,2,1,3,2,3,5,3,4,4,1,1,1,1,3,2,1,2,5,1,1,3,3,1,2,3,4,3,3,3,3108.03,5,"qcmcf395nu07nuvr",NA,NA,"..","/survey/selfserve/53b/g004/230372?list=1&ID=241183254226120","qcmcf395nu07nuvr","241183254226120",54.7076166666667,51.8005,0,42009,"01-04-2009",2009-04-01,169,14,1,14.01,5237,2009,14,3.33333333333333,4.5,4,4,1.5,3,3,5,1.5,1.5,3.66666666666667,3.5,1,3.6,2.6,2.5,2,2.41666666666667,2.8,2.88888888888889,4,2.66666666666667,2,3.66666666666667,3.25,2.2,3.5,1.33333333333333,3.5,1.33333333333333,1.6,3.54545454545455,4.8,2,3,3,2.66666666666667,3.66666666666667,3.66666666666667,2,3.16666666666667,4,4,3,3.5,46.43,40.07,46.92,53.35,35.81,40.41,21.4,29.25,28.9615845,18.8448345,61.7882776,52.4198876,1.55555555555556,1,4,3,2.3,3,1.83333333333333,1.11111111111111,1.33333333333333,1,1,38.41,30.31,28.32,40.07,45.16,29.53,41.53,38.09,51.9448362,41.8280862,38.7609136,29.3925236,3,3,2,4,2,2.5,2.25,2.625,3.25,3.54545454545455,4.6,2,3.33333333333333,3.16666666666667,2.66666666666667,3.66666666666667,3.33333333333333,3,2.16666666666667,3.2,2,3,4.375,4.16666666666667,5,3,4.15384615384615,4.2,4,4.25,3.14285714285714,2.5,4,2.42857142857143,2.2,4,1,3,1,1.7,1.66666666666667,1,2.25,3.25,2,1,2,4.33333333333333,4,3,2,3
"19",32,"k0r8scrbynkn35xb","02/27/2023 12:16","qualified,/Gender/X0TrF,/Age/gcKvr,/Total/Total",3,1,1,1,1,1,1,2,35,1,5,"",6,1,"",2,1,6,10.2013,38,40,2,NA,NA,NA,1,"","Technical Service Manager",7,15,1,2,4,4,2,2,35,2,0,NA,NA,NA,NA,NA,NA,NA,1,2,2,NA,NA,NA,NA,NA,NA,NA,2,2,5,4,3,3,3,4,3,4,4,4,3,3,1,5,4,2,4,1,2,4,3,3,2,2,4,3,3,8,3,2,5,8,2,2,3,3,3,3,3,3,2,2,3,4,3,4,4,3,3,4,4,3,4,5,5,4,4,4,4,4,4,1,1,1,4,5,5,4,4,3,1,1,1,1,4,2,3,5,3,4,3,1,2,2,10,0,2,2,2,5,5,4,8,2,1,1,1,2,1,4,1,2,3,1,0,0,0,2,0,0,1,4,1,1,1,4,2,4,2,2,5,5,4,4,3,4,4,4,4,4,4,4,4,4,3,3,4,2,3,3,4,4,4,4,4,4,4,4,4,4,4,4,3,4,4,3,3,4,4,2,4,2,4,2,1,881.854,4,NA,10,NA,5,6,"02/27/2023 12:01",NA,NA,NA,1,"Mozilla/5.0 (Windows NT 10.0; Win64; x64) AppleWebKit/537.36 (KHTML, like Gecko) Chrome/110.0.0.0 Safari/537.36 Edg/110.0.1587.56","wnxzvf9hhnwv6d8u","paywvxyn1xx4fnzg",NA,NA,"..","/survey/selfserve/53b/g004/230146?list=1&ID=237111539465304","paywvxyn1xx4fnzg","237111539465304",994,2023-04-17 14:27:00,3,1,1,1,1,1,1,2,35,2,"",2,"",4,8,2,2,1,2,2,1,3,1,1,2,1,0,1,1,0,0,0,2,1,4,2,1,3,3,2,2,4,4,2,2,1,1,2,NA,"",NA,"",1,3,NA,"",NA,NA,1,1,0,0,0,0,0,0,0,"",1,"",1,1,0,0,0,0,0,0,0,0,"","",1,1,2,"",2,NA,NA,NA,NA,NA,"",3,1,2,NA,2,"",NA,NA,2,"",NA,NA,NA,"","","",4,4,1,"Fürstenberg Institut, Beratung",1,3,NA,"","","",2,2,2,"",NA,NA,NA,"","","",2,3,3,"",NA,NA,NA,"","","",3,1,1,"Safety Walks, Sicherheitsrunde,",1,5,NA,"","","",NA,NA,2,"",NA,NA,NA,"","","",2,2,1,"je nach Einzelfall",1,4,NA,"","","",NA,NA,1,"Check durch IT/Sicherheitsfachkraft",1,3,NA,"","","",NA,NA,3,"",NA,NA,NA,NA,"",NA,3,3,3,"",NA,NA,NA,"",1,1,1,"Gleitzeit, bei Bedarf auch Stundenreduzierung",2,NA,2,"","","",NA,NA,2,"",NA,NA,NA,"","","",5,5,2,"",NA,NA,NA,"","","",2,2,1,"Female Talent Initiative",NA,NA,NA,NA,"","",NA,NA,2,"",NA,NA,NA,NA,"","",2,2,0,0,0,0,0,0,0,0,0,1,"nix weiter",0,0,0,0,0,0,0,0,0,1,"nix weiter",0,0,0,0,0,0,0,0,0,1,"nix weiter",1,1,NA,NA,NA,NA,1,1,3,NA,"",NA,NA,1,1,3,3,4,4,4,3,2,"",4,4,3,1,10,5,5,4,4,4,4,4,4,3,4,4,4,4,4,4,4,4,4,4,5,3,4,4,3,4,3,3,3,3,3,3,5,4,4,4,4,4,2,3,4,3,4,2,3,3,2,4,3,4,2,3,4,4,4,4,4,4,3,4,3,4,4,5,4,4,4,4,3,4,4,2,2,2,2,3,3,4,2,2,2,1,2,4,4,4,4,4,2,3,4,2,2,2,2,2,2,3,3,2,3,3,3,4,4,2,3,4,4,2,3,3,762.28,5,"68enydybgf27a1g6",NA,NA,"..","/survey/selfserve/53b/g004/230372?list=1&ID=241183254226122","68enydybgf27a1g6","241183254226122",14.6975666666667,12.7046666666667,5,102013,"01-10-2013",2013-10-01,115,9,7,9.07,3593,2013,10,4,3,3.66666666666667,3.66666666666667,2,4.5,3,1.5,3.5,2.5,3,3,3,5.2,2.2,3,3.33333333333333,2.75,3.4,4.11111111111111,3.66666666666667,4.66666666666667,4,3.66666666666667,1,3.4,3,3.66666666666667,3,3.66666666666667,3.2,3.45454545454545,4,3.33333333333333,2.66666666666667,4,4,4,4,4,3.5,4,4,4,4,52.83,54.05,53.98,60.77,55.62,55.25,31.62,52.42,49.5154705,39.3987205,73.3956014,64.0272114,0.888888888888889,2,2,4,2,2.25,1.83333333333333,4.11111111111111,4.33333333333333,4,4,52.83,48.33,53.98,53.35,55.62,55.25,41.53,52.42,57.9179033,47.8011533,66.2341896,56.8657996,0.666666666666667,2,3,4,4,2.66666666666667,3,2.5,3.75,3.90909090909091,4,3.66666666666667,4,3.91666666666667,4,4,4,3.66666666666667,3,3.4,4,3,3.75,3.66666666666667,4,3,3.92307692307692,4,3.75,4,2.71428571428571,2.66666666666667,1.5,2.92857142857143,4,2.75,2,2,3,3,2.66666666666667,3,3.25,3.25,2.2,3,4,4.33333333333333,4,3,3.66666666666667,2.5
"20",33,"j5k7su1w4f77met0","02/27/2023 12:25","qualified,/Gender/X0TrF,/Age/b3xfu,/Total/Total",3,1,1,1,1,1,1,2,62,2,3,"",4,1,"",1,1,3,8.2011,40,40,2,NA,NA,NA,4,"","Multifunktionell",5,15,5,1,NA,NA,NA,NA,NA,NA,NA,NA,NA,NA,NA,NA,NA,NA,NA,NA,NA,NA,NA,NA,NA,NA,NA,NA,NA,2,3,4,4,4,3,3,3,3,4,4,3,3,4,4,3,3,4,4,5,2,3,1,2,2,1,3,1,7,4,4,4,1,3,2,2,2,1,3,3,1,1,1,1,1,3,3,3,1,2,3,3,3,3,3,2,3,3,3,4,4,2,4,1,1,1,4,4,4,4,3,1,1,1,1,3,3,5,3,5,4,4,4,3,2,75,40,3,3,2,3,3,2,4,6,4,4,4,3,2,4,4,4,4,4,4,4,6,3,6,6,4,3,4,3,2,4,3,3,2,3,0,0,0,0,0,0,0,0,0,4,4,4,4,4,3,3,3,3,3,4,1,1,1,3,3,5,3,3,3,2,2,2,2,3,3,3,3,3,2,4,2,4,4,4,1,1256.453,4,NA,12,NA,5,6,"02/27/2023 12:03",NA,NA,NA,1,"Mozilla/5.0 (Windows NT 10.0; Win64; x64; rv:109.0) Gecko/20100101 Firefox/110.0","6pfn20bfdj3k687n","cv8c1841crrd0ddn",NA,NA,"..","/survey/selfserve/53b/g004/230146?list=1&ID=237111539453040","cv8c1841crrd0ddn","237111539453040",396,2023-04-14 09:51:00,3,1,1,1,1,1,1,2,62,2,"",2,"",2,6,5,3,3,3,3,2,3,3,3,4,3,3,2,4,1,4,2,3,3,2,3,3,2,4,2,4,2,2,2,3,1,2,NA,NA,"",NA,"",NA,NA,NA,"",1,1,NA,NA,NA,NA,NA,NA,NA,NA,NA,"",NA,"",1,0,0,0,0,0,1,1,0,0,"","",2,NA,NA,"",2,NA,NA,NA,NA,NA,"",0,2,NA,NA,NA,"",1,1,2,"",NA,NA,NA,"","","",1,1,2,"",NA,NA,NA,"","","",1,1,2,"",NA,NA,NA,"","","",1,1,2,"",NA,NA,NA,"","","",1,1,2,"",NA,NA,NA,"","","",4,4,2,"",NA,NA,NA,"","","",1,1,2,"",NA,NA,NA,"","","",1,1,2,"",NA,NA,NA,"","","",5,5,2,"",NA,NA,NA,NA,"",NA,3,3,2,"",NA,NA,NA,"",3,3,2,"",NA,NA,NA,"","","",3,3,2,"",NA,NA,NA,"","","",1,1,2,"",NA,NA,NA,"","","",1,1,2,"",NA,NA,NA,NA,"","",3,1,2,"",NA,NA,NA,NA,"","",1,1,0,0,0,1,0,0,0,0,0,0,"",0,0,0,1,0,0,0,0,0,0,"",0,0,0,1,0,0,0,0,0,0,"",2,1,NA,NA,NA,NA,2,NA,NA,NA,"",1,1,2,NA,2,2,2,2,1,2,2,"",4,3,4,2,90,50,1,4,4,4,4,5,3,3,3,4,3,4,2,2,2,4,4,4,3,3,3,3,3,3,3,3,3,3,3,3,4,4,4,3,3,3,4,3,4,4,4,3,4,3,2,4,4,4,2,2,4,3,3,3,5,5,3,4,3,3,3,4,4,3,3,3,2,3,3,1,1,1,3,3,2,4,1,2,2,2,2,2,1,2,2,3,2,3,1,1,1,1,1,2,1,2,2,1,3,1,1,1,2,2,1,3,4,3,3,1,1525.79,5,"gzr089b4qszf67te",NA,NA,"..","/survey/selfserve/53b/g004/230372?list=1&ID=241166931202299","gzr089b4qszf67te","241166931202299",20.9408833333333,25.4298333333333,10,82011,"01-08-2011",2011-08-01,141,11,9,11.09,4385,2011,12,3.66666666666667,3.5,3,3.66666666666667,3.5,3.5,3.5,4.5,2.5,1.5,2,1.5,1,4,2,2,1,1.75,2.4,2.88888888888889,3,2.66666666666667,3,3.66666666666667,1,3.8,3,4.33333333333333,3,4.33333333333333,2.8,3.54545454545455,4,3,3.33333333333333,2.41666666666667,1,3.66666666666667,3,2,2.83333333333333,2,2,2,2.33333333333333,22.81,30.31,28.32,40.07,45.16,49.47,31.62,29.25,45.1536972,35.0369472,38.4759988,29.1076088,4.55555555555556,3,2,3,2.9,2.25,3.33333333333333,0,0,0,0,32.56,40.07,38.71,47.67,45.16,49.47,41.53,38.09,52.1501767,42.0334267,48.5346992,39.1663092,2.88888888888889,4,2,2,3,2.5,2.25,2.625,1.75,3.72727272727273,4.2,3,3.66666666666667,3,2,4,3,3,3,3.46666666666667,4,4,3.75,4,3,3,3.53846153846154,3.2,4.25,3.25,2,2.33333333333333,2,1.64285714285714,2,1.75,1.25,1,3,1.6,1.66666666666667,1.66666666666667,1.5,3.25,1.8,1,3,4,3,3.33333333333333,4,3
"21",34,"k5hxzhyj5mez0gxx","02/27/2023 12:18","qualified,/Gender/p47uy,/Age/gcKvr,/Total/Total",3,1,1,1,1,1,1,1,25,1,5,"",5,1,"",1,1,3,8.2019,40,40,2,NA,NA,NA,10,"","Zahnmedizinische Fachangestellte",3,10,3,1,NA,NA,NA,NA,NA,NA,NA,NA,NA,NA,NA,NA,NA,NA,NA,NA,NA,NA,NA,NA,NA,NA,NA,NA,NA,2,3,4,3,5,4,4,4,4,4,4,4,2,1,4,4,2,3,1,2,3,3,2,2,2,4,4,3,3,9,10,6,10,3,4,4,5,4,5,5,4,3,3,4,5,5,5,5,1,3,4,4,3,3,4,3,3,3,3,3,1,2,2,2,2,2,3,3,3,1,3,2,1,1,1,1,1,1,1,1,5,1,1,1,NA,NA,0,1,1,1,1,1,3,8,4,3,3,4,3,4,2,2,3,4,5,4,4,4,2,4,3,4,2,3,4,4,3,3,3,2,3,4,3,2,1,4,4,4,3,1,2,4,3,3,2,2,2,3,2,1,3,3,3,3,4,5,5,2,2,3,2,2,2,4,4,4,3,3,3,3,3,3,3,3,4,1,735.615,14,NA,10,NA,1,2,"02/27/2023 12:05",NA,NA,NA,1,"Mozilla/5.0 (Linux; Android 13; SM-G988B) AppleWebKit/537.36 (KHTML, like Gecko) Chrome/108.0.0.0 Mobile Safari/537.36","6zedfr7hb1w4uv7u","qaktzbjbcg95wbvc",NA,NA,"sa","/survey/selfserve/53b/g004/230146?list=1&ID=237111539460324","awacdafnvk18hfa2","237111539460324",433,2023-04-14 12:57:00,3,1,1,1,1,1,1,1,24,2,"",2,"",4,4,5,4,4,5,4,4,5,5,2,4,5,5,3,3,1,5,4,4,4,1,4,5,4,4,1,4,5,4,1,3,1,2,NA,NA,"",NA,"",NA,NA,NA,"",3,3,NA,NA,NA,NA,NA,NA,NA,NA,NA,"",NA,"",0,0,0,0,0,0,0,1,0,0,"","",1,3,NA,"",2,NA,NA,NA,NA,NA,"",1,2,NA,NA,NA,"",1,2,2,"",NA,NA,NA,"","","",5,5,2,"",NA,NA,NA,"","","",5,5,2,"",NA,NA,NA,"","","",4,5,2,"",NA,NA,NA,"","","",2,1,2,"",NA,NA,NA,"","","",2,1,2,"",NA,NA,NA,"","","",4,4,2,"",NA,NA,NA,"","","",5,5,1,"Verstellbare Stühle, Tische und Monitore",2,NA,3,"","Gute Frage. Fällt mir spontan nichts ein","",NA,NA,2,"",NA,NA,NA,NA,"",NA,3,2,2,"",NA,NA,NA,"",1,1,2,"",NA,NA,NA,"","","",5,5,2,"",NA,NA,NA,"","","",5,5,2,"",NA,NA,NA,"","","",5,5,2,"",NA,NA,NA,NA,"","",5,5,2,"",NA,NA,NA,NA,"","",3,2,0,0,0,0,0,0,0,0,0,1,"Keine",1,0,0,0,0,0,0,0,0,0,"",1,0,0,0,0,0,0,0,0,0,"",2,3,2,NA,1,1,1,1,4,NA,"",NA,NA,1,2,2,2,3,4,3,3,2,"",2,2,2,1,0,0,1,3,3,3,2,2,2,2,2,2,1,2,4,4,4,5,5,5,3,2,3,3,3,3,2,2,1,4,4,4,5,5,5,5,5,1,3,4,3,3,3,2,3,2,3,2,2,4,4,4,4,4,3,2,3,5,1,3,2,2,2,2,5,4,4,4,3,3,2,5,3,4,5,1,1,1,1,1,1,4,4,2,5,4,2,5,2,1,2,2,5,5,5,5,1,5,5,5,4,3,3,3,3,2,2,2,4,3,3,2,943.58,1,"qaktzbjbcg95wbvc",NA,NA,"sa","/survey/selfserve/53b/g004/230372?list=1&ID=241183254221951","awacdafnvk18hfa2","241183254221951",12.26025,15.7263333333333,0,82019,"01-08-2019",2019-08-01,45,3,9,3.09,1463,2019,4,3.33333333333333,4.5,4,4,1.5,4,2.5,1.5,3,2,3.33333333333333,3,3,7.6,3.6,4.5,4.33333333333333,4.08333333333333,3.8,3.33333333333333,3.66666666666667,3.33333333333333,3,2.33333333333333,1.25,1,1,1,1,1,1,2.45454545454545,2.8,2.33333333333333,2,3,3,4.66666666666667,2.33333333333333,2,3.5,3,3,2,2.83333333333333,38.41,40.07,38.71,40.07,45.16,29.53,49.59,45.66,56.9672517,46.8505017,44.7838837,35.4154937,3.66666666666667,4,3,3,3.3,3,3.5,2.88888888888889,3.66666666666667,2.33333333333333,2.66666666666667,32.56,30.31,28.32,31.48,35.81,29.53,21.4,21.66,28.8466296,18.7298796,39.0164909,29.6481009,3.55555555555556,5,2,2,3,3.33333333333333,2.5,3.75,3.25,2.18181818181818,2.6,2,1.66666666666667,3.66666666666667,4,5,2.66666666666667,3,2.83333333333333,3.46666666666667,2,2,2.875,2.66666666666667,3.5,4,3.15384615384615,2.4,3,4.25,3.57142857142857,1,4,3.28571428571429,3.6,1.75,5,1,2,3.3,5,2.66666666666667,2.5,3,2,3,1,5,5,2.66666666666667,3,2.5
"22",35,"56vanv0hx3qsqrzy","02/27/2023 13:23","qualified,/Gender/p47uy,/Age/gcKvr,/Total/Total",3,1,1,1,1,1,1,1,40,1,5,"",6,1,"",1,1,6,7.2007,30,30,2,NA,NA,NA,6,"","Analytics Manager",8,13,1,2,4,4,2,2,40,10,7,NA,NA,NA,NA,NA,NA,NA,1,2,2,NA,NA,NA,NA,NA,NA,NA,5,2,3,4,3,3,3,3,4,4,3,4,4,2,2,3,2,1,3,1,1,3,2,3,3,4,4,3,1,9,2,2,7,7,3,3,3,3,4,3,4,2,3,3,3,4,4,3,3,1,2,5,5,4,3,2,1,2,2,5,1,3,4,1,1,1,5,5,5,5,5,5,1,1,1,1,5,5,5,1,5,2,5,1,2,1,100,78,1,1,1,1,1,4,8,2,1,1,2,2,1,1,1,0,5,0,1,0,0,0,4,0,1,5,3,1,3,4,1,5,3,1,2,2,2,1,1,0,4,3,2,5,5,4,5,5,3,3,3,2,3,3,4,4,2,5,4,4,4,4,5,3,2,2,4,3,4,3,3,4,4,2,4,3,3,4,1,1143.12,14,NA,10,NA,1,2,"02/27/2023 12:08",NA,NA,NA,1,"Mozilla/5.0 (Linux; Android 9; SAMSUNG SM-G960F) AppleWebKit/537.36 (KHTML, like Gecko) SamsungBrowser/20.0 Chrome/106.0.5249.126 Mobile Safari/537.36","2zyqd82cyjy3vx2v","vu3qmtujs1wf4s2p",NA,NA,"sa","/survey/selfserve/53b/g004/230146?list=1&ID=237104974310605","xp9x8zmmg8gyg91q","237104974310605",398,2023-04-14 19:27:00,3,1,1,1,1,1,1,1,40,2,"",2,"",4,5,4,3,3,4,4,3,3,3,1,5,3,4,1,1,0,1,1,2,2,5,5,4,4,4,1,4,5,5,2,3,1,2,NA,NA,"",NA,"",NA,NA,NA,"",1,2,NA,NA,NA,NA,NA,NA,NA,NA,NA,"",NA,"",1,0,0,0,0,0,0,1,0,0,"","",2,NA,NA,"",3,NA,NA,NA,NA,NA,"",3,1,1,5,NA,"",NA,NA,1,"Stretching, yoga",1,5,NA,"","","",NA,NA,2,"",NA,NA,NA,"","","",NA,NA,2,"",NA,NA,NA,"","","",5,5,2,"",NA,NA,NA,"","","",1,1,3,"",NA,NA,NA,"","","",1,1,3,"",NA,NA,NA,"","","",4,4,1,"Computer",2,NA,1,"","","",NA,NA,1,"Richtige Schreibtischhöhe",2,NA,5,"Nur vor Ort, nicht im Home Office","","",NA,NA,1,"Excel, teams",1,3,NA,NA,"",NA,NA,NA,2,"",NA,NA,NA,"",4,4,1,"Gleitzeit, Home Office",1,5,NA,"","","",NA,NA,2,"",NA,NA,NA,"","","",3,3,1,"Kinder können im Notfall mitgebracht werden, Ferienbetreuung",2,NA,5,"Home Officd","","",NA,NA,2,"",NA,NA,NA,NA,"","",3,3,2,"",NA,NA,NA,NA,"","",4,4,0,0,0,0,0,0,0,0,0,1,"Gesundheitstag",0,0,0,0,0,1,0,0,0,0,"",0,0,0,0,0,1,0,0,0,0,"",1,1,NA,NA,NA,NA,1,2,NA,2,"",NA,NA,1,2,2,2,3,2,3,2,2,"",5,3,5,3,100,80,5,4,4,3,3,4,2,3,4,4,3,4,4,4,4,5,5,5,3,3,3,2,3,3,2,2,2,2,3,2,3,3,4,4,3,4,3,3,2,3,3,3,3,3,3,4,4,4,2,2,4,4,2,3,2,3,2,3,4,2,3,3,4,2,2,2,2,2,2,2,2,2,3,1,3,2,1,1,1,1,1,4,2,4,3,4,5,1,3,5,1,2,1,1,1,2,2,2,1,4,4,2,2,2,2,3,3,3,3,3,2501.28,1,"vu3qmtujs1wf4s2p",NA,NA,"sa","/survey/selfserve/53b/g004/230372?list=1&ID=241166931195066","xp9x8zmmg8gyg91q","241166931195066",19.052,41.688,2,72007,"01-07-2007",2007-07-01,190,15,10,15.1,5877,2007,16,3.33333333333333,3,3.66666666666667,3.66666666666667,2,2.5,2,1,2.5,3,3.66666666666667,4,1,5.4,3.2,2.75,3.66666666666667,3.16666666666667,2.6,3.22222222222222,4.66666666666667,2,3,5,1,4.2,5,3.66666666666667,5,3.66666666666667,1,3.72727272727273,4.8,3,2.66666666666667,3.58333333333333,3.33333333333333,4.33333333333333,4.33333333333333,2.33333333333333,3.5,4,3,2,3.33333333333333,52.83,54.05,53.98,53.35,55.62,55.25,56.79,52.42,67.7831145,57.6663645,63.5244708,54.1560808,1.11111111111111,1,2,5,2.5,3.25,2,1.88888888888889,1.66666666666667,2.33333333333333,1.66666666666667,38.41,40.07,38.71,40.07,35.81,40.41,41.53,38.09,48.2190475,38.1022975,46.0470509,36.6786609,1.88888888888889,1,2,2,3,3,2.75,3.125,2.5,3.45454545454545,3.6,3,3.66666666666667,3.66666666666667,4,5,3,2.66666666666667,2.16666666666667,3.13333333333333,4,4,3.75,4,3,2,2.53846153846154,2.6,2.5,2.5,2.14285714285714,1.5,1,2.64285714285714,3.4,3.5,1.25,1,5,2.7,2,4.33333333333333,2,3,2.4,1,5,3.33333333333333,3.5,3.33333333333333,2.66666666666667,3
"23",36,"zvuxk41gyunx365g","02/27/2023 12:24","qualified,/Gender/p47uy,/Age/b3xfu,/Total/Total",3,1,1,1,1,1,1,1,58,2,3,"",2,1,"",1,1,2,2.1998,38,7,2,NA,NA,NA,5,"","Bürokraft",4,13,3,2,2,2,1,NA,56,NA,NA,NA,NA,NA,NA,NA,NA,NA,1,NA,NA,NA,NA,NA,NA,NA,NA,NA,NA,2,5,5,5,4,5,5,5,5,5,5,5,1,1,1,1,1,1,1,1,5,5,5,5,4,5,4,1,9,5,3,5,7,5,5,5,5,5,5,5,5,5,5,5,5,5,5,5,5,5,4,5,5,4,4,4,5,5,4,5,5,5,2,2,2,2,5,5,5,5,5,5,1,1,1,5,5,2,2,1,5,2,1,1,1,7,6,6,3,3,3,3,5,10,1,1,1,1,1,1,1,1,0,0,0,0,0,0,0,0,0,1,1,1,1,1,1,1,1,1,1,5,6,6,6,6,6,6,6,6,5,5,5,5,5,5,5,5,5,5,5,5,5,5,5,5,5,5,5,5,5,5,5,5,5,4,5,5,5,4,1,4,1,5,1,1,662.338,4,NA,12,NA,5,6,"02/27/2023 12:13",NA,NA,NA,1,"Mozilla/5.0 (Windows NT 10.0; Win64; x64; rv:109.0) Gecko/20100101 Firefox/110.0","j06f7wrd7b1cp0pa","kdcgjtqwe5gzpq1h",NA,NA,"..","/survey/selfserve/53b/g004/230146?list=1&ID=237111539456162","kdcgjtqwe5gzpq1h","237111539456162",821,2023-04-15 10:13:00,3,1,1,1,1,1,1,1,58,2,"",2,"",5,10,1,1,1,1,1,1,1,1,0,0,0,0,0,0,0,0,0,1,1,1,1,1,1,4,1,5,1,1,1,3,1,1,2,NA,"",NA,"",2,NA,2,"",NA,NA,0,0,0,1,0,0,0,0,0,"",4,"",1,0,1,0,0,0,0,0,0,0,"","",2,NA,NA,"",2,NA,NA,NA,NA,NA,"",3,2,NA,NA,NA,"",2,2,2,"",NA,NA,NA,"","","",2,2,2,"",NA,NA,NA,"","","",2,2,2,"",NA,NA,NA,"","","",2,2,2,"",NA,NA,NA,"","","",2,1,1,"sicherheit am arbeitsplatz",1,5,NA,"","","",NA,NA,2,"",NA,NA,NA,"","","",2,2,1,"Software besser verstehen",1,5,NA,"","","",NA,NA,2,"",NA,NA,NA,"","","",2,2,1,"Weiterentwicklung Technik",1,5,NA,NA,"",NA,NA,NA,1,"Chef",2,NA,2,"",NA,NA,1,"HomeOffice",2,NA,2,"","","",NA,NA,2,"",NA,NA,NA,"","","",3,4,2,"",NA,NA,NA,"","","",3,3,2,"",NA,NA,NA,NA,"","",3,3,2,"",NA,NA,NA,NA,"","",2,2,0,0,0,1,0,0,0,0,0,0,"",0,0,0,1,0,0,0,0,0,0,"",0,0,0,1,0,0,0,0,0,0,"",1,1,NA,NA,NA,NA,2,NA,NA,NA,"",2,2,2,NA,2,2,4,4,4,4,2,"",5,1,3,1,11,13,5,5,5,5,5,5,5,5,5,5,5,5,5,5,5,5,5,5,5,5,5,5,5,5,3,3,3,3,3,3,5,5,5,5,5,5,5,5,5,5,5,5,5,5,5,5,5,5,1,1,4,5,5,5,5,3,4,4,1,5,5,5,5,5,5,5,1,1,1,1,1,1,1,2,1,1,1,1,1,1,1,5,5,5,5,5,5,2,2,4,5,5,5,5,5,5,5,4,1,4,4,4,4,4,4,5,5,5,5,5,899.33,5,"q63qn78s03fmj2nr",NA,NA,"..","/survey/selfserve/53b/g004/230372?list=1&ID=241183254216743","q63qn78s03fmj2nr","241183254216743",11.0389666666667,14.9888333333333,7,21998,"01-02-1998",1998-02-01,303,25,3,25.03,9314,1998,25,5,4.5,5,5,1,1,1,1,5,5,4.33333333333333,4.5,1,5.8,5,5,5,5,5,4.44444444444444,4.66666666666667,4,4.66666666666667,5,2,3,5,1.66666666666667,5,1.66666666666667,3.6,5,5,5,5,5,5,5,5,5,4.83333333333333,5,5,5,4.66666666666667,59.45,54.05,53.98,60.77,61.83,55.25,56.79,52.42,69.432978,59.316228,68.008793,58.640403,0,5,5,5,2.2,3,1.66666666666667,5.88888888888889,5.66666666666667,6,6,59.45,54.05,53.98,60.77,61.83,55.25,56.79,52.42,69.432978,59.316228,68.008793,58.640403,0,5,2,1,3,1.58333333333333,1.75,1.5,4,5,5,5,5,5,5,5,5,5,3,5,5,5,4.875,4.83333333333333,5,5,4.69230769230769,5,4,5,1,1.16666666666667,1,4.5,5,3.25,5,5,5,4.3,4.66666666666667,4.33333333333333,4,5,2.6,1,5,5,5,5,5,5
"24",37,"a5121bgjze8n5vby","02/27/2023 12:37","qualified,/Gender/X0TrF,/Age/gcKvr,/Total/Total",3,1,1,1,1,1,1,2,39,1,5,"",6,1,"",1,1,3,4.2018,40,41,2,NA,NA,NA,12,"Innovationsmanagement","Innovationsmanager",9,10,1,2,4,4,2,2,39,4,1,NA,NA,NA,NA,NA,NA,NA,1,2,2,NA,NA,NA,NA,NA,NA,NA,2,2,5,2,5,4,1,5,5,5,3,5,4,3,1,5,3,2,5,2,2,4,5,2,4,3,3,5,1,4,1,1,10,8,2,4,4,5,3,5,3,5,3,3,4,4,2,5,5,1,5,5,5,5,5,5,5,5,5,5,2,1,2,2,1,1,2,5,5,1,3,4,1,1,1,1,5,4,5,5,5,4,4,1,1,2,50,0,5,5,3,4,1,5,10,1,1,1,1,1,1,1,1,0,0,0,0,0,0,0,0,0,1,5,1,1,1,5,2,4,1,2,2,6,5,5,4,5,5,3,3,5,5,5,5,5,5,4,4,2,2,4,4,4,2,5,5,5,5,5,5,5,4,4,5,5,4,5,5,4,5,3,3,3,4,2,1,1327.135,4,NA,10,NA,5,6,"02/27/2023 12:14",NA,NA,NA,1,"Mozilla/5.0 (Windows NT 10.0; Win64; x64) AppleWebKit/537.36 (KHTML, like Gecko) Chrome/110.0.0.0 Safari/537.36 Edg/110.0.1587.56","1pv0w1y9ns0mpqva","e2dv66ehv9xvt9rw",NA,NA,"..","/survey/selfserve/53b/g004/230146?list=1&ID=237104974331036","e2dv66ehv9xvt9rw","237104974331036",961,2023-04-17 06:45:00,3,1,1,1,1,1,1,2,39,2,"",2,"",4,10,1,1,1,1,1,1,1,1,0,0,0,0,0,0,0,0,0,2,1,1,1,1,1,5,1,5,3,4,1,2,1,2,NA,NA,"",NA,"",NA,NA,NA,"",1,1,NA,NA,NA,NA,NA,NA,NA,NA,NA,"",NA,"",0,0,0,0,0,0,0,0,1,0,"","",1,4,NA,"",2,NA,NA,NA,NA,NA,"",2,2,NA,NA,NA,"",3,5,2,"",NA,NA,NA,"","","",4,5,2,"",NA,NA,NA,"","","",4,5,1,"Obstkorb",1,4,NA,"","","",NA,NA,2,"",NA,NA,NA,"","","",1,1,2,"",NA,NA,NA,"","","",1,5,2,"",NA,NA,NA,"","","",2,5,2,"",NA,NA,NA,"","","",1,5,1,"Höhenverstellbarer Tisch",1,5,NA,"","","",NA,NA,2,"",NA,NA,NA,NA,"",NA,1,5,2,"",NA,NA,NA,"",1,5,1,"flexible Arbeitszeit",1,5,NA,"","","",NA,NA,2,"",NA,NA,NA,"","","",5,5,2,"",NA,NA,NA,"","","",1,1,2,"",NA,NA,NA,NA,"","",3,1,2,"",NA,NA,NA,NA,"","",5,5,0,0,0,1,0,0,0,0,0,0,"",0,1,1,0,0,0,0,1,1,0,"",1,1,1,1,0,1,1,1,1,0,"",1,1,NA,NA,NA,NA,1,2,NA,2,"",NA,NA,3,NA,2,1,4,2,4,1,2,"",3,1,4,2,50,0,5,5,5,5,5,5,5,5,5,5,5,5,3,3,2,5,5,5,5,5,5,5,5,5,2,3,2,3,2,3,5,5,5,5,5,5,5,5,5,5,5,4,5,5,3,4,4,4,2,2,3,4,4,4,5,5,3,5,1,5,5,3,5,5,5,5,1,1,1,1,1,1,1,2,1,3,2,3,1,1,1,5,4,5,4,4,2,4,1,1,5,5,5,4,1,5,3,4,2,1,1,1,3,2,1,3,5,3,3,3,1290.2,5,"vy8rbvvkmu17dxbf",NA,NA,"..","/survey/selfserve/53b/g004/230372?list=1&ID=241183254224034","vy8rbvvkmu17dxbf","241183254224034",22.1189166666667,21.5033333333333,0,42018,"01-04-2018",2018-04-01,61,5,1,5.01,1950,2018,5,4,2.5,5,4,2,4,3.5,2,4.5,3,3.66666666666667,3,1,4.8,3,4.75,3.66666666666667,3.75,3.6,5,5,5,5,2.66666666666667,1,4.8,4.5,5,4.5,5,3.6,4.18181818181818,5,4.33333333333333,2.66666666666667,4.41666666666667,3.33333333333333,5,5,4.33333333333333,4.66666666666667,3,3,4,3.66666666666667,59.45,54.05,53.98,60.77,61.83,55.25,56.79,52.42,69.432978,59.316228,68.008793,58.640403,0,1,1,4,1.7,1.75,1.66666666666667,4.22222222222222,4,5,3.66666666666667,59.45,54.05,53.98,60.77,61.83,55.25,56.79,52.42,69.432978,59.316228,68.008793,58.640403,0,5,1,1,4,2,1.75,2.125,2.75,5,5,5,5,4.41666666666667,2.66666666666667,5,5,5,2.5,4.8,4,4,3.875,3.83333333333333,4,5,4.61538461538461,4.4,4.5,5,1,2,1,3.57142857142857,4.4,2,4.75,1,4,2.5,4,2,1.75,3.5,1.6,1,5,5,5,5,5,4.25
"25",39,"2fz6hd38p2zkgbp3","02/27/2023 12:33","qualified,/Gender/X0TrF,/Age/b3xfu,/Total/Total",3,1,1,1,1,1,1,2,63,2,3,"",2,2,"",1,1,4,2.2001,40,45,2,NA,NA,NA,1,"","Elektro - Installateur",7,10,1,2,2,2,1,NA,60,NA,NA,NA,NA,NA,NA,NA,NA,NA,1,NA,NA,NA,NA,NA,NA,NA,NA,NA,NA,2,3,4,5,5,5,5,5,5,5,4,5,4,3,2,2,3,1,4,1,4,4,3,3,3,4,4,1,6,7,7,8,6,4,4,5,4,5,5,5,4,4,4,5,5,4,3,3,5,3,4,5,5,5,5,5,5,5,5,5,3,2,2,1,1,2,4,5,2,1,1,1,1,1,1,2,1,1,3,5,1,1,5,5,NA,NA,0,2,2,1,6,1,5,8,3,3,3,2,2,1,1,1,0,0,0,0,0,0,0,0,0,1,3,1,1,1,3,1,2,1,4,4,4,4,4,4,4,4,4,3,5,5,4,5,5,5,4,4,2,4,5,5,5,3,5,5,5,5,5,5,4,4,4,5,5,5,5,5,5,5,5,5,5,5,5,1,913.577,4,NA,10,NA,5,6,"02/27/2023 12:18",NA,NA,NA,1,"Mozilla/5.0 (Windows NT 10.0; Win64; x64) AppleWebKit/537.36 (KHTML, like Gecko) Chrome/110.0.0.0 Safari/537.36","w038when8pxax7s0","xtvsbm80q21fapx8",NA,NA,"..","/survey/selfserve/53b/g004/230146?list=1&ID=237111539449892","xtvsbm80q21fapx8","237111539449892",617,2023-04-14 15:30:00,3,1,1,1,1,1,1,2,63,2,"",2,"",4,4,5,4,3,4,3,1,1,1,0,0,1,0,0,0,0,0,0,3,1,1,1,1,1,5,1,1,1,2,1,2,1,2,NA,NA,"",NA,"",NA,NA,NA,"",3,3,NA,NA,NA,NA,NA,NA,NA,NA,NA,"",NA,"",0,0,0,0,0,0,1,0,0,0,"","",2,NA,NA,"",2,NA,NA,NA,NA,NA,"",0,2,NA,NA,NA,"",3,3,2,"",NA,NA,NA,"","","",2,2,2,"",NA,NA,NA,"","","",2,1,2,"",NA,NA,NA,"","","",1,1,2,"",NA,NA,NA,"","","",1,1,1,"Erste Hilfe",1,4,NA,"","","",NA,NA,2,"",NA,NA,NA,"","","",1,1,1,"Personenbeförderungsscheine",1,5,NA,"","","",NA,NA,2,"",NA,NA,NA,"","","",1,1,2,"",NA,NA,NA,NA,"",NA,1,1,2,"",NA,NA,NA,"",1,1,2,"",NA,NA,NA,"","","",1,1,2,"",NA,NA,NA,"","","",1,1,2,"",NA,NA,NA,"","","",1,1,2,"",NA,NA,NA,NA,"","",1,1,2,"",NA,NA,NA,NA,"","",1,1,0,0,0,0,0,0,0,0,0,1,"keine davon",0,0,0,1,0,0,0,0,0,0,"",0,0,0,1,0,0,0,0,0,0,"",2,1,NA,NA,NA,NA,2,NA,NA,NA,"",4,5,2,NA,2,2,4,4,4,2,2,"",1,1,2,1,0,0,1,5,4,5,5,5,5,4,5,4,4,5,5,4,4,5,5,5,5,5,4,4,5,5,3,3,4,2,3,3,5,5,5,5,5,4,4,4,5,4,5,4,4,4,4,5,5,5,2,2,5,4,3,4,5,5,3,4,2,4,5,5,5,5,5,5,1,1,1,1,1,1,1,2,1,2,2,3,1,1,1,5,4,4,5,5,2,2,2,2,4,4,3,4,5,3,2,1,1,1,1,1,1,1,1,1,1,1,1,1,1056.58,5,"xtvsbm80q21fapx8",NA,NA,"..","/survey/selfserve/53b/g004/230372?list=1&ID=241183254200346","xtvsbm80q21fapx8","241183254200346",15.2262833333333,17.6096666666667,0,22001,"01-02-2001",2001-02-01,267,22,3,22.03,8218,2001,22,4,5,5,4.66666666666667,3.5,2,2,2.5,4,3,3.66666666666667,3.5,1,6.8,4.2,4.5,5,4.5,3.6,4.88888888888889,4.66666666666667,5,5,1.33333333333333,1,2.4,1.5,3,1.5,3,2.4,4.36363636363636,4.8,4.33333333333333,3.66666666666667,4.58333333333333,4.33333333333333,5,5,4,5,1,1,1,3,46.43,40.07,38.71,53.35,55.62,55.25,56.79,52.42,72.8333789,62.7166289,50.4313551,41.0629651,0,3,3,2,1.6,1.75,1.5,3.88888888888889,4,4,3.66666666666667,32.56,30.31,38.71,40.07,45.16,55.25,56.79,52.42,71.8476664,61.7309164,39.0873378,29.7189478,0.111111111111111,5,1,5,4,2,1.75,2.125,3.5,4.63636363636364,4.8,4.66666666666667,4.33333333333333,4.66666666666667,4.33333333333333,5,4.66666666666667,4.66666666666667,3,4.46666666666667,4,4,4.375,4.66666666666667,3.5,4,4.53846153846154,4.4,4.25,5,1,1.83333333333333,1,3.64285714285714,4.6,2,3.75,5,5,1.7,2,2.33333333333333,1,1,1.6,1,1,5,5,4,4.66666666666667,4
"26",40,"kjkksp99db9v7s8c","02/28/2023 14:34","qualified,/Gender/X0TrF,/Age/gcKvr,/Total/Total",3,1,1,1,1,1,1,2,35,1,5,"",5,1,"",2,1,6,1.202,40,44,2,NA,NA,NA,1,"","Field Service Ingenieur",8,10,1,2,2,2,1,NA,30,NA,NA,NA,NA,NA,NA,NA,NA,NA,1,NA,NA,NA,NA,NA,NA,NA,NA,NA,NA,2,4,4,3,3,3,3,3,3,3,3,3,4,3,3,4,3,4,4,3,3,3,3,3,4,3,4,3,4,4,5,5,9,4,3,3,3,4,4,4,4,3,3,3,4,3,3,3,3,4,4,4,4,3,3,3,4,4,4,4,4,4,4,4,4,4,5,5,4,4,4,4,4,4,4,4,4,5,5,4,4,4,2,4,2,20,0,5,5,5,5,5,4,9,1,1,1,1,1,1,1,1,0,0,0,0,0,0,0,0,0,1,1,1,1,1,1,1,1,1,1,4,4,5,5,4,4,5,5,4,4,4,4,4,4,4,4,4,4,4,4,4,4,4,4,4,4,4,4,4,4,4,4,4,5,4,5,4,5,4,4,4,4,5,5,1,27196.67,4,NA,10,NA,5,6,"02/27/2023 12:25",NA,NA,NA,1,"Mozilla/5.0 (Windows NT 10.0; Win64; x64) AppleWebKit/537.36 (KHTML, like Gecko) Chrome/110.0.0.0 Safari/537.36","428vv5jg0eqf27eh","b2bjcc47j4c2btya",NA,NA,"..","/survey/selfserve/53b/g004/230146?list=1&ID=237111539453036","289qemyj7j959pdn","237111539453036",506,2023-04-14 14:54:00,3,1,1,1,1,1,1,2,35,2,"",2,"",4,9,1,1,1,1,1,1,1,1,0,1,1,1,0,0,0,1,1,1,1,1,1,1,1,1,1,1,1,1,1,1,1,1,2,NA,"",NA,"",1,4,NA,"",NA,NA,0,1,0,1,0,0,0,0,0,"",1,"",1,0,0,0,0,0,0,0,0,0,"","",1,2,2,"",1,5,5,1,4,NA,"",3,1,2,NA,2,"",NA,NA,1,"zfdj fh sdg df",1,3,NA,"","","",NA,NA,1,"asg d fsdf s",2,NA,2,"","","",NA,NA,2,"",NA,NA,NA,"","","",3,2,3,"",NA,NA,NA,"","","",2,1,1,"asg as sagsdfg s",2,NA,2,"","","",NA,NA,2,"",NA,NA,NA,"","","",3,2,2,"",NA,NA,NA,"","","",5,5,1,"asg as gsdf",1,3,NA,"","","",NA,NA,2,"",NA,NA,NA,NA,"",NA,2,2,3,"",NA,NA,NA,"",3,3,2,"",NA,NA,NA,"","","",5,5,1,"s hsfgh df",2,NA,2,"","","",NA,NA,2,"",NA,NA,NA,"","","",5,3,2,"",NA,NA,NA,NA,"","",1,1,2,"",NA,NA,NA,NA,"","",3,3,0,0,1,1,1,1,0,0,0,0,"",0,1,0,0,0,0,0,0,0,0,"",0,0,0,0,0,1,1,1,0,0,"",2,1,NA,NA,NA,NA,1,1,5,NA,"",NA,NA,2,NA,2,1,3,4,2,4,2,"",5,5,2,2,20,0,3,3,3,3,3,3,3,3,3,3,3,3,2,2,2,3,3,3,2,2,3,2,3,2,3,3,3,3,3,3,5,4,4,4,5,5,4,4,4,4,5,5,5,5,4,4,4,5,5,4,4,4,4,4,4,5,5,5,4,4,4,5,5,5,4,4,1,1,1,1,1,1,1,2,2,2,2,2,2,1,1,5,4,4,4,5,5,5,4,4,4,5,5,4,4,5,5,5,4,4,4,5,5,5,4,5,5,5,5,3,5898.61,5,"289qemyj7j959pdn",NA,NA,"..","/survey/selfserve/53b/g004/230372?list=1&ID=241183254211778","289qemyj7j959pdn","241183254211778",453.277833333333,98.3101666666667,0,12020,"01-01-2020",2020-01-01,40,3,4,3.04,1310,2020,3,3.66666666666667,3,3,3,3.5,3.5,3.5,3.5,3,3,3.66666666666667,3.5,3,5.4,3.4,3.5,3.66666666666667,3.5,3.2,3.66666666666667,4,3,4,4,4,4.4,4,4.66666666666667,4,4.66666666666667,5,4,4,4,4,4,4,4,4,4,4.5,2,2,1,3,59.45,54.05,53.98,60.77,61.83,55.25,56.79,52.42,69.432978,59.316228,68.008793,58.640403,0,5,5,5,2.2,3,1.66666666666667,4.44444444444444,4,5,4.33333333333333,59.45,54.05,53.98,60.77,61.83,55.25,56.79,52.42,69.432978,59.316228,68.008793,58.640403,0.555555555555556,5,5,5,5,2.33333333333333,3,2,3.25,3,3,3,3,2.41666666666667,2,3,2.33333333333333,2.33333333333333,3,4.46666666666667,1,2,3.5,3.33333333333333,4,2,4.30769230769231,3.8,4.75,4.5,1,2,1,4.42857142857143,4.4,4.5,4.5,4,2,4.4,5,3.33333333333333,4.75,5,4,3,6,4.33333333333333,4.5,4.33333333333333,4.33333333333333,4.75
"27",41,"88usbamw9wtardbt","02/27/2023 12:47","qualified,/Gender/X0TrF,/Age/gcKvr,/Total/Total",3,1,1,1,1,1,1,2,35,1,5,"",6,1,"",1,1,4,11.2022,39,41,2,NA,NA,NA,5,"","Fachanwendungsbetreuer",5,7,4,1,NA,NA,NA,NA,NA,NA,NA,NA,NA,NA,NA,NA,NA,NA,NA,NA,NA,NA,NA,NA,NA,NA,NA,NA,NA,2,4,3,3,2,2,3,3,4,3,4,3,4,3,2,2,3,4,1,2,3,2,5,4,2,3,1,2,1,1,2,4,2,1,3,3,5,4,3,4,3,4,4,3,4,4,3,2,1,2,4,5,3,4,4,3,4,3,4,3,4,5,5,4,2,5,5,4,3,5,4,2,1,3,2,3,4,5,3,4,4,4,2,1,2,23,0,5,5,4,1,6,4,7,2,2,1,2,2,2,2,2,1,1,1,2,1,1,1,1,1,1,3,3,2,2,1,2,2,1,2,3,3,3,3,4,4,6,4,2,3,3,3,3,3,2,3,2,4,3,2,5,4,4,5,4,5,5,4,4,4,2,3,4,4,5,5,4,4,4,2,3,4,4,4,1,677.408,14,NA,10,NA,1,2,"02/27/2023 12:35",NA,NA,NA,1,"Mozilla/5.0 (Linux; Android 13; SM-A536B) AppleWebKit/537.36 (KHTML, like Gecko) Chrome/110.0.0.0 Mobile Safari/537.36","ha9wxa4cknt9af7b","vmcrusu06qnspjk9",NA,NA,"sa","/survey/selfserve/53b/g004/230146?list=1&ID=237104974323750","vmcrusu06qnspjk9","237104974323750",35,2023-04-07 06:41:00,3,1,1,1,1,1,1,2,35,2,"",2,"",2,9,2,1,2,3,2,1,1,1,1,2,1,0,1,2,0,1,1,2,1,4,5,2,1,1,2,4,2,2,2,2,1,2,NA,NA,"",NA,"",NA,NA,NA,"",5,5,NA,NA,NA,NA,NA,NA,NA,NA,NA,"",NA,"",1,1,0,0,0,1,1,0,0,0,"","",2,NA,NA,"",3,NA,NA,NA,NA,NA,"",2,2,NA,NA,NA,"",4,5,2,"",NA,NA,NA,"","","",3,4,2,"",NA,NA,NA,"","","",5,4,2,"",NA,NA,NA,"","","",5,5,1,"Entwöhnungskurse",2,NA,2,"","","",NA,NA,2,"",NA,NA,NA,"","","",5,5,2,"",NA,NA,NA,"","","",5,5,1,"Bezahltes Studium oder Weiterbildung, aber nur wenn in den Abteilungen zeitliche Kapazitäten frei sind.",2,NA,4,"","","Mitarbeiter müssten Mitspracherechte haben",NA,NA,2,"",NA,NA,NA,"","","",4,5,2,"",NA,NA,NA,NA,"",NA,3,4,2,"",NA,NA,NA,"",4,4,1,"Flexible Arbeitszeiten",1,4,NA,"","","",NA,NA,2,"",NA,NA,NA,"","","",4,5,2,"",NA,NA,NA,"","","",3,1,1,"Es gibt ein Frauenkarriereprogramm. Ich kenne die Details aber nicht.",NA,NA,NA,NA,"","",NA,NA,2,"",NA,NA,NA,NA,"","",3,4,0,0,0,0,1,0,0,0,0,0,"",0,0,0,1,0,0,0,0,0,0,"",0,0,0,1,0,0,0,0,0,0,"",3,1,NA,NA,NA,NA,1,2,NA,4,"Termin steht erst noch an",NA,NA,3,NA,3,1,3,3,3,1,1,"Gesundheit im HomeOffice",4,3,4,2,20,0,4,4,4,4,3,2,2,4,3,5,4,3,3,3,2,5,5,4,2,3,2,3,2,1,2,3,2,2,2,3,5,4,5,4,3,3,4,4,5,5,4,4,5,4,4,4,4,4,2,3,5,3,4,4,5,4,5,4,2,3,4,3,2,3,4,3,3,4,3,5,2,3,3,2,1,1,1,1,1,4,4,2,4,3,4,3,4,1,2,1,1,1,3,4,4,1,1,1,5,2,2,1,2,4,2,1,1,2,1,1,2274.73,5,"yawrqdrda82wjhx4",NA,NA,"..","/survey/selfserve/53b/g004/230372?list=1&ID=240475414779008","yawrqdrda82wjhx4","240475414779008",11.2901333333333,37.9121666666667,0,112022,"01-11-2022",2022-11-01,6,0,6,0.06,275,2022,1,3.33333333333333,2,3.33333333333333,3.33333333333333,3.5,2,3.5,1.5,2.5,4.5,2,2.5,2,2,3.2,3.5,3.66666666666667,3.41666666666667,2.4,3.77777777777778,4,3.66666666666667,3.66666666666667,4,2,3.8,3.5,4,3.5,4,4.2,2.81818181818182,3,2.33333333333333,3,4.08333333333333,4.33333333333333,4.66666666666667,4.33333333333333,3,4.33333333333333,4,2,2,3.16666666666667,52.83,48.33,53.98,53.35,55.62,49.47,49.59,45.66,59.9097785,49.7930285,63.5722442,54.2038542,1.11111111111111,3,5,4,2.5,3,2.16666666666667,3.55555555555556,3.33333333333333,4,3.33333333333333,52.83,54.05,46.92,47.67,55.62,55.25,56.79,52.42,69.1278301,59.0110801,58.1081422,48.7397522,1,2,5,2,4,2.5,3,2.25,2.5,3.45454545454545,3.4,3,4,2.91666666666667,2.66666666666667,4.66666666666667,2.33333333333333,2,2.33333333333333,4.2,4,3,3.875,4,3.5,4,3.69230769230769,3.6,4.5,3,3.28571428571429,1.16666666666667,4,2.64285714285714,3.2,2,2.25,4,1,1.7,1,1.66666666666667,2.25,1.25,4.2,2,3,4.66666666666667,3.5,3.66666666666667,4.66666666666667,4.25
"28",43,"try28qg13ysn4uag","02/27/2023 12:53","qualified,/Gender/X0TrF,/Age/gcKvr,/Total/Total",3,1,1,1,1,1,1,2,42,1,3,"",3,1,"",1,1,6,12.2006,40,50,2,NA,NA,NA,4,"","Logistiker",4,13,3,1,NA,NA,NA,NA,NA,NA,NA,NA,NA,NA,NA,NA,NA,NA,NA,NA,NA,NA,NA,NA,NA,NA,NA,NA,NA,2,3,3,4,4,4,4,3,3,3,3,3,3,4,4,4,4,4,4,4,4,4,4,4,3,4,4,3,10,1,10,10,1,3,3,4,4,4,4,4,4,4,3,4,4,3,4,4,4,4,3,4,4,4,4,4,4,4,4,3,3,5,4,5,4,4,5,5,5,5,5,5,5,5,5,3,3,3,3,3,5,4,3,1,1,94,93,4,4,4,4,4,3,10,3,1,1,1,3,3,3,3,3,2,4,2,0,2,4,3,4,3,4,3,3,3,3,3,3,3,3,2,3,3,3,3,3,3,3,3,5,5,5,5,5,5,5,5,5,5,5,5,5,5,5,5,5,5,5,5,5,5,5,5,5,5,5,5,5,5,5,5,5,5,5,1,782.387,14,NA,10,NA,1,2,"02/27/2023 12:40",NA,NA,NA,1,"Mozilla/5.0 (Linux; Android 13; SM-G990B Build/TP1A.220624.014; wv) AppleWebKit/537.36 (KHTML, like Gecko) Version/4.0 Chrome/109.0.5414.117 Mobile Safari/537.36","m8k63mjct9nxqucy","xyku9h4ecskbxayx",NA,NA,"sa","/survey/selfserve/53b/g004/230146?list=1&ID=237104974335223","zsuv8b6cta41mr9v","237104974335223",914,2023-04-16 18:07:00,3,1,1,1,1,1,1,2,42,1,"keine angaben",2,"",4,10,2,2,2,1,1,2,2,2,4,4,4,4,4,4,4,4,4,2,3,4,1,3,3,3,3,3,3,3,3,3,1,1,2,NA,"",NA,"",1,3,NA,"",NA,NA,1,1,1,1,0,1,1,1,0,"",6,"",1,1,1,1,0,1,1,0,0,0,"","keine angaben",1,2,4,"",2,NA,NA,NA,NA,NA,"",1,2,NA,NA,NA,"",1,1,1,"keine angaben",2,NA,1,"","","",NA,NA,2,"",NA,NA,NA,"","","",NA,NA,1,"keine angaben",1,3,NA,"","","",NA,NA,2,"",NA,NA,NA,"","","",5,5,1,"keine angaben",2,NA,1,"","","",NA,NA,1,"keine angaben",1,3,NA,"","","",NA,NA,1,"keine angaben",1,3,NA,"","","",NA,NA,1,"keine angaben",1,3,NA,"","","",NA,NA,1,"keine angaben",2,NA,1,NA,"",NA,NA,NA,1,"keine angaben",1,3,NA,"",NA,NA,2,"",NA,NA,NA,"","","",3,3,2,"",NA,NA,NA,"","","",3,3,1,"keine angaben",1,3,NA,"","","",NA,NA,1,"keine angaben",NA,NA,NA,NA,"","",NA,NA,2,"",NA,NA,NA,NA,"","",3,3,1,0,0,0,0,0,0,0,0,0,"",0,0,1,0,0,0,0,0,0,0,"",1,0,1,1,0,0,0,0,0,0,"",1,1,NA,NA,NA,NA,1,1,3,NA,"",NA,NA,1,1,1,1,3,3,3,3,2,"",5,5,5,3,50,50,3,5,5,5,5,5,5,5,5,5,5,5,5,5,5,5,5,5,5,5,5,5,5,5,4,4,4,4,4,4,5,5,5,5,5,5,5,5,5,5,5,5,5,5,5,5,5,5,5,5,5,5,5,5,5,5,5,5,5,5,5,5,5,5,5,5,5,5,5,5,5,5,5,5,5,5,5,5,5,3,3,5,5,5,5,5,5,5,5,5,5,5,5,5,5,5,5,5,5,5,5,5,5,5,5,5,5,5,5,3,1525.19,5,"xg81vq9f46v7nm3j",NA,NA,"..","/survey/selfserve/53b/g004/230372?list=1&ID=241183254226115","xg81vq9f46v7nm3j","241183254226115",13.0397833333333,25.4198333333333,-43,122006,"01-12-2006",2006-12-01,197,16,5,16.05,6089,2006,17,3.33333333333333,4,3.33333333333333,3,3.5,4,4,4,4,4,3.66666666666667,3.5,3,6.4,3.4,4,4,3.75,3.8,3.88888888888889,3.66666666666667,4,4,5,5,3,3,3,3,3,4,5,5,5,5,5,5,5,5,5,5,1,1,1,3,46.43,54.05,53.98,60.77,45.16,40.41,41.53,38.09,45.1114156,34.9946656,67.457838,58.089448,2.66666666666667,2,3,3,2.9,3,2.83333333333333,2.88888888888889,2.66666666666667,3,3,52.83,48.33,46.92,60.77,61.83,49.47,49.59,45.66,62.521985,52.405235,63.244816,53.876426,4,2,3,3,3,2.75,3,2.625,3,5,5,5,5,5,5,5,5,5,4,5,1,1,4,3.66666666666667,5,1,4.69230769230769,4.2,5,5,5,5,3,5,5,5,5,5,1,4.6,5,3.66666666666667,5,5,4.4,3,6,5,5,5,5,5
"29",44,"6f8agdfq9e7p5jqb","02/27/2023 13:05","qualified,/Gender/X0TrF,/Age/gcKvr,/Total/Total",3,1,1,1,1,1,1,2,42,1,5,"",4,1,"",1,1,6,5.2022,40,40,2,NA,NA,NA,2,"","Bautechnik",6,11,1,2,5,5,2,3,42,12,8,6,NA,NA,NA,NA,NA,NA,1,2,2,2,NA,NA,NA,NA,NA,NA,1,2,4,5,4,5,5,4,5,3,4,3,5,2,5,4,5,3,2,3,4,3,4,5,5,5,5,5,5,6,6,8,6,7,5,5,4,4,4,3,5,5,4,4,5,4,3,3,5,4,4,3,3,5,3,4,4,5,5,3,3,4,4,4,5,4,3,5,3,3,4,4,5,4,4,3,2,1,1,2,5,5,1,1,5,NA,NA,2,4,4,5,4,5,5,8,4,2,3,3,3,3,4,3,3,5,6,6,5,1,6,6,5,3,4,4,3,5,3,4,3,4,4,5,4,4,5,3,4,5,3,3,4,4,5,4,4,3,3,4,5,3,3,3,4,3,4,3,4,3,3,4,3,3,2,4,3,4,4,4,3,3,5,3,3,5,4,1,1019.727,4,NA,10,NA,5,6,"02/27/2023 12:47",NA,NA,NA,1,"Mozilla/5.0 (Windows NT 10.0; Win64; x64) AppleWebKit/537.36 (KHTML, like Gecko) Chrome/110.0.0.0 Safari/537.36","pp4v1v169sssz3eh","87gwh7d5g0tk1y0v",NA,NA,"..","/survey/selfserve/53b/g004/230146?list=1&ID=237111539466338","87gwh7d5g0tk1y0v","237111539466338",715,2023-04-14 20:20:00,3,1,1,1,1,1,1,2,43,1,"egal",2,"",4,8,3,3,3,3,3,2,3,3,4,3,1,3,1,2,4,3,3,2,2,2,1,4,2,1,3,3,2,2,3,3,2,1,1,3,"",6,"",NA,NA,NA,"",NA,NA,NA,NA,NA,NA,NA,NA,NA,NA,NA,"",NA,"",0,0,0,0,0,1,1,0,0,0,"","",2,NA,NA,"",2,NA,NA,NA,NA,NA,"",1,2,NA,NA,NA,"",3,2,2,"",NA,NA,NA,"","","",3,4,2,"",NA,NA,NA,"","","",3,3,2,"",NA,NA,NA,"","","",3,4,2,"",NA,NA,NA,"","","",3,4,3,"",NA,NA,NA,"","","",3,4,2,"",NA,NA,NA,"","","",3,2,2,"",NA,NA,NA,"","","",3,3,2,"",NA,NA,NA,"","","",3,4,2,"",NA,NA,NA,NA,"",NA,3,2,2,"",NA,NA,NA,"",2,3,2,"",NA,NA,NA,"","","",4,3,3,"",NA,NA,NA,"","","",2,2,2,"",NA,NA,NA,"","","",2,3,3,"",NA,NA,NA,NA,"","",3,4,2,"",NA,NA,NA,NA,"","",3,4,0,1,0,0,0,0,1,0,0,0,"",0,0,0,0,0,1,0,1,0,0,"",0,1,0,0,0,0,1,0,0,0,"",2,1,NA,NA,NA,NA,2,NA,NA,NA,"",2,4,3,NA,2,2,2,3,4,4,2,"",3,2,3,1,69,78,4,3,2,3,4,2,3,3,4,4,2,3,2,3,3,4,4,2,3,3,2,4,3,3,2,3,3,2,3,3,3,4,3,3,4,4,4,3,4,4,2,4,3,3,4,3,4,2,4,4,3,4,3,3,3,3,3,2,3,4,3,2,4,3,4,3,2,3,4,4,4,3,3,4,3,4,2,3,3,4,2,3,2,4,4,4,3,2,4,3,3,5,3,3,2,3,3,3,2,4,3,2,4,3,3,3,2,4,3,4,7139.36,5,"87gwh7d5g0tk1y0v",NA,NA,"..","/survey/selfserve/53b/g004/230372?list=1&ID=241183254227159","87gwh7d5g0tk1y0v","241183254227159",16.99545,118.989333333333,76,52022,"01-05-2022",2022-05-01,12,1,0,1,459,2022,1,4.33333333333333,5,4,4,3.5,4.5,2.5,3.5,3.5,5,5,5,NA,6.6,4.6,4,4.33333333333333,4.33333333333333,3.8,3.88888888888889,3.66666666666667,3.66666666666667,4.33333333333333,3.66666666666667,4,2.2,1.5,2.66666666666667,1.5,2.66666666666667,4.4,3.81818181818182,4.2,3.33333333333333,3.66666666666667,3.25,3.33333333333333,3.66666666666667,3.33333333333333,2.66666666666667,3.66666666666667,1,3,2,2.83333333333333,38.41,48.33,38.71,47.67,45.16,40.41,31.62,38.09,41.7277104,31.6109604,55.0088359,45.6404459,4.77777777777778,2,3,2,3.3,3.5,3.16666666666667,4,4,4.66666666666667,3.33333333333333,46.43,40.07,38.71,47.67,45.16,49.47,41.53,38.09,52.6529642,42.5362142,51.3096701,41.9412801,2.66666666666667,4,5,3,3,2.83333333333333,3.25,2.625,3.25,3,2.8,3.33333333333333,3,3,2.66666666666667,3.33333333333333,2.66666666666667,3.33333333333333,2.66666666666667,3.46666666666667,2,2,2.875,2.66666666666667,3.5,3,3.07692307692308,3,2.75,3.5,3.28571428571429,3.16666666666667,3,3.21428571428571,3.4,3,3.5,2,4,3.2,3,3.66666666666667,3,3,4,1,6,3.33333333333333,3.5,3.66666666666667,3.33333333333333,3.5
"30",45,"g6ektyy863w2sk68","02/27/2023 13:10","qualified,/Gender/X0TrF,/Age/b3xfu,/Total/Total",3,1,1,1,1,1,1,2,65,2,2,"",2,1,"",2,2,3,1.202,40,50,2,NA,NA,NA,1,"","Angebotserstellung, logistik",7,2,1,2,2,2,1,NA,57,NA,NA,NA,NA,NA,NA,NA,NA,NA,1,NA,NA,NA,NA,NA,NA,NA,NA,NA,NA,2,3,4,3,4,1,4,5,5,3,4,4,2,4,3,3,1,3,1,1,4,4,4,3,3,3,4,2,8,6,7,8,9,NA,NA,NA,NA,NA,NA,NA,NA,NA,NA,NA,NA,4,4,4,3,4,4,4,5,5,5,5,5,5,5,4,4,4,3,2,2,3,4,4,3,4,4,1,1,1,1,4,5,2,3,2,5,2,5,5,1,0,0,4,3,3,5,3,5,8,3,3,2,4,3,1,1,1,0,3,0,2,1,0,0,1,0,2,4,3,2,2,4,1,1,1,3,3,3,6,5,5,4,5,4,4,5,5,5,5,5,4,4,5,4,5,5,4,4,3,4,5,4,5,5,5,4,4,4,5,4,4,5,5,5,4,3,4,3,3,3,1,1214.869,4,NA,10,NA,5,6,"02/27/2023 12:49",NA,NA,NA,1,"Mozilla/5.0 (Windows NT 10.0; Win64; x64) AppleWebKit/537.36 (KHTML, like Gecko) Chrome/109.0.0.0 Safari/537.36 OPR/95.0.0.0","2h6j7jkdeddunqqu","08kaph5jddcpu4fu",NA,NA,"..","/survey/selfserve/53b/g004/230146?list=1&ID=237111539457205","08kaph5jddcpu4fu","237111539457205",962,2023-04-17 07:42:00,3,1,1,1,1,1,1,2,65,2,"",2,"",4,5,4,3,2,4,3,1,2,2,0,3,0,0,0,0,0,2,0,2,2,4,3,2,1,5,1,5,1,3,1,4,2,1,2,NA,"",NA,"",2,NA,2,"",NA,NA,1,0,0,0,0,0,0,0,0,"",1,"",0,0,0,0,0,0,1,0,0,0,"","",2,NA,NA,"",3,NA,NA,NA,NA,NA,"",0,2,NA,NA,NA,"",3,3,2,"",NA,NA,NA,"","","",3,4,2,"",NA,NA,NA,"","","",3,3,2,"",NA,NA,NA,"","","",3,4,2,"",NA,NA,NA,"","","",3,1,1,"Kontinuierliche Schulungen im ges. Rahmen",2,NA,2,"","","",NA,NA,2,"",NA,NA,NA,"","","",1,1,1,"Berufsspezifisch",2,NA,2,"","","",NA,NA,1,"Individuelle Arbeitsplätze",1,4,NA,"","","",NA,NA,1,"Weiterbildung allgemein",1,4,NA,NA,"",NA,NA,NA,3,"",NA,NA,NA,"",3,2,1,"Gleitzeit, Freizeit",2,NA,2,"","","",NA,NA,1,"Freizeit, flex. Arbeitszeiten",2,NA,2,"","","",NA,NA,2,"",NA,NA,NA,"","","",3,1,2,"",NA,NA,NA,NA,"","",3,1,2,"",NA,NA,NA,NA,"","",2,1,0,0,0,1,0,0,0,0,0,0,"",0,0,0,1,0,0,0,0,0,0,"",0,0,0,1,0,0,0,0,0,0,"",1,1,NA,NA,NA,NA,1,2,NA,2,"",NA,NA,1,1,1,1,4,4,4,3,2,"",5,5,3,1,0,0,2,5,5,5,5,5,5,4,5,3,3,5,4,4,3,5,5,5,5,5,5,5,5,5,3,2,3,3,3,2,4,4,4,3,4,3,4,4,3,4,4,4,3,4,4,5,4,4,3,3,4,5,3,4,4,4,4,4,2,4,5,5,4,4,4,5,1,1,2,1,1,1,1,1,1,1,1,1,1,1,1,5,5,5,5,4,2,3,3,3,5,5,5,5,2,4,4,3,2,3,3,4,4,5,5,4,4,4,4,4,2626.3,5,"m8tqbnn63fzeedd9",NA,NA,"..","/survey/selfserve/53b/g004/230372?list=1&ID=241183254217788","m8tqbnn63fzeedd9","241183254217788",20.2478166666667,43.7716666666667,0,12020,"01-01-2020",2020-01-01,40,3,4,3.04,1310,2020,3,3.33333333333333,2.5,4.66666666666667,3.66666666666667,3,3,2,1,4,3.5,3.33333333333333,3,2,7.6,NA,NA,NA,NA,3.8,4.77777777777778,4.33333333333333,5,5,3.66666666666667,1,3.2,4.5,2.33333333333333,4.5,2.33333333333333,3.6,4.72727272727273,5,4.33333333333333,4.66666666666667,4.25,3.66666666666667,4.33333333333333,5,4,4.66666666666667,3,3,3,3.33333333333333,46.43,40.07,46.92,40.07,45.16,55.25,56.79,52.42,69.0800301,58.9632801,48.8987326,39.5303426,0.777777777777778,2,2,3,1.9,2,1.83333333333333,4.33333333333333,3.66666666666667,5.33333333333333,4,38.41,40.07,46.92,40.07,45.16,55.25,49.59,45.66,61.0505351,50.9337851,49.1614848,39.7930948,0.555555555555556,2,1,1,2,1.66666666666667,1.25,1.875,3.75,4.54545454545455,5,4.66666666666667,3.66666666666667,4.66666666666667,3.66666666666667,5,5,5,2.66666666666667,3.73333333333333,3,3,3.875,3.83333333333333,4,4,4.23076923076923,4.4,4,4.25,1.14285714285714,1,1,4.07142857142857,4.8,2.75,5,2,4,3.9,3.66666666666667,3.33333333333333,4.5,4,2.8,2,5,4,3.5,3.66666666666667,3.66666666666667,3.75
"31",47,"d6wn74ytzx5fe1kf","02/27/2023 13:11","qualified,/Gender/X0TrF,/Age/b3xfu,/Total/Total",3,1,1,1,1,1,1,2,65,2,5,"",5,3,"",4,1,6,8.198,40,40,2,NA,NA,NA,8,"","Abteilungsleiter",7,10,1,2,2,2,1,NA,64,NA,NA,NA,NA,NA,NA,NA,NA,NA,1,NA,NA,NA,NA,NA,NA,NA,NA,NA,NA,2,2,5,3,4,4,5,5,5,3,5,3,1,1,1,1,1,1,1,1,4,3,5,3,3,3,3,1,5,5,3,9,3,1,3,3,3,3,3,3,3,1,1,3,3,4,1,4,1,2,4,4,4,4,4,4,4,3,4,5,4,2,1,1,1,1,5,5,4,4,4,1,1,1,1,4,4,1,1,1,5,1,1,1,NA,NA,0,1,1,1,1,1,5,5,4,3,3,4,2,1,1,1,0,0,0,0,0,0,0,0,0,1,5,1,1,1,5,1,1,1,3,0,4,4,0,5,3,3,4,0,5,5,4,5,5,4,4,4,4,4,4,4,5,3,5,5,5,5,4,4,5,5,5,5,4,5,5,5,5,5,1,5,1,4,1,1,771,4,NA,10,NA,5,6,"02/27/2023 12:58",NA,NA,NA,1,"Mozilla/5.0 (Windows NT 10.0; Win64; x64) AppleWebKit/537.36 (KHTML, like Gecko) Chrome/110.0.0.0 Safari/537.36","s9dxf2a1zw5jhbya","4t81nuypcp8nezs1",NA,NA,"..","/survey/selfserve/53b/g004/230146?list=1&ID=237111539448858","ybsfxng48k8a7e4n","237111539448858",407,2023-04-14 10:26:00,3,1,1,1,1,1,1,2,65,2,"",2,"",5,7,4,3,3,4,3,2,1,1,0,0,0,0,0,0,0,0,0,1,1,5,1,1,1,5,1,5,1,1,1,5,2,1,2,NA,"",NA,"",1,3,NA,"",NA,NA,1,0,0,0,0,0,0,0,0,"",1,"",0,0,0,0,0,0,0,0,1,0,"","",1,2,3,"",3,NA,NA,NA,NA,NA,"",2,3,NA,NA,NA,"",1,2,2,"",NA,NA,NA,"","","",1,1,2,"",NA,NA,NA,"","","",1,1,2,"",NA,NA,NA,"","","",1,1,3,"",NA,NA,NA,"","","",1,1,1,"um Lehrgänge",2,NA,3,"","keine","",NA,NA,2,"",NA,NA,NA,"","","",1,1,1,"Berufs spezifische",1,4,NA,"","","",NA,NA,1,"um Arbeitsplatzgestaltung",1,5,NA,"","","",NA,NA,2,"",NA,NA,NA,NA,"",NA,1,1,3,"",NA,NA,NA,"",1,1,1,"Homeoffice, gleitende Arbeitszeit",1,5,NA,"","","",NA,NA,3,"",NA,NA,NA,"","","",1,1,2,"",NA,NA,NA,"","","",1,1,2,"",NA,NA,NA,NA,"","",1,1,3,"",NA,NA,NA,NA,"","",1,1,0,0,0,0,0,0,0,0,0,1,"keine",0,0,0,0,0,0,0,0,0,1,"keine",0,0,0,0,0,0,0,0,0,1,"keine",3,2,NA,NA,NA,NA,1,1,4,NA,"",NA,NA,3,NA,3,3,4,3,3,3,2,"",3,3,1,1,0,0,1,5,5,4,5,5,4,4,4,3,4,4,5,5,5,5,5,5,5,4,4,5,5,5,3,3,2,3,3,3,4,3,4,5,5,5,5,3,5,4,4,3,3,3,3,5,5,5,1,1,5,3,3,4,3,4,3,3,1,4,5,4,5,4,3,4,1,1,1,1,1,1,1,1,1,1,1,1,1,1,1,5,3,5,4,5,1,1,1,1,3,3,5,1,5,3,3,1,1,3,3,3,4,4,4,3,4,4,4,5,1059.7,5,"4t81nuypcp8nezs1",NA,NA,"..","/survey/selfserve/53b/g004/230372?list=1&ID=241166931195064","h6rg5d0ymr9v89jb","241166931195064",12.85,17.6616666666667,0,81980,"01-08-1980",1980-08-01,513,42,9,42.09,15707,1980,43,3.33333333333333,4,5,3.66666666666667,1,1,1,1,3.5,4,3,3,1,5,1.8,3,3,2.5,2.4,3.88888888888889,4,4,3.66666666666667,4,1,2.2,4,1,4,1,1,4.36363636363636,4.8,4,4,4.58333333333333,4,5,4.33333333333333,5,4.83333333333333,5,5,5,4.83333333333333,38.41,40.07,38.71,40.07,55.62,55.25,56.79,52.42,72.8755835,62.7588335,44.3166401,34.9482501,0,1,1,3,1.2,1.5,1,2.55555555555556,3,2.33333333333333,2.33333333333333,38.41,40.07,38.71,40.07,45.16,49.47,56.79,52.42,68.9556345,58.8388845,43.1664183,33.7980283,0,1,1,1,1,1,1,1,3.25,4.27272727272727,4.8,4,3.66666666666667,4.83333333333333,5,5,4.33333333333333,5,2.83333333333333,3.93333333333333,5,5,4.5,5,3,5,3.92307692307692,4.4,3.25,4,1,1,1,3.07142857142857,4.4,1,3,5,5,3.3,2.33333333333333,3.66666666666667,3.75,3.75,1.2,1,5,3.66666666666667,5,4.33333333333333,4.33333333333333,3
"32",50,"p64bwsc336155u39","02/27/2023 13:48","qualified,/Gender/X0TrF,/Age/gcKvr,/Total/Total",3,1,1,1,1,1,1,2,34,1,5,"",5,1,"",2,1,4,3.2021,38,40,2,NA,NA,NA,1,"","Leiter Produktionsplanung",8,11,3,1,NA,NA,NA,NA,NA,NA,NA,NA,NA,NA,NA,NA,NA,NA,NA,NA,NA,NA,NA,NA,NA,NA,NA,NA,NA,2,3,4,3,5,2,4,4,5,5,5,5,2,2,2,1,1,3,1,1,2,3,3,3,4,4,3,1,2,6,3,7,9,4,5,4,4,5,3,3,4,4,4,4,5,4,5,4,3,4,4,5,4,4,4,4,4,4,5,4,4,4,2,2,1,4,5,4,4,4,3,1,1,1,1,4,5,2,4,2,5,2,1,1,2,5,0,4,5,2,1,2,4,8,3,1,2,1,2,2,2,1,1,0,0,1,0,0,0,1,1,1,4,1,1,1,5,1,2,1,1,4,4,4,4,4,5,5,4,4,4,4,5,4,5,4,4,4,3,3,4,4,4,5,4,4,4,4,4,3,4,4,4,4,4,4,5,4,4,3,2,4,3,3,3,1,1329.367,4,NA,10,NA,5,6,"02/27/2023 13:25",NA,NA,NA,1,"Mozilla/5.0 (Windows NT 10.0; Win64; x64) AppleWebKit/537.36 (KHTML, like Gecko) Chrome/110.0.0.0 Safari/537.36","e1r4s93j5bv1vy0k","zyyrkqjst8uzk7wu",NA,NA,"..","/survey/selfserve/53b/g004/230146?list=1&ID=237111539451984","sdxq861d70eapyk9","237111539451984",543,2023-04-14 14:12:00,3,1,1,1,1,1,1,2,34,2,"",2,"",4,8,2,1,1,1,3,1,3,2,1,1,1,1,1,1,0,0,1,2,1,1,1,1,1,1,1,1,1,1,1,4,1,1,1,6,"keine",1,"",NA,NA,NA,"",NA,NA,NA,NA,NA,NA,NA,NA,NA,NA,NA,"",NA,"",0,0,0,0,0,0,1,0,0,0,"","",1,2,5,"es gibt nur die betriebsärztliche untersuchung",2,NA,NA,NA,NA,NA,"",0,2,NA,NA,NA,"",1,1,2,"",NA,NA,NA,"","","",3,3,2,"",NA,NA,NA,"","","",1,1,2,"",NA,NA,NA,"","","",3,3,2,"",NA,NA,NA,"","","",3,1,1,"wöchentliche sicherheitsschulungen, updates bei problemen",2,NA,2,"","","",NA,NA,2,"",NA,NA,NA,"","","",3,3,2,"",NA,NA,NA,"","","",3,3,1,"verstellbare tische, fußauflagen, ergnomische mäuse und tastaturen auf wunsch",1,4,NA,"","","",NA,NA,2,"",NA,NA,NA,NA,"",NA,3,2,3,"",NA,NA,NA,"",2,1,1,"teilzeit, homeoffice, gleitzeit",1,4,NA,"","","",NA,NA,3,"",NA,NA,NA,"","","",2,2,2,"",NA,NA,NA,"","","",2,2,2,"",NA,NA,NA,NA,"","",2,1,2,"",NA,NA,NA,NA,"","",1,1,0,0,0,1,0,0,0,0,0,0,"",0,0,0,1,0,0,0,0,0,0,"",0,0,0,1,0,0,0,0,0,0,"",1,1,NA,NA,NA,NA,1,1,2,NA,"",NA,NA,1,1,1,3,3,3,2,3,2,"",4,3,3,1,3,0,1,5,5,4,4,5,4,3,4,4,4,5,4,5,4,4,4,4,5,4,4,4,4,4,2,2,1,2,2,2,4,3,2,3,4,3,1,4,3,3,2,3,3,3,2,3,4,4,2,2,4,4,3,3,4,5,3,4,3,3,3,4,4,4,2,4,2,1,2,2,2,1,1,1,1,2,1,1,1,1,1,4,4,5,4,4,4,2,2,2,3,3,4,3,5,4,3,3,1,1,2,2,2,4,3,3,3,4,4,3,1097.88,5,"zyyrkqjst8uzk7wu",NA,NA,"..","/survey/selfserve/53b/g004/230372?list=1&ID=241183254208652","sdxq861d70eapyk9","241183254208652",22.1561166666667,18.298,0,32021,"01-03-2021",2021-03-01,26,2,2,2.02,885,2021,2,3.33333333333333,3.5,4.33333333333333,5,2,1.5,2,1,2.5,3,3.66666666666667,4,1,5.4,4,3.75,4.66666666666667,4.08333333333333,4,4.22222222222222,4.33333333333333,4,4.33333333333333,3.66666666666667,1,3.4,4.5,2.66666666666667,4.5,2.66666666666667,2.8,4,4.4,4,3.33333333333333,4,4.33333333333333,4,3.66666666666667,4,4.16666666666667,4,3,3,3.33333333333333,46.43,54.05,46.92,60.77,55.62,49.47,49.59,52.42,62.1632435,52.0464935,63.3071248,53.9387348,0.444444444444444,2,1,5,1.6,2,1.33333333333333,4.22222222222222,4,4.33333333333333,4.33333333333333,52.83,54.05,53.98,60.77,45.16,55.25,41.53,45.66,51.3800669,41.2633169,69.18797,59.81958,0.777777777777778,5,5,5,2,2.08333333333333,2.25,2,2.75,4.27272727272727,4.6,3.66666666666667,4.33333333333333,4.16666666666667,4.33333333333333,4,4.33333333333333,4,1.83333333333333,2.86666666666667,4,4,3.75,3.83333333333333,3.5,3,3.53846153846154,3.2,4,3.5,1.57142857142857,1.16666666666667,1,3.5,4.2,2.5,3.25,5,5,2.9,3.33333333333333,2.66666666666667,2.75,3.5,2.6,1,5,3,3.5,2.66666666666667,2.66666666666667,2.75
"33",51,"vwx08a32gtzzyf6p","02/27/2023 13:47","qualified,/Gender/p47uy,/Age/gcKvr,/Total/Total",3,1,1,1,1,1,1,1,48,1,5,"",3,4,"",1,2,3,4.2022,40,40,2,NA,NA,NA,11,"","Vertrieb",9,6,4,1,NA,NA,NA,NA,NA,NA,NA,NA,NA,NA,NA,NA,NA,NA,NA,NA,NA,NA,NA,NA,NA,NA,NA,NA,NA,2,4,5,4,4,4,4,4,4,4,2,3,3,2,3,3,2,3,1,2,2,3,3,3,3,3,4,3,7,4,4,5,5,NA,NA,NA,NA,NA,NA,NA,NA,NA,NA,NA,NA,2,4,3,1,2,4,4,4,4,4,4,4,4,4,3,2,3,3,1,4,3,4,4,5,5,5,2,1,1,1,4,5,4,5,4,4,4,2,3,2,59,25,7,6,6,7,7,3,7,4,1,3,1,5,4,4,4,3,3,5,0,1,1,0,1,1,2,5,1,1,3,3,2,3,3,3,3,3,4,4,3,3,4,2,2,4,4,4,4,4,4,4,4,3,3,3,5,5,4,5,5,5,5,5,5,5,3,4,4,4,4,5,4,4,4,3,3,3,3,3,1,1140.708,12,NA,11,NA,1,1,"02/27/2023 13:27",NA,NA,NA,1,"Mozilla/5.0 (iPhone; CPU iPhone OS 13_3 like Mac OS X) AppleWebKit/605.1.15 (KHTML, like Gecko) Version/13.0.4 Mobile/15E148 Safari/604.1","qfqp9qv2fd194y6x","rfsxzs23krkerert",NA,NA,"si","/survey/selfserve/53b/g004/230146?list=1&ID=237111539455116","c16bgzgh13ceepgk","237111539455116",830,2023-04-15 11:41:00,3,1,1,1,1,1,1,2,48,2,"",2,"",4,8,3,2,2,4,3,2,2,2,2,2,3,1,1,1,0,1,0,4,3,4,2,1,2,3,1,5,3,2,2,3,1,2,NA,NA,"",NA,"",NA,NA,NA,"",3,3,NA,NA,NA,NA,NA,NA,NA,NA,NA,"",NA,"",0,0,0,0,0,0,0,0,1,0,"","",2,NA,NA,"",2,NA,NA,NA,NA,NA,"",0,2,NA,NA,NA,"",2,2,2,"",NA,NA,NA,"","","",5,5,2,"",NA,NA,NA,"","","",4,4,2,"",NA,NA,NA,"","","",5,5,2,"",NA,NA,NA,"","","",1,1,2,"",NA,NA,NA,"","","",5,5,2,"",NA,NA,NA,"","","",5,5,2,"",NA,NA,NA,"","","",5,5,2,"",NA,NA,NA,"","","",5,5,2,"",NA,NA,NA,NA,"",NA,4,4,2,"",NA,NA,NA,"",4,4,2,"",NA,NA,NA,"","","",4,4,3,"",NA,NA,NA,"","","",4,5,2,"",NA,NA,NA,"","","",5,5,3,"",NA,NA,NA,NA,"","",4,4,2,"",NA,NA,NA,NA,"","",4,4,0,0,0,0,0,0,0,0,0,1,"Weiss nicht",1,0,0,0,0,0,0,0,0,0,"",1,0,0,0,0,0,0,0,0,0,"",2,1,NA,NA,NA,NA,2,NA,NA,NA,"",2,2,3,NA,2,2,3,3,3,1,2,"",4,1,3,1,34,0,3,4,4,4,5,5,4,5,4,3,3,4,5,4,3,5,5,5,5,5,5,5,5,4,4,3,2,2,3,2,4,4,4,5,4,4,4,4,4,4,4,2,4,4,3,5,4,5,4,2,5,3,4,4,3,3,3,3,3,4,5,4,5,5,5,5,3,2,2,2,2,2,2,4,5,3,4,5,4,2,2,3,3,4,5,5,3,3,3,3,3,2,5,5,1,2,1,3,2,2,2,2,2,2,1,3,3,3,3,2,1091.98,1,"rfsxzs23krkerert",NA,NA,"si","/survey/selfserve/53b/g004/230372?list=1&ID=241183254214910","cvedyk8adecnkvtx","241183254214910",19.0118,18.1996666666667,-25,42022,"01-04-2022",2022-04-01,13,1,1,1.01,489,2022,1,4.33333333333333,4,4,3,2.5,3,2.5,1.5,2.5,3,3.33333333333333,3,3,5,NA,NA,NA,NA,2.4,4,4,4,4,5,1.25,4.4,4.5,4.33333333333333,4.5,4.33333333333333,6.6,3.72727272727273,4,4,3,4.66666666666667,4.66666666666667,5,5,4,4.16666666666667,3,3,3,3.16666666666667,38.41,54.05,38.71,60.77,28.14,29.53,31.62,29.25,30.2532044,20.1364544,59.0069219,49.6385319,1.66666666666667,1,3,3,2.2,3,1.66666666666667,3.11111111111111,3,4,2.33333333333333,46.43,48.33,46.92,40.07,45.16,49.47,49.59,45.66,58.5249107,48.4081607,53.2165572,43.8481672,1.22222222222222,2,3,1,3,2.08333333333333,2.5,1.875,2.5,4.09090909090909,4.4,4.33333333333333,3.33333333333333,4.66666666666667,4,5,5,4.66666666666667,2.66666666666667,3.86666666666667,2,4,4,4.16666666666667,3.5,3,4,4,3,5,2.14285714285714,4.16666666666667,2,3.42857142857143,4,3,3.75,1,4,2.1,2,2.66666666666667,1.75,3,2.8,3,4,4,4.5,4,4,3.25
"34",52,"29ftd6j2vvkfndq6","02/27/2023 13:53","qualified,/Gender/p47uy,/Age/gcKvr,/Total/Total",3,1,1,1,1,1,1,1,54,1,3,"",3,1,"",1,1,3,7.2007,40,42,2,NA,NA,NA,2,"","Finanzbuchhalterin",7,3,3,2,3,3,2,1,59,17,NA,NA,NA,NA,NA,NA,NA,NA,1,2,NA,NA,NA,NA,NA,NA,NA,NA,4,2,2,5,2,5,5,4,5,5,2,3,1,1,1,3,3,1,3,1,1,5,4,3,2,2,3,3,1,9,1,1,10,6,3,2,5,5,3,4,5,5,4,4,5,5,4,3,4,3,4,1,5,3,4,4,3,4,4,4,4,4,3,2,1,1,1,5,5,5,5,5,1,1,1,1,1,1,5,5,5,4,4,1,1,2,70,10,3,5,2,2,7,3,7,4,3,3,4,4,4,5,3,4,4,5,3,4,5,5,3,3,4,3,3,4,4,3,3,4,3,3,3,2,3,1,1,1,2,2,1,5,5,4,5,3,4,3,2,1,1,4,4,4,4,4,5,5,5,5,4,4,4,3,5,4,5,5,5,5,2,4,2,4,4,5,1,1451.662,4,NA,10,NA,5,6,"02/27/2023 13:28",NA,NA,NA,1,"Mozilla/5.0 (Windows NT 10.0; Win64; x64) AppleWebKit/537.36 (KHTML, like Gecko) Chrome/110.0.0.0 Safari/537.36","0p725sgcbw513ruf","j53wr6ujeq1n2m7t",NA,NA,"..","/survey/selfserve/53b/g004/230146?list=1&ID=237104974311640","w8erzbums7k5qkp9","237104974311640",987,2023-04-17 14:08:00,3,1,1,1,1,1,1,1,54,2,"",2,"",3,3,5,4,4,5,4,4,3,4,1,1,3,3,1,1,0,1,0,4,2,3,3,3,1,2,1,4,3,3,1,2,1,2,NA,NA,"",NA,"",NA,NA,NA,"",4,2,NA,NA,NA,NA,NA,NA,NA,NA,NA,"",NA,"",0,1,0,0,0,0,1,1,0,0,"","",2,NA,NA,"",2,NA,NA,NA,NA,NA,"",0,2,NA,NA,NA,"",2,1,2,"",NA,NA,NA,"","","",4,4,2,"",NA,NA,NA,"","","",4,4,2,"",NA,NA,NA,"","","",4,4,2,"",NA,NA,NA,"","","",4,4,1,"Schulung der Mitarbeiter über die BG Bau",2,NA,4,"","","Alles ok, brauche das nur nicht im Büro",NA,NA,2,"",NA,NA,NA,"","","",2,2,2,"",NA,NA,NA,"","","",2,2,1,"Höhenverstellbarer Schreibtisch",2,NA,5,"Noch nicht bestellt","","",NA,NA,2,"",NA,NA,NA,NA,"",NA,2,2,1,"Chef",1,4,NA,"",NA,NA,2,"",NA,NA,NA,"","","",4,4,2,"",NA,NA,NA,"","","",2,2,2,"",NA,NA,NA,"","","",1,1,2,"",NA,NA,NA,NA,"","",1,1,2,"",NA,NA,NA,NA,"","",4,4,0,0,0,1,0,0,0,0,0,0,"",0,0,0,0,0,0,0,0,0,1,"mehr Zeit",1,0,0,0,0,0,0,0,0,0,"",2,1,NA,NA,NA,NA,2,NA,NA,NA,"",4,4,2,NA,1,2,4,4,4,2,2,"",5,3,4,2,75,9,2,5,5,5,5,4,3,3,2,2,2,3,4,4,3,5,5,5,5,5,4,3,4,4,4,3,2,2,3,2,4,3,4,4,3,3,2,2,2,2,2,2,2,2,2,4,4,4,4,4,5,2,2,3,3,2,4,4,3,3,3,4,4,3,4,4,1,1,1,1,1,1,1,2,1,2,1,1,1,3,2,4,5,4,5,2,2,2,2,4,5,5,5,5,5,4,2,1,1,4,4,4,2,3,4,4,4,4,4,4,1835.35,5,"j53wr6ujeq1n2m7t",NA,NA,"..","/survey/selfserve/53b/g004/230372?list=1&ID=241183254201402","w8erzbums7k5qkp9","241183254201402",24.1943666666667,30.5891666666667,-1,72007,"01-07-2007",2007-07-01,190,15,10,15.1,5877,2007,16,3,5,4.66666666666667,2,1,3,2,1,4.5,2.5,2.66666666666667,2.5,1,5.4,3.6,4.75,4.33333333333333,4.16666666666667,3.6,3.55555555555556,3,3.66666666666667,4,5,1,3.4,1,5,1,5,3.8,3.36363636363636,4.4,3,2,4.25,4,4.66666666666667,4.66666666666667,3.66666666666667,4.83333333333333,2,2,1,2.16666666666667,38.41,40.07,38.71,40.07,35.81,29.53,21.4,38.09,31.4393125,21.3225625,51.7898923,42.4215023,4,3,3,3,3.4,3.25,3.5,1.77777777777778,2,2,1.33333333333333,32.56,30.31,28.32,31.48,35.81,29.53,41.53,29.25,46.1891625,36.0724125,33.4017587,24.0333687,1.22222222222222,3,4,2,4,2.5,2.5,2.5,3.5,3.54545454545455,4.8,2.66666666666667,2.33333333333333,4.25,3.66666666666667,5,4.66666666666667,3.66666666666667,2.66666666666667,2.6,2,2,3.125,3.5,2,3,3.38461538461538,3.2,3.25,3.75,1,1.33333333333333,2.5,3.92857142857143,4,2.5,5,5,5,3.3,2.33333333333333,4.33333333333333,3.25,4,1.6,1,5,3.66666666666667,3.5,2.33333333333333,2,2
"35",53,"jq5nv7p8dmnmc9sw","02/27/2023 13:46","qualified,/Gender/X0TrF,/Age/b3xfu,/Total/Total",3,1,1,1,1,1,1,2,60,2,5,"",6,1,"",3,2,3,6.2018,35,35,2,NA,NA,NA,12,"non Profit organisation","Vorstandsvorsitzender",8,10,3,2,3,3,2,1,12,43,NA,NA,NA,NA,NA,NA,NA,NA,2,1,NA,NA,NA,NA,NA,NA,NA,NA,3,2,5,5,5,5,5,5,5,5,5,5,5,1,1,3,3,2,2,1,1,5,5,5,5,5,5,5,3,8,7,7,9,10,NA,NA,NA,NA,NA,NA,NA,NA,NA,NA,NA,NA,5,5,5,5,5,4,3,5,5,5,5,5,5,5,5,5,3,4,2,1,2,5,5,5,5,5,1,1,1,1,4,5,4,4,4,4,4,1,3,2,31,8,7,7,5,7,7,5,9,3,3,3,1,3,3,1,2,0,0,0,0,0,0,0,0,0,1,3,3,3,1,3,3,3,2,2,5,5,6,6,5,5,6,6,6,5,5,5,5,5,5,5,5,3,3,3,5,5,5,5,5,5,5,5,5,5,5,5,5,5,5,5,5,5,4,4,4,4,2,3,1,861.724,4,NA,10,NA,5,6,"02/27/2023 13:32",NA,NA,NA,1,"Mozilla/5.0 (Windows NT 10.0; Win64; x64) AppleWebKit/537.36 (KHTML, like Gecko) Chrome/110.0.0.0 Safari/537.36 Edg/110.0.1587.57","uz7vjushh3pr4zpf","cuhvs56ujg6n2hcq",NA,NA,"..","/survey/selfserve/53b/g004/230146?list=1&ID=237111539464251","x0r1vuhcy6zgd3aj","237111539464251",611,2023-04-14 15:27:00,3,1,1,1,1,1,1,2,60,2,"",2,"",5,9,2,2,1,1,2,1,1,1,2,2,0,1,1,1,0,1,0,3,2,5,3,2,1,5,2,4,3,3,2,3,1,1,1,6,"Vorstandsvorsitzender",10,"Arzt",NA,NA,NA,"",NA,NA,NA,NA,NA,NA,NA,NA,NA,NA,NA,"",NA,"",1,0,0,0,0,0,1,0,0,0,"","",1,4,NA,"",1,9,3,2,NA,2,"",3,1,2,NA,2,"",NA,NA,1,"Fitnesskurs im Fitnessstudio",2,NA,2,"","","",NA,NA,2,"",NA,NA,NA,"","","",NA,NA,1,"Ernährungsberaterin",1,3,NA,"","","",NA,NA,2,"",NA,NA,NA,"","","",1,1,2,"",NA,NA,NA,"","","",1,1,1,"Freizeitangebote; Ausflüge",1,5,NA,"","","",NA,NA,1,"berufliche Weiterbildung",1,5,NA,"","","",NA,NA,2,"",NA,NA,NA,"","","",1,1,2,"",NA,NA,NA,NA,"",NA,1,1,1,"an mich",1,5,NA,"",NA,NA,1,"Homeoffice bei Bedarf",1,5,NA,"","","",NA,NA,2,"",NA,NA,NA,"","","",1,1,1,"Mitnahme an Arbeitsplatz",1,5,NA,"","","",NA,NA,1,"50% Frauenquote",NA,NA,NA,NA,"","",NA,NA,2,"",NA,NA,NA,NA,"","",1,1,0,0,0,1,0,1,0,1,0,0,"",0,1,0,0,0,0,0,0,0,0,"",0,1,0,0,0,0,0,0,0,0,"",1,1,NA,NA,NA,NA,2,NA,NA,NA,"",1,1,2,NA,2,2,5,5,5,5,2,"",4,4,3,2,31,31,4,5,5,5,5,5,5,5,5,5,5,5,5,5,5,5,5,5,5,5,5,5,5,5,3,3,3,3,3,3,5,5,5,5,5,5,5,5,5,5,5,5,5,5,5,4,5,5,2,2,5,5,5,4,4,4,4,4,2,3,4,5,5,5,5,5,1,1,1,1,1,1,1,1,1,1,1,1,1,1,1,5,5,5,5,5,5,5,5,5,5,5,5,5,2,5,5,5,5,5,5,5,5,5,5,5,5,5,5,5,1277.2,5,"cuhvs56ujg6n2hcq",NA,NA,"..","/survey/selfserve/53b/g004/230372?list=1&ID=241183254225084","x0r1vuhcy6zgd3aj","241183254225084",14.3620666666667,21.2866666666667,23,62018,"01-06-2018",2018-06-01,59,4,11,4.11,1889,2018,5,5,5,5,5,1,3,2,1,5,5,5,5,3,8.2,NA,NA,NA,NA,5,4.66666666666667,4,5,5,5,1,4.2,4.5,4,4.5,4,6.6,4.45454545454545,5,5,3,5,5,5,5,5,5,2,2,3,2.83333333333333,46.43,40.07,38.71,60.77,45.16,40.41,56.79,45.66,64.2301093,54.1133593,51.4520735,42.0836835,0,3,3,4,2.6,2.5,2.66666666666667,5.55555555555556,5,6,5.66666666666667,52.83,48.33,53.98,60.77,55.62,55.25,56.79,52.42,68.6943627,58.5776127,64.2973344,54.9289444,0.888888888888889,1,1,2,3,2.08333333333333,1.75,2.25,5,5,5,5,5,5,5,5,5,5,3,5,4,4,4.625,4.5,5,4,4.30769230769231,4,4,5,1,1,1,4.78571428571429,5,5,5,2,1,4.6,5,3.66666666666667,5,5,2.4,3,4,5,5,5,5,5
"36",54,"1wqshxb186jb5ht9","02/28/2023 18:51","qualified,/Gender/p47uy,/Age/gcKvr,/Total/Total",3,1,1,1,1,1,1,1,54,1,3,"",4,1,"",1,1,2,5.2004,35,35,2,NA,NA,NA,12,"Handwerk","Kauffrau für Bürokommunikation",7,4,1,2,2,2,2,2,59,NA,NA,NA,NA,NA,NA,NA,NA,NA,1,NA,NA,NA,NA,NA,NA,NA,NA,NA,3,2,2,4,2,4,1,5,4,4,3,1,2,2,1,2,1,1,3,2,3,3,3,2,1,1,2,2,1,1,2,1,5,7,3,3,4,4,3,4,4,3,3,2,3,3,4,4,4,1,4,3,5,5,5,5,4,5,5,5,5,3,2,2,1,1,1,4,5,1,2,1,1,1,1,1,1,1,1,1,1,5,1,1,1,NA,NA,0,1,1,1,1,1,5,9,3,2,2,4,3,2,1,1,0,0,1,0,0,0,0,1,1,2,5,2,2,1,1,1,1,1,2,1,2,2,1,2,2,2,1,1,4,5,5,5,5,3,4,3,3,4,4,3,4,3,4,5,4,5,5,5,5,3,4,4,4,4,3,3,4,3,2,4,3,4,1,1,2064.023,14,NA,10,NA,1,2,"02/27/2023 13:34",NA,NA,NA,1,"Mozilla/5.0 (Linux; Android 13; Pixel 6) AppleWebKit/537.36 (KHTML, like Gecko) Chrome/110.0.0.0 Mobile Safari/537.36","hte5uk4pv4uaxjy7","cahf111v1888pg86",NA,NA,"sa","/survey/selfserve/53b/g004/230146?list=1&ID=237104974311655","80ajzb8k8ucj5bqf","237104974311655",331,2023-04-14 01:44:00,3,1,1,1,1,1,1,1,55,2,"",2,"",4,6,4,1,2,3,3,1,2,1,1,1,0,0,1,1,0,2,1,3,3,3,2,3,1,4,1,5,1,1,1,2,1,2,NA,NA,"",NA,"",NA,NA,NA,"",1,3,NA,NA,NA,NA,NA,NA,NA,NA,NA,"",NA,"",0,0,0,0,0,0,0,0,1,0,"","",2,NA,NA,"",2,NA,NA,NA,NA,NA,"",0,2,NA,NA,NA,"",3,3,2,"",NA,NA,NA,"","","",4,4,2,"",NA,NA,NA,"","","",3,4,2,"",NA,NA,NA,"","","",5,5,2,"",NA,NA,NA,"","","",1,3,2,"",NA,NA,NA,"","","",3,3,2,"",NA,NA,NA,"","","",3,3,2,"",NA,NA,NA,"","","",5,5,1,"Ergonomischer Schreibtisch",1,3,NA,"","","",NA,NA,2,"",NA,NA,NA,NA,"",NA,3,3,2,"",NA,NA,NA,"",3,4,2,"",NA,NA,NA,"","","",5,5,2,"",NA,NA,NA,"","","",1,3,2,"",NA,NA,NA,"","","",1,1,2,"",NA,NA,NA,NA,"","",3,3,2,"",NA,NA,NA,NA,"","",1,1,0,0,0,1,0,0,0,0,0,0,"",0,0,0,1,0,0,0,0,0,0,"",0,0,0,1,0,0,0,0,0,0,"",2,1,NA,NA,NA,NA,2,NA,NA,NA,"",1,1,2,NA,3,2,3,2,3,1,2,"",1,1,2,1,0,0,1,5,5,4,4,5,4,3,3,2,3,4,4,3,3,4,4,4,4,5,4,4,4,3,1,2,2,1,2,1,3,3,3,3,2,2,1,2,2,1,1,2,1,1,1,5,5,5,2,1,5,4,3,4,4,5,3,3,3,3,4,4,4,3,4,3,1,4,3,1,1,1,1,2,2,4,1,1,1,1,1,4,3,4,3,3,2,3,1,1,1,3,3,3,1,3,1,1,1,1,2,1,1,3,1,4,4,4,3,1,2271.13,1,"cahf111v1888pg86",NA,NA,"sa","/survey/selfserve/53b/g004/230372?list=1&ID=240475414778996","80ajzb8k8ucj5bqf","240475414778996",34.4003833333333,37.8521666666667,0,52004,"01-05-2004",2004-05-01,228,19,0,19,7033,2004,19,2.66666666666667,2.5,4.33333333333333,2,1.5,1.5,2,2.5,3,1.5,1.66666666666667,1.5,1,3.2,3,3.75,3,3.25,3.4,4.66666666666667,4.33333333333333,4.66666666666667,5,1.33333333333333,1,1,1,1,1,1,1,4.09090909090909,4.8,3.33333333333333,3.66666666666667,4.16666666666667,3.33333333333333,4.33333333333333,5,4,3.66666666666667,4,3,5,3.83333333333333,46.43,48.33,46.92,40.07,45.16,49.47,56.79,52.42,66.2636807,56.1469307,51.3492436,41.9808536,0.333333333333333,1,5,4,2,2.75,1.5,1.55555555555556,1.66666666666667,1.66666666666667,1.33333333333333,38.41,54.05,46.92,47.67,45.16,55.25,49.59,52.42,60.7446537,50.6279037,56.2481664,46.8797764,0.777777777777778,3,2,1,4,1.91666666666667,2,1.875,2.25,3.81818181818182,4.6,3.33333333333333,3,3.83333333333333,3.33333333333333,4,4.33333333333333,3.66666666666667,1.5,1.86666666666667,4,5,4.5,4.83333333333333,3.5,3,3.61538461538462,3.6,3.75,3.5,1.71428571428571,1.83333333333333,1,2.5,3.4,1.75,2.5,1,5,1.9,1.66666666666667,2.66666666666667,1.5,3.75,1.4,1,2,3,2.5,1.66666666666667,1.33333333333333,1.25
"37",55,"yq9fgk6zkh4ae2ws","02/27/2023 14:05","qualified,/Gender/p47uy,/Age/gcKvr,/Total/Total",3,1,1,1,1,1,1,1,47,1,5,"",5,1,"",4,1,6,8.2012,40,60,2,NA,NA,NA,9,"","Fachbereichsleitung",8,2,1,2,5,5,2,2,47,76,14,10,NA,NA,NA,NA,NA,NA,1,3,2,2,NA,NA,NA,NA,NA,NA,4,1,3,5,3,4,4,4,4,3,4,3,4,1,1,4,4,3,3,2,2,4,3,3,3,2,3,2,1,7,3,3,4,5,2,2,2,3,2,3,3,3,2,1,2,2,3,5,3,1,4,4,3,4,5,5,4,5,5,5,4,4,4,3,2,1,4,3,4,3,3,3,1,1,1,1,4,3,3,5,4,4,4,2,4,2,40,20,6,6,6,5,3,3,7,2,1,2,3,3,3,2,2,4,4,3,2,3,1,0,0,0,2,4,4,3,1,5,3,3,2,4,5,4,5,4,5,6,6,5,5,5,5,4,4,5,4,4,4,4,3,3,5,5,5,5,5,5,5,5,4,5,4,4,4,5,4,4,4,5,4,2,4,3,4,2,1,1790.86,13,NA,11,NA,5,6,"02/27/2023 13:35",NA,NA,NA,1,"Mozilla/5.0 (Macintosh; Intel Mac OS X 10_15_7) AppleWebKit/605.1.15 (KHTML, like Gecko) Version/16.2 Safari/605.1.15","ymzwa9nnznpgbp4w","c35yg2v8chpwd3fb",NA,NA,"..","/survey/selfserve/53b/g004/230146?list=1&ID=237111539460336","c35yg2v8chpwd3fb","237111539460336",133,2023-04-10 17:00:00,3,1,1,1,1,1,1,1,47,2,"",2,"",4,9,3,2,3,4,2,2,3,2,3,3,3,3,2,1,1,0,0,4,3,2,3,3,1,5,2,3,3,3,1,3,1,2,NA,NA,"",NA,"",NA,NA,NA,"",2,2,NA,NA,NA,NA,NA,NA,NA,NA,NA,"",NA,"",0,0,0,0,0,0,1,0,0,0,"","",1,2,5,"Fallen oft aus unterschiedlichen Gründen aus.",2,NA,NA,NA,NA,NA,"",1,2,NA,NA,NA,"",2,3,2,"",NA,NA,NA,"","","",5,5,2,"",NA,NA,NA,"","","",4,5,2,"",NA,NA,NA,"","","",3,3,1,"Es gibt kein Angebot.",2,NA,5,"Es gibt kein Angebot.","","",NA,NA,2,"",NA,NA,NA,"","","",3,3,2,"",NA,NA,NA,"","","",5,5,1,"Weiterbildungen in den Bereichen Sprache, Pädagogik, Musik",1,3,NA,"","","",NA,NA,2,"",NA,NA,NA,"","","",4,4,2,"",NA,NA,NA,NA,"",NA,5,5,2,"",NA,NA,NA,"",4,4,1,"VORÜBERGEHENDE STUNDRNREDUZURIERUNG MÖGLICH",2,NA,4,"","","Fachkräfte ausreichend einstellen; Stundenreduktion bei den Öffnungszeiten der Einrichtungen;",NA,NA,2,"",NA,NA,NA,"","","",5,1,1,"Betreuungsplatzangebot",2,NA,2,"","","",NA,NA,2,"",NA,NA,NA,NA,"","",4,4,2,"",NA,NA,NA,NA,"","",3,3,0,0,0,1,0,0,0,0,0,0,"",0,0,0,0,0,1,0,0,0,0,"",0,0,0,0,0,1,0,0,0,0,"",1,1,NA,NA,NA,NA,1,2,NA,2,"",NA,NA,2,NA,1,1,3,3,3,2,1,"Lautstärke, Hitze im Sommer, Rückenschonendes Arbeiten",3,1,4,2,25,1,4,4,4,4,5,5,5,4,4,3,3,4,5,5,5,5,5,5,4,4,4,4,4,3,3,3,3,4,4,4,4,4,4,4,4,4,3,3,4,4,5,3,4,3,3,5,3,5,4,4,5,5,5,4,4,4,4,4,3,4,4,3,4,5,4,5,2,3,2,2,1,1,3,3,2,3,3,2,2,3,3,2,2,3,3,3,3,2,2,2,1,1,2,3,2,3,3,3,3,3,3,3,3,3,3,3,3,3,3,1,1750.03,5,"45xq2qezv2dsncju",NA,NA,"..","/survey/selfserve/53b/g004/230372?list=1&ID=240475414780045","45xq2qezv2dsncju","240475414780045",29.8476666666667,29.1671666666667,-19,82012,"01-08-2012",2012-08-01,129,10,9,10.09,4019,2012,11,3.66666666666667,4,3.66666666666667,3.66666666666667,1,4,3,2,3.5,3,2.33333333333333,2.5,1,4.4,2,2.75,2,2.25,3.2,4.44444444444444,3.66666666666667,4.66666666666667,5,3,1,3.8,3.5,4,3.5,4,5.2,4.09090909090909,4.6,4,3.33333333333333,4.75,5,5,4.66666666666667,4.33333333333333,4.33333333333333,4,3,4,3.83333333333333,52.83,54.05,46.92,47.67,45.16,40.41,49.59,45.66,55.5382439,45.4214939,58.7117122,49.3433222,1.88888888888889,2,1,2,2.3,1.5,2.83333333333333,5,4.66666666666667,5,5.33333333333333,46.43,48.33,38.71,40.07,55.62,49.47,41.53,45.66,56.8210463,46.7042963,52.5930297,43.2246397,1.77777777777778,4,1,3,3,2.5,1.5,3,2.75,4.09090909090909,4.4,4.33333333333333,3.33333333333333,4.41666666666667,5,5,4,3.66666666666667,3.5,3.73333333333333,2,2,4,3.66666666666667,5,3,4,3.6,4,4.5,2,2.5,3,2.21428571428571,2.6,2.25,1.75,2,3,3,3,3,3,3,2.8,1,5,4,4,3.33333333333333,4.33333333333333,3.25
"38",59,"2fqsv41bhbr69xe0","02/27/2023 14:35","qualified,/Gender/X0TrF,/Age/b3xfu,/Total/Total",3,1,1,1,1,1,1,2,62,2,3,"",3,1,"",1,1,5,4.2018,40,40,2,NA,NA,NA,6,"","Bankkaufmann",9,15,5,2,2,2,1,NA,67,NA,NA,NA,NA,NA,NA,NA,NA,NA,1,NA,NA,NA,NA,NA,NA,NA,NA,NA,NA,2,3,4,2,2,5,5,5,5,4,4,5,1,1,1,1,1,2,1,1,5,4,5,4,5,5,4,2,8,9,9,7,5,4,3,5,5,4,5,4,5,4,4,4,4,3,4,4,3,4,5,5,5,4,5,4,2,2,5,3,2,5,1,4,1,3,5,5,5,5,5,1,1,1,1,5,5,1,1,1,4,1,1,1,NA,NA,0,1,1,1,1,1,4,6,3,1,1,1,2,1,1,1,0,0,0,0,0,0,0,0,0,1,5,1,1,1,3,1,1,1,2,2,5,2,0,2,2,4,1,2,5,5,4,5,5,4,4,3,4,5,4,3,3,2,5,5,5,4,4,3,4,5,3,4,3,4,4,4,4,4,1,4,1,4,1,1,2362.458,4,NA,10,NA,5,6,"02/27/2023 13:55",NA,NA,NA,1,"Mozilla/5.0 (Windows NT 10.0; Win64; x64) AppleWebKit/537.36 (KHTML, like Gecko) Chrome/110.0.0.0 Safari/537.36 Edg/110.0.1587.57","eq0z2ctnkrg5eqny","x4j7vaefeag29sr0",NA,NA,"..","/survey/selfserve/53b/g004/230146?list=1&ID=237111539449891","3pwc1kdrpwq913yn","237111539449891",593,2023-04-14 15:40:00,3,1,1,1,1,1,1,2,62,2,"",2,"",4,6,3,1,1,1,3,1,1,1,0,1,0,0,0,0,0,0,0,1,1,5,1,1,1,4,1,5,1,1,1,2,1,1,2,NA,"",NA,"",2,NA,2,"",NA,NA,1,1,0,0,0,1,0,0,0,"",1,"",0,0,0,0,0,0,1,0,0,0,"","",1,2,5,"selten Bedarf",1,3,4,2,NA,3,"",2,1,2,NA,2,"",NA,NA,1,"Yoga, Betriebssport, Kostenbeteiligungen an sportlichen Aktivitäten",2,NA,4,"","","Aufgrund dezentraler Organisation kaum möglich",NA,NA,1,"Yoga, Kostenbeteiligungen",2,NA,2,"","","",NA,NA,1,"Auswahl Küchenkantine am Hauptstandort, sonst eher nicht",2,NA,5,"Dezentrale Organisation","","",NA,NA,3,"",NA,NA,NA,"","","",1,1,1,"Regelmäßige Besuche zur Prüfung der Arbeitsplatzsicherheit, z.B. Stuhl, Sitz, Computer, Lichteinfall, Richtung zur Eingangstür im Büro etc.",1,4,NA,"","","",NA,NA,1,"Zuschüsse bei dezentralen Veranstaltungen, gemeinsame Veranstaltungen (wie Weihnachtsfeiern) für auch alle dezentralen Personen am Hauptstandort",1,5,NA,"","","",NA,NA,1,"berufliche Weiterbildungen",1,5,NA,"","","",NA,NA,1,"regelmäßiges Aufsuchen durch Personen des Arbeitsschutzes",1,4,NA,"","","",NA,NA,3,"",NA,NA,NA,NA,"",NA,2,2,1,"Kollegium, Vorgesetzte, Betriebsrat",1,4,NA,"",NA,NA,1,"fast alle in der Klammer genannten",1,5,NA,"","","",NA,NA,3,"",NA,NA,NA,"","","",3,1,3,"",NA,NA,NA,"","","",1,1,3,"",NA,NA,NA,NA,"","",4,1,3,"",NA,NA,NA,NA,"","",1,1,0,0,0,1,0,0,0,0,0,0,"",0,0,0,0,0,0,0,0,0,1,"Nichts",0,0,0,0,0,0,0,0,0,1,"Keine",3,1,NA,NA,NA,NA,1,2,NA,2,"",NA,NA,1,1,1,1,4,3,3,4,2,"",5,4,1,1,0,0,5,5,5,5,5,4,5,4,3,4,4,4,1,4,2,5,5,5,5,4,4,5,4,3,3,3,4,4,3,2,4,3,4,3,2,2,2,1,3,2,2,3,2,2,1,4,4,5,2,1,5,4,3,4,3,5,3,5,2,4,4,5,5,5,5,4,1,1,1,3,1,1,3,1,1,5,1,1,1,1,1,4,4,1,3,3,2,1,1,1,1,3,4,3,5,5,4,1,1,4,5,5,4,4,4,3,5,4,4,4,3417.09,5,"x4j7vaefeag29sr0",NA,NA,"..","/survey/selfserve/53b/g004/230372?list=1&ID=241183254199316","rc13ans1wuun35sx","241183254199316",39.3743,56.9515,0,42018,"01-04-2018",2018-04-01,61,5,1,5.01,1950,2018,5,3,3.5,5,4.33333333333333,1,1,1.5,1,4.5,4.5,4.66666666666667,5,2,7.6,3.8,5,4,4.25,3.6,4.11111111111111,5,4.33333333333333,3,5,1,2.6,5,1,5,1,1,4.36363636363636,4.8,3.66666666666667,4.33333333333333,3.83333333333333,2.66666666666667,5,3.66666666666667,4,3.83333333333333,5,5,5,4.5,46.43,54.05,53.98,60.77,55.62,55.25,56.79,52.42,67.3650951,57.2483451,64.7640032,55.3956132,0,1,3,4,1.5,2.25,1,2.22222222222222,3,2,1.66666666666667,46.43,54.05,53.98,60.77,45.16,55.25,56.79,52.42,64.6769797,54.5602297,63.6862048,54.3178148,0.111111111111111,1,2,1,4,1.33333333333333,2,1,3.5,4.36363636363636,4.8,4,4,3.91666666666667,2.33333333333333,5,4.33333333333333,4,3.16666666666667,2.4,4,5,4.25,4.5,3.5,4,4.30769230769231,4.2,4,4.75,1.57142857142857,1.66666666666667,1,2.57142857142857,3,1.25,2.75,5,5,4.1,3.33333333333333,4.66666666666667,4.25,4,2.8,2,5,3.66666666666667,2.5,1.66666666666667,2.33333333333333,2
"39",60,"036gye2a2axzjrcx","02/27/2023 15:35","qualified,/Gender/p47uy,/Age/gcKvr,/Total/Total",3,1,1,1,1,1,1,1,28,1,5,"",6,1,"",1,1,3,7.2019,41,42,2,NA,NA,NA,5,"","Marketing Manager",5,1,4,1,NA,NA,NA,NA,NA,NA,NA,NA,NA,NA,NA,NA,NA,NA,NA,NA,NA,NA,NA,NA,NA,NA,NA,NA,NA,2,4,3,4,4,5,3,5,4,2,5,3,2,1,4,3,2,4,2,2,4,4,4,2,3,3,4,5,3,8,6,7,8,3,3,4,5,4,4,2,4,2,2,4,5,4,4,3,5,4,3,4,4,5,5,5,3,3,4,4,2,4,4,4,3,5,4,3,5,5,4,2,2,1,1,3,4,3,2,3,4,4,1,2,2,14,4,5,4,3,3,5,4,6,4,1,1,2,4,4,4,3,5,2,5,2,1,1,0,0,0,2,3,3,2,4,2,2,3,1,4,2,2,3,3,3,4,2,2,2,4,4,4,5,5,3,4,3,2,2,3,3,3,3,4,4,5,4,4,4,3,3,3,5,4,4,4,3,4,3,4,4,2,4,4,1,5623.91,14,NA,10,NA,1,2,"02/27/2023 13:59",NA,NA,NA,1,"Mozilla/5.0 (Linux; Android 12; SM-G975F) AppleWebKit/537.36 (KHTML, like Gecko) Chrome/101.0.4951.41 Mobile Safari/537.36 (Ecosia android@101.0.4951.41)","5n1283zs9fke46xg","eb3dr86aw897cwk4",NA,NA,"sa","/survey/selfserve/53b/g004/230146?list=1&ID=237104974326868","xrnhybb699dcz635","237104974326868",754,2023-04-14 20:57:00,3,1,1,1,1,1,1,1,29,2,"",2,"",4,7,3,1,1,1,3,3,4,3,4,5,5,4,3,1,2,1,0,3,3,4,3,2,4,3,2,2,2,3,2,4,1,2,NA,NA,"",NA,"",NA,NA,NA,"",3,5,NA,NA,NA,NA,NA,NA,NA,NA,NA,"",NA,"",0,0,0,0,0,0,1,1,0,0,"","",1,4,NA,"",1,5,5,1,5,NA,"",2,1,1,5,NA,"",NA,NA,1,"Yoga Kurs wöchentlich",1,5,NA,"","","",NA,NA,1,"Yoga Kurs wöchentlich",1,5,NA,"","","",NA,NA,2,"",NA,NA,NA,"","","",2,2,2,"",NA,NA,NA,"","","",2,2,2,"",NA,NA,NA,"","","",4,4,2,"",NA,NA,NA,"","","",3,4,1,"Nach Eigenrecherche. Darf vorgelegt werden.",1,5,NA,"","","",NA,NA,2,"",NA,NA,NA,"","","",5,5,2,"",NA,NA,NA,NA,"",NA,2,2,2,"",NA,NA,NA,"",3,3,1,"Homeoffice nach Bedarf, Vertrauenszeiten so dass man auch mal ein paar Stunden ausfallen kann",1,5,NA,"","","",NA,NA,2,"",NA,NA,NA,"","","",3,1,2,"",NA,NA,NA,"","","",3,1,2,"",NA,NA,NA,NA,"","",5,5,2,"",NA,NA,NA,NA,"","",3,3,0,0,0,1,0,0,0,0,0,0,"",0,0,0,0,1,0,1,1,1,0,"",0,0,1,0,1,1,1,1,1,0,"",3,1,NA,NA,NA,NA,2,NA,NA,NA,"",2,2,2,NA,2,2,4,4,5,3,1,"Awareness für Stressbewältigung und mentale Gesundheit",4,3,3,2,20,5,1,4,4,4,3,5,4,4,4,2,2,2,4,3,5,4,5,5,4,3,3,3,3,3,2,3,1,2,2,3,5,4,5,4,4,3,3,3,2,2,3,3,3,4,4,2,1,3,5,3,4,5,4,3,4,4,3,4,3,2,4,5,4,5,4,5,2,4,2,1,1,1,1,2,3,2,1,1,1,2,3,5,5,4,4,5,3,2,2,2,5,5,5,5,3,4,3,3,2,4,4,4,4,5,5,4,5,3,5,4,1625.57,1,"eb3dr86aw897cwk4",NA,NA,"sa","/survey/selfserve/53b/g004/230372?list=1&ID=241183254219863","xrnhybb699dcz635","241183254219863",93.7318333333333,27.0928333333333,1,72019,"01-07-2019",2019-07-01,46,3,10,3.1,1494,2019,4,3.66666666666667,4.5,4,3.33333333333333,1.5,3.5,3,2,4,3,3.33333333333333,3,NA,6.4,2.4,4.25,4.33333333333333,3.5,4,4,3.66666666666667,5,3.33333333333333,4.66666666666667,1.5,3,3.5,2.66666666666667,3.5,2.66666666666667,4,3.54545454545455,4.4,3.33333333333333,2.33333333333333,3.58333333333333,3,4.33333333333333,4,3,4,2,4,2,3.16666666666667,38.41,54.05,53.98,53.35,35.81,29.53,31.62,38.09,33.1659621,23.0492121,65.1278604,55.7594704,1.77777777777778,3,4,2,2.6,2.75,2.5,2.55555555555556,2.33333333333333,2.66666666666667,2.66666666666667,46.43,54.05,53.98,60.77,45.16,40.41,31.62,38.09,37.9922698,27.8755198,70.3521526,60.9837626,2.77777777777778,2,3,4,2,2.66666666666667,2.75,2.625,4,3.45454545454545,4,4,2,3.75,4,4.66666666666667,3.33333333333333,3,2.16666666666667,3.46666666666667,1,3,2.875,2.33333333333333,4.5,3,3.84615384615385,3.4,3.75,4.5,1.71428571428571,1.66666666666667,2.5,3.92857142857143,4.6,2.25,5,3,4,4,3.33333333333333,4,4.5,4.25,4,1,3,4.66666666666667,4,3,2.33333333333333,3.5
"40",61,"13k70x44a3gcv0a5","02/27/2023 15:50","qualified,/Gender/X0TrF,/Age/gcKvr,/Total/Total",3,1,1,1,1,1,1,2,45,1,5,"",6,1,"",4,1,6,9.2003,42,42,2,NA,NA,NA,1,"","Gruppenleiter Einkaufsqualität direktes Material",8,1,1,2,5,5,2,3,44,14,12,7,NA,NA,NA,NA,NA,NA,1,2,2,2,NA,NA,NA,NA,NA,NA,2,2,4,5,5,3,3,5,4,5,4,4,4,3,4,4,4,3,4,1,1,4,5,5,4,5,4,4,3,6,7,7,6,4,3,4,4,4,3,4,4,4,4,4,4,5,4,5,4,4,4,5,4,4,5,5,4,3,4,4,3,4,3,4,4,1,4,4,4,4,5,3,1,1,1,1,5,5,3,4,3,4,3,1,1,2,5,5,3,3,5,2,2,4,8,2,1,1,1,2,1,2,1,2,2,3,0,1,1,0,0,0,2,2,3,3,2,4,2,2,2,4,4,4,5,4,4,4,5,4,4,3,4,5,4,5,3,3,4,2,2,3,5,4,4,4,4,5,5,4,5,4,4,3,4,3,5,4,4,5,3,2,4,4,5,2,1,6471.31,14,NA,10,NA,1,2,"02/27/2023 14:01",NA,NA,NA,1,"Mozilla/5.0 (Linux; Android 10; SM-G960F) AppleWebKit/537.36 (KHTML, like Gecko) Chrome/110.0.0.0 Mobile Safari/537.36","wv73a5xw845amkhj","x6gsffykqyd3w9wm",NA,NA,"sa","/survey/selfserve/53b/g004/230146?list=1&ID=237104974311652","x6gsffykqyd3w9wm","237104974311652",457,2023-04-14 13:16:00,3,1,1,1,1,1,1,2,45,2,"",2,"",4,8,3,2,2,1,3,1,1,2,4,4,4,0,2,2,1,1,1,2,2,3,2,3,1,4,1,4,2,3,1,4,1,1,2,NA,"",NA,"",1,4,NA,"",NA,NA,1,1,1,0,0,0,1,1,0,"",8,"",0,0,0,0,0,0,1,0,0,0,"","",1,1,1,"",3,NA,NA,NA,NA,NA,"",2,1,2,NA,2,"",NA,NA,1,"Zuzahlung zur Mitgliedschaft in einem Fitnessstudio, Betriebssport, höhenverstellbare Tische, Online kurze Bewegungsangebote für die Pause",1,4,NA,"","","",NA,NA,2,"",NA,NA,NA,"","","",NA,NA,1,"Ein besonders gesundes Menü in der Kantine",1,4,NA,"","","",NA,NA,1,"Seminare zur Suchtprevention und Resilienz",2,NA,2,"","","",NA,NA,1,"Schulungen zur Arbeitssicherheit",1,4,NA,"","","",NA,NA,1,"Familientag, Team Building",1,5,NA,"","","",NA,NA,1,"Umfangreich je nach Aufgabenbereich",1,4,NA,"","","",NA,NA,1,"Höhenverstellbare Tische, Arbeitsplatzbewertung",1,4,NA,"","","",NA,NA,1,"Bewertung Bildschirmarbeitsplatz",2,NA,2,NA,"",NA,NA,NA,1,"Vorgesetzter",1,3,NA,"",NA,NA,1,"Gleitzeit",1,3,NA,"","","",NA,NA,1,"Rückkehrgespräche, Zielgespräche mit vorgesetztem",2,NA,2,"","","",NA,NA,1,"Kontingent an Kitaplätzen",2,NA,2,"","","",NA,NA,1,"Spezieller Förderpiol",NA,NA,NA,NA,"","",NA,NA,3,"",NA,NA,NA,NA,"","",2,2,0,0,0,1,1,1,0,1,0,0,"",0,0,0,1,1,1,1,1,0,0,"",0,0,0,0,0,1,0,1,1,0,"",1,1,NA,NA,NA,NA,1,2,NA,2,"",NA,NA,1,1,1,1,4,3,3,2,2,"",4,4,3,1,10,6,4,3,4,5,5,4,3,4,4,2,3,2,5,4,4,4,5,5,5,4,4,4,4,4,2,3,4,3,4,3,5,4,5,4,4,3,4,4,4,4,4,4,4,5,4,2,3,2,4,4,3,2,2,5,4,4,3,5,2,4,5,5,4,4,4,4,1,3,1,1,1,1,1,1,1,2,1,1,1,1,1,4,5,5,5,5,1,1,5,2,4,4,5,4,4,4,5,5,2,5,4,5,5,4,5,4,4,4,4,5,1694.81,1,"x6gsffykqyd3w9wm",NA,NA,"sa","/survey/selfserve/53b/g004/230372?list=1&ID=241183254204503","x6gsffykqyd3w9wm","241183254204503",107.855166666667,28.2468333333333,1,92003,"01-09-2003",2003-09-01,236,19,8,19.08,7276,2003,20,4.66666666666667,3,4.66666666666667,4,3.5,4,3.5,1,4.5,4.5,4.33333333333333,4.5,3,6,3.8,4,4,3.91666666666667,4.2,4.22222222222222,4.33333333333333,4.66666666666667,3.66666666666667,4,1,4,5,3.33333333333333,5,3.33333333333333,3,3.45454545454545,4.2,3.33333333333333,2.33333333333333,4.25,4.33333333333333,4.33333333333333,4.66666666666667,3.66666666666667,4.16666666666667,4,2,4,3.66666666666667,52.83,54.05,53.98,60.77,55.62,55.25,49.59,52.42,62.4247591,52.3080091,68.1472832,58.7788932,1,4,2,2,2.4,2,2.66666666666667,4.22222222222222,4,4.66666666666667,4,46.43,48.33,46.92,60.77,45.16,55.25,56.79,45.66,64.4101313,54.2933813,58.2162826,48.8478926,2.11111111111111,3,2,2,2,2,1.5,2.25,3,3.54545454545455,4.2,3.66666666666667,2.33333333333333,4.33333333333333,4.33333333333333,4.66666666666667,4.33333333333333,4,3.16666666666667,4.13333333333333,2,2,2.25,2.33333333333333,2,4,4.23076923076923,4.6,4,4,1.28571428571429,1.16666666666667,1,3.85714285714286,4.8,2.25,4.25,4,4,4.6,4.66666666666667,4.33333333333333,4.75,4,3.2,3,4,4.66666666666667,4,3.66666666666667,4,4.25
"41",62,"4vpppywsvd88rd5x","02/27/2023 14:43","qualified,/Gender/X0TrF,/Age/gcKvr,/Total/Total",3,1,1,1,1,1,1,2,41,1,5,"",2,1,"",1,1,6,3.2018,37,40,2,NA,NA,NA,6,"","Banksachbearbeiter",7,4,1,2,4,4,2,2,39,11,10,NA,NA,NA,NA,NA,NA,NA,1,2,2,NA,NA,NA,NA,NA,NA,NA,5,2,1,1,2,1,2,4,4,4,2,4,2,4,3,3,5,2,2,2,3,1,2,1,1,2,2,1,1,7,3,3,3,5,2,1,1,1,4,2,2,1,1,1,2,2,3,4,2,1,2,4,3,3,3,2,3,1,2,2,2,4,2,1,1,1,1,4,4,5,5,5,1,1,1,1,4,4,5,5,1,3,4,1,1,2,80,0,1,1,1,1,1,2,3,3,1,1,3,3,3,2,1,3,1,2,1,1,2,0,0,1,2,5,2,2,3,4,1,2,2,1,1,1,1,0,1,1,1,0,1,4,4,4,3,5,2,2,3,4,3,4,2,1,1,4,4,4,2,2,3,1,1,1,3,3,3,4,2,3,4,2,4,2,4,2,1,2327.01,14,NA,10,NA,1,2,"02/27/2023 14:04",NA,NA,NA,1,"Mozilla/5.0 (Linux; Android 10; MAR-LX1A) AppleWebKit/537.36 (KHTML, like Gecko) Chrome/110.0.0.0 Mobile Safari/537.36","y18r3xkxadk9bc5w","yf9qe0dnajv6adx8",NA,NA,"sa","/survey/selfserve/53b/g004/230146?list=1&ID=237111539459293","9xsvbuw2zyert9h6","237111539459293",497,2023-04-14 13:43:00,3,1,1,1,1,1,1,2,41,2,"",2,"",2,5,3,1,1,2,3,1,2,1,4,3,3,1,3,3,0,1,0,1,2,5,4,1,2,4,1,5,1,2,1,1,1,3,NA,NA,"",NA,"",NA,NA,NA,"",3,2,NA,NA,NA,NA,NA,NA,NA,NA,NA,"",NA,"",0,0,0,0,0,0,1,0,0,0,"","",1,2,5,"ist in einer anderen Filiale",2,NA,NA,NA,NA,NA,"",1,2,NA,NA,NA,"",2,2,1,"Fitnessstudio-Rabatt, Sportgruppen",2,NA,5,"in anderen Filialen","","",NA,NA,1,"Tipps für den Umgang und onlinekurs",2,NA,2,"","","",NA,NA,2,"",NA,NA,NA,"","","",4,4,3,"",NA,NA,NA,"","","",1,1,2,"",NA,NA,NA,"","","",1,1,1,"Teambildung wird bezuschusst",1,2,NA,"","","",NA,NA,1,"interne Kurse",2,NA,5,"keine Unterstützung","","",NA,NA,1,"Arbeitsplatz einrichten",1,3,NA,"","","",NA,NA,1,"Einstellungen der Geräte",1,3,NA,NA,"",NA,NA,NA,3,"",NA,NA,NA,"",3,3,1,"flexible Arbeitszeiten, Teilzeit",2,NA,2,"","","",NA,NA,3,"",NA,NA,NA,"","","",1,1,2,"",NA,NA,NA,"","","",1,1,3,"",NA,NA,NA,NA,"","",3,1,2,"",NA,NA,NA,NA,"","",1,1,0,0,0,1,0,0,0,0,0,0,"",0,0,0,1,0,0,0,0,0,0,"",0,0,0,1,0,0,0,0,0,0,"",3,1,NA,NA,NA,NA,1,2,NA,2,"",NA,NA,1,1,1,1,2,2,2,4,2,"",5,1,4,2,80,0,2,4,4,3,3,4,2,3,2,3,3,4,1,1,1,4,4,4,4,2,3,1,1,1,3,2,3,2,2,2,4,4,4,4,4,3,2,3,4,3,4,4,3,2,2,4,4,4,2,2,4,5,5,4,4,4,4,4,3,4,3,4,4,4,4,4,4,5,4,2,1,2,2,1,2,2,2,3,3,3,3,2,1,2,2,3,2,2,3,1,1,1,1,1,4,3,1,2,2,1,1,1,1,2,2,2,4,2,3,3,2165.83,1,"yf9qe0dnajv6adx8",NA,NA,"sa","/survey/selfserve/53b/g004/230372?list=1&ID=241183254221942","9xsvbuw2zyert9h6","241183254221942",38.7835,36.0971666666667,0,32018,"01-03-2018",2018-03-01,62,5,2,5.02,1981,2018,5,1.33333333333333,1.5,4,2.66666666666667,3.5,4,2,2.5,1.5,1,1.66666666666667,2,1,4.2,1.4,1.25,2.66666666666667,1.66666666666667,2.4,2.55555555555556,3.33333333333333,2.66666666666667,1.66666666666667,5,1,3.8,4,3.66666666666667,4,3.66666666666667,1,3.45454545454545,4,2.33333333333333,3.66666666666667,2.16666666666667,1.33333333333333,4,2.33333333333333,1,3,4,4,4,4,46.43,54.05,53.98,47.67,45.16,40.41,49.59,52.42,56.6703599,46.5536099,61.1540696,51.7856796,1.22222222222222,1,2,5,2.2,3,1.66666666666667,0.777777777777778,1,0.666666666666667,0.666666666666667,46.43,54.05,53.98,53.35,45.16,55.25,49.59,52.42,59.6906631,49.5739131,63.2690564,53.9006664,2,1,2,1,5,1.91666666666667,2.5,1.625,2.5,3.18181818181818,3.6,2.33333333333333,3.33333333333333,2.25,1,4,3,1,2.33333333333333,3.33333333333333,4,4,4.25,4,5,3,3.84615384615385,3.6,4,4,2.85714285714286,2.16666666666667,3,1.85714285714286,2,2,1,4,4,1.8,2,2,1.5,2.75,1.2,1,2,4,4,2.66666666666667,3.66666666666667,2.75
"42",63,"sjmp9hq28ghn9yxr","02/27/2023 14:37","qualified,/Gender/p47uy,/Age/b3xfu,/Total/Total",3,1,1,1,1,1,1,1,58,2,5,"",6,1,"",1,1,6,10.1988,40,40,2,NA,NA,NA,10,"","Fachkrankenschwester",6,3,3,1,NA,NA,NA,NA,NA,NA,NA,NA,NA,NA,NA,NA,NA,NA,NA,NA,NA,NA,NA,NA,NA,NA,NA,NA,NA,2,5,5,4,4,3,5,5,5,5,5,5,1,1,3,3,1,4,1,1,4,5,5,5,5,5,5,3,4,4,9,7,6,4,4,5,5,4,5,5,4,5,5,5,5,2,2,4,1,2,1,2,2,2,3,3,2,3,3,4,2,3,3,1,2,3,5,5,2,3,3,2,1,1,1,1,1,1,1,1,5,1,1,1,NA,NA,1,1,1,1,1,1,5,10,1,1,1,1,1,1,1,1,0,2,0,0,0,0,0,0,0,1,5,1,1,1,5,1,3,1,3,5,6,6,6,6,6,6,6,6,2,1,4,1,1,1,1,5,3,3,3,5,5,5,5,5,5,5,3,5,3,4,3,5,5,5,5,5,5,5,1,5,1,5,1,1,1129.352,13,NA,11,NA,5,6,"02/27/2023 14:18",NA,NA,NA,1,"Mozilla/5.0 (Macintosh; Intel Mac OS X 10_15_7) AppleWebKit/605.1.15 (KHTML, like Gecko) Version/16.2 Safari/605.1.15","dm6fjqwyerur923e","avq998qd3anx9mza",NA,NA,"..","/survey/selfserve/53b/g004/230146?list=1&ID=237111539451986","avq998qd3anx9mza","237111539451986",381,2023-04-14 09:12:00,3,1,1,1,1,1,1,1,58,2,"",2,"",5,10,1,1,1,3,1,1,1,1,0,1,0,0,0,0,0,0,0,2,1,5,1,1,1,5,2,3,4,4,1,4,1,3,NA,NA,"",NA,"",NA,NA,NA,"",3,3,NA,NA,NA,NA,NA,NA,NA,NA,NA,"",NA,"",0,0,0,0,0,0,0,0,1,0,"","",3,NA,NA,"",3,NA,NA,NA,NA,NA,"",0,3,NA,NA,NA,"",2,2,3,"",NA,NA,NA,"","","",1,1,3,"",NA,NA,NA,"","","",1,1,3,"",NA,NA,NA,"","","",1,1,3,"",NA,NA,NA,"","","",1,1,3,"",NA,NA,NA,"","","",1,1,3,"",NA,NA,NA,"","","",1,1,1,"Verschiedene Bereiche.",1,5,NA,"","","",NA,NA,1,"Verstellbare Stühle und Tische.",1,2,NA,"","","",NA,NA,1,"Ich weiß es nicht.",2,NA,2,NA,"",NA,NA,NA,3,"",NA,NA,NA,"",1,1,1,"Arbeitszeitkonten.",2,NA,2,"","","",NA,NA,3,"",NA,NA,NA,"","","",1,1,3,"",NA,NA,NA,"","","",1,1,3,"",NA,NA,NA,NA,"","",1,1,3,"",NA,NA,NA,NA,"","",1,1,0,0,0,0,0,1,0,0,0,0,"",0,0,0,1,0,0,0,0,0,0,"",0,0,0,1,0,0,0,0,0,0,"",1,1,NA,NA,NA,NA,1,1,1,NA,"",NA,NA,1,1,3,3,1,1,1,1,2,"",1,1,2,1,0,0,1,5,5,5,5,4,5,5,5,5,3,4,5,5,5,5,5,5,5,3,4,4,4,4,4,4,4,4,4,4,5,5,5,5,4,4,1,3,4,4,4,4,4,4,3,5,5,5,1,1,5,4,4,3,3,3,3,4,2,4,4,4,5,4,4,4,1,1,1,1,1,1,1,1,1,1,1,1,1,1,1,5,5,5,5,5,5,1,4,1,3,4,4,2,5,5,3,4,1,3,3,4,3,1,2,2,4,3,3,3,973.42,5,"dyftpk6rfmyynwex",NA,NA,"..","/survey/selfserve/53b/g004/230372?list=1&ID=241166931202282","6vss0gn8cxwz08js","241166931202282",18.8225333333333,16.2236666666667,-1,101988,"01-10-1988",1988-10-01,415,34,7,34.07,12724,1988,35,4.66666666666667,3.5,5,5,1,3,2.5,1,4.5,5,5,5,3,6,4.6,4.75,4.66666666666667,4.66666666666667,2.2,2.33333333333333,1.66666666666667,2.66666666666667,2.66666666666667,2.66666666666667,1.25,1,1,1,1,1,1,2.27272727272727,1.8,2.33333333333333,3,4.41666666666667,5,5,4.33333333333333,3.33333333333333,5,5,5,5,5,59.45,54.05,53.98,60.77,61.83,55.25,56.79,52.42,69.432978,59.316228,68.008793,58.640403,0.222222222222222,1,1,3,1.4,1.5,1.33333333333333,5.88888888888889,5.66666666666667,6,6,59.45,54.05,53.98,47.67,61.83,55.25,56.79,52.42,69.761395,59.644645,63.559771,54.191381,0.111111111111111,1,1,3,2,1.83333333333333,1.25,2.125,1,4.63636363636364,4.8,5,4,4.5,5,5,4,4,4,3.93333333333333,5,5,4.75,5,4,4,3.76923076923077,3.8,3.25,4.25,1,1,1,3.85714285714286,5,2.75,3.25,5,5,3.3,4,3.66666666666667,2.5,3,2.4,3,1,5,4.5,2.66666666666667,4,3.75
"43",65,"uwbwf9e6y7yp2hrw","02/27/2023 14:40","qualified,/Gender/p47uy,/Age/gcKvr,/Total/Total",3,1,1,1,1,1,1,1,35,1,5,"",6,1,"",1,1,6,9.2021,39,45,2,NA,NA,NA,10,"","Sozialarbeiterin",5,2,4,1,NA,NA,NA,NA,NA,NA,NA,NA,NA,NA,NA,NA,NA,NA,NA,NA,NA,NA,NA,NA,NA,NA,NA,NA,NA,2,3,3,3,3,3,3,3,3,3,3,3,4,4,4,4,3,4,4,3,3,3,3,3,2,2,2,1,6,7,5,8,1,2,2,2,2,2,2,4,4,2,2,2,2,2,4,2,2,2,3,3,3,3,2,3,2,3,2,4,4,4,2,2,2,3,3,3,3,4,1,1,1,1,1,2,3,2,2,2,5,2,2,4,1,4,5,3,4,3,3,3,4,7,4,3,3,4,3,3,4,3,4,4,4,4,4,4,4,4,4,4,3,3,3,3,4,4,4,4,4,2,2,1,1,1,1,1,1,1,2,2,2,2,2,3,2,3,3,3,2,2,2,2,2,2,3,2,2,3,3,3,3,2,2,2,2,2,2,4,4,4,4,4,4,1,969.616,13,NA,10,NA,5,6,"02/27/2023 14:24",NA,NA,NA,1,"Mozilla/5.0 (Macintosh; Intel Mac OS X 10_15_7) AppleWebKit/537.36 (KHTML, like Gecko) Chrome/110.0.0.0 Safari/537.36","tnxcbtb3phgm3jfh","uxstbm26z82uy94e",NA,NA,"..","/survey/selfserve/53b/g004/230146?list=1&ID=237104974325832","uxstbm26z82uy94e","237104974325832",533,2023-04-14 14:59:00,3,1,1,1,1,1,1,1,35,2,"",2,"",3,5,4,2,3,3,4,4,5,4,5,6,5,6,5,5,3,5,5,4,5,3,5,5,5,3,5,2,4,5,4,3,1,1,2,NA,"",NA,"",1,3,NA,"",NA,NA,0,0,0,0,0,0,0,1,0,"",8,"",0,0,0,0,0,0,1,1,0,0,"","",1,2,4,"",2,NA,NA,NA,NA,NA,"",2,3,NA,NA,NA,"",3,4,1,"Yoga",2,NA,4,"","","frühmorgens",NA,NA,2,"",NA,NA,NA,"","","",NA,NA,2,"",NA,NA,NA,"","","",4,4,3,"",NA,NA,NA,"","","",3,2,3,"",NA,NA,NA,"","","",3,2,3,"",NA,NA,NA,"","","",3,4,1,"Diversität",1,4,NA,"","","",NA,NA,2,"",NA,NA,NA,"","","",3,4,3,"",NA,NA,NA,NA,"",NA,4,4,2,"",NA,NA,NA,"",4,4,1,"Gleitzeit",1,4,NA,"","","",NA,NA,3,"",NA,NA,NA,"","","",4,4,3,"",NA,NA,NA,"","","",4,3,3,"",NA,NA,NA,NA,"","",5,4,2,"",NA,NA,NA,NA,"","",4,4,0,0,0,1,0,0,0,0,0,0,"",0,0,1,0,1,0,0,0,1,0,"",1,0,0,0,0,0,0,0,0,0,"",1,2,NA,NA,NA,NA,3,NA,NA,NA,"",4,4,2,NA,3,2,4,4,3,3,2,"",3,1,4,1,14,0,2,3,3,3,3,4,2,2,3,2,1,2,2,3,1,3,4,3,2,2,2,1,1,1,3,2,3,3,3,3,4,4,4,4,4,4,4,4,4,4,4,4,4,4,4,3,3,3,4,4,4,4,3,4,4,4,4,4,4,4,4,4,4,4,4,4,3,4,4,3,4,3,4,3,2,2,4,4,4,4,4,2,2,2,2,2,4,3,2,4,2,2,2,3,4,3,3,3,3,3,3,3,3,3,3,4,5,3,2,2,4626.38,5,"z1px03d9gktgjzva",NA,NA,"..","/survey/selfserve/53b/g004/230372?list=1&ID=241183254217789","z1px03d9gktgjzva","241183254217789",16.1602666666667,77.1063333333333,-5,92021,"01-09-2021",2021-09-01,20,1,8,1.08,701,2021,2,3,3,3,3,4,4,3.5,3.5,3,3,2,2,1,5.4,2.4,2.5,2,2.33333333333333,2.4,2.66666666666667,3,2.66666666666667,2.33333333333333,2.66666666666667,1,2.2,2.5,2,2.5,2,3.2,2.36363636363636,2,2.66666666666667,2.66666666666667,2.41666666666667,2,2.33333333333333,2.33333333333333,3,2,2,2,2,3,38.41,40.07,38.71,40.07,45.16,40.41,31.62,38.09,43.5027582,33.3860082,49.9047895,40.5363995,4,3,2,2,3.2,2.75,3.5,1.22222222222222,1.66666666666667,1,1,38.41,48.33,38.71,47.67,35.81,29.53,21.4,29.25,26.3081587,16.1914087,56.5859531,47.2175631,5,3,3,4,3,4.25,3.75,4.5,3.5,2.54545454545455,3.2,2.33333333333333,1.66666666666667,2.08333333333333,2,3.33333333333333,2,1,2.83333333333333,4,2,2,3,2.83333333333333,3.5,2,3.84615384615385,3.6,4,4,3.57142857142857,3.16666666666667,4,2.57142857142857,2,3.25,2.25,4,3,3,3,3,3,3.5,2.6,1,3,4,4,4,4,4
"44",66,"ujswuf6sss8k93c9","02/27/2023 14:59","qualified,/Gender/X0TrF,/Age/b3xfu,/Total/Total",3,1,1,1,1,1,1,2,58,2,3,"",3,1,"",2,1,6,8.2008,40,48,2,NA,NA,NA,4,"","Bewaffneter Geldbote",5,10,3,1,NA,NA,NA,NA,NA,NA,NA,NA,NA,NA,NA,NA,NA,NA,NA,NA,NA,NA,NA,NA,NA,NA,NA,NA,NA,2,4,5,3,5,5,5,5,4,5,5,5,1,2,5,2,4,1,1,1,4,3,1,2,1,2,4,5,2,10,1,9,2,2,3,3,4,3,2,4,2,2,2,3,2,4,4,4,3,4,4,4,4,4,5,2,1,3,3,5,4,1,1,1,1,1,5,4,1,1,1,1,1,1,1,1,1,1,2,1,1,1,1,5,NA,NA,1,6,6,1,1,1,4,9,2,2,2,4,2,1,1,2,0,0,0,0,0,0,0,0,0,1,3,1,1,1,2,1,3,1,4,5,5,6,6,6,6,6,5,5,5,5,5,5,5,4,4,5,4,4,4,5,5,5,5,5,5,5,5,4,5,5,5,5,5,4,5,5,5,5,1,5,2,5,2,1,1653.88,4,NA,10,NA,5,6,"02/27/2023 14:31",NA,NA,NA,1,"Mozilla/5.0 (Windows NT 10.0; Win64; x64) AppleWebKit/537.36 (KHTML, like Gecko) Chrome/110.0.0.0 Safari/537.36","jh85uc0s27mns63c","y7d7p8w40gaeqwta",NA,NA,"..","/survey/selfserve/53b/g004/230146?list=1&ID=237111539460337","y7d7p8w40gaeqwta","237111539460337",731,2023-04-14 19:20:00,3,1,1,1,1,1,1,2,58,2,"",2,"",4,9,2,2,2,4,2,1,1,2,0,0,0,0,0,0,0,0,0,2,1,4,1,1,1,4,2,5,1,2,1,3,1,2,NA,NA,"",NA,"",NA,NA,NA,"",5,5,NA,NA,NA,NA,NA,NA,NA,NA,NA,"",NA,"",0,0,0,0,0,0,1,1,0,0,"","",2,NA,NA,"",2,NA,NA,NA,NA,NA,"",0,2,NA,NA,NA,"",5,5,2,"",NA,NA,NA,"","","",5,5,2,"",NA,NA,NA,"","","",5,5,2,"",NA,NA,NA,"","","",5,5,2,"",NA,NA,NA,"","","",5,1,2,"",NA,NA,NA,"","","",5,5,2,"",NA,NA,NA,"","","",5,5,1,"Module für Lastkraftwagen",2,NA,4,"","","0",NA,NA,2,"",NA,NA,NA,"","","",1,1,2,"",NA,NA,NA,NA,"",NA,1,1,2,"",NA,NA,NA,"",3,3,2,"",NA,NA,NA,"","","",1,1,2,"",NA,NA,NA,"","","",1,1,2,"",NA,NA,NA,"","","",1,1,2,"",NA,NA,NA,NA,"","",3,1,2,"",NA,NA,NA,NA,"","",1,1,0,0,0,0,0,0,0,0,0,1,"0",0,0,0,0,0,0,0,0,0,1,"0",0,0,0,0,0,0,0,0,0,1,"0",1,1,NA,NA,NA,NA,1,2,NA,2,"",NA,NA,3,NA,2,2,3,3,3,2,2,"",1,1,1,1,1,1,1,5,5,5,5,5,5,5,5,4,3,4,5,5,5,5,5,5,4,5,4,4,5,5,3,3,3,3,3,3,5,5,5,5,4,4,3,3,5,5,5,5,4,2,3,5,5,5,4,3,5,4,4,5,5,5,5,5,2,4,5,4,5,5,5,5,1,1,1,1,1,1,1,1,1,3,1,1,1,1,1,4,5,5,5,4,1,1,4,1,4,4,5,5,4,3,1,1,4,1,1,1,1,2,1,3,5,1,1,1,1590.11,5,"0wkadrurh4jtx3h4",NA,NA,"..","/survey/selfserve/53b/g004/230372?list=1&ID=241166931206210","0wkadrurh4jtx3h4","241166931206210",27.5646666666667,26.5018333333333,0,82008,"01-08-2008",2008-08-01,177,14,9,14.09,5480,2008,15,4,5,4.66666666666667,5,1.5,3.5,2.5,1,3.5,1.5,2.33333333333333,1.5,NA,4.8,2.6,2.75,2.66666666666667,2.66666666666667,3.8,3.33333333333333,4,3.66666666666667,2.33333333333333,1,1,1.2,1,1.33333333333333,1,1.33333333333333,3,4.54545454545455,5,4.33333333333333,4,4.91666666666667,5,5,4.66666666666667,5,4.83333333333333,5,4,4,4.66666666666667,52.83,48.33,46.92,40.07,55.62,55.25,56.79,45.66,67.8491957,57.7324457,53.544395,44.176005,0,3,4,2,1.8,2,1.66666666666667,5.55555555555556,5.33333333333333,6,5.33333333333333,52.83,48.33,46.92,40.07,55.62,55.25,56.79,45.66,67.8491957,57.7324457,53.544395,44.176005,0,2,2,1,3,1.5,1.75,1.375,2.75,4.63636363636364,5,5,3.66666666666667,4.75,5,5,4.33333333333333,4.66666666666667,3,4.2,2,3,4.125,4.16666666666667,4,4,4.76923076923077,4.4,5,5,1,1.33333333333333,1,3.71428571428571,4.6,1.75,4.5,4,2,1.4,1.66666666666667,1.33333333333333,1.25,2.5,1,1,1,5,4.5,3.33333333333333,5,3.5
"45",68,"5yf47mf7wz00e6yk","02/27/2023 16:22","qualified,/Gender/X0TrF,/Age/b3xfu,/Total/Total",3,1,1,1,1,1,1,2,63,2,5,"",2,1,"",1,1,5,6.201,40,40,2,NA,NA,NA,1,"","REFA und MTM Fachmann Lederverarbeitung",4,2,6,1,NA,NA,NA,NA,NA,NA,NA,NA,NA,NA,NA,NA,NA,NA,NA,NA,NA,NA,NA,NA,NA,NA,NA,NA,NA,2,2,4,3,4,4,2,1,3,2,4,1,1,1,1,1,4,3,2,1,1,1,1,1,1,1,1,1,1,1,1,1,1,1,1,1,1,1,1,1,1,1,1,1,1,1,1,1,1,1,5,5,5,5,5,5,5,5,5,4,2,3,1,1,1,1,2,3,1,1,1,1,1,1,1,1,1,1,1,1,5,1,1,1,NA,NA,0,1,1,1,1,1,4,3,4,4,3,1,4,2,1,1,3,3,0,5,1,1,0,6,1,2,4,3,3,2,3,1,2,2,2,0,0,2,2,2,1,2,2,1,5,5,5,5,5,5,5,5,5,5,5,3,3,3,3,3,3,4,4,4,3,3,3,4,4,4,4,4,4,3,3,3,3,3,3,1,1009.323,4,NA,12,NA,5,6,"02/27/2023 16:05",NA,NA,NA,1,"Mozilla/5.0 (Windows NT 10.0; Win64; x64; rv:109.0) Gecko/20100101 Firefox/110.0","fbcpy16cu258v1h0","nu2kvdsdy85jhjh0",NA,NA,"..","/survey/selfserve/53b/g004/230146?list=1&ID=237104974310607","gjvfs9t15efnh0gj","237104974310607",609,2023-04-14 15:23:00,3,1,1,1,1,1,1,2,63,2,"",2,"",5,4,4,3,3,1,4,1,1,1,0,0,0,5,0,0,0,5,0,3,1,5,3,2,1,4,1,4,2,3,1,3,1,2,NA,NA,"",NA,"",NA,NA,NA,"",1,1,NA,NA,NA,NA,NA,NA,NA,NA,NA,"",NA,"",0,0,0,0,0,0,1,0,0,0,"","",2,NA,NA,"",2,NA,NA,NA,NA,NA,"",0,2,NA,NA,NA,"",1,1,2,"",NA,NA,NA,"","","",1,1,2,"",NA,NA,NA,"","","",1,1,2,"",NA,NA,NA,"","","",1,1,2,"",NA,NA,NA,"","","",1,1,2,"",NA,NA,NA,"","","",1,1,2,"",NA,NA,NA,"","","",1,1,2,"",NA,NA,NA,"","","",5,5,2,"",NA,NA,NA,"","","",5,5,2,"",NA,NA,NA,NA,"",NA,1,1,2,"",NA,NA,NA,"",1,1,2,"",NA,NA,NA,"","","",1,1,2,"",NA,NA,NA,"","","",1,1,2,"",NA,NA,NA,"","","",1,1,2,"",NA,NA,NA,NA,"","",1,1,2,"",NA,NA,NA,NA,"","",1,1,0,0,0,0,0,0,0,0,0,1,"nichts",0,0,0,0,0,0,0,0,0,1,"nichts",0,0,0,0,0,0,0,0,0,1,"nichts",1,3,2,NA,5,5,1,2,NA,2,"",NA,NA,2,NA,2,2,1,1,1,1,2,"",1,1,1,1,0,0,1,5,5,5,5,5,5,5,5,5,5,5,4,4,4,4,5,5,5,5,5,5,5,5,1,1,1,1,1,1,1,1,1,1,1,4,1,1,1,1,1,1,4,1,1,1,1,3,4,3,3,1,1,3,3,3,3,3,3,3,3,3,4,4,4,4,1,1,1,1,1,1,1,1,1,1,1,1,1,5,1,3,1,1,1,1,1,1,1,1,1,1,1,1,1,1,1,1,1,1,1,1,1,1,1,1,4,1,1,1,1230.15,5,"nu2kvdsdy85jhjh0",NA,NA,"..","/survey/selfserve/53b/g004/230372?list=1&ID=241166931195067","gjvfs9t15efnh0gj","241166931195067",16.82205,20.5025,0,62010,"01-06-2010",2010-06-01,155,12,11,12.11,4811,2010,13,3,4,2,2.33333333333333,1,1,3.5,1.5,1,1,1,1,1,1,1,1,1,1,1,5,5,5,5,1,1,1,1,1,1,1,1,5,5,5,5,3.25,3,3,4,3,4,3,3,3,3,38.41,30.31,38.71,60.77,35.81,49.47,56.79,52.42,67.9060898,57.7893398,46.2520339,36.8836439,2.22222222222222,2,3,4,2.4,2.75,2.16666666666667,1.33333333333333,0.666666666666667,2,1.33333333333333,38.41,40.07,38.71,60.77,35.81,55.25,56.79,52.42,67.2656626,57.1489126,49.3055517,39.9371617,1.11111111111111,1,2,2,3,1.83333333333333,1.75,1.875,1,5,5,5,5,4.66666666666667,4,4.66666666666667,5,5,1,1.4,2,3,1.875,2.16666666666667,1,3,3.30769230769231,3,3,4,1,1,3,1.14285714285714,1.4,1,1,1,5,1.4,1,2.33333333333333,1,1.75,1.4,1,2,1,1,2,1,1.75
"46",71,"g4fmduzp87jvykzh","02/27/2023 16:53","qualified,/Gender/X0TrF,/Age/gcKvr,/Total/Total",3,1,1,1,1,1,1,2,43,1,5,"",3,1,"",1,1,4,7.2015,40,40,2,NA,NA,NA,11,"","Geomatiker",4,3,4,1,NA,NA,NA,NA,NA,NA,NA,NA,NA,NA,NA,NA,NA,NA,NA,NA,NA,NA,NA,NA,NA,NA,NA,NA,NA,2,4,4,2,5,5,4,4,4,5,5,4,2,2,2,3,2,2,1,1,4,4,3,3,3,5,3,5,8,10,8,9,4,3,2,5,4,4,5,5,5,3,3,4,4,3,3,3,1,2,4,3,4,4,3,3,2,1,2,3,3,1,1,1,1,2,5,5,5,5,5,1,1,1,1,4,3,3,1,1,2,4,1,4,2,40,0,1,1,1,1,1,5,10,2,1,1,1,3,1,1,1,0,0,1,0,0,0,0,0,0,1,5,1,1,1,5,1,1,1,3,2,5,2,1,2,0,1,3,0,5,5,5,5,5,4,4,2,5,4,5,2,2,1,5,5,5,4,5,3,4,1,1,4,3,4,3,3,4,4,3,4,2,4,2,1,2371.949,14,NA,10,NA,1,2,"02/27/2023 16:13",NA,NA,NA,1,"Mozilla/5.0 (Linux; Android 8.0.0; SAMSUNG SM-G935F/G935FXXU8EUE1) AppleWebKit/537.36 (KHTML, like Gecko) SamsungBrowser/20.0 Chrome/106.0.5249.126 Mobile Safari/537.36","us9quafzbne5ftsd","7x8q5s2ufeceqgku",NA,NA,"sa","/survey/selfserve/53b/g004/230146?list=1&ID=237129246473411","7x8q5s2ufeceqgku","237129246473411",438,2023-04-14 13:17:00,3,1,1,1,1,1,1,2,43,2,"",2,"",4,9,3,1,1,2,3,1,1,1,0,0,1,0,0,0,0,0,0,2,1,1,1,1,1,5,1,5,1,1,1,3,1,1,2,NA,"",NA,"",2,NA,2,"",NA,NA,1,0,0,0,0,0,0,0,0,"",1,"",0,0,0,0,0,0,0,0,1,0,"","",2,NA,NA,"",2,NA,NA,NA,NA,NA,"",0,2,NA,NA,NA,"",2,1,2,"",NA,NA,NA,"","","",1,1,2,"",NA,NA,NA,"","","",1,1,2,"",NA,NA,NA,"","","",1,1,2,"",NA,NA,NA,"","","",1,1,3,"",NA,NA,NA,"","","",2,2,1,"Team Events",1,2,NA,"","","",NA,NA,1,"Schulungen",1,5,NA,"","","",NA,NA,1,"Tischhöhe verstellbar",1,5,NA,"","","",NA,NA,2,"",NA,NA,NA,NA,"",NA,1,1,3,"",NA,NA,NA,"",3,1,1,"Teilzeit und homeoffice",1,5,NA,"","","",NA,NA,1,"Weiß nicht  genau, aber gibt es",2,NA,2,"","","",NA,NA,2,"",NA,NA,NA,"","","",1,1,2,"",NA,NA,NA,NA,"","",1,1,2,"",NA,NA,NA,NA,"","",1,1,0,0,0,0,0,0,0,0,0,1,"Keine",0,0,0,0,0,0,0,0,0,1,"Keine",0,0,0,0,0,0,0,0,0,1,"Keine",3,1,NA,NA,NA,NA,1,2,NA,2,"",NA,NA,1,1,3,2,3,3,3,2,2,"",3,1,4,2,40,0,1,5,5,5,5,5,5,5,4,4,4,4,2,2,1,5,5,5,3,4,4,3,1,1,3,3,2,2,3,3,4,3,4,3,4,2,3,3,4,4,4,3,3,4,3,4,4,4,1,1,4,4,3,3,5,2,2,3,3,4,3,4,5,3,4,4,1,1,1,1,1,1,1,2,2,3,2,1,1,1,1,4,2,3,4,2,1,2,1,1,2,1,4,3,5,3,3,1,1,1,1,3,3,4,4,2,5,3,4,3,2035.4,1,"kmqg09d4h8925qnf",NA,NA,"sa","/survey/selfserve/53b/g004/230372?list=1&ID=241183254218833","kmqg09d4h8925qnf","241183254218833",39.5324833333333,33.9233333333333,0,72015,"01-07-2015",2015-07-01,94,7,10,7.1,2955,2015,8,3.33333333333333,5,4,4.66666666666667,2,2.5,2,1,4,3,3.66666666666667,4,NA,7.8,3.2,4.75,4,3.91666666666667,2.4,2.88888888888889,3.66666666666667,3.33333333333333,1.66666666666667,5,1,2.4,3.5,1.66666666666667,3.5,1.66666666666667,1,4.45454545454545,5,3.33333333333333,4.66666666666667,3.16666666666667,1.66666666666667,5,4,2,3.5,3,4,4,3.83333333333333,52.83,54.05,53.98,60.77,45.16,55.25,56.79,52.42,64.9089797,54.7922297,64.9666528,55.5982628,0.111111111111111,1,1,3,1.2,1.5,1,1.77777777777778,3,1.33333333333333,1,46.43,54.05,53.98,53.35,45.16,55.25,56.79,52.42,64.8629991,54.7462491,61.1662244,51.7978344,0.111111111111111,5,1,1,3,1.5,1.5,1.5,2.75,4.63636363636364,5,4.66666666666667,4,3,1.66666666666667,5,3.66666666666667,1.66666666666667,2.66666666666667,3.4,5,5,4.125,4.33333333333333,3.5,3,3.46153846153846,3.4,3,4,1,1.83333333333333,1,2.5,3,1.25,2.5,5,5,2.8,2.33333333333333,2.33333333333333,3.5,3.5,1.2,1,1,3.66666666666667,3.5,2.66666666666667,4,3.25
"47",73,"5t4x9mnp68a6v3bd","02/27/2023 16:29","qualified,/Gender/p47uy,/Age/b3xfu,/Total/Total",3,1,1,1,1,1,1,1,59,2,3,"",3,1,"",1,1,3,10.2013,40,40,2,NA,NA,NA,10,"","Kfm.Angestellte",8,7,1,2,2,2,1,NA,57,NA,NA,NA,NA,NA,NA,NA,NA,NA,1,NA,NA,NA,NA,NA,NA,NA,NA,NA,NA,2,3,4,5,5,1,5,4,5,5,5,3,1,1,2,2,1,3,1,1,4,4,2,1,1,3,4,1,6,5,5,4,3,3,3,3,2,3,2,4,2,3,3,2,2,4,4,4,1,4,3,5,5,5,5,4,5,5,5,4,4,4,1,1,1,1,5,5,3,3,5,1,1,1,1,2,1,1,1,1,5,1,1,1,NA,NA,2,6,1,1,1,1,5,10,1,1,1,1,1,1,1,1,0,0,0,0,0,0,0,0,0,1,5,1,1,1,1,1,1,1,1,6,6,6,6,6,4,6,5,6,5,5,5,5,5,5,5,5,3,3,5,5,5,4,5,5,5,5,5,5,4,5,5,5,5,5,5,5,5,5,1,5,1,5,1,1,655.286,14,NA,10,NA,1,2,"02/27/2023 16:18",NA,NA,NA,1,"Mozilla/5.0 (Linux; Android 13; SM-A515F) AppleWebKit/537.36 (KHTML, like Gecko) Chrome/108.0.5359.215 Mobile Safari/537.36 OPR/73.3.3844.70500","rzaz5ua340qu68k2","gw6e1q3kyegugh8n",NA,NA,"sa","/survey/selfserve/53b/g004/230146?list=1&ID=237129246466134","pfqncn1h39t58y7t","237129246466134",423,2023-04-14 12:16:00,3,1,1,1,1,1,1,1,59,2,"",2,"",4,10,2,1,1,1,2,1,1,1,0,0,0,0,0,0,0,0,0,1,1,5,1,1,1,5,1,5,1,1,1,4,1,2,NA,NA,"",NA,"",NA,NA,NA,"",1,1,NA,NA,NA,NA,NA,NA,NA,NA,NA,"",NA,"",0,0,0,0,0,0,1,0,0,0,"","",2,NA,NA,"",2,NA,NA,NA,NA,NA,"",2,2,NA,NA,NA,"",1,4,2,"",NA,NA,NA,"","","",1,3,2,"",NA,NA,NA,"","","",1,2,2,"",NA,NA,NA,"","","",1,1,2,"",NA,NA,NA,"","","",1,1,2,"",NA,NA,NA,"","","",1,1,2,"",NA,NA,NA,"","","",3,1,2,"",NA,NA,NA,"","","",1,3,2,"",NA,NA,NA,"","","",3,4,2,"",NA,NA,NA,NA,"",NA,1,1,2,"",NA,NA,NA,"",1,1,2,"",NA,NA,NA,"","","",1,1,2,"",NA,NA,NA,"","","",1,1,2,"",NA,NA,NA,"","","",1,1,2,"",NA,NA,NA,NA,"","",1,1,2,"",NA,NA,NA,NA,"","",1,1,0,0,0,0,0,0,0,0,0,1,"keine",0,0,0,0,0,0,0,0,0,1,"keine",0,0,0,0,0,0,0,0,0,1,"keine",2,1,NA,NA,NA,NA,2,NA,NA,NA,"",1,1,2,NA,2,2,3,3,1,1,2,"",1,1,1,1,0,0,1,5,5,5,5,5,5,5,5,5,5,5,5,5,5,5,5,5,5,5,5,5,5,5,3,4,4,4,4,4,5,5,5,5,5,5,1,4,5,5,4,4,4,5,5,4,5,5,1,1,5,5,4,5,4,5,2,4,1,5,5,5,5,5,5,5,1,1,1,1,1,1,1,1,1,1,1,1,1,1,1,4,1,5,3,3,1,1,1,1,1,1,1,1,1,4,1,1,1,1,1,1,1,1,1,1,1,1,1,1,2399.64,5,"rz0g43srak7kn71r",NA,NA,"..","/survey/selfserve/53b/g004/230372?list=1&ID=241166931201255","rz0g43srak7kn71r","241166931201255",10.9214333333333,39.994,-2,102013,"01-10-2013",2013-10-01,115,9,7,9.07,3593,2013,10,4,3,4.66666666666667,4.33333333333333,1,2,2,1,4,1.5,2.66666666666667,2,1,4.6,3.2,2.25,2.33333333333333,2.66666666666667,3.4,4.66666666666667,4.33333333333333,4.66666666666667,5,3.66666666666667,1,1.2,1.5,1,1.5,1,2,4.63636363636364,5,5,3.66666666666667,4.83333333333333,4.66666666666667,5,5,4.66666666666667,5,5,5,5,5,59.45,54.05,53.98,60.77,61.83,55.25,56.79,52.42,69.432978,59.316228,68.008793,58.640403,0,1,5,5,1.8,3,1,5.66666666666667,6,6,5,52.83,54.05,53.98,60.77,55.62,55.25,56.79,52.42,67.5970951,57.4803451,66.0444512,56.6760612,0,1,1,1,2,1.08333333333333,1.25,1,2,5,5,5,5,5,5,5,5,5,3.83333333333333,4.46666666666667,5,5,4.75,4.83333333333333,4.5,5,4.61538461538461,5,3.75,5,1,1,1,1.78571428571429,3.2,1,1,1,5,1.7,2,2.33333333333333,1,1,1.6,1,2,5,5,3.33333333333333,4.66666666666667,4.5
"48",74,"p68g2bqdtree9vvd","02/27/2023 16:58","qualified,/Gender/X0TrF,/Age/b3xfu,/Total/Total",3,1,1,1,1,1,1,2,63,2,2,"",2,1,"",1,1,6,1.2009,40,0,2,NA,NA,NA,12,"sicherheitsunternehmen","sicherheitsmtarbeiter",4,10,1,2,3,3,1,NA,58,31,NA,NA,NA,NA,NA,NA,NA,NA,1,2,NA,NA,NA,NA,NA,NA,NA,NA,NA,2,4,4,3,3,5,3,3,3,3,2,3,3,3,3,3,3,3,2,3,3,3,2,2,3,3,3,1,4,3,2,8,7,2,2,3,3,3,4,3,4,2,2,3,3,1,5,1,1,1,1,1,1,3,3,4,4,4,4,2,2,2,2,1,1,2,3,3,1,4,3,1,1,1,1,1,1,1,1,1,4,2,1,2,2,4,1,1,1,1,4,1,3,8,3,1,1,1,2,1,1,1,0,2,0,1,0,0,0,0,0,2,2,2,2,1,5,1,1,1,1,3,5,5,5,5,4,5,5,5,4,4,4,4,4,5,4,5,3,4,5,5,5,5,5,5,5,5,3,3,4,5,5,5,5,3,5,4,5,3,4,2,4,4,4,1,2306.008,4,NA,10,NA,5,6,"02/27/2023 16:19",NA,NA,NA,1,"Mozilla/5.0 (Windows NT 10.0; Win64; x64) AppleWebKit/537.36 (KHTML, like Gecko) Chrome/110.0.0.0 Safari/537.85","u9h0mnrqytdw8qe9","r6uu5w1rtcr1jdm9",NA,NA,"..","/survey/selfserve/53b/g004/230146?list=1&ID=237104974311647","r6uu5w1rtcr1jdm9","237104974311647",656,2023-04-14 16:41:00,3,1,1,1,1,1,1,2,63,1,"nichts verändert",2,"",4,9,3,1,1,1,2,1,1,1,1,1,0,1,1,1,0,0,0,1,1,1,1,1,1,1,1,1,1,1,1,1,1,2,NA,NA,"",NA,"",NA,NA,NA,"",3,3,NA,NA,NA,NA,NA,NA,NA,NA,NA,"",NA,"",1,0,0,0,0,0,0,0,0,0,"","",2,NA,NA,"",2,NA,NA,NA,NA,NA,"",0,2,NA,NA,NA,"",1,1,2,"",NA,NA,NA,"","","",5,5,2,"",NA,NA,NA,"","","",5,5,2,"",NA,NA,NA,"","","",5,5,2,"",NA,NA,NA,"","","",5,5,3,"",NA,NA,NA,"","","",5,5,2,"",NA,NA,NA,"","","",5,5,2,"",NA,NA,NA,"","","",5,5,2,"",NA,NA,NA,"","","",5,5,2,"",NA,NA,NA,NA,"",NA,5,5,2,"",NA,NA,NA,"",5,5,2,"",NA,NA,NA,"","","",5,5,2,"",NA,NA,NA,"","","",5,5,2,"",NA,NA,NA,"","","",3,3,2,"",NA,NA,NA,NA,"","",5,5,2,"",NA,NA,NA,NA,"","",5,5,0,0,0,1,0,0,0,0,0,0,"",1,0,0,0,0,0,0,0,0,0,"",0,1,0,0,0,0,0,0,0,0,"",1,1,NA,NA,NA,NA,2,NA,NA,NA,"",5,5,2,NA,3,3,5,5,5,5,2,"",1,1,3,1,1,1,1,5,5,5,5,2,5,5,5,5,5,5,5,5,5,5,5,5,5,5,5,5,5,1,2,2,2,2,2,4,5,5,5,5,5,5,5,5,5,5,5,5,5,5,5,5,5,5,5,5,5,5,5,5,5,5,5,2,2,2,2,2,2,2,2,2,1,1,1,1,1,1,1,1,1,1,1,1,1,1,1,3,3,3,3,3,3,3,3,3,3,3,3,3,3,1,1,1,1,1,1,1,1,1,1,1,1,1,1,3,1508.49,5,"5h8kx084crey75kk",NA,NA,"..","/survey/selfserve/53b/g004/230372?list=1&ID=241183254202443","5h8kx084crey75kk","241183254202443",38.4334666666667,25.1415,0,12009,"01-01-2009",2009-01-01,172,14,4,14.04,5327,2009,14,3.66666666666667,4,3,2.66666666666667,3,3,3,2.5,3,2,3,3,1,4.8,2.2,3.5,3,2.83333333333333,1.8,2.77777777777778,1,3.33333333333333,4,2.66666666666667,1,1,1,1,1,1,1.6,4.18181818181818,4,4.66666666666667,4,4.58333333333333,5,5,3.66666666666667,4.66666666666667,4.5,2,2,2,2.5,46.43,54.05,53.98,60.77,55.62,55.25,56.79,52.42,67.3650951,57.2483451,64.7640032,55.3956132,0.333333333333333,4,1,5,2,2,2,4.66666666666667,4.33333333333333,5,4.66666666666667,46.43,54.05,53.98,60.77,55.62,55.25,56.79,52.42,67.3650951,57.2483451,64.7640032,55.3956132,0.555555555555556,5,5,5,5,2.33333333333333,3,2,5,4.72727272727273,4.4,5,5,4.66666666666667,5,5,5,3.66666666666667,2.33333333333333,5,1,1,4,3.66666666666667,5,4,3.07692307692308,3,4.25,2,1,1,1,3,3,3,3,3,5,1.4,1,2.33333333333333,1,1,1.6,1,1,5,5,5,5,5
"49",75,"w69fe2pxk7sb4c9j","03/09/2023 15:43","qualified,/Gender/p47uy,/Age/b3xfu,/Total/Total,20230301_12:51_v2",3,1,1,1,1,1,1,1,57,2,5,"",6,1,"",1,1,6,8.2,35,35,2,NA,NA,NA,5,"","Anwendungsbetreuerin",6,9,4,1,NA,NA,NA,NA,NA,NA,NA,NA,NA,NA,NA,NA,NA,NA,NA,NA,NA,NA,NA,NA,NA,NA,NA,NA,NA,2,4,4,3,4,1,4,4,4,2,2,2,2,4,2,2,2,2,1,1,4,2,4,2,4,3,2,3,6,1,2,6,5,4,3,4,4,4,3,3,3,1,1,2,3,2,3,2,3,2,4,4,4,3,3,3,3,2,3,3,2,4,2,3,1,4,5,5,5,5,5,1,1,1,1,4,4,5,1,1,2,5,1,1,3,100,100,1,1,1,1,1,3,2,5,4,4,4,5,3,4,4,6,6,6,6,5,3,1,6,3,3,3,5,4,1,4,1,3,1,2,0,0,0,0,0,0,1,0,0,4,4,4,4,5,2,2,2,4,1,3,2,1,1,2,2,5,4,4,3,1,2,1,1,4,2,2,2,3,1,5,1,5,1,5,1,896.345,13,NA,11,NA,5,6,"02/27/2023 16:23",NA,NA,NA,1,"Mozilla/5.0 (Macintosh; Intel Mac OS X 10_15_7) AppleWebKit/605.1.15 (KHTML, like Gecko) Version/16.3 Safari/605.1.15","ncxn90bv99a139rw","50xp4czme611m41w",NA,NA,"..","/survey/selfserve/53b/g004/230146?list=1&ID=237129246468203","50xp4czme611m41w","237129246468203",445,2023-04-14 13:06:00,3,1,1,1,1,1,1,1,57,2,"",2,"",3,2,4,3,4,4,5,3,5,4,5,5,6,3,5,2,2,6,3,3,4,3,5,3,3,3,1,4,2,2,3,3,1,1,2,NA,"",NA,"",1,3,NA,"",NA,NA,1,1,0,0,0,0,0,0,1,"Schwerbehindertenvertretung",9,"Schwerbehindertenvertretung",0,0,0,0,0,0,1,0,0,0,"","",1,2,3,"",3,NA,NA,NA,NA,NA,"",0,1,2,NA,3,"",NA,NA,3,"",NA,NA,NA,"","","",1,1,1,"“Stress-Talk”",2,NA,4,"","","Mir egal",1,1,3,"",NA,NA,NA,"","","",1,1,3,"",NA,NA,NA,"","","",1,1,1,"Arbeitssicherheitsschulungen",1,4,NA,"","","",NA,NA,3,"",NA,NA,NA,"","","",3,2,1,"Zu viele, um sie aufzuzählen- wir sind ein großes, internationales IT- Unternehmen",1,3,NA,"","","",NA,NA,1,"Beratung der Fachkraft für Arbeitssicherheit",2,NA,5,"Ich war selber Sicherheitsbeauftragte","","",NA,NA,3,"",NA,NA,NA,NA,"",NA,3,1,1,"Unsere arbeitsmedizinische Vertragsfirma",1,3,NA,"",NA,NA,1,"Alle. Großer Konzern.",1,4,NA,"","","",NA,NA,3,"",NA,NA,NA,"","","",1,1,3,"",NA,NA,NA,"","","",1,1,1,"Keine Ahnung",2,NA,4,NA,"","Keine Ahnung",NA,NA,3,"",NA,NA,NA,NA,"","",2,1,1,0,0,1,0,1,0,1,1,0,"",0,0,0,1,0,0,0,0,0,0,"",0,0,0,1,0,0,0,0,0,0,"",1,1,NA,NA,NA,NA,1,1,1,NA,"",NA,NA,1,1,1,1,3,3,2,2,2,"",4,4,5,3,100,100,1,4,4,4,3,4,2,2,2,3,3,3,2,1,1,2,2,4,3,3,3,2,2,2,3,3,4,3,3,4,5,4,5,4,5,4,3,4,5,4,5,3,4,3,4,4,4,4,4,3,5,3,2,3,3,4,2,3,2,2,4,4,3,5,5,4,1,1,3,1,1,1,1,2,1,5,4,3,2,2,1,3,3,4,4,2,5,5,3,5,1,3,3,1,5,2,3,3,3,3,2,4,3,4,2,3,3,3,3,4,1286.36,5,"50xp4czme611m41w",NA,NA,"..","/survey/selfserve/53b/g004/230372?list=1&ID=241183254209701","50xp4czme611m41w","241183254209701",14.9390833333333,21.4393333333333,0,82000,"01-08-2000",2000-08-01,273,22,9,22.09,8402,2000,23,3.66666666666667,2.5,4,2,3,2,2,1,3,3,3,3.5,3,4,2.4,3.5,3,2.91666666666667,2.4,3.22222222222222,4,3,2.66666666666667,5,1,3,4,2.33333333333333,4,2.33333333333333,1,3.18181818181818,4.2,2,2.66666666666667,2.33333333333333,1.33333333333333,3,3.66666666666667,1.33333333333333,2.33333333333333,1,1,1,1,32.56,30.31,28.32,40.07,28.14,40.41,31.62,29.25,39.2022977,29.0855477,38.5594187,29.1910287,4.66666666666667,3,2,4,2.7,2,3.16666666666667,0.111111111111111,0,0.333333333333333,0,38.41,40.07,28.32,40.07,28.14,40.41,21.4,29.25,30.2002558,20.0835058,45.6957758,36.3273858,4.11111111111111,3,3,2,3,2.83333333333333,3,2.75,2.5,3.09090909090909,3.8,2,3,2.25,1.33333333333333,2.66666666666667,3,2,3.33333333333333,4.13333333333333,2,3,3.375,3.66666666666667,2.5,4,3.53846153846154,3.4,3,4.25,1.28571428571429,2.83333333333333,1.5,3.35714285714286,3.2,4.5,2,5,3,2.9,2.66666666666667,2.66666666666667,3.25,3,2.8,3,4,4.66666666666667,4.5,3.66666666666667,4.66666666666667,3.5
"50",76,"3xf5tf9d6bzk033h","02/27/2023 16:46","qualified,/Gender/p47uy,/Age/b3xfu,/Total/Total",3,1,1,1,1,1,1,1,57,2,5,"",5,1,"",1,1,4,8.2022,40,40,2,NA,NA,NA,1,"","Buchhalterin",8,14,3,2,2,2,1,NA,69,NA,NA,NA,NA,NA,NA,NA,NA,NA,1,NA,NA,NA,NA,NA,NA,NA,NA,NA,NA,2,3,5,3,4,4,5,4,5,4,5,4,1,1,1,1,1,2,1,1,4,4,4,4,2,4,4,1,7,8,7,8,8,3,4,4,4,4,4,4,4,3,3,4,3,5,5,5,5,5,5,5,5,5,5,5,5,5,5,4,4,4,4,3,2,3,5,5,5,4,3,1,1,1,1,5,5,1,1,1,5,1,1,1,NA,NA,1,1,1,1,1,1,5,10,1,2,1,2,1,1,1,1,0,0,0,0,0,0,0,0,0,1,5,1,1,1,5,1,1,1,2,6,6,6,6,6,6,6,6,6,5,5,5,5,5,5,5,5,5,5,5,4,4,4,5,5,5,5,5,5,4,4,4,4,4,4,5,4,4,5,1,5,1,5,1,1,1290.03,14,NA,10,NA,5,6,"02/27/2023 16:24",NA,NA,NA,1,"Mozilla/5.0 (X11; Linux x86_64) AppleWebKit/537.36 (KHTML, like Gecko) SamsungBrowser/19.0 Chrome/102.0.5005.125 Safari/537.36","wdr4hxafmtjf1dm8","atdkxewmyb6wmeqb",NA,NA,"..","/survey/selfserve/53b/g004/230146?list=1&ID=237129246475491","atdkxewmyb6wmeqb","237129246475491",713,2023-04-14 18:52:00,3,1,1,1,1,1,1,1,57,2,"",2,"",5,9,1,1,1,1,1,1,1,1,0,0,0,0,0,0,0,0,0,1,1,5,1,1,1,5,1,5,1,1,1,3,1,1,2,NA,"",NA,"",2,NA,2,"",NA,NA,0,1,0,0,0,0,0,0,0,"",2,"",0,1,0,0,0,0,0,0,0,0,"","",1,3,NA,"",3,NA,NA,NA,NA,NA,"",1,2,NA,NA,NA,"",1,1,1,"Pausenfitness, Fitnesskurs",1,3,NA,"","","",NA,NA,3,"",NA,NA,NA,"","","",NA,NA,1,"Gesundes Frühstück",1,4,NA,"","","",NA,NA,3,"",NA,NA,NA,"","","",1,1,1,"Sicherheitstraining, Sicherheitsbefragung, AS-Quiz",1,4,NA,"","","",NA,NA,1,"Teamfinding, Firmenfahrten",1,4,NA,"","","",NA,NA,1,"Arbeitsplatzbezogene",1,4,NA,"","","",NA,NA,1,"Arbeitsplatz an meinen Körper angepasst, höhenverstellbarer Tisch",1,4,NA,"","","",NA,NA,3,"",NA,NA,NA,NA,"",NA,3,3,1,"Vorgesetzt, QM, Personalabteilung",1,4,NA,"",NA,NA,1,"Gleitzeit",1,5,NA,"","","",NA,NA,1,"Zahlung der Kinderkrippe/Kindergarten für Kibder oder Enkel",2,NA,2,"","","",NA,NA,1,"Siehe vorherige Antwort",2,NA,2,"","","",NA,NA,3,"",NA,NA,NA,NA,"","",3,4,3,"",NA,NA,NA,NA,"","",1,2,0,0,0,1,0,1,0,1,1,0,"",0,0,0,0,0,0,0,0,0,1,"Keine weiteren",0,0,0,1,0,0,0,0,0,0,"",1,1,NA,NA,NA,NA,1,2,NA,2,"",NA,NA,1,1,1,1,4,4,3,3,2,"",5,2,1,1,1,2,1,5,5,5,5,5,5,5,5,5,5,5,5,5,4,5,5,5,5,5,5,5,5,5,4,4,4,4,4,4,5,5,5,5,5,5,5,5,4,4,4,5,5,5,5,5,5,5,1,1,5,5,5,4,4,4,5,4,1,5,5,5,5,5,5,5,1,1,1,1,1,1,1,1,1,1,1,1,1,1,1,5,5,5,5,5,2,2,2,2,3,2,3,3,1,5,3,3,1,4,4,4,4,4,4,4,4,4,4,4,2223.26,5,"atdkxewmyb6wmeqb",NA,NA,"..","/survey/selfserve/53b/g004/230372?list=1&ID=241183254221950","2fvusrajsm7ze83x","241183254221950",21.5005,37.0543333333333,1,82022,"01-08-2022",2022-08-01,9,0,9,0.09,367,2022,1,3.66666666666667,4,4.66666666666667,4.33333333333333,1,1,1.5,1,4,4,3.33333333333333,3,1,7.6,3.4,4,3.66666666666667,3.66666666666667,5,5,5,5,5,4,1,2.6,5,1,5,1,1,5,5,5,5,4.5,4,5,5,4,4.16666666666667,5,5,5,5,59.45,48.33,53.98,53.35,61.83,55.25,56.79,52.42,70.716265,60.599515,63.7416958,54.3733058,0,1,1,4,1.3,1.75,1,6,6,6,6,59.45,54.05,53.98,60.77,61.83,55.25,56.79,52.42,69.432978,59.316228,68.008793,58.640403,0,1,1,1,3,1.16666666666667,1.5,1,3.5,5,5,5,5,4.91666666666667,4.66666666666667,5,5,5,4,4.8,5,5,5,5,5,5,4.69230769230769,4.8,4.25,5,1,1,1,3.21428571428571,5,2,2.75,1,5,4,3.66666666666667,4.33333333333333,4,4,3.2,1,5,5,5,5,4,5
"51",77,"tdzd4y83sdc6z2qa","02/27/2023 17:10","qualified,/Gender/X0TrF,/Age/b3xfu,/Total/Total",3,1,1,1,1,1,1,2,60,2,3,"",2,1,"",1,1,6,10.201,40,40,2,NA,NA,NA,2,"","Archivar",9,7,1,2,2,2,1,NA,62,NA,NA,NA,NA,NA,NA,NA,NA,NA,1,NA,NA,NA,NA,NA,NA,NA,NA,NA,NA,2,2,5,2,4,4,2,4,3,2,2,2,1,1,1,3,1,2,3,3,3,4,3,3,2,3,3,1,1,1,2,5,2,3,2,3,3,3,3,4,3,3,2,3,3,3,3,3,2,2,5,5,5,4,4,4,4,4,4,2,2,2,1,2,1,1,5,4,5,4,2,1,1,1,1,4,4,1,1,1,5,2,1,1,1,2,0,1,1,1,1,1,4,5,5,4,4,5,4,3,2,4,2,5,6,4,3,1,1,1,0,4,2,4,3,2,2,1,3,1,1,2,2,3,3,2,0,5,2,2,4,4,5,5,4,4,3,2,4,4,4,3,3,3,4,4,4,5,5,3,3,3,3,4,4,4,4,4,3,2,4,2,4,3,3,1,2652.592,4,NA,10,NA,5,6,"02/27/2023 16:25",NA,NA,NA,1,"Mozilla/5.0 (Windows NT 10.0; Win64; x64) AppleWebKit/537.36 (KHTML, like Gecko) Chrome/110.0.0.0 Safari/537.36","x3g6560ef6aqqmb4","3kwh8u4g8psagprv",NA,NA,"..","/survey/selfserve/53b/g004/230146?list=1&ID=237104974325820","711ytk3wm59puv0a","237104974325820",1002,2023-04-17 17:23:00,3,1,1,1,1,1,1,2,60,2,"",2,"",4,5,4,4,4,4,4,3,2,2,5,6,5,5,5,2,0,1,0,3,3,3,3,3,2,4,1,1,3,3,1,1,1,3,NA,NA,"",NA,"",NA,NA,NA,"",3,3,NA,NA,NA,NA,NA,NA,NA,NA,NA,"",NA,"",0,0,0,0,0,0,1,1,0,0,"","",1,1,4,"",2,NA,NA,NA,NA,NA,"",0,3,NA,NA,NA,"",2,2,3,"",NA,NA,NA,"","","",2,2,3,"",NA,NA,NA,"","","",1,1,3,"",NA,NA,NA,"","","",1,1,3,"",NA,NA,NA,"","","",1,1,1,"diverse",2,NA,4,"","","die betreffen meine Arbeit nicht",NA,NA,3,"",NA,NA,NA,"","","",3,1,1,"diverse",2,NA,4,"","","die betreffen meine Arbeit nicht",NA,NA,3,"",NA,NA,NA,"","","",3,3,3,"",NA,NA,NA,NA,"",NA,2,2,3,"",NA,NA,NA,"",1,1,3,"",NA,NA,NA,"","","",3,3,3,"",NA,NA,NA,"","","",1,1,3,"",NA,NA,NA,"","","",1,1,3,"",NA,NA,NA,NA,"","",1,1,3,"",NA,NA,NA,NA,"","",1,1,0,0,0,1,0,0,0,1,0,0,"",0,0,0,0,0,0,0,0,0,1,"keine",0,0,0,0,0,0,0,0,0,1,"keine",1,3,1,4,NA,NA,3,NA,NA,NA,"",3,3,3,NA,3,3,4,2,2,2,2,"",4,1,3,1,7,0,4,5,4,4,5,5,5,5,4,4,4,3,4,4,3,4,4,4,5,5,4,3,4,4,2,3,3,2,3,2,4,1,3,3,3,2,4,3,4,3,2,3,3,2,2,5,5,5,5,4,4,3,2,4,4,4,4,4,2,4,4,5,5,4,5,3,2,3,2,3,2,3,3,1,1,5,1,1,1,2,2,4,3,4,4,3,3,4,4,2,4,4,4,4,4,3,3,2,1,3,3,4,3,4,3,3,4,4,4,3,2736.8,5,"3kwh8u4g8psagprv",NA,NA,"..","/survey/selfserve/53b/g004/230372?list=1&ID=241183254216744","711ytk3wm59puv0a","241183254216744",44.2098666666667,45.6133333333333,0,102010,"01-10-2010",2010-10-01,151,12,7,12.07,4689,2010,13,3,4,3,2,1,2,1.5,3,3.5,3,2.66666666666667,2.5,1,2.2,2.8,3,3,2.91666666666667,2.6,4.33333333333333,5,4,4,3.66666666666667,1,2.2,4,1,4,1,1,3.90909090909091,4.4,3,4,3.58333333333333,3,4,4.33333333333333,3,3.83333333333333,2,2,3,2.33333333333333,32.56,30.31,28.32,31.48,35.81,40.41,49.59,29.25,54.2980509,44.1813009,31.1840815,21.8156915,2.55555555555556,4,4,5,3.1,3,3.16666666666667,2.33333333333333,2,3.66666666666667,1.33333333333333,38.41,30.31,28.32,40.07,35.81,40.41,49.59,45.66,60.5248186,50.4080686,35.8435512,26.4751612,3.22222222222222,3,2,5,5,2.83333333333333,2.5,3,2.5,4.36363636363636,4.6,4.66666666666667,3.66666666666667,4,3.66666666666667,4,4.66666666666667,3.66666666666667,2.5,2.8,1,2,3.375,3.66666666666667,2.5,4,4.15384615384615,4.2,4,4.25,2.57142857142857,1.66666666666667,2,3.64285714285714,3.6,3.25,4,4,5,3.3,2.66666666666667,3.66666666666667,3.5,3.75,1.4,1,2,2.66666666666667,3,3,3,2.5
"52",78,"mn2z0cksb3x79296","02/27/2023 16:48","qualified,/Gender/X0TrF,/Age/b3xfu,/Total/Total",3,1,1,1,1,1,1,2,64,2,3,"",2,1,"",1,1,6,10.2005,40,42,2,NA,NA,NA,1,"","CAD-CAM",4,16,5,1,NA,NA,NA,NA,NA,NA,NA,NA,NA,NA,NA,NA,NA,NA,NA,NA,NA,NA,NA,NA,NA,NA,NA,NA,NA,2,2,4,4,4,4,4,4,5,3,4,4,3,2,5,3,3,4,2,2,2,2,2,2,3,3,3,1,5,2,1,3,2,3,3,3,4,3,3,3,3,3,3,3,3,2,3,2,2,2,4,4,4,4,4,3,4,4,4,3,3,3,1,1,1,1,4,4,4,4,3,3,1,4,2,4,3,1,1,1,5,1,1,1,NA,NA,0,2,1,1,1,1,5,7,4,4,3,4,3,3,3,1,1,1,1,1,1,1,1,1,1,1,3,2,3,2,4,3,3,3,4,1,3,4,3,3,4,4,4,3,4,4,4,4,5,4,4,4,3,3,4,5,5,4,5,5,5,5,5,5,5,5,5,4,4,4,4,4,4,4,3,4,3,4,3,1,1196.191,4,NA,12,NA,5,6,"02/27/2023 16:27",NA,NA,NA,1,"Mozilla/5.0 (Windows NT 10.0; Win64; x64; rv:109.0) Gecko/20100101 Firefox/111.0","rgcbedgs9tnqtpp7","n1a1rc5utgrafrz4",NA,NA,"..","/survey/selfserve/53b/g004/230146?list=1&ID=237129246465074","n1a1rc5utgrafrz4","237129246465074",67,2023-04-07 12:16:00,3,1,1,1,1,1,1,2,64,2,"",2,"",4,7,5,4,3,4,4,3,3,3,1,2,2,2,1,1,1,1,1,3,2,3,3,3,2,3,2,3,3,3,2,3,1,2,NA,NA,"",NA,"",NA,NA,NA,"",3,3,NA,NA,NA,NA,NA,NA,NA,NA,NA,"",NA,"",0,0,0,0,0,0,0,0,1,0,"","",3,NA,NA,"",3,NA,NA,NA,NA,NA,"",0,3,NA,NA,NA,"",2,2,2,"",NA,NA,NA,"","","",2,1,2,"",NA,NA,NA,"","","",3,3,3,"",NA,NA,NA,"","","",3,3,3,"",NA,NA,NA,"","","",2,2,3,"",NA,NA,NA,"","","",3,3,3,"",NA,NA,NA,"","","",3,3,3,"",NA,NA,NA,"","","",3,2,2,"",NA,NA,NA,"","","",3,3,3,"",NA,NA,NA,NA,"",NA,3,2,3,"",NA,NA,NA,"",3,3,2,"",NA,NA,NA,"","","",3,3,2,"",NA,NA,NA,"","","",3,1,2,"",NA,NA,NA,"","","",3,1,3,"",NA,NA,NA,NA,"","",3,1,3,"",NA,NA,NA,NA,"","",3,1,0,0,0,0,0,0,0,0,0,1,"Keine",0,0,0,0,0,0,0,0,0,1,"Keine",0,0,0,0,0,0,0,0,0,1,"Keine",3,1,NA,NA,NA,NA,2,NA,NA,NA,"",3,3,3,NA,3,3,3,3,3,2,2,"",2,2,2,1,0,0,1,4,4,5,4,4,4,4,5,3,3,3,5,4,4,5,5,5,5,5,5,5,5,5,2,2,2,2,2,2,3,3,3,3,3,3,3,3,3,3,3,3,3,3,3,3,3,3,2,3,4,2,3,3,3,3,2,3,3,3,3,3,3,3,3,3,2,3,2,2,2,2,2,3,2,4,2,3,3,1,1,3,3,3,3,3,3,3,3,3,3,3,3,3,3,3,2,2,2,3,3,3,3,3,3,2,3,2,3,3,1891.1,5,"8y2ra0wcd3gvt0d7",NA,NA,"..","/survey/selfserve/53b/g004/230372?list=1&ID=240475414777961","8y2ra0wcd3gvt0d7","240475414777961",19.9365166666667,31.5183333333333,0,102005,"01-10-2005",2005-10-01,211,17,7,17.07,6515,2005,18,3.33333333333333,4,4.33333333333333,3.66666666666667,2.5,4,3.5,2,2,2,3,3,1,2.6,3,3.25,3,3.08333333333333,2.2,3.88888888888889,4,3.66666666666667,4,3.66666666666667,2.5,2,3.5,1,3.5,1,1.2,3.90909090909091,4.2,4,3.33333333333333,4.91666666666667,4.66666666666667,5,5,5,4,3,3,3,3.5,38.41,30.31,38.71,40.07,45.16,40.41,41.53,52.42,57.9345493,47.8177993,44.5286377,35.1602477,1,3,2,2,2.4,2.25,2.5,3.22222222222222,2.33333333333333,3.66666666666667,3.66666666666667,32.56,30.31,38.71,40.07,35.81,40.41,41.53,38.09,49.8792458,39.7624958,41.895547,32.527157,1.33333333333333,3,3,3,3,2.66666666666667,2.5,2.75,2.75,3.90909090909091,4.2,4.33333333333333,3,4.83333333333333,4.33333333333333,5,5,5,2,3,4,3,3.125,3.33333333333333,2.5,3,2.92307692307692,3,2.75,3,2.14285714285714,2.83333333333333,1,3,3,3,3,3,4,2.9,2.33333333333333,3.33333333333333,3,2.5,1.4,1,2,3,3,3,3,3
"53",80,"kntccgkha0gj7s2v","02/27/2023 17:02","qualified,/Gender/X0TrF,/Age/b3xfu,/Total/Total",3,1,1,1,1,1,1,2,61,2,3,"",3,2,"",4,1,5,5.199,40,40,2,NA,NA,NA,4,"","Lagerist",8,3,1,2,3,3,2,1,55,12,NA,NA,NA,NA,NA,NA,NA,NA,1,2,NA,NA,NA,NA,NA,NA,NA,NA,3,2,4,5,3,5,2,5,4,5,5,3,5,2,1,3,3,1,3,2,1,4,3,5,4,4,4,4,2,8,5,8,8,5,4,4,5,5,3,4,4,3,3,3,4,4,3,5,3,1,3,1,2,2,3,3,3,3,1,1,5,5,3,1,1,1,4,5,5,5,5,4,1,1,1,4,1,1,1,1,1,5,1,1,1,NA,NA,0,1,1,1,1,1,5,10,2,1,1,1,2,1,1,1,0,3,1,0,0,0,0,0,0,2,4,2,1,1,4,1,1,1,3,5,5,5,5,6,6,6,6,5,5,5,5,5,2,5,4,4,4,3,4,5,5,5,5,5,5,3,4,2,3,3,3,4,5,4,5,4,5,3,4,4,2,4,1,1,1830.088,4,NA,10,NA,5,6,"02/27/2023 16:31",NA,NA,NA,1,"Mozilla/5.0 (Windows NT 10.0; Win64; x64) AppleWebKit/537.36 (KHTML, like Gecko) Chrome/109.0.0.0 Safari/537.36 OPR/95.0.0.0","v2nfd5h3mt7jdujm","4g03p80hvt4a42jx",NA,NA,"..","/survey/selfserve/53b/g004/230146?list=1&ID=237104974324783","4g03p80hvt4a42jx","237104974324783",648,2023-04-14 16:35:00,3,1,1,1,1,1,1,2,61,2,"",2,"",4,9,3,1,1,1,2,1,1,1,0,3,1,0,0,0,0,0,2,1,2,2,2,2,2,2,2,2,2,2,2,2,1,1,2,NA,"",NA,"",1,5,NA,"",NA,NA,1,0,0,0,0,0,0,0,0,"",1,"",1,0,0,0,0,0,1,0,0,0,"","",1,4,NA,"",1,10,3,1,5,NA,"",2,3,NA,NA,NA,"",4,5,1,"Joga und Schwimmbad",1,5,NA,"","","",NA,NA,1,"Joga und Ruheräume",1,5,NA,"","","",NA,NA,1,"Kantine",1,5,NA,"","","",NA,NA,1,"Betriebsarzt und Betriebsrat",2,NA,2,"","","",NA,NA,1,"Vorträge und praktische Vorstellungen",1,5,NA,"","","",NA,NA,1,"Betriebsrat und Vertraunsmänner/Frauen",2,NA,2,"","","",NA,NA,1,"Kurse",1,5,NA,"","","",NA,NA,1,"Kurse",2,NA,2,"","","",NA,NA,1,"Kurse",1,4,NA,NA,"",NA,NA,NA,1,"Kursleiter",1,4,NA,"",NA,NA,2,"",NA,NA,NA,"","","",3,3,1,"Betriebsrat",2,NA,2,"","","",NA,NA,2,"",NA,NA,NA,"","","",5,5,2,"",NA,NA,NA,NA,"","",5,1,3,"",NA,NA,NA,NA,"","",3,3,0,0,0,1,1,1,0,1,0,0,"",0,1,0,0,0,0,0,0,1,0,"",0,0,0,0,1,0,0,0,0,0,"",1,1,NA,NA,NA,NA,1,1,3,NA,"",NA,NA,1,1,3,3,5,5,5,4,2,"",1,1,2,1,0,0,1,5,5,5,5,2,4,5,4,4,4,5,4,4,4,4,5,5,2,1,1,1,3,5,3,3,3,3,3,3,3,4,4,5,3,3,3,4,4,4,3,4,4,4,4,5,5,5,2,2,5,3,3,4,4,5,4,4,4,4,4,3,4,4,4,4,1,1,1,1,1,1,1,3,3,3,3,3,3,1,1,4,4,5,5,5,3,4,4,4,4,4,4,4,4,5,5,5,5,5,5,5,5,5,5,5,5,5,5,5,1695.95,5,"mqhj7pj34ty5mb4e",NA,NA,"..","/survey/selfserve/53b/g004/230372?list=1&ID=241183254215685","mqhj7pj34ty5mb4e","241183254215685",30.5014666666667,28.2658333333333,0,51990,"01-05-1990",1990-05-01,396,33,0,33,12147,1990,33,4,3.5,4.66666666666667,4.33333333333333,1.5,3,2,1.5,3.5,4.5,4,4,2,6.8,3.6,4.25,3.66666666666667,3.83333333333333,3,2.11111111111111,1.66666666666667,3,1.66666666666667,4.66666666666667,1.75,1,1,1,1,1,1,4.18181818181818,4.4,4.33333333333333,3.66666666666667,4,5,5,3,3,4.5,2,4,5,3.66666666666667,52.83,54.05,53.98,60.77,55.62,55.25,56.79,52.42,67.5970951,57.4803451,66.0444512,56.6760612,0.444444444444444,2,2,3,1.6,1.75,1.5,5.44444444444444,5.33333333333333,5.33333333333333,5.66666666666667,46.43,54.05,53.98,60.77,55.62,55.25,56.79,52.42,67.3650951,57.2483451,64.7640032,55.3956132,0.666666666666667,4,4,4,4,2.66666666666667,3,2.5,4.75,4.36363636363636,4.4,4.33333333333333,4.33333333333333,3.25,4,4.66666666666667,1.33333333333333,3,3,3.73333333333333,4,4,4.25,4.66666666666667,3,2,3.84615384615385,3.4,4.25,4,1,3,1,4.14285714285714,4.6,3.75,4,4,1,4.6,5,3.66666666666667,5,5,2,2,1,3.66666666666667,4,3.33333333333333,3.66666666666667,4
"54",81,"egus37rb67s2kb2b","02/27/2023 17:01","qualified,/Gender/p47uy,/Age/gcKvr,/Total/Total",3,1,1,1,1,1,1,1,29,1,4,"",3,1,"",1,1,6,5.2017,39,39,2,NA,NA,NA,9,"","Erzieherin",8,1,3,2,2,2,1,NA,27,NA,NA,NA,NA,NA,NA,NA,NA,NA,1,NA,NA,NA,NA,NA,NA,NA,NA,NA,NA,2,4,4,3,4,3,4,2,5,5,3,3,2,2,4,4,4,3,4,3,3,3,4,2,4,3,4,5,4,3,4,10,5,3,2,4,4,2,3,2,3,3,3,2,2,3,4,3,4,3,1,2,3,4,4,3,4,3,4,4,1,1,4,1,1,1,2,3,2,1,1,1,1,1,1,1,1,1,1,1,5,1,1,1,NA,NA,0,1,2,5,1,1,5,9,2,1,1,1,2,1,1,1,2,2,1,2,0,1,0,1,1,3,5,3,2,1,4,1,2,1,3,2,5,5,2,4,2,5,2,3,4,4,4,4,4,4,4,3,3,2,3,4,4,3,4,4,5,3,3,2,4,2,2,4,4,4,4,5,4,4,2,4,2,4,2,1,1770.671,14,NA,10,NA,1,2,"02/27/2023 16:31",NA,NA,NA,1,"Mozilla/5.0 (Linux; Android 13; KB2003 Build/RKQ1.211119.001; wv) AppleWebKit/537.36 (KHTML, like Gecko) Version/4.0 Chrome/110.0.5481.65 Mobile Safari/537.36","rtrtnkvbyrjgt5tf","ya87gj5dc3npwdx3",NA,NA,"sa","/survey/selfserve/53b/g004/230146?list=1&ID=237111539456157","ya87gj5dc3npwdx3","237111539456157",435,2023-04-14 13:05:00,3,1,1,1,1,1,1,1,29,2,"",2,"",4,8,1,1,1,1,3,1,1,1,2,1,0,1,1,1,0,1,1,1,3,3,3,2,1,4,1,5,2,2,1,4,1,1,2,NA,"",NA,"",1,2,NA,"",NA,NA,1,0,0,0,0,0,0,1,0,"",1,"",0,0,0,0,0,0,1,0,0,0,"","",3,NA,NA,"",3,NA,NA,NA,NA,NA,"",0,3,NA,NA,NA,"",2,2,1,"Hansefit",2,NA,5,"Hatte schon eine Mitgliedschaft im Fitnessstudio","","",NA,NA,3,"",NA,NA,NA,"","","",NA,NA,2,"",NA,NA,NA,"","","",5,5,3,"",NA,NA,NA,"","","",3,1,1,"Begehung zur Betriebssicherheit mit der Feuerwehr und einen Sicherheitsbeauftragten direkt im Betrieb",2,NA,2,"","","",NA,NA,1,"Ab und zu sogenannte Teampflege, also gemeinsame freiwillige Aktivitäten in der Freizeit",1,4,NA,"","","",NA,NA,1,"Ganz viele unterschiedliche",1,5,NA,"","","",NA,NA,1,"Ergonomische Stühle",1,5,NA,"","","",NA,NA,3,"",NA,NA,NA,NA,"",NA,3,3,3,"",NA,NA,NA,"",4,4,2,"",NA,NA,NA,"","","",5,5,3,"",NA,NA,NA,"","","",5,5,1,"Ferien-Kita, also eine Betreuung in den Sommerferien wenn die meisten Kitas normalerweise geschlossen sind und bevorzugte Platzvergabe für die eigenen Kinder bei städtischen Kitas.",2,NA,2,"","","",NA,NA,3,"",NA,NA,NA,NA,"","",4,4,3,"",NA,NA,NA,NA,"","",4,4,1,0,0,0,0,0,0,0,0,0,"",0,0,0,0,0,1,0,1,1,0,"",1,0,0,0,0,1,0,1,1,0,"",1,1,NA,NA,NA,NA,1,1,5,NA,"",NA,NA,1,1,2,2,4,4,5,2,2,"",2,2,2,1,0,0,5,4,4,4,4,5,3,3,4,2,2,3,5,4,4,5,5,5,3,3,3,3,3,3,3,3,2,3,4,4,4,4,5,3,3,2,1,2,2,3,4,4,4,3,2,4,5,4,2,1,5,5,4,4,3,5,3,4,2,4,4,4,5,3,4,3,1,1,1,1,1,1,1,1,1,1,2,2,3,2,2,4,3,4,4,4,2,1,2,1,1,2,3,4,3,4,4,3,1,4,4,3,3,3,3,3,5,2,3,4,1326.07,1,"ya87gj5dc3npwdx3",NA,NA,"sa","/survey/selfserve/53b/g004/230372?list=1&ID=241183254216740","ya87gj5dc3npwdx3","241183254216740",29.5111833333333,22.1011666666667,0,52017,"01-05-2017",2017-05-01,72,6,0,6,2285,2017,6,3.66666666666667,3.5,3.66666666666667,3.66666666666667,2,4,3.5,3.5,3,3,3.66666666666667,3.5,NA,5.2,2.6,3.5,2,2.75,3.4,3.11111111111111,2,3.66666666666667,3.66666666666667,1.33333333333333,1,1,1,1,1,1,2,3.54545454545455,4,3.66666666666667,2.66666666666667,3.33333333333333,3.66666666666667,4.33333333333333,2.66666666666667,2.66666666666667,4.16666666666667,4,4,4,4,52.83,54.05,53.98,60.77,55.62,55.25,56.79,52.42,67.5970951,57.4803451,66.0444512,56.6760612,1.11111111111111,1,2,3,1.9,1.75,2,3.33333333333333,3.66666666666667,4,2.33333333333333,59.45,54.05,53.98,60.77,45.16,55.25,56.79,52.42,65.1489547,55.0322047,66.2911162,56.9227262,0.888888888888889,3,2,1,2,1.91666666666667,1.5,2.125,3.75,3.45454545454545,4.2,3.33333333333333,2.33333333333333,3.83333333333333,4.33333333333333,5,3,3,3.16666666666667,3.06666666666667,4,5,4.5,4.5,4.5,4,3.84615384615385,4,3.75,3.75,1,1.66666666666667,2,2.71428571428571,3.8,1.5,2.5,3,5,3.6,3.66666666666667,4.33333333333333,3,3.25,1.6,1,1,4.33333333333333,3,1.66666666666667,3,3.25
"55",85,"vsprnwu6uzzaj6df","02/27/2023 17:18","qualified,/Gender/X0TrF,/Age/gcKvr,/Total/Total",3,1,1,1,1,1,1,2,52,1,5,"",2,1,"",1,1,6,5.2001,40,40,2,NA,NA,NA,5,"","Sachbearbeiter",7,13,3,2,3,3,2,1,48,17,NA,NA,NA,NA,NA,NA,NA,NA,1,2,NA,NA,NA,NA,NA,NA,NA,NA,2,2,3,3,2,5,5,4,4,4,4,4,4,2,2,3,3,3,3,2,2,3,3,3,3,4,4,4,5,6,3,8,8,3,3,3,3,5,3,4,4,4,3,3,3,3,3,3,3,4,3,4,4,4,4,4,3,4,4,4,1,3,4,1,3,1,4,4,4,4,5,4,1,1,1,1,4,4,5,1,5,2,5,1,1,3,98,50,1,1,1,1,5,5,7,4,3,2,3,4,2,3,3,5,5,5,3,5,3,4,3,2,4,4,4,5,4,3,2,3,2,2,1,1,3,2,1,4,4,2,1,4,4,4,4,4,3,3,3,4,3,3,4,4,4,4,4,4,4,4,3,2,3,2,3,3,3,3,3,3,3,3,3,3,3,4,1,1670.548,4,NA,12,NA,5,6,"02/27/2023 16:50",NA,NA,NA,1,"Mozilla/5.0 (Windows NT 10.0; Win64; x64; rv:109.0) Gecko/20100101 Firefox/110.0","a0ewe9wgj3ejhccj","pghgmtv6scv5w1dm",NA,NA,"..","/survey/selfserve/53b/g004/230146?list=1&ID=237111539449897","dnjqa2ee7wjhd4dy","237111539449897",676,2023-04-14 17:32:00,3,1,1,1,1,1,1,2,53,2,"",2,"",3,7,3,2,3,3,4,3,4,3,3,4,4,3,3,3,2,2,2,5,3,4,4,3,3,4,1,5,3,3,2,3,1,1,1,6,"Keine",9,"",NA,NA,NA,"",NA,NA,NA,NA,NA,NA,NA,NA,NA,NA,NA,"",NA,"",0,0,0,0,0,0,0,0,1,0,"","",1,2,3,"",3,NA,NA,NA,NA,NA,"",3,3,NA,NA,NA,"",4,3,3,"",NA,NA,NA,"","","",3,3,1,"Stressseminar",2,NA,2,"","","",3,3,3,"",NA,NA,NA,"","","",3,3,3,"",NA,NA,NA,"","","",2,2,3,"",NA,NA,NA,"","","",3,3,3,"",NA,NA,NA,"","","",3,3,1,"Fachliche Schulungen",1,3,NA,"","","",NA,NA,3,"",NA,NA,NA,"","","",3,3,3,"",NA,NA,NA,NA,"",NA,3,3,3,"",NA,NA,NA,"",3,3,1,"Teilzeitangebote",2,NA,2,"","","",NA,NA,3,"",NA,NA,NA,"","","",2,2,2,"",NA,NA,NA,"","","",1,1,2,"",NA,NA,NA,NA,"","",3,1,3,"",NA,NA,NA,NA,"","",3,3,0,0,0,1,0,0,0,0,0,0,"",0,0,0,1,0,0,0,0,0,0,"",0,0,0,1,0,0,0,0,0,0,"",1,1,NA,NA,NA,NA,1,1,4,NA,"",NA,NA,1,1,1,1,4,4,3,3,2,"",3,3,5,3,100,50,5,4,5,5,5,4,4,4,3,4,4,4,4,4,4,4,4,5,4,4,4,3,3,3,3,3,3,2,2,2,4,3,4,3,4,3,3,4,4,3,3,4,4,3,3,4,4,5,4,4,4,2,3,3,4,3,2,4,3,3,3,4,4,3,4,4,3,3,3,2,1,1,1,4,3,3,3,3,3,1,1,3,3,5,3,4,2,2,3,3,2,2,2,2,2,3,4,4,2,4,4,4,4,3,4,3,4,3,4,4,1656.96,1,"vre20gnwmpj9wxgs",NA,NA,"s.","/survey/selfserve/53b/g004/230372?list=1&ID=241183254201395","vre20gnwmpj9wxgs","241183254201395",27.8424666666667,27.616,0,52001,"01-05-2001",2001-05-01,264,22,0,22,8129,2001,22,2.66666666666667,5,4,4,2,3,3,2,3,3,4,4,NA,5.6,3.2,4,3,3.41666666666667,3.2,3.88888888888889,4,3.66666666666667,4,4.33333333333333,1,3.8,4,3.66666666666667,4,3.66666666666667,1.8,3.54545454545455,4,3,3.33333333333333,3.5,4,4,3.66666666666667,2.33333333333333,3,3,3,2,2.83333333333333,38.41,40.07,46.92,47.67,35.81,49.47,41.53,38.09,48.5612197,38.4444697,52.7970142,43.4286242,3.88888888888889,2,3,4,3.3,3.25,3.33333333333333,2.11111111111111,1,3,2.33333333333333,46.43,48.33,38.71,47.67,35.81,40.41,31.62,38.09,39.6155789,29.4988289,55.6499733,46.2815833,2.88888888888889,2,2,1,3,2.5,2.5,2.5,3.5,4.18181818181818,4.6,3.66666666666667,4,3.83333333333333,4,4.33333333333333,4,3,2.5,3.46666666666667,2,2,3.25,3.5,2.5,3,3.38461538461538,3.2,3.25,3.75,2,3.16666666666667,1,2.71428571428571,3.6,2.5,2,2,4,3.8,3.66666666666667,4,3.75,3.5,2.6,1,5,3.66666666666667,3.5,3.33333333333333,3.33333333333333,3.5
"56",86,"a57jgj2fath8haxc","02/27/2023 17:27","qualified,/Gender/X0TrF,/Age/b3xfu,/Total/Total",3,1,1,1,1,1,1,2,63,2,5,"",6,1,"",4,1,6,2.1985,40,60,2,NA,NA,NA,1,"","Bereichsleiter",8,9,1,2,3,3,1,NA,1,1,NA,NA,NA,NA,NA,NA,NA,NA,1,2,NA,NA,NA,NA,NA,NA,NA,NA,NA,2,3,4,2,4,5,5,5,4,4,4,4,1,4,2,4,1,2,1,1,4,4,5,4,3,4,5,1,7,3,5,6,6,2,3,4,4,4,4,4,4,4,4,4,4,4,3,4,4,3,5,5,5,5,5,5,4,5,5,4,3,3,2,2,2,3,3,4,3,2,3,1,1,1,1,5,5,1,1,1,5,1,1,1,NA,NA,0,3,4,1,1,1,4,9,2,1,1,1,1,1,1,1,0,0,0,0,0,0,0,0,0,1,5,1,1,1,5,2,1,1,2,6,6,6,6,6,6,6,6,6,5,5,5,5,5,5,5,5,2,5,5,5,5,5,5,5,5,5,5,5,5,5,5,5,5,5,5,5,5,5,1,5,1,5,1,1,1766.995,4,NA,12,NA,5,6,"02/27/2023 16:57",NA,NA,NA,1,"Mozilla/5.0 (Windows NT 10.0; Win64; x64; rv:109.0) Gecko/20100101 Firefox/110.0","05sqdnb6znt9885k","y07h3j0h1vyzyafa",NA,NA,"..","/survey/selfserve/53b/g004/230146?list=1&ID=237129246467161","jaddzp6ybecbq4jc","237129246467161",795,2023-04-15 07:16:00,3,1,1,1,1,1,1,2,63,2,"",2,"",4,9,3,1,1,1,2,1,1,1,0,0,0,1,0,0,1,0,0,5,1,5,1,1,1,5,1,4,1,2,1,5,2,1,2,NA,"",NA,"",1,4,NA,"",NA,NA,1,0,0,0,0,0,0,0,0,"",1,"",0,0,0,0,0,0,1,1,0,0,"","",1,3,NA,"",1,5,2,2,NA,4,"",2,1,2,NA,4,"",NA,NA,1,"fitness",2,NA,3,"","keine","",NA,NA,2,"",NA,NA,NA,"","","",NA,NA,3,"",NA,NA,NA,"","","",2,2,1,"rauchen und drogen",2,NA,4,"","","benötige keine angebote",NA,NA,1,"allgemeine hinweise",2,NA,4,"","","die aufklärung",NA,NA,2,"",NA,NA,NA,"","","",2,2,1,"weiterbildung jeglicher art",1,4,NA,"","","",NA,NA,2,"",NA,NA,NA,"","","",2,2,1,"PC",2,NA,2,NA,"",NA,NA,NA,1,"um spezialisten",2,NA,2,"",NA,NA,1,"gleit arbeitszeit, homoffies",2,NA,4,"","","unsere vorhandenen sind prima",NA,NA,3,"",NA,NA,NA,"","","",3,2,1,"zuschüsse und betriebskindergärten",2,NA,2,"","","",NA,NA,3,"",NA,NA,NA,NA,"","",4,2,3,"",NA,NA,NA,NA,"","",2,2,0,0,0,1,0,0,0,0,0,0,"",0,0,0,0,0,0,0,0,0,1,"keine",0,0,0,0,0,0,0,0,0,1,"keine",3,1,NA,NA,NA,NA,1,1,4,NA,"",NA,NA,1,2,3,3,4,3,4,3,2,"",3,2,1,1,1,1,1,5,5,5,5,5,5,5,5,5,5,5,5,5,5,5,5,5,5,5,5,5,5,5,4,4,4,3,4,3,1,1,1,1,1,1,1,1,1,1,1,1,1,1,1,5,3,5,1,3,5,4,3,4,5,4,5,5,1,5,5,5,5,5,5,5,1,1,1,1,1,1,1,1,1,1,1,1,1,1,1,5,5,5,5,5,1,1,1,1,5,5,5,5,1,3,3,2,2,3,3,2,2,2,3,5,4,4,4,4,3391.34,5,"y07h3j0h1vyzyafa",NA,NA,"..","/survey/selfserve/53b/g004/230372?list=1&ID=241183254207616","m1sj584bryuw06v2","241183254207616",29.4499166666667,56.5223333333333,1,21985,"01-02-1985",1985-02-01,459,38,3,38.03,14062,1985,38,3,4.5,4.66666666666667,4,2.5,3,1.5,1,4,4.5,4,3.5,1,5.4,3.4,4,4,3.75,3.6,4.88888888888889,5,5,4.66666666666667,2.66666666666667,1,2.6,5,1,5,1,2,4.72727272727273,5,5,4,5,5,5,5,5,5,5,5,5,5,52.83,54.05,53.98,60.77,61.83,55.25,56.79,52.42,69.193003,59.076253,66.6843296,57.3159396,0,1,1,4,1.4,1.75,1.16666666666667,6,6,6,6,46.43,54.05,53.98,60.77,55.62,55.25,56.79,52.42,67.3650951,57.2483451,64.7640032,55.3956132,0.222222222222222,1,1,2,1,1.16666666666667,1,1.25,3.5,5,5,5,5,5,5,5,5,5,3.66666666666667,1,5,3,4.125,4.33333333333333,3.5,5,4.84615384615385,4.8,4.75,5,1,1,1,3.57142857142857,5,1,5,1,4,2.7,2.66666666666667,3.33333333333333,2.25,4.25,2.4,1,5,1,1,1,1,1
"57",87,"94rddr2hzj18hm36","02/27/2023 17:13","qualified,/Gender/p47uy,/Age/gcKvr,/Total/Total",3,1,1,1,1,1,1,1,35,1,5,"",4,1,"",1,1,6,9.2007,38,39,2,NA,NA,NA,1,"","Controllerin",9,10,4,1,NA,NA,NA,NA,NA,NA,NA,NA,NA,NA,NA,NA,NA,NA,NA,NA,NA,NA,NA,NA,NA,NA,NA,NA,NA,2,4,4,3,3,2,4,4,4,3,3,4,2,3,2,3,2,3,2,2,3,3,3,3,3,3,3,1,5,5,5,5,5,3,3,4,4,3,4,3,4,3,3,4,4,3,3,3,4,3,3,4,4,3,3,3,3,3,3,4,4,4,2,4,1,4,4,4,3,4,3,1,1,1,1,3,4,4,3,3,4,4,1,2,2,34,10,2,2,2,2,2,4,7,3,1,1,1,3,1,1,1,0,2,1,1,1,0,0,1,0,1,5,1,1,1,5,1,2,1,4,4,5,4,3,4,5,5,4,3,4,4,4,4,4,4,4,4,4,4,4,4,4,4,4,4,4,4,4,4,3,3,3,3,3,4,4,4,4,4,4,4,2,4,2,1,905.393,14,NA,10,NA,1,2,"02/27/2023 16:58",NA,NA,NA,1,"Mozilla/5.0 (Linux; Android 13; SAMSUNG SM-G991B) AppleWebKit/537.36 (KHTML, like Gecko) SamsungBrowser/20.0 Chrome/106.0.5249.126 Mobile Safari/537.36","e5caskqcda46fx4x","ebweuu9gqrph596j",NA,NA,"sa","/survey/selfserve/53b/g004/230146?list=1&ID=237129246466131","rn9asqjaxnubk53y","237129246466131",460,2023-04-14 13:11:00,3,1,1,1,1,1,1,1,35,2,"",2,"",4,8,2,1,1,1,3,1,1,1,1,1,1,1,0,0,0,0,0,3,1,5,1,1,1,4,1,5,1,1,1,5,1,3,NA,NA,"",NA,"",NA,NA,NA,"",2,2,NA,NA,NA,NA,NA,NA,NA,NA,NA,"",NA,"",0,0,0,0,0,0,0,1,0,0,"","",1,3,NA,"",1,5,4,2,NA,2,"",3,1,2,NA,2,"",NA,NA,1,"Bewegte Mittagspause, Bezuschussung von Kursen",1,3,NA,"","","",NA,NA,1,"Kurse",2,NA,2,"","","",NA,NA,2,"",NA,NA,NA,"","","",4,4,1,"Kurse",2,NA,2,"","","",NA,NA,3,"",NA,NA,NA,"","","",3,3,2,"",NA,NA,NA,"","","",2,2,1,"Unterschiedle",1,4,NA,"","","",NA,NA,3,"",NA,NA,NA,"","","",3,3,3,"",NA,NA,NA,NA,"",NA,2,2,3,"",NA,NA,NA,"",2,2,1,"Flexi",2,NA,2,"","","",NA,NA,3,"",NA,NA,NA,"","","",3,3,3,"",NA,NA,NA,"","","",3,3,1,"Mentoring",2,NA,2,NA,"","",NA,NA,3,"",NA,NA,NA,NA,"","",2,2,1,0,0,0,0,0,0,0,0,0,"",0,0,0,0,0,0,0,0,0,1,"Keine",0,0,0,0,0,0,0,0,0,1,"Keine",3,1,NA,NA,NA,NA,1,2,NA,2,"",NA,NA,2,NA,2,2,4,4,4,3,2,"",4,4,3,2,33,14,2,4,4,4,4,4,4,4,4,4,4,4,4,4,4,4,4,4,4,4,4,3,3,3,2,2,2,2,3,3,2,2,2,2,2,2,1,2,2,2,2,3,3,2,2,3,3,3,3,3,3,4,4,3,3,3,3,3,3,4,3,3,4,3,3,3,2,2,2,2,2,2,2,1,1,2,2,1,2,1,1,1,4,4,4,4,2,2,3,2,3,3,2,2,2,3,3,4,2,3,3,3,3,3,3,2,4,3,3,3,1181.29,1,"ebweuu9gqrph596j",NA,NA,"sa","/survey/selfserve/53b/g004/230372?list=1&ID=241183254207609","rn9asqjaxnubk53y","241183254207609",15.0898833333333,19.6881666666667,4,92007,"01-09-2007",2007-09-01,188,15,8,15.08,5815,2007,16,3.66666666666667,2.5,4,3.33333333333333,2.5,2.5,2.5,2,3,3,3,3,1,5,3,4,3.66666666666667,3.5,3.2,3.22222222222222,3.66666666666667,3,3,3.33333333333333,1,3.4,3.5,3.33333333333333,3.5,3.33333333333333,2,4,4,4,4,3.75,4,4,4,3,3.66666666666667,2,4,4,3.66666666666667,46.43,54.05,53.98,60.77,45.16,55.25,56.79,52.42,64.6769797,54.5602297,63.6862048,54.3178148,0.666666666666667,1,1,2,1.2,1.25,1.16666666666667,4.11111111111111,4.33333333333333,4,4,52.83,54.05,53.98,60.77,45.16,55.25,56.79,52.42,64.9089797,54.7922297,64.9666528,55.5982628,0.444444444444444,1,2,1,1,1.08333333333333,1.25,1,3.75,4,4,4,4,3.75,4,4,4,3,2.33333333333333,2.06666666666667,3,3,3.25,3,4,3,3.15384615384615,3.2,3,3.25,2,1.5,1,2.71428571428571,3.4,2.25,2.5,2,4,3.2,3.33333333333333,3.33333333333333,3,3,3,1,1,2,2,1.66666666666667,2,2.5
"58",88,"9u60rype3kj88d7g","02/27/2023 18:32","qualified,/Gender/p47uy,/Age/gcKvr,/Total/Total",3,1,1,1,1,1,1,1,41,1,3,"",2,1,"",1,1,6,1.2011,38,38,2,NA,NA,NA,6,"","Kundenberaterin",7,1,1,2,2,2,1,NA,46,NA,NA,NA,NA,NA,NA,NA,NA,NA,1,NA,NA,NA,NA,NA,NA,NA,NA,NA,NA,2,4,4,3,3,1,4,4,4,4,4,4,1,1,1,1,1,1,1,1,4,4,4,4,4,4,4,1,1,9,8,7,6,3,3,3,3,3,3,3,3,3,3,3,3,3,3,3,3,3,3,3,3,3,3,3,3,3,3,3,3,3,3,3,3,3,3,3,3,3,3,1,1,1,1,3,3,4,1,4,3,4,1,1,2,79,11,1,1,1,1,1,5,9,2,1,1,2,2,1,1,1,0,1,0,0,0,0,0,0,0,1,1,1,1,1,1,1,1,1,1,4,4,4,4,4,4,4,4,4,3,3,3,3,3,3,3,3,3,3,3,4,4,4,4,4,4,4,4,4,4,4,4,4,4,4,4,4,4,4,1,4,1,4,1,1,5382.078,4,NA,10,NA,5,6,"02/27/2023 17:02",NA,NA,NA,1,"Mozilla/5.0 (Windows NT 10.0; Win64; x64) AppleWebKit/537.36 (KHTML, like Gecko) Chrome/110.0.0.0 Safari/537.36 Edg/110.0.1587.50","nduyrtw9756x01cb","jbu6fnugwxehcrba",NA,NA,"..","/survey/selfserve/53b/g004/230146?list=1&ID=237111539451981","jbu6fnugwxehcrba","237111539451981",586,2023-04-14 14:50:00,3,1,1,1,1,1,1,1,41,2,"",2,"",5,9,3,2,2,3,3,1,1,1,1,1,2,0,0,0,0,0,0,2,1,1,1,1,1,1,1,1,1,1,2,1,1,1,2,NA,"",NA,"",2,NA,2,"",NA,NA,1,0,0,0,0,0,0,0,0,"",1,"",0,0,0,0,0,0,1,0,0,0,"","",1,1,2,"",2,NA,NA,NA,NA,NA,"",3,1,2,NA,2,"",NA,NA,1,"Beacxh Vollyball und Marathon",2,NA,3,"","nichts weiter","",NA,NA,1,"Stressbewätlgungsseminar",1,2,NA,"","","",NA,NA,1,"ernähunsgkurse",1,3,NA,"","","",NA,NA,2,"",NA,NA,NA,"","","",1,3,1,"erste hilfe kurse",2,NA,2,"","","",NA,NA,2,"",NA,NA,NA,"","","",1,1,1,"busniss kurse",2,NA,2,"","","",NA,NA,2,"",NA,NA,NA,"","","",1,1,2,"",NA,NA,NA,NA,"",NA,1,1,2,"",NA,NA,NA,"",1,1,1,"teilzeit und auszeit",1,5,NA,"","","",NA,NA,1,"eingliederung",2,NA,2,"","","",NA,NA,2,"",NA,NA,NA,"","","",1,1,2,"",NA,NA,NA,NA,"","",1,1,2,"",NA,NA,NA,NA,"","",1,1,1,0,0,0,0,1,0,0,0,0,"",0,0,0,0,0,0,0,0,0,1,"nichts",0,0,0,0,0,0,0,0,0,1,"nichts",1,1,NA,NA,NA,NA,1,2,NA,2,"",NA,NA,2,NA,2,2,3,3,3,2,2,"",4,1,5,2,60,0,5,5,5,5,5,5,5,5,5,5,5,5,5,5,5,5,5,5,5,5,5,5,5,5,3,3,3,3,3,3,4,4,4,4,4,4,4,4,4,4,4,4,4,4,4,4,4,4,4,4,4,4,4,4,4,3,4,4,2,4,4,4,4,4,4,4,1,1,1,1,1,1,1,1,1,1,1,1,1,1,1,5,5,5,5,5,5,5,5,5,5,5,5,5,5,5,5,5,5,5,5,5,5,5,5,5,5,5,5,4,1028.88,5,"jbu6fnugwxehcrba",NA,NA,"..","/survey/selfserve/53b/g004/230372?list=1&ID=241183254208646","jbu6fnugwxehcrba","241183254208646",89.7013,17.148,-11,12011,"01-01-2011",2011-01-01,148,12,4,12.04,4597,2011,12,3.66666666666667,2,4,4,1,1,1,1,4,4,4,4,1,6.2,3,3,3,3,3,3,3,3,3,3,1,3,3,3,3,3,1,3,3,3,3,4,4,4,4,4,4,5,5,5,4.5,52.83,54.05,53.98,53.35,55.62,55.25,56.79,52.42,67.7831145,57.6663645,63.5244708,54.1560808,0.111111111111111,5,5,5,2.2,3,1.66666666666667,4,4,4,4,46.43,48.33,46.92,47.67,45.16,55.25,56.79,52.42,67.3049823,57.1882323,54.002779,44.634389,0.444444444444444,5,5,5,5,2.41666666666667,3.25,2,2.75,5,5,5,5,5,5,5,5,5,3,4,2,2,3.5,3.33333333333333,4,4,3.92307692307692,4,3.75,4,1,1,1,5,5,5,5,5,1,4.6,5,3.66666666666667,5,5,3,1,1,4,4,4,4,4
"59",90,"a503zqdpcaj6wak7","02/27/2023 17:21","qualified,/Gender/X0TrF,/Age/b3xfu,/Total/Total",3,1,1,1,1,1,1,2,58,2,5,"",6,1,"",1,1,4,9.2007,40,41,2,NA,NA,NA,2,"","Qualitätsmanager",8,16,1,2,2,2,1,NA,55,NA,NA,NA,NA,NA,NA,NA,NA,NA,1,NA,NA,NA,NA,NA,NA,NA,NA,NA,NA,2,4,4,4,4,4,4,4,4,4,4,4,2,2,2,2,2,2,2,2,4,4,4,4,4,4,4,3,4,5,5,5,8,3,3,4,4,3,3,3,4,4,4,4,4,4,4,4,4,4,4,4,4,4,4,5,4,4,4,4,3,3,2,2,2,4,4,4,4,4,3,2,1,1,1,4,4,4,2,3,4,3,2,3,2,20,5,2,2,2,2,2,4,7,2,2,2,2,2,2,2,2,0,0,1,1,0,0,1,0,1,1,1,1,1,1,1,1,1,1,1,4,5,4,5,5,5,5,5,4,4,4,4,4,4,4,4,4,4,4,4,4,4,4,4,4,4,4,4,4,4,4,4,4,4,4,4,4,4,4,2,4,2,4,2,1,708.157,4,NA,10,NA,5,6,"02/27/2023 17:09",NA,NA,NA,1,"Mozilla/5.0 (Windows NT 10.0; Win64; x64) AppleWebKit/537.36 (KHTML, like Gecko) Chrome/110.0.0.0 Safari/537.36","94nra7qv9dvuxbwm","nzuur1r0x58chybw",NA,NA,"..","/survey/selfserve/53b/g004/230146?list=1&ID=237129246465082","nzuur1r0x58chybw","237129246465082",411,2023-04-14 11:54:00,3,1,1,1,1,1,1,2,58,2,"",2,"",5,8,3,3,2,4,3,1,1,2,0,2,1,1,0,0,0,0,0,1,1,4,1,1,1,4,1,5,2,1,4,3,1,1,2,NA,"",NA,"",2,NA,2,"",NA,NA,0,0,0,0,0,0,1,0,0,"",7,"",0,1,0,0,0,0,0,0,0,0,"","",1,3,NA,"",2,NA,NA,NA,NA,NA,"",2,3,NA,NA,NA,"",2,3,1,"Massagen und Ruheräume",2,NA,2,"","","",NA,NA,2,"",NA,NA,NA,"","","",NA,NA,2,"",NA,NA,NA,"","","",2,2,3,"",NA,NA,NA,"","","",2,2,1,"turnusmäßige Belehrungen",1,4,NA,"","","",NA,NA,3,"",NA,NA,NA,"","","",2,2,1,"sehr vielfältige und laufende, von Seminaren bis zu Workshops",1,5,NA,"","","",NA,NA,1,"höhenverstellbare Schreibtische, ergonomische Stühle",1,4,NA,"","","",NA,NA,3,"",NA,NA,NA,NA,"",NA,2,3,3,"",NA,NA,NA,"",3,2,1,"flex Arbeitszeiten, Homeoffice",1,4,NA,"","","",NA,NA,3,"",NA,NA,NA,"","","",2,1,3,"",NA,NA,NA,"","","",1,1,3,"",NA,NA,NA,NA,"","",3,1,2,"",NA,NA,NA,NA,"","",2,2,0,0,0,1,0,1,0,1,1,0,"",0,0,0,0,0,0,0,1,1,0,"",0,0,0,0,0,0,0,1,1,0,"",3,1,NA,NA,NA,NA,2,NA,NA,NA,"",2,2,3,NA,3,3,4,4,4,4,2,"",4,4,3,2,20,10,5,4,4,4,4,4,4,4,4,4,4,4,4,4,4,4,4,4,4,4,4,4,4,4,2,2,3,2,2,1,3,3,3,3,3,3,2,3,4,4,4,2,3,3,3,4,3,3,3,3,3,3,3,4,4,3,4,4,2,4,4,4,4,4,4,4,2,1,1,1,1,1,2,2,2,2,2,2,2,1,1,4,4,4,4,4,4,4,4,4,4,4,4,4,4,3,3,3,3,3,4,4,4,4,4,3,3,3,3,3,5061.43,5,"0hhh2euur6nggbet",NA,NA,"..","/survey/selfserve/53b/g004/230372?list=1&ID=241166931197128","0hhh2euur6nggbet","241166931197128",11.8026166666667,84.3571666666667,5,92007,"01-09-2007",2007-09-01,188,15,8,15.08,5815,2007,16,4,4,4,4,2,2,2,2,4,4,4,4,3,5.4,3.4,3.75,3.66666666666667,3.58333333333333,4,4.11111111111111,4,4.33333333333333,4,3.66666666666667,1.25,3.4,4,3,4,3,2,4,4,4,4,4,4,4,4,4,4,4,4,4,4,52.83,48.33,46.92,53.35,55.62,49.47,49.59,45.66,61.1120965,50.9953465,60.0849572,50.7165672,0.444444444444444,5,5,5,2.2,3,1.66666666666667,4.66666666666667,4.66666666666667,4.66666666666667,4.66666666666667,46.43,40.07,46.92,40.07,45.16,55.25,56.79,45.66,66.5135961,56.3968461,48.6632142,39.2948242,0.444444444444444,2,2,1,3,1.66666666666667,2.5,1.25,4,4,4,4,4,4,4,4,4,4,2,3.06666666666667,3,3,3.125,3.16666666666667,3,4,3.92307692307692,4,3.75,4,1.28571428571429,2,1,4,4,4,4,4,3,3.5,3,3.33333333333333,4,3,2.6,3,4,3,3,2.66666666666667,4,2.75
"60",91,"82kfr5xemguc4jfu","02/27/2023 18:04","qualified,/Gender/X0TrF,/Age/gcKvr,/Total/Total",3,1,1,1,1,1,1,2,42,1,2,"",2,2,"",3,1,6,5.2001,35,39,2,NA,NA,NA,1,"","teamleiter",5,2,1,2,4,4,2,2,10,15,41,NA,NA,NA,NA,NA,NA,NA,2,2,1,NA,NA,NA,NA,NA,NA,NA,2,2,3,3,3,4,4,3,3,3,4,3,4,3,3,4,4,3,3,4,3,4,4,3,2,3,4,3,3,8,3,5,8,4,2,2,2,2,2,3,3,2,2,2,3,3,3,3,2,4,2,2,2,2,3,3,2,3,3,2,3,3,2,1,2,1,2,4,4,4,2,2,1,1,1,1,1,1,1,2,1,5,1,1,1,NA,NA,0,2,2,1,1,1,4,7,3,1,2,3,3,3,4,2,5,5,4,5,5,4,4,5,1,3,3,4,4,3,4,3,4,3,4,1,2,2,2,1,2,2,2,2,4,4,4,4,4,3,3,2,4,2,4,2,2,2,4,4,4,2,3,2,3,4,4,3,4,4,3,3,3,2,4,4,4,4,3,1,1620.237,4,NA,12,NA,5,6,"02/27/2023 17:12",NA,NA,NA,1,"Mozilla/5.0 (Windows NT 10.0; Win64; x64; rv:109.0) Gecko/20100101 Firefox/110.0","1uu034ncthqa8jqs","wxv9ytzaznw39b85",NA,NA,"..","/survey/selfserve/53b/g004/230146?list=1&ID=237129246466120","wxv9ytzaznw39b85","237129246466120",718,2023-04-14 18:55:00,3,1,1,1,1,1,1,2,42,2,"",2,"",4,5,3,2,2,2,3,2,3,2,6,6,4,6,4,4,4,6,3,2,4,3,4,4,3,3,3,3,3,4,2,3,1,2,NA,NA,"",NA,"",NA,NA,NA,"",4,3,NA,NA,NA,NA,NA,NA,NA,NA,NA,"",NA,"",0,0,0,0,0,0,1,1,0,0,"","",3,NA,NA,"",2,NA,NA,NA,NA,NA,"",0,2,NA,NA,NA,"",3,3,2,"",NA,NA,NA,"","","",2,2,2,"",NA,NA,NA,"","","",3,3,2,"",NA,NA,NA,"","","",4,4,2,"",NA,NA,NA,"","","",2,2,2,"",NA,NA,NA,"","","",3,3,2,"",NA,NA,NA,"","","",3,3,1,"seminare",2,NA,4,"","","weiß nicht",NA,NA,3,"",NA,NA,NA,"","","",3,3,2,"",NA,NA,NA,NA,"",NA,3,2,3,"",NA,NA,NA,"",3,3,2,"",NA,NA,NA,"","","",4,4,3,"",NA,NA,NA,"","","",4,4,2,"",NA,NA,NA,"","","",4,3,2,"",NA,NA,NA,NA,"","",3,2,2,"",NA,NA,NA,NA,"","",3,3,0,0,0,1,0,0,0,0,0,0,"",0,0,0,0,0,0,0,1,0,0,"",0,0,0,0,0,0,0,1,0,0,"",3,1,NA,NA,NA,NA,3,NA,NA,NA,"",3,3,1,1,2,2,2,2,2,2,2,"",2,2,2,1,0,0,2,4,3,4,4,4,3,3,2,3,2,3,3,3,3,4,4,4,2,3,2,2,3,2,3,3,2,2,3,3,3,4,3,2,3,3,3,3,4,3,2,3,3,3,3,3,4,3,2,3,3,3,3,2,3,4,3,3,2,3,3,4,3,3,4,3,2,2,2,2,2,4,2,2,2,3,4,4,2,2,2,3,4,3,2,3,4,3,3,2,3,4,3,3,3,3,4,3,2,3,4,3,3,2,3,2,4,2,2,2,1989.3,5,"f7r22d2341emsp27",NA,NA,"..","/survey/selfserve/53b/g004/230372?list=1&ID=241183254202453","f7r22d2341emsp27","241183254202453",27.00395,33.155,0,52001,"01-05-2001",2001-05-01,264,22,0,22,8129,2001,22,3,4,3,3.66666666666667,3,4,3,3.5,4,2.5,3.33333333333333,3.5,3,5.6,2.2,2.25,2.66666666666667,2.33333333333333,2.8,2.44444444444444,2,2.66666666666667,2.66666666666667,2.66666666666667,1,1.2,1,1.33333333333333,1,1.33333333333333,1.4,3.45454545454545,4,2.66666666666667,3.33333333333333,3,2,4,2.33333333333333,3.66666666666667,3.33333333333333,2,2,3,2.83333333333333,46.43,54.05,46.92,47.67,45.16,40.41,31.62,45.66,42.3969553,32.2802053,62.6795824,53.3111924,4.22222222222222,3,2,2,3.1,2.5,3.5,1.77777777777778,1.33333333333333,2,2,46.43,48.33,46.92,53.35,45.16,49.47,41.53,45.66,52.4018383,42.2850883,60.0807144,50.7123244,4.77777777777778,3,3,3,3,3.25,2.75,3.5,2,3.18181818181818,3.8,2.66666666666667,2.66666666666667,2.91666666666667,3,4,2.33333333333333,2.33333333333333,2.66666666666667,3,4,3,3.25,3.33333333333333,3,4,3.23076923076923,3.2,3.25,3.25,2.28571428571429,2.83333333333333,2,3.07142857142857,3,3,3.25,3,4,3.2,3.33333333333333,3.66666666666667,2.75,2.5,1.6,3,1,3.33333333333333,2.5,3,3,3
"61",93,"dqkkb7crrv1wh300","03/01/2023 11:28","qualified,/Gender/X0TrF,/Age/b3xfu,/Total/Total",3,1,1,1,1,1,1,2,60,2,4,"",2,1,"",1,1,6,10.1996,40,40,2,NA,NA,NA,5,"","Service Design & Transition",8,2,1,2,4,4,2,1,58,24,17,NA,NA,NA,NA,NA,NA,NA,1,2,2,NA,NA,NA,NA,NA,NA,NA,2,2,4,5,4,4,4,3,5,4,5,5,3,3,3,3,3,3,3,1,1,4,4,4,4,5,5,3,3,3,5,8,8,7,4,3,4,4,4,4,4,4,4,4,4,4,4,4,4,4,4,3,3,3,4,5,5,4,4,3,2,2,4,1,4,1,4,5,5,5,5,5,1,1,1,1,3,5,5,2,5,2,5,1,1,3,98,50,4,2,3,1,1,4,8,2,2,2,1,2,1,1,1,3,3,1,1,1,1,0,0,0,1,4,1,1,1,4,2,2,2,2,3,3,3,2,2,2,4,2,2,4,4,4,4,5,4,4,4,3,3,3,4,3,3,5,5,5,4,4,4,4,4,5,5,5,5,5,5,5,3,4,4,2,4,1,1,697.042,4,NA,12,NA,5,6,"02/27/2023 17:20",NA,NA,NA,1,"Mozilla/5.0 (Windows NT 10.0; Win64; x64; rv:109.0) Gecko/20100101 Firefox/110.0","8dh8fejv2dq32frk","t3dh8835u0b2nq4h",NA,NA,"..","/survey/selfserve/53b/g004/230146?list=1&ID=237111539450949","t3dh8835u0b2nq4h","237111539450949",912,2023-04-16 17:37:00,3,1,1,1,1,1,1,2,60,2,"",2,"",4,8,2,1,1,1,2,1,2,1,1,1,0,1,1,1,0,0,0,1,1,5,2,2,1,4,1,4,1,1,1,2,1,1,2,NA,"",NA,"",1,4,NA,"",NA,NA,0,0,0,0,0,0,0,1,0,"",8,"",0,0,0,0,0,0,1,0,0,0,"","",1,2,4,"",1,6,5,2,NA,2,"",3,1,2,NA,2,"",NA,NA,1,"Jogging, Rückentraining, Entspannungstechniken",2,NA,1,"","","",NA,NA,1,"Entspannungstechniken",2,NA,4,"","","Keine Ahnung",NA,NA,3,"",NA,NA,NA,"","","",5,4,2,"",NA,NA,NA,"","","",3,1,1,"Schulungen zur Arbeitssicherheit",1,5,NA,"","","",NA,NA,1,"Anonyme Meldungen und definierte Vorgehensweise.",2,NA,5,"Nicht betroffen","","",NA,NA,1,"Sehr viele Angebot. Vor allem IT-bezogen.",1,5,NA,"","","",NA,NA,1,"Online Training",1,5,NA,"","","",NA,NA,1,"Online Training",1,5,NA,NA,"",NA,NA,NA,1,"Eigens dafür eingerichet (Gesundheitsmanagement)",1,5,NA,"",NA,NA,2,"",NA,NA,NA,"","","",5,5,1,"Weiß ich nicht genau.",2,NA,4,"","","Keine Ahnung",NA,NA,1,"Reine Beratung und Vermittlung.",2,NA,4,"","","Keine Ahnung.",NA,NA,1,"Frauen werden gezielt gefördert.",NA,NA,NA,NA,"","",NA,NA,3,"",NA,NA,NA,NA,"","",5,5,0,0,0,0,1,1,1,1,0,0,"",0,0,0,0,0,0,0,0,1,0,"",0,0,0,0,1,1,1,1,1,0,"",1,1,NA,NA,NA,NA,3,NA,NA,NA,"",4,4,1,1,1,1,5,5,5,4,2,"",5,5,4,3,100,80,5,4,4,4,4,4,4,4,3,4,3,4,4,3,3,5,5,5,4,4,4,4,4,4,4,4,4,4,4,4,4,5,5,5,5,5,4,5,5,5,5,5,5,5,5,5,5,5,2,2,4,4,3,4,5,4,4,4,1,5,5,5,4,4,4,4,1,1,1,2,1,1,2,1,1,1,1,1,1,1,1,4,3,5,4,4,1,4,4,4,3,3,3,5,4,4,4,3,1,5,5,4,4,4,4,4,4,4,5,5,1477.12,5,"t3dh8835u0b2nq4h",NA,NA,"..","/survey/selfserve/53b/g004/230372?list=1&ID=241183254207605","t3dh8835u0b2nq4h","241183254207605",11.6173666666667,24.6186666666667,30,101996,"01-10-1996",1996-10-01,319,26,7,26.07,9802,1996,27,4.33333333333333,4,4,4.33333333333333,3,3,3,1,4,4,4.33333333333333,5,3,6.2,3.8,4,4,3.91666666666667,4,3.77777777777778,3,4.66666666666667,3.66666666666667,5,1,4,4,4,4,4,2.2,3.81818181818182,4.2,4,3,4.16666666666667,3.33333333333333,5,4,4.33333333333333,5,2,4,5,3.66666666666667,52.83,48.33,46.92,60.77,55.62,55.25,56.79,52.42,69.8966807,59.7799307,60.8100474,51.4416574,1.11111111111111,2,2,4,1.8,2.25,1.5,2.55555555555556,2.66666666666667,3,2,52.83,54.05,53.98,60.77,55.62,55.25,49.59,52.42,62.4247591,52.3080091,68.1472832,58.7788932,0.555555555555556,1,2,2,4,1.58333333333333,2,1.375,4.75,3.81818181818182,4,3.66666666666667,3.66666666666667,4.08333333333333,3.33333333333333,5,4,4,4,4.86666666666667,4,4,4.25,4.5,3.5,5,4.38461538461539,4.8,4.25,4,1.28571428571429,1,1,3.64285714285714,4,3.25,3.5,4,5,4.2,3.66666666666667,5,4,4.25,2.8,3,4,4.66666666666667,5,4.66666666666667,5,5
"62",94,"3bae2ax2uay79hym","02/27/2023 17:44","qualified,/Gender/p47uy,/Age/b3xfu,/Total/Total",3,1,1,1,1,1,1,1,64,2,3,"",3,1,"",1,1,3,7.2004,38,38,2,NA,NA,NA,11,"","vital- und Wellnesstrainer",9,2,5,2,2,2,1,NA,63,NA,NA,NA,NA,NA,NA,NA,NA,NA,1,NA,NA,NA,NA,NA,NA,NA,NA,NA,NA,2,3,5,5,5,4,5,5,5,2,3,3,1,1,1,1,1,1,1,1,5,5,4,2,1,3,4,1,10,10,10,10,6,4,5,5,3,5,5,5,5,4,3,5,5,3,4,4,2,3,3,1,4,5,5,4,3,4,4,5,2,1,3,1,1,1,5,5,3,1,1,1,1,1,1,3,2,1,1,1,5,1,1,1,NA,NA,0,1,1,1,1,1,5,10,1,1,1,1,1,1,1,1,0,1,0,0,0,0,0,0,0,1,5,1,1,1,5,1,2,1,2,6,6,6,6,6,6,6,6,6,5,5,5,5,1,5,5,5,5,5,5,5,5,5,5,5,5,5,5,5,3,3,3,5,4,5,5,5,5,5,1,5,1,5,1,1,1313.385,4,NA,12,NA,5,6,"02/27/2023 17:21",NA,NA,NA,1,"Mozilla/5.0 (Windows NT 10.0; Win64; x64; rv:109.0) Gecko/20100101 Firefox/110.0","556qvb9jtbysn450","byh47vrcqk3e5q2y",NA,NA,"..","/survey/selfserve/53b/g004/230146?list=1&ID=237129246467160","byh47vrcqk3e5q2y","237129246467160",664,2023-04-14 16:59:00,3,1,1,1,1,1,1,1,65,2,"",2,"",5,10,1,1,1,1,1,1,1,1,0,0,0,0,0,0,0,0,0,1,1,5,1,1,1,5,1,5,1,1,1,3,1,2,NA,NA,"",NA,"",NA,NA,NA,"",1,1,NA,NA,NA,NA,NA,NA,NA,NA,NA,"",NA,"",0,0,0,0,0,0,0,0,1,0,"","",2,NA,NA,"",2,NA,NA,NA,NA,NA,"",0,2,NA,NA,NA,"",3,4,2,"",NA,NA,NA,"","","",3,5,2,"",NA,NA,NA,"","","",2,3,2,"",NA,NA,NA,"","","",1,3,2,"",NA,NA,NA,"","","",1,1,3,"",NA,NA,NA,"","","",2,2,2,"",NA,NA,NA,"","","",3,4,3,"",NA,NA,NA,"","","",3,4,1,"verstellbare stühle und tische",2,NA,2,"","","",NA,NA,2,"",NA,NA,NA,NA,"",NA,1,1,1,"geschätfsleitung",1,5,NA,"",NA,NA,1,"flexible Arbeitszeit",1,5,NA,"","","",NA,NA,3,"",NA,NA,NA,"","","",1,1,2,"",NA,NA,NA,"","","",1,1,2,"",NA,NA,NA,NA,"","",1,1,2,"",NA,NA,NA,NA,"","",1,1,0,0,0,0,0,0,0,0,0,1,"keine",0,0,0,0,0,0,0,0,0,1,"keine",1,0,0,0,0,0,0,0,0,0,"",1,1,NA,NA,NA,NA,2,NA,NA,NA,"",1,1,3,NA,2,2,3,3,4,2,2,"",2,2,1,1,0,0,1,5,5,5,5,3,5,5,5,5,5,5,5,5,5,5,5,5,5,5,5,3,5,5,4,4,4,4,4,4,5,5,5,3,3,3,3,3,4,4,4,5,5,1,1,5,5,5,1,1,5,5,5,5,5,2,5,5,1,5,5,5,5,5,5,5,1,1,1,1,1,1,1,1,1,1,1,1,1,1,1,5,3,5,5,5,3,1,3,1,3,3,5,3,1,4,1,5,1,1,1,1,4,3,4,4,5,3,4,3,1625.49,5,"byh47vrcqk3e5q2y",NA,NA,"..","/survey/selfserve/53b/g004/230372?list=1&ID=241183254207615","byh47vrcqk3e5q2y","241183254207615",21.88975,27.0915,0,72004,"01-07-2004",2004-07-01,226,18,10,18.1,6972,2004,19,4.33333333333333,4.5,5,2.66666666666667,1,1,1,1,5,3,2.66666666666667,2,1,9.2,4.2,4.5,5,4.5,3.2,3.66666666666667,2.66666666666667,4.66666666666667,3.66666666666667,1.66666666666667,1,1.6,2.5,1,2.5,1,1,4.63636363636364,4.2,5,5,4.5,5,5,5,3,4.83333333333333,5,5,5,5,59.45,54.05,53.98,60.77,61.83,55.25,56.79,52.42,69.432978,59.316228,68.008793,58.640403,0.111111111111111,1,1,4,1.4,1.75,1.16666666666667,6,6,6,6,59.45,54.05,53.98,60.77,61.83,55.25,56.79,52.42,69.432978,59.316228,68.008793,58.640403,0,1,1,1,3,1.16666666666667,1.5,1,3,4.81818181818182,4.6,5,5,4.83333333333333,5,5,5,4.33333333333333,4,3.6,5,5,5,5,5,5,4.76923076923077,5,4.25,5,1,1,1,3.28571428571429,4.6,2,3.5,1,5,2.9,3.33333333333333,2.33333333333333,3,4,1.4,1,1,5,3,3,4,3
"63",95,"54hyprgh8dfxqrr7","02/27/2023 17:55","qualified,/Gender/p47uy,/Age/gcKvr,/Total/Total",3,1,1,1,1,1,1,1,39,1,3,"",2,2,"",1,1,4,12.2002,35,35,2,NA,NA,NA,1,"","Elektronikmontiererin",4,16,3,2,2,2,2,1,10,NA,NA,NA,NA,NA,NA,NA,NA,NA,2,NA,NA,NA,NA,NA,NA,NA,NA,NA,4,2,2,3,3,4,3,3,3,3,4,4,4,3,2,3,3,3,2,4,3,2,2,2,2,2,2,3,3,8,8,3,5,6,2,2,2,3,2,2,3,2,1,1,3,2,3,4,3,2,2,1,3,2,2,2,2,3,4,2,4,2,1,1,1,1,1,3,4,2,2,3,4,2,1,4,2,1,1,1,1,5,1,1,1,NA,NA,0,2,2,1,1,1,4,5,3,3,2,2,4,2,3,2,2,3,3,5,3,3,1,4,1,3,4,3,4,3,3,3,4,2,2,1,2,1,1,1,2,2,2,1,4,4,4,4,3,4,3,2,3,2,3,2,3,2,4,4,4,4,3,3,2,3,3,3,3,4,3,2,3,2,4,2,4,2,4,1,1880.378,14,NA,10,NA,1,2,"02/27/2023 17:24",NA,NA,NA,1,"Mozilla/5.0 (Linux; Android 13; SAMSUNG SM-A225F) AppleWebKit/537.36 (KHTML, like Gecko) SamsungBrowser/20.0 Chrome/106.0.5249.126 Mobile Safari/537.36","975anmaaxnb3p0kj","ammg3b0fyxquwyth",NA,NA,"sa","/survey/selfserve/53b/g004/230146?list=1&ID=237111539461131","11ed9uh2u6f4mqcp","237111539461131",421,2023-04-14 11:46:00,3,1,1,1,1,1,1,1,40,2,"",2,"",3,5,4,3,3,3,3,2,2,2,2,3,2,4,3,3,2,4,2,3,3,3,4,4,3,3,2,4,3,3,2,2,1,2,NA,NA,"",NA,"",NA,NA,NA,"",3,3,NA,NA,NA,NA,NA,NA,NA,NA,NA,"",NA,"",1,0,0,0,0,0,1,0,0,0,"","",2,NA,NA,"",2,NA,NA,NA,NA,NA,"",0,2,NA,NA,NA,"",3,4,2,"",NA,NA,NA,"","","",4,4,2,"",NA,NA,NA,"","","",4,4,2,"",NA,NA,NA,"","","",4,4,2,"",NA,NA,NA,"","","",2,2,1,"Schulungen",1,4,NA,"","","",NA,NA,2,"",NA,NA,NA,"","","",4,4,2,"",NA,NA,NA,"","","",4,4,2,"",NA,NA,NA,"","","",4,4,2,"",NA,NA,NA,NA,"",NA,3,3,2,"",NA,NA,NA,"",4,4,1,"Teilweise, Mama - Schicht",1,5,NA,"","","",NA,NA,2,"",NA,NA,NA,"","","",4,4,2,"",NA,NA,NA,"","","",4,4,2,"",NA,NA,NA,NA,"","",5,5,2,"",NA,NA,NA,NA,"","",5,5,0,0,0,0,0,0,0,0,0,1,"Nix",1,0,0,0,0,0,0,0,0,0,"",1,1,0,0,0,0,0,0,0,0,"",2,1,NA,NA,NA,NA,2,NA,NA,NA,"",4,4,1,1,1,2,2,2,3,2,2,"",1,1,2,1,0,1,1,4,4,5,4,3,3,4,3,4,3,3,2,3,2,4,4,4,3,3,3,2,2,2,2,3,2,3,3,3,4,4,4,4,4,2,2,3,3,3,3,3,3,3,3,4,4,4,3,3,4,4,3,4,3,3,2,3,3,3,3,3,4,3,3,3,3,4,3,2,2,2,2,2,2,4,3,4,3,2,2,3,2,3,2,4,3,4,3,3,2,2,3,3,2,3,2,3,3,3,3,2,3,3,2,4,4,2,2,2,1653.3,1,"ammg3b0fyxquwyth",NA,NA,"sa","/survey/selfserve/53b/g004/230372?list=1&ID=241166931206215","11ed9uh2u6f4mqcp","241166931206215",31.3396333333333,27.555,1,122002,"01-12-2002",2002-12-01,245,20,5,20.05,7550,2002,21,2.66666666666667,3.5,3,4,2.5,3,2.5,3.5,2,2,2.33333333333333,2,3,6,1.8,2.25,2.33333333333333,2.08333333333333,2.8,2.33333333333333,2,2,3,2.33333333333333,2.75,1.2,1.5,1,1.5,1,1.4,3.27272727272727,3.8,3,2.66666666666667,3.08333333333333,2.33333333333333,4,3.33333333333333,2.66666666666667,3,2,2,2,2,46.43,40.07,46.92,53.35,35.81,49.47,41.53,45.66,51.5834976,41.4667476,56.594356,47.225966,2.77777777777778,2,3,4,3.1,3,3.16666666666667,1.44444444444444,1.33333333333333,1.33333333333333,1.66666666666667,38.41,40.07,38.71,47.67,45.16,49.47,49.59,45.66,61.0263325,50.9095825,47.6148439,38.2464539,2.77777777777778,3,3,2,4,3,3,3,2.25,3.63636363636364,4,3.33333333333333,3.33333333333333,2.83333333333333,2.33333333333333,4,3,2,2.66666666666667,3.2,3,3,3.625,3.66666666666667,3.5,3,3.07692307692308,3.2,2.75,3.25,2.57142857142857,3,2,2.78571428571429,2.8,3.25,2.5,2,3,2.7,2.66666666666667,3,2.5,3,1,3,1,4,4,2.33333333333333,3,3
"64",96,"etnhn518f7mu76sz","02/27/2023 17:37","qualified,/Gender/p47uy,/Age/gcKvr,/Total/Total",3,1,1,1,1,1,1,1,34,1,3,"",3,1,"",1,1,6,2.2023,38,38,1,2,2,2,10,"","Sachbearbeiterin",7,3,3,2,2,2,1,NA,40,NA,NA,NA,NA,NA,NA,NA,NA,NA,1,NA,NA,NA,NA,NA,NA,NA,NA,NA,NA,2,5,5,4,4,4,5,4,5,4,4,4,3,4,2,3,3,1,1,1,4,4,4,4,4,4,4,1,3,9,10,4,5,4,4,4,4,4,4,4,5,4,4,4,4,4,4,4,4,4,4,4,4,4,4,4,4,4,4,4,3,3,2,1,1,3,4,4,4,4,4,1,1,1,1,4,5,3,3,2,1,3,1,1,2,17,17,1,1,1,1,1,4,9,2,2,1,1,2,1,2,1,0,3,0,0,0,0,0,0,0,2,4,2,2,1,4,1,2,1,3,4,5,4,4,4,5,5,4,4,5,5,5,4,4,5,4,5,3,4,4,4,4,4,4,4,4,4,4,4,4,4,4,3,4,4,4,4,4,4,1,4,4,4,2,1,759.945,14,NA,10,NA,1,2,"02/27/2023 17:24",NA,NA,NA,1,"Mozilla/5.0 (Linux; Android 13; SM-G780G Build/TP1A.220624.014; wv) AppleWebKit/537.36 (KHTML, like Gecko) Version/4.0 Chrome/110.0.5481.65 Mobile Safari/537.36 EdgW/1.0","tmk7j4vx81jsbute","mb7htvrf9atd6mxb",NA,NA,"sa","/survey/selfserve/53b/g004/230146?list=1&ID=237111539457198","ps75hgaan7ph77vv","237111539457198",899,2023-04-16 10:38:00,3,1,1,1,1,1,1,1,34,2,"",2,"",4,8,3,2,1,3,2,1,1,1,0,2,0,0,0,0,0,0,0,2,2,4,2,2,1,4,1,3,3,3,3,3,1,1,2,NA,"",NA,"",2,NA,2,"",NA,NA,1,0,0,0,0,0,0,0,0,"",1,"",0,0,0,0,0,0,0,0,1,0,"","",1,2,2,"",3,NA,NA,NA,NA,NA,"",0,3,NA,NA,NA,"",3,2,2,"",NA,NA,NA,"","","",4,4,3,"",NA,NA,NA,"","","",2,2,2,"",NA,NA,NA,"","","",2,4,2,"",NA,NA,NA,"","","",1,1,3,"",NA,NA,NA,"","","",2,2,2,"",NA,NA,NA,"","","",2,2,1,"Alles",2,NA,2,"","","",NA,NA,2,"",NA,NA,NA,"","","",4,4,3,"",NA,NA,NA,NA,"",NA,4,3,3,"",NA,NA,NA,"",1,1,1,"Gleitzeit",1,5,NA,"","","",NA,NA,3,"",NA,NA,NA,"","","",4,4,2,"",NA,NA,NA,"","","",4,4,3,"",NA,NA,NA,NA,"","",3,3,3,"",NA,NA,NA,NA,"","",3,3,0,0,0,0,0,0,0,0,0,1,"Keine",1,0,0,1,0,0,0,0,0,0,"",1,0,0,1,0,0,0,0,0,0,"",3,1,NA,NA,NA,NA,1,2,NA,2,"",NA,NA,3,NA,3,3,4,4,4,4,2,"",5,4,3,2,22,15,4,4,4,4,4,4,4,4,4,4,4,4,4,4,4,5,5,4,4,4,4,4,4,4,3,3,3,3,3,3,4,4,4,4,4,4,3,4,3,3,3,4,4,3,3,4,4,4,1,2,4,4,4,3,3,4,3,3,3,4,4,4,5,5,4,4,1,2,1,1,1,1,1,2,2,1,1,1,1,1,1,4,2,4,4,4,1,1,1,1,4,3,4,3,3,4,4,4,2,3,4,4,4,3,4,4,4,4,4,4,1065.11,1,"4swgtttvxtmrxphu",NA,NA,"sa","/survey/selfserve/53b/g004/230372?list=1&ID=241166931205159","mjskcx3pbb3qbaha","241166931205159",12.66575,17.7518333333333,-2,22023,"01-02-2023",2023-02-01,3,0,3,0.03,183,2023,0,4.66666666666667,4,4.66666666666667,4,3.5,2.5,2,1,4,4,4,4,1,6.2,4,4.25,4,4.08333333333333,4,4,4,4,4,4,1,3.4,4.5,2.66666666666667,4.5,2.66666666666667,1,4.36363636363636,4.6,4.66666666666667,3.66666666666667,4,4,4,4,4,3.83333333333333,5,2,4,3.83333333333333,52.83,48.33,53.98,60.77,55.62,55.25,49.59,52.42,63.5220267,53.4052767,66.4001664,57.0317764,0.333333333333333,2,2,3,1.8,1.75,1.83333333333333,4.33333333333333,4.33333333333333,4.33333333333333,4.33333333333333,46.43,48.33,53.98,47.67,55.62,55.25,56.79,52.42,68.7907797,58.6740297,58.5678644,49.1994744,0.222222222222222,2,2,3,3,2.25,2.25,2.25,4,4,4,4,4,4.16666666666667,4,4.66666666666667,4,4,3,3.6,5,4,4.125,4.16666666666667,4,3,3.76923076923077,3.6,3.25,4.5,1.14285714285714,1.33333333333333,1,2.78571428571429,3.6,1,3.5,3,4,3.8,4,3.66666666666667,3.75,4,2,1,5,4,4,3.66666666666667,3,3.5
"65",97,"3akuy1dg69mc1rz2","02/27/2023 18:00","qualified,/Gender/p47uy,/Age/gcKvr,/Total/Total",3,1,1,1,1,1,1,1,26,1,5,"",3,1,"",1,2,4,9.2018,40,50,2,NA,NA,NA,11,"","Biologisch technische Assistenz",2,9,4,1,NA,NA,NA,NA,NA,NA,NA,NA,NA,NA,NA,NA,NA,NA,NA,NA,NA,NA,NA,NA,NA,NA,NA,NA,NA,2,3,3,2,4,3,3,1,2,4,3,1,1,3,5,5,1,4,5,4,1,1,1,1,1,1,1,1,10,1,1,1,1,NA,NA,NA,NA,NA,NA,NA,NA,NA,NA,NA,NA,1,3,1,1,1,2,2,1,1,2,1,2,1,1,5,4,2,3,1,1,1,4,4,1,2,4,1,1,1,1,1,1,1,1,1,5,1,1,3,NA,NA,1,5,5,1,1,1,2,3,4,4,4,5,4,2,5,5,4,5,6,4,4,3,0,2,5,4,2,5,4,1,4,4,5,2,5,2,4,4,1,1,2,4,3,1,4,4,5,5,5,3,4,5,4,3,4,4,4,4,5,5,5,2,2,2,3,2,3,3,4,4,3,2,4,4,2,4,2,4,2,1,2041.27,4,NA,10,NA,5,6,"02/27/2023 17:25",NA,NA,NA,1,"Mozilla/5.0 (Windows NT 10.0; Win64; x64) AppleWebKit/537.36 (KHTML, like Gecko) Chrome/110.0.0.0 Safari/537.36 Edg/110.0.1587.50","bd4j56y0qvr6qgvn","hchca950arwqpmv9",NA,NA,"..","/survey/selfserve/53b/g004/230146?list=1&ID=237129246474452","dcfp4wq3qmzm9cv3","237129246474452",902,2023-04-16 13:35:00,3,1,1,1,1,1,1,1,26,2,"",2,"",4,4,4,3,2,3,4,2,4,4,4,6,4,4,4,4,1,1,0,2,5,1,5,5,2,2,5,1,5,5,1,4,1,2,NA,NA,"",NA,"",NA,NA,NA,"",5,5,NA,NA,NA,NA,NA,NA,NA,NA,NA,"",NA,"",0,1,0,0,0,0,0,0,0,0,"","",2,NA,NA,"",2,NA,NA,NA,NA,NA,"",0,2,NA,NA,NA,"",5,5,2,"",NA,NA,NA,"","","",5,5,2,"",NA,NA,NA,"","","",5,5,2,"",NA,NA,NA,"","","",5,5,2,"",NA,NA,NA,"","","",5,5,2,"",NA,NA,NA,"","","",5,5,2,"",NA,NA,NA,"","","",5,5,2,"",NA,NA,NA,"","","",5,5,2,"",NA,NA,NA,"","","",5,5,2,"",NA,NA,NA,NA,"",NA,5,5,2,"",NA,NA,NA,"",5,5,2,"",NA,NA,NA,"","","",5,5,2,"",NA,NA,NA,"","","",5,5,2,"",NA,NA,NA,"","","",5,4,2,"",NA,NA,NA,NA,"","",5,5,2,"",NA,NA,NA,NA,"","",5,5,0,0,0,0,0,0,0,0,0,1,"es gibt gar keine!!!",1,1,0,1,0,1,1,0,1,0,"",1,1,0,1,0,1,1,0,1,0,"",1,3,1,1,NA,NA,1,1,1,NA,"",NA,NA,2,NA,2,2,1,1,1,1,1,"gar nichts abgedeckt, daher bedarf in allen möglichen bereichen",2,2,4,1,0,0,4,5,5,5,5,5,4,4,4,4,5,5,5,4,3,4,4,5,2,2,1,4,1,1,2,2,2,2,3,3,5,5,5,5,5,2,5,4,5,5,4,4,5,5,4,4,4,4,2,1,5,4,4,4,4,4,4,4,2,4,4,4,4,5,5,4,3,5,2,1,1,1,2,2,1,4,5,5,2,4,5,2,1,1,1,1,1,4,1,4,1,1,1,1,1,1,1,1,5,1,1,1,1,1,1,1,5,1,1,1,1265.29,5,"hchca950arwqpmv9",NA,NA,"..","/survey/selfserve/53b/g004/230372?list=1&ID=241183254220905","dcfp4wq3qmzm9cv3","241183254220905",34.0211666666667,21.0881666666667,-1,92018,"01-09-2018",2018-09-01,56,4,8,4.08,1797,2018,5,2.66666666666667,3.5,2,2.66666666666667,2,5,2.5,4.5,1,1,1,1,1,2.8,NA,NA,NA,NA,1.4,1.44444444444444,1.66666666666667,1.33333333333333,1.33333333333333,2.33333333333333,1,1,1,1,1,1,2.6,4.18181818181818,4.6,4,3.66666666666667,3.41666666666667,4,5,2,2.66666666666667,3.33333333333333,4,4,4,4,38.41,30.31,28.32,31.48,35.81,49.47,21.4,21.66,33.3083049,23.1915549,40.4367486,31.0683586,3.66666666666667,4,2,1,3.2,1.5,4.33333333333333,2.44444444444444,2.33333333333333,3,2,38.41,40.07,46.92,47.67,35.81,49.47,31.62,29.25,38.0859679,27.9692179,55.3833432,46.0149532,3.11111111111111,5,4,5,2,4.08333333333333,2.25,5,1,4.63636363636364,5,4,4.66666666666667,3,4,4.33333333333333,1.66666666666667,2,2.33333333333333,4.53333333333333,4,5,4.25,4.33333333333333,4,4,4.15384615384615,4,4,4.5,2.14285714285714,3.16666666666667,4.5,1.5,1.2,2.5,1,1,1,1,1,1,1,2,1.6,1,2,5,5,3.66666666666667,4.66666666666667,4.5
"66",98,"ntyrds70s8zbv8f7","02/27/2023 17:59","qualified,/Gender/p47uy,/Age/gcKvr,/Total/Total",3,1,1,1,1,1,1,1,41,1,3,"",2,1,"",1,1,6,4.2021,39,42,2,NA,NA,NA,8,"","Bürokauffrau",8,13,3,2,3,3,2,1,44,11,NA,NA,NA,NA,NA,NA,NA,NA,1,2,NA,NA,NA,NA,NA,NA,NA,NA,3,2,5,3,3,4,2,5,5,4,3,5,4,2,1,3,4,1,2,1,1,4,4,2,3,3,4,4,1,7,5,6,8,3,3,3,4,4,3,4,4,4,3,3,3,3,4,3,4,1,4,4,4,4,3,3,2,2,2,4,5,2,2,2,4,1,1,5,5,4,5,3,1,1,1,1,5,5,3,1,3,4,3,1,1,2,20,0,1,1,1,1,1,4,9,2,1,1,1,2,1,2,1,1,2,1,3,1,0,4,3,0,2,4,2,2,1,4,1,2,1,3,3,3,5,4,5,5,5,6,6,5,4,4,3,4,4,4,4,4,3,3,4,4,3,5,5,5,5,5,4,3,4,4,4,4,5,4,3,4,3,2,3,3,4,3,1,1587.866,4,NA,10,NA,5,6,"02/27/2023 17:32",NA,NA,NA,1,"Mozilla/5.0 (Windows NT 10.0; Win64; x64) AppleWebKit/537.36 (KHTML, like Gecko) Chrome/110.0.0.0 Safari/537.36 Edg/110.0.1587.56","htqm7ck5x6kjsdeg","emg1bpatk0k7beuj",NA,NA,"..","/survey/selfserve/53b/g004/230146?list=1&ID=237129246465076","emg1bpatk0k7beuj","237129246465076",812,2023-04-15 09:40:00,3,1,1,1,1,1,1,1,41,2,"",2,"",5,9,2,1,1,1,2,1,2,1,2,2,3,3,1,0,4,1,0,2,2,5,2,2,1,4,1,5,2,2,1,4,1,1,2,NA,"",NA,"",2,NA,2,"",NA,NA,0,1,0,0,0,1,1,1,0,"",4,"",1,0,0,0,0,0,1,1,0,0,"","",1,3,NA,"",3,NA,NA,NA,NA,NA,"",1,3,NA,NA,NA,"",3,4,1,"Sportkurs",2,NA,5,"Kurs wird zu weit entfernt angeboten","","",NA,NA,3,"",NA,NA,NA,"","","",NA,NA,2,"",NA,NA,NA,"","","",4,5,2,"",NA,NA,NA,"","","",2,2,1,"Belehrungen",1,3,NA,"","","",NA,NA,1,"Teamtage",1,4,NA,"","","",NA,NA,1,"Online-Weiterbildungen",2,NA,4,"","","öfter und spezifischer",NA,NA,1,"einen Mitarbeiter, der die Gestaltung kontrolliert",2,NA,4,"","","Schulungen",NA,NA,3,"",NA,NA,NA,NA,"",NA,3,4,1,"Vorgesetzte",1,4,NA,"",NA,NA,1,"Gleitzeit, Möglichkeit der Teilzeit",1,5,NA,"","","",NA,NA,2,"",NA,NA,NA,"","","",3,1,2,"",NA,NA,NA,"","","",3,2,2,"",NA,NA,NA,NA,"","",3,4,2,"",NA,NA,NA,NA,"","",3,5,0,0,0,0,0,0,0,1,0,0,"",1,0,1,0,0,0,0,0,0,0,"",1,0,1,1,0,0,0,1,0,0,"",1,1,NA,NA,NA,NA,2,NA,NA,NA,"",2,2,1,1,1,1,4,5,3,2,2,"",3,1,3,2,20,0,4,5,4,4,4,5,4,4,4,4,3,4,5,5,4,5,4,5,4,4,4,3,5,4,2,3,2,2,3,2,3,4,4,4,3,3,2,4,3,3,2,4,4,2,3,4,4,4,4,3,5,3,3,3,3,4,3,4,3,4,4,4,5,4,4,4,2,1,2,1,1,1,1,1,1,2,1,1,1,1,1,5,3,5,4,4,2,3,2,1,3,1,3,4,3,4,1,3,1,2,2,3,3,4,3,4,5,4,4,3,1474.39,5,"bq4uanftrkwrr9d4",NA,NA,"..","/survey/selfserve/53b/g004/230372?list=1&ID=241183254199315","bq4uanftrkwrr9d4","241183254199315",26.4644333333333,24.5731666666667,0,42021,"01-04-2021",2021-04-01,25,2,1,2.01,854,2021,2,3.66666666666667,3,4.66666666666667,4,1.5,3.5,1.5,1,4,2.5,3.66666666666667,3.5,1,5.8,3.2,4,3,3.41666666666667,3.2,3.11111111111111,4,2.66666666666667,2.66666666666667,4,1,3.4,5,2.33333333333333,5,2.33333333333333,1,3.81818181818182,4,4,3.33333333333333,4.25,3.66666666666667,5,4.66666666666667,3.66666666666667,4,4,3,3,3.33333333333333,52.83,54.05,53.98,60.77,55.62,55.25,49.59,52.42,62.4247591,52.3080091,68.1472832,58.7788932,1.66666666666667,2,2,3,1.8,1.75,1.83333333333333,4.66666666666667,3.66666666666667,4.66666666666667,5.66666666666667,52.83,54.05,53.98,60.77,55.62,55.25,49.59,52.42,62.4247591,52.3080091,68.1472832,58.7788932,1.77777777777778,1,2,1,2,1.58333333333333,1.5,1.625,3.5,4.09090909090909,4.4,4,3.66666666666667,4.33333333333333,4.66666666666667,4.66666666666667,4,4,2.33333333333333,3.2,2,3,3.5,3.66666666666667,3,3,3.76923076923077,3.6,3.5,4.25,1.28571428571429,1.16666666666667,1,3.07142857142857,4.2,2,2.75,3,5,3,2.66666666666667,3,3.25,4.25,2,1,1,3.66666666666667,3.5,3,2.66666666666667,3.25
"67",101,"gsptr9ruu5pwyw98","02/27/2023 18:10","qualified,/Gender/X0TrF,/Age/b3xfu,/Total/Total",3,1,1,1,1,1,1,2,59,2,5,"",6,1,"",1,1,6,5.1996,60,60,2,NA,NA,NA,4,"","Empfangskraft",6,2,5,1,NA,NA,NA,NA,NA,NA,NA,NA,NA,NA,NA,NA,NA,NA,NA,NA,NA,NA,NA,NA,NA,NA,NA,NA,NA,2,3,3,2,3,3,3,3,3,3,3,3,2,3,3,3,3,3,3,3,3,3,3,3,3,3,3,1,10,10,10,10,10,2,2,4,4,4,2,2,2,2,2,2,2,3,3,3,3,3,2,2,2,3,3,3,3,3,3,3,3,3,3,3,3,3,3,3,3,3,3,3,3,3,3,2,1,1,1,1,5,1,1,5,NA,NA,0,1,1,1,1,1,5,9,3,2,2,2,2,2,2,2,1,3,2,0,1,0,0,0,0,3,4,3,2,2,4,2,2,2,4,3,3,3,3,3,3,3,3,3,4,4,4,4,4,4,4,4,4,4,4,3,3,3,3,3,3,3,3,3,3,3,3,3,3,3,3,3,3,3,3,3,3,3,3,1,1657.115,4,NA,10,NA,5,6,"02/27/2023 17:42",NA,NA,NA,1,"Mozilla/5.0 (Windows NT 10.0; Win64; x64) AppleWebKit/537.36 (KHTML, like Gecko) Chrome/110.0.0.0 Safari/537.36","r1b6mhb7cxpq9ues","egrk5mjx0tcw73fq",NA,NA,"..","/survey/selfserve/53b/g004/230146?list=1&ID=237111539450937","egrk5mjx0tcw73fq","237111539450937",707,2023-04-14 19:05:00,3,1,1,1,1,1,1,2,59,2,"",2,"",4,10,2,2,1,2,1,1,1,1,1,1,1,1,1,1,1,1,1,1,2,2,2,2,2,2,2,2,2,2,2,2,1,2,NA,NA,"",NA,"",NA,NA,NA,"",3,3,NA,NA,NA,NA,NA,NA,NA,NA,NA,"",NA,"",1,0,0,0,0,0,1,0,0,0,"","",1,2,2,"",3,NA,NA,NA,NA,NA,"",3,2,NA,NA,NA,"",3,3,2,"",NA,NA,NA,"","","",3,3,3,"",NA,NA,NA,"","","",3,3,2,"",NA,NA,NA,"","","",3,3,2,"",NA,NA,NA,"","","",3,3,1,"schulungen",1,4,NA,"","","",NA,NA,2,"",NA,NA,NA,"","","",3,3,1,"sifa",1,4,NA,"","","",NA,NA,1,"stühle",1,4,NA,"","","",NA,NA,2,"",NA,NA,NA,NA,"",NA,3,3,2,"",NA,NA,NA,"",3,3,2,"",NA,NA,NA,"","","",3,3,2,"",NA,NA,NA,"","","",3,3,2,"",NA,NA,NA,"","","",3,3,2,"",NA,NA,NA,NA,"","",3,3,2,"",NA,NA,NA,NA,"","",3,3,0,0,0,0,0,0,0,1,0,0,"",0,0,1,0,0,0,0,0,0,0,"",0,0,0,1,1,0,0,0,0,0,"",3,1,NA,NA,NA,NA,1,2,NA,2,"",NA,NA,1,1,2,2,3,3,3,3,2,"",2,2,1,1,0,0,1,3,3,3,3,3,3,3,3,3,3,3,3,3,3,3,3,3,3,3,3,3,3,3,3,3,3,3,3,3,3,3,3,3,3,3,3,3,3,3,3,3,3,3,3,3,3,3,3,3,3,3,3,3,3,3,3,3,3,3,3,3,3,3,3,3,3,3,3,3,3,3,3,3,3,3,3,3,3,2,2,3,3,3,3,3,3,3,3,3,3,3,3,3,3,3,3,3,3,3,3,3,3,3,3,3,3,3,3,3,3873.2,5,"egrk5mjx0tcw73fq",NA,NA,"..","/survey/selfserve/53b/g004/230372?list=1&ID=241166931200216","egrk5mjx0tcw73fq","241166931200216",27.6185833333333,64.5533333333333,0,51996,"01-05-1996",1996-05-01,324,27,0,27,9955,1996,27,2.66666666666667,3,3,3,2.5,3,3,3,3,3,3,3,1,10,2,3,2.66666666666667,2.5,3,2.66666666666667,2,3,3,3,3,1.2,1.5,1,1.5,1,1,4,4,4,4,3,3,3,3,3,3,3,3,3,3,46.43,48.33,46.92,53.35,55.62,49.47,49.59,45.66,60.8800965,50.7633465,58.8045092,49.4361192,0.777777777777778,2,2,2,2.2,2,2.33333333333333,3,3,3,3,52.83,48.33,53.98,53.35,61.83,55.25,56.79,52.42,70.47629,60.35954,62.4172324,53.0488424,1,4,4,4,4,2.66666666666667,3,2.5,3,3,3,3,3,3,3,3,3,3,3,3,3,3,3,3,3,3,3,3,3,3,3,3,2,3,3,3,3,3,3,3,3,3,3,3,3,1,1,3,3,3,3,3
"68",102,"wt78229hpfxjvcps","02/27/2023 18:04","qualified,/Gender/p47uy,/Age/b3xfu,/Total/Total",3,1,1,1,1,1,1,1,65,2,3,"",5,3,"",1,1,6,6.1991,40,40,2,NA,NA,NA,8,"","Technische Aufsichtsbeamtin",7,16,1,2,2,2,1,NA,1,NA,NA,NA,NA,NA,NA,NA,NA,NA,1,NA,NA,NA,NA,NA,NA,NA,NA,NA,NA,2,5,5,5,5,5,5,3,4,4,4,4,4,4,3,3,2,4,2,3,3,3,3,2,3,3,3,1,6,5,5,9,4,2,2,3,2,4,3,3,2,2,1,2,2,2,4,3,1,2,4,4,4,4,5,4,4,4,4,4,4,4,3,1,1,2,3,3,5,5,2,1,1,1,1,3,5,5,2,1,4,4,1,4,2,40,41,3,1,1,1,5,4,6,3,2,2,1,2,1,2,2,3,4,3,4,0,2,0,0,0,2,4,3,2,2,2,1,3,3,2,0,5,4,4,5,5,5,5,4,4,4,5,4,4,4,4,4,4,4,3,4,4,4,4,4,4,5,4,5,4,4,4,4,4,4,4,4,4,4,1,4,2,4,3,1,1245.509,4,NA,10,NA,5,6,"02/27/2023 17:43",NA,NA,NA,1,"Mozilla/5.0 (Windows NT 10.0; Win64; x64) AppleWebKit/537.36 (KHTML, like Gecko) Chrome/110.0.0.0 Safari/537.36 Edg/110.0.1587.57","bazhr8he2x970bst","79ek6ma2ae4fbhgz",NA,NA,"..","/survey/selfserve/53b/g004/230146?list=1&ID=237129246466125","rm4gwb94zah22hnn","237129246466125",737,2023-04-14 19:44:00,3,1,1,1,1,1,1,1,65,2,"",2,"",4,7,3,3,2,3,3,2,3,2,3,3,2,3,2,2,0,0,0,1,3,4,4,3,3,4,3,3,3,3,2,3,2,2,NA,NA,"",NA,"",NA,NA,NA,"",2,3,NA,NA,NA,NA,NA,NA,NA,NA,NA,"",NA,"",1,0,0,0,0,0,1,0,0,0,"","",1,4,NA,"",2,NA,NA,NA,NA,NA,"",2,2,NA,NA,NA,"",3,4,2,"",NA,NA,NA,"","","",5,5,2,"",NA,NA,NA,"","","",5,5,2,"",NA,NA,NA,"","","",5,5,2,"",NA,NA,NA,"","","",3,3,1,"Erste Hilfe Angebote, Sicherheit am Arbeitsplatz",1,5,NA,"","","",NA,NA,1,"Wandertage",1,5,NA,"","","",NA,NA,1,"Spezifische tätigkeitsbezogene Kurse",1,4,NA,"","","",NA,NA,1,"höhenverstellbare Schreibtische",1,5,NA,"","","",NA,NA,1,"Computer Lehrgänge",1,5,NA,NA,"",NA,NA,NA,2,"",NA,NA,NA,"",3,3,1,"Teilzeitmodelle",2,NA,4,"","","ja",NA,NA,1,"Elternzeit",2,NA,2,"","","",NA,NA,2,"",NA,NA,NA,"","","",2,2,2,"",NA,NA,NA,NA,"","",3,3,2,"",NA,NA,NA,NA,"","",3,3,0,0,0,0,0,0,1,0,0,0,"",0,1,0,1,1,0,0,0,0,0,"",0,1,0,1,1,0,0,0,0,0,"",1,2,NA,NA,NA,NA,1,1,2,NA,"",NA,NA,1,1,1,1,3,3,3,3,2,"",3,3,4,2,50,57,5,4,4,5,4,4,4,3,4,4,4,4,4,4,4,4,4,5,5,5,4,4,4,4,3,3,2,3,3,3,3,3,4,4,4,1,1,2,3,2,2,2,3,3,3,4,5,4,4,3,5,4,4,4,4,4,4,5,3,4,5,4,4,4,4,5,3,4,2,1,1,1,2,1,1,1,1,1,1,2,1,4,4,4,4,4,4,4,4,4,3,4,4,4,4,3,2,3,2,2,3,3,3,3,3,4,5,4,4,4,1485.42,5,"79ek6ma2ae4fbhgz",NA,NA,"..","/survey/selfserve/53b/g004/230372?list=1&ID=241183254207604","rm4gwb94zah22hnn","241183254207604",20.7584833333333,24.757,16,61991,"01-06-1991",1991-06-01,383,31,11,31.11,11751,1991,32,5,5,4,4,4,3,3,2.5,3,2.5,3,3,1,5.8,2,2.5,2.66666666666667,2.33333333333333,2.4,4.11111111111111,4,4.33333333333333,4,4,1,3.2,4,2.66666666666667,4,2.66666666666667,2.2,4,4.2,4,3.66666666666667,4.16666666666667,4,4,4.66666666666667,4,4,5,4,3,4,46.43,48.33,46.92,60.77,55.62,55.25,49.59,45.66,61.9259107,51.8091607,61.396913,52.028523,1.77777777777778,2,4,4,2.6,3.25,2.16666666666667,4.11111111111111,3.33333333333333,4.33333333333333,4.66666666666667,46.43,40.07,46.92,47.67,45.16,49.47,41.53,45.66,54.1287517,44.0120017,55.6287384,46.2603484,1.66666666666667,2,2,3,3,2.83333333333333,2.5,3,3,4,4.2,3.66666666666667,4,4.25,4,4.33333333333333,4.66666666666667,4,2.83333333333333,2.66666666666667,2,3,3.875,3.83333333333333,4,3,4.15384615384615,4,4.25,4.25,2,1,1.5,3.92857142857143,4,4,3.75,4,4,2.9,2.66666666666667,3,3,4.25,2.2,1,5,3.33333333333333,4,1.33333333333333,2.33333333333333,2.75
"69",105,"60mmt9gzrxb61jbs","02/27/2023 18:13","qualified,/Gender/p47uy,/Age/gcKvr,/Total/Total",3,1,1,1,1,1,1,1,46,1,5,"",6,3,"",3,1,4,8.2007,38,38,2,NA,NA,NA,8,"","Anwendungsentwicklerin",8,10,1,2,2,2,1,NA,1,NA,NA,NA,NA,NA,NA,NA,NA,NA,1,NA,NA,NA,NA,NA,NA,NA,NA,NA,NA,2,5,5,4,4,4,4,4,4,4,4,4,1,1,1,1,1,1,1,1,4,4,4,4,4,4,4,5,7,6,6,7,6,3,3,4,4,3,4,4,4,3,3,3,3,3,4,3,2,3,4,4,4,4,4,4,4,4,4,4,4,4,2,1,1,3,5,5,5,5,5,1,1,1,1,5,5,3,3,3,4,4,3,3,2,50,20,3,3,2,3,2,4,9,2,1,1,1,2,1,1,1,0,0,0,0,0,0,0,0,0,1,4,1,1,1,3,1,3,1,3,5,5,5,5,5,5,5,5,5,5,4,4,5,5,4,4,4,4,4,4,5,5,5,5,5,5,5,5,5,4,4,4,4,4,4,5,5,5,5,1,5,1,5,1,1,1669.659,4,NA,12,NA,5,6,"02/27/2023 17:45",NA,NA,NA,1,"Mozilla/5.0 (Windows NT 10.0; Win64; x64; rv:109.0) Gecko/20100101 Firefox/110.0","h2pm3pthv6uykx3z","vhh3h3wukw9bxp0m",NA,NA,"..","/survey/selfserve/53b/g004/230146?list=1&ID=237111539449907","vhh3h3wukw9bxp0m","237111539449907",839,2023-04-15 14:35:00,3,1,1,1,1,1,1,1,46,2,"",2,"",5,8,2,1,1,1,2,1,1,1,0,0,0,0,0,0,0,0,0,1,1,5,1,1,1,3,1,5,2,2,2,4,2,2,NA,NA,"",NA,"",NA,NA,NA,"",2,3,NA,NA,NA,NA,NA,NA,NA,NA,NA,"",NA,"",0,0,0,0,0,0,1,1,0,0,"","",3,NA,NA,"",1,6,1,2,NA,2,"",0,2,NA,NA,NA,"",2,3,1,"Ballsport",2,NA,4,"","","zeitlich",NA,NA,2,"",NA,NA,NA,"","","",NA,NA,2,"",NA,NA,NA,"","","",3,4,2,"",NA,NA,NA,"","","",3,3,2,"",NA,NA,NA,"","","",2,2,2,"",NA,NA,NA,"","","",3,3,1,"interne Seminare",1,5,NA,"","","",NA,NA,3,"",NA,NA,NA,"","","",3,4,2,"",NA,NA,NA,NA,"",NA,3,3,3,"",NA,NA,NA,"",3,4,1,"Gleitzeit",1,5,NA,"","","",NA,NA,3,"",NA,NA,NA,"","","",3,3,2,"",NA,NA,NA,"","","",3,3,1,"Seminare",2,NA,3,NA,"keine","",NA,NA,2,"",NA,NA,NA,NA,"","",2,2,0,0,0,0,1,0,0,0,0,0,"",0,0,0,0,0,1,0,0,0,0,"",0,0,0,0,0,0,0,1,0,0,"",1,1,NA,NA,NA,NA,2,NA,NA,NA,"",2,2,1,1,2,2,3,3,4,2,2,"",4,4,4,2,60,40,5,5,5,5,5,5,5,5,4,5,5,5,5,5,5,5,5,5,4,4,4,4,4,5,3,3,2,2,3,2,5,4,5,4,4,5,5,5,5,5,4,4,4,5,4,5,5,4,1,1,3,4,4,3,2,3,2,3,2,3,4,4,4,4,4,4,1,1,1,1,1,1,1,1,1,1,1,1,1,1,1,5,4,5,5,4,2,2,4,2,4,4,4,4,1,4,4,4,1,2,2,3,3,3,3,3,4,3,3,3,3695.18,5,"vhh3h3wukw9bxp0m",NA,NA,"..","/survey/selfserve/53b/g004/230372?list=1&ID=241183254202437","vhh3h3wukw9bxp0m","241183254202437",27.82765,61.5863333333333,20,82007,"01-08-2007",2007-08-01,189,15,9,15.09,5846,2007,16,4.66666666666667,4,4,4,1,1,1,1,4,4,4,4,NA,6.4,3.2,4,3,3.41666666666667,3,4,4,4,4,5,1,3.8,5,3,5,3,2.6,4.27272727272727,4.6,4,4,4.75,5,5,5,4,4.5,5,5,5,5,52.83,54.05,53.98,60.77,55.62,55.25,56.79,52.42,67.5970951,57.4803451,66.0444512,56.6760612,0,2,3,3,1.7,2,1.5,5,5,5,5,52.83,54.05,53.98,60.77,55.62,55.25,56.79,52.42,67.5970951,57.4803451,66.0444512,56.6760612,0,1,3,1,2,1.5,2,1.25,3,4.90909090909091,5,4.66666666666667,5,4.58333333333333,5,5,4,4.33333333333333,2.5,4.53333333333333,5,5,4.375,4.5,4,4,3.38461538461538,3.6,2.5,4,1,1,1,3.57142857142857,4.6,2.5,4,1,5,3.3,4,3,3,3.25,2.2,1,5,4.66666666666667,4,5,4.66666666666667,4.25
"70",106,"7gs1juz6j9dz7nz7","02/27/2023 18:02","qualified,/Gender/p47uy,/Age/gcKvr,/Total/Total",3,1,1,1,1,1,1,1,38,1,5,"",5,1,"",4,1,6,1.2,40,40,2,NA,NA,NA,4,"","fuhrparkleiter",8,3,1,2,3,3,2,1,38,17,NA,NA,NA,NA,NA,NA,NA,NA,1,2,NA,NA,NA,NA,NA,NA,NA,NA,3,2,4,5,4,4,5,4,4,4,4,5,5,4,5,5,4,4,4,4,3,4,5,5,5,4,5,5,1,7,3,7,8,6,3,4,4,5,4,4,4,4,5,5,5,4,3,4,4,3,3,4,5,4,4,5,5,5,5,4,4,4,5,4,4,3,4,4,4,4,5,5,1,1,1,1,4,5,3,4,4,5,2,1,3,1,1,0,5,6,5,5,5,5,10,1,1,1,1,1,1,1,1,0,2,0,3,0,0,0,0,0,1,4,2,1,1,4,1,2,1,3,3,4,4,5,5,4,4,4,4,4,5,5,4,4,4,4,4,5,3,4,5,4,4,4,5,5,5,5,4,4,4,4,4,5,5,5,4,4,4,4,5,5,4,4,1,816.554,4,NA,12,NA,5,6,"02/27/2023 17:48",NA,NA,NA,1,"Mozilla/5.0 (Windows NT 10.0; Win64; x64; rv:107.0) Gecko/20100101 Firefox/107.0","dgv5agyv8c27quqz","xud7r8w0hybgymnu",NA,NA,"..","/survey/selfserve/53b/g004/230146?list=1&ID=237104974329995","fcn1jwvtwsfhfe0q","237104974329995",474,2023-04-14 13:16:00,3,1,1,1,1,1,1,1,38,2,"",2,"",5,10,2,1,1,1,2,1,1,1,2,3,0,0,0,0,0,0,0,1,1,4,2,1,1,4,2,3,2,2,1,3,1,1,2,NA,"",NA,"",2,NA,2,"",NA,NA,1,0,0,0,0,0,0,0,0,"",1,"",0,1,0,0,0,0,0,0,0,0,"","",2,NA,NA,"",2,NA,NA,NA,NA,NA,"",1,2,NA,NA,NA,"",2,2,2,"",NA,NA,NA,"","","",2,2,1,"therapien",2,NA,2,"","","",2,2,2,"",NA,NA,NA,"","","",3,3,2,"",NA,NA,NA,"","","",1,1,2,"",NA,NA,NA,"","","",3,3,1,"feiern",1,4,NA,"","","",NA,NA,1,"weiterbildung fahrsicherheit",1,4,NA,"","","",NA,NA,2,"",NA,NA,NA,"","","",3,3,2,"",NA,NA,NA,NA,"",NA,2,2,2,"",NA,NA,NA,"",4,3,1,"muttischicht",2,NA,2,"","","",NA,NA,2,"",NA,NA,NA,"","","",2,2,2,"",NA,NA,NA,"","","",1,1,2,"",NA,NA,NA,NA,"","",3,3,2,"",NA,NA,NA,NA,"","",3,3,0,0,0,0,0,0,0,1,0,0,"",0,0,0,0,0,1,1,0,0,0,"",0,0,0,0,0,1,0,0,0,0,"",2,1,NA,NA,NA,NA,1,2,NA,2,"",NA,NA,1,1,2,2,4,4,4,3,2,"",1,1,2,1,0,0,1,4,5,4,4,5,5,4,4,5,5,4,5,4,4,5,5,5,5,4,4,4,4,4,3,3,2,2,3,3,4,3,4,4,5,5,4,4,4,3,3,4,4,4,4,4,5,5,2,4,4,4,4,4,5,3,3,4,1,4,4,4,4,4,4,4,1,1,1,1,1,1,1,1,1,1,1,1,1,1,1,5,4,4,5,5,4,4,4,4,5,5,5,5,5,4,4,5,5,5,4,4,4,4,4,4,5,5,5,5,1302.13,5,"xud7r8w0hybgymnu",NA,NA,"..","/survey/selfserve/53b/g004/230372?list=1&ID=241183254224022","fcn1jwvtwsfhfe0q","241183254224022",13.6092333333333,21.7021666666667,0,12000,"01-01-2000",2000-01-01,280,23,4,23.04,8615,2000,23,4.33333333333333,4.5,4,4.66666666666667,4.5,4.5,4,3.5,4.5,5,4.66666666666667,4.5,1,6.2,4.2,4.25,4.33333333333333,4.25,3.4,4.55555555555556,4.33333333333333,4.66666666666667,4.66666666666667,4.66666666666667,1,4,4.5,3.66666666666667,4.5,3.66666666666667,5.2,4.18181818181818,4.4,4,4,4.41666666666667,4.33333333333333,4.66666666666667,4.66666666666667,4,4.5,2,1,2,3,59.45,54.05,53.98,60.77,61.83,55.25,56.79,52.42,69.432978,59.316228,68.008793,58.640403,0.555555555555556,2,2,3,1.6,1.75,1.5,4.11111111111111,4,4.33333333333333,4,52.83,54.05,53.98,60.77,55.62,55.25,56.79,52.42,67.5970951,57.4803451,66.0444512,56.6760612,0.555555555555556,2,2,3,3,1.83333333333333,1.75,1.875,3.75,4.45454545454545,4.4,4.33333333333333,4.66666666666667,4.41666666666667,4.33333333333333,5,4.33333333333333,4,2.66666666666667,3.93333333333333,4,2,4,4,4,5,4,4.2,3.75,4,1,1,1,4.57142857142857,4.6,4,5,5,1,3.9,4.33333333333333,3.33333333333333,4,4.75,4,1,5,3.66666666666667,4.5,4.33333333333333,3.33333333333333,4
"71",107,"qqdxcqy2b6r1m9xc","02/27/2023 18:14","qualified,/Gender/X0TrF,/Age/b3xfu,/Total/Total",3,1,1,1,1,1,1,2,61,2,5,"",2,1,"",1,1,6,3.2008,40,0,2,NA,NA,NA,5,"","Auftragsbearbeitung",6,14,1,2,2,2,1,NA,64,NA,NA,NA,NA,NA,NA,NA,NA,NA,1,NA,NA,NA,NA,NA,NA,NA,NA,NA,NA,2,4,4,4,3,3,5,3,4,4,4,4,2,2,1,3,1,1,1,1,3,4,2,2,2,2,3,2,5,5,5,5,5,3,3,3,4,3,3,4,5,3,3,3,3,2,2,1,1,1,5,3,3,3,3,2,2,2,2,2,2,2,3,3,3,4,5,5,5,5,5,1,1,1,1,3,3,5,3,5,3,5,1,1,2,98,0,5,1,1,1,1,5,5,2,2,1,1,3,2,2,1,2,1,0,0,1,1,0,0,0,2,4,3,3,2,4,1,3,3,3,3,4,4,2,4,1,3,2,1,4,4,4,4,3,3,3,3,4,4,3,4,4,4,4,4,4,3,4,3,2,3,3,3,3,4,4,4,4,3,3,3,3,3,3,1,1279.521,14,NA,10,NA,1,2,"02/27/2023 17:53",NA,NA,NA,1,"Mozilla/5.0 (Linux; Android 13; SAMSUNG SM-S908B) AppleWebKit/537.36 (KHTML, like Gecko) SamsungBrowser/20.0 Chrome/106.0.5249.126 Mobile Safari/537.36","yrw0gfx0c2qpazcq","yeb7bxknp06rxdca",NA,NA,"sa","/survey/selfserve/53b/g004/230146?list=1&ID=237111539460330","yeb7bxknp06rxdca","237111539460330",925,2023-04-17 01:33:00,3,1,1,1,1,1,1,2,61,2,"",2,"",4,8,2,3,1,1,3,3,2,2,2,5,1,0,1,1,2,0,2,3,2,2,2,2,2,4,2,4,2,4,2,4,1,1,1,6,".",9,"",NA,NA,NA,"",NA,NA,NA,NA,NA,NA,NA,NA,NA,NA,NA,"",NA,"",1,0,0,0,0,0,0,0,0,0,"","",1,2,2,"",2,NA,NA,NA,NA,NA,"",2,2,NA,NA,NA,"",2,3,2,"",NA,NA,NA,"","","",3,1,2,"",NA,NA,NA,"","","",4,2,2,"",NA,NA,NA,"","","",3,2,2,"",NA,NA,NA,"","","",4,3,2,"",NA,NA,NA,"","","",1,1,1,".",2,NA,2,"","","",NA,NA,3,"",NA,NA,NA,"","","",3,2,1,".",2,NA,2,"","","",NA,NA,2,"",NA,NA,NA,NA,"",NA,3,3,2,"",NA,NA,NA,"",3,3,1,".",1,5,NA,"","","",NA,NA,1,".",2,NA,2,"","","",NA,NA,2,"",NA,NA,NA,"","","",3,1,2,"",NA,NA,NA,NA,"","",1,1,2,"",NA,NA,NA,NA,"","",2,2,0,0,0,0,0,0,0,0,0,1,".",0,0,0,0,0,0,0,0,0,1,".",0,0,0,1,0,0,0,0,1,0,"",1,1,NA,NA,NA,NA,1,1,4,NA,"",NA,NA,1,1,2,2,3,2,2,3,2,"",5,1,5,2,95,5,5,3,3,4,4,5,4,4,4,2,4,4,4,4,4,4,4,4,4,4,3,2,3,2,3,3,3,3,3,3,5,5,5,4,5,3,2,5,4,5,5,5,5,5,3,4,4,4,2,2,3,1,1,2,2,3,3,3,3,3,3,5,3,3,3,3,3,3,2,4,1,2,4,1,1,4,4,1,3,2,1,3,2,3,1,4,4,5,3,3,4,3,2,2,5,3,3,3,3,3,3,2,2,3,2,3,3,3,3,3,1493.51,1,"yeb7bxknp06rxdca",NA,NA,"sa","/survey/selfserve/53b/g004/230372?list=1&ID=241166931206204","y9xfb9z47tyv4v9z","241166931206204",21.32535,24.8918333333333,5,32008,"01-03-2008",2008-03-01,182,15,2,15.02,5633,2008,15,4,3,4,4,2,2,1,1,3.5,2,2.33333333333333,2,2,5,3.2,3.75,3,3.33333333333333,1.4,2.77777777777778,3.66666666666667,2.66666666666667,2,5,1,3.8,3,4.33333333333333,3,4.33333333333333,1.8,3.54545454545455,3.8,3,3.66666666666667,3.5,4,4,3.33333333333333,2.66666666666667,3.66666666666667,3,3,3,3,52.83,48.33,53.98,60.77,45.16,49.47,49.59,52.42,59.6020777,49.4853277,65.2499446,55.8815546,0.555555555555556,2,2,3,2.4,2.5,2.33333333333333,2.66666666666667,3.66666666666667,3,1.33333333333333,52.83,40.07,53.98,60.77,45.16,40.41,49.59,45.66,56.6892923,46.5725423,62.37797,53.00958,1.55555555555556,4,2,2,2,2.33333333333333,2,2.5,2.5,3.72727272727273,3.8,4,3.33333333333333,3.5,4,4,3.66666666666667,2.33333333333333,3,4.4,4,4,3.125,3.83333333333333,1,3,3,3.2,2.75,3,2.71428571428571,2.33333333333333,1.5,3.14285714285714,2.6,3.75,2.75,5,3,2.7,3,3,2.25,3,3,2,3,5,4.5,3.33333333333333,4.66666666666667,4.5
"72",108,"gbgtuu5vngx097qe","02/27/2023 18:05","qualified,/Gender/X0TrF,/Age/gcKvr,/Total/Total",3,1,1,1,1,1,1,2,43,1,3,"",4,1,"",4,1,4,10.2015,40,60,2,NA,NA,NA,4,"","Direktor",7,2,5,2,2,2,2,1,8,NA,NA,NA,NA,NA,NA,NA,NA,NA,2,NA,NA,NA,NA,NA,NA,NA,NA,NA,3,2,4,4,5,3,3,5,2,3,5,4,1,2,5,4,5,2,5,4,2,4,5,3,3,3,3,3,1,5,4,4,5,5,2,4,3,5,5,4,3,3,5,4,3,3,3,4,3,3,3,5,5,4,5,4,5,4,4,5,5,5,4,2,1,1,1,5,5,3,5,4,1,1,1,1,2,4,1,5,2,5,1,1,1,NA,NA,2,1,2,3,1,1,4,8,3,1,1,4,3,3,4,4,1,4,4,2,1,3,0,3,3,4,4,4,4,4,4,4,4,4,4,3,4,4,4,4,4,5,5,3,5,4,4,5,4,4,4,4,2,1,1,5,5,5,5,5,5,3,2,3,3,3,4,2,4,5,5,4,4,2,3,3,4,3,3,1,702.472,4,NA,10,NA,5,6,"02/27/2023 17:53",NA,NA,NA,1,"Mozilla/5.0 (Windows NT 10.0; Win64; x64) AppleWebKit/537.36 (KHTML, like Gecko) Chrome/110.0.0.0 Safari/537.36 Edg/110.0.1587.56","0f7mhzx58tnn260f","81xftze28yheagcn",NA,NA,"..","/survey/selfserve/53b/g004/230146?list=1&ID=237111539457197","a0qeebsjvcf6zbhw","237111539457197",703,2023-04-14 19:35:00,3,1,1,1,1,1,1,2,44,2,"",2,"",3,7,3,2,1,3,3,1,2,1,3,4,3,5,5,5,2,3,3,4,5,2,1,2,3,3,5,2,4,4,4,5,1,1,2,NA,"",NA,"",2,NA,2,"",NA,NA,1,1,0,0,0,0,0,0,0,"",1,"",0,1,0,0,0,0,0,0,0,0,"","",1,2,2,"",1,5,1,2,NA,2,"",1,2,NA,NA,NA,"",3,4,1,"Schwimmbad, Fitness Studio",1,5,NA,"","","",NA,NA,1,"X",1,5,NA,"","","",NA,NA,1,"Diätspezifische kost.",1,5,NA,"","","",NA,NA,2,"",NA,NA,NA,"","","",5,5,3,"",NA,NA,NA,"","","",4,4,1,"Team building",1,4,NA,"","","",NA,NA,1,"X",1,5,NA,"","","",NA,NA,1,"Ergonomischer Stuhl",1,5,NA,"","","",NA,NA,1,"Umgang mit App",1,1,NA,NA,"",NA,NA,NA,1,"X",1,4,NA,"",NA,NA,2,"",NA,NA,NA,"","","",5,5,2,"",NA,NA,NA,"","","",5,5,2,"",NA,NA,NA,"","","",5,5,2,"",NA,NA,NA,NA,"","",5,5,2,"",NA,NA,NA,NA,"","",5,3,0,1,0,0,0,0,0,0,0,0,"",1,0,1,0,1,0,1,1,1,0,"",0,1,0,0,0,0,0,0,0,0,"",1,1,NA,NA,NA,NA,1,2,NA,2,"",NA,NA,1,1,1,2,5,3,3,5,2,"",1,1,5,2,6,0,5,5,5,4,4,3,3,1,5,2,2,1,5,4,4,4,5,5,5,5,5,5,5,5,3,3,3,2,2,1,5,2,5,5,5,5,2,5,5,5,5,5,5,5,5,4,1,3,4,4,5,5,5,5,5,3,5,5,2,4,4,4,5,3,5,5,5,5,5,1,2,5,5,4,1,3,1,5,5,2,3,4,5,5,5,5,5,4,4,4,5,4,4,5,5,5,1,1,1,1,3,1,3,2,3,3,4,1,1,1,5957.64,1,"008xy9336ma1kyjn",NA,NA,"sa","/survey/selfserve/53b/g004/230372?list=1&ID=241183254217784","9tuj0r2fc1q6e6hp","241183254217784",11.7078666666667,99.294,-2,102015,"01-10-2015",2015-10-01,91,7,7,7.07,2863,2015,8,4.33333333333333,3,3.33333333333333,3.33333333333333,3.5,4.5,3.5,3,4.5,3,3,3,1,4.6,3.6,3.75,3.66666666666667,3.66666666666667,3.2,4.55555555555556,4.66666666666667,4.66666666666667,4.33333333333333,4,1,2.8,3,2.66666666666667,3,2.66666666666667,1.6,3.45454545454545,4.4,4,1.33333333333333,4,5,5,2.66666666666667,3.33333333333333,4,3,2,3,2.66666666666667,46.43,54.05,53.98,40.07,45.16,40.41,31.62,29.25,35.1551128,25.0383628,63.014033,53.645643,2.33333333333333,2,2,2,3.4,3,3.66666666666667,4,3.66666666666667,4.33333333333333,4,46.43,48.33,53.98,47.67,45.16,55.25,49.59,52.42,60.9303283,50.8135783,59.592898,50.224508,3.66666666666667,4,3,4,1,3.33333333333333,2.75,3.625,4,3.18181818181818,4.2,3,1.66666666666667,4.75,4.33333333333333,4.66666666666667,5,5,2.33333333333333,4.6,2,2,3.375,2.83333333333333,5,4,4.38461538461539,4.2,4.5,4.5,4,3.16666666666667,2.5,4.57142857142857,4.8,4.25,4.5,5,5,2.5,2.33333333333333,3,2.25,2.25,1.8,1,5,4,5,4,5,5
"73",109,"b3afstanacdzujph","02/27/2023 18:13","qualified,/Gender/X0TrF,/Age/b3xfu,/Total/Total",3,1,1,1,1,1,1,2,59,2,5,"",6,1,"",2,1,4,1.201,40,45,2,NA,NA,NA,11,"","Maschinenbauingenieur",8,10,1,2,3,3,2,1,55,17,NA,NA,NA,NA,NA,NA,NA,NA,1,2,NA,NA,NA,NA,NA,NA,NA,NA,3,2,4,4,4,4,2,4,4,4,5,3,3,3,3,3,4,2,5,2,2,4,3,3,4,3,3,4,3,8,7,6,8,8,4,3,4,4,3,3,4,2,4,3,3,3,3,4,4,1,3,2,4,3,4,4,3,3,4,4,3,4,4,2,2,1,4,5,4,4,5,5,1,1,1,1,3,5,4,3,3,2,4,1,4,3,35,15,5,5,6,5,5,3,8,3,2,2,3,2,2,2,3,2,4,2,4,3,1,3,3,2,3,4,3,4,3,3,3,4,2,4,3,2,2,2,1,2,2,2,2,4,4,4,3,5,3,3,3,4,3,3,3,3,2,4,5,4,3,3,4,3,3,2,4,4,4,4,4,4,2,3,3,3,3,2,1,1008.668,4,NA,12,NA,5,6,"02/27/2023 17:55",NA,NA,NA,1,"Mozilla/5.0 (Windows NT 10.0; Win64; x64; rv:102.0) Gecko/20100101 Firefox/102.0","bs0cce2ys9yqeqjt","6437t56pzxypfs1x",NA,NA,"..","/survey/selfserve/53b/g004/230146?list=1&ID=237129246472360","v8yv4s0wu5spz7n1","237129246472360",833,2023-04-15 12:14:00,3,1,1,1,1,1,1,2,49,2,"",2,"",3,8,3,3,2,3,3,2,2,2,3,4,2,2,4,2,1,2,1,4,4,3,4,4,3,3,3,3,4,4,3,2,2,2,NA,NA,"",NA,"",NA,NA,NA,"",4,5,NA,NA,NA,NA,NA,NA,NA,NA,NA,"",NA,"",1,0,0,0,0,0,1,0,0,0,"","",2,NA,NA,"",2,NA,NA,NA,NA,NA,"",0,2,NA,NA,NA,"",4,5,2,"",NA,NA,NA,"","","",2,3,2,"",NA,NA,NA,"","","",4,5,2,"",NA,NA,NA,"","","",2,4,2,"",NA,NA,NA,"","","",2,2,2,"",NA,NA,NA,"","","",5,5,1,"strategietagungen bis ins wochenende hinein, weihnachtsfeier freitag/samstag",2,NA,2,"","","",NA,NA,1,"fachliche weiterbildungen",2,NA,2,"","","",NA,NA,2,"",NA,NA,NA,"","","",4,5,2,"",NA,NA,NA,NA,"",NA,4,5,2,"",NA,NA,NA,"",5,5,2,"",NA,NA,NA,"","","",5,5,1,"um die gesetzlich vorgeschriebenen",2,NA,1,"","","",NA,NA,2,"",NA,NA,NA,"","","",4,4,3,"",NA,NA,NA,NA,"","",5,1,2,"",NA,NA,NA,NA,"","",5,5,0,0,0,0,0,0,0,0,0,1,"keine",1,1,0,0,0,0,0,0,1,0,"",1,1,0,0,0,0,0,0,1,0,"",1,1,NA,NA,NA,NA,2,NA,NA,NA,"",4,4,2,NA,2,2,2,3,4,2,2,"",5,3,5,2,55,20,5,4,5,4,5,4,3,3,3,4,3,3,2,2,2,4,4,4,4,4,3,3,2,3,2,3,3,2,2,2,4,4,3,4,4,3,3,3,5,4,4,4,4,4,4,4,5,5,3,3,4,3,3,3,3,3,2,4,3,4,4,4,4,4,4,3,4,5,3,2,2,2,2,2,3,3,2,2,1,2,2,3,3,3,4,3,2,2,3,2,2,3,4,3,1,3,3,3,4,2,3,3,2,4,3,2,4,3,4,2,1108.21,5,"6437t56pzxypfs1x",NA,NA,"..","/survey/selfserve/53b/g004/230372?list=1&ID=241183254217776","v8yv4s0wu5spz7n1","241183254217776",16.8111333333333,18.4701666666667,5,12010,"01-01-2010",2010-01-01,160,13,4,13.04,4962,2010,13,4,3,4,3.66666666666667,3,3.5,3.5,2,3.5,3.5,3.33333333333333,3,3,7.4,3.6,3.25,3,3.33333333333333,3,3.44444444444444,3,3.66666666666667,3.66666666666667,4.66666666666667,1,3.6,4,3.33333333333333,4,3.33333333333333,5.2,3.54545454545455,4,3,3.33333333333333,3.25,2.66666666666667,4.33333333333333,3.33333333333333,2.66666666666667,4,3,3,4,3,46.43,48.33,46.92,47.67,55.62,49.47,49.59,38.09,58.1485436,48.0317936,56.6117288,47.2433388,2.66666666666667,2,3,2,2.9,2.5,3.16666666666667,2,2,2,2,46.43,40.07,46.92,47.67,45.16,49.47,49.59,45.66,59.9188945,49.8021445,53.2747348,43.9063448,2.33333333333333,3,3,3,4,3.5,3.25,3.625,2.75,3.72727272727273,4.4,3,3.33333333333333,3.08333333333333,2,4,3.66666666666667,2.66666666666667,2.33333333333333,3.8,3,3,3.75,4,3,3,3.46153846153846,3.6,3,3.75,2.85714285714286,2.16666666666667,2,2.71428571428571,3.2,2.25,3,1,2,2.8,3,2.33333333333333,3,3.25,2.6,3,4,3.66666666666667,4,3,4.33333333333333,4
"74",110,"te39xw35pk0jhzv4","02/27/2023 18:38","qualified,/Gender/p47uy,/Age/b3xfu,/Total/Total",3,1,1,1,1,1,1,1,58,2,5,"",5,1,"",1,1,3,2.2023,35,40,2,NA,NA,NA,12,"Buchhaltung","Buchhalter",6,4,1,2,2,2,2,0,1,NA,NA,NA,NA,NA,NA,NA,NA,NA,1,NA,NA,NA,NA,NA,NA,NA,NA,NA,5,1,4,4,4,4,4,3,3,3,3,3,4,3,3,3,3,3,3,3,3,3,3,3,3,3,3,3,3,7,6,5,7,6,3,4,4,4,4,4,4,4,4,3,4,4,3,3,4,3,4,3,2,2,3,2,2,2,3,2,3,3,3,2,2,3,2,4,4,4,4,4,1,1,1,1,3,3,1,2,1,5,1,1,1,NA,NA,0,4,4,4,4,4,2,9,4,3,3,4,2,3,4,3,3,5,0,3,4,2,4,3,0,3,3,3,3,3,3,2,3,3,3,4,4,4,4,4,4,4,4,4,4,4,4,3,2,4,3,3,3,3,3,4,4,4,4,4,4,2,3,2,2,3,2,2,3,3,4,3,3,2,3,3,3,3,3,1,1612.759,4,NA,12,NA,5,6,"02/27/2023 18:10",NA,NA,NA,1,"Mozilla/5.0 (Windows NT 10.0; Win64; x64; rv:109.0) Gecko/20100101 Firefox/110.0","d4d93d3dvn8zdr0e","vxhdsk5hvtq2p9ct",NA,NA,"..","/survey/selfserve/53b/g004/230146?list=1&ID=237104974331031","m5f2hjw79pyx3v48","237104974331031",894,2023-04-16 09:35:00,3,1,1,1,1,1,1,1,58,2,"",2,"",3,6,4,1,3,4,2,3,4,3,4,5,2,3,3,2,5,2,1,4,3,3,5,5,1,4,4,1,3,4,1,5,1,2,NA,NA,"",NA,"",NA,NA,NA,"",3,4,NA,NA,NA,NA,NA,NA,NA,NA,NA,"",NA,"",0,0,0,0,0,0,1,1,0,0,"","",2,NA,NA,"",2,NA,NA,NA,NA,NA,"",0,2,NA,NA,NA,"",2,3,2,"",NA,NA,NA,"","","",4,4,2,"",NA,NA,NA,"","","",4,4,2,"",NA,NA,NA,"","","",4,4,2,"",NA,NA,NA,"","","",2,1,2,"",NA,NA,NA,"","","",2,2,2,"",NA,NA,NA,"","","",3,3,1,"berufsbedingte Angebote",2,NA,1,"","","",NA,NA,2,"",NA,NA,NA,"","","",3,3,2,"",NA,NA,NA,NA,"",NA,3,3,3,"",NA,NA,NA,"",4,3,2,"",NA,NA,NA,"","","",5,5,2,"",NA,NA,NA,"","","",1,1,2,"",NA,NA,NA,"","","",1,1,2,"",NA,NA,NA,NA,"","",1,1,2,"",NA,NA,NA,NA,"","",2,2,0,0,0,0,0,0,0,0,0,1,"Gesundheitskarte",0,0,0,0,0,0,0,0,0,1,"Zuzahlung zu Fitnessprogrammen",0,0,0,0,0,0,0,0,1,0,"",1,1,NA,NA,NA,NA,2,NA,NA,NA,"",1,1,1,2,2,2,2,2,3,3,1,"Zuzahlung zu Fitnessstudio",1,1,2,1,1,1,1,4,3,3,4,3,4,2,3,3,3,3,4,4,4,4,4,3,2,2,2,3,3,3,2,2,1,1,2,2,3,3,3,3,3,3,3,3,3,3,3,3,3,3,3,4,2,3,3,3,3,4,3,3,4,3,3,2,3,3,3,3,4,3,4,3,3,3,3,1,1,2,1,4,2,4,3,3,3,2,2,3,2,3,4,3,3,3,3,4,3,3,4,3,2,2,2,3,3,2,2,3,2,3,1,3,3,2,3,3,3333.35,5,"vxhdsk5hvtq2p9ct",NA,NA,"..","/survey/selfserve/53b/g004/230372?list=1&ID=241183254224032","m5f2hjw79pyx3v48","241183254224032",26.8793166666667,55.5558333333333,1,22023,"01-02-2023",2023-02-01,3,0,3,0.03,183,2023,0,4,4,3,3.33333333333333,3,3,3,3,3,3,3,3,3,6.2,3.6,4,4,3.83333333333333,3.4,2.33333333333333,2.33333333333333,2.33333333333333,2.33333333333333,4,1,2,3,1.33333333333333,3,1.33333333333333,4,3.27272727272727,3.4,3.33333333333333,3,3.16666666666667,4,4,2.33333333333333,2.33333333333333,3,3,3,3,2.83333333333333,38.41,40.07,38.71,40.07,55.62,40.41,31.62,38.09,46.1908736,36.0741236,50.9825879,41.6141979,2.66666666666667,3,3,3,2.9,3,2.83333333333333,4,4,4,4,38.41,54.05,38.71,40.07,55.62,40.41,31.62,38.09,43.5090902,33.3923402,55.2526391,45.8842491,3,3,2,5,1,3.08333333333333,1.25,4,2.5,3.18181818181818,3.4,3,3,3.16666666666667,4,3.66666666666667,2,3,1.66666666666667,3,3,3,3.125,3,3.5,3,3.15384615384615,3,3,3.5,2,3.16666666666667,2,3.07142857142857,3,3.25,3.25,2,3,2.3,2.33333333333333,2.33333333333333,2.25,2.75,2.4,3,4,3,3,3,3,3
"75",111,"6h95nj55bz4y5j1h","02/27/2023 18:34","qualified,/Gender/X0TrF,/Age/b3xfu,/Total/Total",3,1,1,1,1,1,1,2,59,2,3,"",3,1,"",2,1,6,8.198,38,41,2,NA,NA,NA,6,"","Finanzberatrt",8,1,1,2,2,2,1,NA,59,NA,NA,NA,NA,NA,NA,NA,NA,NA,1,NA,NA,NA,NA,NA,NA,NA,NA,NA,NA,2,3,5,5,5,5,5,5,5,5,4,4,2,2,3,3,1,2,1,1,4,5,5,4,4,4,5,2,5,6,6,6,8,3,3,4,4,4,4,4,4,4,4,4,4,4,5,5,5,4,4,5,4,5,5,5,4,5,5,5,4,3,3,3,3,2,5,5,4,4,4,2,1,1,1,4,5,1,2,2,5,1,1,3,NA,NA,0,4,4,3,2,1,5,9,3,2,2,4,2,2,1,1,1,1,0,1,0,0,0,1,0,1,5,3,2,1,5,1,1,1,3,5,5,5,5,5,5,4,4,4,4,4,4,5,4,4,4,4,4,4,4,4,4,4,5,5,5,5,5,5,5,5,5,5,4,4,5,4,4,4,1,4,2,4,2,1,1074.629,14,NA,10,NA,1,2,"02/27/2023 18:16",NA,NA,NA,1,"Mozilla/5.0 (Linux; Android 11; SAMSUNG SM-A405FN) AppleWebKit/537.36 (KHTML, like Gecko) SamsungBrowser/20.0 Chrome/106.0.5249.126 Mobile Safari/537.36","ex55re3z8nx5ykph","wrpst3j4p6qj1zdu",NA,NA,"sa","/survey/selfserve/53b/g004/230146?list=1&ID=237129246469239","qd6zbbaepqkk73sc","237129246469239",597,2023-04-14 15:12:00,3,1,1,1,1,1,1,2,59,2,"",2,"",4,0,3,1,1,2,2,2,1,1,1,1,0,0,1,0,0,1,0,1,2,1,1,1,1,1,1,1,2,2,1,3,1,1,2,NA,"",NA,"",1,4,NA,"",NA,NA,1,0,0,0,0,0,0,0,0,"",2,"",0,0,0,0,0,0,1,0,0,0,"","",2,NA,NA,"",1,3,4,1,3,NA,"",3,1,2,NA,2,"",NA,NA,1,"Yoga",2,NA,3,"","Wanderung","",NA,NA,2,"",NA,NA,NA,"","","",NA,NA,2,"",NA,NA,NA,"","","",3,3,2,"",NA,NA,NA,"","","",2,2,1,"Video",2,NA,2,"","","",NA,NA,2,"",NA,NA,NA,"","","",2,2,1,"Weiterbildung",1,5,NA,"","","",NA,NA,2,"",NA,NA,NA,"","","",3,3,2,"",NA,NA,NA,NA,"",NA,3,3,2,"",NA,NA,NA,"",4,3,1,"Selbst bestimmen Stundenzahl",2,NA,2,"","","",NA,NA,2,"",NA,NA,NA,"","","",3,2,1,"Zuschuß",2,NA,2,"","","",NA,NA,2,"",NA,NA,NA,NA,"","",2,1,2,"",NA,NA,NA,NA,"","",3,3,0,0,0,0,0,1,0,1,1,0,"",1,0,0,0,0,0,0,0,0,0,"",1,0,0,0,0,0,0,0,0,0,"",1,1,NA,NA,NA,NA,1,1,4,NA,"",NA,NA,1,1,1,1,4,4,4,4,2,"",1,1,1,1,0,0,1,4,4,4,4,4,4,4,4,4,4,4,4,4,4,4,4,4,4,4,4,4,4,3,2,2,2,2,3,3,3,3,4,3,3,3,3,3,4,4,4,4,4,3,3,4,4,4,2,2,3,5,5,2,3,3,3,3,2,4,4,4,4,4,4,3,1,1,1,1,1,2,2,2,1,1,2,1,5,1,1,4,4,4,4,4,4,1,3,2,4,4,4,4,1,3,3,4,2,2,4,4,4,4,3,4,4,4,5,4,1466.97,1,"wrpst3j4p6qj1zdu",NA,NA,"sa","/survey/selfserve/53b/g004/230372?list=1&ID=241183254211788","qd6zbbaepqkk73sc","241183254211788",17.9104833333333,24.4495,0,81980,"01-08-1980",1980-08-01,513,42,9,42.09,15707,1980,43,4.33333333333333,5,5,4.33333333333333,2,3,1.5,1,4.5,4.5,4.33333333333333,4,2,6.2,3.6,4,4,3.83333333333333,4.6,4.66666666666667,4.33333333333333,5,4.66666666666667,4,1.25,2.8,4.5,1.66666666666667,4.5,1.66666666666667,2.8,4.09090909090909,4.2,4,4,4.75,4,5,5,5,4.33333333333333,5,4,4,4.16666666666667,46.43,48.33,46.92,40.07,55.62,49.47,56.79,52.42,68.9517961,58.8350461,52.427042,43.058652,0.444444444444444,1,1,3,1.5,1.5,1.5,4.66666666666667,5,4.66666666666667,4.33333333333333,46.43,54.05,53.98,53.35,55.62,49.47,56.79,52.42,66.3192809,56.2025309,62.1715994,52.8032094,0.444444444444444,5,5,5,3,2.41666666666667,2.5,2.375,4,4,4,4,4,3.91666666666667,4,4,4,3.66666666666667,2.33333333333333,3.4,4,4,4.125,3.83333333333333,5,4,3.46153846153846,3.6,3,3.75,1.28571428571429,2,1,3.35714285714286,4,2.5,4,1,4,3.5,3.33333333333333,3.33333333333333,3.75,4.25,2.8,2,5,3.33333333333333,3,3,4,3.5
"76",112,"f243036vy9un50cv","02/27/2023 18:57","qualified,/Gender/X0TrF,/Age/gcKvr,/Total/Total",3,1,1,1,1,1,1,2,38,1,5,"",5,1,"",3,2,5,9.2015,30,30,2,NA,NA,NA,5,"","Manager",7,9,1,2,4,4,2,2,32,10,8,NA,NA,NA,NA,NA,NA,NA,1,2,2,NA,NA,NA,NA,NA,NA,NA,4,1,5,5,5,5,5,5,5,5,5,5,5,5,5,2,3,2,3,1,2,5,5,5,5,5,5,5,3,8,8,7,8,4,NA,NA,NA,NA,NA,NA,NA,NA,NA,NA,NA,NA,5,4,4,4,4,5,5,4,4,5,4,4,5,4,5,5,4,4,4,5,5,5,5,5,5,5,5,5,5,5,5,5,5,4,4,4,4,5,5,1,58,42,7,4,7,7,3,5,7,2,4,4,6,4,4,5,4,3,3,2,2,3,3,3,2,4,5,5,5,4,4,4,4,4,5,4,5,4,5,4,4,5,5,5,5,5,5,5,5,5,5,5,5,5,5,5,4,5,5,5,5,5,5,5,5,5,5,4,5,5,5,5,5,4,5,5,5,5,5,5,1,1780.742,14,NA,12,NA,1,2,"02/27/2023 18:24",NA,NA,NA,1,"Mozilla/5.0 (Android 12; Mobile; rv:68.0) Gecko/68.0 Firefox/68.0","vfyhzffmcadnqy1w","shku4b5wk7y66kj5",NA,NA,"sa","/survey/selfserve/53b/g004/230146?list=1&ID=237104974336006","shku4b5wk7y66kj5","237104974336006",69,2023-04-07 14:05:00,3,1,1,1,1,1,1,2,39,2,"",2,"",5,10,1,4,4,6,1,4,4,3,0,5,3,2,0,0,4,5,3,5,5,5,5,5,5,5,5,5,5,5,5,5,2,1,1,4,"",7,"",NA,NA,NA,"",NA,NA,NA,NA,NA,NA,NA,NA,NA,NA,NA,"",NA,"",1,0,0,1,0,0,0,0,0,0,"","َ.",1,4,NA,"",1,6,3,2,NA,4,"",5,1,1,5,NA,"",NA,NA,1,".",1,5,NA,"","","",NA,NA,2,"",NA,NA,NA,"","","",NA,NA,1,".",1,5,NA,"","","",NA,NA,1,".",1,5,NA,"","","",NA,NA,1,".",1,5,NA,"","","",NA,NA,1,".",1,5,NA,"","","",NA,NA,1,".",1,5,NA,"","","",NA,NA,1,".",1,5,NA,"","","",NA,NA,1,".",1,5,NA,NA,"",NA,NA,NA,1,".",1,5,NA,"",NA,NA,1,".",1,5,NA,"","","",NA,NA,1,".",1,5,NA,"","","",NA,NA,1,".",1,5,NA,"","","",NA,NA,1,".",NA,NA,NA,NA,"","",NA,NA,1,".",1,5,NA,NA,"","",NA,NA,0,0,0,1,0,1,1,0,0,0,"",0,0,0,1,0,1,1,0,0,0,"",0,1,0,1,0,1,0,0,0,0,"",1,1,NA,NA,NA,NA,1,1,5,NA,"",NA,NA,1,1,1,1,5,5,5,5,2,"",5,3,4,2,43,31,5,5,5,5,5,4,5,5,5,5,5,5,5,5,5,5,5,5,5,5,5,5,5,5,4,4,4,4,4,4,5,5,5,5,5,5,5,5,5,5,5,5,5,5,5,5,5,5,5,5,5,5,5,5,5,5,5,5,5,5,5,5,5,5,5,5,5,5,3,4,3,3,3,5,5,5,5,5,5,3,3,5,5,5,5,5,5,5,5,5,5,5,5,5,5,5,5,5,5,5,5,5,5,5,5,5,5,5,5,5,1369.68,1,"f1q0gxbqwwah3jk5",NA,NA,"sa","/survey/selfserve/53b/g004/230372?list=1&ID=240475414780053","f1q0gxbqwwah3jk5","240475414780053",29.6790333333333,22.828,-11,92015,"01-09-2015",2015-09-01,92,7,8,7.08,2893,2015,8,5,5,5,5,5,2.5,2.5,1.5,5,5,5,5,3,7,NA,NA,NA,NA,4.2,4.44444444444444,4.66666666666667,4.33333333333333,4.33333333333333,5,5,4.6,5,4.33333333333333,5,4.33333333333333,5.6,5,5,5,5,4.83333333333333,4.66666666666667,5,5,4.66666666666667,4.83333333333333,1,1,1,3,52.83,30.31,28.32,25.45,35.81,29.53,21.4,29.25,32.6141327,22.4973827,41.2884368,31.9200468,2.77777777777778,1,2,2,3.6,3.25,3.83333333333333,4.66666666666667,4.33333333333333,4.66666666666667,5,59.45,30.31,28.32,25.45,61.83,29.53,31.62,38.09,50.2389371,40.1221871,42.6171334,33.2487434,2.44444444444444,1,1,1,1,3.66666666666667,3,4,5,4.90909090909091,4.8,5,5,5,5,5,5,5,4,5,1,1,4,3.66666666666667,5,1,4.69230769230769,4.2,5,5,3.71428571428571,5,3,5,5,5,5,5,1,4.6,5,3.66666666666667,5,5,4.4,3,6,5,5,5,5,5
"77",113,"buekuxfd98a6nch4","02/27/2023 18:47","qualified,/Gender/p47uy,/Age/b3xfu,/Total/Total",3,1,1,1,1,1,1,1,59,2,5,"",2,1,"",1,1,6,9.1983,40,45,2,NA,NA,NA,1,"","Absatzplanerin",6,7,4,1,NA,NA,NA,NA,NA,NA,NA,NA,NA,NA,NA,NA,NA,NA,NA,NA,NA,NA,NA,NA,NA,NA,NA,NA,NA,2,3,4,5,5,5,5,2,5,4,5,3,2,4,4,4,1,4,1,1,4,3,5,3,3,3,3,2,8,9,8,6,6,3,2,3,3,2,3,2,3,2,3,2,2,5,3,3,5,3,5,5,4,4,5,2,3,3,3,3,4,4,3,2,2,3,5,5,4,4,5,1,1,1,1,5,5,5,1,5,3,4,1,1,2,79,5,1,1,4,1,1,4,8,1,1,1,2,2,1,2,1,1,1,1,1,0,1,1,1,1,1,5,3,1,1,4,1,3,1,5,5,5,5,5,5,5,6,6,6,4,4,4,4,4,4,3,4,4,4,3,5,5,5,4,4,4,5,4,4,4,4,3,4,4,4,4,3,4,4,3,4,2,4,1,1,1287.258,14,NA,12,NA,1,2,"02/27/2023 18:25",NA,NA,NA,1,"Mozilla/5.0 (Android 13; Mobile; rv:109.0) Gecko/110.0 Firefox/110.0","2uvuedh37s0ryfes","6xcj1jwptavp6t17",NA,NA,"sa","/survey/selfserve/53b/g004/230146?list=1&ID=237129246478367","6xcj1jwptavp6t17","237129246478367",805,2023-04-15 09:10:00,3,1,1,1,1,1,1,1,59,2,"",2,"",4,8,2,1,1,1,2,1,2,1,3,2,0,1,0,2,3,1,1,1,1,4,1,1,1,5,1,4,2,3,1,5,1,1,2,NA,"",NA,"",1,4,NA,"",NA,NA,1,1,0,0,0,0,0,1,0,"",1,"",0,0,0,0,0,0,1,0,0,0,"","",1,1,4,"",3,NA,NA,NA,NA,NA,"",0,3,NA,NA,NA,"",4,3,1,"Mitglied in einem FitnessStudio   Präsenz Fitness Kurse",2,NA,4,"","","Ist u. Zt für mich ungünstig wegen Homeoffice",NA,NA,1,"Resilenz Kurse",2,NA,2,"","","",NA,NA,3,"",NA,NA,NA,"","","",4,3,3,"",NA,NA,NA,"","","",3,2,1,"Training durch Verantwortlichen",2,NA,2,"","","",NA,NA,3,"",NA,NA,NA,"","","",3,3,1,"Digitalisierung , Sprachen",1,5,NA,"","","",NA,NA,1,"Elektrische Schreibtische",1,3,NA,"","","",NA,NA,3,"",NA,NA,NA,NA,"",NA,3,3,3,"",NA,NA,NA,"",4,3,1,"Gleichzeitig,Möglichkeit Anpassung der Arbeitszeit, Möglichkeit 4 Tage Woche. Sabatikal ist Möglich",2,NA,2,"","","",NA,NA,3,"",NA,NA,NA,"","","",3,1,1,"Ferienptogramm für Kinder",2,NA,2,"","","",NA,NA,3,"",NA,NA,NA,NA,"","",5,3,3,"",NA,NA,NA,NA,"","",3,3,0,0,0,1,1,1,1,0,0,0,"",1,1,1,1,1,1,1,1,1,0,"",0,0,0,1,0,0,0,0,0,0,"",1,1,NA,NA,NA,NA,1,1,4,NA,"",NA,NA,1,1,1,1,4,3,3,4,2,"",5,3,4,2,85,3,3,4,4,4,4,3,4,3,4,4,3,4,5,5,5,5,5,5,4,4,5,4,4,4,3,3,2,2,3,2,3,3,3,3,3,3,3,3,2,2,2,4,3,3,3,4,3,4,2,3,4,4,3,3,4,4,2,3,2,4,4,3,4,3,3,3,4,3,4,3,2,1,3,1,3,2,3,1,3,2,1,4,4,5,4,5,3,3,3,3,3,3,4,3,3,4,3,4,3,4,4,4,4,4,3,3,4,3,4,3,1645.54,1,"6xcj1jwptavp6t17",NA,NA,"sa","/survey/selfserve/53b/g004/230372?list=1&ID=241183254225076","6xcj1jwptavp6t17","241183254225076",21.4543,27.4256666666667,-2,91983,"01-09-1983",1983-09-01,476,39,8,39.08,14581,1983,40,4,5,4,4,3,4,2.5,1,3.5,4,3,3,2,7.4,2.4,3,2,2.5,3.8,3.77777777777778,4.66666666666667,3.66666666666667,3,4.33333333333333,1,4.2,5,3.66666666666667,5,3.66666666666667,1.6,3.81818181818182,4,3.66666666666667,3.66666666666667,4.25,5,4,4.33333333333333,3.66666666666667,3.83333333333333,3,4,5,4,59.45,54.05,53.98,53.35,55.62,55.25,49.59,52.42,62.8507535,52.7340035,66.9517662,57.5833762,0.888888888888889,1,2,1,1.5,1.25,1.66666666666667,5.33333333333333,5,5.33333333333333,5.66666666666667,52.83,54.05,53.98,60.77,55.62,55.25,49.59,52.42,62.4247591,52.3080091,68.1472832,58.7788932,1.44444444444444,2,1,2,1,1.41666666666667,1,1.625,3.5,3.72727272727273,3.8,3.66666666666667,3.66666666666667,4.58333333333333,5,5,4.33333333333333,4,2.5,2.86666666666667,4,3,3.625,3.66666666666667,3.5,4,3.38461538461538,3.6,3.25,3.25,2.85714285714286,2.16666666666667,1.5,3.57142857142857,4.4,3,3.25,3,3,3.7,3.66666666666667,3.66666666666667,3.75,3.5,2.8,2,5,3,3,3,2,3.25
"78",114,"045f1g5fbewhv0vv","02/27/2023 19:12","qualified,/Gender/X0TrF,/Age/gcKvr,/Total/Total",3,1,1,1,1,1,1,2,26,1,4,"",4,1,"",1,1,4,2.2022,40,40,2,NA,NA,NA,1,"","Einkäufer",5,2,3,2,2,2,2,1,6,NA,NA,NA,NA,NA,NA,NA,NA,NA,2,NA,NA,NA,NA,NA,NA,NA,NA,NA,2,1,3,4,3,4,4,5,4,5,3,4,4,2,1,1,2,2,2,3,2,4,3,4,4,4,4,5,2,8,9,8,9,8,2,4,4,5,3,4,5,4,4,3,4,4,4,5,4,3,4,4,4,5,4,4,3,4,4,5,4,2,3,1,1,1,3,4,5,4,5,2,1,1,1,1,3,4,4,1,2,4,4,1,1,2,31,0,6,1,2,2,2,4,9,1,1,1,1,2,1,1,1,1,1,3,2,1,0,1,0,1,1,5,2,2,1,5,3,1,2,3,4,5,4,4,5,5,5,4,5,4,4,4,4,5,3,3,4,3,3,4,4,4,5,4,4,5,3,4,4,4,4,3,4,5,4,5,5,4,4,1,4,1,5,1,1,2424.703,4,NA,10,NA,5,6,"02/27/2023 18:30",NA,NA,NA,1,"Mozilla/5.0 (Windows NT 10.0; Win64; x64) AppleWebKit/537.36 (KHTML, like Gecko) Chrome/110.0.0.0 Safari/537.36","790ty8ajeaq6h1dx","1xj1k4qy1d8b9h8e",NA,NA,"..","/survey/selfserve/53b/g004/230146?list=1&ID=237104974324775","9r48k8n7shkwc1xv","237104974324775",642,2023-04-14 16:40:00,3,1,1,1,1,1,1,2,27,2,"",2,"",4,9,1,1,1,1,2,1,2,1,1,2,3,3,2,0,0,1,0,2,1,5,3,2,1,2,2,4,2,1,2,3,1,2,NA,NA,"",NA,"",NA,NA,NA,"",2,3,NA,NA,NA,NA,NA,NA,NA,NA,NA,"",NA,"",1,0,0,0,0,0,1,0,0,0,"","",1,3,NA,"",2,NA,NA,NA,NA,NA,"",1,2,NA,NA,NA,"",3,2,1,"Job Rad",2,NA,2,"","","",NA,NA,2,"",NA,NA,NA,"","","",NA,NA,1,"Obst wird angeboten",1,5,NA,"","","",NA,NA,2,"",NA,NA,NA,"","","",2,2,1,"Vortrag Sicherheitsbeauftragter",1,4,NA,"","","",NA,NA,1,"Gemeinsam essen gehen",1,5,NA,"","","",NA,NA,1,"Englischkurs",1,5,NA,"","","",NA,NA,1,"Stehschreibtisch",2,NA,2,"","","",NA,NA,2,"",NA,NA,NA,NA,"",NA,2,2,1,"Manager",2,NA,1,"",NA,NA,1,"Gleitzeit",2,NA,1,"","","",NA,NA,1,"Elternzeit",2,NA,2,"","","",NA,NA,2,"",NA,NA,NA,"","","",2,2,2,"",NA,NA,NA,NA,"","",2,2,2,"",NA,NA,NA,NA,"","",1,1,0,0,0,0,0,0,0,0,1,0,"",0,0,0,1,0,0,0,0,1,0,"",0,0,0,1,0,0,0,0,1,0,"",1,1,NA,NA,NA,NA,1,1,3,NA,"",NA,NA,2,NA,2,2,3,3,3,2,2,"",3,1,3,2,40,0,2,4,4,4,4,5,4,2,4,3,4,4,4,4,5,4,5,5,5,4,4,4,5,4,3,3,4,3,3,3,5,4,4,3,4,4,2,3,3,4,5,3,4,4,3,5,4,4,2,1,4,4,4,4,5,4,3,4,2,4,5,3,4,4,5,4,1,2,2,2,1,2,2,1,1,1,1,2,1,2,2,4,4,3,5,4,3,1,2,2,2,3,4,4,2,3,2,3,2,4,4,4,5,4,4,5,4,4,5,4,2587.91,5,"1xj1k4qy1d8b9h8e",NA,NA,"..","/survey/selfserve/53b/g004/230372?list=1&ID=241183254214904","9r48k8n7shkwc1xv","241183254214904",40.4117166666667,43.1318333333333,0,22022,"01-02-2022",2022-02-01,15,1,3,1.03,548,2022,1,3.33333333333333,4,4.66666666666667,3.66666666666667,1.5,1.5,2,2.5,3.5,4,4.33333333333333,4,2,8.4,3.6,4.25,3.66666666666667,3.83333333333333,4,4.11111111111111,4.33333333333333,3.66666666666667,4.33333333333333,3.66666666666667,1,2.8,3.5,2.33333333333333,3.5,2.33333333333333,2.6,3.72727272727273,4.2,3.33333333333333,3.33333333333333,4,4.33333333333333,4.33333333333333,3.66666666666667,3.66666666666667,4.5,5,5,5,4.66666666666667,59.45,54.05,53.98,60.77,55.62,55.25,56.79,52.42,67.8370701,57.7203201,67.3689146,58.0005246,1.11111111111111,1,1,3,1.7,1.75,1.66666666666667,4.55555555555556,4.66666666666667,4.33333333333333,4.66666666666667,59.45,54.05,53.98,60.77,55.62,55.25,49.59,52.42,62.6647341,52.5479841,69.4717466,60.1033566,1.33333333333333,1,4,2,3,2,2.5,1.75,2.75,3.81818181818182,4.2,3.33333333333333,3.66666666666667,4.41666666666667,4.33333333333333,4.66666666666667,4.33333333333333,4.33333333333333,3.16666666666667,3.66666666666667,4,5,4.25,4.33333333333333,4,4,4.07692307692308,4,4,4.25,1.71428571428571,1.16666666666667,2,3.07142857142857,4,2,3.25,2,4,3.7,2.66666666666667,4,4.25,4.5,1.8,2,5,4.33333333333333,3.5,3,4,3.5
"79",115,"c470f3x47mgt8h4c","02/27/2023 18:53","qualified,/Gender/p47uy,/Age/gcKvr,/Total/Total",3,1,1,1,1,1,1,1,52,1,3,"",4,1,"",4,1,3,9.2021,20,28,2,NA,NA,NA,11,"","Buchhaltung",3,9,6,1,NA,NA,NA,NA,NA,NA,NA,NA,NA,NA,NA,NA,NA,NA,NA,NA,NA,NA,NA,NA,NA,NA,NA,NA,NA,2,4,5,5,5,5,3,5,3,5,2,2,1,1,1,3,2,2,1,1,3,5,2,2,2,3,2,1,3,4,1,4,10,3,2,5,3,2,3,3,1,2,3,3,3,5,3,4,1,5,4,5,5,4,5,5,5,4,5,4,3,2,3,2,1,1,4,3,4,5,3,2,1,1,2,5,5,1,1,1,4,1,1,1,NA,NA,71,2,1,1,1,1,5,5,3,2,2,2,3,4,4,2,0,0,0,4,0,0,0,4,0,3,5,5,1,4,4,2,5,3,2,5,5,6,6,6,6,6,6,6,5,5,5,5,5,5,5,5,3,4,5,5,5,5,5,5,5,5,5,5,5,5,5,5,5,5,5,5,5,1,1,1,5,5,1,1,1318.218,4,NA,10,NA,5,6,"02/27/2023 18:30",NA,NA,NA,1,"Mozilla/5.0 (Windows NT 10.0; Win64; x64) AppleWebKit/537.36 (KHTML, like Gecko) Chrome/110.0.0.0 Safari/537.36","bnk292hyn9ar64p9","zch4gja7tkxc1u1q",NA,NA,"..","/survey/selfserve/53b/g004/230146?list=1&ID=237104974324787","bjvgqugcf1h8n936","237104974324787",23,2023-04-06 18:10:00,3,1,1,1,1,1,1,1,52,2,"",2,"",5,5,3,2,3,2,3,3,2,2,0,1,1,5,1,0,0,5,0,5,4,5,5,1,3,1,1,5,5,5,1,5,1,2,NA,NA,"",NA,"",NA,NA,NA,"",1,1,NA,NA,NA,NA,NA,NA,NA,NA,NA,"",NA,"",1,0,0,0,0,0,0,0,0,0,"","",2,NA,NA,"",2,NA,NA,NA,NA,NA,"",0,2,NA,NA,NA,"",1,1,2,"",NA,NA,NA,"","","",5,5,2,"",NA,NA,NA,"","","",5,5,2,"",NA,NA,NA,"","","",1,1,2,"",NA,NA,NA,"","","",5,1,2,"",NA,NA,NA,"","","",5,5,2,"",NA,NA,NA,"","","",5,5,2,"",NA,NA,NA,"","","",5,5,2,"",NA,NA,NA,"","","",5,5,2,"",NA,NA,NA,NA,"",NA,5,5,2,"",NA,NA,NA,"",5,5,1,"jeder kann dann arbeiten, wann es ihm passt",1,5,NA,"","","",NA,NA,2,"",NA,NA,NA,"","","",1,1,2,"",NA,NA,NA,"","","",1,1,2,"",NA,NA,NA,NA,"","",1,1,2,"",NA,NA,NA,NA,"","",1,1,0,0,0,0,0,0,0,0,0,1,"keine",0,0,0,0,0,0,0,1,1,0,"",0,0,0,0,0,0,0,1,1,0,"",2,3,2,NA,5,5,2,NA,NA,NA,"",1,5,2,NA,2,2,5,1,3,3,1,"ergonomische Arbeitsmittel",1,1,5,1,0,88,1,5,5,5,5,5,5,5,5,5,5,5,5,5,5,5,5,5,5,5,5,5,5,5,2,1,1,3,2,1,1,1,1,1,1,4,1,1,1,1,4,1,1,4,1,5,2,5,3,2,5,5,5,3,1,5,3,5,1,1,5,5,5,5,5,5,3,5,2,1,1,1,5,1,1,3,1,1,1,1,1,4,1,5,4,1,1,5,1,1,3,1,3,1,1,1,1,1,1,1,1,1,1,3,1,2,5,1,3,1,1806.27,5,"zch4gja7tkxc1u1q",NA,NA,"..","/survey/selfserve/53b/g004/230372?list=1&ID=240475414779011","bjvgqugcf1h8n936","240475414779011",21.9703,30.1045,17,92021,"01-09-2021",2021-09-01,20,1,8,1.08,701,2021,2,4.66666666666667,5,3.66666666666667,3,1,2,2,1,4,2,2.33333333333333,2.5,1,4.4,2.6,3,2.66666666666667,2.75,3.6,4.66666666666667,4.66666666666667,4.66666666666667,4.66666666666667,4,1.5,2.6,5,1,5,1,1.2,4.72727272727273,5,5,4,5,5,5,5,5,5,5,1,5,3,46.43,48.33,46.92,53.35,45.16,29.53,31.62,45.66,41.0330797,30.9163297,62.7251808,53.3567908,0.888888888888889,1,2,4,3,3.25,2.83333333333333,5.77777777777778,5.33333333333333,6,6,46.43,48.33,38.71,53.35,45.16,40.41,49.59,45.66,57.6592769,47.5425269,53.5578595,44.1894695,1.44444444444444,1,5,1,1,2.75,2.5,2.875,3,5,5,5,5,5,5,5,5,5,1.66666666666667,1.6,3,4,4.25,4,5,5,4.07692307692308,3.8,3.5,5,2.57142857142857,1.33333333333333,1,2.28571428571429,3,2,2,1,5,1.6,1,2.33333333333333,1.5,2.75,1.8,1,5,1,1,2,2,1.75
"80",116,"5qmbm1egrkypq8ht","02/27/2023 19:08","qualified,/Gender/p47uy,/Age/gcKvr,/Total/Total",3,1,1,1,1,1,1,1,43,1,5,"",6,1,"",2,1,4,7.2017,40,42,2,NA,NA,NA,11,"","Managenent",6,1,3,1,NA,NA,NA,NA,NA,NA,NA,NA,NA,NA,NA,NA,NA,NA,NA,NA,NA,NA,NA,NA,NA,NA,NA,NA,NA,2,4,4,5,4,4,3,3,4,4,4,4,4,3,3,3,2,3,1,1,4,4,2,2,3,3,2,2,7,5,5,5,8,3,3,3,4,3,3,3,3,3,3,3,3,3,4,3,2,4,5,5,5,4,4,5,5,4,5,4,4,4,4,3,1,4,5,4,4,5,4,1,1,1,1,4,4,4,3,2,4,3,1,1,2,15,0,5,1,1,1,4,3,3,4,2,2,4,4,3,2,3,2,4,4,1,3,1,0,0,1,3,3,2,2,2,4,3,5,1,4,2,2,2,1,2,2,2,1,1,2,2,3,3,3,2,3,2,3,3,3,2,3,2,3,3,4,3,3,3,4,4,3,2,3,3,3,3,2,2,4,3,3,3,3,1,785.955,12,NA,11,NA,1,1,"02/27/2023 18:54",NA,NA,NA,1,"Mozilla/5.0 (iPhone; CPU iPhone OS 16_1_1 like Mac OS X) AppleWebKit/605.1.15 (KHTML, like Gecko) Version/16.1 Mobile/15E148 Safari/604.1","a2nb8dvn4gghvxaq","v71vtcwu2ru84a4d",NA,NA,"si","/survey/selfserve/53b/g004/230146?list=1&ID=237129246465077","v71vtcwu2ru84a4d","237129246465077",1028,2023-04-18 07:41:00,3,1,1,1,1,1,1,1,43,2,"",2,"",3,6,4,2,2,3,3,1,2,1,1,2,2,1,1,1,0,0,1,3,1,5,2,2,1,5,3,3,5,4,1,4,1,1,1,6,"Assistenz der Geschäftsführung - zuständig für u.a. Arbeitsmed. Vorsorge.",3,"",NA,NA,NA,"",NA,NA,NA,NA,NA,NA,NA,NA,NA,NA,NA,"",NA,"",0,0,0,0,0,0,1,0,0,0,"","",1,4,NA,"",1,6,1,1,2,NA,"",1,2,NA,NA,NA,"",1,2,2,"",NA,NA,NA,"","","",4,4,2,"",NA,NA,NA,"","","",3,3,2,"",NA,NA,NA,"","","",3,5,2,"",NA,NA,NA,"","","",1,1,1,"Unterweisungen, Begehungen mit Beratungen zur Ergonomie am Arbeitsplatz",1,3,NA,"","","",NA,NA,2,"",NA,NA,NA,"","","",3,3,1,"Fachliche Angebote",2,NA,4,"","","-",NA,NA,2,"",NA,NA,NA,"","","",4,4,2,"",NA,NA,NA,NA,"",NA,2,2,3,"",NA,NA,NA,"",2,2,1,"Teilzeitmodelle, remote Arbeit",1,4,NA,"","","",NA,NA,2,"",NA,NA,NA,"","","",1,1,2,"",NA,NA,NA,"","","",1,1,2,"",NA,NA,NA,NA,"","",1,1,2,"",NA,NA,NA,NA,"","",2,2,0,0,0,1,0,0,0,0,0,0,"",0,0,0,0,0,1,0,0,0,0,"",0,0,0,0,0,0,0,0,0,1,"Keine",1,1,NA,NA,NA,NA,1,1,4,NA,"",NA,NA,1,1,1,1,3,3,3,2,1,"Sportangebote",5,1,3,2,20,0,3,4,4,3,4,4,3,3,3,3,4,4,4,4,4,3,3,3,5,5,5,5,5,5,2,2,2,2,2,2,3,4,3,3,4,5,5,3,3,4,4,3,4,4,4,4,3,3,4,4,3,3,2,3,3,5,3,3,4,3,3,3,3,4,4,5,2,3,3,2,2,3,3,1,1,1,1,1,1,3,3,4,4,3,3,4,5,1,4,2,4,4,4,4,1,3,3,1,2,2,2,2,2,2,2,3,4,3,4,3,1245.3,1,"ut2phx7kqwnw14w9",NA,NA,"si","/survey/selfserve/53b/g004/230372?list=1&ID=241183254200345","ut2phx7kqwnw14w9","241183254200345",13.09925,20.755,0,72017,"01-07-2017",2017-07-01,70,5,10,5.1,2224,2017,6,4.33333333333333,4,3.33333333333333,4,3.5,3,2.5,1,4,2,2.66666666666667,3,2,6,3,3.25,3,3.08333333333333,3.2,4.66666666666667,5,4.33333333333333,4.66666666666667,4.33333333333333,1,3.4,4,3,4,3,2.4,2.63636363636364,2.6,2.33333333333333,3,3.08333333333333,2.33333333333333,3.33333333333333,3,3.66666666666667,2.66666666666667,2,3,3,2.66666666666667,38.41,48.33,46.92,40.07,35.81,40.41,49.59,38.09,51.0265115,40.9097615,50.2713112,40.9029212,1.77777777777778,3,2,2,2.5,1.75,3,1.66666666666667,2,1.66666666666667,1.33333333333333,38.41,48.33,46.92,47.67,45.16,55.25,49.59,52.42,61.8419213,51.7251713,54.5010496,45.1326596,1,1,1,3,2,2.16666666666667,1.25,2.625,2.75,3.54545454545455,3.8,3,3.66666666666667,4.25,4,3,5,5,2,3.73333333333333,2,2,2.75,2.83333333333333,2.5,2,3.38461538461538,2.8,3.5,4,2.57142857142857,1,3,3.35714285714286,3.6,3,4,1,4,2.3,2.33333333333333,2.66666666666667,2,3.5,3.2,2,5,3.33333333333333,3.5,4.33333333333333,3.66666666666667,3.75
"81",117,"8nrzg3625wmft49q","02/27/2023 19:09","qualified,/Gender/p47uy,/Age/gcKvr,/Total/Total",3,1,1,1,1,1,1,1,36,1,4,"",5,1,"",1,1,6,8.2022,39,40,2,NA,NA,NA,8,"","Fördermittelvergabe",5,13,4,1,NA,NA,NA,NA,NA,NA,NA,NA,NA,NA,NA,NA,NA,NA,NA,NA,NA,NA,NA,NA,NA,NA,NA,NA,NA,1,4,4,4,3,4,4,4,4,3,4,4,4,3,3,4,4,4,4,4,4,4,4,3,4,4,4,1,7,3,2,5,4,3,3,4,3,3,3,2,3,3,4,3,3,4,3,4,2,3,4,3,4,3,4,4,4,4,4,3,3,3,2,3,2,3,4,4,4,4,4,4,4,4,4,3,4,2,2,2,5,1,1,1,NA,NA,0,3,2,2,2,2,4,8,2,1,2,1,2,1,2,1,0,1,1,1,1,0,0,1,0,2,2,2,2,2,2,2,3,3,2,3,3,3,2,2,3,3,3,3,4,4,3,4,4,4,4,4,3,4,4,4,4,4,4,4,4,4,4,4,3,4,3,4,4,4,4,4,4,4,2,4,2,4,2,1,636.878,4,NA,10,NA,5,6,"02/27/2023 18:58",NA,NA,NA,1,"Mozilla/5.0 (Windows NT 10.0; Win64; x64) AppleWebKit/537.36 (KHTML, like Gecko) Chrome/110.0.0.0 Safari/537.36 Edg/110.0.1587.57","bt7yjczgt531vzc4","230q765gre5s15cw",NA,NA,"..","/survey/selfserve/53b/g004/230146?list=1&ID=237104974312689","230q765gre5s15cw","237104974312689",722,2023-04-14 18:41:00,3,1,1,1,1,1,1,1,36,2,"",2,"",4,7,3,1,1,1,3,1,2,2,3,3,4,3,3,2,2,3,2,2,2,2,2,2,2,2,2,2,2,3,2,2,1,2,NA,NA,"",NA,"",NA,NA,NA,"",4,2,NA,NA,NA,NA,NA,NA,NA,NA,NA,"",NA,"",0,0,0,0,0,0,1,0,0,0,"","",2,NA,NA,"",2,NA,NA,NA,NA,NA,"",3,2,NA,NA,NA,"",2,2,2,"",NA,NA,NA,"","","",4,4,2,"",NA,NA,NA,"","","",2,2,2,"",NA,NA,NA,"","","",4,4,2,"",NA,NA,NA,"","","",2,2,2,"",NA,NA,NA,"","","",2,2,2,"",NA,NA,NA,"","","",2,2,1,"Je nach stelle",1,4,NA,"","","",NA,NA,2,"",NA,NA,NA,"","","",2,2,2,"",NA,NA,NA,NA,"",NA,2,2,2,"",NA,NA,NA,"",2,2,1,"Gleitzeit",1,5,NA,"","","",NA,NA,2,"",NA,NA,NA,"","","",2,2,2,"",NA,NA,NA,"","","",2,2,2,"",NA,NA,NA,NA,"","",2,2,2,"",NA,NA,NA,NA,"","",2,2,0,0,0,1,0,0,0,0,0,0,"",0,0,0,0,0,0,0,0,0,1,"Keine",1,0,0,0,0,0,0,0,0,0,"",2,1,NA,NA,NA,NA,3,NA,NA,NA,"",2,2,3,NA,2,2,3,4,3,3,2,"",3,1,3,2,27,0,1,4,3,4,3,4,4,3,4,4,3,3,4,4,4,4,4,4,4,3,4,4,4,4,2,2,2,2,2,2,2,2,2,2,2,3,2,2,3,2,3,3,3,3,3,3,3,4,3,4,4,4,4,3,3,3,3,3,4,3,4,4,3,4,4,3,2,2,3,3,2,2,2,1,1,2,2,1,1,1,1,4,4,4,4,4,3,4,3,4,3,4,4,4,4,3,3,2,3,2,3,2,3,2,2,4,4,4,4,2,691.81,5,"230q765gre5s15cw",NA,NA,"..","/survey/selfserve/53b/g004/230372?list=1&ID=241183254208643","230q765gre5s15cw","241183254208643",10.6146333333333,11.5301666666667,0,82022,"01-08-2022",2022-08-01,9,0,9,0.09,367,2022,1,4,3.5,4,3.66666666666667,3.5,3.5,4,4,4,3.5,4,4,1,4.2,3,3.25,3,3.08333333333333,3.2,3.77777777777778,3.66666666666667,3.66666666666667,4,4,4,2.6,3.5,2,3.5,2,2.2,3.81818181818182,3.8,4,3.66666666666667,3.83333333333333,4,4,4,3.33333333333333,4,4,4,4,4,52.83,54.05,46.92,60.77,55.62,55.25,49.59,52.42,63.6270771,53.5103271,64.6599962,55.2916062,0.555555555555556,4,4,4,2.8,3.25,2.5,2.77777777777778,2.66666666666667,2.66666666666667,3,46.43,54.05,53.98,60.77,45.16,55.25,49.59,45.66,56.9382097,46.8214597,65.5535184,56.1851284,2.77777777777778,4,4,4,4,2.75,3,2.625,3.25,3.54545454545455,3.6,3.66666666666667,3.33333333333333,3.91666666666667,4,4,3.66666666666667,4,2,2.46666666666667,3,2,3.375,3.16666666666667,4,2,3.23076923076923,3.2,3,3.5,2.28571428571429,1.33333333333333,1,3.78571428571429,4,3.5,3.75,4,3,2.5,2.66666666666667,2.66666666666667,2.25,4,2.6,1,3,2,2,2.33333333333333,2.66666666666667,3
"82",119,"u4m2yp6u4b00881u","02/27/2023 19:20","qualified,/Gender/X0TrF,/Age/b3xfu,/Total/Total",3,1,1,1,1,1,1,2,62,2,5,"",6,1,"",2,1,4,4.1989,37,40,2,NA,NA,NA,4,"","Frachtcontroller",5,7,1,2,3,3,1,NA,56,24,NA,NA,NA,NA,NA,NA,NA,NA,1,2,NA,NA,NA,NA,NA,NA,NA,NA,NA,2,2,3,3,4,2,3,2,4,4,4,3,2,1,2,2,3,3,2,2,2,2,3,2,2,2,2,1,4,1,1,2,3,1,2,3,3,1,3,2,2,1,1,1,1,4,4,2,1,2,3,4,3,3,3,3,3,3,4,5,2,2,2,1,1,4,4,4,3,4,3,1,1,1,1,3,3,4,2,3,4,4,1,2,2,50,0,2,3,1,6,1,4,9,2,1,1,2,2,1,1,1,0,0,0,1,0,1,0,0,0,1,5,2,1,1,4,1,1,1,2,5,5,4,3,5,4,3,3,3,4,4,5,5,5,5,4,3,4,4,4,3,3,3,4,4,4,4,4,3,3,3,3,4,4,5,5,3,4,4,2,4,3,4,1,1,1007.459,4,NA,12,NA,5,6,"02/27/2023 19:03",NA,NA,NA,1,"Mozilla/5.0 (Windows NT 10.0; Win64; x64; rv:109.0) Gecko/20100101 Firefox/110.0","59m3dfrg690tpc58","3eu70hg72unxdpdc",NA,NA,"..","/survey/selfserve/53b/g004/230146?list=1&ID=237111539460328","be9f8g9c3sug4ya1","237111539460328",388,2023-04-14 09:41:00,3,1,1,1,1,1,1,2,62,2,"",2,"",3,7,2,1,1,2,2,1,2,1,1,0,1,0,0,1,0,0,0,2,1,4,2,1,1,4,1,4,1,1,1,2,1,1,2,NA,"",NA,"",2,NA,3,"",NA,NA,0,0,0,0,0,0,1,0,0,"",2,"",0,0,0,0,0,0,1,0,0,0,"","",1,3,NA,"",2,NA,NA,NA,NA,NA,"",2,3,NA,NA,NA,"",3,4,1,"Rabatt Aktion für Fitnessclub,  gelegentliche Gesundheitsinfos allgemeiner Art von der Personalabteilung",2,NA,4,"","","klare Struktur (Inhalt, Zeit) ohne das man den Eindruck hat, dass die Angebote quasi nur eine 'Alibi'-Funktion haben, damit 'etwas' gemacht wird",NA,NA,1,"Resilienzvorträge einer Krankenkasse (Organisation über Personalabteilung)",2,NA,2,"","","",NA,NA,2,"",NA,NA,NA,"","","",2,2,2,"",NA,NA,NA,"","","",2,1,1,"Vorträge des Vorgesetzten (jährlich) und BG (alle 2 Jahre)",1,3,NA,"","","",NA,NA,1,"gemeinsame Aktionstage, die jedoch durch die Pandemie 'einschliefen' und bereits seit drei Jahren nicht mehr organisiert werden",1,4,NA,"","","",NA,NA,1,"alle relevanten Themen (technischer, kaufmännischer und administrativer Natur), die die einzelnen Sektoren des Unternehmens betreffen, werden mittels Kursen (meistens online) als Weiterbildung angeboten",1,5,NA,"","","",NA,NA,1,"jährliche Begehungen von BR, Geschäftsleitung und BG",1,3,NA,"","","",NA,NA,2,"",NA,NA,NA,NA,"",NA,3,3,3,"",NA,NA,NA,"",4,4,1,"Flexoffice und home office, Präsenzphasen im Büro können teilweise selbst bestimmt werden",1,4,NA,"","","",NA,NA,2,"",NA,NA,NA,"","","",4,2,2,"",NA,NA,NA,"","","",4,1,2,"",NA,NA,NA,NA,"","",5,1,2,"",NA,NA,NA,NA,"","",5,2,0,0,0,1,0,0,0,1,0,0,"",0,0,0,0,1,1,0,0,0,0,"",0,0,0,0,0,0,0,0,1,0,"",1,1,NA,NA,NA,NA,1,1,4,NA,"",NA,NA,1,1,1,1,4,4,5,2,2,"",3,1,4,2,50,0,4,4,4,4,4,3,4,4,4,3,4,4,3,3,3,5,5,5,4,4,4,4,4,3,3,3,2,2,3,3,4,4,3,3,3,4,3,3,4,4,3,4,3,4,3,5,4,4,2,2,5,5,5,4,5,5,3,4,2,4,4,4,5,5,4,4,4,2,2,1,1,1,1,2,2,3,2,2,1,1,2,3,3,3,3,4,2,2,2,2,1,1,3,1,2,4,3,4,2,4,4,3,3,3,3,3,5,4,4,3,1706.34,5,"08s3js73u1tusjj9",NA,NA,"..","/survey/selfserve/53b/g004/230372?list=1&ID=241166931206203","08s3js73u1tusjj9","241166931206203",16.7909833333333,28.439,0,41989,"01-04-1989",1989-04-01,409,34,1,34.01,12542,1989,34,2.66666666666667,3,3,3.66666666666667,1.5,2,3,2,2,2.5,2,2,1,2.2,1.4,2.75,1,1.75,2.6,3.22222222222222,3.33333333333333,3,3.33333333333333,3.33333333333333,1,3,3,3,3,3,2.6,4.27272727272727,4.6,4,4,3.41666666666667,3,4,3.66666666666667,3,4.16666666666667,4,3,5,4,52.83,54.05,53.98,53.35,55.62,55.25,56.79,52.42,67.7831145,57.6663645,63.5244708,54.1560808,0.222222222222222,1,2,4,1.5,2,1.16666666666667,3.88888888888889,5,3.33333333333333,3.33333333333333,52.83,54.05,53.98,53.35,55.62,55.25,49.59,52.42,62.6107785,52.4940285,65.6273028,56.2589128,0.333333333333333,2,2,2,4,1.58333333333333,2,1.375,3.75,3.81818181818182,3.8,4,3.66666666666667,3.91666666666667,3,5,4,3.66666666666667,2.66666666666667,3.46666666666667,4,4,4.5,4.33333333333333,5,4,4.23076923076923,4,4.25,4.5,1.71428571428571,2,1.5,2.28571428571429,3.2,2,1.5,2,4,3.5,3.66666666666667,4,3,4,2,1,3,3.66666666666667,3,3.33333333333333,3.66666666666667,3.5
"83",120,"bs5zbpv1tyhcv5ax","02/27/2023 19:23","qualified,/Gender/X0TrF,/Age/gcKvr,/Total/Total",3,1,1,1,1,1,1,2,42,1,3,"",2,2,"",1,2,2,6.201,35,35,2,NA,NA,NA,11,"","Kraftfahrer",3,9,4,1,NA,NA,NA,NA,NA,NA,NA,NA,NA,NA,NA,NA,NA,NA,NA,NA,NA,NA,NA,NA,NA,NA,NA,NA,NA,2,1,5,2,2,1,2,2,3,2,2,2,2,3,3,1,3,3,3,3,2,2,3,2,3,3,3,1,5,1,4,2,4,NA,NA,NA,NA,NA,NA,NA,NA,NA,NA,NA,NA,3,2,3,3,1,3,2,3,3,2,2,3,1,3,5,3,2,3,1,1,1,5,5,1,1,1,1,1,1,1,1,1,1,1,1,1,1,1,5,NA,NA,0,4,3,2,4,5,4,6,3,2,2,1,2,2,1,1,1,1,0,2,1,1,0,1,0,3,2,3,2,2,2,3,2,1,2,2,3,3,3,2,3,4,4,3,4,4,4,5,3,4,4,4,4,3,5,4,3,4,4,5,5,3,3,3,4,2,2,4,3,4,4,5,5,4,3,4,2,4,2,1,967.923,3,NA,12,NA,5,6,"02/27/2023 19:06",NA,NA,NA,1,"Mozilla/5.0 (Windows NT 6.3; Win64; x64; rv:109.0) Gecko/20100101 Firefox/110.0","ykrpnjj1c896hadn","5fztn6mq62jscc1d",NA,NA,"..","/survey/selfserve/53b/g004/230146?list=1&ID=237104974332083","5fztn6mq62jscc1d","237104974332083",636,2023-04-14 16:17:00,3,1,1,1,1,1,1,2,42,2,"",2,"",5,9,1,1,1,1,1,1,1,1,1,1,0,0,1,1,1,0,0,3,2,5,1,1,1,3,2,5,2,2,2,3,1,2,NA,NA,"",NA,"",NA,NA,NA,"",1,1,NA,NA,NA,NA,NA,NA,NA,NA,NA,"",NA,"",0,0,0,0,0,0,1,0,0,0,"","",2,NA,NA,"",2,NA,NA,NA,NA,NA,"",0,2,NA,NA,NA,"",1,1,2,"",NA,NA,NA,"","","",1,1,2,"",NA,NA,NA,"","","",1,1,2,"",NA,NA,NA,"","","",1,1,2,"",NA,NA,NA,"","","",1,1,1,"sicherheitslehrgänge",1,5,NA,"","","",NA,NA,2,"",NA,NA,NA,"","","",1,1,3,"",NA,NA,NA,"","","",3,3,2,"",NA,NA,NA,"","","",1,1,2,"",NA,NA,NA,NA,"",NA,1,1,1,"service",2,NA,2,"",NA,NA,2,"",NA,NA,NA,"","","",1,1,2,"",NA,NA,NA,"","","",1,1,3,"",NA,NA,NA,"","","",3,3,3,"",NA,NA,NA,NA,"","",4,4,2,"",NA,NA,NA,NA,"","",1,1,0,0,0,1,0,0,0,0,0,0,"",0,1,0,0,0,0,0,0,0,0,"",0,0,0,1,0,0,0,0,0,0,"",3,1,NA,NA,NA,NA,2,NA,NA,NA,"",3,3,3,NA,3,3,3,3,3,2,2,"",1,1,1,1,0,0,1,5,5,5,5,4,5,4,4,4,4,5,5,5,4,5,5,5,5,5,5,4,5,4,4,4,3,3,3,3,4,3,4,3,3,4,3,4,4,3,3,4,3,4,4,5,5,5,1,1,5,5,5,3,3,5,3,4,2,4,4,5,5,5,4,4,2,1,1,1,1,1,1,1,1,2,1,1,1,1,1,5,5,5,5,4,4,1,4,2,4,3,3,4,2,4,4,3,3,4,4,5,4,4,4,4,5,4,4,4,1681,5,"5fztn6mq62jscc1d",NA,NA,"..","/survey/selfserve/53b/g004/230372?list=1&ID=241166931207244","5fztn6mq62jscc1d","241166931207244",16.13205,28.0166666666667,0,62010,"01-06-2010",2010-06-01,155,12,11,12.11,4811,2010,13,2.66666666666667,1.5,2.33333333333333,2,2.5,2,3,3,2,2.5,3,3,1,3.2,NA,NA,NA,NA,2.4,2.44444444444444,2.66666666666667,2.33333333333333,2.33333333333333,1,1,1,1,1,1,1,3.6,4,4,4,4,3.5,3.66666666666667,4.66666666666667,3,2.66666666666667,4.16666666666667,3,4,4,3.83333333333333,46.43,48.33,46.92,60.77,55.62,49.47,56.79,52.42,68.4328471,58.3160971,59.457176,50.088786,0.777777777777778,4,4,4,2.8,2.75,2.83333333333333,3,2.33333333333333,3.33333333333333,3.33333333333333,59.45,54.05,53.98,60.77,61.83,55.25,56.79,52.42,69.432978,59.316228,68.008793,58.640403,0.555555555555556,1,3,1,3,1.75,2.25,1.5,2.75,4.54545454545455,4.8,4.33333333333333,4.33333333333333,4.75,4.66666666666667,5,5,4.33333333333333,3.33333333333333,3.53333333333333,5,5,5,5,5,4,4.07692307692308,4,3.75,4.5,1.14285714285714,1.16666666666667,1,3.64285714285714,4.8,2.75,3.5,2,3,3.9,3.66666666666667,3.66666666666667,4.25,4.25,1.6,1,1,3.66666666666667,3,3.66666666666667,3.33333333333333,3.75
"84",122,"tbz58vbdsybj3szb","02/27/2023 19:45","qualified,/Gender/p47uy,/Age/gcKvr,/Total/Total",3,1,1,1,1,1,1,1,33,1,4,"",3,1,"",2,1,4,7.2013,40,40,2,NA,NA,NA,1,"","Industriekauffrau",7,10,1,2,4,4,2,2,40,9,7,NA,NA,NA,NA,NA,NA,NA,1,2,2,NA,NA,NA,NA,NA,NA,NA,5,2,3,5,3,4,5,5,5,5,5,2,3,1,3,3,3,1,2,1,1,5,5,4,4,2,4,3,2,6,6,6,8,7,4,5,5,5,5,5,5,5,4,4,5,5,5,4,4,3,3,3,4,4,3,4,4,5,5,5,4,3,3,1,1,1,3,5,5,4,3,5,1,1,1,1,2,5,2,3,2,4,4,1,1,2,40,0,1,2,1,1,1,5,10,1,1,1,1,2,1,1,1,1,1,0,0,0,0,0,0,0,2,4,2,1,2,4,1,2,1,3,5,5,6,6,5,6,6,6,5,4,5,4,5,3,4,5,5,5,3,4,5,5,5,5,5,5,4,5,4,4,4,5,4,5,5,5,5,5,4,1,5,1,4,1,1,1303.219,14,NA,10,NA,1,2,"02/27/2023 19:23",NA,NA,NA,1,"Mozilla/5.0 (Linux; Android 13; SM-A515F) AppleWebKit/537.36 (KHTML, like Gecko) Chrome/110.0.0.0 Mobile Safari/537.36","xpan2jnx99xu7a8y","8ruxp3bnc3yez2tb",NA,NA,"sa","/survey/selfserve/53b/g004/230146?list=1&ID=237104974328951","8ruxp3bnc3yez2tb","237104974328951",404,2023-04-14 10:33:00,3,1,1,1,1,1,1,1,33,2,"",2,"",5,10,1,1,1,1,2,1,1,1,2,1,1,0,0,1,0,0,0,2,2,4,2,1,2,1,2,4,2,3,2,4,1,2,NA,NA,"",NA,"",NA,NA,NA,"",3,3,NA,NA,NA,NA,NA,NA,NA,NA,NA,"",NA,"",0,0,0,0,0,0,0,1,0,0,"","",2,NA,NA,"",3,NA,NA,NA,NA,NA,"",0,2,NA,NA,NA,"",3,3,1,"Fitnessstudio nitgliedschaft",1,4,NA,"","","",NA,NA,2,"",NA,NA,NA,"","","",NA,NA,2,"",NA,NA,NA,"","","",2,2,2,"",NA,NA,NA,"","","",1,1,3,"",NA,NA,NA,"","","",4,3,2,"",NA,NA,NA,"","","",4,4,1,"Verschiedene",1,5,NA,"","","",NA,NA,1,"Büro möbel",1,5,NA,"","","",NA,NA,2,"",NA,NA,NA,NA,"",NA,3,3,1,"IT Abteilung",1,5,NA,"",NA,NA,2,"",NA,NA,NA,"","","",5,4,2,"",NA,NA,NA,"","","",4,3,2,"",NA,NA,NA,"","","",4,4,2,"",NA,NA,NA,NA,"","",3,3,2,"",NA,NA,NA,NA,"","",4,3,0,0,0,1,0,0,0,0,0,0,"",0,1,0,0,0,0,0,0,0,0,"",0,1,0,1,0,0,0,0,0,0,"",3,1,NA,NA,NA,NA,3,NA,NA,NA,"",3,3,2,NA,2,2,4,4,3,3,2,"",4,1,3,2,40,0,5,5,5,5,5,4,4,5,4,5,4,5,5,5,5,5,5,5,4,5,3,3,4,3,3,3,2,2,3,3,5,5,5,5,5,4,5,5,5,5,5,4,5,4,5,3,2,3,4,2,5,4,3,4,5,4,2,4,1,4,5,4,5,5,5,5,1,1,1,2,1,2,1,1,1,2,1,1,2,1,1,5,3,4,4,5,3,2,3,1,3,4,4,4,3,4,4,3,4,4,4,3,3,4,3,4,5,4,5,5,1929.11,1,"8ruxp3bnc3yez2tb",NA,NA,"sa","/survey/selfserve/53b/g004/230372?list=1&ID=241166931206207","8ruxp3bnc3yez2tb","241166931206207",21.7203166666667,32.1518333333333,0,72013,"01-07-2013",2013-07-01,118,9,10,9.1,3685,2013,10,3.66666666666667,4.5,5,3.33333333333333,2,3,1.5,1,5,4,3,3,2,6.6,4.4,5,5,4.75,3.8,4.11111111111111,3.66666666666667,3.66666666666667,5,4,1,2.8,3.5,2.33333333333333,3.5,2.33333333333333,1.2,4.27272727272727,4.2,4.66666666666667,4,4.66666666666667,5,5,4.33333333333333,4.33333333333333,4.83333333333333,5,5,5,4.66666666666667,59.45,54.05,53.98,60.77,55.62,55.25,56.79,52.42,67.8370701,57.7203201,67.3689146,58.0005246,0.222222222222222,2,2,3,1.8,2,1.66666666666667,5.55555555555556,5,6,5.66666666666667,59.45,54.05,53.98,60.77,55.62,55.25,56.79,52.42,67.8370701,57.7203201,67.3689146,58.0005246,0.555555555555556,2,5,2,2,2.25,2.75,2,3.5,4.63636363636364,4.8,4.33333333333333,4.66666666666667,4.33333333333333,5,5,4,3.33333333333333,2.66666666666667,4.8,2,4,3.25,3.16666666666667,3.5,5,4.38461538461539,4.4,3.75,5,1.28571428571429,1.33333333333333,1,3.42857142857143,4.2,2.25,3.75,3,2,3.4,3.66666666666667,3.33333333333333,3.25,4.5,1.8,2,5,5,5,4.66666666666667,5,4.5
"85",123,"91p387xm3q2fywnu","02/27/2023 19:50","qualified,/Gender/X0TrF,/Age/b3xfu,/Total/Total",3,1,1,1,1,1,1,2,61,2,3,"",3,2,"",1,1,4,1.2015,45,50,2,NA,NA,NA,12,"Sicherheit","Sicherheitsmitarbeiter",6,10,1,2,4,4,2,1,63,21,17,NA,NA,NA,NA,NA,NA,NA,1,2,2,NA,NA,NA,NA,NA,NA,NA,2,2,3,5,4,5,5,5,5,5,4,5,5,1,1,1,1,1,1,1,1,4,4,3,3,3,3,3,1,10,3,1,9,3,3,3,5,4,4,4,4,4,4,4,4,4,2,3,3,1,2,3,3,3,4,5,4,4,4,4,5,4,3,3,1,1,2,5,5,4,4,1,1,1,1,1,1,1,1,1,1,1,1,1,5,NA,NA,0,4,4,1,1,1,5,9,2,1,1,1,1,1,1,1,0,0,0,0,0,0,0,0,0,1,5,2,1,1,5,2,1,1,3,6,6,6,6,6,6,6,6,6,5,5,5,5,5,5,4,5,5,5,5,5,5,5,5,5,5,5,5,5,5,5,4,5,5,5,5,5,5,4,1,4,1,5,1,1,751.505,4,NA,12,NA,5,6,"02/27/2023 19:37",NA,NA,NA,1,"Mozilla/5.0 (Windows NT 10.0; Win64; x64; rv:109.0) Gecko/20100101 Firefox/110.0","46heyq898ehftp6m","vy4y61un7zz0093r",NA,NA,"..","/survey/selfserve/53b/g004/230146?list=1&ID=237111539450941","056cswyan7db5d6y","237111539450941",549,2023-04-14 14:13:00,3,1,1,1,1,1,1,2,61,2,"",2,"",5,9,2,1,1,1,1,1,1,1,0,0,0,0,0,0,0,0,0,1,1,5,1,1,1,5,1,5,2,1,1,3,1,2,NA,NA,"",NA,"",NA,NA,NA,"",3,3,NA,NA,NA,NA,NA,NA,NA,NA,NA,"",NA,"",1,1,0,0,0,0,1,0,0,0,"","",2,NA,NA,"",2,NA,NA,NA,NA,NA,"",0,2,NA,NA,NA,"",3,2,2,"",NA,NA,NA,"","","",3,3,2,"",NA,NA,NA,"","","",4,4,2,"",NA,NA,NA,"","","",4,4,2,"",NA,NA,NA,"","","",5,4,2,"",NA,NA,NA,"","","",5,5,2,"",NA,NA,NA,"","","",4,4,1,"Qualifikation",1,5,NA,"","","",NA,NA,2,"",NA,NA,NA,"","","",5,5,2,"",NA,NA,NA,NA,"",NA,3,4,2,"",NA,NA,NA,"",4,3,2,"",NA,NA,NA,"","","",3,3,2,"",NA,NA,NA,"","","",5,2,2,"",NA,NA,NA,"","","",4,3,2,"",NA,NA,NA,NA,"","",5,1,2,"",NA,NA,NA,NA,"","",4,3,0,0,0,0,0,0,0,0,0,1,"Keine",0,0,0,0,0,0,0,0,0,1,"Weiss nicht",0,0,0,0,0,0,0,0,0,1,"Keine Ahnung",1,1,NA,NA,NA,NA,3,NA,NA,NA,"",5,5,2,NA,2,2,4,5,5,3,2,"",1,1,1,1,0,0,1,5,5,5,5,5,4,4,5,4,4,5,5,5,4,5,5,5,5,5,4,4,5,4,3,4,2,3,2,3,4,3,4,3,4,4,2,3,3,3,4,3,4,3,3,4,3,4,3,3,4,3,2,5,4,3,3,4,2,4,4,4,4,4,4,3,1,1,1,1,1,1,1,1,1,1,2,2,1,1,1,5,3,4,5,5,2,1,3,1,4,2,3,3,3,4,3,3,2,2,3,1,1,2,3,2,5,3,3,1,951.73,1,"4wagcrm3n2tc3d0w",NA,NA,"sa","/survey/selfserve/53b/g004/230372?list=1&ID=241183254205535","h03y5zqaabeymwhg","241183254205535",12.5250833333333,15.8621666666667,0,12015,"01-01-2015",2015-01-01,100,8,4,8.04,3136,2015,8,4,5,5,4.66666666666667,1,1,1,1,4,3,3,3,1,5.2,3.6,4.25,4,3.91666666666667,2.2,3.77777777777778,3,4.33333333333333,4,3,1,1,1,1,1,1,2.2,4.90909090909091,5,4.66666666666667,5,4.91666666666667,5,5,5,4.66666666666667,5,5,5,5,4.66666666666667,52.83,54.05,53.98,60.77,61.83,55.25,56.79,52.42,69.193003,59.076253,66.6843296,57.3159396,0,1,1,3,1.4,1.5,1.33333333333333,6,6,6,6,52.83,54.05,53.98,60.77,61.83,55.25,56.79,52.42,69.193003,59.076253,66.6843296,57.3159396,0,1,1,1,3,1.25,1.5,1.125,4.25,4.63636363636364,5,4.33333333333333,4.33333333333333,4.66666666666667,4.66666666666667,5,4.66666666666667,4.33333333333333,2.83333333333333,3.33333333333333,3,3,3.25,3.5,2.5,4,3.84615384615385,4.2,3.5,3.75,1,1.33333333333333,1,3.14285714285714,4.4,1.75,3,3,4,2.6,3.33333333333333,3,1.75,3.25,2,1,1,3.66666666666667,3.5,3,3.33333333333333,3.25
"86",126,"ft1sugrgfrp4w7t6","02/27/2023 20:16","qualified,/Gender/p47uy,/Age/gcKvr,/Total/Total",3,1,1,1,1,1,1,1,46,1,5,"",5,1,"",3,1,5,9.1992,40,45,2,NA,NA,NA,6,"","Prozessmanagerin",8,2,1,2,2,2,1,NA,49,NA,NA,NA,NA,NA,NA,NA,NA,NA,1,NA,NA,NA,NA,NA,NA,NA,NA,NA,NA,2,5,5,5,4,5,3,3,4,4,1,3,1,1,5,5,1,5,1,1,3,2,2,2,2,2,2,2,4,3,3,3,3,2,2,2,2,2,2,2,2,2,2,2,2,2,5,2,2,2,3,4,4,4,4,4,4,4,4,2,4,4,2,1,1,1,5,5,5,5,5,1,1,1,1,3,3,5,2,5,4,4,1,1,2,50,50,1,1,1,1,7,3,9,2,1,1,1,2,1,1,1,0,0,0,0,0,0,0,0,0,1,5,1,1,1,5,1,1,1,1,5,5,5,5,5,5,5,5,5,5,5,5,5,5,5,5,5,5,5,5,4,4,4,4,4,4,4,4,4,4,4,4,5,5,5,5,5,5,5,1,5,1,5,1,1,1448.181,4,NA,12,NA,5,6,"02/27/2023 19:51",NA,NA,NA,1,"Mozilla/5.0 (Windows NT 10.0; Win64; x64; rv:109.0) Gecko/20100101 Firefox/110.0","z86f0hk27swvh5pf","1b1ftb7sutjk30dv",NA,NA,"..","/survey/selfserve/53b/g004/230146?list=1&ID=237129246465091","1b1ftb7sutjk30dv","237129246465091",494,2023-04-14 13:21:00,3,1,1,1,1,1,1,1,46,2,"",2,"",4,9,2,1,1,1,2,1,1,1,0,0,0,0,0,0,0,0,0,2,1,5,1,1,1,5,1,5,3,2,1,4,1,1,2,NA,"",NA,"",2,NA,2,"",NA,NA,1,1,0,1,0,1,1,0,0,"",7,"",0,0,0,0,0,0,0,0,1,0,"","",1,3,NA,"",1,4,5,1,3,NA,"",4,1,2,NA,3,"",NA,NA,1,"Yogakurs, Rückenschule",1,4,NA,"","","",NA,NA,3,"",NA,NA,NA,"","","",NA,NA,1,"Kochkurs",2,NA,3,"","Kein Bedarf, nehme mein Essen von zu Hause mit","",NA,NA,2,"",NA,NA,NA,"","","",1,1,2,"",NA,NA,NA,"","","",1,1,1,"Regelmäßige FÜhrungsseminare",1,3,NA,"","","",NA,NA,1,"Fachspezifische Weiterbildungen",1,4,NA,"","","",NA,NA,2,"",NA,NA,NA,"","","",4,4,2,"",NA,NA,NA,NA,"",NA,1,1,3,"",NA,NA,NA,"",1,1,1,"Flexible Arbeitszeit",1,5,NA,"","","",NA,NA,3,"",NA,NA,NA,"","","",1,1,2,"",NA,NA,NA,"","","",1,1,2,"",NA,NA,NA,NA,"","",4,4,2,"",NA,NA,NA,NA,"","",1,1,0,0,0,0,0,1,0,0,0,0,"",0,0,0,0,0,0,0,1,0,0,"",0,0,0,0,0,0,0,1,0,0,"",1,1,NA,NA,NA,NA,1,1,1,NA,"",NA,NA,1,1,2,2,1,1,1,1,2,"",3,3,4,2,50,0,5,5,5,5,5,5,5,5,5,3,5,3,4,4,4,4,4,4,3,4,4,4,4,4,2,2,2,2,2,2,4,3,4,4,4,4,3,4,4,4,4,4,4,4,4,4,4,4,2,2,4,4,4,4,4,4,4,4,2,4,4,4,4,4,4,4,3,3,3,1,1,1,1,2,1,2,2,2,2,1,1,3,4,4,4,4,1,1,4,1,3,3,3,3,3,3,3,3,1,3,3,4,4,3,2,2,2,2,2,4,933.3,5,"1b1ftb7sutjk30dv",NA,NA,"..","/survey/selfserve/53b/g004/230372?list=1&ID=241183254202436","1b1ftb7sutjk30dv","241183254202436",24.13635,15.555,-50,91992,"01-09-1992",1992-09-01,368,30,8,30.08,11293,1992,31,5,4.5,3.33333333333333,2.66666666666667,1,5,3,1,2.5,2,2,2,2,3.2,2,2,2,2,2.6,3.88888888888889,3.66666666666667,4,4,5,1,3.6,3,4,3,4,2.2,5,5,5,5,4,4,4,4,4,5,5,5,5,5,52.83,54.05,53.98,60.77,55.62,55.25,56.79,52.42,67.5970951,57.4803451,66.0444512,56.6760612,0,1,1,5,1.4,2,1,5,5,5,5,52.83,54.05,53.98,60.77,55.62,55.25,56.79,52.42,67.5970951,57.4803451,66.0444512,56.6760612,0,1,1,1,2,1.33333333333333,1.25,1.375,1,4.63636363636364,5,5,3.66666666666667,3.91666666666667,4,4,3.66666666666667,4,2,3.86666666666667,4,4,4,4,4,4,4,4,4,4,1.85714285714286,1.83333333333333,1,2.92857142857143,3.8,1.75,3,3,5,3.3,3,3.66666666666667,3.25,2,1.8,2,3,3.66666666666667,4,3.66666666666667,4,4
"87",127,"7xvc19cgx21bcpm4","02/27/2023 20:23","qualified,/Gender/X0TrF,/Age/gcKvr,/Total/Total",3,1,1,1,1,1,1,2,27,1,3,"",3,1,"",4,1,6,8.2011,40,40,2,NA,NA,NA,4,"","Abteilungsleiter",5,15,4,1,NA,NA,NA,NA,NA,NA,NA,NA,NA,NA,NA,NA,NA,NA,NA,NA,NA,NA,NA,NA,NA,NA,NA,NA,NA,2,4,4,4,4,4,4,4,4,4,4,4,4,4,4,4,4,4,4,4,4,4,4,4,5,5,5,5,8,7,7,5,7,2,4,3,4,4,3,2,4,4,3,4,4,4,4,4,4,4,4,4,4,4,4,4,4,4,4,5,3,4,4,3,1,2,4,4,4,3,4,1,1,1,1,4,3,2,4,1,5,1,1,1,NA,NA,0,5,5,5,1,2,5,10,2,1,1,1,1,4,1,1,3,3,1,0,5,5,3,0,1,1,5,1,1,1,4,4,4,2,4,4,5,4,5,5,5,5,5,5,5,5,5,5,5,5,5,5,5,5,5,5,5,5,5,5,5,5,5,3,5,5,5,5,5,5,5,5,5,5,5,5,5,5,5,1,1117.435,12,NA,11,NA,1,1,"02/27/2023 20:04",NA,NA,NA,1,"Mozilla/5.0 (iPhone; CPU iPhone OS 16_3_1 like Mac OS X) AppleWebKit/605.1.15 (KHTML, like Gecko) Version/16.3 Mobile/15E148 Safari/604.1","hxxd0p19e8jf3r20","tsz4qf6veyuwa680",NA,NA,"si","/survey/selfserve/53b/g004/230146?list=1&ID=237129246470284","tsz4qf6veyuwa680","237129246470284",824,2023-04-15 11:02:00,3,1,1,1,1,1,1,2,28,2,"",2,"",4,9,2,1,1,1,2,1,1,1,3,2,2,1,0,0,0,0,0,1,1,1,1,1,1,1,1,1,1,1,1,1,1,1,2,NA,"",NA,"",2,NA,2,"",NA,NA,1,0,1,0,0,0,0,1,0,"",8,"",1,0,0,1,0,0,0,0,0,0,"","Religiöser Verein",1,2,2,"",1,5,1,2,NA,1,"",0,2,NA,NA,NA,"",3,4,2,"",NA,NA,NA,"","","",4,4,1,"Stressmanagment",2,NA,2,"","","",2,4,1,"Unterschiedlich",2,NA,3,"","Essen von der Firma","",NA,NA,2,"",NA,NA,NA,"","","",1,1,2,"",NA,NA,NA,"","","",4,4,2,"",NA,NA,NA,"","","",4,4,1,"Interne",1,5,NA,"","","",NA,NA,1,"Stühle, Bildschirme",2,NA,2,"","","",NA,NA,2,"",NA,NA,NA,NA,"",NA,4,4,1,"Chef",1,4,NA,"",NA,NA,1,"Minusstundeaufbau",1,4,NA,"","","",NA,NA,2,"",NA,NA,NA,"","","",1,1,2,"",NA,NA,NA,"","","",1,1,2,"",NA,NA,NA,NA,"","",1,1,2,"",NA,NA,NA,NA,"","",1,1,0,0,0,0,0,0,1,0,0,0,"",0,1,0,0,0,0,0,0,0,0,"",0,1,0,0,0,0,0,0,0,0,"",1,1,NA,NA,NA,NA,1,2,NA,2,"",NA,NA,3,NA,3,3,4,4,4,4,2,"",1,1,3,1,0,10,1,5,4,5,4,5,4,5,5,3,3,4,3,4,5,5,5,4,5,5,5,5,5,5,3,3,3,3,3,3,1,3,4,4,2,1,1,1,5,4,4,4,4,4,4,4,4,4,4,4,4,4,4,4,3,3,3,3,3,3,3,3,4,4,3,4,3,4,3,3,4,3,3,3,4,3,3,2,2,2,2,4,4,4,4,4,5,4,4,5,4,4,5,4,3,4,5,4,4,5,4,5,4,4,4,4,5,4,4,4,2165.63,5,"av0dyfedgqkdb7aa",NA,NA,"..","/survey/selfserve/53b/g004/230372?list=1&ID=241166931204114","av0dyfedgqkdb7aa","241166931204114",18.6239166666667,36.0938333333333,10,82011,"01-08-2011",2011-08-01,141,11,9,11.09,4385,2011,12,4,4,4,4,4,4,4,4,4,4,5,5,NA,6.8,3,3.5,4,3.41666666666667,4,4,4,4,4,3.66666666666667,1,2.8,3.5,2.33333333333333,3.5,2.33333333333333,3.6,5,5,5,5,4.83333333333333,5,5,4.33333333333333,5,5,1,1,1,3,52.83,54.05,53.98,60.77,61.83,29.53,56.79,52.42,63.7115566,53.5948066,66.362058,56.993668,2.33333333333333,1,2,2,1.9,1.75,2,4.77777777777778,4.66666666666667,4.66666666666667,5,52.83,54.05,53.98,60.77,55.62,55.25,56.79,52.42,67.5970951,57.4803451,66.0444512,56.6760612,0.888888888888889,5,5,5,5,2.33333333333333,3,2,4,4.27272727272727,4.6,4.66666666666667,3.33333333333333,4.66666666666667,4,4.66666666666667,5,5,3,3.06666666666667,2,2,3.5,3.33333333333333,4,3,3.30769230769231,3.2,3,3.75,3.28571428571429,2.83333333333333,2,4.14285714285714,4,4.5,4.25,3,2,4.1,4.33333333333333,3.66666666666667,4.25,4.25,2.8,1,5,2.66666666666667,3,1,4.33333333333333,4
"88",128,"4vfzn68wgp812t9g","02/27/2023 20:40","qualified,/Gender/p47uy,/Age/b3xfu,/Total/Total",3,1,1,1,1,1,1,1,64,2,3,"",2,1,"",1,1,6,2.2005,38,38,2,NA,NA,NA,1,"","laborantin",7,4,5,2,2,2,1,NA,34,NA,NA,NA,NA,NA,NA,NA,NA,NA,2,NA,NA,NA,NA,NA,NA,NA,NA,NA,NA,1,4,5,5,5,5,5,5,5,5,5,5,1,1,1,1,1,2,1,1,5,5,5,3,3,4,4,1,10,10,10,10,5,4,4,5,5,5,5,5,5,5,5,4,4,2,4,4,2,4,1,5,5,5,5,5,5,5,5,4,2,1,1,1,1,1,5,5,5,3,5,5,3,1,5,1,1,1,1,1,5,1,1,1,NA,NA,0,5,5,1,1,1,5,5,5,4,3,5,3,2,1,1,0,0,0,0,0,0,0,0,0,1,5,2,2,1,5,1,3,1,5,5,5,5,6,5,6,6,6,5,5,5,5,5,5,5,5,5,5,5,5,5,5,5,5,5,5,5,5,5,5,5,5,5,5,5,5,5,5,5,1,5,2,4,2,1,1536.518,4,NA,10,NA,5,6,"02/27/2023 20:13",NA,NA,NA,1,"Mozilla/5.0 (Windows NT 10.0; Win64; x64) AppleWebKit/537.36 (KHTML, like Gecko) Chrome/110.0.0.0 Safari/537.36","b3vdaknhxtzhjway","yr531kbpqtcqpsn0",NA,NA,"..","/survey/selfserve/53b/g004/230146?list=1&ID=237104974324781","yr531kbpqtcqpsn0","237104974324781",768,2023-04-14 22:45:00,3,1,1,1,1,1,1,1,64,2,"",2,"",4,8,4,4,4,5,4,2,3,4,2,1,1,0,1,0,0,0,0,4,1,4,1,1,1,5,1,1,2,3,1,2,1,2,NA,NA,"",NA,"",NA,NA,NA,"",1,1,NA,NA,NA,NA,NA,NA,NA,NA,NA,"",NA,"",1,1,1,0,0,0,1,0,0,0,"","",1,4,NA,"",1,6,4,2,NA,2,"",1,1,2,NA,2,"",NA,NA,2,"",NA,NA,NA,"","","",1,1,2,"",NA,NA,NA,"","","",1,1,2,"",NA,NA,NA,"","","",1,1,2,"",NA,NA,NA,"","","",1,1,1,"Arbeitsschutzbelehrung",1,5,NA,"","","",NA,NA,1,"Toleranz",1,5,NA,"","","",NA,NA,1,"IT Bereich, Arbeitsfahrzeug genehmigung, Labor Artbeit, etc...",1,5,NA,"","","",NA,NA,1,"Neue IT und Labor Ausstattung",1,5,NA,"","","",NA,NA,1,"Exel  und Word Kurse",1,5,NA,NA,"",NA,NA,NA,1,"IT Bereich",1,5,NA,"",NA,NA,2,"",NA,NA,NA,"","","",5,5,2,"",NA,NA,NA,"","","",5,3,2,"",NA,NA,NA,"","","",4,1,2,"",NA,NA,NA,NA,"","",1,1,2,"",NA,NA,NA,NA,"","",1,1,0,0,0,0,0,0,0,0,1,0,"",0,0,0,0,0,0,0,1,0,0,"",0,0,0,0,0,0,0,0,1,0,"",1,2,NA,NA,NA,NA,1,1,3,NA,"",NA,NA,3,NA,2,2,4,3,3,2,2,"",1,1,1,1,0,0,1,5,5,5,5,5,5,5,5,5,5,5,5,5,3,5,5,5,5,5,5,5,3,2,1,1,1,2,2,1,4,4,4,2,2,2,2,2,2,2,2,3,4,4,2,5,3,3,5,4,3,1,1,4,3,2,1,2,2,4,5,4,5,4,4,5,1,1,1,1,1,1,1,1,1,1,1,1,1,1,1,5,4,5,5,5,4,3,3,2,3,5,5,5,5,5,4,2,2,2,2,2,3,5,3,3,2,4,4,3,2889.56,5,"mtkaub15r3gt1dpn",NA,NA,"..","/survey/selfserve/53b/g004/230372?list=1&ID=241166931204119","mtkaub15r3gt1dpn","241166931204119",25.6086333333333,48.1593333333333,0,22005,"01-02-2005",2005-02-01,219,18,3,18.03,6757,2005,18,4.66666666666667,5,5,5,1,1,1.5,1,5,4,3.66666666666667,3.5,1,9,4.6,5,4.33333333333333,4.66666666666667,3.2,4.55555555555556,3.66666666666667,5,5,4.33333333333333,3.5,1,1,1,1,1,2.6,5,5,5,5,5,5,5,5,5,5,5,4,4,4.5,32.56,30.31,38.71,31.48,45.16,49.47,56.79,52.42,70.8311841,60.7144341,36.0975786,26.7291886,0,1,1,1,1.4,1,1.66666666666667,5.44444444444444,5,5.66666666666667,5.66666666666667,38.41,30.31,28.32,31.48,35.81,49.47,41.53,29.25,50.6508378,40.5340878,34.8220164,25.4536264,0.555555555555556,2,1,5,4,1.91666666666667,1.75,2,3,5,5,5,5,4.41666666666667,4.33333333333333,5,5,3.33333333333333,1.33333333333333,2.73333333333333,1,2,2.375,2.83333333333333,1,4,3.61538461538462,4.2,2,4.5,1,1,1,4.21428571428571,4.8,3,4.5,5,4,3.2,3.66666666666667,2.66666666666667,3.25,3.25,1,1,5,4,2,2,2,3.25
"89",129,"558swmtqvvuu4e3a","02/27/2023 20:37","qualified,/Gender/p47uy,/Age/gcKvr,/Total/Total",3,1,1,1,1,1,1,1,49,1,5,"",3,1,"",3,1,6,10.2003,40,42,2,NA,NA,NA,4,"","Personalfachkauffrau",8,7,1,2,4,4,2,1,59,23,15,NA,NA,NA,NA,NA,NA,NA,1,2,2,NA,NA,NA,NA,NA,NA,NA,3,2,3,5,2,4,4,4,4,4,4,4,4,1,1,2,2,1,3,1,1,4,3,4,3,3,3,3,1,5,2,5,9,2,2,2,3,3,2,3,3,3,2,2,3,3,3,4,3,2,3,2,4,4,3,3,3,3,3,4,5,1,1,1,1,1,1,5,5,4,3,3,1,1,1,1,2,2,1,1,1,5,1,1,1,NA,NA,0,1,1,1,1,1,5,9,2,1,1,2,2,1,1,1,0,1,1,1,0,0,0,0,0,2,5,3,2,2,4,2,3,1,3,4,5,3,3,5,5,5,4,4,4,4,4,4,4,4,3,4,3,3,4,5,5,5,5,5,5,4,4,3,4,4,4,4,4,4,5,4,5,4,2,4,3,4,2,1,1065.294,4,NA,12,NA,5,6,"02/27/2023 20:19",NA,NA,NA,1,"Mozilla/5.0 (Windows NT 10.0; Win64; x64; rv:109.0) Gecko/20100101 Firefox/110.0","ce9gc4tu2gbb56au","wxjgdy8nabca7jtw",NA,NA,"..","/survey/selfserve/53b/g004/230146?list=1&ID=237129246467166","xf4nst1tfhh5eyzk","237129246467166",740,2023-04-14 19:49:00,3,1,1,1,1,1,1,1,49,2,"",2,"",5,9,2,1,1,1,2,1,1,1,0,1,0,1,1,0,0,1,0,2,3,4,2,2,1,4,2,4,1,1,1,3,1,1,2,NA,"",NA,"",2,NA,2,"",NA,NA,1,0,0,0,0,0,0,0,0,"",1,"",0,0,0,0,0,0,0,0,1,0,"","",1,3,NA,"",2,NA,NA,NA,NA,NA,"",1,2,NA,NA,NA,"",1,2,1,"Rückenschule, Fitniss- Studio",1,5,NA,"","","",NA,NA,3,"",NA,NA,NA,"","","",NA,NA,2,"",NA,NA,NA,"","","",1,2,2,"",NA,NA,NA,"","","",1,1,1,"Arbeitsschutzschulung",1,5,NA,"","","",NA,NA,1,"Verschiedene - auch um Mobbing, sexuelle Belästigung u.s.w zu erkennen",2,NA,2,"","","",NA,NA,1,"arbeitsplatz spezifische Schulungen",1,5,NA,"","","",NA,NA,3,"",NA,NA,NA,"","","",3,4,3,"",NA,NA,NA,NA,"",NA,3,3,3,"",NA,NA,NA,"",2,3,2,"",NA,NA,NA,"","","",2,2,3,"",NA,NA,NA,"","","",3,2,2,"",NA,NA,NA,"","","",1,1,2,"",NA,NA,NA,NA,"","",2,3,2,"",NA,NA,NA,NA,"","",1,1,1,0,0,0,0,0,0,0,0,0,"",1,0,0,0,0,0,0,0,0,0,"",1,0,0,0,0,0,0,0,0,0,"",1,1,NA,NA,NA,NA,1,1,4,NA,"",NA,NA,1,1,2,2,4,3,3,3,2,"",1,1,1,1,0,0,1,5,4,4,5,5,4,3,4,3,4,4,5,5,5,5,5,5,3,4,4,4,4,4,3,3,2,2,3,2,4,3,3,3,3,3,3,3,5,4,4,3,4,3,3,5,4,4,1,3,4,4,4,3,4,4,3,4,2,3,4,4,5,3,4,4,1,1,1,1,1,1,1,2,1,2,2,2,1,1,1,5,4,5,4,4,3,2,4,2,3,3,4,2,2,3,3,3,2,3,3,3,3,3,3,3,4,3,3,5,1129.88,5,"wxjgdy8nabca7jtw",NA,NA,"..","/survey/selfserve/53b/g004/230372?list=1&ID=241183254208656","xf4nst1tfhh5eyzk","241183254208656",17.7549,18.8313333333333,0,102003,"01-10-2003",2003-10-01,235,19,7,19.07,7246,2003,20,3.33333333333333,4,4,4,1,2,2,1,3.5,3.5,3,3,1,4.6,2.2,3,2.66666666666667,2.58333333333333,3,3.22222222222222,3.33333333333333,3,3.33333333333333,3.33333333333333,1,1.4,2,1,2,1,1,3.72727272727273,4,3.66666666666667,3.33333333333333,4.41666666666667,5,5,3.66666666666667,4,4.33333333333333,4,3,4,3.83333333333333,52.83,54.05,53.98,53.35,55.62,55.25,56.79,52.42,67.7831145,57.6663645,63.5244708,54.1560808,0.333333333333333,1,2,3,2.1,2,2.16666666666667,4.22222222222222,4.66666666666667,3.66666666666667,4.33333333333333,52.83,54.05,53.98,60.77,55.62,55.25,56.79,52.42,67.5970951,57.4803451,66.0444512,56.6760612,0.444444444444444,2,2,2,3,1.83333333333333,1.75,1.875,3.25,4.09090909090909,4.6,3.66666666666667,3.66666666666667,4.41666666666667,5,5,3.66666666666667,4,2.5,3.4,5,3,4.125,4.16666666666667,4,4,3.76923076923077,3.6,3.75,4,1,1.66666666666667,1,3.35714285714286,4.4,2.75,3,2,4,3.1,3,3.33333333333333,3,3.25,1,1,1,3.33333333333333,3,3,4.33333333333333,3.25
"90",130,"c29ddqe7cf6sfbu3","02/27/2023 20:42","qualified,/Gender/X0TrF,/Age/b3xfu,/Total/Total",3,1,1,1,1,1,1,2,60,2,3,"",5,1,"",1,1,3,6.2015,40,40,2,NA,NA,NA,12,"Ing.-wesen Konstruktion & Consulting","Konstrukteur",5,14,1,2,3,3,1,NA,65,27,NA,NA,NA,NA,NA,NA,NA,NA,1,2,NA,NA,NA,NA,NA,NA,NA,NA,NA,2,4,4,4,4,4,4,4,4,4,4,4,2,4,2,3,1,3,2,4,4,4,4,4,4,4,4,1,5,5,5,5,9,4,4,4,4,4,4,4,4,4,4,4,4,3,3,3,3,3,3,3,3,3,3,3,3,3,3,3,3,4,3,2,2,3,4,4,5,4,4,1,1,1,1,4,4,1,1,1,5,1,1,1,NA,NA,1,1,1,1,1,1,4,9,2,2,2,4,1,2,1,1,0,0,0,0,0,0,0,0,0,1,1,1,1,1,1,1,1,1,1,4,5,5,5,5,5,5,5,4,4,4,4,4,4,4,4,4,4,4,4,4,4,4,4,4,4,4,4,4,4,4,4,4,4,4,4,4,4,4,1,4,1,4,1,1,1098.07,4,NA,12,NA,5,6,"02/27/2023 20:23",NA,NA,NA,1,"Mozilla/5.0 (Windows NT 10.0; Win64; x64; rv:109.0) Gecko/20100101 Firefox/110.0","2d4ex9ne61rqfb4d","gxrb3475216g46jj",NA,NA,"..","/survey/selfserve/53b/g004/230146?list=1&ID=237129246465083","ngb13j37j5uc8q8j","237129246465083",857,2023-04-15 21:13:00,3,1,1,1,1,1,1,2,60,2,"",2,"",4,9,3,2,2,4,1,2,1,1,0,0,0,0,0,0,0,0,0,1,1,4,1,1,1,4,1,4,1,1,1,3,1,3,NA,NA,"",NA,"",NA,NA,NA,"",4,2,NA,NA,NA,NA,NA,NA,NA,NA,NA,"",NA,"",0,0,0,0,0,0,0,1,0,0,"","",2,NA,NA,"",2,NA,NA,NA,NA,NA,"",2,2,NA,NA,NA,"",3,3,2,"",NA,NA,NA,"","","",4,4,2,"",NA,NA,NA,"","","",3,3,2,"",NA,NA,NA,"","","",4,3,2,"",NA,NA,NA,"","","",1,1,3,"",NA,NA,NA,"","","",3,3,2,"",NA,NA,NA,"","","",3,3,1,"arbeitsbedingte weiterbildungen bei neuen Arbeitsprogrammen",1,5,NA,"","","",NA,NA,2,"",NA,NA,NA,"","","",5,5,2,"",NA,NA,NA,NA,"",NA,4,4,2,"",NA,NA,NA,"",3,3,1,"flexible Arbeitzeiten",1,5,NA,"","","",NA,NA,3,"",NA,NA,NA,"","","",4,1,2,"",NA,NA,NA,"","","",4,1,2,"",NA,NA,NA,NA,"","",4,1,2,"",NA,NA,NA,NA,"","",3,3,0,0,0,0,0,0,0,0,0,1,"keine",0,0,0,1,0,0,0,0,0,0,"",0,0,0,1,0,0,0,0,0,0,"",3,1,NA,NA,NA,NA,2,NA,NA,NA,"",4,4,2,NA,2,2,4,4,4,4,2,"",4,1,3,1,0,0,3,4,4,4,4,4,4,4,4,4,4,4,4,4,4,4,4,4,4,4,4,4,4,4,3,3,3,3,3,3,4,4,4,4,4,4,4,4,2,3,3,4,3,3,3,4,4,4,2,1,4,4,4,4,3,4,4,4,2,5,4,4,4,4,4,4,1,1,1,3,1,3,3,4,2,1,2,2,2,1,1,4,4,4,4,4,1,2,2,2,3,3,3,2,1,4,4,3,1,2,2,2,2,2,2,2,3,1,3,1,2045.28,5,"gxrb3475216g46jj",NA,NA,"..","/survey/selfserve/53b/g004/230372?list=1&ID=241166931197129","ngb13j37j5uc8q8j","241166931197129",18.3011666666667,34.088,-1,62015,"01-06-2015",2015-06-01,95,7,11,7.11,2985,2015,8,4,4,4,4,3,2.5,2,3,4,4,4,4,1,5.8,4,4,4,4,3,3,3,3,3,4.33333333333333,1,2.2,4,1,4,1,1,4,4,4,4,4,4,4,4,4,4,5,5,5,4.5,52.83,48.33,46.92,40.07,61.83,49.47,56.79,52.42,70.779704,60.662954,54.3473684,44.9789784,0,5,5,5,2.2,3,1.66666666666667,4.77777777777778,4.66666666666667,5,4.66666666666667,46.43,48.33,46.92,40.07,61.83,49.47,56.79,52.42,70.547704,60.430954,53.0669204,43.6985304,0,2,2,2,3,1.41666666666667,1.75,1.25,4,4,4,4,4,4,4,4,4,4,3,3.53333333333333,4,5,4.125,4.16666666666667,4,4,4,4.2,3.75,4,1.85714285714286,2.16666666666667,1,2.78571428571429,4,1.75,2.75,1,5,2.8,3.66666666666667,3,2,2.25,2.8,1,1,4,4,4,2.66666666666667,3.25
"91",131,"bwe3vkqrapypmcde","02/27/2023 20:48","qualified,/Gender/X0TrF,/Age/gcKvr,/Total/Total",3,1,1,1,1,1,1,2,33,1,5,"",5,1,"",1,1,4,12.2007,40,41,2,NA,NA,NA,1,"","Konstrukteur",8,13,1,2,3,3,2,1,32,3,NA,NA,NA,NA,NA,NA,NA,NA,1,2,NA,NA,NA,NA,NA,NA,NA,NA,3,2,4,4,4,4,3,4,4,4,4,4,4,2,1,3,3,1,3,2,1,3,4,3,3,3,2,3,1,3,5,6,5,7,4,4,3,4,4,3,3,4,3,4,4,3,4,3,4,4,4,4,3,4,4,3,4,4,3,4,4,3,3,3,3,3,3,4,4,4,3,4,3,2,3,1,4,5,4,2,3,4,4,1,2,2,40,1,2,2,3,4,4,4,7,3,1,3,2,1,1,1,1,1,1,1,1,1,1,1,1,1,1,1,1,1,1,1,1,1,1,1,6,6,6,6,6,6,5,6,6,3,4,3,4,4,4,3,4,4,4,4,4,5,4,4,4,4,4,4,4,4,4,4,4,4,4,4,4,4,4,2,4,3,4,2,1,1404.954,14,NA,10,NA,1,2,"02/27/2023 20:24",NA,NA,NA,1,"Mozilla/5.0 (Linux; Android 11; SAMSUNG SM-A705FN) AppleWebKit/537.36 (KHTML, like Gecko) SamsungBrowser/20.0 Chrome/106.0.5249.126 Mobile Safari/537.36","xbb56j5gtp8z7zs5","qm86dz7mtv60f0wn",NA,NA,"sa","/survey/selfserve/53b/g004/230146?list=1&ID=237104974322706","6xjj8j5ym0kga5a0","237104974322706",898,2023-04-16 09:55:00,3,1,1,1,1,1,1,2,33,2,"",2,"",4,8,3,2,2,2,2,1,2,2,1,1,1,1,1,1,1,1,1,2,2,4,2,2,2,4,1,2,2,2,1,2,1,2,NA,NA,"",NA,"",NA,NA,NA,"",2,2,NA,NA,NA,NA,NA,NA,NA,NA,NA,"",NA,"",0,0,0,0,0,0,1,1,0,0,"","",2,NA,NA,"",2,NA,NA,NA,NA,NA,"",0,2,NA,NA,NA,"",4,5,2,"",NA,NA,NA,"","","",4,5,2,"",NA,NA,NA,"","","",4,4,2,"",NA,NA,NA,"","","",4,4,2,"",NA,NA,NA,"","","",3,4,2,"",NA,NA,NA,"","","",4,4,2,"",NA,NA,NA,"","","",3,4,1,"Fachliche Themen",1,4,NA,"","","",NA,NA,2,"",NA,NA,NA,"","","",5,4,2,"",NA,NA,NA,NA,"",NA,4,4,2,"",NA,NA,NA,"",4,4,1,"Gleitzeit, Homeoffice",1,5,NA,"","","",NA,NA,2,"",NA,NA,NA,"","","",4,5,2,"",NA,NA,NA,"","","",5,5,2,"",NA,NA,NA,NA,"","",4,4,2,"",NA,NA,NA,NA,"","",4,5,0,0,0,0,0,1,0,0,0,0,"",0,0,0,1,1,1,1,0,0,0,"",0,0,0,1,0,1,0,0,0,0,"",1,1,NA,NA,NA,NA,1,2,NA,2,"",NA,NA,2,NA,2,2,2,4,3,3,2,"",3,4,3,2,42,1,2,4,4,4,4,4,4,4,4,4,4,4,4,4,4,5,4,4,4,4,5,4,5,5,3,3,3,3,2,3,5,5,4,5,5,5,4,5,4,4,4,4,4,4,4,4,4,5,4,4,4,4,5,4,3,4,4,4,2,3,4,4,4,4,4,4,2,3,3,3,2,2,2,1,1,1,1,1,1,2,2,4,4,4,4,4,3,3,4,4,4,3,4,4,4,4,4,4,3,4,4,4,4,3,4,3,4,4,4,3,846.92,3,"rr27cd3vx415hjxg",NA,NA,"ta","/survey/selfserve/53b/g004/230372?list=1&ID=241183254211796","rr27cd3vx415hjxg","241183254211796",23.4159,14.1153333333333,0,122007,"01-12-2007",2007-12-01,185,15,5,15.05,5724,2007,16,4,3.5,4,4,1.5,3,2,1.5,3.5,3,2.66666666666667,2.5,1,5.2,3.6,3.5,3.66666666666667,3.58333333333333,3.8,3.66666666666667,3.66666666666667,3.66666666666667,3.66666666666667,3.66666666666667,2.25,3.6,4.5,3,4.5,3,3,3.72727272727273,3.6,3.66666666666667,4,4.08333333333333,4.33333333333333,4,4,4,4,4,3,4,3.83333333333333,46.43,54.05,38.71,53.35,61.83,55.25,56.79,52.42,71.7475034,61.6307534,55.3412847,45.9728947,1,5,5,5,2.2,3,1.66666666666667,5.88888888888889,6,5.66666666666667,6,46.43,48.33,46.92,53.35,55.62,55.25,49.59,45.66,62.1119301,51.9951801,58.8769326,49.5085426,1,2,2,4,4,2.16666666666667,2.25,2.125,3,4,4,4,4,4.33333333333333,4,4.33333333333333,4.33333333333333,4.66666666666667,2.83333333333333,4.4,2,2,3.75,3.5,4.5,4,3.84615384615385,3.8,3.75,4,2.42857142857143,1,2,3.78571428571429,4,3.5,3.75,4,3,3.8,4,3.66666666666667,3.75,3.75,3,1,3,4.66666666666667,5,4.66666666666667,4,4
"92",132,"vuke4s72p2b7u1cc","02/27/2023 20:53","qualified,/Gender/p47uy,/Age/b3xfu,/Total/Total",3,1,1,1,1,1,1,1,59,2,5,"",5,1,"",1,1,4,7.1993,40,40,2,NA,NA,NA,6,"","buchhalter",8,16,1,2,2,2,2,0,59,NA,NA,NA,NA,NA,NA,NA,NA,NA,1,NA,NA,NA,NA,NA,NA,NA,NA,NA,1,2,4,4,3,4,4,5,5,5,5,5,5,2,4,3,4,1,5,2,2,4,4,4,4,3,3,3,5,2,2,9,9,8,3,3,4,4,4,4,4,4,4,4,4,4,4,4,4,4,4,4,4,4,4,4,4,4,4,4,5,3,2,3,1,1,3,4,4,3,2,3,2,1,1,1,4,2,1,1,1,5,1,1,1,NA,NA,0,2,2,2,2,2,5,9,3,2,2,1,2,1,1,1,1,1,0,1,0,0,1,1,0,2,4,2,1,1,3,1,2,1,2,2,3,4,4,3,3,4,4,4,4,4,4,4,4,4,4,4,3,3,4,4,4,4,4,4,4,4,4,4,4,4,4,4,4,4,4,4,4,3,3,3,4,3,4,1,1451.487,4,NA,10,NA,5,6,"02/27/2023 20:28",NA,NA,NA,1,"Mozilla/5.0 (Windows NT 10.0; Win64; x64) AppleWebKit/537.36 (KHTML, like Gecko) Chrome/110.0.0.0 Safari/537.36","c562sar7wjde8zvm","zv3h20487gk4emvu",NA,NA,"..","/survey/selfserve/53b/g004/230146?list=1&ID=237129246466122","zspb5dps2vpypekq","237129246466122",685,2023-04-14 17:41:00,3,1,1,1,1,1,1,1,59,2,"",2,"",4,9,3,2,1,2,2,1,1,1,0,0,0,0,0,0,0,0,0,2,1,5,1,1,1,5,1,5,2,2,1,1,1,2,NA,NA,"",NA,"",NA,NA,NA,"",1,1,NA,NA,NA,NA,NA,NA,NA,NA,NA,"",NA,"",0,0,0,0,0,0,0,1,0,0,"","",1,1,2,"",2,NA,NA,NA,NA,NA,"",0,2,NA,NA,NA,"",2,2,2,"",NA,NA,NA,"","","",1,2,2,"",NA,NA,NA,"","","",2,2,2,"",NA,NA,NA,"","","",2,2,2,"",NA,NA,NA,"","","",1,1,2,"",NA,NA,NA,"","","",2,2,1,"Sportfest,Frauentagsfeier,Weihnachtsfeier",1,5,NA,"","","",NA,NA,1,"Bezahlsysteme,Buchhaltung",1,5,NA,"","","",NA,NA,1,"neuer PC neuer Stuhl neuer Schreibtisch",1,5,NA,"","","",NA,NA,2,"",NA,NA,NA,NA,"",NA,2,2,3,"",NA,NA,NA,"",2,2,2,"",NA,NA,NA,"","","",2,2,3,"",NA,NA,NA,"","","",2,2,2,"",NA,NA,NA,"","","",2,2,2,"",NA,NA,NA,NA,"","",2,2,2,"",NA,NA,NA,NA,"","",1,1,0,0,0,0,0,0,0,0,1,0,"",0,0,0,0,0,0,0,0,0,1,"keine",0,0,0,0,0,0,0,0,0,1,"keine",3,1,NA,NA,NA,NA,2,NA,NA,NA,"",1,1,3,NA,2,2,3,3,2,2,2,"",1,1,1,1,0,0,1,5,5,5,5,5,5,5,5,5,5,5,5,5,4,4,4,4,4,5,5,4,4,4,4,4,4,4,4,4,5,5,5,4,4,4,4,4,4,4,4,4,4,4,4,4,4,4,2,2,2,2,2,4,4,4,4,4,2,4,4,4,4,4,4,4,1,1,1,1,1,1,1,1,1,1,1,1,1,1,1,5,5,5,5,5,1,1,5,1,1,5,5,5,5,4,1,1,1,1,1,1,1,1,1,4,4,4,4,4,1371.63,5,"zv3h20487gk4emvu",NA,NA,"..","/survey/selfserve/53b/g004/230372?list=1&ID=241183254206571","zspb5dps2vpypekq","241183254206571",24.19145,22.8605,0,71993,"01-07-1993",1993-07-01,358,29,10,29.1,10990,1993,30,3.66666666666667,4,5,5,3,3.5,3,2,4,4,3,3,NA,6,3.6,4,4,3.83333333333333,4,4,4,4,4,2.66666666666667,1.25,1.8,3,1,3,1,2,3.81818181818182,4,4,3.33333333333333,4,4,4,4,4,4,3,2,2,2.66666666666667,46.43,48.33,46.92,60.77,55.62,55.25,56.79,52.42,69.6646807,59.5479307,59.5295994,50.1612094,0.555555555555556,2,3,4,1.9,2.25,1.66666666666667,3.44444444444444,2.66666666666667,4,3.66666666666667,46.43,48.33,53.98,53.35,55.62,55.25,56.79,52.42,68.6483821,58.5316321,60.496906,51.128516,0,1,1,1,5,1.5,2,1.25,2.5,5,5,5,5,4.33333333333333,4.66666666666667,4,4.66666666666667,4,4,4.2,4,4,3.25,3.66666666666667,2,4,4,4,4,4,1,1,1,3.85714285714286,5,2,4,5,5,1.7,2,2.33333333333333,1,4,2,1,5,5,4,4,4,4
"93",133,"2pbhq4x92d4170xh","02/27/2023 20:53","qualified,/Gender/p47uy,/Age/b3xfu,/Total/Total",3,1,1,1,1,1,1,1,59,2,3,"",3,1,"",1,1,6,6.2003,38,38,2,NA,NA,NA,9,"","Erzieherin",5,16,5,1,NA,NA,NA,NA,NA,NA,NA,NA,NA,NA,NA,NA,NA,NA,NA,NA,NA,NA,NA,NA,NA,NA,NA,NA,NA,2,3,4,2,2,1,4,3,3,4,4,4,1,2,2,2,2,2,3,2,4,3,4,2,3,4,3,5,9,6,7,6,5,4,4,4,4,3,4,4,4,4,4,4,4,3,3,3,2,3,4,4,3,4,4,4,4,4,4,4,2,2,1,1,1,2,3,4,3,2,1,1,1,1,1,3,2,1,1,1,5,1,1,1,NA,NA,1,1,1,4,1,1,4,6,3,1,1,1,3,1,2,2,1,1,1,2,1,1,1,1,0,2,4,2,2,2,4,2,2,2,2,4,4,4,4,4,4,4,4,4,4,4,4,4,4,4,3,4,3,3,4,4,4,4,4,4,4,4,4,4,4,3,3,3,3,4,4,4,4,3,3,3,4,3,4,1,1094.562,4,NA,12,NA,5,6,"02/27/2023 20:34",NA,NA,NA,1,"Mozilla/5.0 (Windows NT 10.0; Win64; x64; rv:109.0) Gecko/20100101 Firefox/110.0","dd4fwex044qychqm","23brn4uj0ggb7a59",NA,NA,"..","/survey/selfserve/53b/g004/230146?list=1&ID=237104974311659","23brn4uj0ggb7a59","237104974311659",758,2023-04-17 22:00:00,3,1,1,1,1,1,1,1,58,2,"",2,"",4,8,3,1,1,1,3,1,2,1,1,1,1,1,1,1,1,0,1,2,2,4,2,2,2,4,1,5,2,2,2,3,1,1,2,NA,"",NA,"",1,3,NA,"",NA,NA,0,0,0,0,0,0,0,1,0,"",8,"",1,0,1,0,0,0,0,0,0,0,"","",1,1,2,"",3,NA,NA,NA,NA,NA,"",0,3,NA,NA,NA,"",3,3,2,"",NA,NA,NA,"","","",4,4,3,"",NA,NA,NA,"","","",4,4,3,"",NA,NA,NA,"","","",3,3,3,"",NA,NA,NA,"","","",3,3,1,"sicherheitsbeauftragte",2,NA,2,"","","",NA,NA,3,"",NA,NA,NA,"","","",4,4,1,"sich auf die arbeiti der kita bezogene weiterbildungen",1,4,NA,"","","",NA,NA,1,"stühle",1,4,NA,"","","",NA,NA,3,"",NA,NA,NA,NA,"",NA,3,3,3,"",NA,NA,NA,"",4,4,1,"teilzeitarbeit",2,NA,2,"","","",NA,NA,3,"",NA,NA,NA,"","","",3,1,1,"10 euro pro platz ermäßigung",2,NA,2,"","","",NA,NA,2,"",NA,NA,NA,NA,"","",2,2,2,"",NA,NA,NA,NA,"","",3,3,0,0,0,0,1,1,0,0,0,0,"",0,1,0,0,0,0,0,0,0,0,"",0,1,0,0,0,0,0,0,0,0,"",1,1,NA,NA,NA,NA,1,1,3,NA,"",NA,NA,3,NA,3,3,4,4,3,2,2,"",1,1,2,1,1,1,1,4,4,4,4,4,4,4,4,4,3,4,4,4,4,4,4,4,4,4,4,4,4,4,3,3,3,2,3,3,3,3,3,3,3,1,1,1,1,3,2,2,2,2,2,4,4,4,2,2,4,3,3,3,3,3,3,3,3,4,3,4,4,3,3,3,1,1,1,3,1,2,3,2,2,2,3,2,3,2,2,4,4,4,4,4,4,2,3,2,4,4,4,4,4,3,3,3,2,3,3,3,3,3,3,3,4,3,4,3,3491.21,5,"y3k27fad6ps4pg7f",NA,NA,"..","/survey/selfserve/53b/g004/230372?list=1&ID=241166931201247","y3k27fad6ps4pg7f","241166931201247",18.2427,58.1868333333333,0,62003,"01-06-2003",2003-06-01,239,19,11,19.11,7368,2003,20,3,1.5,3.33333333333333,4,1.5,2,2,2.5,3.5,3,3.33333333333333,3.5,NA,6.6,4,4,3.66666666666667,3.91666666666667,2.8,3.88888888888889,3.66666666666667,4,4,2,1,1.6,2.5,1,2.5,1,1.6,3.72727272727273,4,3.66666666666667,3.33333333333333,3.83333333333333,4,4,4,3.33333333333333,3.66666666666667,3,2,2,2.66666666666667,46.43,54.05,53.98,60.77,45.16,55.25,49.59,45.66,56.9382097,46.8214597,65.5535184,56.1851284,1,2,2,4,2.2,2.5,2,4,4,4,4,46.43,54.05,53.98,60.77,45.16,55.25,49.59,52.42,59.5046437,49.3878937,65.7890368,56.4206468,0.888888888888889,2,2,1,3,1.91666666666667,2.25,1.75,3.25,3.90909090909091,4,4,3.66666666666667,4,4,4,4,4,2.83333333333333,2.13333333333333,4,4,3.75,4,3,3,3.23076923076923,3.4,3,3.25,1.71428571428571,2.33333333333333,2,3.64285714285714,4,2.75,4,4,4,3.1,3,3.33333333333333,3,3.5,1.4,1,1,3,3,1,2,2
"94",136,"r4v20nnm7vn78t93","02/27/2023 22:46","qualified,/Gender/X0TrF,/Age/gcKvr,/Total/Total",3,1,1,1,1,1,1,2,49,1,2,"",2,1,"",1,1,3,3.202,40,40,2,NA,NA,NA,5,"","lagerist",4,9,4,2,2,2,1,NA,75,NA,NA,NA,NA,NA,NA,NA,NA,NA,3,NA,NA,NA,NA,NA,NA,NA,NA,NA,NA,2,3,3,3,4,3,5,3,4,3,3,3,2,3,3,2,2,4,3,2,3,3,1,2,3,3,2,1,4,2,4,3,5,3,3,4,3,4,4,3,3,2,2,3,3,3,3,3,2,2,4,4,4,3,3,2,3,4,3,5,4,1,1,1,1,1,3,3,3,2,2,1,1,1,1,1,1,1,1,1,5,1,1,1,NA,NA,0,2,2,1,1,1,4,8,3,1,1,1,2,1,1,1,0,1,1,1,0,0,0,0,0,1,4,1,1,1,4,2,3,1,2,5,5,4,4,4,5,4,4,4,4,4,3,3,4,4,4,4,3,4,4,4,5,4,4,4,4,4,4,4,4,4,4,3,3,4,4,4,3,3,4,4,4,4,4,1,3195.477,4,NA,10,NA,5,6,"02/27/2023 21:14",NA,NA,NA,1,"Mozilla/5.0 (Windows NT 10.0; Win64; x64) AppleWebKit/537.36 (KHTML, like Gecko) Chrome/109.0.0.0 Safari/537.36","b61nwxgg9gsxzxdj","d71z1evrq8wkp0tk",NA,NA,"..","/survey/selfserve/53b/g004/230146?list=1&ID=237129246474453","d71z1evrq8wkp0tk","237129246474453",625,2023-04-14 20:27:00,3,1,1,1,1,1,1,2,49,2,"",2,"",3,8,3,1,1,1,2,1,1,1,0,0,0,0,0,0,0,0,0,1,1,4,2,2,1,5,2,4,2,3,1,4,1,2,NA,NA,"",NA,"",NA,NA,NA,"",4,4,NA,NA,NA,NA,NA,NA,NA,NA,NA,"",NA,"",0,0,0,0,0,0,1,0,0,0,"","",2,NA,NA,"",2,NA,NA,NA,NA,NA,"",1,2,NA,NA,NA,"",1,1,2,"",NA,NA,NA,"","","",3,3,2,"",NA,NA,NA,"","","",3,3,2,"",NA,NA,NA,"","","",2,2,2,"",NA,NA,NA,"","","",2,2,3,"",NA,NA,NA,"","","",3,3,2,"",NA,NA,NA,"","","",3,3,2,"",NA,NA,NA,"","","",2,2,2,"",NA,NA,NA,"","","",3,3,2,"",NA,NA,NA,NA,"",NA,1,1,2,"",NA,NA,NA,"",3,3,2,"",NA,NA,NA,"","","",3,3,2,"",NA,NA,NA,"","","",2,2,2,"",NA,NA,NA,"","","",2,2,2,"",NA,NA,NA,NA,"","",2,2,2,"",NA,NA,NA,NA,"","",2,2,0,0,0,0,0,0,0,0,0,1,"keine",0,0,0,0,0,0,0,0,0,1,"keine bestimmte",0,0,0,0,0,0,0,0,0,1,"keine",2,1,NA,NA,NA,NA,2,NA,NA,NA,"",3,3,2,NA,2,2,4,3,3,2,2,"",1,1,1,1,0,0,1,4,4,5,4,4,5,4,4,4,4,4,4,5,4,4,5,4,3,4,3,3,4,3,3,3,3,2,3,2,4,3,3,3,4,4,3,3,4,3,3,4,4,3,3,4,4,4,2,2,3,3,3,3,3,3,3,3,3,3,3,3,3,3,3,3,2,3,1,1,1,1,1,1,3,3,1,2,2,2,2,4,2,4,3,3,3,4,3,3,3,3,3,3,3,4,4,3,3,4,4,3,3,4,3,3,3,3,3,3,16954.91,5,"d71z1evrq8wkp0tk",NA,NA,"..","/survey/selfserve/53b/g004/230372?list=1&ID=241183254220907","d71z1evrq8wkp0tk","241183254220907",53.25795,282.581833333333,0,32020,"01-03-2020",2020-03-01,38,3,2,3.02,1250,2020,3,3,3.5,4,3,2.5,2.5,3,2.5,3,1.5,2.66666666666667,3,1,3.6,2.6,3.5,3.33333333333333,3.08333333333333,2.6,3.33333333333333,4,2.66666666666667,3.33333333333333,2.33333333333333,1,1,1,1,1,1,1.4,3.72727272727273,3.6,4,3.66666666666667,4.08333333333333,4.33333333333333,4,4,4,3.5,2,2,2,2.83333333333333,46.43,54.05,53.98,60.77,55.62,55.25,56.79,52.42,67.3650951,57.2483451,64.7640032,55.3956132,0.333333333333333,2,2,4,1.8,2,1.66666666666667,4.33333333333333,4.66666666666667,4,4.33333333333333,46.43,54.05,53.98,60.77,55.62,55.25,56.79,52.42,67.3650951,57.2483451,64.7640032,55.3956132,0,2,1,2,2,1.75,1.25,2,3,4.18181818181818,4.2,4.33333333333333,4,3.83333333333333,4.33333333333333,4.33333333333333,3.33333333333333,3.33333333333333,2.66666666666667,3.4,4,4,3.625,3.83333333333333,3,3,3,3,3,3,1.42857142857143,2,2,3.14285714285714,3.2,3.25,3,3,3,3.5,3.66666666666667,3.66666666666667,3.25,3,1,1,1,3.33333333333333,3.5,3.33333333333333,3.33333333333333,3.5
"95",213,"2885zg8qs9rhhncu","02/28/2023 09:21","qualified,/Gender/p47uy,/Age/gcKvr,/Total/Total",3,1,1,1,1,1,1,1,28,1,3,"",3,1,"",1,1,6,6.2022,30,30,2,NA,NA,NA,10,"","Medizinische Fachangestellte",8,2,1,2,3,3,2,1,29,1,NA,NA,NA,NA,NA,NA,NA,NA,1,2,NA,NA,NA,NA,NA,NA,NA,NA,4,2,2,2,2,1,1,4,2,3,5,5,1,1,1,1,1,2,2,1,1,1,1,2,3,2,3,1,1,8,2,5,2,2,2,2,3,4,1,2,2,1,1,1,1,2,1,2,2,1,1,2,2,2,1,1,1,1,1,1,5,3,4,1,1,1,1,4,2,3,2,4,1,1,1,1,2,5,4,1,1,5,3,1,1,2,5,0,1,1,1,1,1,4,8,3,1,1,2,3,3,3,2,2,1,3,2,1,1,0,1,0,1,4,2,1,3,2,1,3,2,2,3,4,1,2,3,2,2,2,1,4,4,3,2,3,4,2,3,1,4,3,1,1,2,4,4,5,3,4,2,3,2,2,4,4,3,4,2,3,2,5,2,4,3,3,1,4503.596,4,NA,12,NA,5,6,"02/28/2023 08:06",NA,NA,NA,1,"Mozilla/5.0 (Windows NT 10.0; Win64; x64; rv:102.0) Gecko/20100101 Firefox/102.0","c87pdmr7z71524xa","ube43nr6cjeu2xp2",NA,NA,"..","/survey/selfserve/53b/g004/230146?list=1&ID=237129246482523","ube43nr6cjeu2xp2","237129246482523",1057,2023-04-19 07:40:00,3,1,1,1,1,1,1,1,28,2,"",2,"",4,8,3,2,2,4,3,3,5,3,1,2,0,3,0,1,0,3,0,1,1,2,2,1,3,3,3,2,4,2,2,1,1,1,1,1,"",1,"",NA,NA,NA,"",NA,NA,NA,NA,NA,NA,NA,NA,NA,NA,NA,"",NA,"",0,0,0,0,0,0,1,1,0,0,"","",1,2,1,"",3,NA,NA,NA,NA,NA,"",0,1,2,NA,2,"",NA,NA,1,"Fitnessstudio",2,NA,5,"Entfernung zum Büro zu weit weg","","",NA,NA,3,"",NA,NA,NA,"","","",NA,NA,1,"Ernährungstipps",2,NA,2,"","","",NA,NA,3,"",NA,NA,NA,"","","",2,1,3,"",NA,NA,NA,"","","",2,1,1,"Gegen Mobbing",2,NA,2,"","","",NA,NA,1,"Zur Arbeitsmedizinischen Fachkraft",1,3,NA,"","","",NA,NA,1,"Ergonomieberatung, höhenverstellbare Tische",1,5,NA,"","","",NA,NA,3,"",NA,NA,NA,NA,"",NA,3,3,1,"IT-Mitarbeiter",1,2,NA,"",NA,NA,1,"Gleitzeit, Teilzeit, Sabbaticals, etc.",1,5,NA,"","","",NA,NA,3,"",NA,NA,NA,"","","",5,5,1,"Contigentscheine, Betriebseigener Kindergarten",2,NA,2,"","","",NA,NA,3,"",NA,NA,NA,NA,"","",3,2,3,"",NA,NA,NA,NA,"","",2,2,0,0,0,1,0,0,0,0,0,0,"",1,0,0,0,0,0,0,0,0,0,"",1,0,0,0,0,0,0,0,0,0,"",1,1,NA,NA,NA,NA,1,2,NA,2,"",NA,NA,1,1,1,3,4,4,3,4,2,"",3,1,2,2,3,0,3,4,4,5,3,4,5,2,3,2,5,3,2,3,2,5,5,4,4,4,4,3,3,3,4,3,1,2,1,2,2,3,2,3,3,3,1,2,4,3,3,3,4,3,4,2,1,3,5,5,2,3,2,4,5,5,2,1,4,3,2,3,3,2,2,2,3,5,2,1,1,1,1,1,2,1,4,1,1,1,1,4,2,5,2,1,2,1,1,1,1,1,1,1,1,5,3,2,1,2,2,2,1,1,1,4,5,4,5,4,4053.25,5,"987x0yxxfd5p0w3q",NA,NA,"..","/survey/selfserve/53b/g004/230372?list=1&ID=241183254226125","987x0yxxfd5p0w3q","241183254226125",75.0599333333333,67.5541666666667,0,62022,"01-06-2022",2022-06-01,11,0,11,0.11,428,2022,1,2,1,3,3.66666666666667,1,1,2,1,1,2.5,2,2.5,1,3.8,1.6,2.5,1.33333333333333,1.83333333333333,1.4,1.33333333333333,2,1,1,3,1,2.6,3.5,2,3.5,2,1,3,3.2,3,2.66666666666667,2.75,1.33333333333333,4.33333333333333,3,2.33333333333333,3.33333333333333,1,2,3,2.16666666666667,46.43,54.05,53.98,53.35,45.16,40.41,41.53,45.66,48.1713855,38.0546355,65.2015964,55.8332064,1.22222222222222,2,4,4,2.3,3.25,1.66666666666667,2.22222222222222,3.33333333333333,1.66666666666667,1.66666666666667,46.43,48.33,46.92,40.07,45.16,40.41,21.4,38.09,33.4689608,23.3522108,61.072468,51.704078,1.11111111111111,4,3,4,5,2.83333333333333,3.25,2.625,3.75,3.63636363636364,4,3.33333333333333,3.33333333333333,3.5,2.33333333333333,4.66666666666667,4,3,2.16666666666667,2.86666666666667,1,1,1.875,1.66666666666667,2.5,2,2.76923076923077,2.8,3.25,2.25,2,1.66666666666667,1,1.71428571428571,2.8,1.25,1,1,5,2.4,3.33333333333333,3,1.25,4.5,1.6,1,2,2.33333333333333,3,2,3.33333333333333,3.5
"96",215,"4jvhntjxatju9n1k","02/28/2023 08:34","qualified,/Gender/p47uy,/Age/gcKvr,/Total/Total",3,1,1,1,1,1,1,1,26,1,5,"",6,1,"",1,1,6,2.2022,40,42,1,2,2,2,12,"Testing, Inspection, certification","Strategic Market Analyst",7,1,4,2,3,3,1,NA,28,24,NA,NA,NA,NA,NA,NA,NA,NA,4,4,NA,NA,NA,NA,NA,NA,NA,NA,NA,2,3,3,2,3,4,3,2,3,3,3,1,3,1,2,1,1,2,4,2,3,3,2,2,2,2,2,2,5,2,4,3,3,2,2,2,2,2,2,2,2,2,2,2,2,2,3,2,2,2,4,4,4,2,2,2,2,3,3,2,4,4,1,3,1,5,5,5,5,5,5,1,1,1,1,2,4,5,1,5,4,4,1,1,2,80,50,1,1,1,1,1,2,7,4,2,3,1,5,3,4,3,5,4,5,3,5,5,0,2,4,2,4,3,2,1,4,1,2,1,3,1,2,2,1,1,3,1,1,1,4,4,4,4,4,4,3,2,3,2,3,1,1,1,5,5,5,4,3,3,2,2,2,3,3,3,3,4,4,3,3,3,3,3,3,1,724.225,4,NA,10,NA,5,6,"02/28/2023 08:22",NA,NA,NA,1,"Mozilla/5.0 (Windows NT 10.0; Win64; x64) AppleWebKit/537.36 (KHTML, like Gecko) Chrome/109.0.0.0 Safari/537.36","hp2qdx1ee17s5t7u","yz396t4df50q14tc",NA,NA,"..","/survey/selfserve/53b/g004/230146?list=1&ID=237129246473407","yz396t4df50q14tc","237129246473407",1032,2023-04-18 09:27:00,3,1,1,1,1,1,1,1,26,2,"",2,"",2,8,3,1,1,1,2,1,2,1,4,3,4,0,3,4,0,0,0,3,1,5,2,2,1,4,1,4,2,2,1,2,1,3,NA,NA,"",NA,"",NA,NA,NA,"",3,1,NA,NA,NA,NA,NA,NA,NA,NA,NA,"",NA,"",0,0,0,0,0,0,0,0,1,0,"","",1,1,5,"müsste dafür länger arbeiten, da es nicht in die Arbeitszeit gerechnet wird",2,NA,NA,NA,NA,NA,"",3,1,2,NA,3,"",NA,NA,1,"Yogakurs",2,NA,5,"Müsste dafür mehr arbeiten; mache lieber Sport in Freizeit und kostenlos","","",NA,NA,1,"Onlinevortrag zu Resilienz",2,NA,3,"","Konkrete Maßnahmen im Arbeitsalltag anstatt Vortrag nachdem sich am eigentlichen Problem nichts verändert","",NA,NA,2,"",NA,NA,NA,"","","",5,4,2,"",NA,NA,NA,"","","",2,1,1,"Pflichtschulung (online) einmal im Jahr",1,2,NA,"","","",NA,NA,2,"",NA,NA,NA,"","","",4,3,1,"Individuell wählbar aber vom Teambudget abhängig ob es genehmight wird",2,NA,5,"als duale Studentin nicht angedacht","","",NA,NA,1,"Höhenverstellbare Arbeitsplätze",1,5,NA,"","","",NA,NA,2,"",NA,NA,NA,NA,"",NA,3,3,2,"",NA,NA,NA,"",2,2,3,"",NA,NA,NA,"","","",3,3,3,"",NA,NA,NA,"","","",4,4,2,"",NA,NA,NA,"","","",3,3,2,"",NA,NA,NA,NA,"","",5,4,2,"",NA,NA,NA,NA,"","",3,3,0,0,0,1,1,1,0,0,0,0,"",1,0,0,0,0,0,0,0,0,0,"",1,0,0,0,0,0,0,0,0,0,"",1,1,NA,NA,NA,NA,1,2,NA,2,"",NA,NA,3,NA,2,2,3,3,2,1,1,"Bessere Balance zwischen Arbeitszeit und Freizeit",3,3,5,2,80,0,2,4,3,5,4,4,3,3,2,2,3,3,1,1,1,5,5,5,4,3,3,1,1,1,2,3,2,3,3,3,4,4,4,4,4,2,3,3,4,4,4,4,4,4,4,4,4,4,2,1,4,4,3,4,3,4,4,4,2,4,4,3,4,4,4,4,1,3,3,1,1,1,2,2,1,2,1,1,1,2,2,3,1,1,1,4,4,2,4,4,2,1,1,1,4,2,3,4,2,3,2,2,3,2,2,3,4,3,3,3,1176.23,5,"fghs6exdmt9artaw",NA,NA,"..","/survey/selfserve/53b/g004/230372?list=1&ID=241166931205167","fghs6exdmt9artaw","241166931205167",12.0704166666667,19.6038333333333,-50,22022,"01-02-2022",2022-02-01,15,1,3,1.03,548,2022,1,2.66666666666667,3.5,2.66666666666667,2.33333333333333,2,1.5,1.5,3,3,2,2,2,2,3.4,2,2,2,2,2.2,2.88888888888889,4,2,2.66666666666667,5,1,3.4,3,3.66666666666667,3,3.66666666666667,1,3.36363636363636,4,3,2.66666666666667,2.83333333333333,1,5,3.33333333333333,2,3.33333333333333,3,3,3,3,38.41,48.33,38.71,60.77,28.14,40.41,31.62,38.09,37.0253236,26.9085736,57.7041171,48.3357271,3.66666666666667,2,2,3,1.9,1.75,2,1.44444444444444,1.33333333333333,1.33333333333333,1.66666666666667,46.43,54.05,53.98,60.77,55.62,55.25,49.59,52.42,62.1927591,52.0760091,66.8668352,57.4984452,2,1,2,2,4,1.75,2,1.625,2.25,3.27272727272727,4,2.66666666666667,2.66666666666667,2.58333333333333,1,5,3.33333333333333,1,2.66666666666667,3.73333333333333,4,5,4,4.16666666666667,3.5,4,3.84615384615385,3.8,3.75,4,1.71428571428571,1.33333333333333,2,2.35714285714286,2,3.5,1.25,4,4,2.7,3,3,2.25,3.25,2.8,2,3,4,4,2.66666666666667,4,4
"97",216,"jjhevqarm4dyz7nj","02/28/2023 08:44","qualified,/Gender/X0TrF,/Age/gcKvr,/Total/Total",3,1,1,1,1,1,1,2,38,1,3,"",3,3,"",1,1,6,10.2004,0,48,2,NA,NA,NA,8,"","Beamter im mittleren Feuerwehr technischen Dienst",8,1,1,2,4,4,2,2,1,1,1,NA,NA,NA,NA,NA,NA,NA,1,2,2,NA,NA,NA,NA,NA,NA,NA,3,2,4,4,3,3,3,4,4,4,4,4,4,2,2,2,2,2,2,2,2,4,4,4,4,3,3,3,5,1,5,5,5,3,4,4,4,4,4,4,4,4,4,4,4,4,3,3,4,3,4,4,4,4,4,4,4,4,4,4,4,2,2,4,2,2,2,4,4,1,1,1,1,1,1,1,2,3,1,1,1,3,1,1,1,NA,NA,0,1,1,1,1,1,5,10,1,1,1,1,2,1,1,1,0,0,0,0,0,0,0,0,0,1,1,1,1,1,1,1,1,1,1,6,6,6,6,6,6,6,6,6,5,5,5,5,5,5,5,5,5,5,5,5,5,5,5,5,5,5,5,5,5,5,5,5,5,5,5,5,5,1,1,1,1,1,1,1,921.352,13,NA,11,NA,5,6,"02/28/2023 08:28",NA,NA,NA,1,"Mozilla/5.0 (Macintosh; Intel Mac OS X 10_15_7) AppleWebKit/605.1.15 (KHTML, like Gecko) Version/16.3 Safari/605.1.15","f4s53yapjc27e95b","u6u2h7y0b5qz80m5",NA,NA,"..","/survey/selfserve/53b/g004/230146?list=1&ID=237129246472368","u6u2h7y0b5qz80m5","237129246472368",989,2023-04-17 14:18:00,3,1,1,1,1,1,1,2,39,2,"",2,"",5,10,2,1,1,1,1,1,1,1,0,0,0,0,0,0,0,0,0,1,1,1,1,1,1,1,1,1,1,1,1,1,2,2,NA,NA,"",NA,"",NA,NA,NA,"",3,3,NA,NA,NA,NA,NA,NA,NA,NA,NA,"",NA,"",0,0,0,0,0,0,1,0,0,0,"","",1,4,NA,"",2,NA,NA,NA,NA,NA,"",1,2,NA,NA,NA,"",2,2,1,"Sportraum",1,4,NA,"","","",NA,NA,1,"Ausreichend Pausen und Zeit für Sport",1,5,NA,"","","",NA,NA,1,"Kantine",2,NA,2,"","","",NA,NA,3,"",NA,NA,NA,"","","",3,3,1,"Onlinekurse & Schulungen",1,5,NA,"","","",NA,NA,3,"",NA,NA,NA,"","","",4,4,1,"Spezifisch auf die Tätigkeit",1,5,NA,"","","",NA,NA,1,"Höhenverstellbare Tische, ergonomischer Stühle ...",1,5,NA,"","","",NA,NA,1,"Computer, Beamer ...",1,5,NA,NA,"",NA,NA,NA,2,"",NA,NA,NA,"",2,2,2,"",NA,NA,NA,"","","",1,1,1,"Alles",2,NA,2,"","","",NA,NA,2,"",NA,NA,NA,"","","",3,3,1,"Frau werden besonders gefördert",NA,NA,NA,NA,"","",NA,NA,3,"",NA,NA,NA,NA,"","",3,3,0,0,0,0,0,0,0,0,1,0,"",1,1,1,1,1,1,1,1,1,0,"",0,1,0,0,0,0,0,0,1,0,"",1,1,NA,NA,NA,NA,1,1,4,NA,"",NA,NA,1,1,1,1,4,4,4,4,2,"",2,2,1,1,0,0,1,5,5,5,5,5,5,5,5,5,5,5,5,5,5,5,5,5,5,5,5,5,5,5,4,4,4,4,4,4,5,3,4,5,3,4,5,4,5,4,4,5,3,5,4,5,5,5,5,5,5,5,5,4,4,4,3,4,3,3,4,3,3,4,4,4,1,1,1,1,1,1,1,1,1,1,1,1,1,1,1,5,5,5,5,5,5,5,5,5,5,5,5,5,5,5,5,5,5,5,5,5,5,5,5,5,5,5,5,4,1196.39,5,"cf7twt4stytt09b3",NA,NA,"..","/survey/selfserve/53b/g004/230372?list=1&ID=241183254218817","cf7twt4stytt09b3","241183254218817",15.3558666666667,19.9398333333333,0,102004,"01-10-2004",2004-10-01,223,18,7,18.07,6880,2004,19,3.66666666666667,3,4,4,2,2,2,2,4,4,3,3,NA,3.8,4,4,4,4,3.4,4,4,4,4,1,1,1.6,2.5,1,2.5,1,1,5,5,5,5,5,5,5,5,5,5,5,5,5,3,59.45,54.05,53.98,60.77,55.62,55.25,56.79,52.42,67.8370701,57.7203201,67.3689146,58.0005246,0,5,5,5,2.2,3,1.66666666666667,6,6,6,6,52.83,54.05,53.98,60.77,61.83,55.25,56.79,52.42,69.193003,59.076253,66.6843296,57.3159396,0,5,5,5,5,2.33333333333333,3,2,4,5,5,5,5,5,5,5,5,5,4,4.2,1,1,4,3.66666666666667,5,3,3.61538461538462,3.4,3.75,3.75,1,1,1,5,5,5,5,5,1,4.6,5,3.66666666666667,5,5,2.4,1,1,4,4,4.33333333333333,4.33333333333333,4.25
"98",218,"5jzh30skc8zrktcj","02/28/2023 09:17","qualified,/Gender/X0TrF,/Age/gcKvr,/Total/Total",3,1,1,1,1,1,1,2,41,1,5,"",3,1,"",4,1,6,4.2007,40,45,2,NA,NA,NA,1,"","SAP Projektmanager",8,11,1,2,3,3,1,NA,46,22,NA,NA,NA,NA,NA,NA,NA,NA,1,2,NA,NA,NA,NA,NA,NA,NA,NA,NA,2,5,5,5,5,5,5,5,5,5,5,5,1,4,2,1,1,2,1,1,5,5,5,5,5,5,5,3,8,8,7,8,7,4,4,5,4,5,4,4,4,5,4,5,4,5,5,5,4,5,5,5,5,5,5,5,5,5,5,2,3,4,2,1,1,4,5,5,4,3,4,3,3,3,3,5,5,5,1,1,2,5,1,1,3,100,5,3,2,1,4,3,5,10,1,1,1,1,1,1,1,1,0,0,0,0,0,0,0,0,0,1,1,1,1,1,1,1,1,1,1,6,6,6,6,6,6,6,6,6,5,5,5,5,5,5,5,5,5,5,5,5,5,5,5,5,5,5,5,5,5,5,5,5,5,5,5,5,5,5,1,5,1,5,1,1,1628.964,4,NA,10,NA,5,6,"02/28/2023 08:49",NA,NA,NA,1,"Mozilla/5.0 (Windows NT 10.0; Win64; x64) AppleWebKit/537.36 (KHTML, like Gecko) Chrome/110.0.0.0 Safari/537.36","pae2xct5q3dmkb7q","65renr65zrc4frbf",NA,NA,"..","/survey/selfserve/53b/g004/230146?list=1&ID=237129246468209","65renr65zrc4frbf","237129246468209",1026,2023-04-18 07:26:00,3,1,1,1,1,1,1,2,41,2,"",2,"",5,10,1,1,1,1,1,1,1,1,0,0,0,0,0,0,0,0,0,1,1,5,1,1,1,5,1,5,1,1,1,1,1,1,2,NA,"",NA,"",1,5,NA,"",NA,NA,1,0,0,0,0,0,1,0,0,"",1,"",0,0,0,0,0,0,1,0,0,0,"","",2,NA,NA,"",2,NA,NA,NA,NA,NA,"",5,2,NA,NA,NA,"",3,3,2,"",NA,NA,NA,"","","",3,3,2,"",NA,NA,NA,"","","",3,3,2,"",NA,NA,NA,"","","",4,4,2,"",NA,NA,NA,"","","",3,3,1,"Online Schulung",1,4,NA,"","","",NA,NA,2,"",NA,NA,NA,"","","",3,3,2,"",NA,NA,NA,"","","",5,5,1,"Entsprechende Ausstattung",1,5,NA,"","","",NA,NA,2,"",NA,NA,NA,NA,"",NA,5,5,1,"Vorgesetzte(n)",1,4,NA,"",NA,NA,3,"",NA,NA,NA,"","","",3,3,1,"Wiedereingliederung",2,NA,2,"","","",NA,NA,2,"",NA,NA,NA,"","","",1,1,2,"",NA,NA,NA,NA,"","",3,1,2,"",NA,NA,NA,NA,"","",1,1,0,0,0,0,0,0,0,0,0,1,"Keine davon",0,0,0,1,0,0,0,0,0,0,"",0,1,0,1,0,0,0,0,0,0,"",3,1,NA,NA,NA,NA,1,2,NA,2,"",NA,NA,1,1,2,2,4,4,4,3,2,"",5,3,5,3,100,5,5,5,5,5,5,5,5,5,5,5,5,5,5,5,5,5,5,5,5,5,5,5,5,5,4,4,4,4,4,4,5,5,5,5,5,5,5,5,5,5,5,5,5,5,5,5,5,5,1,1,5,5,5,5,5,5,5,5,1,5,5,5,5,5,5,5,1,1,1,1,1,1,1,1,1,1,1,1,1,1,1,5,5,5,5,5,5,3,3,3,4,5,5,5,5,5,5,5,1,5,5,5,5,5,5,5,5,5,5,4,1672.46,5,"uyezdghahcc16gvj",NA,NA,"..","/survey/selfserve/53b/g004/230372?list=1&ID=241183254210742","uyezdghahcc16gvj","241183254210742",27.1494,27.8743333333333,0,42007,"01-04-2007",2007-04-01,193,16,1,16.01,5968,2007,16,5,5,5,5,2.5,1.5,1.5,1,5,5,5,5,3,7.6,4.2,4.25,4.66666666666667,4.33333333333333,4.8,5,5,5,5,3.66666666666667,3,3.4,5,2.33333333333333,5,2.33333333333333,2.6,5,5,5,5,5,5,5,5,5,5,5,5,5,5,59.45,54.05,53.98,60.77,61.83,55.25,56.79,52.42,69.432978,59.316228,68.008793,58.640403,0,5,5,5,2.2,3,1.66666666666667,6,6,6,6,59.45,54.05,53.98,60.77,61.83,55.25,56.79,52.42,69.432978,59.316228,68.008793,58.640403,0,1,1,1,5,1.33333333333333,2,1,3.75,5,5,5,5,5,5,5,5,5,4,5,5,5,5,5,5,5,5,5,5,5,1,1,1,4.5,5,3.5,4.75,5,5,5,5,5,5,5,2.4,3,4,5,5,5,5,5
"99",220,"dfwrmgj6bdcf1yzc","02/28/2023 12:58","qualified,/Gender/X0TrF,/Age/b3xfu,/Total/Total",3,1,1,1,1,1,1,2,56,2,3,"",4,1,"",1,1,4,6.2022,40,45,1,2,2,2,6,"","Administrator",7,2,1,2,3,3,2,1,47,12,NA,NA,NA,NA,NA,NA,NA,NA,1,2,NA,NA,NA,NA,NA,NA,NA,NA,2,2,1,1,5,4,5,5,5,5,5,5,5,1,5,2,3,1,4,1,1,5,5,5,5,4,4,4,1,3,3,3,3,2,2,3,3,4,3,2,2,3,3,4,4,3,4,4,4,4,4,4,3,4,4,5,4,4,4,4,5,5,5,5,5,5,4,5,5,4,3,4,4,4,4,3,4,5,3,4,4,5,3,1,1,1,1,0,6,5,5,5,5,5,10,5,4,4,5,2,2,2,2,0,0,0,0,0,0,0,0,0,3,2,3,3,3,2,2,3,3,3,6,6,6,6,6,6,6,6,6,5,5,4,5,5,5,5,4,4,4,4,5,5,5,5,5,5,5,5,5,5,5,5,5,5,5,5,5,5,2,4,2,3,4,3,1,8573.558,4,NA,10,NA,5,6,"02/28/2023 09:53",NA,NA,NA,1,"Mozilla/5.0 (Windows NT 10.0; Win64; x64) AppleWebKit/537.36 (KHTML, like Gecko) Chrome/108.0.0.0 Safari/537.36 Edg/108.0.1462.76","cga4rzfwnnepmg6v","tx14v5natv5mm49g",NA,NA,"..","/survey/selfserve/53b/g004/230146?list=1&ID=237111539453021","tx14v5natv5mm49g","237111539453021",827,2023-04-15 16:31:00,3,1,1,1,1,1,1,2,56,2,"",2,"",5,8,5,4,4,5,4,3,3,3,0,0,4,4,4,0,3,3,2,3,3,3,3,3,3,3,3,3,3,3,3,3,1,2,NA,NA,"",NA,"",NA,NA,NA,"",3,3,NA,NA,NA,NA,NA,NA,NA,NA,NA,"",NA,"",1,0,0,0,0,0,0,0,0,0,"","",2,NA,NA,"",2,NA,NA,NA,NA,NA,"",0,2,NA,NA,NA,"",3,3,2,"",NA,NA,NA,"","","",3,3,2,"",NA,NA,NA,"","","",3,3,2,"",NA,NA,NA,"","","",3,3,2,"",NA,NA,NA,"","","",3,1,2,"",NA,NA,NA,"","","",1,1,2,"",NA,NA,NA,"","","",3,1,2,"",NA,NA,NA,"","","",1,1,2,"",NA,NA,NA,"","","",1,1,2,"",NA,NA,NA,NA,"",NA,2,2,2,"",NA,NA,NA,"",1,1,2,"",NA,NA,NA,"","","",1,2,2,"",NA,NA,NA,"","","",2,2,2,"",NA,NA,NA,"","","",1,1,2,"",NA,NA,NA,NA,"","",2,2,2,"",NA,NA,NA,NA,"","",2,2,0,0,0,0,0,0,0,0,0,1,"nichts",0,0,0,0,0,0,0,0,0,1,"nichts",0,0,0,0,0,0,0,0,0,1,"nichts",2,1,NA,NA,NA,NA,2,NA,NA,NA,"",3,3,3,NA,2,2,2,2,1,1,2,"",2,1,4,2,55,50,2,2,2,2,2,2,2,2,2,2,2,2,3,3,3,3,3,3,3,3,3,3,3,3,2,1,2,2,3,3,3,3,3,3,3,3,3,3,3,3,3,3,3,3,3,3,3,3,3,3,3,3,3,3,3,3,3,3,3,3,3,3,3,3,3,3,3,3,3,3,3,3,3,3,3,3,3,3,3,1,1,3,3,3,3,3,3,3,3,3,3,3,3,3,4,3,3,3,3,3,3,3,3,3,3,3,3,3,3,1,19951.68,5,"q6tr3eea68eerd75",NA,NA,"..","/survey/selfserve/53b/g004/230372?list=1&ID=241166931202285","q6tr3eea68eerd75","241166931202285",142.892633333333,332.528,50,62022,"01-06-2022",2022-06-01,11,0,11,0.11,428,2022,1,2.33333333333333,4.5,5,5,3,2.5,2.5,1,5,5,4,4,1,2.8,2.8,3,3.33333333333333,3,4,4,3.66666666666667,4.33333333333333,4,3.66666666666667,3.75,4,4.5,3.66666666666667,4.5,3.66666666666667,5.2,4.54545454545455,4.8,4.66666666666667,4,5,5,5,5,5,5,2,3,3,2.66666666666667,32.56,30.31,28.32,31.48,55.62,49.47,49.59,45.66,67.5499465,57.4331965,33.9105501,24.5421601,0,4,4,3,3.1,3.25,3,6,6,6,6,32.56,30.31,28.32,31.48,35.81,40.41,41.53,38.09,51.8640141,41.7472641,33.8460707,24.4776807,2.22222222222222,3,3,3,3,3,3,3,1.5,2,2,2,2,3,3,3,3,3,2.16666666666667,3,3,3,3,3,3,3,3,3,3,3,3,3,1,3.07142857142857,3,3,3,4,3,3,3,3,3,3,4.8,1,6,3,3,3,3,3
"100",221,"z6ag2yxyvz94amz4","02/28/2023 10:53","qualified,/Gender/X0TrF,/Age/b3xfu,/Total/Total",3,1,1,1,1,1,1,2,63,2,5,"",4,1,"",2,1,4,8.2002,40,40,2,NA,NA,NA,9,"","Personalleiter",8,8,2,2,2,2,1,NA,64,NA,NA,NA,NA,NA,NA,NA,NA,NA,1,NA,NA,NA,NA,NA,NA,NA,NA,NA,NA,2,3,5,3,5,4,4,4,4,5,4,3,1,2,2,2,2,2,1,1,5,4,4,3,4,4,3,1,7,3,5,9,3,3,3,4,3,3,3,4,3,3,2,4,3,2,4,4,2,3,3,5,4,5,5,4,4,4,4,5,3,3,2,4,2,2,5,5,5,3,3,1,1,1,1,3,2,2,2,5,5,2,1,1,1,0,0,3,3,2,1,1,5,8,3,1,1,1,2,1,1,1,2,2,0,2,1,0,0,0,0,2,4,2,3,1,4,1,2,2,3,4,5,5,5,5,6,6,4,4,4,5,4,5,5,4,4,3,3,3,4,5,5,5,5,5,5,4,4,4,5,5,5,5,4,5,5,5,5,4,2,4,3,4,2,1,1167.751,4,NA,12,NA,5,6,"02/28/2023 10:33",NA,NA,NA,1,"Mozilla/5.0 (Windows NT 10.0; Win64; x64; rv:109.0) Gecko/20100101 Firefox/110.0","mpum2fmmqx02pgg6","d3yzzeap4jcpg98d",NA,NA,"..","/survey/selfserve/53b/g004/230146?list=1&ID=237129246467172","wmd023vr2v191g2g","237129246467172",1040,2023-04-18 17:56:00,3,1,1,1,1,1,1,2,63,2,"",2,"",5,9,3,2,1,2,2,1,1,1,1,2,0,0,0,1,0,0,0,1,1,4,3,3,1,4,2,4,2,2,1,4,1,1,2,NA,"",NA,"",1,4,NA,"",NA,NA,1,0,0,0,0,0,0,0,0,"",1,"",0,1,0,0,0,0,1,0,0,0,"","",1,3,NA,"",1,6,5,2,NA,4,"",2,1,2,NA,4,"",NA,NA,1,"Fitnessklubbeiträge werden bei einer bestimmten anzahl gänzlich übernommen",1,3,NA,"","","",NA,NA,2,"",NA,NA,NA,"","","",NA,NA,1,"im Kantine gibt es vegane ,salzarme Kost und diverse Fleischersatzproukte zur auswahl.",1,3,NA,"","","",NA,NA,2,"",NA,NA,NA,"","","",3,1,1,"wir haben einen hauptamtlichen Mitarbeiter der dafür zuständig ist anhand von aktuellen listen der BG arbeitet.",2,NA,4,"","","einfach ein wenig mehr rücksichtnahme der Mitarbeiter und studierenden untereinander hilft dabei am meisten . Diese Gedankenlosigkeit sollte immer wieder herausgefordert werden mehr auf einander zu achten",NA,NA,2,"",NA,NA,NA,"","","",4,4,1,"hier kann ich nicht aus die Spezifischen Angebote eingehen aber für jeden der Beschäftigten gibt es Angebote",1,4,NA,"","","",NA,NA,2,"",NA,NA,NA,"","","",4,4,2,"",NA,NA,NA,NA,"",NA,3,3,1,"hier haben wir Kollegen die sich um Probleme kümmern sei es mit den Programmen oder der Hardware",1,5,NA,"",NA,NA,1,"flexible Arbeitszeiten wenn sie in den Lehrplan integriert werden können und umsetzbar sind .",2,NA,4,"","","der Lehrkörper würde sich das ganz gerne wünschen .",NA,NA,2,"",NA,NA,NA,"","","",3,1,2,"",NA,NA,NA,"","","",3,1,2,"",NA,NA,NA,NA,"","",5,1,2,"",NA,NA,NA,NA,"","",2,2,0,0,0,0,0,0,0,1,0,0,"",0,0,0,0,0,0,0,0,0,1,"keine davon",1,0,0,0,0,0,0,0,0,0,"",2,1,NA,NA,NA,NA,1,1,4,NA,"",NA,NA,1,1,2,2,3,3,3,2,1,"mehr angebote für die Fitness /Gesundtheitprävenzion",1,3,1,1,0,0,4,5,5,4,5,5,5,4,4,3,4,4,5,5,4,5,5,5,5,5,4,5,5,5,3,4,3,4,3,3,5,4,5,5,5,5,5,5,5,4,4,4,5,4,4,4,3,4,3,2,4,5,5,4,5,4,4,4,2,4,4,4,5,5,4,4,2,3,2,1,1,1,1,1,1,3,1,1,1,1,1,5,4,5,5,4,4,2,4,4,4,4,4,3,4,4,3,4,4,4,4,4,4,4,5,4,5,4,4,4,1902.03,5,"mhtehc2m3kf5r7g1",NA,NA,"..","/survey/selfserve/53b/g004/230372?list=1&ID=241183254209694","pkdxczv2nn12u7f6","241183254209694",19.4625166666667,31.7005,0,82002,"01-08-2002",2002-08-01,249,20,9,20.09,7672,2002,21,3.66666666666667,4.5,4,4,1.5,2,2,1,4.5,3.5,3.66666666666667,4,1,5.4,3,3.25,3.33333333333333,3.16666666666667,3,4.22222222222222,4,4.66666666666667,4,3.66666666666667,1,2.8,2.5,3,2.5,3,2,4,4.6,3.66666666666667,3.33333333333333,4.75,5,5,4,5,4.83333333333333,4,3,4,3.83333333333333,46.43,54.05,53.98,60.77,55.62,55.25,56.79,52.42,67.3650951,57.2483451,64.7640032,55.3956132,0.777777777777778,2,2,3,2,2,2,4.88888888888889,4.66666666666667,5.33333333333333,4.66666666666667,46.43,48.33,53.98,53.35,55.62,55.25,56.79,52.42,68.6483821,58.5316321,60.496906,51.128516,0.444444444444444,2,2,2,2,1.91666666666667,1.5,2.125,2.75,4.36363636363636,4.8,4.33333333333333,3.66666666666667,4.83333333333333,4.66666666666667,5,4.66666666666667,5,3.33333333333333,4.6,3,4,4,3.66666666666667,5,4,4.23076923076923,4,4.25,4.5,1.57142857142857,1.33333333333333,1,4,4.6,3.5,3.75,4,2,3.8,3.66666666666667,3.33333333333333,4.25,4.25,2.6,1,5,4.66666666666667,5,5,4.33333333333333,4.25
"101",222,"0n3ugz8tu5anubf5","03/01/2023 17:06","qualified,/Gender/p47uy,20230301_12:51_v2,/HomeOffice/oPdDr,/Age/b3xfu,/Total/Total",3,1,1,1,1,1,1,1,64,2,3,"",3,1,"",1,1,6,8.1979,34,0,2,NA,NA,NA,5,"","Sachbearbeiter",6,10,5,1,NA,NA,NA,NA,NA,NA,NA,NA,NA,NA,NA,NA,NA,NA,NA,NA,NA,NA,NA,NA,NA,NA,NA,NA,NA,2,2,4,3,4,3,2,2,3,3,3,3,1,1,2,2,1,3,1,1,4,4,3,4,4,4,4,5,6,10,10,8,9,4,4,4,4,3,4,4,4,4,4,3,4,4,3,4,4,3,2,3,2,2,2,2,2,2,2,3,3,3,3,3,3,3,5,5,4,3,4,3,1,1,1,2,1,3,2,2,4,3,1,1,2,22,1,1,1,1,1,1,4,10,2,1,1,1,2,1,1,1,1,1,1,1,1,1,1,1,1,1,1,1,1,1,1,1,1,1,1,4,4,5,5,6,5,5,5,5,4,4,4,4,4,4,4,4,4,4,4,3,4,4,4,4,4,4,4,4,4,4,4,4,4,4,4,4,4,4,3,3,3,4,4,1,774.427,4,NA,10,NA,1,1,"02/28/2023 10:58",NA,NA,NA,1,"Mozilla/5.0 (Windows NT 10.0; Win64; x64) AppleWebKit/537.36 (KHTML, like Gecko) Chrome/110.0.0.0 Safari/537.36 Edg/110.0.1587.57","hd1z3js3wzsdb34g","s2bqu0d1fqpr86v0",NA,NA,"si","/survey/selfserve/53b/g004/230146?list=1&ID=237111539450947","s2bqu0d1fqpr86v0","237111539450947",693,2023-04-15 05:12:00,3,1,1,1,1,1,1,1,64,2,"",2,"",4,7,3,2,2,2,3,2,2,2,1,2,1,2,1,1,1,1,1,5,3,4,3,3,2,5,1,5,2,1,1,2,1,1,2,NA,"",NA,"",2,NA,2,"",NA,NA,0,0,0,0,0,0,0,1,0,"",6,"",0,0,0,0,0,0,0,1,0,0,"","",1,3,NA,"",1,6,5,2,NA,2,"",5,1,2,NA,2,"",NA,NA,1,"Fitness",2,NA,2,"","","",NA,NA,3,"",NA,NA,NA,"","","",NA,NA,3,"",NA,NA,NA,"","","",3,4,3,"",NA,NA,NA,"","","",3,1,1,"regelmäßige Schulungen",1,4,NA,"","","",NA,NA,3,"",NA,NA,NA,"","","",3,4,1,"über verschiedene Themen",1,5,NA,"","","",NA,NA,1,"Schreibtische Stühle",1,5,NA,"","","",NA,NA,3,"",NA,NA,NA,NA,"",NA,3,3,3,"",NA,NA,NA,"",4,4,3,"",NA,NA,NA,"","","",3,3,3,"",NA,NA,NA,"","","",3,3,3,"",NA,NA,NA,"","","",1,1,3,"",NA,NA,NA,NA,"","",4,4,3,"",NA,NA,NA,NA,"","",1,1,0,0,0,1,0,0,0,0,0,0,"",0,0,0,0,0,1,0,0,0,0,"",0,1,0,0,0,0,0,0,0,0,"",1,1,NA,NA,NA,NA,1,2,NA,2,"",NA,NA,1,1,1,1,5,5,4,4,2,"",5,4,2,1,0,1,1,5,5,5,5,5,5,5,5,5,5,5,3,3,4,3,3,3,3,3,3,3,3,3,2,2,2,2,2,2,4,4,3,4,4,4,2,3,3,3,3,3,3,3,3,4,4,4,2,2,3,3,3,3,2,3,3,3,3,3,3,3,3,3,3,3,1,1,1,1,1,1,1,1,1,1,1,1,1,4,1,4,3,3,3,3,3,3,3,3,3,3,3,3,3,3,3,3,3,3,3,3,3,3,3,4,4,3,3,4,957.53,1,"cthnvsmfb6b8fapj",NA,NA,"si","/survey/selfserve/53b/g004/230372?list=1&ID=241183254206570","cthnvsmfb6b8fapj","241183254206570",12.9071166666667,15.9588333333333,0,81979,"01-08-1979",1979-08-01,525,43,9,43.09,16073,1979,44,3,3.5,2.33333333333333,3,1,2,2,1,4,3.5,4,4,NA,8.6,4,4,3.33333333333333,3.83333333333333,3.6,2.11111111111111,2.33333333333333,2,2,3.66666666666667,1.5,2,1.5,2.33333333333333,1.5,2.33333333333333,1,4,4,4,4,3.91666666666667,3.66666666666667,4,4,4,4,3,3,2,3.16666666666667,52.83,54.05,53.98,60.77,55.62,55.25,56.79,52.42,67.5970951,57.4803451,66.0444512,56.6760612,1,5,5,5,2.2,3,1.66666666666667,4.88888888888889,4.66666666666667,5,5,46.43,48.33,46.92,53.35,45.16,49.47,49.59,45.66,58.1919811,48.0752311,57.7267108,48.3583208,1.22222222222222,2,1,1,4,2,2,2,4.5,5,5,5,5,3.08333333333333,3.33333333333333,3,3,3,2,3.26666666666667,4,4,3.625,3.83333333333333,3,3,2.92307692307692,3,2.75,3,1,1,2.5,3.07142857142857,3.2,3,3,3,3,3,3,3,3,3.5,3,1,1,3.66666666666667,4,3,3,3
"102",223,"81v6yg6h2y9686bv","02/28/2023 11:39","qualified,/Gender/p47uy,/Age/gcKvr,/Total/Total",3,1,1,1,1,1,1,1,53,1,5,"",6,1,"",1,1,6,7.2013,39,3,2,NA,NA,NA,10,"","Sekretärin",5,3,3,2,2,2,1,NA,1,NA,NA,NA,NA,NA,NA,NA,NA,NA,2,NA,NA,NA,NA,NA,NA,NA,NA,NA,NA,2,2,3,5,3,3,1,3,1,2,2,4,2,2,5,4,1,5,1,3,4,1,3,1,1,2,2,1,2,2,2,5,1,4,4,4,2,2,3,5,2,3,3,2,1,1,4,2,1,1,1,2,2,2,3,2,2,3,2,5,5,5,1,1,1,4,5,4,2,4,3,1,1,1,1,1,1,1,1,1,5,1,1,1,NA,NA,0,2,1,2,1,1,4,9,4,3,3,4,3,4,4,4,5,5,2,1,5,4,2,1,1,4,2,5,4,2,2,2,4,1,3,2,3,0,0,0,2,2,1,1,4,4,4,4,3,3,3,2,3,2,3,1,1,1,5,5,5,3,3,1,2,2,2,4,4,4,4,2,4,3,4,2,4,3,3,1,1187.3,4,NA,10,NA,5,6,"02/28/2023 11:19",NA,NA,NA,1,"Mozilla/5.0 (Windows NT 10.0; Win64; x64) AppleWebKit/537.36 (KHTML, like Gecko) Chrome/110.0.0.0 Safari/537.36 Edg/110.0.1587.50","nwrvp32g1a39p617","6v5j263h6rstcn02",NA,NA,"..","/survey/selfserve/53b/g004/230146?list=1&ID=237129246472372","t2tjkjt2873w07es","237129246472372",553,2023-04-14 14:23:00,3,1,1,1,1,1,1,1,54,2,"",2,"",2,7,4,1,2,4,5,4,4,3,3,5,5,3,4,4,3,3,2,3,4,2,4,4,3,4,2,2,4,4,2,3,1,1,2,NA,"",NA,"",2,NA,3,"",NA,NA,1,0,0,0,0,1,0,0,0,"",1,"",1,0,0,0,0,1,1,0,0,0,"","",1,3,NA,"",2,NA,NA,NA,NA,NA,"",2,3,NA,NA,NA,"",1,1,3,"",NA,NA,NA,"","","",4,4,1,"weiß nicht mehr",2,NA,4,"","","Angebote sind schön u gut, aber der Stresslevel, den Vorgesetzte ansetzen, wirkt sich negativ auf eigene Gesundheit aus u auf Teamgeist, falls überhaupt noch vorhanden",4,4,3,"",NA,NA,NA,"","","",4,3,3,"",NA,NA,NA,"","","",4,1,3,"",NA,NA,NA,"","","",4,1,3,"",NA,NA,NA,"","","",4,2,3,"",NA,NA,NA,"","","",5,5,3,"",NA,NA,NA,"","","",5,5,3,"",NA,NA,NA,NA,"",NA,4,4,3,"",NA,NA,NA,"",4,5,1,"teilweise AZ-Reduzierung",2,NA,5,"Zustimmung Chef schwierig","","",NA,NA,3,"",NA,NA,NA,"","","",3,1,1,"Ferienprogramm, Betriebskita",2,NA,2,"","","",NA,NA,3,"",NA,NA,NA,NA,"","",5,4,3,"",NA,NA,NA,NA,"","",3,1,0,0,0,0,0,1,0,0,0,0,"",1,0,0,0,0,0,1,0,0,0,"",1,0,0,0,0,1,0,0,0,0,"",1,1,NA,NA,NA,NA,1,1,1,NA,"",NA,NA,1,1,3,2,3,4,4,2,1,"Aquafitness",1,1,3,1,0,0,4,4,4,3,4,3,3,3,1,2,1,2,1,1,1,5,5,5,3,3,2,3,3,3,3,3,2,2,3,3,5,4,4,4,3,4,2,2,3,3,3,3,3,3,3,4,3,4,4,4,4,5,4,4,4,3,4,4,3,3,3,3,4,4,4,4,3,4,4,1,3,3,4,1,1,5,1,1,1,2,2,2,2,2,2,3,4,3,2,2,2,2,3,2,3,1,1,3,5,1,1,5,4,2,2,2,4,1,3,2,1446.49,5,"6v5j263h6rstcn02",NA,NA,"..","/survey/selfserve/53b/g004/230372?list=1&ID=241183254218820","t2tjkjt2873w07es","241183254218820",19.7883333333333,24.1081666666667,0,72013,"01-07-2013",2013-07-01,118,9,10,9.1,3685,2013,10,3.33333333333333,3,1.66666666666667,2.66666666666667,2,4.5,3,2,2.5,2,1.66666666666667,1.5,1,2.4,3.8,2.75,1.66666666666667,2.91666666666667,1.8,2.11111111111111,1.66666666666667,2.33333333333333,2.33333333333333,3,1,1,1,1,1,1,1.4,3.18181818181818,3.8,2.66666666666667,2.66666666666667,2.58333333333333,1,5,2.33333333333333,2,3.66666666666667,2,2,3,2.5,38.41,40.07,38.71,40.07,45.16,29.53,31.62,29.25,37.8279066,27.7111566,49.4604775,40.0920875,2.88888888888889,4,4,3,3.3,2.5,3.83333333333333,1.22222222222222,1.66666666666667,0.666666666666667,1.33333333333333,38.41,54.05,46.92,40.07,28.14,29.53,31.62,38.09,32.7300964,22.6133464,56.340103,46.971713,3.55555555555556,4,2,4,3,3.33333333333333,2.5,3.75,3.25,2.72727272727273,3.6,2.33333333333333,1.66666666666667,2.91666666666667,1,5,2.66666666666667,3,2.66666666666667,3.26666666666667,2,2,3.5,3.16666666666667,4.5,3,3.61538461538462,3.2,3.75,4,3.14285714285714,1.66666666666667,2,2.42857142857143,2.2,2.75,2.25,3,1,2.1,1.66666666666667,1,3.25,2.5,2.4,1,2,4.33333333333333,3.5,2.66666666666667,3,3
"103",224,"ze1ma53x3j07ukmm","02/28/2023 12:53","qualified,/Gender/X0TrF,/Age/gcKvr,/Total/Total",3,1,1,1,1,1,1,2,50,1,5,"",4,1,"",1,1,6,7.1994,35,50,2,NA,NA,NA,1,"","Junge für alles",8,2,3,2,2,2,1,NA,49,NA,NA,NA,NA,NA,NA,NA,NA,NA,1,NA,NA,NA,NA,NA,NA,NA,NA,NA,NA,2,4,4,4,5,5,3,2,3,5,5,3,2,1,3,5,1,3,1,1,3,3,5,3,5,4,4,4,5,2,9,9,10,2,1,1,1,1,1,2,1,1,1,1,1,5,5,3,3,4,4,5,4,5,5,5,4,4,5,2,2,2,1,1,1,2,5,5,5,5,5,1,1,1,1,4,5,5,3,5,2,5,1,3,3,100,95,1,1,1,4,3,5,10,1,1,1,1,1,1,1,1,0,1,1,0,0,0,5,0,0,1,4,1,1,1,5,1,3,1,5,6,6,6,6,6,6,6,6,6,5,5,5,5,5,5,5,5,2,2,5,5,5,5,5,5,5,5,5,5,5,5,5,5,5,5,5,5,5,5,1,5,1,5,1,1,1281.599,13,NA,11,NA,5,6,"02/28/2023 12:31",NA,NA,NA,1,"Mozilla/5.0 (Macintosh; Intel Mac OS X 10_15_7) AppleWebKit/605.1.15 (KHTML, like Gecko) Version/16.3 Safari/605.1.15","4a5j0wegxcq7sg85","90dux8bh2rqq3zz1",NA,NA,"..","/survey/selfserve/53b/g004/230146?list=1&ID=237104974310609","90dux8bh2rqq3zz1","237104974310609",806,2023-04-15 09:07:00,3,1,1,1,1,1,1,2,50,2,"",2,"",5,10,1,1,1,1,1,1,1,1,0,0,0,0,0,0,0,0,0,3,1,1,1,1,1,1,1,1,1,1,1,5,1,1,2,NA,"",NA,"",2,NA,2,"",NA,NA,1,0,0,0,0,0,0,0,0,"",1,"",0,0,0,0,0,0,0,1,0,0,"","",1,1,3,"",1,5,5,2,NA,2,"",5,1,2,NA,2,"",NA,NA,2,"",NA,NA,NA,"","","",1,1,1,"coaching",2,NA,2,"","","",1,1,3,"",NA,NA,NA,"","","",1,1,1,"entzug fallss nötig,coaching",2,NA,2,"","","",NA,NA,1,"pflicht veranstalltung",1,1,NA,"","","",NA,NA,1,"seminare",2,NA,3,"","keins","",NA,NA,1,"seminare",2,NA,2,"","","",NA,NA,1,"online schulung",2,NA,2,"","","",NA,NA,1,"coaching",2,NA,2,NA,"",NA,NA,NA,3,"",NA,NA,NA,"",1,1,1,"flexibele arbeitszeiten",1,5,NA,"","","",NA,NA,1,"Wiedereinstiegsprogramme",2,NA,2,"","","",NA,NA,2,"",NA,NA,NA,"","","",1,1,1,"bevorzugte Stellenbesetzung mit Frauen",NA,NA,NA,NA,"","",NA,NA,2,"",NA,NA,NA,NA,"","",1,1,0,0,0,0,0,1,0,1,1,0,"",0,0,0,0,0,0,0,0,0,1,"keins",0,0,0,0,0,0,0,0,0,1,"keins",1,3,2,NA,1,1,1,2,NA,2,"",NA,NA,1,1,2,2,3,3,1,3,2,"",5,5,5,3,100,98,4,5,4,5,5,5,5,5,5,2,5,5,5,5,5,5,5,5,5,5,5,5,5,5,3,3,3,2,4,2,5,4,5,5,5,5,5,5,5,5,5,5,5,5,5,5,5,5,1,1,5,4,4,5,5,5,5,4,1,5,5,4,5,5,5,5,1,4,1,1,1,1,1,1,1,1,1,1,1,1,1,5,5,5,5,4,1,1,1,1,5,4,4,4,1,1,1,1,1,1,1,4,4,3,2,5,5,5,4,3,1330.37,5,"hyv402yf0xqrgd3g",NA,NA,"..","/survey/selfserve/53b/g004/230372?list=1&ID=241183254200343","hyv402yf0xqrgd3g","241183254200343",21.3599833333333,22.1728333333333,3,71994,"01-07-1994",1994-07-01,346,28,10,28.1,10625,1994,29,4,5,2.66666666666667,4.33333333333333,1.5,4,2,1,3,4,4.33333333333333,4.5,4,7,1.4,1,1,1.16666666666667,4,4.55555555555556,4.33333333333333,5,4.33333333333333,5,1,4.4,4.5,4.33333333333333,4.5,4.33333333333333,2,4.45454545454545,5,5,3,5,5,5,5,5,5,5,5,5,5,59.45,54.05,53.98,60.77,61.83,55.25,56.79,52.42,69.432978,59.316228,68.008793,58.640403,0.777777777777778,2,1,1,1.3,1,1.5,6,6,6,6,59.45,54.05,53.98,60.77,61.83,55.25,56.79,52.42,69.432978,59.316228,68.008793,58.640403,0,5,5,5,1,2,2,2,2.5,4.63636363636364,4.8,5,4,5,5,5,5,5,2.83333333333333,4.93333333333333,5,5,4.75,5,4,5,4.84615384615385,4.8,4.75,5,1.42857142857143,1,1,3.28571428571429,4.8,1,4.25,1,5,2.3,1,2.33333333333333,3.25,4.75,1.4,4,4,4.66666666666667,5,5,5,5
"104",230,"sa7cqqsdn7vms0bq","02/28/2023 14:43","qualified,/Gender/X0TrF,/Age/b3xfu,/Total/Total",3,1,1,1,1,1,1,2,60,2,5,"",6,1,"",4,2,4,7.1998,40,40,2,NA,NA,NA,5,"","Wirtschaftsinformatiker",8,2,1,2,3,3,2,1,61,17,NA,NA,NA,NA,NA,NA,NA,NA,1,2,NA,NA,NA,NA,NA,NA,NA,NA,3,2,5,5,4,5,5,5,4,5,5,4,5,2,3,3,4,2,2,2,1,5,5,5,5,4,5,5,3,9,9,2,9,9,NA,NA,NA,NA,NA,NA,NA,NA,NA,NA,NA,NA,5,5,4,4,5,4,4,4,5,5,4,5,5,4,4,4,4,3,3,3,3,5,5,4,5,5,4,3,3,3,5,4,4,4,3,4,5,3,3,2,80,70,5,6,4,5,7,5,9,2,2,1,2,1,1,1,1,1,0,0,0,0,0,0,0,0,2,1,1,2,1,1,1,1,2,3,5,5,6,6,6,6,6,5,5,5,5,5,5,5,5,3,4,2,3,3,5,5,5,5,5,5,5,5,5,5,5,5,5,5,5,5,5,5,3,3,3,3,3,3,1,1150.031,4,NA,12,NA,5,6,"02/28/2023 14:23",NA,NA,NA,1,"Mozilla/5.0 (Windows NT 10.0; Win64; x64; rv:109.0) Gecko/20100101 Firefox/110.0","htr093j5qffnhapt","c3areq9y5b94vyj6",NA,NA,"..","/survey/selfserve/53b/g004/230146?list=1&ID=237129246467168","6hxg5fmkrqmqss92","237129246467168",19,2023-04-06 16:30:00,3,1,1,1,1,1,1,2,60,2,"",2,"",5,10,2,2,1,2,1,1,1,1,0,0,0,0,0,0,0,0,0,1,1,2,1,2,1,1,1,1,2,1,1,1,1,1,1,5,"",8,"",NA,NA,NA,"",NA,NA,NA,NA,NA,NA,NA,NA,NA,NA,NA,"",NA,"",1,1,0,1,0,0,1,0,0,0,"","Relgionsgemeinschaft",2,NA,NA,"",2,NA,NA,NA,NA,NA,"",4,2,NA,NA,NA,"",2,2,2,"",NA,NA,NA,"","","",1,5,1,"Yoga",1,5,NA,"","","",5,5,2,"",NA,NA,NA,"","","",1,1,2,"",NA,NA,NA,"","","",1,1,2,"",NA,NA,NA,"","","",1,1,2,"",NA,NA,NA,"","","",1,1,1,"Berufbezogene Kurse",1,5,NA,"","","",NA,NA,1,"Richtiger Einsatz",1,5,NA,"","","",NA,NA,2,"",NA,NA,NA,NA,"",NA,1,1,2,"",NA,NA,NA,"",1,1,1,"Planbarae AZ Modelle",1,5,NA,"","","",NA,NA,2,"",NA,NA,NA,"","","",1,1,2,"",NA,NA,NA,"","","",1,1,2,"",NA,NA,NA,NA,"","",1,1,2,"",NA,NA,NA,NA,"","",1,1,0,0,0,1,0,0,0,0,0,0,"",0,0,0,1,0,0,0,0,0,0,"",0,0,0,0,1,0,0,0,0,0,"",3,1,NA,NA,NA,NA,2,NA,NA,NA,"",1,1,2,NA,2,2,4,4,5,5,2,"",5,5,4,2,80,80,5,5,5,5,5,5,5,5,5,5,5,5,5,5,5,5,5,5,5,5,5,5,5,5,4,4,4,4,4,4,5,5,5,5,5,5,5,5,5,5,5,5,5,5,5,5,5,5,1,1,1,5,5,1,1,1,1,1,1,1,5,5,5,5,5,5,1,1,1,1,1,1,1,1,1,1,1,1,1,1,1,5,5,5,5,5,5,5,5,5,5,5,5,5,1,5,5,5,5,5,5,5,5,5,5,5,5,5,5,5,1117.18,5,"c3areq9y5b94vyj6",NA,NA,"..","/survey/selfserve/53b/g004/230372?list=1&ID=240475414778999","z15zrz0wsez6ktr1","240475414778999",19.1671833333333,18.6196666666667,10,71998,"01-07-1998",1998-07-01,298,24,10,24.1,9164,1998,25,4.66666666666667,5,4.66666666666667,4.66666666666667,2.5,3.5,2,1.5,5,5,4.66666666666667,4.5,3,7.6,NA,NA,NA,NA,4.6,4.44444444444444,4,4.66666666666667,4.66666666666667,4.66666666666667,3.25,4,4.5,3.66666666666667,4.5,3.66666666666667,5.4,4.09090909090909,5,4,2.66666666666667,5,5,5,5,5,5,3,3,3,3,52.83,48.33,53.98,53.35,61.83,55.25,56.79,52.42,70.47629,60.35954,62.4172324,53.0488424,0.111111111111111,5,5,3,2.3,2.75,2,5.55555555555556,5.33333333333333,6,5.33333333333333,52.83,48.33,53.98,53.35,61.83,55.25,56.79,52.42,70.47629,60.35954,62.4172324,53.0488424,0,4,5,5,5,2.41666666666667,3,2.125,4.5,5,5,5,5,5,5,5,5,5,4,5,5,5,4.5,4.33333333333333,5,5,3.15384615384615,3.4,1,5,1,1,1,4.71428571428571,5,5,5,1,1,4.6,5,3.66666666666667,5,5,3.2,3,4,5,5,5,5,5
"105",232,"e8zabnjt6fh6rm9t","02/28/2023 15:01","qualified,/Gender/p47uy,/Age/b3xfu,/Total/Total",3,1,1,1,1,1,1,1,59,2,3,"",3,1,"",1,1,2,6.2021,30,30,2,NA,NA,NA,4,"","logistikassistentin",9,4,6,1,NA,NA,NA,NA,NA,NA,NA,NA,NA,NA,NA,NA,NA,NA,NA,NA,NA,NA,NA,NA,NA,NA,NA,NA,NA,2,4,4,4,4,4,4,4,4,4,4,4,1,3,1,1,1,1,1,1,4,4,4,4,1,4,4,1,6,6,6,6,5,3,4,4,4,4,4,4,4,4,4,4,4,4,4,4,4,4,4,4,4,4,4,4,4,4,4,5,3,3,3,1,1,1,4,4,4,4,4,1,1,1,1,5,5,1,1,1,5,1,1,1,NA,NA,0,1,1,1,1,1,5,10,2,1,1,1,2,1,1,1,0,0,0,0,0,0,0,0,0,1,1,1,1,1,1,1,1,1,1,6,6,6,6,6,6,6,6,6,3,3,3,3,3,3,3,3,3,3,3,4,4,4,4,4,4,4,4,4,4,4,4,3,3,3,3,3,3,4,1,4,1,4,1,1,617.191,4,NA,12,NA,5,6,"02/28/2023 14:51",NA,NA,NA,1,"Mozilla/5.0 (Windows NT 10.0; Win64; x64; rv:109.0) Gecko/20100101 Firefox/110.0","5y1up6ydxwj9g1cs","qgc3skudq3q459eg",NA,NA,"..","/survey/selfserve/53b/g004/230146?list=1&ID=237111539454068","qgc3skudq3q459eg","237111539454068",459,2023-04-14 13:02:00,3,1,1,1,1,1,1,1,59,2,"",2,"",5,10,2,1,1,1,2,1,1,1,0,0,0,0,0,0,0,0,0,5,1,1,1,1,1,1,1,1,1,1,1,1,1,2,NA,NA,"",NA,"",NA,NA,NA,"",3,3,NA,NA,NA,NA,NA,NA,NA,NA,NA,"",NA,"",1,0,0,0,0,0,1,0,0,0,"","",2,NA,NA,"",2,NA,NA,NA,NA,NA,"",0,2,NA,NA,NA,"",3,3,2,"",NA,NA,NA,"","","",2,2,2,"",NA,NA,NA,"","","",2,2,2,"",NA,NA,NA,"","","",2,2,2,"",NA,NA,NA,"","","",2,2,2,"",NA,NA,NA,"","","",2,2,2,"",NA,NA,NA,"","","",2,2,2,"",NA,NA,NA,"","","",2,2,2,"",NA,NA,NA,"","","",2,2,2,"",NA,NA,NA,NA,"",NA,2,2,1,"arbeitgeber",1,5,NA,"",NA,NA,1,"kann mir die zeit einteilen",1,5,NA,"","","",NA,NA,2,"",NA,NA,NA,"","","",2,2,2,"",NA,NA,NA,"","","",2,2,2,"",NA,NA,NA,NA,"","",2,2,2,"",NA,NA,NA,NA,"","",2,2,0,0,0,1,0,0,0,0,0,0,"",0,0,0,0,0,0,0,0,0,1,"nichts",0,0,0,1,0,0,0,0,0,0,"",2,1,NA,NA,NA,NA,2,NA,NA,NA,"",1,3,2,NA,2,2,2,2,2,2,2,"",1,1,1,1,0,0,1,5,5,5,5,5,5,5,5,5,5,5,5,5,5,5,5,5,5,5,5,5,5,5,4,4,4,4,4,4,3,3,3,3,3,3,3,3,3,3,3,3,3,3,3,4,4,4,4,4,4,4,4,4,4,4,4,4,4,4,4,4,4,4,4,4,1,1,1,1,1,1,1,1,1,1,1,1,1,1,1,5,5,5,5,5,5,5,5,5,5,5,5,5,1,5,5,5,5,5,5,5,5,5,5,5,5,5,5,3,812.67,5,"r1av1t8r23eje1a5",NA,NA,"..","/survey/selfserve/53b/g004/230372?list=1&ID=241183254212821","r1av1t8r23eje1a5","241183254212821",10.2865166666667,13.5445,0,62021,"01-06-2021",2021-06-01,23,1,11,1.11,793,2021,2,4,4,4,4,2,1,1,1,4,4,3,2.5,1,5.8,3.8,4,4,3.91666666666667,4,4,4,4,4,4,1,2.6,5,1,5,1,1,3,3,3,3,4,4,4,4,4,3,5,5,5,4.5,52.83,54.05,53.98,60.77,55.62,55.25,56.79,52.42,67.5970951,57.4803451,66.0444512,56.6760612,0,5,5,5,2.2,3,1.66666666666667,6,6,6,6,52.83,54.05,53.98,60.77,55.62,55.25,56.79,52.42,67.5970951,57.4803451,66.0444512,56.6760612,0,5,5,5,5,2.33333333333333,3,2,2,5,5,5,5,5,5,5,5,5,4,3,2,2,3.5,3.33333333333333,4,2,3.84615384615385,3.6,4,4,1,1,1,4.71428571428571,5,5,5,1,1,4.6,5,3.66666666666667,5,5,1.8,1,5,3,3,3,3,3
"106",233,"quju4a6axqg9kvw9","02/28/2023 15:25","qualified,/Gender/X0TrF,/Age/b3xfu,/Total/Total",3,1,1,1,1,1,1,2,59,2,3,"",2,3,"",1,1,6,8.1994,41,0,2,NA,NA,NA,8,"","Analyst",8,2,1,2,2,2,1,NA,55,NA,NA,NA,NA,NA,NA,NA,NA,NA,1,NA,NA,NA,NA,NA,NA,NA,NA,NA,NA,2,2,3,1,2,1,4,2,3,2,4,1,3,4,2,3,1,2,4,4,3,1,2,2,1,1,3,1,3,2,1,2,1,2,1,1,1,1,2,2,1,1,2,2,1,2,3,1,4,2,4,4,4,3,5,5,4,4,3,4,2,3,1,3,2,1,4,4,5,4,4,1,1,1,1,2,1,4,1,4,4,4,1,1,2,49,0,1,1,1,1,1,4,6,4,3,2,3,4,2,3,2,5,5,6,5,6,6,2,2,5,4,2,5,4,2,4,3,4,2,1,0,0,1,1,0,1,2,1,0,5,4,4,4,5,3,2,1,4,3,4,1,1,2,4,4,4,4,4,4,3,3,2,3,3,4,4,4,4,2,3,2,3,3,4,1,1177.545,4,NA,12,NA,5,6,"02/28/2023 15:05",NA,NA,NA,1,"Mozilla/5.0 (Windows NT 10.0; Win64; x64; rv:109.0) Gecko/20100101 Firefox/110.0","f9kpneeagrq6791r","jmm2zf1mnk9xu7fu",NA,NA,"..","/survey/selfserve/53b/g004/230146?list=1&ID=237129246470289","jmm2zf1mnk9xu7fu","237129246470289",583,2023-04-14 14:53:00,3,1,1,1,1,1,1,2,59,2,"",2,"",4,7,3,3,2,4,3,2,2,1,5,5,6,4,5,6,1,4,3,2,3,4,3,4,2,4,3,2,4,3,2,1,2,2,NA,NA,"",NA,"",NA,NA,NA,"",2,2,NA,NA,NA,NA,NA,NA,NA,NA,NA,"",NA,"",0,0,0,0,0,0,1,1,0,0,"","",1,4,NA,"",2,NA,NA,NA,NA,NA,"",0,2,NA,NA,NA,"",3,3,2,"",NA,NA,NA,"","","",4,4,2,"",NA,NA,NA,"","","",4,4,2,"",NA,NA,NA,"","","",4,4,2,"",NA,NA,NA,"","","",3,3,1,"Sicherheitsunterweisungen",1,2,NA,"","","",NA,NA,2,"",NA,NA,NA,"","","",5,5,1,"Fachspezifische Angebote",1,3,NA,"","","",NA,NA,1,"verstellbarer Schreibtisch",1,5,NA,"","","",NA,NA,2,"",NA,NA,NA,NA,"",NA,3,3,2,"",NA,NA,NA,"",4,4,1,"HO",1,5,NA,"","","",NA,NA,2,"",NA,NA,NA,"","","",2,1,2,"",NA,NA,NA,"","","",1,1,2,"",NA,NA,NA,NA,"","",3,3,2,"",NA,NA,NA,NA,"","",3,3,0,0,0,0,0,0,0,0,0,1,"nichts",0,0,0,1,0,0,0,0,0,0,"",0,0,0,1,0,0,0,0,0,0,"",1,1,NA,NA,NA,NA,1,1,4,NA,"",NA,NA,1,1,2,2,3,3,3,4,2,"",3,1,5,2,49,0,5,5,4,4,4,4,2,2,1,3,4,3,3,2,2,4,4,5,4,4,4,2,3,3,2,3,2,2,2,2,4,3,4,4,4,3,2,3,3,3,2,3,4,2,2,5,4,4,3,3,4,5,4,2,3,4,3,3,2,3,3,4,3,3,3,3,2,2,1,3,2,2,3,1,3,1,1,5,1,1,1,1,1,1,1,2,5,5,2,3,1,1,1,5,5,2,1,1,5,1,1,1,1,1,1,1,4,1,1,1,1310.73,5,"rk4tr3jsyjhkczz6",NA,NA,"..","/survey/selfserve/53b/g004/230372?list=1&ID=241183254215684","rk4tr3jsyjhkczz6","241183254215684",19.62575,21.8455,0,81994,"01-08-1994",1994-08-01,345,28,9,28.09,10594,1994,29,2,1.5,3,2.33333333333333,3.5,2.5,1.5,4,2,2,1.66666666666667,1,1,1.8,1.6,1.25,1.33333333333333,1.41666666666667,2.4,4,4,4.33333333333333,3.66666666666667,4.33333333333333,1,2.4,1.5,3,1.5,3,1,3.54545454545455,4.4,2,3.66666666666667,3,1.33333333333333,4,4,2.66666666666667,3.66666666666667,3,3,2,2.5,38.41,40.07,46.92,47.67,35.81,49.47,41.53,45.66,51.4351702,41.3184202,53.060753,43.692363,4.66666666666667,4,2,5,3.5,2.75,4,0.666666666666667,0,1.33333333333333,0.666666666666667,46.43,40.07,46.92,40.07,45.16,49.47,49.59,52.42,62.6758605,52.5591105,50.9291412,41.5607512,4.33333333333333,2,2,4,5,3.08333333333333,2.75,3.25,3.25,3.27272727272727,4.2,1.66666666666667,3.33333333333333,3.33333333333333,2.33333333333333,4.33333333333333,4,2.66666666666667,2.16666666666667,3.06666666666667,3,3,4,3.83333333333333,4.5,4,3.15384615384615,3.2,3.25,3,2.14285714285714,2,1,2.42857142857143,1.2,3.75,2,5,1,1.1,1.33333333333333,1,1,1.75,2,1,2,3.66666666666667,4,2.66666666666667,2.66666666666667,2.75
"107",234,"krsf00q5cgv0aq4r","02/28/2023 15:28","qualified,/Gender/p47uy,/Age/b3xfu,/Total/Total",3,1,1,1,1,1,1,1,55,2,5,"",3,1,"",1,1,6,10.2022,38,0,2,NA,NA,NA,10,"","Assistentin des Institutsleiters",9,9,3,2,2,2,1,NA,70,NA,NA,NA,NA,NA,NA,NA,NA,NA,1,NA,NA,NA,NA,NA,NA,NA,NA,NA,NA,2,4,3,3,3,2,3,3,3,4,3,3,3,1,1,1,1,1,1,1,3,3,3,3,3,4,3,1,5,2,5,8,5,3,3,3,3,3,3,3,3,3,3,3,3,4,3,4,3,3,3,4,4,3,3,3,2,2,3,3,3,3,1,1,1,3,4,4,4,4,4,1,1,1,1,3,3,1,1,1,5,1,1,1,NA,NA,0,1,1,1,1,1,2,8,3,1,1,1,3,3,4,2,0,0,0,0,0,0,0,0,0,1,4,3,2,1,2,1,3,1,4,2,2,2,2,2,4,4,4,1,5,5,5,5,5,4,4,3,4,3,4,3,4,3,5,5,4,4,4,3,3,2,2,3,3,3,4,4,4,4,3,4,3,4,3,1,744.391,4,NA,12,NA,5,6,"02/28/2023 15:15",NA,NA,NA,1,"Mozilla/5.0 (Windows NT 10.0; Win64; x64; rv:109.0) Gecko/20100101 Firefox/110.0","f678fwuy0ak7hgb5","azrz95zwv0bwpfcf",NA,NA,"..","/survey/selfserve/53b/g004/230146?list=1&ID=237111539453028","azrz95zwv0bwpfcf","237111539453028",804,2023-04-15 09:04:00,3,1,1,1,1,1,1,1,55,2,"",2,"",2,7,3,1,1,1,3,1,3,1,0,0,1,0,0,0,0,0,0,3,2,4,3,2,1,4,2,4,3,3,1,4,1,1,2,NA,"",NA,"",1,3,NA,"",NA,NA,1,0,0,0,0,0,0,0,0,"",1,"",0,0,0,0,0,0,0,1,0,0,"","",1,2,1,"",3,NA,NA,NA,NA,NA,"",3,1,2,NA,1,"",NA,NA,1,"Hansefit",1,3,NA,"","","",NA,NA,3,"",NA,NA,NA,"","","",NA,NA,2,"",NA,NA,NA,"","","",4,3,3,"",NA,NA,NA,"","","",3,1,3,"",NA,NA,NA,"","","",3,3,1,"Führungskräftetrainings",2,NA,4,"","","???",NA,NA,1,"Pflichtfortbildungen, Arbeitsbezogene Themen",2,NA,5,"Bin erst seit kurzem da","","",NA,NA,1,"Höhenverstellbare Schreibtische, besondere Stühle, besondere Mäuse, etc.",1,3,NA,"","","",NA,NA,2,"",NA,NA,NA,NA,"",NA,3,3,2,"",NA,NA,NA,"",3,3,1,"Stundenreduzierung",2,NA,2,"","","",NA,NA,3,"",NA,NA,NA,"","","",1,1,3,"",NA,NA,NA,"","","",1,1,2,"",NA,NA,NA,NA,"","",3,3,2,"",NA,NA,NA,NA,"","",3,3,0,0,0,1,0,0,0,0,0,0,"",1,0,1,0,0,0,0,0,0,0,"",1,0,1,0,0,0,0,0,0,0,"",1,1,NA,NA,NA,NA,1,1,3,NA,"",NA,NA,1,1,1,3,3,3,3,3,2,"",2,2,2,1,0,0,5,5,5,5,5,5,5,5,3,3,4,5,3,3,4,5,5,5,4,4,3,3,3,3,3,2,2,2,2,2,4,3,3,3,3,3,2,2,3,4,3,4,3,2,2,4,3,3,4,3,4,3,3,3,3,4,3,4,2,3,3,3,4,4,4,4,3,3,3,4,4,3,4,2,2,3,1,2,2,2,2,4,4,4,3,3,2,3,2,2,3,2,4,4,4,4,4,2,2,3,2,4,4,4,4,3,4,3,4,3,1415,5,"cn7gnzxf73y773za",NA,NA,"..","/survey/selfserve/53b/g004/230372?list=1&ID=241183254209705","cn7gnzxf73y773za","241183254209705",12.4065166666667,23.5833333333333,0,102022,"01-10-2022",2022-10-01,7,0,7,0.07,306,2022,1,3.33333333333333,2.5,3,3.33333333333333,2,1,1,1,3,3,3.33333333333333,3.5,1,5,3,3,3,3,3.4,3,3.66666666666667,3,2.33333333333333,4,1,1.8,3,1,3,1,1,4.27272727272727,5,3.66666666666667,3.66666666666667,3.5,3.33333333333333,4.66666666666667,3.66666666666667,2.33333333333333,3.5,3,3,3,3.5,46.43,54.05,53.98,60.77,45.16,40.41,31.62,45.66,40.8662203,30.7494703,70.6158914,61.2475014,0,2,4,2,2,2,2,2.55555555555556,2,2.66666666666667,3,46.43,54.05,53.98,60.77,45.16,55.25,41.53,52.42,53.7145009,43.5977509,68.1430404,58.7746504,0.111111111111111,2,2,2,2,2.08333333333333,1.5,2.375,3,4.54545454545455,5,4.33333333333333,4,3.75,3.33333333333333,5,3.66666666666667,3,2.16666666666667,2.93333333333333,2,3,3.125,3.16666666666667,3,4,3.53846153846154,3.2,3.5,4,3.42857142857143,2,2,3.14285714285714,3.6,2.25,3.25,4,4,3.5,3.33333333333333,3,4,3.5,1.8,1,1,3.33333333333333,3,2.33333333333333,3.33333333333333,2.75
"108",235,"vxac5ec4b2p6hhn5","02/28/2023 16:00","qualified,/Gender/X0TrF,/Age/gcKvr,/Total/Total",3,1,1,1,1,1,1,2,34,1,5,"",6,1,"",1,1,6,1.2023,39,39,2,NA,NA,NA,4,"","Softwarearchitekt",7,1,3,1,NA,NA,NA,NA,NA,NA,NA,NA,NA,NA,NA,NA,NA,NA,NA,NA,NA,NA,NA,NA,NA,NA,NA,NA,NA,2,5,3,4,3,1,3,3,3,5,3,3,5,3,4,3,3,3,1,1,3,3,4,4,4,4,2,3,9,6,5,5,6,5,3,4,5,3,3,3,3,2,2,3,3,4,3,2,3,3,4,3,3,3,3,3,3,3,4,2,1,4,2,2,1,5,4,4,5,5,5,2,1,1,2,4,5,5,5,5,2,5,1,1,3,100,6,3,3,4,6,2,2,4,4,3,3,2,3,3,4,3,5,5,5,6,5,5,3,5,4,3,3,3,4,2,3,2,3,3,2,2,2,1,2,0,2,1,1,1,3,4,3,2,4,3,3,1,3,2,2,5,5,5,2,3,2,4,4,4,3,2,2,3,3,2,3,3,3,2,2,2,4,3,3,1,831.166,14,NA,10,NA,1,2,"02/28/2023 15:45",NA,NA,NA,1,"Mozilla/5.0 (Linux; Android 12; 2000_000170_00) AppleWebKit/537.36 (KHTML, like Gecko) Chrome/110.0.0.0 Mobile Safari/537.36","wyxsmsekuex0yhrq","dduaqj4ccss9ha1b",NA,NA,"sa","/survey/selfserve/53b/g004/230146?list=1&ID=237104974322700","pg4hjvdj3nhq94u1","237104974322700",601,2023-04-14 15:10:00,3,1,1,1,1,1,1,2,34,2,"",2,"",3,4,4,3,2,3,3,2,3,3,5,5,5,6,3,5,3,6,5,2,1,5,4,3,1,3,1,4,3,2,3,3,1,3,NA,NA,"",NA,"",NA,NA,NA,"",3,3,NA,NA,NA,NA,NA,NA,NA,NA,NA,"",NA,"",0,0,0,0,0,0,1,1,0,0,"","",1,1,3,"",3,NA,NA,NA,NA,NA,"",0,3,NA,NA,NA,"",2,2,3,"",NA,NA,NA,"","","",2,2,3,"",NA,NA,NA,"","","",2,2,3,"",NA,NA,NA,"","","",2,2,3,"",NA,NA,NA,"","","",3,3,1,"Pflichtschulungen zum Arbeitsschutz",1,3,NA,"","","",NA,NA,3,"",NA,NA,NA,"","","",3,3,3,"",NA,NA,NA,"","","",4,4,3,"",NA,NA,NA,"","","",2,2,3,"",NA,NA,NA,NA,"",NA,2,2,3,"",NA,NA,NA,"",1,1,1,"Teilzeit, zusätzliche Urlaubstage",2,NA,2,"","","",NA,NA,3,"",NA,NA,NA,"","","",4,3,3,"",NA,NA,NA,"","","",4,3,3,"",NA,NA,NA,NA,"","",2,1,3,"",NA,NA,NA,NA,"","",2,2,0,0,0,1,0,0,0,0,0,0,"",0,0,0,1,0,0,0,0,0,0,"",0,0,0,1,0,0,0,0,0,0,"",3,1,NA,NA,NA,NA,3,NA,NA,NA,"",3,3,3,NA,1,3,3,3,2,2,2,"",5,3,5,3,47,10,2,4,4,3,2,3,2,2,1,1,1,3,4,4,5,3,3,3,4,4,4,3,2,3,2,3,2,2,2,2,5,5,5,5,5,3,3,3,3,4,3,3,3,3,3,3,4,3,4,3,5,3,3,4,4,5,4,4,4,4,4,3,5,4,5,4,1,4,2,1,2,3,3,1,1,2,2,1,1,4,4,2,4,4,4,4,4,2,2,2,1,1,5,4,3,3,4,3,2,3,3,4,3,3,3,3,4,3,3,3,871.03,1,"dduaqj4ccss9ha1b",NA,NA,"sa","/survey/selfserve/53b/g004/230372?list=1&ID=241183254210751","pg4hjvdj3nhq94u1","241183254210751",13.8527666666667,14.5171666666667,4,12023,"01-01-2023",2023-01-01,4,0,4,0.04,214,2023,0,4,2,3,3.66666666666667,4,3.5,3,1,3,4,3.33333333333333,4,3,6.2,3,3.75,3,3.25,3,3.22222222222222,3.33333333333333,3,3.33333333333333,5,1.5,4.8,4.5,5,4.5,5,3.6,2.72727272727273,3.2,2.33333333333333,2.33333333333333,3.41666666666667,5,2.33333333333333,4,2.33333333333333,2.83333333333333,4,2,3,2.66666666666667,38.41,40.07,38.71,53.35,45.16,40.41,31.62,38.09,43.1698286,33.0530786,54.4149431,45.0465531,4.77777777777778,3,3,4,3,3,3,1.33333333333333,1.33333333333333,1.33333333333333,1.33333333333333,38.41,40.07,46.92,47.67,45.16,49.47,41.53,38.09,50.9640762,40.8473262,53.7604382,44.3920482,4.77777777777778,1,3,2,3,2.25,2.5,2.125,2.5,2.36363636363636,3.2,1.66666666666667,1.66666666666667,3.5,4.33333333333333,3,4,2.66666666666667,2.16666666666667,3.73333333333333,2,3,3.25,3.33333333333333,3,2,4,3.4,4.25,4.5,2.28571428571429,1.33333333333333,4,3,3.6,2.5,2.75,3,4,3.3,3.33333333333333,3.33333333333333,3.25,3.25,2.8,3,4,5,5,3,3.33333333333333,3
"109",305,"t3ebjtgtncsmc8za","03/01/2023 15:04","qualified,/Gender/p47uy,20230301_12:51_v2,/HomeOffice/oPdDr,/Age/b3xfu,/Total/Total",3,1,1,1,1,1,1,1,59,2,3,"",5,1,"",1,1,6,10.2,39,65,2,NA,NA,NA,10,"","Fachpflegekraft",9,10,5,1,NA,NA,NA,NA,NA,NA,NA,NA,NA,NA,NA,NA,NA,NA,NA,NA,NA,NA,NA,NA,NA,NA,NA,NA,NA,1,3,5,5,5,4,2,2,2,4,2,2,3,4,5,5,5,5,5,4,3,3,2,2,2,2,2,1,3,2,4,3,2,3,2,2,3,3,3,3,2,2,2,2,2,2,5,3,1,2,1,1,1,1,1,1,1,1,1,3,2,1,1,1,1,1,4,4,4,2,4,1,1,1,1,1,1,1,1,1,5,1,1,1,NA,NA,0,5,7,1,1,1,2,0,6,4,4,5,4,3,5,5,6,6,6,6,6,6,5,6,6,5,1,5,5,2,4,5,5,1,5,0,1,1,0,0,0,2,0,0,2,2,3,2,3,2,2,2,2,1,1,5,3,3,1,1,5,2,2,2,2,2,2,4,3,3,1,5,3,3,1,1,1,1,1,1,1031.2,12,NA,11,NA,1,1,"03/01/2023 14:46",NA,NA,NA,1,"Mozilla/5.0 (iPhone; CPU iPhone OS 16_3_1 like Mac OS X) AppleWebKit/605.1.15 (KHTML, like Gecko) Version/16.3 Mobile/15E148 Safari/604.1","wa8y395tj9cr7etx","jkxk90gfrg9tkd77",NA,NA,"si","/survey/selfserve/53b/g004/230146?list=1&ID=237301716010089","jkxk90gfrg9tkd77","237301716010089",644,2023-04-14 16:17:00,3,1,1,1,1,1,1,1,59,2,"",2,"",3,6,4,4,3,4,3,3,3,3,6,6,5,6,6,6,6,6,6,4,5,3,5,5,3,2,5,1,5,5,2,5,1,1,2,NA,"",NA,"",2,NA,4,"Betriebsrätin ist sehr Arbeitgeberfreundlich",NA,NA,1,0,0,0,0,0,0,0,0,"",3,"",0,0,0,0,0,0,1,0,0,0,"","",2,NA,NA,"",2,NA,NA,NA,NA,NA,"",1,2,NA,NA,NA,"",2,2,1,"Pilates Yoga",1,5,NA,"","","",NA,NA,2,"",NA,NA,NA,"","","",NA,NA,2,"",NA,NA,NA,"","","",5,5,2,"",NA,NA,NA,"","","",5,5,2,"",NA,NA,NA,"","","",5,5,2,"",NA,NA,NA,"","","",5,5,1,"Interne Fortblildungen z.B Hygiene",1,5,NA,"","","",NA,NA,2,"",NA,NA,NA,"","","",5,5,3,"",NA,NA,NA,NA,"",NA,5,5,3,"",NA,NA,NA,"",5,5,2,"",NA,NA,NA,"","","",5,5,2,"",NA,NA,NA,"","","",1,1,2,"",NA,NA,NA,"","","",1,1,2,"",NA,NA,NA,NA,"","",5,5,2,"",NA,NA,NA,NA,"","",4,4,0,0,0,0,0,0,0,0,0,1,"Nichts!",1,0,0,0,0,0,0,1,1,0,"",1,1,0,0,0,0,0,0,0,0,"",2,3,2,NA,5,1,1,1,1,NA,"",NA,NA,1,1,2,2,1,1,1,1,2,"",1,1,2,1,0,0,1,5,5,5,5,5,3,3,2,4,1,1,3,4,4,4,4,5,3,3,3,1,1,2,2,2,2,3,2,3,4,4,4,4,3,4,3,2,2,2,2,2,3,2,3,5,1,2,5,5,5,5,3,3,3,4,2,4,4,1,2,2,4,4,4,4,3,5,5,3,2,3,2,1,1,1,1,5,1,5,5,1,1,1,1,3,5,1,5,5,1,1,3,3,5,1,1,1,5,1,3,1,1,1,1,1,5,1,1,1,1201.56,1,"jkxk90gfrg9tkd77",NA,NA,"si","/survey/selfserve/53b/g004/230372?list=1&ID=241183254221949","jkxk90gfrg9tkd77","241183254221949",17.1866666666667,20.026,0,102000,"01-10-2000",2000-10-01,271,22,7,22.07,8341,2000,23,4.33333333333333,4.5,2,2.66666666666667,3.5,5,5,4.5,3,2,2,2,1,2.8,2.4,2.5,2.33333333333333,2.41666666666667,2.6,1,1,1,1,3.33333333333333,1,1,1,1,1,1,3,2,2.4,2,1.33333333333333,2.5,3.66666666666667,2.33333333333333,2,2,3.16666666666667,5,5,5,3.33333333333333,22.81,30.31,28.32,31.48,35.81,40.41,21.4,21.66,30.8119377,20.6951877,37.2021348,27.8337448,5.88888888888889,5,2,1,3.6,1.5,5,0.444444444444444,0.333333333333333,1,0,38.41,30.31,38.71,40.07,45.16,40.41,41.53,38.09,52.4941648,42.3774148,44.0293805,34.6609905,5.88888888888889,3,4,5,1,4,2.5,4.75,1,3.54545454545455,5,2.66666666666667,2,3.08333333333333,3.66666666666667,4.33333333333333,3,1.33333333333333,2.33333333333333,2.93333333333333,1,1,2.875,2.5,4,2,3,2,3.25,4,3.28571428571429,1.66666666666667,5,2.57142857142857,1.4,4,2,5,1,1.2,1,1.66666666666667,1,2,1,1,2,4,3.5,3,2,2.5
"110",306,"fgegb5vkw1feq5vt","03/01/2023 15:08","qualified,20230301_12:51_v2,/Gender/X0TrF,/HomeOffice/oPdDr,/Age/b3xfu,/Total/Total",3,1,1,1,1,1,1,2,63,2,5,"",2,1,"",3,1,6,1.199,40,41,2,NA,NA,NA,6,"","Personalleiter",8,10,1,2,5,5,2,3,52,15,13,11,NA,NA,NA,NA,NA,NA,1,2,2,2,NA,NA,NA,NA,NA,NA,2,1,4,5,4,5,5,5,5,5,5,5,5,2,2,3,2,1,3,1,1,5,5,5,5,5,5,4,2,8,5,6,6,7,3,4,5,4,4,4,4,5,5,4,5,5,5,5,5,4,5,3,4,4,4,5,5,4,4,5,4,4,3,4,3,4,3,5,5,4,4,5,1,1,1,3,4,1,3,3,3,5,3,1,2,2,20,20,4,4,3,5,1,5,9,2,1,1,2,2,1,1,1,1,0,0,1,0,0,0,0,0,1,4,1,1,1,4,1,3,1,4,5,6,6,6,5,5,6,5,5,4,5,5,5,4,4,2,4,3,4,4,5,5,5,5,5,5,4,4,5,5,4,5,5,5,5,5,5,5,5,1,4,3,4,2,1,1234.134,14,NA,10,NA,3,2,"03/01/2023 14:47",NA,NA,NA,1,"Mozilla/5.0 (Linux; Android 10; Lenovo TB-X505L) AppleWebKit/537.36 (KHTML, like Gecko) Chrome/110.0.0.0 Safari/537.36","yceknnby2pm0z9qj","5q7s0djd3d7ah71b",NA,NA,"ta","/survey/selfserve/53b/g004/230146?list=1&ID=237301715985619","5q7s0djd3d7ah71b","237301715985619",477,2023-04-14 13:34:00,3,1,1,1,1,1,1,2,63,2,"",2,"",5,9,2,1,1,2,1,1,1,1,1,0,0,1,0,0,1,0,0,2,1,4,1,1,1,5,2,5,3,3,1,4,1,1,2,NA,"",NA,"",2,NA,2,"",NA,NA,0,0,1,0,0,0,0,0,0,"",3,"",1,1,0,0,0,0,0,0,0,0,"","",1,3,NA,"",2,NA,NA,NA,NA,NA,"",2,1,1,5,NA,"",NA,NA,1,"Rueckenschule",1,5,NA,"","","",NA,NA,1,"Bewältigung",1,5,NA,"","","",NA,NA,2,"",NA,NA,NA,"","","",3,4,2,"",NA,NA,NA,"","","",2,1,1,"Schulungen intern",1,4,NA,"","","",NA,NA,2,"",NA,NA,NA,"","","",3,3,1,"Fachlicher Natur",1,5,NA,"","","",NA,NA,1,"Rueckenschule",2,NA,2,"","","",NA,NA,1,"Arbeitsspezifische",1,5,NA,NA,"",NA,NA,NA,1,"Betriebsrat",2,NA,3,"",NA,NA,1,"Elte rnzeit",2,NA,2,"","","",NA,NA,2,"",NA,NA,NA,"","","",2,1,1,"Aktive Mithilfe",2,NA,2,"","","",NA,NA,2,"",NA,NA,NA,NA,"","",3,1,2,"",NA,NA,NA,NA,"","",1,1,0,0,0,0,0,0,0,1,0,0,"",0,0,1,0,0,0,0,0,0,0,"",0,0,1,0,0,0,0,0,0,0,"",1,1,NA,NA,NA,NA,2,NA,NA,NA,"",3,2,1,1,2,2,4,5,4,3,2,"",4,3,3,2,20,20,5,4,5,5,4,5,5,5,5,4,4,5,5,5,5,5,5,5,5,4,5,5,5,5,3,3,3,4,3,4,5,5,4,5,5,5,5,5,5,5,5,5,5,5,5,5,5,5,2,1,4,4,4,4,3,5,3,4,1,5,5,5,5,5,5,4,1,1,1,1,1,1,1,1,1,3,1,1,1,1,1,5,5,5,5,5,1,1,5,1,5,5,5,5,1,5,4,5,2,5,5,5,5,5,5,5,5,5,5,5,2229.04,1,"xx9f9u6nv7h263hh",NA,NA,"sa","/survey/selfserve/53b/g004/230372?list=1&ID=241183254205536","ypkqy4x1cj4au6ek","241183254205536",20.5689,37.1506666666667,0,11990,"01-01-1990",1990-01-01,400,33,4,33.04,12267,1990,33,4.33333333333333,5,5,5,2,2.5,2,1,5,5,4.66666666666667,5,2,6.4,4,4.5,4.66666666666667,4.33333333333333,4.8,4.22222222222222,3.66666666666667,4.66666666666667,4.33333333333333,4.33333333333333,1.5,2.8,2.5,3,2.5,3,3.4,4,4.6,3.33333333333333,3.66666666666667,4.75,5,5,4.33333333333333,4.66666666666667,5,5,3,4,4.16666666666667,52.83,54.05,53.98,53.35,55.62,55.25,56.79,52.42,67.7831145,57.6663645,63.5244708,54.1560808,0.222222222222222,2,2,2,1.5,1.5,1.5,5.44444444444444,5.33333333333333,6,5,52.83,54.05,53.98,53.35,61.83,55.25,56.79,52.42,69.3790224,59.2622724,64.1643492,54.7959592,0.333333333333333,2,1,1,2,1.58333333333333,1.25,1.75,4,4.63636363636364,4.6,5,4.33333333333333,4.91666666666667,5,5,4.66666666666667,5,3.33333333333333,4.93333333333333,4,5,4.5,4.66666666666667,4,5,4.46153846153846,4.8,3.75,4.75,1,1.33333333333333,1,3.85714285714286,5,2,5,1,4,4.8,4.66666666666667,4.66666666666667,5,5,3.4,2,4,4.66666666666667,5,5,5,5
"111",307,"asmkxbx24vh8c51g","03/01/2023 15:06","qualified,20230301_12:51_v2,/Gender/X0TrF,/HomeOffice/oPdDr,/Age/b3xfu,/Total/Total",3,1,1,1,1,1,1,2,59,2,2,"",2,2,"",3,1,4,3.2018,35,40,2,NA,NA,NA,4,"","Supervisor",5,3,4,1,NA,NA,NA,NA,NA,NA,NA,NA,NA,NA,NA,NA,NA,NA,NA,NA,NA,NA,NA,NA,NA,NA,NA,NA,NA,2,3,4,3,4,4,2,4,3,3,4,3,3,3,4,4,4,3,3,3,3,4,3,3,3,4,3,1,8,5,6,2,4,4,4,4,3,3,4,3,3,3,3,4,3,3,4,3,1,4,1,2,4,4,4,3,3,3,4,3,2,1,2,1,1,1,4,4,1,1,1,1,1,1,1,1,1,1,2,1,2,1,1,1,NA,NA,49,3,3,1,1,1,2,4,4,3,2,4,4,1,4,2,5,6,5,6,5,5,4,5,3,3,3,3,3,3,4,4,4,3,3,2,2,4,4,3,3,4,2,3,5,5,5,5,5,5,5,4,3,4,4,3,3,4,4,5,5,5,4,5,4,3,3,4,4,4,4,4,4,3,4,4,3,4,4,1,1115.862,14,NA,10,NA,1,2,"03/01/2023 14:47",NA,NA,NA,1,"Mozilla/5.0 (Linux; U; Android 11; de-de; Redmi Note 11 Build/RKQ1.211001.001) AppleWebKit/537.36 (KHTML, like Gecko) Version/4.0 Chrome/89.0.4389.116 Mobile Safari/537.36 XiaoMi/MiuiBrowser/12.22.0.3-gn","v5kxu6hgmetms2f2","mvetmmegq102uuy3",NA,NA,"sa","/survey/selfserve/53b/g004/230146?list=1&ID=237301716010094","ms8ty2abp1w9g8xy","237301716010094",588,2023-04-14 15:04:00,3,1,1,1,1,1,1,2,59,2,"",2,"",3,4,4,3,4,5,4,3,3,3,5,6,4,6,6,6,4,6,5,4,3,3,4,4,3,3,4,4,4,3,3,4,1,2,NA,NA,"",NA,"",NA,NA,NA,"",5,3,NA,NA,NA,NA,NA,NA,NA,NA,NA,"",NA,"",0,0,0,0,0,0,1,0,0,0,"","",2,NA,NA,"",2,NA,NA,NA,NA,NA,"",0,2,NA,NA,NA,"",5,3,2,"",NA,NA,NA,"","","",5,5,2,"",NA,NA,NA,"","","",4,3,2,"",NA,NA,NA,"","","",5,3,2,"",NA,NA,NA,"","","",3,3,2,"",NA,NA,NA,"","","",3,3,2,"",NA,NA,NA,"","","",2,3,2,"",NA,NA,NA,"","","",3,3,2,"",NA,NA,NA,"","","",4,4,2,"",NA,NA,NA,NA,"",NA,4,3,2,"",NA,NA,NA,"",5,3,2,"",NA,NA,NA,"","","",4,3,2,"",NA,NA,NA,"","","",3,3,2,"",NA,NA,NA,"","","",2,2,2,"",NA,NA,NA,NA,"","",2,1,2,"",NA,NA,NA,NA,"","",3,3,0,0,0,0,0,0,0,0,0,1,"Keine",0,0,0,0,0,0,0,0,0,1,"Keine",0,0,0,0,1,0,0,0,0,0,"",2,1,NA,NA,NA,NA,2,NA,NA,NA,"",3,3,2,NA,2,2,1,1,3,1,1,"Das trifft nicht zu",1,1,1,1,2,3,1,5,5,5,5,5,5,5,4,5,4,5,3,4,4,5,4,5,5,5,5,5,5,5,4,3,2,2,2,2,3,3,3,3,3,1,1,1,1,2,2,2,3,2,2,3,5,5,4,5,4,4,3,3,5,5,5,5,5,4,4,4,4,4,4,3,3,5,5,1,2,5,3,3,1,5,3,5,5,4,4,1,1,1,1,1,1,2,3,3,1,1,1,1,3,4,1,1,1,1,1,1,1,1,1,1,1,1,5,2,1613.04,1,"mvetmmegq102uuy3",NA,NA,"sa","/survey/selfserve/53b/g004/230372?list=1&ID=241183254221952","ms8ty2abp1w9g8xy","241183254221952",18.5977,26.884,-46,32018,"01-03-2018",2018-03-01,62,5,2,5.02,1981,2018,5,3.33333333333333,4,3,3.33333333333333,3,4,3.5,3,3.5,3,3.33333333333333,3.5,1,5,3.4,3.5,3.33333333333333,3.41666666666667,3,3.11111111111111,2.33333333333333,3.66666666666667,3.33333333333333,1,1,1.2,1,1.33333333333333,1,1.33333333333333,1.8,4.54545454545455,5,4.66666666666667,3.66666666666667,4,3.33333333333333,4.66666666666667,4.66666666666667,3.33333333333333,4,2,3,2,3,38.41,40.07,46.92,40.07,35.81,55.25,31.62,45.66,45.73839,35.62164,53.446379,44.077989,4.88888888888889,3,2,3,3.1,2.75,3.33333333333333,3,2.33333333333333,4,2.66666666666667,38.41,40.07,28.32,31.48,35.81,40.41,41.53,38.09,50.2038158,40.0870658,37.9975746,28.6291846,5.33333333333333,3,3,2,2,3.16666666666667,2.75,3.375,1.5,4.81818181818182,5,4.66666666666667,4.66666666666667,4.58333333333333,3.66666666666667,4.66666666666667,5,5,2.5,2.13333333333333,2,1,3.375,3.33333333333333,3.5,1,3.92307692307692,3.2,5,3.75,3.42857142857143,3.66666666666667,4,1.5,1,2.25,1,3,5,1.7,2,2.33333333333333,1,2,1.2,1,1,3,3,1,1.66666666666667,2.25
"112",309,"peq3g1f4qj47bhyv","03/01/2023 15:08","qualified,/Age/gcKvr,20230301_12:51_v2,/Gender/X0TrF,/HomeOffice/oPdDr,/Total/Total",3,1,1,1,1,1,1,2,54,1,2,"",3,1,"",3,2,2,2.2018,40,42,2,NA,NA,NA,4,"","Zolldeklarant",8,7,1,2,4,4,2,1,44,18,15,NA,NA,NA,NA,NA,NA,NA,1,2,2,NA,NA,NA,NA,NA,NA,NA,3,2,2,1,2,2,4,4,4,4,3,4,4,2,1,3,3,1,3,2,2,4,4,2,2,3,4,4,1,9,5,2,2,8,NA,NA,NA,NA,NA,NA,NA,NA,NA,NA,NA,NA,4,4,4,3,4,4,4,4,4,4,4,4,4,4,4,4,5,5,1,1,1,5,5,5,5,4,1,1,1,1,4,3,1,2,1,5,1,1,1,NA,NA,4,2,2,1,1,1,5,9,2,1,1,1,1,1,1,1,1,1,0,1,0,0,0,0,0,2,4,2,1,1,4,1,1,1,2,5,5,4,3,3,3,4,3,3,4,4,4,4,4,4,4,4,4,4,4,4,4,4,4,4,4,4,4,4,4,4,4,4,3,4,4,3,4,4,2,2,2,4,2,1,1223.588,14,NA,10,NA,1,2,"03/01/2023 14:47",NA,NA,NA,1,"Mozilla/5.0 (Linux; Android 13; SAMSUNG SM-A536B) AppleWebKit/537.36 (KHTML, like Gecko) SamsungBrowser/20.0 Chrome/106.0.5249.126 Mobile Safari/537.36","8nt0pj9ckhck3kpz","1fs5bsjbyyqx54sy",NA,NA,"sa","/survey/selfserve/53b/g004/230146?list=1&ID=237301716003051","p366649nmqstvecx","237301716003051",689,2023-04-14 17:39:00,3,1,1,1,1,1,1,2,54,2,"",2,"",4,9,3,1,1,1,2,1,1,1,1,1,0,0,1,0,0,1,0,1,1,4,1,1,1,4,1,4,1,1,1,1,1,2,NA,NA,"",NA,"",NA,NA,NA,"",3,2,NA,NA,NA,NA,NA,NA,NA,NA,NA,"",NA,"",0,0,0,0,0,0,1,0,0,0,"","",2,NA,NA,"",2,NA,NA,NA,NA,NA,"",1,2,NA,NA,NA,"",2,4,2,"",NA,NA,NA,"","","",4,4,2,"",NA,NA,NA,"","","",4,3,2,"",NA,NA,NA,"","","",1,1,2,"",NA,NA,NA,"","","",1,1,2,"",NA,NA,NA,"","","",3,3,2,"",NA,NA,NA,"","","",3,3,2,"",NA,NA,NA,"","","",4,4,2,"",NA,NA,NA,"","","",4,4,2,"",NA,NA,NA,NA,"",NA,2,2,2,"",NA,NA,NA,"",2,2,2,"",NA,NA,NA,"","","",4,4,2,"",NA,NA,NA,"","","",3,3,2,"",NA,NA,NA,"","","",3,3,2,"",NA,NA,NA,NA,"","",3,3,2,"",NA,NA,NA,NA,"","",2,2,0,0,0,0,0,0,0,0,0,1,"Keine",1,0,0,0,0,0,0,0,0,0,"",1,0,0,0,0,0,0,0,0,0,"",3,1,NA,NA,NA,NA,2,NA,NA,NA,"",1,1,2,NA,2,2,4,4,4,4,2,"",1,1,1,1,0,0,1,5,5,5,5,5,5,5,5,4,4,5,4,4,4,4,4,4,4,4,4,4,4,4,2,2,3,2,3,3,5,5,5,5,5,5,5,5,5,5,5,5,5,5,5,5,5,5,5,5,5,5,5,5,5,5,5,5,5,5,5,5,5,5,5,5,1,1,1,1,1,1,1,2,2,2,2,3,2,1,1,4,4,4,4,4,4,4,4,4,4,4,4,4,4,3,3,3,3,3,3,3,3,3,3,4,4,4,4,1,997.77,3,"43db52zapm6dkwgy",NA,NA,"ta","/survey/selfserve/53b/g004/230372?list=1&ID=241183254218816","dadzd8xex9q111yr","241183254218816",20.3931333333333,16.6295,-4,22018,"01-02-2018",2018-02-01,63,5,3,5.03,2009,2018,5,1.66666666666667,3,4,3.66666666666667,1.5,3,2,2,4,2,3.66666666666667,3.5,1,5.2,NA,NA,NA,NA,3.8,4,4,4,4,4.66666666666667,1,2.2,3.5,1.33333333333333,3.5,1.33333333333333,1.4,4,4,4,4,4,4,4,4,4,3.66666666666667,4,4,4,3.66666666666667,52.83,54.05,53.98,60.77,61.83,55.25,56.79,52.42,69.193003,59.076253,66.6843296,57.3159396,0.333333333333333,2,2,4,1.7,2,1.5,3.66666666666667,4.33333333333333,3.66666666666667,3,46.43,54.05,53.98,60.77,55.62,55.25,56.79,52.42,67.3650951,57.2483451,64.7640032,55.3956132,0.444444444444444,2,2,2,5,1.58333333333333,2.25,1.25,4,4.81818181818182,5,5,4.33333333333333,4,4,4,4,4,2.5,5,1,1,4,3.66666666666667,5,1,4.69230769230769,4.2,5,5,1,2.16666666666667,1,4,4,4,4,4,3,3,3,3,3,4,2.6,1,5,5,5,5,5,5
"113",311,"y19aw3rgzeaud33a","03/01/2023 15:02","qualified,20230301_12:51_v2,/Gender/X0TrF,/Age/b3xfu,/HomeOffice/ZRYex,/Total/Total",3,1,1,1,1,1,1,2,57,2,5,"",6,1,"",1,1,6,7.2022,40,44,1,2,2,1,1,"","Buchhalter",7,12,1,2,2,2,1,NA,53,NA,NA,NA,NA,NA,NA,NA,NA,NA,1,NA,NA,NA,NA,NA,NA,NA,NA,NA,NA,2,4,4,3,4,2,4,4,5,5,5,2,5,2,2,2,1,1,1,1,2,2,1,1,5,5,4,2,8,6,2,7,6,2,2,5,5,3,5,5,5,3,3,4,5,1,3,1,2,2,3,4,4,3,1,1,1,1,1,2,2,5,1,1,3,5,5,5,5,5,5,1,1,1,1,3,5,5,1,5,3,4,1,1,2,80,0,1,1,1,1,1,2,9,2,1,1,2,2,1,1,1,3,3,4,0,0,5,0,0,0,1,5,1,1,1,5,1,1,1,4,2,2,0,0,0,0,0,0,0,4,4,3,4,4,5,5,2,4,4,4,1,1,1,4,4,4,2,3,1,1,1,1,4,3,4,4,2,4,5,1,5,1,5,1,1,782.732,4,NA,10,NA,5,6,"03/01/2023 14:48",NA,NA,NA,1,"Mozilla/5.0 (Windows NT 10.0; Win64; x64) AppleWebKit/537.36 (KHTML, like Gecko) Chrome/110.0.0.0 Safari/537.36","8183v9xtezrn24qv","s347pm7nm1xqdwpy",NA,NA,"..","/survey/selfserve/53b/g004/230146?list=1&ID=237301715983531","s347pm7nm1xqdwpy","237301715983531",680,2023-04-14 17:24:00,3,1,1,1,1,1,1,2,57,2,"",2,"",3,9,2,1,1,1,2,1,1,1,0,0,0,0,0,1,0,0,0,1,1,5,1,1,1,5,1,4,1,1,1,4,1,2,NA,NA,"",NA,"",NA,NA,NA,"",1,2,NA,NA,NA,NA,NA,NA,NA,NA,NA,"",NA,"",0,0,0,0,0,0,0,1,0,0,"","",1,1,2,"",1,6,2,2,NA,2,"",5,1,2,NA,2,"",NA,NA,2,"",NA,NA,NA,"","","",5,5,2,"",NA,NA,NA,"","","",1,1,2,"",NA,NA,NA,"","","",1,1,2,"",NA,NA,NA,"","","",1,1,1,"Schulungen",1,1,NA,"","","",NA,NA,2,"",NA,NA,NA,"","","",1,1,2,"",NA,NA,NA,"","","",5,5,2,"",NA,NA,NA,"","","",1,1,2,"",NA,NA,NA,NA,"",NA,3,3,3,"",NA,NA,NA,"",1,1,1,"Gleitzeit  Sabatical",1,5,NA,"","","",NA,NA,3,"",NA,NA,NA,"","","",1,1,2,"",NA,NA,NA,"","","",1,1,2,"",NA,NA,NA,NA,"","",1,1,2,"",NA,NA,NA,NA,"","",1,1,0,0,0,1,0,0,0,0,0,0,"",0,0,0,1,0,0,0,0,0,0,"",0,0,0,1,0,0,0,0,0,0,"",2,1,NA,NA,NA,NA,1,2,NA,2,"",NA,NA,1,1,1,2,3,3,3,3,2,"",5,4,5,3,100,52,5,3,3,4,3,3,4,4,2,4,4,4,1,1,1,4,4,4,3,3,2,2,1,1,4,3,1,1,3,3,5,4,5,4,5,5,3,4,4,4,4,5,3,1,1,4,4,4,1,1,4,3,4,3,5,2,1,3,2,4,4,4,5,5,4,4,3,4,1,1,1,1,1,4,3,5,2,3,3,1,5,3,1,3,3,3,1,5,1,1,1,1,1,1,1,1,1,3,1,1,1,2,2,4,1,3,5,3,3,4,855.72,5,"s347pm7nm1xqdwpy",NA,NA,"..","/survey/selfserve/53b/g004/230372?list=1&ID=241183254201398","s347pm7nm1xqdwpy","241183254201398",13.0455333333333,14.262,52,72022,"01-07-2022",2022-07-01,10,0,10,0.1,398,2022,1,3.66666666666667,3,4.33333333333333,4,3.5,2,1,1,2,1,4.66666666666667,5,2,5.8,3,5,4,3.91666666666667,1.8,2.11111111111111,3.66666666666667,1.66666666666667,1,5,1,3.8,4,3.66666666666667,4,3.66666666666667,1,3.90909090909091,3.8,4,4,2,1,4,2,1,3.5,5,5,5,5,52.83,54.05,53.98,53.35,55.62,55.25,56.79,52.42,67.7831145,57.6663645,63.5244708,54.1560808,1.66666666666667,1,1,2,1.1,1.25,1,0.444444444444444,1.33333333333333,0,0,52.83,54.05,53.98,60.77,55.62,55.25,56.79,52.42,67.5970951,57.4803451,66.0444512,56.6760612,0.111111111111111,1,1,2,2,1.16666666666667,1.25,1.125,3,3.45454545454545,3.2,3.33333333333333,4,2.25,1,4,2.66666666666667,1.33333333333333,2.5,3.8,5,5,4.125,4.33333333333333,3.5,4,3.69230769230769,3.8,2.75,4.5,1.71428571428571,3.33333333333333,3,1.85714285714286,2.6,2,1,1,5,2.1,1.66666666666667,2.33333333333333,2.25,3.5,3,2,1,4.66666666666667,4.5,4,4,2.5
"114",312,"cha1xc5uyrjgyu1t","03/03/2023 18:46","qualified,/Age/gcKvr,20230301_12:51_v2,/Gender/X0TrF,/HomeOffice/ZRYex,/Total/Total",3,1,1,1,1,1,1,2,43,1,5,"",3,1,"",4,1,6,1.2015,42,50,2,NA,NA,NA,6,"","Product Owner",8,10,1,2,5,5,2,3,39,6,4,2,NA,NA,NA,NA,NA,NA,1,2,2,2,NA,NA,NA,NA,NA,NA,2,2,4,5,4,4,3,4,2,3,5,2,3,2,2,5,5,1,3,1,1,4,3,2,4,4,5,5,4,3,3,9,5,6,2,4,4,4,3,3,2,4,4,3,2,3,3,5,3,1,3,5,5,5,4,4,4,3,5,5,5,3,3,1,1,1,4,4,4,4,5,4,2,1,1,3,5,5,4,5,5,4,5,1,1,2,80,30,5,5,7,7,5,4,5,4,3,3,3,4,4,5,2,5,6,2,3,5,3,5,0,2,3,4,5,3,2,3,1,5,3,4,3,3,2,1,2,4,0,3,3,5,5,4,4,5,3,1,3,2,1,2,3,2,1,4,5,5,4,4,5,5,4,4,4,3,4,4,4,5,3,2,3,1,4,1,1,2061.736,14,NA,10,NA,1,2,"03/01/2023 14:49",NA,NA,NA,1,"Mozilla/5.0 (Linux; Android 13; SM-G781B) AppleWebKit/537.36 (KHTML, like Gecko) Chrome/110.0.0.0 Mobile Safari/537.36","d6p2fmk6xdddavyn","2dv64szghzgjrg8b",NA,NA,"sa","/survey/selfserve/53b/g004/230146?list=1&ID=237301716006975","2dv64szghzgjrg8b","237301716006975",439,2023-04-14 13:44:00,3,1,1,1,1,1,1,2,43,2,"",2,"",3,6,4,3,3,3,4,2,4,2,5,6,1,0,5,5,3,0,3,4,3,2,5,4,2,2,3,1,5,5,3,3,1,3,NA,NA,"",NA,"",NA,NA,NA,"",5,5,NA,NA,NA,NA,NA,NA,NA,NA,NA,"",NA,"",0,0,0,0,0,0,1,0,0,0,"","",1,1,4,"",1,4,5,2,NA,3,"",2,3,NA,NA,NA,"",1,2,1,"Yoga",2,NA,4,"","","Auch für körperlich beeinträchtigte Leute",NA,NA,2,"",NA,NA,NA,"","","",NA,NA,2,"",NA,NA,NA,"","","",5,4,2,"",NA,NA,NA,"","","",2,1,3,"",NA,NA,NA,"","","",4,4,2,"",NA,NA,NA,"","","",5,5,1,"Persönliche und fachliche",1,3,NA,"","","",NA,NA,2,"",NA,NA,NA,"","","",4,5,2,"",NA,NA,NA,NA,"",NA,4,5,2,"",NA,NA,NA,"",5,5,1,"Mobiles arbeiten, Gleitzeit",1,5,NA,"","","",NA,NA,2,"",NA,NA,NA,"","","",5,5,2,"",NA,NA,NA,"","","",5,5,1,"Keine Ahnung, bin nicht Zielgruppe",NA,NA,NA,NA,"","",NA,NA,2,"",NA,NA,NA,NA,"","",4,5,0,0,0,0,0,0,0,0,0,1,"Keine",1,0,0,1,0,1,0,1,0,0,"",1,0,0,0,0,1,0,0,0,0,"",1,1,NA,NA,NA,NA,3,NA,NA,NA,"",5,5,3,NA,2,2,3,2,1,1,2,"",3,3,4,2,80,20,5,4,4,3,5,5,4,2,2,4,3,2,3,2,1,4,5,5,4,4,5,5,3,4,1,3,1,2,1,2,5,4,5,3,4,4,2,4,3,2,3,2,4,4,5,5,4,4,3,2,4,3,2,5,3,5,3,4,3,5,4,3,5,4,4,5,1,3,1,3,1,4,5,2,1,2,1,1,1,1,3,1,1,1,3,1,2,1,1,1,1,3,4,5,3,1,1,1,5,1,2,1,3,1,1,1,1,1,1,1,3321.65,1,"2dv64szghzgjrg8b",NA,NA,"sa","/survey/selfserve/53b/g004/230372?list=1&ID=241183254220901","2dv64szghzgjrg8b","241183254220901",34.3622666666667,55.3608333333333,-10,12015,"01-01-2015",2015-01-01,100,8,4,8.04,3136,2015,8,4.33333333333333,3.5,3,3.33333333333333,2,5,2,1,3.5,3,4.66666666666667,4.5,4,5.2,3,3.75,2.66666666666667,3.16666666666667,3,4.44444444444444,5,4,4.33333333333333,4.33333333333333,1.75,4.8,5,4.66666666666667,5,4.66666666666667,5.8,3.18181818181818,4.6,2.33333333333333,1.66666666666667,3.83333333333333,2,4.66666666666667,4.33333333333333,4.33333333333333,4,4,5,5,4,38.41,40.07,38.71,47.67,35.81,29.53,21.4,45.66,34.122731,24.005981,54.6347431,45.2663531,3.44444444444444,2,3,2,2.9,2.5,3.16666666666667,2.33333333333333,2.66666666666667,1,3.33333333333333,38.41,40.07,38.71,47.67,35.81,49.47,31.62,45.66,45.7141874,35.5974374,51.8997381,42.5313481,3.11111111111111,4,4,5,3,3.83333333333333,3,4.25,1.75,3.45454545454545,4.2,2.66666666666667,3,3.75,2,4.66666666666667,4.33333333333333,4,1.66666666666667,3.6,3,4,3.625,4,2.5,3,4.07692307692308,4,3.75,4.5,2.57142857142857,1.33333333333333,2,2,1.4,1.25,3.25,3,1,1.3,1,1.33333333333333,1.5,1,2,4,4,4.66666666666667,3.5,3.33333333333333,2.66666666666667,3.75
"115",313,"btn7mwpfqdx5q3f2","03/01/2023 15:07","qualified,/Age/gcKvr,20230301_12:51_v2,/Gender/X0TrF,/HomeOffice/oPdDr,/Total/Total",3,1,1,1,1,1,1,2,44,1,3,"",3,1,"",2,1,3,4.202,34,34,2,NA,NA,NA,10,"","Krankenpfleger",5,1,3,1,NA,NA,NA,NA,NA,NA,NA,NA,NA,NA,NA,NA,NA,NA,NA,NA,NA,NA,NA,NA,NA,NA,NA,NA,NA,2,3,4,4,3,1,5,5,5,4,5,4,2,1,3,3,3,4,2,3,3,4,2,2,3,3,3,1,9,3,3,5,6,3,3,4,4,4,4,4,4,3,3,4,4,3,3,3,1,2,3,3,3,3,4,4,4,4,4,5,3,1,1,1,1,1,3,3,1,1,1,1,1,1,1,1,1,1,1,1,5,1,1,1,NA,NA,0,1,1,1,1,1,4,7,3,2,1,2,2,1,2,1,3,3,2,4,1,1,0,4,0,1,4,2,2,1,5,2,1,1,5,2,3,2,0,3,0,3,0,0,5,5,5,5,5,4,4,3,3,3,4,4,3,3,4,4,5,4,4,3,3,3,2,3,3,3,4,4,4,3,3,3,3,3,3,1,1056.442,4,NA,12,NA,5,6,"03/01/2023 14:49",NA,NA,NA,1,"Mozilla/5.0 (Windows NT 10.0; Win64; x64; rv:109.0) Gecko/20100101 Firefox/110.0","04swth9rhcx6wqtq","kjdgpdctktufphjn",NA,NA,"..","/survey/selfserve/53b/g004/230146?list=1&ID=237301715992648","vss1y2czmm7ftd1c","237301715992648",380,2023-04-14 09:36:00,3,1,1,1,1,1,1,2,44,2,"",2,"",4,6,3,2,2,2,3,1,2,1,1,2,3,5,1,1,0,5,0,3,2,4,3,2,1,4,3,3,2,2,1,4,1,2,NA,NA,"",NA,"",NA,NA,NA,"",1,1,NA,NA,NA,NA,NA,NA,NA,NA,NA,"",NA,"",0,0,0,0,0,0,0,0,1,0,"","",2,NA,NA,"",2,NA,NA,NA,NA,NA,"",0,2,NA,NA,NA,"",1,1,2,"",NA,NA,NA,"","","",1,1,2,"",NA,NA,NA,"","","",1,1,2,"",NA,NA,NA,"","","",1,1,2,"",NA,NA,NA,"","","",1,1,2,"",NA,NA,NA,"","","",1,1,2,"",NA,NA,NA,"","","",1,1,1,"diverse fachliche",1,5,NA,"","","",NA,NA,2,"",NA,NA,NA,"","","",1,1,2,"",NA,NA,NA,NA,"",NA,1,1,2,"",NA,NA,NA,"",1,1,1,"teilzeit",1,5,NA,"","","",NA,NA,3,"",NA,NA,NA,"","","",1,1,2,"",NA,NA,NA,"","","",1,1,2,"",NA,NA,NA,NA,"","",3,1,2,"",NA,NA,NA,NA,"","",1,1,0,0,0,0,0,0,0,0,0,1,"keine",0,0,0,0,0,0,0,0,0,1,"keine",0,0,0,0,0,0,0,0,0,1,"keine",3,2,NA,NA,NA,NA,1,2,NA,2,"",NA,NA,1,1,3,3,3,3,3,3,2,"",2,2,1,1,0,0,1,5,5,5,5,5,5,5,3,3,3,5,3,2,2,4,4,4,3,3,3,2,2,2,2,3,2,2,2,2,3,2,3,2,2,1,1,1,3,2,2,2,2,1,1,3,3,3,3,3,4,2,1,3,3,4,3,3,3,3,3,3,4,3,3,3,1,1,1,1,1,1,1,2,2,2,1,2,2,1,1,4,4,5,4,3,2,1,3,1,3,2,2,3,2,4,4,2,1,2,2,2,3,2,2,2,3,1,3,3,1130.49,5,"kjdgpdctktufphjn",NA,NA,"..","/survey/selfserve/53b/g004/230372?list=1&ID=241166931202300","vss1y2czmm7ftd1c","241166931202300",17.6073666666667,18.8415,0,42020,"01-04-2020",2020-04-01,37,3,1,3.01,1219,2020,3,3.66666666666667,2,5,4.33333333333333,1.5,3,3.5,2.5,3.5,2,3,3,1,5.2,3.2,4,4,3.66666666666667,2.4,3.55555555555556,3,3.66666666666667,4,1,1,1,1,1,1,1,1,4.18181818181818,5,3.66666666666667,3.33333333333333,3.5,3.33333333333333,4.33333333333333,3.66666666666667,2.66666666666667,3.5,3,3,3,3,46.43,48.33,53.98,53.35,55.62,55.25,49.59,52.42,63.4760461,53.3592961,62.599738,53.231348,2,2,1,1,1.4,1,1.66666666666667,1.44444444444444,2.66666666666667,1.66666666666667,0,46.43,48.33,46.92,53.35,45.16,55.25,49.59,52.42,61.9902487,51.8734987,58.0346526,48.6662626,2,2,2,3,2,2.08333333333333,1.5,2.375,3,4.45454545454545,5,4.33333333333333,3.66666666666667,2.83333333333333,2.33333333333333,4,3,2,2.16666666666667,1.86666666666667,3,3,2.75,3.16666666666667,1.5,3,3.15384615384615,3,3.25,3.25,1,1.83333333333333,1,2.78571428571429,4,1.75,2.5,2,5,2.8,3.33333333333333,3,2.25,2.25,1,1,1,2.66666666666667,2,1,2.33333333333333,1.5
"116",314,"f07rs17z4zq0s1a9","03/01/2023 15:10","qualified,20230301_12:51_v2,/Gender/X0TrF,/Age/b3xfu,/HomeOffice/ZRYex,/Total/Total",3,1,1,1,1,1,1,2,63,2,4,"",5,1,"",2,1,6,11.1991,39,43,2,NA,NA,NA,1,"","elektr. Ingenieur",8,2,1,2,2,2,1,NA,59,NA,NA,NA,NA,NA,NA,NA,NA,NA,1,NA,NA,NA,NA,NA,NA,NA,NA,NA,NA,2,4,4,4,4,1,5,5,5,5,5,4,1,1,3,3,1,3,2,1,4,4,4,3,3,4,4,1,5,4,4,6,9,3,4,5,5,4,5,4,5,4,4,4,4,4,3,4,4,3,4,4,4,4,4,4,4,4,4,4,4,3,2,2,2,4,5,5,5,5,5,3,2,2,2,4,5,5,2,2,4,4,1,2,2,75,10,4,3,3,1,3,5,10,2,1,1,1,2,1,1,1,0,0,1,0,0,0,0,0,0,1,4,2,1,1,4,1,2,1,4,5,5,5,5,3,3,5,4,3,4,4,4,4,5,5,4,4,4,4,4,4,4,4,5,5,5,4,4,4,4,4,4,5,4,5,5,5,5,4,1,1,1,2,1,1,1274.106,4,NA,10,NA,5,6,"03/01/2023 14:49",NA,NA,NA,1,"Mozilla/5.0 (Windows NT 10.0; Win64; x64) AppleWebKit/537.36 (KHTML, like Gecko) Chrome/110.0.0.0 Safari/537.36","sd850tg0sdgd87sh","tnkdq0tsxktsk03n",NA,NA,"..","/survey/selfserve/53b/g004/230146?list=1&ID=237301715981447","tnkdq0tsxktsk03n","237301715981447",538,2023-04-14 14:10:00,3,1,1,1,1,1,1,2,63,2,"",2,"",5,9,2,1,1,1,2,1,1,1,0,0,0,0,0,0,0,0,0,2,1,5,1,1,1,5,1,5,1,1,1,4,1,1,2,NA,"",NA,"",2,NA,2,"",NA,NA,1,1,0,0,0,0,0,0,0,"",1,"",0,0,0,0,0,0,1,0,0,0,"","",1,2,2,"",3,NA,NA,NA,NA,NA,"",2,3,NA,NA,NA,"",2,2,1,"Fitnessstudio",2,NA,2,"","","",NA,NA,3,"",NA,NA,NA,"","","",NA,NA,3,"",NA,NA,NA,"","","",2,2,3,"",NA,NA,NA,"","","",2,1,3,"",NA,NA,NA,"","","",2,2,2,"",NA,NA,NA,"","","",2,2,1,"Fachliche Kurse",1,5,NA,"","","",NA,NA,1,"Ergonomie am Arbeitsplatz",1,5,NA,"","","",NA,NA,1,"Arbeitssicherheit",2,NA,2,NA,"",NA,NA,NA,3,"",NA,NA,NA,"",2,2,1,"flexible Arbeitszeit",1,5,NA,"","","",NA,NA,3,"",NA,NA,NA,"","","",1,1,1,"Betriebskindergarten, -krippe",2,NA,2,"","","",NA,NA,3,"",NA,NA,NA,NA,"","",2,1,3,"",NA,NA,NA,NA,"","",1,1,0,0,0,1,0,0,0,0,0,0,"",0,0,0,1,0,0,0,0,0,0,"",0,0,0,1,0,0,0,0,0,0,"",1,1,NA,NA,NA,NA,1,1,5,NA,"",NA,NA,1,1,1,1,5,5,4,5,2,"",5,1,4,2,66,0,5,5,5,5,5,5,5,4,4,4,4,5,5,5,5,5,5,5,5,5,5,4,4,4,3,3,3,2,2,2,4,4,4,4,4,3,4,4,4,4,4,4,4,3,3,4,5,4,2,1,4,5,5,4,4,4,3,4,1,4,4,4,4,4,4,4,1,1,1,3,1,1,3,1,1,1,1,1,1,1,1,5,4,4,5,5,4,1,2,2,4,4,4,4,1,4,3,3,1,4,4,4,3,3,3,3,5,4,4,4,1160.56,5,"tnkdq0tsxktsk03n",NA,NA,"..","/survey/selfserve/53b/g004/230372?list=1&ID=241183254200352","tnkdq0tsxktsk03n","241183254200352",21.2351,19.3426666666667,-10,111991,"01-11-1991",1991-11-01,378,31,6,31.06,11598,1991,32,4,2.5,5,4.66666666666667,1,3,2,1.5,4,3.5,3.66666666666667,3.5,1,5.6,3.8,5,4,4.25,3.6,4,4,4,4,5,2.25,3.6,4.5,3,4.5,3,2.8,4.18181818181818,4.2,4.33333333333333,4,4.25,4,5,4,4,4.83333333333333,5,5,5,3.66666666666667,52.83,54.05,53.98,60.77,55.62,55.25,56.79,52.42,67.5970951,57.4803451,66.0444512,56.6760612,0.111111111111111,2,2,2,1.5,1.5,1.5,4.22222222222222,4.33333333333333,5,3.33333333333333,52.83,54.05,53.98,60.77,55.62,55.25,56.79,52.42,67.5970951,57.4803451,66.0444512,56.6760612,0,1,1,1,2,1.08333333333333,1.25,1,4.75,4.63636363636364,5,4.33333333333333,4.33333333333333,4.75,5,5,5,4,2.5,3.8,4,5,4.5,4.33333333333333,5,5,4,4.2,3.75,4,1.57142857142857,1,1,3.5,4.6,2.25,4,1,5,3.6,3.33333333333333,4.33333333333333,3.25,4,2.6,1,5,4,4,3.66666666666667,4,3.5
"117",315,"tnjxrqhgcwc18hvx","03/01/2023 15:17","qualified,/Age/gcKvr,20230301_12:51_v2,/Gender/X0TrF,/HomeOffice/oPdDr,/Total/Total",3,1,1,1,1,1,1,2,50,1,3,"",3,1,"",3,1,5,1.1996,40,40,2,NA,NA,NA,10,"","Altenpflege , Gruppenleiter",5,10,4,2,2,2,2,1,17,NA,NA,NA,NA,NA,NA,NA,NA,NA,2,NA,NA,NA,NA,NA,NA,NA,NA,NA,5,2,4,5,4,5,5,4,4,4,4,2,4,1,1,4,4,1,1,1,1,4,4,3,3,3,3,2,3,2,1,2,6,2,3,3,4,4,5,4,4,2,3,3,3,3,3,5,3,3,3,2,4,4,4,5,3,4,4,3,4,2,2,2,1,1,2,5,5,4,2,3,2,2,2,2,2,1,1,1,1,5,1,1,1,NA,NA,0,6,6,1,1,6,3,6,3,3,3,4,3,2,2,1,3,4,4,4,4,3,4,2,3,3,3,3,3,1,5,2,2,1,1,2,2,2,2,2,2,6,3,2,5,5,4,5,4,5,5,3,4,3,3,4,4,3,5,5,5,5,4,4,3,3,3,5,5,5,5,5,5,4,1,3,1,1,1,1,1576.625,4,NA,10,NA,5,6,"03/01/2023 14:50",NA,NA,NA,1,"Mozilla/5.0 (Windows NT 10.0; Win64; x64) AppleWebKit/537.36 (KHTML, like Gecko) Chrome/110.0.0.0 Safari/537.36","69jg5u9dvuqf4b21","c4104zt7bcn3yswu",NA,NA,"..","/survey/selfserve/53b/g004/230146?list=1&ID=237301716003850","c4104zt7bcn3yswu","237301716003850",536,2023-04-14 14:14:00,3,1,1,1,1,1,1,2,50,2,"",2,"",3,6,4,3,3,4,3,2,3,4,4,4,4,4,5,5,4,4,3,5,4,2,4,4,3,2,4,2,3,4,1,1,1,2,NA,NA,"",NA,"",NA,NA,NA,"",5,5,NA,NA,NA,NA,NA,NA,NA,NA,NA,"",NA,"",0,0,0,0,0,0,1,0,0,0,"","",2,NA,NA,"",2,NA,NA,NA,NA,NA,"",0,2,NA,NA,NA,"",3,3,2,"",NA,NA,NA,"","","",5,5,2,"",NA,NA,NA,"","","",5,5,2,"",NA,NA,NA,"","","",5,5,2,"",NA,NA,NA,"","","",3,3,2,"",NA,NA,NA,"","","",5,5,2,"",NA,NA,NA,"","","",5,5,2,"",NA,NA,NA,"","","",1,1,2,"",NA,NA,NA,"","","",3,3,2,"",NA,NA,NA,NA,"",NA,5,5,3,"",NA,NA,NA,"",5,5,2,"",NA,NA,NA,"","","",5,5,3,"",NA,NA,NA,"","","",5,5,2,"",NA,NA,NA,"","","",5,3,2,"",NA,NA,NA,NA,"","",5,1,2,"",NA,NA,NA,NA,"","",5,5,0,0,0,0,0,0,0,0,0,1,"keine",1,0,1,0,0,0,0,0,0,0,"",1,0,1,0,0,0,0,0,0,0,"",3,1,NA,NA,NA,NA,2,NA,NA,NA,"",5,5,2,NA,2,2,5,5,5,3,2,"",1,1,1,1,0,0,1,4,4,4,5,5,3,4,2,2,2,3,3,3,2,5,5,5,2,3,2,2,3,3,4,4,4,4,4,4,4,4,4,4,4,4,4,4,4,4,4,4,4,4,4,5,5,5,1,1,5,4,4,4,3,5,3,5,4,4,4,3,5,5,5,5,3,5,3,3,3,3,3,1,1,1,5,5,3,4,1,2,2,1,3,2,2,5,5,3,2,2,3,3,5,2,2,5,5,2,2,2,2,2,2,2,5,2,2,1,1734.81,5,"ks24fn0uq3jv84nf",NA,NA,"..","/survey/selfserve/53b/g004/230372?list=1&ID=241183254218829","ks24fn0uq3jv84nf","241183254218829",26.2770833333333,28.9135,0,11996,"01-01-1996",1996-01-01,328,27,4,27.04,10076,1996,27,4.33333333333333,5,4,3.33333333333333,1,4,1,1,4,3,2.66666666666667,3,3,2.6,3.2,3.5,3.66666666666667,3.41666666666667,3.4,3.66666666666667,3.33333333333333,4,3.66666666666667,3,2,1.2,1.5,1,1.5,1,4,4.18181818181818,4.6,4.33333333333333,3.33333333333333,4,3.66666666666667,5,4.33333333333333,3,5,5,5,5,3.83333333333333,46.43,40.07,38.71,40.07,45.16,49.47,49.59,52.42,64.0740235,53.9572735,46.8738117,37.5054217,3.44444444444444,3,1,5,2.4,2,2.66666666666667,2.55555555555556,2,3.33333333333333,2.33333333333333,38.41,40.07,38.71,40.07,45.16,49.47,41.53,29.25,49.1966652,39.0799152,46.8160111,37.4476211,4.11111111111111,4,4,4,5,3.66666666666667,3.25,3.875,4.5,3.45454545454545,4.4,3,2.33333333333333,3.16666666666667,2.66666666666667,5,2.33333333333333,2.66666666666667,4,4,5,5,4.75,5,4,2,4.07692307692308,3.4,4,5,3.28571428571429,2.66666666666667,2.5,2.85714285714286,2,3.75,2.5,5,1,2.2,3,1.66666666666667,2,2.75,1.6,3,3,4,4,4,4,4
"118",317,"patu8m4xaqrz161g","03/01/2023 15:14","qualified,/Gender/p47uy,/Age/gcKvr,20230301_12:51_v2,/HomeOffice/ZRYex,/Total/Total",3,1,1,1,1,1,1,1,45,1,5,"",3,1,"",2,1,6,12.201,38,42,2,NA,NA,NA,4,"","Kauffrau im Büromanagement",6,1,4,1,NA,NA,NA,NA,NA,NA,NA,NA,NA,NA,NA,NA,NA,NA,NA,NA,NA,NA,NA,NA,NA,NA,NA,NA,NA,1,4,4,2,4,3,5,5,4,5,5,5,1,1,2,3,1,2,1,1,3,3,4,3,5,4,4,2,7,2,4,4,4,3,4,5,5,4,5,5,5,5,5,5,4,4,4,3,5,4,3,4,4,4,3,3,5,3,3,4,3,4,2,2,1,4,5,4,3,4,4,1,1,1,1,3,2,5,5,5,4,4,1,1,2,66,0,2,2,1,4,1,5,8,2,1,1,2,2,2,3,1,1,2,1,1,1,1,1,1,0,2,4,2,1,1,4,1,3,1,4,4,5,5,6,5,5,5,5,3,4,5,4,4,5,4,4,4,4,3,4,5,4,4,5,5,5,4,3,3,4,4,3,4,4,4,4,4,5,4,2,4,4,3,4,1,1431.083,4,NA,10,NA,5,6,"03/01/2023 14:50",NA,NA,NA,1,"Mozilla/5.0 (Windows NT 10.0; Win64; x64) AppleWebKit/537.36 (KHTML, like Gecko) Chrome/110.0.0.0 Safari/537.36 Edg/110.0.1587.50","7xumhnjypg57039s","rjhbs2j8p7x123s4",NA,NA,"..","/survey/selfserve/53b/g004/230146?list=1&ID=237301715995768","d8s3730t0fwmpkva","237301715995768",629,2023-04-14 16:17:00,3,1,1,1,1,1,1,1,45,2,"",2,"",4,8,3,1,1,2,2,2,3,1,1,1,2,0,1,1,0,0,0,3,1,4,2,2,1,5,1,5,2,2,1,3,1,1,2,NA,"",NA,"",1,4,NA,"",NA,NA,1,0,0,0,0,0,0,1,0,"",8,"",0,1,0,0,0,0,1,1,0,0,"","",1,2,2,"",1,1,5,1,4,NA,"",2,1,2,NA,2,"",NA,NA,1,"Fitnesskursmitgliedschaft, Firmenlauf, Yoga, Fahrradmietung",1,5,NA,"","","",NA,NA,1,"yoga, Meditation, Zuschuss zu seperaten Gruppenkursen",1,5,NA,"","","",NA,NA,1,"veganes und vegetarische Speisen, weniger Fett.",1,5,NA,"","","",NA,NA,3,"",NA,NA,NA,"","","",3,2,1,"Broschüren und Plakate.",2,NA,2,"","","",NA,NA,1,"Kurse für Mitarbeiter, meist Führungskräfte, Feiern, Ruheräume",1,5,NA,"","","",NA,NA,1,"externe und interne Kurse.",1,5,NA,"","","",NA,NA,1,"ergonomische Stühle, Arbeitsgeräte, wie Maus und Tastatur, wie auch Schreibtische, die angepasst werden können.",1,5,NA,"","","",NA,NA,2,"",NA,NA,NA,NA,"",NA,4,3,3,"",NA,NA,NA,"",3,2,1,"flexible Arbeitszeit, Home Office, Auszeiten, Mutterschaftsurlaub.",1,5,NA,"","","",NA,NA,1,"Kurse während der Elternzeit, Eingliederung, Teilzeitmodelle.",2,NA,4,"","","mehr Flexibilität im Arbeitskontext und Arbeitszeitmodellen.",NA,NA,1,"Ansprechpartner, Kinderhort",2,NA,4,"","","mehr Möglichkeiten von Arbeit und Kinderbetreuung am Arbeitsplatz.",NA,NA,1,"Quoting, spezielle Bevorzugungen für Frauen bei der Jobbewerbung.",2,NA,2,NA,"","",NA,NA,2,"",NA,NA,NA,NA,"","",4,4,0,0,0,1,0,1,0,1,1,0,"",1,0,0,1,1,1,1,1,1,0,"",1,0,1,1,1,1,0,1,1,0,"",2,1,NA,NA,NA,NA,1,1,3,NA,"",NA,NA,1,1,1,1,5,4,4,3,1,"mehr Hygienekonzepte auch nach Corona",4,1,4,2,21,1,5,4,5,4,4,3,5,4,4,3,3,4,5,5,4,4,4,5,3,3,3,4,4,4,3,3,2,2,4,4,4,3,5,3,5,5,4,4,4,3,4,4,4,4,3,5,5,5,2,2,5,4,4,3,4,4,2,5,3,3,4,3,4,5,5,5,1,1,1,2,1,1,1,2,2,4,2,2,2,1,1,4,4,4,3,5,4,4,5,2,4,4,3,4,3,5,5,5,1,4,5,5,5,5,5,4,5,4,5,4,2633.57,5,"vavy9f5f6b3hb2v0",NA,NA,"..","/survey/selfserve/53b/g004/230372?list=1&ID=241166931203086","b8667jak9bdmrexu","241166931203086",23.8513833333333,43.8928333333333,1,122010,"01-12-2010",2010-12-01,149,12,5,12.05,4628,2010,13,3.33333333333333,3.5,4.66666666666667,5,1,2.5,1.5,1,3,3.5,4.33333333333333,4.5,2,4.2,4.4,5,4.33333333333333,4.58333333333333,4,3.55555555555556,3.66666666666667,3.33333333333333,3.66666666666667,3.66666666666667,1,4,2.5,5,2.5,5,2,4.09090909090909,4.4,4,3.66666666666667,4.08333333333333,4.33333333333333,5,3.33333333333333,3.66666666666667,4.16666666666667,4,2,2,3.16666666666667,52.83,54.05,53.98,53.35,55.62,49.47,41.53,52.42,55.5888021,45.4720521,67.908883,58.540493,1,2,2,2,1.7,1.5,1.83333333333333,4.77777777777778,4.66666666666667,5.33333333333333,4.33333333333333,46.43,54.05,53.98,53.35,55.62,49.47,41.53,52.42,55.3568021,45.2400521,66.628435,57.260045,0.666666666666667,2,1,1,3,1.58333333333333,1.5,1.625,4,3.90909090909091,4,4.33333333333333,3.33333333333333,4,4.66666666666667,4.33333333333333,3,4,3,3.93333333333333,4,4,4.5,4.66666666666667,4,3,3.84615384615385,3.2,3.75,4.75,1.14285714285714,2.33333333333333,1,3.78571428571429,4,3.75,3.75,3,5,4.9,5,4.66666666666667,5,4.5,2.6,2,5,4,4,4.33333333333333,3.66666666666667,3.75
"119",318,"7g1ge3ebbddrqjz3","03/01/2023 15:32","qualified,20230301_12:51_v2,/Gender/X0TrF,/HomeOffice/oPdDr,/Age/b3xfu,/Total/Total",3,1,1,1,1,1,1,2,60,2,5,"",6,1,"",4,1,6,8.1986,40,45,2,NA,NA,NA,6,"","Chief Complience und Risikomanagement",8,2,1,2,3,3,1,NA,56,19,NA,NA,NA,NA,NA,NA,NA,NA,1,2,NA,NA,NA,NA,NA,NA,NA,NA,NA,2,4,5,3,5,4,5,5,5,4,4,5,1,2,3,2,5,2,1,1,5,5,5,5,5,5,4,3,7,5,8,9,6,3,4,5,5,4,5,5,5,4,4,5,5,4,5,5,4,5,4,4,4,5,5,5,4,4,5,4,2,2,4,5,1,4,5,5,5,5,4,1,1,1,2,4,4,3,2,2,4,3,1,2,2,20,20,3,3,2,4,2,5,10,3,1,1,1,2,1,1,1,0,0,0,1,0,0,1,0,0,1,5,2,2,2,4,2,3,1,3,5,6,5,5,5,5,6,5,5,5,5,4,4,4,4,5,4,4,4,4,5,5,4,5,5,5,4,5,4,5,5,5,5,5,5,5,5,5,4,1,4,1,4,2,1,2456.323,4,NA,10,NA,5,6,"03/01/2023 14:51",NA,NA,NA,1,"Mozilla/5.0 (Windows NT 10.0; Win64; x64) AppleWebKit/537.36 (KHTML, like Gecko) Chrome/110.0.0.0 Safari/537.36","cy6fy033uvt31hp2","eu9x25p5t0m2r9uv",NA,NA,"..","/survey/selfserve/53b/g004/230146?list=1&ID=237301715985615","eu9x25p5t0m2r9uv","237301715985615",615,2023-04-14 15:32:00,3,1,1,1,1,1,1,2,61,2,"",2,"",5,9,3,1,1,1,2,1,1,1,1,1,0,0,0,0,0,0,0,1,1,4,2,2,1,3,1,5,2,2,1,3,1,1,2,NA,"",NA,"",1,4,NA,"",NA,NA,1,0,0,0,0,0,0,0,0,"",1,"",1,1,0,0,0,0,1,0,0,0,"","",1,3,NA,"",1,6,3,2,NA,2,"",3,1,2,NA,2,"",NA,NA,1,"betriebseigene Veranstaltungen",2,NA,2,"","","",NA,NA,1,"Stressbewältigung und -vorbeugung",2,NA,2,"","","",NA,NA,1,"Ernährungsberatung",2,NA,2,"","","",NA,NA,2,"",NA,NA,NA,"","","",3,3,2,"",NA,NA,NA,"","","",2,2,1,"interne Schulung",2,NA,2,"","","",NA,NA,1,"so ziemlich jede Art fachlich und Personalführung",1,5,NA,"","","",NA,NA,1,"interne Schulung",2,NA,2,"","","",NA,NA,1,"interne Schulung",1,5,NA,NA,"",NA,NA,NA,1,"interne Fachkraft",1,5,NA,"",NA,NA,1,"flexible Arbeitszeiten",2,NA,2,"","","",NA,NA,1,"interne Schulung",2,NA,2,"","","",NA,NA,1,"betrieseigene Kinderbetreuung; Zuschüsse für Betreuung",2,NA,2,"","","",NA,NA,1,"interne Ansprechpartner",NA,NA,NA,NA,"","",NA,NA,2,"",NA,NA,NA,NA,"","",3,3,0,1,0,1,0,1,1,1,1,0,"",1,0,0,0,0,0,0,0,0,0,"",1,0,0,0,0,0,0,0,0,0,"",1,1,NA,NA,NA,NA,1,2,NA,2,"",NA,NA,1,1,1,3,4,4,3,3,2,"",5,5,3,2,20,20,5,5,5,5,5,5,5,5,4,4,4,4,5,5,4,5,5,5,5,4,5,5,4,5,3,3,3,3,3,3,4,4,4,4,4,4,4,4,5,4,5,4,4,4,4,4,4,4,2,2,4,4,4,3,3,3,3,3,2,4,4,3,4,4,3,4,1,1,1,2,1,1,3,1,1,1,1,1,1,1,1,4,4,4,4,4,2,2,3,2,4,3,3,4,3,5,5,5,4,4,4,4,4,4,4,5,5,4,4,5,1376.07,5,"t451xe8nxqgbunb4",NA,NA,"..","/survey/selfserve/53b/g004/230372?list=1&ID=241183254205533","6eaye64y9t4v19sw","241183254205533",40.9387166666667,22.9345,0,81986,"01-08-1986",1986-08-01,441,36,9,36.09,13516,1986,37,4,4.5,5,4.33333333333333,1.5,2.5,3.5,1,5,5,4.66666666666667,5,3,7,4,5,4.66666666666667,4.5,4.6,4.44444444444444,4,5,4.33333333333333,4.66666666666667,1.25,3,4,2.33333333333333,4,2.33333333333333,2.8,4.27272727272727,4.4,4.33333333333333,4,4.75,4.66666666666667,5,4.33333333333333,5,5,5,5,4,4.33333333333333,46.43,54.05,53.98,60.77,55.62,55.25,56.79,52.42,67.3650951,57.2483451,64.7640032,55.3956132,0.222222222222222,1,2,3,1.9,2,1.83333333333333,5.22222222222222,5.33333333333333,5.33333333333333,5,46.43,54.05,53.98,60.77,55.62,55.25,56.79,52.42,67.3650951,57.2483451,64.7640032,55.3956132,0.222222222222222,2,3,1,3,1.75,2,1.625,3.5,4.63636363636364,5,4.66666666666667,4,4.75,4.66666666666667,5,4.66666666666667,4.66666666666667,3,4.13333333333333,4,4,4,4,4,4,3.46153846153846,3.6,3,3.75,1.42857142857143,1,1,3.28571428571429,4,2.25,3.5,3,2,4.1,5,3.33333333333333,4,4.5,3.2,3,5,4,4,4,4.66666666666667,4
"120",323,"m3g47nmuten92nbs","03/01/2023 15:19","qualified,/Gender/p47uy,/Age/gcKvr,20230301_12:51_v2,/HomeOffice/ZRYex,/Total/Total",3,1,1,1,1,1,1,1,45,1,5,"",6,1,"",3,1,3,5.2018,25,30,2,NA,NA,NA,9,"","Sprachdozentin",4,2,5,2,3,3,2,2,16,16,NA,NA,NA,NA,NA,NA,NA,NA,2,2,NA,NA,NA,NA,NA,NA,NA,NA,5,2,4,4,4,4,4,4,3,4,4,4,4,2,2,3,3,3,4,2,2,4,3,3,3,3,4,4,1,6,5,6,6,5,4,4,3,4,4,4,4,4,4,4,4,3,4,4,4,4,5,4,4,4,4,4,4,4,4,4,3,4,4,4,3,3,3,4,4,4,5,4,1,1,1,1,4,5,5,5,5,3,4,4,4,3,98,53,5,5,4,5,5,4,9,4,3,2,4,3,4,3,2,4,4,0,0,0,1,1,0,1,3,3,3,3,3,3,3,3,3,3,2,4,3,4,4,4,4,4,2,4,5,5,4,4,5,4,4,4,4,4,4,3,3,3,4,4,4,4,4,4,4,4,3,3,3,3,3,3,4,2,3,3,4,3,1,1365.843,4,NA,10,NA,5,6,"03/01/2023 14:55",NA,NA,NA,1,"Mozilla/5.0 (Windows NT 10.0; Win64; x64) AppleWebKit/537.36 (KHTML, like Gecko) Chrome/110.0.0.0 Safari/537.36","m5ung62gdyadm2cu","344zje9a4753atvw",NA,NA,"..","/survey/selfserve/53b/g004/230146?list=1&ID=237301715992636","344zje9a4753atvw","237301715992636",392,2023-04-14 09:32:00,3,1,1,1,1,1,1,1,45,2,"",2,"",4,6,3,3,3,3,4,3,3,3,2,3,1,2,1,1,1,1,2,2,2,2,3,3,3,2,3,3,3,2,3,3,1,2,NA,NA,"",NA,"",NA,NA,NA,"",3,3,NA,NA,NA,NA,NA,NA,NA,NA,NA,"",NA,"",0,0,0,0,0,0,1,0,0,0,"","",2,NA,NA,"",2,NA,NA,NA,NA,NA,"",0,2,NA,NA,NA,"",3,4,2,"",NA,NA,NA,"","","",4,4,2,"",NA,NA,NA,"","","",4,4,2,"",NA,NA,NA,"","","",3,3,2,"",NA,NA,NA,"","","",3,3,2,"",NA,NA,NA,"","","",3,2,3,"",NA,NA,NA,"","","",3,4,1,"Online Kurse",1,4,NA,"","","",NA,NA,2,"",NA,NA,NA,"","","",3,3,3,"",NA,NA,NA,NA,"",NA,3,3,3,"",NA,NA,NA,"",3,3,1,"Home >Office",1,5,NA,"","","",NA,NA,3,"",NA,NA,NA,"","","",3,3,2,"",NA,NA,NA,"","","",3,3,2,"",NA,NA,NA,NA,"","",3,3,1,"keine",2,NA,2,NA,"","",NA,NA,0,0,0,1,0,0,0,0,0,0,"",1,0,0,0,0,0,0,0,0,0,"",1,0,1,0,0,0,0,0,0,0,"",2,1,NA,NA,NA,NA,2,NA,NA,NA,"",2,2,2,NA,2,2,3,3,3,3,2,"",5,5,5,3,99,99,3,5,4,4,5,4,4,4,4,4,4,4,4,3,3,4,4,4,4,4,3,4,4,4,3,3,3,3,3,3,3,4,3,3,3,3,2,3,3,3,3,3,3,3,3,5,4,4,4,4,4,4,4,4,4,3,3,3,3,4,4,4,4,4,4,4,3,3,2,3,3,3,3,3,1,3,3,3,2,1,2,4,3,3,3,4,4,3,3,4,3,4,4,4,3,3,4,3,3,3,3,3,3,4,3,4,3,3,3,3,847.99,5,"vzw5t01rukuv34eg",NA,NA,"..","/survey/selfserve/53b/g004/230372?list=1&ID=241166931202297","vzw5t01rukuv34eg","241166931202297",22.76405,14.1331666666667,46,52018,"01-05-2018",2018-05-01,60,5,0,5,1920,2018,5,4,4,3.66666666666667,4,2,3,3.5,2,3.5,3,3.66666666666667,3.5,1,5.6,4,3.75,3.66666666666667,3.83333333333333,4.2,4,4,4,4,4.33333333333333,1,4.8,4.5,5,4.5,5,4.8,4.27272727272727,4.4,4.33333333333333,4,3.75,3.33333333333333,3.66666666666667,4,4,3,4,3,3,3.5,38.41,40.07,46.92,40.07,45.16,29.53,41.53,45.66,49.7789459,39.6621959,51.1932168,41.8248268,1.22222222222222,3,3,3,3,3,3,3.44444444444444,3.33333333333333,3.66666666666667,3.33333333333333,46.43,40.07,38.71,47.67,35.81,40.41,41.53,38.09,48.3192405,38.2024905,50.2327243,40.8643343,1.55555555555556,4,4,3,3,3,3.25,2.875,3,4.18181818181818,4.4,4,4,3.75,3.33333333333333,4,3.66666666666667,4,3,3,2,2,3.625,3.5,4,3,3.69230769230769,3.8,3.25,4,2.85714285714286,2.5,1.5,3.5,3.4,3.5,3.75,3,3,3.2,3.33333333333333,3,3.25,3.25,3.4,1,5,3.33333333333333,3,2.66666666666667,3,3
"121",327,"22x878tkrw4e890s","03/01/2023 15:10","qualified,/Age/gcKvr,20230301_12:51_v2,/Gender/X0TrF,/HomeOffice/oPdDr,/Total/Total",3,1,1,1,1,1,1,2,41,1,4,"",4,1,"",2,1,5,12.2015,40,6,2,NA,NA,NA,2,"","bauingenieur",8,2,1,2,3,3,2,1,40,7,NA,NA,NA,NA,NA,NA,NA,NA,1,2,NA,NA,NA,NA,NA,NA,NA,NA,2,2,3,3,4,4,5,5,4,4,4,4,4,3,4,4,2,3,3,3,3,3,3,3,3,3,3,3,3,6,6,6,6,7,3,3,3,3,3,3,3,3,3,3,3,3,3,3,3,3,3,3,3,3,3,3,3,3,3,3,3,4,4,4,4,4,4,3,3,5,5,4,2,2,2,2,3,3,3,3,3,4,4,4,4,2,44,9,4,4,4,4,4,3,5,3,2,2,2,2,2,2,2,2,2,2,2,2,2,2,2,2,3,3,3,3,3,3,3,3,3,3,5,5,5,5,5,5,5,5,5,3,3,3,3,3,3,3,3,3,3,3,4,4,4,4,4,4,5,5,5,5,5,5,4,4,4,4,4,4,3,3,3,3,3,3,1,719.612,4,NA,12,NA,5,6,"03/01/2023 14:57",NA,NA,NA,1,"Mozilla/5.0 (Windows NT 10.0; Win64; x64; rv:109.0) Gecko/20100101 Firefox/110.0","1h1dnp91pbqmf5rb","96tc3hwf5qmbmhww",NA,NA,"..","/survey/selfserve/53b/g004/230146?list=1&ID=237301715991602","96tc3hwf5qmbmhww","237301715991602",564,2023-04-14 14:21:00,3,1,1,1,1,1,1,2,41,2,"",2,"",4,7,2,4,4,4,4,3,3,3,5,4,4,4,5,5,5,5,4,4,4,4,4,5,5,5,5,4,4,5,5,4,1,1,1,4,"",7,"",NA,NA,NA,"",NA,NA,NA,NA,NA,NA,NA,NA,NA,NA,NA,"",NA,"",1,1,1,0,0,0,0,0,0,0,"","",1,3,NA,"",1,7,3,1,4,NA,"",3,1,1,4,NA,"",NA,NA,1,"fitnesskurse",1,4,NA,"","","",NA,NA,1,"life balance",1,4,NA,"","","",NA,NA,1,"fit bleiben",1,4,NA,"","","",NA,NA,2,"",NA,NA,NA,"","","",4,4,1,"kurse",1,4,NA,"","","",NA,NA,2,"",NA,NA,NA,"","","",4,4,1,"englisch",1,4,NA,"","","",NA,NA,2,"",NA,NA,NA,"","","",4,4,2,"",NA,NA,NA,NA,"",NA,3,3,2,"",NA,NA,NA,"",4,4,2,"",NA,NA,NA,"","","",4,4,2,"",NA,NA,NA,"","","",4,4,2,"",NA,NA,NA,"","","",4,4,2,"",NA,NA,NA,NA,"","",4,4,2,"",NA,NA,NA,NA,"","",4,4,1,1,0,1,0,0,0,0,0,0,"",0,0,1,1,1,0,0,0,0,0,"",0,0,1,0,1,0,0,1,0,0,"",1,2,NA,NA,NA,NA,2,NA,NA,NA,"",4,4,1,2,2,2,4,4,4,4,2,"",5,5,4,2,71,74,4,4,5,5,5,4,4,4,4,5,5,5,5,4,4,4,5,5,5,4,4,4,5,5,3,3,4,4,4,4,5,4,4,4,5,5,4,4,4,5,5,5,5,4,4,5,4,4,4,5,5,5,5,5,4,4,4,5,5,5,5,4,4,4,4,5,5,4,4,4,4,5,5,3,3,3,3,3,3,3,3,3,3,3,3,3,3,3,3,3,3,3,3,3,3,3,3,3,3,3,3,3,3,3,3,3,3,3,3,3,677.37,5,"96tc3hwf5qmbmhww",NA,NA,"..","/survey/selfserve/53b/g004/230372?list=1&ID=241183254210739","96tc3hwf5qmbmhww","241183254210739",11.9935333333333,11.2895,65,122015,"01-12-2015",2015-12-01,89,7,5,7.05,2802,2015,8,3.33333333333333,4.5,4.33333333333333,4,3.5,3,3,3,3,3,3,3,3,6.2,3,3,3,3,3,3,3,3,3,4.66666666666667,2,3,3,3,3,3,4,3,3,3,3,4.5,4,4,5,5,4,3,3,3,3,46.43,48.33,46.92,53.35,55.62,49.47,49.59,45.66,60.8800965,50.7633465,58.8045092,49.4361192,2,3,3,3,3,3,3,5,5,5,5,52.83,30.31,28.32,40.07,35.81,40.41,41.53,38.09,52.3834503,42.2667003,40.8188254,31.4504354,4.55555555555556,2,1,2,2,3.66666666666667,3.25,3.875,4,4.54545454545455,4.6,4,5,4.5,4.33333333333333,4.66666666666667,4.33333333333333,4.66666666666667,3.66666666666667,4.46666666666667,2,1,3.875,3.5,5,1,4.15384615384615,4,4.25,4.25,4.42857142857143,3,3,3,3,3,3,3,3,3,3,3,3,3,4,3,4,4.33333333333333,4.5,4.33333333333333,4.66666666666667,4.5
"122",329,"rn71ggnutmcesh6h","03/01/2023 15:21","qualified,/Gender/p47uy,/Age/gcKvr,20230301_12:51_v2,/HomeOffice/oPdDr,/Total/Total",3,1,1,1,1,1,1,1,52,1,3,"",4,1,"",3,1,6,9.1993,40,41,2,NA,NA,NA,4,"","Filialleiterin",5,16,4,1,NA,NA,NA,NA,NA,NA,NA,NA,NA,NA,NA,NA,NA,NA,NA,NA,NA,NA,NA,NA,NA,NA,NA,NA,NA,2,3,4,4,4,4,3,4,4,4,3,3,2,5,5,5,2,5,5,3,3,3,2,2,4,4,3,3,10,1,2,6,6,4,4,3,3,3,4,2,3,2,2,3,2,3,3,2,1,1,1,1,1,3,3,2,3,3,1,3,2,4,2,1,1,3,4,5,4,4,4,1,1,1,1,1,1,1,3,1,5,1,1,5,NA,NA,10,3,1,1,1,1,3,7,4,1,1,3,4,3,3,2,6,6,4,6,6,2,2,6,2,3,2,3,3,3,3,5,3,2,3,2,4,3,2,2,3,3,2,2,3,4,4,4,4,3,4,3,2,2,3,3,4,3,4,4,4,3,4,3,3,3,3,2,4,4,3,3,3,4,4,4,2,4,4,1,1285.154,12,NA,11,NA,1,1,"03/01/2023 14:59",NA,NA,NA,1,"Mozilla/5.0 (iPhone; CPU iPhone OS 16_3_1 like Mac OS X) AppleWebKit/605.1.15 (KHTML, like Gecko) Version/16.3 Mobile/15E148 Safari/604.1","znmgk1zwva2xyktx","sxfudbbh8x1394zb",NA,NA,"si","/survey/selfserve/53b/g004/230146?list=1&ID=237301715991604","sxfudbbh8x1394zb","237301715991604",1006,2023-04-17 19:18:00,3,1,1,1,1,1,1,1,52,2,"",2,"",3,6,3,1,1,3,3,2,2,1,5,5,4,5,4,2,2,4,1,5,2,3,3,2,2,4,3,4,3,3,2,3,1,1,2,NA,"",NA,"",2,NA,3,"",NA,NA,0,0,1,0,0,0,1,0,0,"",3,"",0,0,0,1,0,0,1,0,0,0,"","Römisch katholisch Kirche",2,NA,NA,"",2,NA,NA,NA,NA,NA,"",5,1,2,NA,1,"",NA,NA,2,"",NA,NA,NA,"","","",5,5,2,"",NA,NA,NA,"","","",3,3,2,"",NA,NA,NA,"","","",3,3,2,"",NA,NA,NA,"","","",1,1,1,"Online Schulung Arbeitsicherheit für jeden Mitarbeiter",1,4,NA,"","","",NA,NA,1,"Online Schulung Pflicht für alle Ma",1,3,NA,"","","",NA,NA,1,"Online Schulungen Pflicht",1,2,NA,"","","",NA,NA,2,"",NA,NA,NA,"","","",5,5,2,"",NA,NA,NA,NA,"",NA,5,5,2,"",NA,NA,NA,"",3,3,2,"",NA,NA,NA,"","","",5,5,2,"",NA,NA,NA,"","","",1,1,2,"",NA,NA,NA,"","","",1,1,2,"",NA,NA,NA,NA,"","",1,1,2,"",NA,NA,NA,NA,"","",3,3,0,0,0,0,0,1,0,0,0,0,"",1,1,0,0,0,0,0,0,1,0,"",1,1,0,1,0,0,0,0,1,0,"",1,1,NA,NA,NA,NA,2,NA,NA,NA,"",5,5,1,1,2,2,2,2,2,2,2,"",2,2,2,1,0,10,4,4,4,4,4,4,2,4,4,3,3,4,3,3,4,4,4,4,3,4,4,4,3,3,3,3,3,1,3,1,4,3,4,3,3,3,3,3,3,3,3,3,4,4,3,4,3,3,5,5,5,5,5,4,5,4,4,5,2,4,4,4,4,3,4,4,1,1,1,1,1,1,1,5,3,4,3,3,3,3,3,3,3,4,4,3,3,5,3,3,3,3,3,3,3,2,1,3,3,3,3,2,2,2,2,3,3,2,2,3,1320.37,5,"tg50b2awcawu9nnc",NA,NA,"..","/survey/selfserve/53b/g004/230372?list=1&ID=241183254210740","ydu29zyas36u480c","241183254210740",21.4192333333333,22.0061666666667,0,91993,"01-09-1993",1993-09-01,356,29,8,29.08,10928,1993,30,3.66666666666667,4,3.66666666666667,3.33333333333333,3.5,5,3.5,4,3,2,3.66666666666667,4,3,5,2.8,3.25,2.66666666666667,2.91666666666667,2,2,1,2.66666666666667,2.33333333333333,4,1,1.4,1,1.66666666666667,1,1.66666666666667,1.4,3.27272727272727,3.8,3.33333333333333,2.33333333333333,3.41666666666667,3.33333333333333,4,3.33333333333333,3,3.16666666666667,2,4,2,3.33333333333333,38.41,54.05,53.98,47.67,35.81,40.41,41.53,45.66,45.6202016,35.5034516,60.7045694,51.3361794,4.44444444444444,4,3,3,3.2,2.75,3.5,2.55555555555556,2.66666666666667,2.66666666666667,2.33333333333333,46.43,54.05,53.98,47.67,45.16,49.47,49.59,52.42,58.6012271,48.4844771,61.2675914,51.8992014,3.55555555555556,3,2,2,3,2.5,2.25,2.625,2,3.63636363636364,4,3.33333333333333,3.33333333333333,3.58333333333333,3.33333333333333,4,3.66666666666667,3.33333333333333,2.33333333333333,3.26666666666667,1,1,3.375,2.83333333333333,5,4,4.07692307692308,4,4.5,3.75,1,3.5,3,3.28571428571429,3.4,3.5,3,3,3,2.3,2,3,2,2.5,2.2,3,1,3.66666666666667,3,3,3,3.5
"123",331,"48gchz1kfd5sp9a0","03/01/2023 15:19","qualified,20230301_12:51_v2,/Gender/X0TrF,/HomeOffice/oPdDr,/Age/b3xfu,/Total/Total",3,1,1,1,1,1,1,2,64,2,5,"",6,1,"",4,1,4,10.2008,40,40,2,NA,NA,NA,1,"","Werksleiter",8,11,1,2,2,2,1,NA,61,NA,NA,NA,NA,NA,NA,NA,NA,NA,1,NA,NA,NA,NA,NA,NA,NA,NA,NA,NA,2,4,4,5,5,4,5,1,5,4,3,1,1,1,1,2,1,3,3,3,2,3,1,1,3,2,1,1,1,5,1,2,1,1,1,1,1,1,1,1,1,1,1,1,1,3,3,2,1,4,2,5,4,5,5,5,2,3,4,4,3,5,1,1,1,2,4,4,5,5,3,1,1,1,1,2,2,1,1,1,5,1,1,2,NA,NA,0,1,1,1,1,1,2,7,3,1,1,2,3,1,1,1,0,0,1,0,0,2,0,0,0,1,5,2,1,1,5,2,4,1,3,1,2,3,1,0,1,3,1,0,5,5,5,5,5,4,5,2,3,4,5,3,3,3,5,5,5,5,5,5,4,4,4,4,4,3,5,3,5,5,1,4,2,4,2,1,1152.767,14,NA,10,NA,1,2,"03/01/2023 15:00",NA,NA,NA,1,"Mozilla/5.0 (Linux; Android 10; MAR-LX1A Build/HUAWEIMAR-L21A; wv) AppleWebKit/537.36 (KHTML, like Gecko) Version/4.0 Chrome/110.0.5481.153 Mobile Safari/537.36 EdgW/1.0","ksrs9z2j821wvpva","kr7gcw4g9h0h1rt1",NA,NA,"sa","/survey/selfserve/53b/g004/230146?list=1&ID=237301715980402","kr7gcw4g9h0h1rt1","237301715980402",998,2023-04-17 15:15:00,3,1,1,1,1,1,1,2,64,2,"",2,"",2,6,3,3,3,2,5,3,1,1,0,0,3,1,0,0,0,0,0,2,1,5,3,1,1,4,1,4,4,4,1,3,2,2,NA,NA,"",NA,"",NA,NA,NA,"",1,1,NA,NA,NA,NA,NA,NA,NA,NA,NA,"",NA,"",0,0,0,0,0,0,0,0,1,0,"","",2,NA,NA,"",2,NA,NA,NA,NA,NA,"",0,2,NA,NA,NA,"",1,2,2,"",NA,NA,NA,"","","",1,1,2,"",NA,NA,NA,"","","",1,1,2,"",NA,NA,NA,"","","",1,1,2,"",NA,NA,NA,"","","",1,1,1,"schulung",2,NA,2,"","","",NA,NA,2,"",NA,NA,NA,"","","",1,1,2,"",NA,NA,NA,"","","",3,4,2,"",NA,NA,NA,"","","",4,4,2,"",NA,NA,NA,NA,"",NA,1,1,2,"",NA,NA,NA,"",1,1,2,"",NA,NA,NA,"","","",5,5,2,"",NA,NA,NA,"","","",1,1,2,"",NA,NA,NA,"","","",1,1,2,"",NA,NA,NA,NA,"","",3,1,2,"",NA,NA,NA,NA,"","",1,1,0,0,0,0,0,0,0,0,0,1,"nichts",0,0,0,0,0,0,0,0,0,1,"nichts",0,0,0,0,0,0,0,0,0,1,"keine",2,1,NA,NA,NA,NA,1,2,NA,2,"",NA,NA,2,NA,2,2,1,1,1,1,2,"",1,1,4,1,0,0,5,5,5,5,5,4,5,5,5,5,5,5,2,1,1,5,5,5,4,4,5,5,5,5,1,3,1,2,1,1,4,3,4,3,4,1,1,2,4,4,3,2,2,3,3,5,4,5,1,1,3,4,3,4,5,5,3,3,2,4,4,4,5,3,3,4,1,1,1,1,1,1,1,1,1,5,1,1,1,2,2,1,1,1,1,3,2,4,1,1,1,1,1,1,1,1,1,1,1,1,1,1,1,1,1,1,1,1,1,1,1173.77,5,"s950k4yukw2ycs0w",NA,NA,"..","/survey/selfserve/53b/g004/230372?list=1&ID=240475414777962","s950k4yukw2ycs0w","240475414777962",19.2127833333333,19.5628333333333,0,102008,"01-10-2008",2008-10-01,175,14,7,14.07,5419,2008,15,4.33333333333333,4.5,3.66666666666667,2.66666666666667,1,1.5,2,3,2.5,1,2,2.5,1,2,1,1,1,1,2.6,3.88888888888889,3.66666666666667,5,3,4.33333333333333,1,1.4,2,1,2,1,1,4.36363636363636,5,3.66666666666667,4,4.25,3,5,5,4,4,5,4,4,4.33333333333333,46.43,54.05,53.98,53.35,45.16,55.25,56.79,52.42,64.8629991,54.7462491,61.1662244,51.7978344,0.333333333333333,1,1,3,1.7,1.5,1.83333333333333,1.33333333333333,1,2.33333333333333,0.666666666666667,46.43,40.07,38.71,53.35,28.14,40.41,56.79,52.42,62.6085929,52.4918429,47.4138707,38.0454807,0.444444444444444,1,2,2,3,2,1.75,2.125,1,4.90909090909091,4.8,5,5,3.91666666666667,1.33333333333333,5,4.33333333333333,5,1.5,2.86666666666667,5,5,4.25,4.5,3.5,4,3.92307692307692,4,4,3.75,1,1.66666666666667,2,1.42857142857143,1.4,2,1,1,5,1.4,1,2.33333333333333,1,1,2,1,2,3.66666666666667,3.5,1.33333333333333,3.66666666666667,2.5
"124",332,"3vqa04d9xjakzf5f","03/01/2023 15:26","qualified,20230301_12:51_v2,/Gender/X0TrF,/HomeOffice/oPdDr,/Age/b3xfu,/Total/Total",3,1,1,1,1,1,1,2,56,2,5,"",2,1,"",4,1,6,1.199,38,43,2,NA,NA,NA,1,"","Produktionsleiter",8,6,3,2,4,4,2,1,50,18,17,NA,NA,NA,NA,NA,NA,NA,1,2,2,NA,NA,NA,NA,NA,NA,NA,2,2,4,4,3,5,5,4,4,4,5,4,4,2,1,3,3,1,4,2,1,5,4,5,5,2,3,4,2,3,5,3,6,3,3,3,4,4,4,4,3,3,4,3,4,4,5,5,3,3,4,2,2,1,4,3,3,2,2,3,4,2,1,1,3,1,3,5,5,4,4,4,1,1,1,1,2,2,1,3,1,5,1,1,1,NA,NA,0,3,4,2,1,2,5,8,3,2,2,3,1,1,2,1,3,3,0,2,1,1,3,0,0,2,4,2,3,1,4,2,2,1,5,5,5,5,5,6,6,5,5,5,5,5,5,5,4,4,4,4,4,3,4,5,5,5,5,5,5,3,3,4,5,4,4,4,4,4,5,4,5,4,2,4,2,5,2,1,1449.983,4,NA,10,NA,5,6,"03/01/2023 15:01",NA,NA,NA,1,"Mozilla/5.0 (Windows NT 10.0; Win64; x64) AppleWebKit/537.36 (KHTML, like Gecko) Chrome/110.0.0.0 Safari/537.36 Edg/110.0.1587.57","gmvbxxny85x3xyg2","1qygh465mx9za5ur",NA,NA,"..","/survey/selfserve/53b/g004/230146?list=1&ID=237301715998884","1qygh465mx9za5ur","237301715998884",517,2023-04-14 14:09:00,3,1,1,1,1,1,1,2,56,2,"",2,"",4,8,3,3,3,2,2,1,1,1,1,1,0,0,0,0,0,0,0,3,2,4,1,2,1,5,1,4,2,2,1,5,1,1,2,NA,"",NA,"",2,NA,2,"",NA,NA,1,0,0,0,0,0,1,0,0,"",1,"",0,0,0,0,0,0,0,0,1,0,"","",1,3,NA,"",2,NA,NA,NA,NA,NA,"",2,3,NA,NA,NA,"",3,4,2,"",NA,NA,NA,"","","",4,5,1,"Kurse mit Entspannungsmethoden.",2,NA,2,"","","",2,2,1,"Gesprächsrunden mit einer Ernährungsberaterin.",2,NA,2,"","","",NA,NA,1,"Angebote, mit dem Rauchen aufzuhören.",2,NA,2,"","","",NA,NA,1,"Aufklärung über Sicherheitsbestimmungen.",2,NA,2,"","","",NA,NA,1,"Gemeinsame Feiern, z.B. Geburtstage, Jubiläen oder Weihnachten.",1,4,NA,"","","",NA,NA,1,"Weiterbildungen im IT-Bereich und im handwerklichen Bereich.",1,5,NA,"","","",NA,NA,3,"",NA,NA,NA,"","","",2,4,3,"",NA,NA,NA,NA,"",NA,3,4,2,"",NA,NA,NA,"",2,3,1,"Arbeitszeitkonten, Home-Office, flexible Urlaubsregelung",1,4,NA,"","","",NA,NA,3,"",NA,NA,NA,"","","",1,1,3,"",NA,NA,NA,"","","",1,1,3,"",NA,NA,NA,NA,"","",4,1,2,"",NA,NA,NA,NA,"","",1,1,0,0,0,0,0,1,0,0,0,0,"",0,0,0,0,1,1,0,0,0,0,"",0,0,0,1,0,0,0,0,0,0,"",3,1,NA,NA,NA,NA,1,1,5,NA,"",NA,NA,1,1,1,3,4,4,4,4,2,"",2,1,1,1,0,0,5,4,5,4,5,5,5,4,4,3,3,4,5,5,5,5,5,5,4,4,3,5,4,4,1,3,2,2,3,2,5,3,4,3,4,5,4,4,4,4,4,3,4,2,3,4,3,3,4,4,5,3,4,4,5,5,4,3,2,4,4,4,5,3,2,2,1,1,1,1,1,1,1,1,2,3,2,1,1,1,1,5,5,5,4,5,1,2,2,1,4,4,5,5,5,4,3,3,1,3,3,5,5,4,3,4,5,3,4,5,2594.23,5,"dyajj2sxfjwr1nbe",NA,NA,"..","/survey/selfserve/53b/g004/230372?list=1&ID=241183254216730","dyajj2sxfjwr1nbe","241183254216730",24.1663833333333,43.2371666666667,0,11990,"01-01-1990",1990-01-01,400,33,4,33.04,12267,1990,33,3.66666666666667,5,4,4.33333333333333,1.5,3,2.5,1.5,4.5,5,3,2.5,2,4,3.2,3.75,4,3.58333333333333,4,2.44444444444444,1.66666666666667,3.33333333333333,2.33333333333333,4,1,1.8,2,1.66666666666667,2,1.66666666666667,2.4,4.27272727272727,4.8,4,3.66666666666667,4.41666666666667,5,5,3.33333333333333,4.33333333333333,4.33333333333333,4,4,4,4.16666666666667,46.43,48.33,46.92,47.67,61.83,55.25,49.59,52.42,66.4166696,56.2999196,57.8232878,48.4548978,1.44444444444444,2,2,1,1.8,1.25,2.16666666666667,5.22222222222222,5.33333333333333,5,5.33333333333333,46.43,40.07,38.71,53.35,55.62,55.25,56.79,52.42,72.8333789,62.7166289,50.4313551,41.0629651,0.222222222222222,2,1,2,1,1.5,1,1.75,4,4.18181818181818,4.6,4.33333333333333,3.33333333333333,4.5,5,5,3.66666666666667,4.33333333333333,2.16666666666667,3.73333333333333,2,2,3.25,3.16666666666667,3.5,4,3.76923076923077,4,4.25,3,1,1.66666666666667,1,3.78571428571429,4.8,1.5,4.5,5,5,3.8,3.33333333333333,3.66666666666667,4.25,4,1.8,2,1,4,3.5,4.33333333333333,4,3
"125",335,"q8x5fyprfs424yjd","03/01/2023 15:26","qualified,/Age/gcKvr,20230301_12:51_v2,/Gender/X0TrF,/HomeOffice/oPdDr,/Total/Total",3,1,1,1,1,1,1,2,44,1,5,"",6,1,"",3,2,4,3.2016,40,45,2,NA,NA,NA,5,"","IT Ingenieur",8,7,1,2,5,5,2,3,35,16,13,10,NA,NA,NA,NA,NA,NA,1,2,2,2,NA,NA,NA,NA,NA,NA,3,2,4,5,3,5,4,4,2,4,5,4,4,2,4,3,3,1,2,1,2,4,5,4,4,4,5,4,3,6,5,8,10,7,NA,NA,NA,NA,NA,NA,NA,NA,NA,NA,NA,NA,4,5,4,5,4,4,5,4,4,4,5,4,4,5,3,4,5,3,4,3,4,4,5,4,5,4,5,3,3,3,3,4,3,4,2,5,3,3,2,1,12,3,5,3,5,3,4,5,8,2,1,1,1,2,2,1,1,1,3,1,0,1,0,6,0,1,2,3,2,3,2,4,2,2,3,3,5,4,5,6,5,6,6,5,5,4,5,4,4,5,4,4,5,5,4,3,4,5,5,4,4,4,5,4,4,5,4,4,4,5,4,4,5,4,4,2,3,2,3,3,1,1337.109,14,NA,10,NA,1,2,"03/01/2023 15:03",NA,NA,NA,1,"Mozilla/5.0 (Linux; Android 8.1.0; SM-J260F) AppleWebKit/537.36 (KHTML, like Gecko) Chrome/103.0.5060.59 Mobile Safari/537.36","ft2482pcmp6ap3y0","4j9scts2phww2wp4",NA,NA,"sa","/survey/selfserve/53b/g004/230146?list=1&ID=237301716027528","4j9scts2phww2wp4","237301716027528",403,2023-04-14 10:32:00,3,1,1,1,1,1,1,2,44,1,"Die Arbeitszeiten waren besser und die Produktion besser",2,"",5,8,2,2,1,1,2,2,2,2,1,3,2,3,0,0,6,1,2,2,2,3,3,3,2,4,2,4,3,4,2,3,1,1,1,3,"",1,"",NA,NA,NA,"",NA,NA,NA,NA,NA,NA,NA,NA,NA,NA,NA,"",NA,"",1,0,0,0,0,0,1,0,0,0,"","",1,2,4,"",1,4,2,1,3,NA,"",2,1,1,4,NA,"",NA,NA,3,"",NA,NA,NA,"","","",3,4,2,"",NA,NA,NA,"","","",3,4,1,"Gut und perfekt Angebote",2,NA,3,"","Nicht","",NA,NA,3,"",NA,NA,NA,"","","",3,3,1,"Perfekt und gut Qualität Angebote",2,NA,3,"","Nicht","",NA,NA,3,"",NA,NA,NA,"","","",4,4,2,"",NA,NA,NA,"","","",4,4,1,"Ich Weiß nicht",2,NA,2,"","","",NA,NA,3,"",NA,NA,NA,NA,"",NA,4,4,3,"",NA,NA,NA,"",3,3,3,"",NA,NA,NA,"","","",3,4,2,"",NA,NA,NA,"","","",4,5,2,"",NA,NA,NA,"","","",2,2,3,"",NA,NA,NA,NA,"","",4,3,2,"",NA,NA,NA,NA,"","",4,3,0,1,0,0,0,0,0,1,0,0,"",0,1,0,0,0,0,0,0,0,0,"",0,0,0,0,0,0,0,0,1,0,"",3,1,NA,NA,NA,NA,3,NA,NA,NA,"",4,4,3,NA,3,2,4,3,4,3,2,"",3,3,3,2,16,28,3,4,5,5,3,5,4,3,4,5,3,3,4,5,4,5,5,5,4,4,5,4,4,3,3,2,3,4,2,3,3,4,4,3,2,4,3,3,3,5,3,2,4,3,5,2,4,5,3,2,4,4,4,5,2,3,4,3,3,4,3,4,3,3,4,3,2,2,1,3,2,1,2,1,2,2,3,1,2,4,1,3,5,4,5,4,3,4,3,4,3,3,4,5,3,3,4,3,4,3,4,5,4,3,4,4,5,4,3,3,1740.25,1,"mg4mdevw314abrhw",NA,NA,"sa","/survey/selfserve/53b/g004/230372?list=1&ID=241166931207261","mg4mdevw314abrhw","241166931207261",22.28515,29.0041666666667,25,32016,"01-03-2016",2016-03-01,86,7,2,7.02,2711,2016,7,4,4.5,3.33333333333333,4.33333333333333,3,3,1.5,1.5,4.5,4,4.33333333333333,4.5,3,7.2,NA,NA,NA,NA,4.4,4.33333333333333,4.33333333333333,4.33333333333333,4.33333333333333,4.33333333333333,3.5,3.2,3.5,3,3.5,3,4,4.27272727272727,4.4,4.33333333333333,4,4.33333333333333,4.66666666666667,4,4.33333333333333,4.33333333333333,4.33333333333333,4,4,3,3.5,52.83,54.05,53.98,60.77,55.62,49.47,56.79,52.42,66.3652615,56.2485115,65.9720278,56.6036378,1.44444444444444,3,2,3,2.4,2.5,2.33333333333333,5.22222222222222,4.66666666666667,5.66666666666667,5.33333333333333,52.83,48.33,53.98,60.77,55.62,49.47,49.59,45.66,59.7237591,49.6070091,66.0922246,56.7238346,2,3,2,2,3,2.58333333333333,2.25,2.75,3.5,4,4.4,3.66666666666667,3.66666666666667,4.33333333333333,4.33333333333333,5,4.33333333333333,3.66666666666667,2.83333333333333,3.4,3,4,3.75,3.66666666666667,4,3,3.38461538461538,3.8,3,3.25,1.85714285714286,1.83333333333333,2.5,3.78571428571429,4.2,3.5,3.75,3,2,3.5,3.33333333333333,3,4,4,3.8,3,6,3.66666666666667,2.5,3.33333333333333,3.66666666666667,3.5
"126",337,"0kteh1fpbtt8eh1m","03/01/2023 15:34","qualified,/Age/gcKvr,20230301_12:51_v2,/Gender/X0TrF,/HomeOffice/oPdDr,/Total/Total",3,1,1,1,1,1,1,2,38,1,5,"",4,1,"",2,2,6,2.2019,35,40,2,NA,NA,NA,2,"","Architekt",7,2,1,2,4,4,2,2,32,14,5,NA,NA,NA,NA,NA,NA,NA,1,2,2,NA,NA,NA,NA,NA,NA,NA,2,2,4,3,3,4,3,5,4,5,4,4,3,2,3,3,3,2,4,1,1,4,3,3,3,3,4,2,3,7,4,4,8,4,NA,NA,NA,NA,NA,NA,NA,NA,NA,NA,NA,NA,4,4,4,5,4,2,3,3,4,3,3,4,3,3,5,3,3,4,4,3,3,4,4,4,4,4,2,2,2,3,3,2,3,4,4,4,3,4,3,2,33,39,5,5,6,5,5,4,7,2,3,3,4,4,3,2,2,1,3,2,2,2,0,3,0,3,4,2,4,4,3,4,4,3,3,3,3,4,5,4,4,5,6,4,5,4,3,4,3,4,2,3,4,3,3,4,5,5,4,4,3,4,3,3,3,4,3,3,3,4,3,3,4,4,5,1,5,2,4,1,1,1721.576,14,NA,10,NA,1,2,"03/01/2023 15:04",NA,NA,NA,1,"Mozilla/5.0 (Linux; Android 10; K) AppleWebKit/537.36 (KHTML, like Gecko) Chrome/111.0.0.0 Mobile Safari/537.36","cq7pprffbf5an7tv","tdbsdpyg7cmz8k7z",NA,NA,"sa","/survey/selfserve/53b/g004/230146?list=1&ID=237301716030635","tdbsdpyg7cmz8k7z","237301716030635",660,2023-04-14 17:17:00,3,1,1,1,1,1,1,2,38,2,"",2,"",4,7,2,2,2,2,2,2,3,2,1,2,1,2,1,0,3,1,2,4,3,3,4,3,2,4,2,4,3,4,3,4,2,1,2,NA,"",NA,"",1,2,NA,"",NA,NA,1,1,0,1,0,0,0,0,0,"",1,"",1,0,0,0,0,0,1,1,0,0,"","",1,3,NA,"",1,8,2,2,NA,4,"",2,3,NA,NA,NA,"",3,3,1,"Yoga-Angebote",1,3,NA,"","","",NA,NA,3,"",NA,NA,NA,"","","",NA,NA,1,"Bewusstsein für Stressbewältigung und Resilienz",1,4,NA,"","","",NA,NA,1,"Programme zur Raucherentwöhnung  البحث عن النص على Google",1,3,NA,"","","",NA,NA,3,"",NA,NA,NA,"","","",4,4,1,"Rolle für die menschliche Entwicklung",1,4,NA,"","","",NA,NA,3,"",NA,NA,NA,"","","",3,4,1,"Optimale Möglichkeiten für den Einsatz von Business-Tools",1,4,NA,"","","",NA,NA,2,"",NA,NA,NA,NA,"",NA,3,4,1,"Kollegen",1,4,NA,"",NA,NA,1,"flexible Wochenarbeitszeit",1,4,NA,"","","",NA,NA,2,"",NA,NA,NA,"","","",3,4,1,"Betriebskindergarten, -krippe",2,NA,2,"","","",NA,NA,3,"",NA,NA,NA,NA,"","",3,1,3,"",NA,NA,NA,NA,"","",3,3,0,0,0,0,1,0,0,0,0,0,"",0,0,1,0,0,0,0,0,0,0,"",0,1,0,0,1,0,0,0,0,0,"",1,1,NA,NA,NA,NA,1,1,5,NA,"",NA,NA,3,NA,2,1,4,3,4,5,2,"",5,4,4,2,35,27,4,4,4,3,4,4,3,4,4,5,3,4,4,4,4,4,4,4,3,3,3,4,4,4,2,3,3,2,3,3,3,4,3,4,4,4,3,3,2,3,4,4,5,4,3,4,3,4,2,2,4,3,2,3,3,4,4,4,2,4,3,4,4,4,3,4,4,3,2,2,2,1,2,3,2,2,1,3,2,2,1,4,4,4,4,4,5,2,5,4,4,4,3,4,4,4,4,4,3,4,3,3,3,4,2,4,4,4,5,4,2779.2,1,"2k4t8r425b0pkmmp",NA,NA,"sa","/survey/selfserve/53b/g004/230372?list=1&ID=241183254228205","2k4t8r425b0pkmmp","241183254228205",28.6929333333333,46.32,-12,22019,"01-02-2019",2019-02-01,51,4,3,4.03,1644,2019,4,3.33333333333333,3.5,4.66666666666667,3.66666666666667,2.5,3,3,1,3.5,3,3,3.5,3,5.4,NA,NA,NA,NA,4.2,3.11111111111111,2.66666666666667,3.33333333333333,3.33333333333333,4,2.25,3.2,2.5,3.66666666666667,2.5,3.66666666666667,5.2,3.36363636363636,3.6,3,3.33333333333333,3.66666666666667,4.66666666666667,3.66666666666667,3,3.33333333333333,3.5,5,4,5,4.66666666666667,52.83,40.07,38.71,40.07,35.81,40.41,49.59,45.66,57.4058658,47.2891158,46.8417955,37.4734055,1.77777777777778,4,2,3,3.4,2.75,3.83333333333333,4.44444444444444,3.66666666666667,5,4.66666666666667,52.83,48.33,46.92,53.35,55.62,49.47,41.53,45.66,55.3219537,45.2052037,62.4389608,53.0705708,1.44444444444444,3,2,2,2,2.75,2.25,3,4,3.81818181818182,3.8,3.66666666666667,4,3.75,4,4,3,4,2.66666666666667,3.53333333333333,4,4,3.5,3.83333333333333,2.5,4,3.69230769230769,3.6,3.75,3.75,2.28571428571429,2.16666666666667,1.5,3.92857142857143,4,4,3.75,4,3,3.4,4,3.33333333333333,3,4.25,3.4,3,4,3.33333333333333,4,3.33333333333333,3,4
"127",338,"g5bm7u082mssyj5d","03/01/2023 15:21","qualified,/Age/gcKvr,20230301_12:51_v2,/Gender/X0TrF,/HomeOffice/oPdDr,/Total/Total",3,1,1,1,1,1,1,2,52,1,5,"",4,1,"",2,1,6,8.199,39,41,2,NA,NA,NA,6,"","Abteilungsleiter WP-Vertriebsunterstützung",8,7,1,2,4,4,2,1,48,19,15,NA,NA,NA,NA,NA,NA,NA,1,2,2,NA,NA,NA,NA,NA,NA,NA,2,2,4,4,4,4,4,4,5,5,3,4,4,2,2,3,3,1,3,1,1,4,4,4,4,3,4,4,1,6,4,6,6,5,3,4,4,4,4,4,3,4,3,3,4,4,3,4,4,3,3,4,3,3,4,4,4,4,4,4,4,4,4,1,2,1,3,5,5,4,5,5,1,1,1,1,4,4,3,3,3,4,3,2,2,2,10,0,4,2,1,2,2,4,8,2,1,1,2,1,1,1,1,3,3,0,3,1,0,0,0,0,2,3,2,2,1,4,2,3,1,3,4,5,4,4,5,4,5,5,4,4,4,4,4,4,4,4,4,3,3,4,4,4,4,4,4,4,4,4,4,4,4,4,4,3,4,4,4,4,3,2,4,2,4,2,1,983.393,4,NA,10,NA,5,6,"03/01/2023 15:05",NA,NA,NA,1,"Mozilla/5.0 (Windows NT 10.0; Win64; x64) AppleWebKit/537.36 (KHTML, like Gecko) Chrome/110.0.0.0 Safari/537.36 Edg/110.0.1587.49","wets8vuj4sqs1bxq","asscuq76hg2nsckt",NA,NA,"..","/survey/selfserve/53b/g004/230146?list=1&ID=237301716009051","asscuq76hg2nsckt","237301716009051",475,2023-04-14 13:44:00,3,1,1,1,1,1,1,2,52,2,"",2,"",4,9,2,1,1,2,2,1,1,1,2,2,0,1,1,0,0,0,0,3,1,4,2,2,1,4,1,5,2,3,1,3,2,1,2,NA,"",NA,"",1,2,NA,"",NA,NA,1,0,0,0,0,0,0,0,0,"",1,"",1,0,0,0,0,0,0,0,0,0,"","",1,2,2,"",1,2,3,2,NA,2,"",2,1,2,NA,2,"",NA,NA,1,"Fitrnes",2,NA,2,"","","",NA,NA,1,"Seminar",2,NA,2,"","","",NA,NA,1,"Seminare",2,NA,2,"","","",NA,NA,2,"",NA,NA,NA,"","","",1,1,2,"",NA,NA,NA,"","","",1,1,1,"Seminare",1,4,NA,"","","",NA,NA,1,"Fachschulungen",1,4,NA,"","","",NA,NA,1,"höhenverstellbare Schreibtische",1,4,NA,"","","",NA,NA,2,"",NA,NA,NA,NA,"",NA,1,1,3,"",NA,NA,NA,"",1,1,1,"flexible Arbeitszeiten",2,NA,2,"","","",NA,NA,1,"Wiedereinstiegsförderung",2,NA,2,"","","",NA,NA,2,"",NA,NA,NA,"","","",2,1,1,"Mentoring",NA,NA,NA,NA,"","",NA,NA,2,"",NA,NA,NA,NA,"","",1,1,1,0,0,1,0,1,0,1,0,0,"",0,0,0,0,0,1,0,0,0,0,"",0,0,0,0,0,1,0,0,0,0,"",1,1,NA,NA,NA,NA,1,1,2,NA,"",NA,NA,1,1,1,1,4,4,4,4,2,"",4,1,3,2,15,1,5,5,5,5,5,5,5,4,4,3,4,4,5,5,5,5,5,5,4,4,4,4,4,4,2,2,2,2,2,2,4,3,4,3,4,4,4,3,4,3,4,4,4,4,4,4,4,4,2,1,4,3,3,4,2,3,3,3,2,3,4,4,5,4,4,4,1,1,1,3,1,1,1,1,1,1,1,1,1,1,1,5,5,5,5,5,2,1,2,1,4,4,4,4,4,4,4,4,1,4,4,4,4,4,4,4,4,4,4,5,2969.65,5,"pr5x223aneg0pdjh",NA,NA,"..","/survey/selfserve/53b/g004/230372?list=1&ID=241183254221944","pr5x223aneg0pdjh","241183254221944",16.3898833333333,49.4941666666667,1,81990,"01-08-1990",1990-08-01,393,32,9,32.09,12055,1990,33,4,4,4.66666666666667,3.66666666666667,2,3,2,1,4,4,3.66666666666667,3.5,1,5.4,3.2,4,4,3.66666666666667,3.4,3.77777777777778,3.33333333333333,4,4,4.66666666666667,1,3.4,4,3,4,3,2.2,3.81818181818182,4,4,3.33333333333333,4,4,4,4,4,3.83333333333333,4,4,4,3.83333333333333,52.83,54.05,53.98,53.35,61.83,55.25,56.79,52.42,69.3790224,59.2622724,64.1643492,54.7959592,1.11111111111111,3,2,3,2.1,1.75,2.33333333333333,4.44444444444444,4.66666666666667,4.33333333333333,4.33333333333333,52.83,54.05,53.98,53.35,55.62,55.25,56.79,52.42,67.7831145,57.6663645,63.5244708,54.1560808,0.666666666666667,2,2,1,3,1.75,1.75,1.75,4,4.45454545454545,5,4.33333333333333,3.66666666666667,4.5,5,5,4,4,2,3.73333333333333,4,5,3.875,4.16666666666667,3,4,3.61538461538462,3.8,2.75,4.25,1.28571428571429,1,1,3.64285714285714,5,1.5,4,4,5,4.1,4,4.33333333333333,4,4,2.2,1,5,3.66666666666667,3.5,3.66666666666667,3.66666666666667,4
"128",340,"0zmdrb4bz0gjdxaz","03/01/2023 15:25","qualified,20230301_12:51_v2,/Gender/X0TrF,/HomeOffice/oPdDr,/Age/b3xfu,/Total/Total",3,1,1,1,1,1,1,2,56,2,5,"",6,1,"",3,1,5,4.1994,39,42,2,NA,NA,NA,10,"","Facharzt für Anästhesiologie",8,2,1,2,2,2,1,NA,55,NA,NA,NA,NA,NA,NA,NA,NA,NA,1,NA,NA,NA,NA,NA,NA,NA,NA,NA,NA,2,4,5,4,5,5,5,4,5,5,4,5,2,1,3,3,1,2,1,1,5,4,5,3,4,5,5,2,8,9,9,9,9,3,4,3,5,4,4,4,3,4,3,3,2,4,4,4,3,4,2,3,2,5,5,5,4,4,4,4,3,3,1,1,1,3,5,5,4,4,4,1,1,2,2,2,2,3,1,2,5,2,1,2,2,9,8,7,2,1,1,6,4,9,2,1,1,1,2,1,1,1,0,0,0,0,0,0,0,0,0,1,5,1,1,1,4,1,2,1,1,4,5,5,5,5,5,5,3,3,4,4,4,4,3,5,4,4,4,3,4,5,4,4,4,4,4,2,4,4,4,4,4,4,4,4,4,4,4,4,1,4,1,4,1,1,992.676,14,NA,10,NA,1,2,"03/01/2023 15:08",NA,NA,NA,1,"Mozilla/5.0 (Linux; Android 8.0.0; SHIFT6m) AppleWebKit/537.36 (KHTML, like Gecko) Chrome/110.0.0.0 Mobile Safari/537.36","eu2dejdyf7ye6gnv","h8sku8eukejfn89n",NA,NA,"sa","/survey/selfserve/53b/g004/230146?list=1&ID=237301715995762","deteh4gtq88e2c18","237301715995762",557,2023-04-14 15:09:00,3,1,1,1,1,1,1,2,56,2,"",2,"",4,9,2,1,1,2,2,1,1,1,0,1,0,0,0,0,0,0,0,1,1,5,2,1,1,5,1,5,1,2,1,2,1,1,1,3,"",6,"",NA,NA,NA,"",NA,NA,NA,NA,NA,NA,NA,NA,NA,NA,NA,"",NA,"",1,1,0,0,0,0,0,0,0,0,"","",1,3,NA,"",1,5,2,2,NA,2,"",1,2,NA,NA,NA,"",1,1,1,"Fitness",1,5,NA,"","","",NA,NA,2,"",NA,NA,NA,"","","",NA,NA,2,"",NA,NA,NA,"","","",4,4,1,"Beratung",2,NA,2,"","","",NA,NA,1,"AS Ausschuss",2,NA,2,"","","",NA,NA,1,"Alles mögliche",2,NA,2,"","","",NA,NA,1,"Fachlich wie methodische",1,5,NA,"","","",NA,NA,1,"Pulttisch",1,5,NA,"","","",NA,NA,2,"",NA,NA,NA,NA,"",NA,3,4,2,"",NA,NA,NA,"",2,1,1,"Alles mz",2,NA,2,"","","",NA,NA,2,"",NA,NA,NA,"","","",4,1,2,"",NA,NA,NA,"","","",4,1,2,"",NA,NA,NA,NA,"","",3,1,2,"",NA,NA,NA,NA,"","",2,3,0,0,0,0,0,1,0,0,0,0,"",1,0,0,0,0,0,0,0,0,0,"",1,0,0,0,0,0,0,0,0,0,"",1,2,NA,NA,NA,NA,1,1,5,NA,"",NA,NA,1,1,1,1,4,4,4,4,2,"",1,1,2,1,0,0,5,5,4,5,5,4,4,5,4,4,4,4,4,4,4,5,4,5,5,4,4,4,4,4,3,3,3,3,3,3,5,4,4,4,4,4,4,4,5,5,5,4,4,4,4,4,4,4,1,2,5,5,5,4,4,4,4,4,4,4,5,4,4,4,4,4,1,1,1,1,1,1,1,1,1,1,1,1,1,1,1,4,4,4,4,5,3,4,3,2,4,4,4,4,4,5,4,4,1,4,4,4,4,4,4,4,4,4,4,5,3903.38,1,"h8sku8eukejfn89n",NA,NA,"sa","/survey/selfserve/53b/g004/230372?list=1&ID=241183254214893","deteh4gtq88e2c18","241183254214893",16.5446,65.0563333333333,-8,41994,"01-04-1994",1994-04-01,349,29,1,29.01,10716,1994,29,4.33333333333333,5,4.66666666666667,4.66666666666667,1.5,3,1.5,1,4.5,4,4.66666666666667,4.5,2,8.8,3.6,3.75,3,3.5,3.8,3.77777777777778,2.33333333333333,5,4,4,1.5,2,2,2,2,2,3.4,3.90909090909091,3.8,4.33333333333333,3.66666666666667,3.91666666666667,4.33333333333333,4,3.33333333333333,4,4,5,5,5,4.5,52.83,54.05,53.98,60.77,55.62,55.25,56.79,52.42,67.5970951,57.4803451,66.0444512,56.6760612,0,1,2,5,1.6,2.25,1.16666666666667,4.44444444444444,4.66666666666667,5,3.66666666666667,52.83,54.05,53.98,53.35,55.62,55.25,56.79,52.42,67.7831145,57.6663645,63.5244708,54.1560808,0.111111111111111,1,1,1,4,1.41666666666667,1.75,1.25,4,4.36363636363636,4.6,4.33333333333333,4,4.25,4,4.66666666666667,4.33333333333333,4,3,4.26666666666667,5,4,4.5,4.33333333333333,5,2,3.92307692307692,3.8,4,4,1,1,1,3.78571428571429,4.2,3,4,4,5,4.2,4.33333333333333,4.33333333333333,4,4,1.8,2,5,4.33333333333333,4,4,5,4
"129",341,"g8u4zmpj671qakex","03/01/2023 15:25","qualified,20230301_12:51_v2,/Gender/X0TrF,/HomeOffice/oPdDr,/Age/b3xfu,/Total/Total",3,1,1,1,1,1,1,2,57,2,3,"",3,1,"",2,1,3,4.2014,40,45,2,NA,NA,NA,2,"","Kfm. Leiter",8,6,1,2,2,2,1,NA,58,NA,NA,NA,NA,NA,NA,NA,NA,NA,1,NA,NA,NA,NA,NA,NA,NA,NA,NA,NA,2,3,3,2,2,2,3,2,3,4,3,3,2,4,4,4,3,4,3,4,3,3,1,1,2,2,2,1,4,3,5,2,3,1,1,2,2,1,2,3,2,2,2,2,2,2,4,3,2,2,2,3,3,2,2,2,2,2,2,3,3,4,3,1,1,2,3,4,3,5,4,1,1,1,1,2,2,1,5,1,5,1,1,2,NA,NA,0,6,6,5,3,5,2,5,3,2,2,2,3,2,3,1,3,4,3,2,3,4,2,2,2,3,3,3,3,2,4,3,3,1,4,2,2,1,1,1,1,1,1,1,2,3,3,3,3,3,3,2,2,2,2,2,2,2,4,4,5,2,2,2,2,2,2,4,4,4,4,3,4,4,2,3,2,4,2,1,930.866,12,NA,11,NA,1,1,"03/01/2023 15:08",NA,NA,NA,1,"Mozilla/5.0 (iPhone; CPU iPhone OS 16_1_1 like Mac OS X) AppleWebKit/605.1.15 (KHTML, like Gecko) Version/16.1 Mobile/15E148 Safari/604.1","9sf9d47ggpvtvrcj","08gtbzvmv2v9g223",NA,NA,"si","/survey/selfserve/53b/g004/230146?list=1&ID=237301715987694","08gtbzvmv2v9g223","237301715987694",34,2023-04-07 02:42:00,3,1,1,1,1,1,1,2,57,2,"",2,"",3,6,4,3,3,4,4,3,3,3,3,3,3,2,3,4,3,1,2,3,2,4,3,3,2,4,2,4,3,3,3,4,2,2,NA,NA,"",NA,"",NA,NA,NA,"",3,3,NA,NA,NA,NA,NA,NA,NA,NA,NA,"",NA,"",0,1,0,0,0,0,1,0,0,0,"","",2,NA,NA,"",2,NA,NA,NA,NA,NA,"",0,2,NA,NA,NA,"",2,2,2,"",NA,NA,NA,"","","",4,5,2,"",NA,NA,NA,"","","",5,5,2,"",NA,NA,NA,"","","",3,3,2,"",NA,NA,NA,"","","",2,2,1,"BG Kurse",1,4,NA,"","","",NA,NA,2,"",NA,NA,NA,"","","",5,5,2,"",NA,NA,NA,"","","",4,4,2,"",NA,NA,NA,"","","",4,4,2,"",NA,NA,NA,NA,"",NA,4,4,2,"",NA,NA,NA,"",2,2,2,"",NA,NA,NA,"","","",4,4,2,"",NA,NA,NA,"","","",1,1,2,"",NA,NA,NA,"","","",2,2,2,"",NA,NA,NA,NA,"","",2,2,2,"",NA,NA,NA,NA,"","",3,3,0,0,0,1,0,0,0,0,0,0,"",0,1,0,0,0,0,0,0,0,0,"",0,1,1,1,0,0,0,0,0,0,"",2,1,NA,NA,NA,NA,2,NA,NA,NA,"",4,4,2,NA,2,2,2,2,2,2,2,"",1,1,1,1,1,0,1,3,3,4,4,2,3,3,2,3,3,3,1,1,1,3,5,5,2,3,3,2,3,3,2,2,2,1,2,2,3,2,3,2,2,4,4,4,2,3,2,3,3,3,3,4,3,3,4,4,3,4,4,3,4,4,3,4,2,3,3,3,4,4,4,4,4,5,5,4,4,5,5,4,4,5,4,3,3,4,4,1,1,1,1,3,3,3,3,3,1,2,2,3,4,1,1,2,2,2,2,2,2,1,1,1,4,2,1,1,938.47,1,"11aqhkw9831vd881",NA,NA,"si","/survey/selfserve/53b/g004/230372?list=1&ID=240475414778998","11aqhkw9831vd881","240475414778998",15.5144333333333,15.6411666666667,0,42014,"01-04-2014",2014-04-01,109,9,1,9.01,3411,2014,9,2.66666666666667,2,2.66666666666667,3.33333333333333,3,4,3.5,3.5,3,1,2,2,1,3.4,1.8,2,1.66666666666667,1.83333333333333,2.6,2.22222222222222,2.66666666666667,2,2,4,1,2.2,2,2.33333333333333,2,2.33333333333333,5,2.54545454545455,2.8,2.66666666666667,2,2.58333333333333,2,4.33333333333333,2,2,3.83333333333333,4,4,4,3.83333333333333,46.43,48.33,46.92,53.35,45.16,49.47,41.53,52.42,54.9682723,44.8515223,60.3162328,50.9478428,2.77777777777778,3,2,2,2.5,1.75,3,1.22222222222222,1.66666666666667,1,1,38.41,40.07,38.71,40.07,35.81,40.41,41.53,38.09,48.2190475,38.1022975,46.0470509,36.6786609,2.66666666666667,2,2,2,2,2.41666666666667,2.25,2.5,2,3,3.2,2.66666666666667,3,2.66666666666667,1,4.33333333333333,2.66666666666667,2.66666666666667,1.83333333333333,2.86666666666667,2,2,3.125,2.83333333333333,4,4,3.61538461538462,3.2,3.75,4,4.57142857142857,3.83333333333333,4,2.21428571428571,1.4,3,2,4,4,1.8,1.33333333333333,2.66666666666667,1.5,2,2.2,1,3,2.66666666666667,2,4,2.33333333333333,3
"130",343,"ghpdmyq3ck4x626g","03/01/2023 15:27","qualified,/Gender/p47uy,20230301_12:51_v2,/HomeOffice/oPdDr,/Age/b3xfu,/Total/Total",3,1,1,1,1,1,1,1,61,2,5,"",6,1,"",3,1,4,4.2016,35,35,2,NA,NA,NA,8,"","it managerin",8,10,1,2,3,3,2,1,62,15,NA,NA,NA,NA,NA,NA,NA,NA,1,2,NA,NA,NA,NA,NA,NA,NA,NA,3,1,3,4,4,4,4,4,4,4,4,4,4,1,1,1,1,1,1,1,1,4,4,4,4,3,3,3,1,2,5,4,4,6,4,4,4,4,4,4,4,4,4,4,4,4,4,4,4,4,4,4,4,4,4,4,4,4,4,4,4,4,4,4,4,4,4,4,4,3,3,3,4,3,4,4,4,4,1,1,1,5,1,1,1,NA,NA,0,1,1,1,1,1,5,10,4,2,1,2,2,1,1,1,0,0,0,0,0,0,0,0,0,1,3,1,1,1,1,1,1,1,1,5,5,5,5,5,5,5,5,5,5,5,5,5,5,5,5,5,5,5,5,4,4,4,4,4,4,4,4,4,4,4,4,4,4,4,4,4,4,4,2,3,3,3,3,1,1062.493,4,NA,10,NA,5,6,"03/01/2023 15:09",NA,NA,NA,1,"Mozilla/5.0 (Windows NT 10.0; Win64; x64) AppleWebKit/537.36 (KHTML, like Gecko) Chrome/110.0.0.0 Safari/537.36","k2v1enxgac3qmdr3","e3en0sjntxwsp6uq",NA,NA,"..","/survey/selfserve/53b/g004/230146?list=1&ID=237301716024411","tsavbybr0bvh60jg","237301716024411",449,2023-04-14 13:21:00,3,1,1,1,1,1,1,1,61,2,"",2,"",5,9,3,3,2,2,3,1,1,1,0,0,0,0,0,0,0,0,0,2,1,4,1,1,1,4,1,4,1,1,1,1,1,2,NA,NA,"",NA,"",NA,NA,NA,"",3,3,NA,NA,NA,NA,NA,NA,NA,NA,NA,"",NA,"",0,0,0,0,0,0,1,0,0,0,"","",2,NA,NA,"",2,NA,NA,NA,NA,NA,"",0,2,NA,NA,NA,"",3,3,2,"",NA,NA,NA,"","","",3,3,2,"",NA,NA,NA,"","","",3,3,2,"",NA,NA,NA,"","","",2,2,2,"",NA,NA,NA,"","","",3,3,2,"",NA,NA,NA,"","","",3,3,2,"",NA,NA,NA,"","","",3,3,1,"führung",2,NA,2,"","","",NA,NA,2,"",NA,NA,NA,"","","",3,3,2,"",NA,NA,NA,NA,"",NA,3,2,3,"",NA,NA,NA,"",3,4,2,"",NA,NA,NA,"","","",4,3,2,"",NA,NA,NA,"","","",3,3,2,"",NA,NA,NA,"","","",1,1,2,"",NA,NA,NA,NA,"","",2,2,2,"",NA,NA,NA,NA,"","",1,1,0,0,0,1,0,0,0,0,0,0,"",0,0,0,1,0,0,0,0,0,0,"",0,0,0,1,0,0,0,0,0,0,"",3,1,NA,NA,NA,NA,2,NA,NA,NA,"",1,1,2,NA,2,2,3,4,3,3,2,"",1,1,1,1,0,0,1,5,5,5,5,5,5,5,5,5,5,5,4,4,4,4,4,4,4,4,4,4,4,4,3,3,3,3,3,3,3,3,3,4,4,4,3,3,4,4,3,4,4,3,3,4,4,4,1,1,4,4,4,4,4,3,3,3,3,3,3,3,3,3,3,3,1,1,1,1,1,1,1,1,1,1,1,1,1,1,1,4,4,4,4,4,4,4,4,4,4,4,4,4,4,4,4,4,4,4,4,4,4,4,4,4,4,4,4,3,2181.46,5,"xdmven92buk7a5a6",NA,NA,"..","/survey/selfserve/53b/g004/230372?list=1&ID=241183254226118","xdmven92buk7a5a6","241183254226118",17.7082166666667,36.3576666666667,0,42016,"01-04-2016",2016-04-01,85,7,1,7.01,2680,2016,7,3.66666666666667,4,4,4,1,1,1,1,4,4,3,3,1,4.2,4,4,4,4,4,4,4,4,4,3,3.75,2.2,4,1,4,1,1,5,5,5,5,4,4,4,4,4,4,4,3,3,3.33333333333333,38.41,48.33,53.98,53.35,55.62,55.25,56.79,52.42,68.3576571,58.2409071,58.8923446,49.5239546,0,3,5,5,2,3,1.33333333333333,5,5,5,5,46.43,40.07,46.92,53.35,45.16,55.25,56.79,52.42,68.7471005,58.6303505,53.4088862,44.0404962,0,2,2,2,5,1.58333333333333,2.25,1.25,3.25,5,5,5,5,4,4,4,4,4,3,3.46666666666667,5,5,4.25,4.33333333333333,4,3,3.15384615384615,3.2,3.25,3,1,1,1,4,4,4,4,4,2,3.8,4,3.33333333333333,4,4,4,1,3,3,4,3.33333333333333,3.66666666666667,3.5
"131",344,"jzg4bydvh6k9keht","03/01/2023 15:50","qualified,/Gender/p47uy,20230301_12:51_v2,/HomeOffice/oPdDr,/Age/b3xfu,/Total/Total",3,1,1,1,1,1,1,1,55,2,5,"",6,1,"",4,1,6,1.2001,40,40,2,NA,NA,NA,11,"","Senior Manager",8,2,1,2,2,2,1,NA,56,NA,NA,NA,NA,NA,NA,NA,NA,NA,1,NA,NA,NA,NA,NA,NA,NA,NA,NA,NA,2,3,5,3,4,4,4,4,4,3,4,4,2,2,2,2,1,3,1,1,4,4,4,4,3,3,4,1,7,6,5,5,5,3,3,4,4,3,4,4,3,4,3,3,3,4,4,4,3,4,4,4,4,5,5,5,4,4,5,4,4,4,1,2,1,2,5,5,3,3,3,1,1,1,1,4,5,3,2,3,5,2,1,1,1,1,0,4,4,3,2,2,4,8,2,1,1,1,2,1,1,1,0,1,0,1,0,0,0,0,0,2,5,2,2,1,5,1,2,2,4,4,5,5,4,4,4,5,4,4,5,4,4,5,5,4,4,4,3,3,4,4,4,4,4,5,5,5,5,5,5,4,4,5,5,5,5,5,4,4,2,3,3,4,2,1,2435.197,4,NA,12,NA,5,6,"03/01/2023 15:09",NA,NA,NA,1,"Mozilla/5.0 (Windows NT 10.0; Win64; x64; rv:109.0) Gecko/20100101 Firefox/110.0","wyjg0mk12j3habxg","td6w0e33pd3wrx1r",NA,NA,"..","/survey/selfserve/53b/g004/230146?list=1&ID=237301715978333","j2vdugzw24b3mw82","237301715978333",442,2023-04-14 13:24:00,3,1,1,1,1,1,1,1,55,2,"",2,"",4,8,2,1,1,1,2,1,1,1,1,1,0,1,0,0,0,1,0,1,2,4,2,2,1,4,2,2,2,3,2,4,1,2,NA,NA,"",NA,"",NA,NA,NA,"",3,3,NA,NA,NA,NA,NA,NA,NA,NA,NA,"",NA,"",0,0,0,0,0,0,1,1,0,0,"","",1,4,NA,"",1,7,2,2,NA,4,"",2,3,NA,NA,NA,"",2,2,1,"Fitnessstudio",1,3,NA,"","","",NA,NA,2,"",NA,NA,NA,"","","",NA,NA,2,"",NA,NA,NA,"","","",2,1,2,"",NA,NA,NA,"","","",1,1,1,"allgemeine Schulung für Führungskräfte",1,4,NA,"","","",NA,NA,2,"",NA,NA,NA,"","","",3,3,1,"unterschiedlich",2,NA,4,"","","k.A.",NA,NA,1,"Ergonomie",1,4,NA,"","","",NA,NA,2,"",NA,NA,NA,NA,"",NA,2,2,1,"Personalabteilung",2,NA,2,"",NA,NA,1,"flexible Arbeitszeit, sabbatical",1,4,NA,"","","",NA,NA,3,"",NA,NA,NA,"","","",2,1,2,"",NA,NA,NA,"","","",3,1,1,"Mentoring",2,NA,2,NA,"","",NA,NA,2,"",NA,NA,NA,NA,"","",2,1,0,0,0,0,0,0,0,1,0,0,"",0,0,0,0,0,0,0,1,0,0,"",0,0,0,0,0,0,0,0,0,1,"keine",3,1,NA,NA,NA,NA,2,NA,NA,NA,"",3,3,3,NA,2,2,3,3,4,3,2,"",4,3,3,1,0,0,5,4,5,4,5,4,4,4,4,3,3,5,4,4,4,4,4,5,5,5,5,4,4,4,3,3,3,2,3,3,4,4,4,4,4,3,3,3,4,4,4,4,3,3,3,4,4,4,3,3,4,4,4,3,4,4,3,3,2,4,4,4,4,4,3,4,1,1,1,1,1,1,1,1,1,1,1,1,1,1,1,4,4,4,4,4,2,2,2,2,3,4,4,3,4,3,3,3,2,3,3,4,4,4,3,4,4,4,4,4,2391.46,5,"td6w0e33pd3wrx1r",NA,NA,"..","/survey/selfserve/53b/g004/230372?list=1&ID=241183254198273","7e0ftqqz7yukyy03","241183254198273",40.5866166666667,39.8576666666667,0,12001,"01-01-2001",2001-01-01,268,22,4,22.04,8249,2001,22,3.66666666666667,4,4,3.66666666666667,2,2,2,1,4,4,3.33333333333333,3,1,5.6,3.4,3.75,3,3.41666666666667,3.8,4.44444444444444,4,5,4.33333333333333,3,1,3.4,4.5,2.66666666666667,4.5,2.66666666666667,3,4.09090909090909,4.6,4,3.33333333333333,4.5,4,4.66666666666667,5,4.33333333333333,4.83333333333333,4,3,4,3.66666666666667,52.83,54.05,53.98,60.77,55.62,55.25,56.79,52.42,67.5970951,57.4803451,66.0444512,56.6760612,0.222222222222222,1,1,2,1.6,1.5,1.66666666666667,4.33333333333333,4.33333333333333,4.66666666666667,4,52.83,54.05,53.98,60.77,55.62,55.25,56.79,52.42,67.5970951,57.4803451,66.0444512,56.6760612,0.444444444444444,2,2,4,2,2.16666666666667,1.75,2.375,3.25,4.09090909090909,4.4,4,3.66666666666667,4.33333333333333,4,4.33333333333333,5,4,2.83333333333333,3.6,3,3,3.75,3.66666666666667,4,4,3.69230769230769,3.8,3.5,3.75,1,1,1,3.28571428571429,4,2,3.5,4,4,3.4,3,3.33333333333333,3.75,4,2,1,5,4,4,3,4,3.25
"132",345,"pavqp556mrxn10ze","03/01/2023 15:29","qualified,20230301_12:51_v2,/Gender/X0TrF,/Age/b3xfu,/HomeOffice/ZRYex,/Total/Total",3,1,1,1,1,1,1,2,58,2,5,"",5,1,"",2,1,6,4.2019,39,43,2,NA,NA,NA,10,"","Leiter Beratung",8,10,3,2,3,3,1,NA,18,20,NA,NA,NA,NA,NA,NA,NA,NA,2,2,NA,NA,NA,NA,NA,NA,NA,NA,NA,2,4,5,4,4,4,4,5,4,4,4,4,1,4,3,2,1,2,1,1,5,5,5,3,4,4,4,1,8,6,8,8,8,4,4,4,4,5,4,5,4,5,5,5,5,4,5,4,2,4,4,4,4,4,5,5,5,5,5,4,4,4,2,2,2,3,5,5,4,4,4,1,1,1,1,4,5,5,5,4,4,4,2,1,2,40,20,2,2,1,1,1,4,8,3,2,2,3,2,1,1,1,2,2,1,2,1,0,0,1,0,1,4,2,2,2,4,1,3,1,4,4,5,4,4,5,5,5,4,4,4,4,4,4,4,4,4,4,4,4,4,5,5,4,5,5,5,5,5,5,5,5,5,4,4,4,4,4,4,4,2,4,2,4,2,1,1072.205,4,NA,10,NA,5,6,"03/01/2023 15:11",NA,NA,NA,1,"Mozilla/5.0 (Windows NT 10.0; Win64; x64) AppleWebKit/537.36 (KHTML, like Gecko) Chrome/110.0.0.0 Safari/537.36 Edg/110.0.1587.57","hu839a7j3ran4rfw","7mcssuctvnftaau0",NA,NA,"..","/survey/selfserve/53b/g004/230146?list=1&ID=237301716004892","j9jcc8930wyvhdst","237301716004892",763,2023-04-14 21:30:00,3,1,1,1,1,1,1,2,58,2,"",2,"",4,8,3,3,2,4,2,1,2,2,2,2,2,2,0,0,0,2,0,3,1,5,1,1,1,4,1,4,2,1,1,4,1,2,NA,NA,"",NA,"",NA,NA,NA,"",2,4,NA,NA,NA,NA,NA,NA,NA,NA,NA,"",NA,"",0,0,0,0,1,0,0,0,0,0,"","Caritas",1,2,4,"",1,6,3,2,NA,2,"",2,2,NA,NA,NA,"",3,3,2,"",NA,NA,NA,"","","",4,4,2,"",NA,NA,NA,"","","",4,4,2,"",NA,NA,NA,"","","",2,2,2,"",NA,NA,NA,"","","",2,2,2,"",NA,NA,NA,"","","",2,2,2,"",NA,NA,NA,"","","",2,2,1,"präventionskurse",1,4,NA,"","","",NA,NA,1,"Schreibtischerhöhung",2,NA,2,"","","",NA,NA,2,"",NA,NA,NA,NA,"",NA,2,3,1,"IT- Koordinator",1,4,NA,"",NA,NA,1,"Home Office, flexible Arbeitszeiten, Stundenreduzierung",1,4,NA,"","","",NA,NA,2,"",NA,NA,NA,"","","",2,2,2,"",NA,NA,NA,"","","",2,2,2,"",NA,NA,NA,NA,"","",2,2,2,"",NA,NA,NA,NA,"","",2,2,1,0,0,1,0,0,0,0,0,0,"",0,1,0,0,0,0,0,0,1,0,"",0,1,0,0,0,0,0,0,1,0,"",1,1,NA,NA,NA,NA,1,1,4,NA,"",NA,NA,1,1,2,3,4,4,4,3,2,"",4,3,4,2,40,20,3,4,4,5,4,5,4,4,4,4,3,4,5,5,4,5,5,5,5,5,5,5,5,5,3,3,3,3,3,3,3,4,4,3,3,3,3,2,2,3,2,4,3,3,3,4,4,4,2,2,4,3,2,4,4,4,4,4,3,4,4,4,4,4,4,3,1,1,1,1,1,1,1,1,1,1,2,2,1,1,1,5,5,5,5,5,1,1,1,1,4,4,4,4,3,4,4,3,1,4,4,4,4,4,4,4,4,4,4,4,1202.02,1,"gnafkmh0ace6a1ks",NA,NA,"sa","/survey/selfserve/53b/g004/230372?list=1&ID=241183254219860","tep33e5c8h19a8d3","241183254219860",17.8700833333333,20.0336666666667,0,42019,"01-04-2019",2019-04-01,49,4,1,4.01,1585,2019,4,4.33333333333333,4,4.33333333333333,4,2.5,2.5,1.5,1,5,4,4,4,1,7.6,4.6,4,5,4.5,3.8,4.55555555555556,4,4.66666666666667,5,4,1,4.6,4.5,4.66666666666667,4.5,4.66666666666667,1.4,4,4,4,4,4.91666666666667,4.66666666666667,5,5,5,4,4,4,4,4,46.43,48.33,46.92,47.67,55.62,55.25,56.79,52.42,69.9930977,59.8763477,55.0805774,45.7121874,1,2,2,2,1.8,1.75,1.83333333333333,4.44444444444444,4.66666666666667,4.33333333333333,4.33333333333333,46.43,40.07,46.92,40.07,55.62,55.25,49.59,45.66,64.0293755,53.9126255,51.8438446,42.4754546,1.11111111111111,1,2,2,2,1.33333333333333,1.5,1.25,3.75,4.09090909090909,4.4,4,3.66666666666667,4.91666666666667,4.66666666666667,5,5,5,3,3,4,4,3.625,4,2.5,3,3.84615384615385,3.8,4,3.75,1,1.33333333333333,1,3.42857142857143,5,1,4,3,5,4,3.66666666666667,4.33333333333333,4,4,2.6,1,5,3.66666666666667,3,2.66666666666667,2.33333333333333,3.25
"133",346,"wk90g2fkpfn36ytq","03/01/2023 15:29","qualified,20230301_12:51_v2,/Gender/X0TrF,/Age/b3xfu,/HomeOffice/ZRYex,/Total/Total",3,1,1,1,1,1,1,2,57,2,5,"",6,1,"",4,2,5,2.2014,40,5,1,2,2,2,5,"","CEO",8,2,1,2,2,2,1,NA,52,NA,NA,NA,NA,NA,NA,NA,NA,NA,1,NA,NA,NA,NA,NA,NA,NA,NA,NA,NA,2,3,5,5,5,5,5,5,5,5,4,3,1,1,2,1,1,2,1,1,5,5,5,4,4,4,4,4,8,2,2,8,3,NA,NA,NA,NA,NA,NA,NA,NA,NA,NA,NA,NA,2,5,5,3,5,5,5,5,5,5,5,5,5,5,4,4,4,3,2,2,5,5,5,5,5,5,1,1,1,1,5,5,5,5,3,4,4,2,2,2,80,60,7,7,6,5,7,5,10,2,2,1,2,2,1,1,1,0,0,0,0,0,0,0,0,0,1,3,1,2,1,5,1,3,1,5,5,6,6,6,6,6,6,5,6,5,5,5,5,5,5,5,5,5,5,5,5,5,5,5,5,5,5,5,5,5,5,5,5,5,5,5,5,5,4,1,2,3,5,1,1,1043.615,13,NA,11,NA,5,6,"03/01/2023 15:11",NA,NA,NA,1,"Mozilla/5.0 (Macintosh; Intel Mac OS X 10_15_7) AppleWebKit/605.1.15 (KHTML, like Gecko) Version/16.3 Safari/605.1.15","tqnwk414684v2kj2","rvef3h4f1db44dbq",NA,NA,"..","/survey/selfserve/53b/g004/230146?list=1&ID=237301716027522","rvef3h4f1db44dbq","237301716027522",616,2023-04-14 15:31:00,3,1,1,1,1,1,1,2,57,2,"",2,"",5,9,3,1,1,1,2,1,1,1,1,1,0,0,0,0,0,0,0,2,1,5,1,1,1,5,2,2,2,2,1,2,2,2,NA,NA,"",NA,"",NA,NA,NA,"",3,3,NA,NA,NA,NA,NA,NA,NA,NA,NA,"",NA,"",0,0,0,0,0,0,1,0,0,0,"","",1,2,5,"Weil diese für die Mitarbeitenden sind",1,8,3,2,NA,6,"Weil diese für die Mitarbeitenden sind",1,2,NA,NA,NA,"",1,1,1,"Mitgliedschaft in einem Fitnessstudio wird monetär unterstützt",2,NA,5,"Weil diese Angebote für die Mitarbeitenden sind","","",NA,NA,2,"",NA,NA,NA,"","","",NA,NA,1,"Obstlieferungen",1,4,NA,"","","",NA,NA,2,"",NA,NA,NA,"","","",1,1,1,"Online Trainings und Schulungen zur Arbeitssicherheit",1,4,NA,"","","",NA,NA,2,"",NA,NA,NA,"","","",1,1,1,"Individuelle Kurse sowohl in- als auch extern entlang der jeweiligen Stelleninhalte",1,5,NA,"","","",NA,NA,1,"Online Kurse und Schulungen im Rahmen der Arbeitssicherheit",1,2,NA,"","","",NA,NA,2,"",NA,NA,NA,NA,"",NA,1,1,1,"Um die jeweilige Führungskraft, als auch eine Mitarbeitendenvetretung",2,NA,4,"Weil ich der CEO der Gruppe bin",NA,NA,1,"Die Menschen können ihre Arbeitszeit, in Absprache mit den Führungskräften und KollegInnen so einteilen, dass sie auch privaten Verpflichtungen gerecht werden können.",2,NA,5,"Weil ich der CEO der Unternehmensgruppe bin.","","",NA,NA,2,"",NA,NA,NA,"","","",4,1,1,"Die Mitnahme an den Arbeitsplatz ist für uns völlig ok.",2,NA,5,"Weil ich 57 Jahre alt bin, und bereits Großvater","","",NA,NA,2,"",NA,NA,NA,NA,"","",1,1,2,"",NA,NA,NA,NA,"","",1,1,0,0,0,0,0,0,0,0,0,1,"Wir haben an einem Standort einmal ein  Resilienz-Training  durchgeführt",0,0,0,0,0,0,0,0,0,1,"Nichts",0,0,0,0,0,0,0,0,0,1,"Nichts",1,1,NA,NA,NA,NA,1,1,5,NA,"",NA,NA,1,1,2,2,5,4,3,3,2,"",5,5,3,2,70,70,4,5,5,5,5,5,5,5,5,5,5,5,5,5,5,5,5,5,5,5,5,5,5,5,3,3,3,3,3,3,5,5,5,5,5,5,5,5,5,5,5,5,5,5,5,4,4,4,2,2,4,3,2,5,5,5,5,5,1,5,5,5,5,5,5,5,1,1,1,2,1,1,2,1,1,1,1,1,1,1,2,5,5,5,5,5,2,1,1,1,1,4,1,5,2,4,3,4,1,1,2,3,5,5,5,5,5,4,5,5,1304.16,5,"muq6bwwfpbb8yhag",NA,NA,"..","/survey/selfserve/53b/g004/230372?list=1&ID=241183254227162","muq6bwwfpbb8yhag","241183254227162",17.3935833333333,21.736,10,22014,"01-02-2014",2014-02-01,111,9,3,9.03,3470,2014,9,4.33333333333333,5,5,4,1,1.5,1.5,1,5,4.5,4,4,4,4.6,NA,NA,NA,NA,4,5,5,5,5,5,1,4.6,5,4.33333333333333,5,4.33333333333333,6.4,5,5,5,5,5,5,5,5,5,5,5,3,5,4,52.83,48.33,53.98,53.35,55.62,55.25,56.79,52.42,68.8803821,58.7636321,61.777354,52.408964,0,3,1,1,1.5,1,1.83333333333333,5.77777777777778,5.66666666666667,6,5.66666666666667,46.43,54.05,53.98,60.77,55.62,55.25,56.79,52.42,67.3650951,57.2483451,64.7640032,55.3956132,0.222222222222222,1,1,4,4,1.75,1.75,1.75,3.75,5,5,5,5,5,5,5,5,5,3,5,4,4,3.625,4,2.5,5,5,5,5,5,1.28571428571429,1,1.5,3.07142857142857,5,1.25,2.75,2,5,3.7,3.66666666666667,2.66666666666667,4.5,4.75,3.2,4,4,5,5,5,5,5
"134",354,"wkf9kcp43qtwx0ye","03/01/2023 15:48","qualified,20230301_12:51_v2,/Gender/X0TrF,/HomeOffice/oPdDr,/Age/b3xfu,/Total/Total",3,1,1,1,1,1,1,2,60,2,3,"",2,1,"",3,1,5,4.199,40,40,2,NA,NA,NA,1,"","Abteilungsleiter ""Personalwesen""",6,12,4,1,NA,NA,NA,NA,NA,NA,NA,NA,NA,NA,NA,NA,NA,NA,NA,NA,NA,NA,NA,NA,NA,NA,NA,NA,NA,1,3,5,4,5,4,5,5,5,5,2,4,1,1,3,3,1,2,1,1,5,4,4,4,4,4,5,1,3,2,4,5,3,3,4,5,4,5,5,4,5,5,4,5,5,4,4,4,5,4,3,3,3,4,4,3,4,4,3,3,3,3,2,1,1,2,5,5,4,4,4,1,1,1,1,3,1,1,3,2,5,1,2,1,NA,NA,0,3,2,1,2,1,5,8,3,1,1,1,2,1,1,1,0,0,0,0,0,0,0,0,0,1,4,1,1,1,5,1,1,1,2,3,4,4,4,3,4,4,4,4,4,5,4,4,5,5,4,4,4,4,5,5,5,4,5,5,5,4,4,4,5,5,5,4,4,5,5,5,5,5,2,4,3,4,2,1,1488.074,4,NA,12,NA,5,6,"03/01/2023 15:22",NA,NA,NA,1,"Mozilla/5.0 (Windows NT 10.0; Win64; x64; rv:109.0) Gecko/20100101 Firefox/110.0","v441n34cs36kxfvv","dk2jee152z8jhj0b",NA,NA,"..","/survey/selfserve/53b/g004/230146?list=1&ID=237301715987702","dk2jee152z8jhj0b","237301715987702",385,2023-04-14 09:30:00,3,1,1,1,1,1,1,2,60,2,"",2,"",5,8,3,2,2,1,2,1,1,1,0,0,1,0,0,0,0,0,0,1,2,5,2,2,1,5,2,5,1,2,1,3,1,1,2,NA,"",NA,"",1,4,NA,"",NA,NA,1,0,0,0,0,0,0,0,0,"",1,"",1,0,0,0,0,0,1,0,0,0,"","",1,3,NA,"",2,NA,NA,NA,NA,NA,"",2,3,NA,NA,NA,"",2,3,2,"",NA,NA,NA,"","","",4,4,2,"",NA,NA,NA,"","","",2,2,2,"",NA,NA,NA,"","","",2,2,2,"",NA,NA,NA,"","","",2,1,1,"Sicherheitsschulungen durch die Berufsgenossenschaft",1,5,NA,"","","",NA,NA,2,"",NA,NA,NA,"","","",1,1,1,"Spezifisch in den verschiedenen Abteilungen für deren Mitarbeiter.",1,5,NA,"","","",NA,NA,2,"",NA,NA,NA,"","","",2,3,2,"",NA,NA,NA,NA,"",NA,2,2,3,"",NA,NA,NA,"",2,2,2,"",NA,NA,NA,"","","",2,2,3,"",NA,NA,NA,"","","",1,1,2,"",NA,NA,NA,"","","",1,1,3,"",NA,NA,NA,NA,"","",1,1,2,"",NA,NA,NA,NA,"","",1,1,1,0,0,0,0,0,0,0,0,0,"",0,0,0,0,0,1,0,0,0,0,"",0,0,0,0,0,1,0,0,0,0,"",1,1,NA,NA,NA,NA,1,1,5,NA,"",NA,NA,1,1,1,1,5,5,5,5,2,"",1,1,1,1,0,0,1,4,5,5,5,4,4,4,5,4,4,4,5,5,5,5,5,5,4,4,5,4,5,5,3,2,2,3,3,3,3,3,3,4,3,3,2,3,3,4,3,3,4,4,3,5,5,5,1,1,5,4,5,3,5,4,3,4,2,4,4,5,5,5,5,5,1,1,1,1,1,1,1,2,1,3,2,2,2,1,1,5,4,5,5,4,3,3,4,2,4,4,4,3,5,5,5,4,1,5,5,5,5,5,5,5,5,5,5,5,1228.38,5,"d9dmfgrk9kxjsgs4",NA,NA,"..","/survey/selfserve/53b/g004/230372?list=1&ID=241166931201251","d9dmfgrk9kxjsgs4","241166931201251",24.8012333333333,20.473,0,41990,"01-04-1990",1990-04-01,397,33,1,33.01,12177,1990,33,4,4.5,5,3.66666666666667,1,3,1.5,1,4.5,4,4.33333333333333,4,1,3.4,4,4.75,5,4.5,4.2,3.44444444444444,3,3.66666666666667,3.66666666666667,4,1,2,2,2,2,2,1.8,4.36363636363636,4.4,4.33333333333333,4.33333333333333,4.66666666666667,4.66666666666667,5,4,5,4.66666666666667,4,3,4,4,46.43,54.05,53.98,60.77,55.62,55.25,56.79,52.42,67.3650951,57.2483451,64.7640032,55.3956132,0,2,1,4,1.4,1.75,1.16666666666667,3.77777777777778,3.33333333333333,4,4,46.43,48.33,46.92,60.77,55.62,55.25,56.79,52.42,69.6646807,59.5479307,59.5295994,50.1612094,0.111111111111111,1,1,1,3,1.58333333333333,1.5,1.625,5,4.36363636363636,4.6,4.33333333333333,4,4.75,5,5,4.33333333333333,4.66666666666667,2.66666666666667,3.2,5,5,4.875,5,4.5,4,4.30769230769231,4,4,5,1,2,1,3.92857142857143,4.6,3,3.75,5,5,4.9,4.66666666666667,5,5,5,1.8,1,1,3,3.5,2.66666666666667,3.33333333333333,3.5
"135",356,"rj2p9vrenypqpvjk","03/01/2023 15:39","qualified,20230301_12:51_v2,/Gender/X0TrF,/Age/b3xfu,/HomeOffice/ZRYex,/Total/Total",3,1,1,1,1,1,1,2,58,2,5,"",6,1,"",4,1,6,2.1987,40,45,2,NA,NA,NA,1,"","Compliance Manager",8,2,1,2,2,2,1,NA,59,NA,NA,NA,NA,NA,NA,NA,NA,NA,1,NA,NA,NA,NA,NA,NA,NA,NA,NA,NA,2,3,3,3,4,4,5,5,5,5,4,3,1,1,2,1,1,2,1,1,5,5,4,3,5,5,3,3,7,4,8,10,8,5,4,5,5,4,4,5,5,3,3,5,5,3,5,5,5,5,4,4,4,5,5,5,4,4,5,3,2,3,1,1,1,4,5,5,4,1,4,1,1,1,1,5,4,5,3,2,3,4,1,2,2,80,0,5,3,1,5,6,4,8,2,1,1,1,3,1,1,1,0,0,0,0,0,0,0,0,0,1,5,1,1,1,3,1,1,1,1,3,4,2,1,3,5,4,2,1,5,5,5,5,5,4,4,4,3,4,4,4,3,3,5,5,5,5,4,5,3,3,3,4,4,3,5,4,4,5,1,5,1,5,1,1,798.895,4,NA,10,NA,5,6,"03/01/2023 15:26",NA,NA,NA,1,"Mozilla/5.0 (Windows NT 10.0; Win64; x64) AppleWebKit/537.36 (KHTML, like Gecko) Chrome/110.0.0.0 Safari/537.36","4cf87b5jg7x39dr5","6z4uz41nbv85h8wd",NA,NA,"..","/survey/selfserve/53b/g004/230146?list=1&ID=237301715991609","6z4uz41nbv85h8wd","237301715991609",402,2023-04-14 10:41:00,3,1,1,1,1,1,1,2,58,2,"",2,"",3,8,2,1,1,1,3,1,1,1,0,0,0,0,0,1,0,0,0,2,1,5,1,1,1,1,1,5,1,1,1,1,1,1,2,NA,"",NA,"",1,5,NA,"",NA,NA,1,0,0,0,0,0,0,0,0,"",3,"",1,0,0,0,0,0,0,0,0,0,"","",1,1,4,"",2,NA,NA,NA,NA,NA,"",2,3,NA,NA,NA,"",1,1,1,"Fitnrss Club, Aktionen am Arbeitsplatz",2,NA,2,"","","",NA,NA,3,"",NA,NA,NA,"","","",NA,NA,3,"",NA,NA,NA,"","","",2,3,1,"Rat beim Betriebsrat oder Betriebsarzt",2,NA,2,"","","",NA,NA,1,"Verpflichtende Schulungen",1,4,NA,"","","",NA,NA,3,"",NA,NA,NA,"","","",2,3,1,"Fachbezogen, soziale Fehigkeiten, Fuehrungstraining und viel mehr",1,5,NA,"","","",NA,NA,1,"Moebel, Tips",1,4,NA,"","","",NA,NA,1,"Richtige Einstellungen des Geraets und Moebels",1,5,NA,NA,"",NA,NA,NA,3,"",NA,NA,NA,"",3,4,1,"Elternzeit, Sabbatical, Home Office, Kita, Ferienbetreuung",2,NA,2,"","","",NA,NA,1,"Wiedereingliederung nach Elternzeit, Teilzeitmodelle",2,NA,2,"","","",NA,NA,1,"Kita, Ferienbetreuung",2,NA,2,"","","",NA,NA,1,"Frauenmentoring, Frauenquoten in Management",NA,NA,NA,NA,"","",NA,NA,3,"",NA,NA,NA,NA,"","",1,1,1,0,0,1,1,1,0,1,0,0,"",0,0,0,0,0,0,0,0,1,0,"",0,0,0,1,0,0,0,1,1,0,"",1,1,NA,NA,NA,NA,1,1,5,NA,"",NA,NA,1,1,1,1,5,5,5,4,2,"",4,3,5,2,80,5,5,5,5,5,5,5,5,4,3,3,3,4,3,3,4,5,5,5,4,4,5,4,3,3,2,4,2,2,3,3,1,2,3,2,2,1,2,2,2,3,3,4,5,1,1,4,4,5,4,2,4,5,5,4,3,3,3,3,1,4,5,4,5,5,4,5,3,4,2,4,2,2,4,1,1,4,3,1,3,2,2,4,4,5,5,3,1,1,1,1,2,1,5,3,5,5,5,4,2,5,4,5,5,5,5,5,5,5,5,5,3087.76,5,"9zw41rsnn15fkc2w",NA,NA,"..","/survey/selfserve/53b/g004/230372?list=1&ID=241166931202294","9zw41rsnn15fkc2w","241166931202294",13.3149166666667,51.4626666666667,5,21987,"01-02-1987",1987-02-01,435,36,3,36.03,13332,1987,36,3,4,5,4,1,1.5,1.5,1,5,3.5,4.33333333333333,5,3,7.4,4,4.75,4.66666666666667,4.41666666666667,4.6,4.44444444444444,4,5,4.33333333333333,3,1,3.8,4.5,3.33333333333333,4.5,3.33333333333333,4,4.36363636363636,5,4,3.66666666666667,4,3.33333333333333,5,4.66666666666667,3,4,5,5,5,5,52.83,54.05,53.98,60.77,45.16,55.25,56.79,52.42,64.9089797,54.7922297,64.9666528,55.5982628,0,1,3,5,1.6,2.5,1,2.77777777777778,3.33333333333333,2.33333333333333,2.66666666666667,52.83,54.05,53.98,60.77,45.16,55.25,56.79,52.42,64.9089797,54.7922297,64.9666528,55.5982628,0.111111111111111,1,5,1,5,1.66666666666667,3,1,4.75,4.27272727272727,5,4,3.33333333333333,4,3.33333333333333,5,4.33333333333333,3.33333333333333,2.66666666666667,2.26666666666667,2,4,4.125,3.83333333333333,5,5,4.07692307692308,4.4,3,4.75,3,2.16666666666667,2,2.92857142857143,4.2,1,2.75,5,4,4.7,4.66666666666667,4.33333333333333,5,5,2,3,4,2,2,1.66666666666667,2.66666666666667,2.75
"136",357,"g527jg0k20t61j9s","03/01/2023 15:46","qualified,/Gender/p47uy,/Age/gcKvr,20230301_12:51_v2,/HomeOffice/ZRYex,/Total/Total",3,1,1,1,1,1,1,1,42,1,5,"",5,1,"",3,1,6,7.2006,40,41,2,NA,NA,NA,10,"","Sozialpädagogin",6,2,3,1,NA,NA,NA,NA,NA,NA,NA,NA,NA,NA,NA,NA,NA,NA,NA,NA,NA,NA,NA,NA,NA,NA,NA,NA,NA,2,4,4,4,2,2,4,4,4,2,4,2,1,2,2,3,2,2,2,3,4,4,3,2,3,3,3,1,3,7,5,5,3,3,3,3,3,4,3,3,3,3,2,3,3,4,5,4,1,3,4,5,5,4,4,4,4,5,5,5,3,3,2,1,1,2,4,5,2,2,3,1,1,1,1,3,5,4,4,3,4,3,1,4,2,10,0,1,1,1,5,1,4,9,3,2,1,3,3,3,2,2,3,3,2,2,2,2,1,1,0,3,4,2,3,2,3,2,2,1,3,3,3,3,3,2,4,4,3,3,4,4,5,4,4,4,4,3,3,3,3,5,5,5,5,5,5,5,5,5,5,5,5,4,4,4,5,4,5,4,3,4,3,3,3,1,1140.045,4,NA,10,NA,5,6,"03/01/2023 15:27",NA,NA,NA,1,"Mozilla/5.0 (Windows NT 10.0; Win64; x64) AppleWebKit/537.36 (KHTML, like Gecko) Chrome/110.0.0.0 Safari/537.36","fu6902zjvzrn5867","cz5adzny0x0dcpan",NA,NA,"..","/survey/selfserve/53b/g004/230146?list=1&ID=237301715984583","cz5adzny0x0dcpan","237301715984583",978,2023-04-17 12:17:00,3,1,1,1,1,1,1,1,42,2,"",2,"",4,7,3,3,3,3,4,3,3,3,4,5,2,3,4,4,1,1,2,3,4,4,4,3,2,4,1,4,3,3,1,2,1,1,2,NA,"",NA,"",2,NA,2,"",NA,NA,0,0,0,0,0,0,0,0,1,"Verwaltungskraft, die für ASA zuständig ist",6,"",0,0,0,0,0,0,1,0,0,0,"","",1,2,4,"",2,NA,NA,NA,NA,NA,"",1,2,NA,NA,NA,"",3,3,2,"",NA,NA,NA,"","","",5,4,1,"Studientag einmal im Jahr",1,2,NA,"","","",4,4,2,"",NA,NA,NA,"","","",4,5,2,"",NA,NA,NA,"","","",1,1,1,"Brandschutzübung, Arbeitssicherheit",2,NA,2,"","","",NA,NA,1,"Betriebsausflug, Studientag",1,2,NA,"","","",NA,NA,1,"selber aussuchen, inhouse schulungen",1,4,NA,"","","",NA,NA,1,"alles was man will",1,5,NA,"","","",NA,NA,2,"",NA,NA,NA,NA,"",NA,5,5,3,"",NA,NA,NA,"",5,3,1,"telearbeit",1,5,NA,"","","",NA,NA,1,"Familienbudget",2,NA,3,"","ich hab keien kinder","",NA,NA,2,"",NA,NA,NA,"","","",3,5,2,"",NA,NA,NA,NA,"","",5,5,2,"",NA,NA,NA,NA,"","",3,3,0,0,0,0,0,0,0,0,0,1,"nix",1,0,0,0,1,1,0,0,0,0,"",1,0,0,1,0,1,1,0,0,0,"",1,1,NA,NA,NA,NA,1,2,NA,2,"",NA,NA,1,2,1,1,3,3,4,2,1,"Fitnessraum, Kantine",4,4,3,2,10,0,5,4,4,4,4,5,4,4,3,3,3,3,5,5,5,5,5,5,4,5,4,3,3,3,2,2,1,3,2,4,5,5,4,4,5,3,4,3,3,4,4,4,4,4,3,3,2,3,3,3,3,3,3,4,4,4,4,4,2,3,4,4,5,5,4,4,3,3,2,2,2,2,2,3,1,3,2,3,1,1,2,4,5,5,5,4,2,1,3,2,2,4,4,4,1,3,3,2,2,2,2,3,2,4,3,4,4,4,4,3,5157.69,5,"cz5adzny0x0dcpan",NA,NA,"..","/survey/selfserve/53b/g004/230372?list=1&ID=241166931199186","cz5adzny0x0dcpan","241166931199186",19.00075,85.9615,0,72006,"01-07-2006",2006-07-01,202,16,10,16.1,6242,2006,17,4,2,4,2.66666666666667,1.5,2.5,2,2.5,4,2.5,3,3,1,4.6,2.8,3,3.33333333333333,3,3.4,4.44444444444444,4.66666666666667,4,4.66666666666667,2.33333333333333,1,3.8,4,3.66666666666667,4,3.66666666666667,1.8,3.72727272727273,4.2,3.66666666666667,3,5,5,5,5,5,4.33333333333333,3,3,3,3.33333333333333,46.43,48.33,53.98,47.67,45.16,40.41,49.59,45.66,55.2011935,45.0844435,59.1714344,49.8030444,1.77777777777778,2,3,3,2.3,2.25,2.33333333333333,3.11111111111111,2.66666666666667,3.33333333333333,3.33333333333333,46.43,40.07,38.71,47.67,35.81,40.41,41.53,38.09,48.3192405,38.2024905,50.2327243,40.8643343,2.88888888888889,2,2,2,4,2.58333333333333,2.25,2.75,3,3.72727272727273,4.2,3.66666666666667,3,4.33333333333333,5,5,4.33333333333333,3,2.33333333333333,3.93333333333333,3,3,2.875,2.83333333333333,3,4,4.07692307692308,3.8,4,4.5,2.28571428571429,2.16666666666667,1.5,3.28571428571429,4.6,2,3.5,1,4,2.8,2.66666666666667,2.66666666666667,3,4,1.8,1,5,4.66666666666667,4.5,3.33333333333333,3.66666666666667,3.75
"137",358,"qgdc0n4bazuqtnj6","03/01/2023 15:47","qualified,20230301_12:51_v2,/Gender/X0TrF,/HomeOffice/oPdDr,/Age/b3xfu,/Total/Total",3,1,1,1,1,1,1,2,64,2,5,"",5,1,"",4,2,6,4.1982,40,5,2,NA,NA,NA,10,"","Direktor",8,13,1,2,2,2,1,NA,64,NA,NA,NA,NA,NA,NA,NA,NA,NA,1,NA,NA,NA,NA,NA,NA,NA,NA,NA,NA,2,4,4,4,3,1,4,4,5,5,4,4,1,3,2,2,1,2,1,1,5,5,5,5,5,5,5,3,7,4,8,10,4,NA,NA,NA,NA,NA,NA,NA,NA,NA,NA,NA,NA,5,5,5,5,5,5,5,5,5,4,4,4,4,4,3,4,4,4,4,4,3,5,5,5,4,4,4,1,1,1,5,1,1,5,1,5,1,1,1,NA,NA,0,7,7,3,1,7,5,8,1,1,1,1,1,1,1,1,0,0,0,0,0,0,0,0,0,1,1,1,1,1,5,1,2,1,3,5,6,6,6,6,6,6,6,6,5,5,5,5,5,5,5,5,4,3,5,5,5,5,5,5,5,5,5,5,5,5,5,4,5,5,5,5,5,4,1,5,1,5,1,1,1162.342,4,NA,12,NA,5,6,"03/01/2023 15:27",NA,NA,NA,1,"Mozilla/5.0 (Windows NT 10.0; Win64; x64; rv:109.0) Gecko/20100101 Firefox/110.0","c61r92f02qjhb7qf","wdg2n84fpsjdseaw",NA,NA,"..","/survey/selfserve/53b/g004/230146?list=1&ID=237301715994727","8xcmt3b9jxzamtqe","237301715994727",410,2023-04-14 10:52:00,3,1,1,1,1,1,1,2,64,2,"",2,"",4,9,2,1,1,1,2,1,1,1,0,0,0,0,0,0,0,0,0,1,1,4,1,2,1,5,1,5,2,2,1,4,1,1,2,NA,"",NA,"",1,2,NA,"",NA,NA,1,0,0,0,0,0,0,0,0,"",1,"",0,1,0,0,0,0,0,0,0,0,"","",1,3,NA,"",2,NA,NA,NA,NA,NA,"",2,2,NA,NA,NA,"",3,2,1,"Rückenschule",2,NA,2,"","","",NA,NA,2,"",NA,NA,NA,"","","",NA,NA,2,"",NA,NA,NA,"","","",1,1,2,"",NA,NA,NA,"","","",1,1,1,"Vorträge Bego",1,5,NA,"","","",NA,NA,2,"",NA,NA,NA,"","","",3,2,1,"Fachseminare",1,5,NA,"","","",NA,NA,1,"Bego",1,5,NA,"","","",NA,NA,1,"von Vertragspartnern Seminare",1,5,NA,NA,"",NA,NA,NA,1,"Betriebsleiter",2,NA,2,"",NA,NA,1,"flexible AZ",1,5,NA,"","","",NA,NA,2,"",NA,NA,NA,"","","",1,1,1,"Vertragseinrichtungen",2,NA,2,"","","",NA,NA,2,"",NA,NA,NA,NA,"","",1,1,2,"",NA,NA,NA,NA,"","",1,1,0,0,0,1,0,1,0,0,0,0,"",0,0,0,0,0,0,0,1,0,0,"",0,0,0,0,0,0,0,1,0,0,"",1,1,NA,NA,NA,NA,1,1,5,NA,"",NA,NA,1,1,1,2,5,5,5,5,2,"",1,1,2,1,0,0,4,5,4,4,5,5,5,5,5,4,4,5,4,5,4,5,5,5,5,5,5,5,5,5,3,3,2,3,3,3,3,2,3,3,3,4,4,4,4,4,5,4,4,5,5,5,5,5,1,1,4,4,3,3,2,4,4,4,1,4,4,5,5,5,4,4,5,4,1,1,1,1,1,1,1,1,1,1,1,1,1,5,5,4,4,4,3,1,3,3,4,4,4,5,4,5,4,4,1,4,4,4,4,4,5,5,5,5,5,5,1445.44,5,"wdg2n84fpsjdseaw",NA,NA,"..","/survey/selfserve/53b/g004/230372?list=1&ID=241166931203082","8xcmt3b9jxzamtqe","241166931203082",19.3723666666667,24.0906666666667,0,41982,"01-04-1982",1982-04-01,493,41,1,41.01,15099,1982,41,4,2,4.33333333333333,4.33333333333333,2,2,1.5,1,5,5,5,5,3,6.6,NA,NA,NA,NA,5,4.44444444444444,5,4.33333333333333,4,4.33333333333333,1.75,2.6,3,2.33333333333333,3,2.33333333333333,5,4.72727272727273,5,5,4,5,5,5,5,5,4.83333333333333,5,5,5,4.83333333333333,59.45,54.05,53.98,60.77,61.83,55.25,56.79,52.42,69.432978,59.316228,68.008793,58.640403,0,5,1,3,1.7,1.5,1.83333333333333,5.88888888888889,5.66666666666667,6,6,52.83,54.05,53.98,60.77,55.62,55.25,56.79,52.42,67.5970951,57.4803451,66.0444512,56.6760612,0,2,1,1,2,1.41666666666667,1.25,1.5,5,4.63636363636364,4.6,5,4.33333333333333,4.83333333333333,4.33333333333333,5,5,5,2.83333333333333,3.8,5,5,4.5,4.83333333333333,3.5,5,4.07692307692308,4.2,3.5,4.5,2,1,1,3.78571428571429,4.4,2.5,4.25,4,5,4.3,4.33333333333333,4.33333333333333,4.25,5,3.8,3,4,2.66666666666667,3,4,4.33333333333333,4.5
"138",362,"ua3nb8fsufsyzvh3","03/01/2023 15:58","qualified,/Gender/p47uy,/Age/gcKvr,20230301_12:51_v2,/HomeOffice/ZRYex,/Total/Total",3,1,1,1,1,1,1,1,42,1,5,"",5,1,"",2,1,6,5.2008,40,50,2,NA,NA,NA,5,"","Teamleader Billing",9,2,1,2,3,3,2,1,42,8,NA,NA,NA,NA,NA,NA,NA,NA,1,2,NA,NA,NA,NA,NA,NA,NA,NA,4,2,5,5,5,4,5,4,4,4,3,4,4,3,2,3,3,2,3,3,3,3,3,3,3,3,3,3,1,6,8,4,5,4,4,4,4,4,4,4,4,4,4,4,4,4,4,4,3,4,4,5,5,5,5,5,5,5,5,5,3,3,3,2,2,2,3,4,4,4,4,4,3,1,1,2,5,5,5,5,5,3,5,1,1,2,86,3,6,6,6,6,6,5,10,3,2,1,1,2,1,2,1,1,1,1,0,1,0,4,0,0,3,3,3,3,3,2,3,3,3,3,2,3,2,3,3,2,3,3,3,5,5,5,5,5,5,5,5,5,5,5,5,5,5,5,5,5,5,5,5,5,5,5,5,5,5,5,5,5,4,1,2,2,2,2,1,1453.724,13,NA,11,NA,5,6,"03/01/2023 15:34",NA,NA,NA,1,"Mozilla/5.0 (Macintosh; Intel Mac OS X 10_15_6) AppleWebKit/605.1.15 (KHTML, like Gecko) Version/15.6.1 Safari/605.1.15","hfqexwrkqd3vb9j2","v6t3a8sxn4mr3q35",NA,NA,"..","/survey/selfserve/53b/g004/230146?list=1&ID=237301716019452","v6t3a8sxn4mr3q35","237301716019452",20,2023-04-06 17:40:00,3,1,1,1,1,1,1,1,42,2,"",2,"",4,10,3,2,2,1,3,3,1,1,1,1,2,0,1,1,1,1,0,4,4,4,4,4,3,4,3,3,3,3,3,3,1,2,NA,NA,"",NA,"",NA,NA,NA,"",2,2,NA,NA,NA,NA,NA,NA,NA,NA,NA,"",NA,"",0,1,0,0,0,0,0,0,0,0,"","",1,2,2,"",2,NA,NA,NA,NA,NA,"",3,1,2,NA,1,"",NA,NA,1,"Fitnessstudio  Fahrrad Mieten",2,NA,1,"","","",NA,NA,2,"",NA,NA,NA,"","","",NA,NA,2,"",NA,NA,NA,"","","",4,5,2,"",NA,NA,NA,"","","",1,1,1,"Helm",2,NA,4,"","","Weiß ich nicht",NA,NA,1,"Obst",1,5,NA,"","","",NA,NA,1,"Steuerrecht",1,5,NA,"","","",NA,NA,2,"",NA,NA,NA,"","","",5,5,2,"",NA,NA,NA,NA,"",NA,5,5,1,"IT",1,4,NA,"",NA,NA,1,"Home Office",1,4,NA,"","","",NA,NA,2,"",NA,NA,NA,"","","",5,5,2,"",NA,NA,NA,"","","",5,5,2,"",NA,NA,NA,NA,"","",5,5,2,"",NA,NA,NA,NA,"","",5,5,0,0,0,1,0,0,0,0,1,0,"",0,0,1,0,0,1,0,0,0,0,"",0,0,0,0,0,1,0,1,0,0,"",1,1,NA,NA,NA,NA,1,2,NA,2,"",NA,NA,1,1,1,2,5,5,5,5,2,"",5,1,3,2,80,1,4,5,5,5,5,5,5,5,5,5,5,5,5,5,5,5,5,5,5,5,5,5,5,5,3,3,1,1,1,3,3,3,3,3,3,3,3,3,3,3,3,3,3,3,3,5,4,4,4,4,4,4,4,4,4,2,3,3,2,3,3,3,3,3,3,3,2,3,3,3,2,2,2,1,1,1,1,1,1,1,1,4,3,4,4,4,4,4,4,4,4,4,4,4,4,4,4,4,4,4,4,4,4,4,4,3,4,3,3,3,2900.36,5,"v6t3a8sxn4mr3q35",NA,NA,"..","/survey/selfserve/53b/g004/230372?list=1&ID=240475414780049","v6t3a8sxn4mr3q35","240475414780049",24.2287333333333,48.3393333333333,-2,52008,"01-05-2008",2008-05-01,180,15,0,15,5572,2008,15,5,4.5,4,3.66666666666667,2.5,3,2.5,3,3,3,3,3,1,5.4,4,4,4,4,3.8,5,5,5,5,4,1.75,5,5,5,5,5,6,5,5,5,5,5,5,5,5,5,5,5,4,4,3.5,46.43,48.33,53.98,60.77,55.62,55.25,49.59,52.42,63.2900267,53.1732767,65.1197184,55.7513284,0.888888888888889,3,4,3,3.1,3.25,3,2.66666666666667,2.66666666666667,2.66666666666667,2.66666666666667,46.43,48.33,46.92,60.77,45.16,40.41,56.79,52.42,63.8138645,53.6971145,58.2658558,48.8974658,0.888888888888889,2,2,3,3,3.08333333333333,2.75,3.25,5,5,5,5,5,5,5,5,5,5,2,3,2,2,3.625,3.5,4,4,3.15384615384615,3.4,3,3,2.42857142857143,1,1,3.92857142857143,3.8,4,4,4,2,3.8,4,3.33333333333333,4,3.25,2.4,1,5,3,3,3,3,3
"139",363,"6qvt71wmq48m91av","03/01/2023 15:51","qualified,/Age/gcKvr,20230301_12:51_v2,/Gender/X0TrF,/HomeOffice/oPdDr,/Total/Total",3,1,1,1,1,1,1,2,53,1,5,"",6,1,"",4,1,5,11.1999,40,50,2,NA,NA,NA,4,"","Geschäftsführer",8,2,1,2,4,4,2,2,37,17,15,NA,NA,NA,NA,NA,NA,NA,1,2,2,NA,NA,NA,NA,NA,NA,NA,1,2,3,3,4,5,4,4,5,4,4,3,4,1,1,2,1,1,1,2,2,5,4,3,3,5,4,4,2,2,1,7,4,3,4,5,4,4,3,5,4,4,5,4,4,5,5,4,5,4,5,3,4,3,3,4,4,4,3,3,3,3,4,4,5,4,4,5,5,5,5,5,4,1,2,2,4,5,3,3,4,4,4,4,3,2,50,30,6,7,6,6,6,3,7,4,4,3,2,4,4,4,3,5,6,4,5,5,4,3,4,2,4,2,4,5,4,3,2,4,4,5,2,3,2,2,3,2,1,2,1,4,5,5,4,4,4,5,4,4,5,4,2,1,1,4,4,5,5,4,3,4,4,4,3,4,3,4,4,4,2,3,4,2,3,5,1,1004.915,4,NA,10,NA,5,6,"03/01/2023 15:34",NA,NA,NA,1,"Mozilla/5.0 (Windows NT 10.0; Win64; x64) AppleWebKit/537.36 (KHTML, like Gecko) Chrome/110.0.0.0 Safari/537.36","j255hvbxt97mqa1r","pd2gs56zkwv4hznh",NA,NA,"..","/survey/selfserve/53b/g004/230146?list=1&ID=237301715991607","pd2gs56zkwv4hznh","237301715991607",420,2023-04-14 11:57:00,3,1,1,1,1,1,1,2,53,2,"",2,"",3,6,4,3,3,3,4,4,4,3,4,5,5,6,5,6,1,5,3,4,4,3,5,5,4,3,2,4,5,5,4,2,1,1,2,NA,"",NA,"",1,4,NA,"",NA,NA,0,1,1,0,0,0,0,1,0,"",3,"",0,0,0,1,0,1,0,1,0,0,"","VDK",1,3,NA,"",1,9,4,1,4,NA,"",2,1,1,4,NA,"",NA,NA,1,"Verhaltens- und verhältnisbezogene Suchtprävention im Betrieb. Aktive Stressbewältigung und Stressprävention.",2,NA,4,"","","Förderung der Bewegungsfreude.  Sammeln von Bewegungserfahrungen.  Erproben und Erweitern der motorischen Fähigkeiten.  Körperbewusstsein – den eigenen Körper erfahren.  Eigene Fähigkeiten und Grenzen kennen lernen und erweitern.  Auseinandersetzung mit der Umwelt.",NA,NA,2,"",NA,NA,NA,"","","",NA,NA,2,"",NA,NA,NA,"","","",5,5,1,"Prävention des Suchtmittelkonsums.",2,NA,4,"","","Es gib keine Verbesserung sie zu gestalten.",NA,NA,2,"",NA,NA,NA,"","","",1,1,2,"",NA,NA,NA,"","","",1,1,2,"",NA,NA,NA,"","","",1,1,2,"",NA,NA,NA,"","","",1,1,2,"",NA,NA,NA,NA,"",NA,1,1,2,"",NA,NA,NA,"",1,1,2,"",NA,NA,NA,"","","",1,1,2,"",NA,NA,NA,"","","",1,1,2,"",NA,NA,NA,"","","",1,1,2,"",NA,NA,NA,NA,"","",1,1,2,"",NA,NA,NA,NA,"","",1,1,0,0,0,0,0,0,1,0,0,0,"",0,0,0,0,0,0,0,1,0,0,"",0,0,0,0,0,0,1,1,1,0,"",2,1,NA,NA,NA,NA,2,NA,NA,NA,"",1,1,2,NA,2,2,3,3,3,3,2,"",4,4,4,2,70,40,5,5,4,5,5,4,4,5,5,4,4,5,2,1,3,4,4,5,4,5,4,5,4,5,3,4,3,3,4,4,5,4,4,4,4,5,5,4,4,4,5,4,5,4,5,5,4,4,5,4,4,5,4,4,5,5,4,5,4,5,5,4,5,4,5,5,3,4,4,2,3,3,2,1,1,1,1,1,1,4,4,3,1,1,2,3,4,1,1,1,1,1,1,1,1,2,3,3,4,3,3,4,3,3,4,4,3,3,4,3,2651.91,5,"esbg9f5ttu0c10c4",NA,NA,"..","/survey/selfserve/53b/g004/230372?list=1&ID=241166931202292","esbg9f5ttu0c10c4","241166931202292",16.7485833333333,44.1985,10,111999,"01-11-1999",1999-11-01,282,23,6,23.06,8676,1999,24,3.33333333333333,4.5,4.33333333333333,3.66666666666667,1,1.5,1,2,4.5,3,4.33333333333333,4.5,2,3.4,4.4,4.25,4,4.25,4.6,3.44444444444444,3.33333333333333,3.66666666666667,3.33333333333333,5,2.25,3.8,4.5,3.33333333333333,4.5,3.33333333333333,6.2,4.36363636363636,4.4,4.33333333333333,4.33333333333333,3.41666666666667,1.33333333333333,4.33333333333333,4,4,3.66666666666667,3,4,1,2.83333333333333,38.41,30.31,38.71,53.35,35.81,29.53,31.62,38.09,40.3204873,30.2037373,50.3340983,40.9657083,4.22222222222222,4,3,1,3.5,3,3.83333333333333,2,2.66666666666667,1.66666666666667,1.66666666666667,38.41,40.07,38.71,47.67,35.81,29.53,31.62,38.09,38.5906241,28.4738741,51.3861511,42.0177611,4.44444444444444,3,3,2,4,3.83333333333333,3.75,3.875,3,4.54545454545455,4.6,4.66666666666667,4.33333333333333,3.83333333333333,2,4.33333333333333,4.33333333333333,4.66666666666667,3.5,4.4,1,2,3.625,3.33333333333333,4.5,2,4.46153846153846,4,4.75,4.75,3,1,4,1.57142857142857,2,1.75,1,1,2,3,2.66666666666667,2.66666666666667,3.5,3.5,4.2,2,6,4.33333333333333,4,4.66666666666667,4.33333333333333,4.5
"140",365,"8wz9vuger45wjn6n","03/01/2023 16:13","qualified,20230301_12:51_v2,/Gender/X0TrF,/HomeOffice/oPdDr,/Age/b3xfu,/Total/Total",3,1,1,1,1,1,1,2,63,2,4,"",4,1,"",4,1,6,5.201,40,45,2,NA,NA,NA,4,"","Küchenmeister",7,1,3,2,2,2,1,NA,36,NA,NA,NA,NA,NA,NA,NA,NA,NA,1,NA,NA,NA,NA,NA,NA,NA,NA,NA,NA,2,5,5,5,5,5,4,5,5,5,3,4,2,3,4,4,1,4,3,1,5,4,4,4,4,4,5,5,9,6,4,3,10,4,4,5,5,4,4,5,5,5,4,5,4,5,4,5,4,5,5,5,5,5,5,5,5,5,5,4,5,5,3,3,2,3,5,5,5,5,5,2,1,1,2,5,3,1,3,2,5,1,3,3,NA,NA,2,3,3,1,2,5,5,8,4,4,4,5,4,4,2,2,2,2,0,3,3,0,0,0,0,3,4,3,2,1,5,3,3,2,4,6,6,6,6,6,5,6,6,5,5,5,4,5,4,5,4,5,3,4,5,5,5,5,5,5,5,5,5,5,5,5,5,4,5,5,5,5,5,4,3,4,3,4,3,1,2088.336,3,NA,12,NA,5,6,"03/01/2023 15:37",NA,NA,NA,1,"Mozilla/5.0 (Windows NT 6.2; Win64; x64; rv:109.0) Gecko/20100101 Firefox/110.0","9jmex8wnd1rtzesq","rc83qbq1p5hww51v",NA,NA,"..","/survey/selfserve/53b/g004/230146?list=1&ID=237301715991605","rc83qbq1p5hww51v","237301715991605",1000,2023-04-17 16:06:00,3,1,1,1,1,1,1,2,63,2,"",2,"",5,9,4,4,3,5,4,3,3,3,1,3,2,2,2,1,2,2,1,5,3,4,3,3,2,4,3,2,2,2,2,3,1,2,NA,NA,"",NA,"",NA,NA,NA,"",3,3,NA,NA,NA,NA,NA,NA,NA,NA,NA,"",NA,"",1,0,0,0,0,0,1,1,0,0,"","",2,NA,NA,"",2,NA,NA,NA,NA,NA,"",0,2,NA,NA,NA,"",3,4,2,"",NA,NA,NA,"","","",2,3,2,"",NA,NA,NA,"","","",3,3,2,"",NA,NA,NA,"","","",4,4,2,"",NA,NA,NA,"","","",3,3,3,"",NA,NA,NA,"","","",5,5,2,"",NA,NA,NA,"","","",4,4,1,"EDV  Word",1,5,NA,"","","",NA,NA,1,"Kontrolle der Sitzmöglichkeiten oder der EDV, Geräte, Arbeitstische",1,5,NA,"","","",NA,NA,1,"Kurse  mit refrendaren",1,5,NA,NA,"",NA,NA,NA,1,"Abteilungsleiter",1,4,NA,"",NA,NA,1,"stundenreduzierung",2,NA,2,"","","",NA,NA,3,"",NA,NA,NA,"","","",4,5,2,"",NA,NA,NA,"","","",3,3,2,"",NA,NA,NA,NA,"","",3,4,2,"",NA,NA,NA,NA,"","",3,3,0,0,0,1,0,1,0,0,0,0,"",0,0,0,0,0,0,0,0,1,0,"",0,0,0,0,0,1,0,0,1,0,"",2,1,NA,NA,NA,NA,2,NA,NA,NA,"",3,5,1,1,3,3,4,5,5,3,2,"",2,1,1,1,0,0,5,5,5,4,5,4,5,4,5,4,5,5,5,5,5,5,5,5,5,5,5,5,5,5,4,3,1,1,3,3,4,3,4,4,4,3,4,4,4,3,4,3,4,4,4,5,5,4,5,5,4,3,3,3,4,3,3,3,3,3,4,4,5,4,4,4,2,1,3,3,3,2,3,1,3,3,2,2,4,1,1,5,4,5,5,3,4,3,4,3,3,3,3,3,4,4,3,3,3,3,3,4,4,3,4,3,3,3,3,3,2883.76,5,"e5vdx2qarwecnmj2",NA,NA,"..","/survey/selfserve/53b/g004/230372?list=1&ID=241183254210741","e5vdx2qarwecnmj2","241183254210741",34.8056,48.0626666666667,-2,52010,"01-05-2010",2010-05-01,156,13,0,13,4842,2010,13,5,5,4.66666666666667,4,2.5,4,2.5,2,4.5,4,4.33333333333333,4,NA,6.4,4.4,4.75,4.33333333333333,4.5,4.6,5,5,5,5,5,1.5,2.8,4,2,4,2,2.8,4.45454545454545,4.6,4.66666666666667,4,5,5,5,5,5,4.83333333333333,3,3,3,3.5,38.41,30.31,28.32,31.48,35.81,29.53,49.59,45.66,58.4214243,48.3046743,32.789889,23.421499,1.11111111111111,2,1,2,2.2,1.5,2.66666666666667,5.77777777777778,6,6,5.33333333333333,38.41,30.31,38.71,31.48,35.81,40.41,41.53,38.09,50.3066596,40.1899096,40.1486207,30.7802307,1.77777777777778,2,2,4,3,2.58333333333333,2.25,2.75,4.25,4.63636363636364,4.6,4.66666666666667,4.66666666666667,5,5,5,5,5,2.5,3.73333333333333,1,1,3.25,3.33333333333333,3,3,3.61538461538462,3.4,3.25,4.25,2.42857142857143,2.5,1,3.71428571428571,4.4,3.5,3,4,3,3.4,3.33333333333333,3,3.75,3,3.2,1,5,3.66666666666667,4,3.66666666666667,3.66666666666667,3.75
"141",370,"fpfuy2rjx98mpq4s","03/01/2023 16:09","qualified,/Age/gcKvr,20230301_12:51_v2,/Gender/X0TrF,/HomeOffice/ZRYex,/Total/Total",3,1,1,1,1,1,1,2,40,1,5,"",6,1,"",3,1,6,3.2014,40,43,2,NA,NA,NA,1,"","Projektleiter",8,2,1,2,3,3,2,1,36,5,NA,NA,NA,NA,NA,NA,NA,NA,1,2,NA,NA,NA,NA,NA,NA,NA,NA,3,2,4,5,4,5,5,5,4,4,4,5,5,5,4,3,3,5,5,3,1,5,4,5,5,5,5,5,3,2,3,6,3,7,3,5,5,5,5,5,4,4,5,5,5,4,4,5,5,4,4,5,4,5,4,5,4,4,5,4,4,3,3,3,2,1,4,5,5,5,4,5,3,2,4,4,4,5,5,3,4,4,3,2,2,1,25,5,7,6,5,6,4,5,9,2,1,1,1,2,1,1,1,0,4,0,1,1,0,1,0,0,5,4,1,1,2,5,1,3,2,2,6,6,6,5,5,5,5,4,5,5,5,5,5,5,5,5,4,4,4,4,5,5,5,5,5,5,5,5,4,5,5,5,5,5,5,5,5,5,5,5,5,5,5,1,1,1191.649,14,NA,10,NA,1,2,"03/01/2023 15:49",NA,NA,NA,1,"Mozilla/5.0 (Linux; Android 13; SAMSUNG SM-G781B) AppleWebKit/537.36 (KHTML, like Gecko) SamsungBrowser/20.0 Chrome/106.0.5249.126 Mobile Safari/537.36","hcxjjnmqsbphzwwe","c9ugdbxgnsfu4xs7",NA,NA,"sa","/survey/selfserve/53b/g004/230146?list=1&ID=237301715997851","dnsfbc2rdw14dkx1","237301715997851",849,2023-04-15 18:11:00,3,1,1,1,1,1,1,2,40,2,"",2,"",5,10,2,1,1,1,1,1,1,1,2,1,2,1,2,1,2,1,1,2,1,1,1,3,1,4,1,1,1,1,1,3,1,1,2,NA,"",NA,"",1,4,NA,"",NA,NA,1,1,0,0,0,0,0,0,0,"",1,"",1,1,0,0,0,0,1,0,0,0,"","",1,2,2,"",2,NA,NA,NA,NA,NA,"",4,1,1,3,NA,"",NA,NA,1,"Rückentraining und Ruhrraum",1,4,NA,"","","",NA,NA,1,"Onlinekurse",2,NA,1,"","","",NA,NA,1,"Onlinekurse",2,NA,1,"","","",NA,NA,2,"",NA,NA,NA,"","","",3,4,1,"Onlineschulung durch den Arbeitsgeber und auch Kurse durch den Arbeitgeber",1,5,NA,"","","",NA,NA,2,"",NA,NA,NA,"","","",5,5,1,"verschiedene Kurse nach Anvorderung",1,5,NA,"","","",NA,NA,1,"Onlinekurse",1,5,NA,"","","",NA,NA,1,"Onlinekurse",1,4,NA,NA,"",NA,NA,NA,1,"Vorgesetzen",1,5,NA,"",NA,NA,1,"Man kann Stundenreduzieren",1,5,NA,"","","",NA,NA,1,"Wiedereingliederung nach längerer Krankeheit",2,NA,2,"","","",NA,NA,2,"",NA,NA,NA,"","","",5,5,1,"leider nur den setztlich Vorgeschriebenen (Elternzeit",NA,NA,NA,NA,"","",NA,NA,2,"",NA,NA,NA,NA,"","",5,4,0,0,0,1,1,0,0,1,0,0,"",1,0,0,0,0,0,1,1,0,0,"",0,0,0,0,0,1,1,1,0,0,"",1,1,NA,NA,NA,NA,1,1,5,NA,"",NA,NA,1,1,1,1,4,5,4,5,2,"",4,3,3,1,1,0,5,5,5,5,5,5,5,4,4,5,5,4,5,4,5,5,4,5,5,5,4,5,5,4,3,4,4,3,4,3,4,5,4,4,5,4,4,4,3,5,5,4,5,4,5,3,4,4,5,5,4,4,5,4,5,4,4,4,2,4,5,2,5,5,3,4,2,1,1,1,2,1,1,2,2,2,2,1,2,1,2,4,5,3,5,4,4,5,5,5,3,4,4,3,3,4,5,4,3,5,4,3,4,4,5,4,5,4,5,4,1220.54,5,"gfn9n30e15f598r8",NA,NA,"..","/survey/selfserve/53b/g004/230372?list=1&ID=241183254215697","gfn9n30e15f598r8","241183254215697",19.8608166666667,20.3423333333333,-5,32014,"01-03-2014",2014-03-01,110,9,2,9.02,3442,2014,9,4.33333333333333,5,4.33333333333333,4.66666666666667,4.5,3,5,2,4.5,5,5,5,3,4.2,4.4,4.75,4.66666666666667,4.58333333333333,4.4,4.44444444444444,4.66666666666667,4.33333333333333,4.33333333333333,4.66666666666667,3.25,4.2,4.5,4,4.5,4,5.6,4.63636363636364,5,4.66666666666667,4,4.91666666666667,5,5,4.66666666666667,5,5,1,1,5,3.66666666666667,52.83,54.05,53.98,60.77,55.62,55.25,56.79,52.42,67.5970951,57.4803451,66.0444512,56.6760612,0.777777777777778,2,1,4,2.2,2.25,2.16666666666667,5.22222222222222,5.66666666666667,5.33333333333333,4.66666666666667,52.83,54.05,53.98,60.77,61.83,55.25,56.79,52.42,69.193003,59.076253,66.6843296,57.3159396,1.44444444444444,5,2,5,3,2.08333333333333,1.75,2.25,4.5,4.72727272727273,5,4.33333333333333,4.66666666666667,4.66666666666667,4.66666666666667,4.66666666666667,4.66666666666667,4.66666666666667,3.5,4.33333333333333,1,1,3.25,2.83333333333333,4.5,4,4.07692307692308,3.8,4.25,4.25,1.28571428571429,1.83333333333333,1.5,4.07142857142857,4.2,4.75,3.5,3,3,4.1,4.33333333333333,4,4,4.5,2.6,3,4,4.33333333333333,4.5,4,4.33333333333333,4.5
"142",371,"jpam38euye3g82aw","03/01/2023 16:08","qualified,20230301_12:51_v2,/Gender/X0TrF,/HomeOffice/oPdDr,/Age/b3xfu,/Total/Total",3,1,1,1,1,1,1,2,65,2,5,"",6,3,"",4,1,4,8.1991,40,45,2,NA,NA,NA,9,"","Leitender Gesamtschuldirektor",8,10,5,2,3,3,1,NA,35,30,NA,NA,NA,NA,NA,NA,NA,NA,2,2,NA,NA,NA,NA,NA,NA,NA,NA,NA,1,4,5,4,4,3,5,5,5,4,5,3,2,2,4,4,2,3,2,3,4,4,4,4,4,4,4,1,6,6,7,7,5,3,3,4,4,4,4,4,4,4,4,4,3,4,4,3,1,4,3,3,3,3,4,4,3,3,3,4,4,4,3,3,3,3,4,4,2,3,3,1,1,1,1,3,2,1,4,1,5,1,1,1,NA,NA,0,5,5,5,1,1,4,8,3,2,2,2,2,2,2,2,3,3,0,2,2,2,0,0,0,2,2,3,3,1,3,2,2,1,4,5,5,5,5,5,5,5,5,5,4,4,4,4,4,4,4,4,4,4,4,4,4,4,4,4,4,4,4,4,4,4,4,4,4,4,4,4,4,4,1,4,2,3,3,1,1057.576,14,NA,10,NA,3,2,"03/01/2023 15:49",NA,NA,NA,1,"Mozilla/5.0 (Linux; Android 9; CMR-AL09) AppleWebKit/537.36 (KHTML, like Gecko) Chrome/110.0.0.0 Safari/537.36","3u2365655we4s9mr","gp83sjxc7nbd08ny",NA,NA,"ta","/survey/selfserve/53b/g004/230146?list=1&ID=237301715983542","6c4j5hnzu6n5eqez","237301715983542",11,2023-04-06 14:41:00,3,1,1,1,1,1,1,2,65,2,"",2,"",5,9,3,2,2,3,2,1,1,1,2,2,0,0,0,0,0,0,0,4,3,3,3,3,2,4,3,4,3,2,1,3,2,2,NA,NA,"",NA,"",NA,NA,NA,"",2,2,NA,NA,NA,NA,NA,NA,NA,NA,NA,"",NA,"",0,0,0,0,0,0,1,0,0,0,"","",2,NA,NA,"",2,NA,NA,NA,NA,NA,"",0,2,NA,NA,NA,"",4,3,2,"",NA,NA,NA,"","","",4,4,2,"",NA,NA,NA,"","","",4,4,2,"",NA,NA,NA,"","","",4,4,2,"",NA,NA,NA,"","","",4,1,2,"",NA,NA,NA,"","","",3,2,2,"",NA,NA,NA,"","","",4,3,1,"Fortbildungen des Landes NRW",1,3,NA,"","","",NA,NA,2,"",NA,NA,NA,"","","",4,4,2,"",NA,NA,NA,NA,"",NA,4,4,2,"",NA,NA,NA,"",4,4,1,"Teilzeitkonzept",2,NA,4,"","","Das ist in meinem Bereich schwer möglich (Schule)!",NA,NA,1,"Mitwirkung",2,NA,4,"","","S. O.",NA,NA,2,"",NA,NA,NA,"","","",2,2,1,"Gleifhstellungsplan des Landes NRW",NA,NA,NA,NA,"","",NA,NA,2,"",NA,NA,NA,NA,"","",2,1,1,0,0,0,0,0,0,0,0,0,"",1,1,1,1,0,0,0,1,0,0,"",1,1,1,1,0,0,0,1,0,0,"",1,1,NA,NA,NA,NA,2,NA,NA,NA,"",4,4,1,1,1,1,3,3,3,2,1,"Erheblich mehr Angebote für meinen Berufsstand (Lehrer)",2,1,3,1,0,1,4,4,4,4,4,4,4,4,4,2,3,4,5,5,5,5,5,5,5,5,5,5,5,5,3,3,3,3,3,3,4,4,4,4,4,4,4,3,3,3,3,3,4,3,3,4,4,4,4,3,3,4,4,3,3,4,3,3,3,4,4,4,4,5,5,5,1,2,1,1,1,1,1,1,1,1,1,1,1,1,1,5,4,4,4,5,1,1,3,1,2,2,3,4,2,5,5,5,2,4,4,4,4,5,4,5,5,3,4,4,1352.96,3,"gp83sjxc7nbd08ny",NA,NA,"ta","/survey/selfserve/53b/g004/230372?list=1&ID=240475414777967","6c4j5hnzu6n5eqez","240475414777967",17.6262666666667,22.5493333333333,1,81991,"01-08-1991",1991-08-01,381,31,9,31.09,11690,1991,32,4.33333333333333,3.5,5,4,2,4,2.5,2.5,4,4,4,4,1,6.2,3.6,4,3.66666666666667,3.75,3.2,3.22222222222222,3,3.66666666666667,3,2.66666666666667,1,2.2,2.5,2,2.5,2,3.4,4,4,4,4,4,4,4,4,4,4,5,4,3,3.83333333333333,46.43,48.33,46.92,53.35,55.62,49.47,49.59,45.66,60.8800965,50.7633465,58.8045092,49.4361192,1.33333333333333,4,3,2,2.3,1.75,2.66666666666667,5,5,5,5,46.43,48.33,46.92,47.67,55.62,55.25,56.79,52.42,69.9930977,59.8763477,55.0805774,45.7121874,0.444444444444444,3,2,2,3,2.5,2,2.75,2.75,3.72727272727273,4,4,3,5,5,5,5,5,3,3.53333333333333,2,3,3.5,3.33333333333333,4,3,3.84615384615385,3.6,3.25,4.75,1.14285714285714,1,1,2.92857142857143,4.4,1.5,2.75,2,4,4.4,5,4,4.25,4.25,3.2,1,1,4,4,3.66666666666667,3,3.25
"143",373,"shc1d4waaa70zv0g","03/01/2023 16:07","qualified,/Gender/p47uy,/Age/gcKvr,20230301_12:51_v2,/HomeOffice/oPdDr,/Total/Total",3,1,1,1,1,1,1,1,46,1,5,"",6,1,"",1,1,2,4.2015,40,40,2,NA,NA,NA,12,"Keine angabe","Keine angabe",9,2,1,2,2,2,1,NA,48,NA,NA,NA,NA,NA,NA,NA,NA,NA,1,NA,NA,NA,NA,NA,NA,NA,NA,NA,NA,2,3,4,3,3,3,3,3,3,3,3,4,2,2,3,3,2,3,3,2,3,3,3,3,3,3,3,3,6,6,5,6,6,3,3,4,4,3,3,3,3,3,3,3,3,4,3,3,3,3,2,2,2,3,3,3,2,2,3,3,3,4,3,3,3,3,4,4,3,3,3,2,1,1,1,2,2,1,2,1,5,1,1,1,NA,NA,48,4,4,4,4,4,3,5,3,3,3,1,3,1,1,1,3,2,3,3,3,3,1,2,0,3,3,3,3,2,3,2,3,2,3,3,3,2,2,2,2,2,2,2,3,3,4,3,2,4,3,3,3,3,3,3,3,3,4,4,4,3,3,3,2,2,2,3,3,3,3,3,3,3,3,3,3,3,3,1,873.355,14,NA,10,NA,3,2,"03/01/2023 15:52",NA,NA,NA,1,"Mozilla/5.0 (Linux; Android 11; SM-T725) AppleWebKit/537.36 (KHTML, like Gecko) Chrome/110.0.0.0 Safari/537.36","pskqct2v14bd04b1","te4w84yk613yn5q0",NA,NA,"ta","/survey/selfserve/53b/g004/230146?list=1&ID=237301715997853","we62zquzhst55sk4","237301715997853",841,2023-04-15 14:27:00,3,1,1,1,1,1,1,1,46,2,"",2,"",3,5,3,2,2,2,2,1,1,1,1,0,0,0,0,0,0,0,0,3,2,2,2,2,2,2,2,2,2,2,2,2,1,2,NA,NA,"",NA,"",NA,NA,NA,"",3,3,NA,NA,NA,NA,NA,NA,NA,NA,NA,"",NA,"",0,0,0,0,0,0,1,0,0,0,"","",2,NA,NA,"",2,NA,NA,NA,NA,NA,"",0,2,NA,NA,NA,"",2,2,2,"",NA,NA,NA,"","","",4,4,2,"",NA,NA,NA,"","","",3,3,2,"",NA,NA,NA,"","","",2,2,2,"",NA,NA,NA,"","","",2,2,3,"",NA,NA,NA,"","","",3,3,2,"",NA,NA,NA,"","","",3,3,1,"keine Angabe",2,NA,2,"","","",NA,NA,3,"",NA,NA,NA,"","","",3,3,2,"",NA,NA,NA,NA,"",NA,3,3,2,"",NA,NA,NA,"",3,3,2,"",NA,NA,NA,"","","",4,4,3,"",NA,NA,NA,"","","",3,3,3,"",NA,NA,NA,"","","",3,3,3,"",NA,NA,NA,NA,"","",2,2,2,"",NA,NA,NA,NA,"","",3,3,0,0,0,0,0,0,0,0,0,1,"weiß nicht",0,0,0,0,0,0,0,0,0,1,"keine",0,0,0,0,0,0,0,0,0,1,"keine",3,1,NA,NA,NA,NA,2,NA,NA,NA,"",3,3,3,NA,3,3,3,3,3,3,2,"",1,1,4,1,0,0,4,4,4,4,4,4,4,4,4,4,4,4,3,3,3,3,3,3,3,3,3,3,3,2,3,3,3,3,3,3,3,3,3,3,3,3,3,3,3,3,3,3,3,3,3,3,3,3,3,3,3,3,3,3,3,3,3,3,3,3,3,3,3,3,3,3,2,3,2,2,2,2,2,3,3,3,3,3,3,3,2,3,3,3,3,3,3,3,3,3,3,3,3,3,3,3,3,3,3,3,3,3,2,3,3,3,3,3,3,3,761.27,5,"9mhg0ca5q17h81jq",NA,NA,"..","/survey/selfserve/53b/g004/230372?list=1&ID=241183254215700","9mhg0ca5q17h81jq","241183254215700",14.5559166666667,12.6878333333333,-48,42015,"01-04-2015",2015-04-01,97,8,1,8.01,3046,2015,8,3.33333333333333,3,3,3.33333333333333,2,3,2.5,2.5,3,3,3,3,3,5.8,3,3.5,3,3.16666666666667,3.2,2.44444444444444,2,3,2.33333333333333,3,1.25,1.6,2,1.33333333333333,2,1.33333333333333,4,3.09090909090909,3,3.33333333333333,3,3,3,4,3,2,3,3,3,3,3,46.43,40.07,38.71,60.77,45.16,55.25,56.79,52.42,69.9592441,59.8424941,51.8735371,42.5051471,2.22222222222222,3,3,3,2.7,2.5,2.83333333333333,2.22222222222222,2.66666666666667,2,2,46.43,48.33,46.92,53.35,55.62,55.25,56.79,52.42,69.8507001,59.7339501,57.009619,47.641229,0.111111111111111,4,4,4,4,2.66666666666667,3,2.5,3,4,4,4,4,2.91666666666667,3,3,3,2.66666666666667,3,3,3,3,3,3,3,3,3,3,3,3,2.14285714285714,3,2.5,3,3,3,3,3,3,2.9,3,3,2.75,3,3.2,3,4,3,3,3,3,3
"144",376,"j3sxrq32e20tygmt","03/01/2023 16:09","qualified,20230301_12:51_v2,/Gender/X0TrF,/HomeOffice/oPdDr,/Age/b3xfu,/Total/Total",3,1,1,1,1,1,1,2,56,2,5,"",5,1,"",1,1,6,9.1993,34,38,2,NA,NA,NA,5,"","Sachbearbeiter",7,14,1,2,2,2,1,NA,55,NA,NA,NA,NA,NA,NA,NA,NA,NA,1,NA,NA,NA,NA,NA,NA,NA,NA,NA,NA,1,4,4,4,4,3,4,4,4,4,3,4,3,3,3,3,3,3,2,2,3,3,4,3,3,3,3,2,6,4,4,5,5,3,3,4,3,4,3,3,3,3,4,3,3,4,4,3,3,3,3,3,3,3,3,3,3,3,3,4,4,5,3,2,2,4,4,4,4,4,4,1,1,1,1,3,3,3,3,3,3,5,1,1,2,75,10,4,4,5,5,4,3,8,3,2,2,2,2,3,3,3,3,4,3,2,2,3,3,2,3,3,3,2,3,2,3,3,3,3,3,3,3,3,3,3,3,3,2,2,4,4,3,3,3,3,3,3,3,3,3,3,3,3,3,3,3,4,4,3,2,3,3,3,3,3,3,3,3,3,4,3,4,3,4,1,928.189,4,NA,10,NA,5,6,"03/01/2023 15:54",NA,NA,NA,1,"Mozilla/5.0 (Windows NT 10.0; Win64; x64) AppleWebKit/537.36 (KHTML, like Gecko) Chrome/110.0.0.0 Safari/537.36","5348x577t791dsar","1vatyunhha5k2y86",NA,NA,"..","/survey/selfserve/53b/g004/230146?list=1&ID=237305720739995","nuzezq9fgm9tx8de","237305720739995",556,2023-04-14 14:22:00,3,1,1,1,1,1,1,2,57,2,"",2,"",4,8,3,1,2,3,3,2,2,2,3,3,3,2,2,2,3,2,3,2,3,4,3,3,2,4,2,4,2,3,3,3,1,1,2,NA,"",NA,"",2,NA,2,"",NA,NA,1,0,1,1,0,0,0,0,0,"",1,"",0,0,0,0,0,0,1,0,0,0,"","",1,2,2,"",1,8,4,1,4,NA,"",0,1,2,NA,2,"",NA,NA,2,"",NA,NA,NA,"","","",3,3,1,"weiß nicht",2,NA,2,"","","",3,3,2,"",NA,NA,NA,"","","",3,3,2,"",NA,NA,NA,"","","",3,3,1,"weiß nicht",2,NA,2,"","","",NA,NA,1,"Teamevents",1,3,NA,"","","",NA,NA,1,"Fachkurse",1,4,NA,"","","",NA,NA,1,"verstellbare Schreibtische",1,3,NA,"","","",NA,NA,2,"",NA,NA,NA,NA,"",NA,3,3,2,"",NA,NA,NA,"",3,3,1,"Gleitarbeitszeit",1,4,NA,"","","",NA,NA,1,"Elternzeit",2,NA,2,"","","",NA,NA,2,"",NA,NA,NA,"","","",2,2,2,"",NA,NA,NA,NA,"","",3,3,2,"",NA,NA,NA,NA,"","",2,2,0,0,0,0,0,1,0,0,0,0,"",0,0,0,0,0,0,0,1,0,0,"",0,0,0,0,0,1,0,0,0,0,"",1,2,NA,NA,NA,NA,1,1,4,NA,"",NA,NA,1,1,1,1,3,3,3,3,2,"",5,3,4,2,80,20,4,4,4,4,3,4,3,3,3,3,3,3,3,3,3,3,4,4,4,4,4,3,3,3,2,2,2,2,2,2,3,3,3,3,3,3,3,3,3,3,3,3,3,3,3,3,4,3,3,3,4,4,4,3,3,3,3,3,3,3,3,3,3,3,3,3,3,3,2,2,2,2,2,3,3,3,3,2,2,2,2,3,3,3,3,3,3,3,3,3,3,3,3,3,3,3,3,3,3,3,3,3,3,3,3,4,4,4,3,3,1246.36,5,"1vatyunhha5k2y86",NA,NA,"..","/survey/selfserve/53b/g004/230372?list=1&ID=241183337777175","nuzezq9fgm9tx8de","241183337777175",15.4698166666667,20.7726666666667,10,91993,"01-09-1993",1993-09-01,356,29,8,29.08,10928,1993,30,4,3.5,4,3.66666666666667,3,3,3,2,3,3.5,3,3,2,4.8,3.2,3.25,3.33333333333333,3.25,3.4,3,3,3,3,4,1,3,3,3,3,3,4.4,3.18181818181818,3.4,3,3,3.08333333333333,3,3,3.66666666666667,2.66666666666667,3,2,2,2,2.5,46.43,48.33,46.92,53.35,55.62,40.41,41.53,38.09,50.285136,40.168386,60.7812522,51.4128622,2.77777777777778,3,3,3,2.8,2.75,2.83333333333333,2.77777777777778,3,3,2.33333333333333,46.43,54.05,46.92,47.67,45.16,49.47,49.59,45.66,57.2371111,47.1203611,57.544786,48.176396,2.55555555555556,2,2,2,3,2.5,2.5,2.5,3,3.36363636363636,3.8,3,3,3.41666666666667,3,3.66666666666667,4,3,2,3,3,3,3.5,3.33333333333333,4,3,3,3,3,3,2.28571428571429,2.66666666666667,2,3,3,3,3,3,3,3,3,3,3,3.75,3.2,2,1,3,3,3,3,3
"145",377,"fr0cdz9qj2u8sh2j","03/01/2023 16:25","qualified,/Age/gcKvr,20230301_12:51_v2,/Gender/X0TrF,/HomeOffice/oPdDr,/Total/Total",3,1,1,1,1,1,1,2,51,1,4,"",3,4,"",2,2,2,8.2003,45,50,2,NA,NA,NA,11,"","IT consultant",7,2,3,1,NA,NA,NA,NA,NA,NA,NA,NA,NA,NA,NA,NA,NA,NA,NA,NA,NA,NA,NA,NA,NA,NA,NA,NA,NA,2,4,4,4,4,3,3,2,1,2,3,1,3,3,3,3,3,3,3,3,2,3,3,3,3,3,3,1,5,6,5,6,8,NA,NA,NA,NA,NA,NA,NA,NA,NA,NA,NA,NA,3,3,2,3,3,3,3,3,3,3,3,3,3,3,3,4,3,4,4,4,3,3,3,4,4,4,3,3,3,3,3,3,3,3,3,5,5,2,3,1,53,59,6,4,1,1,4,4,8,4,3,3,4,3,3,4,3,4,3,3,1,2,1,2,0,4,3,3,3,3,3,3,3,3,2,3,2,2,3,3,3,3,3,3,3,4,4,3,4,5,3,3,3,3,3,3,3,3,4,4,4,3,4,2,3,3,3,3,3,3,3,3,3,3,2,3,3,4,4,4,1,1808.238,4,NA,12,NA,5,6,"03/01/2023 15:54",NA,NA,NA,1,"Mozilla/5.0 (Windows NT 10.0; Win64; x64; rv:109.0) Gecko/20100101 Firefox/110.0","vrv75yqtuvumab78","agm84hvhxksd1u2m",NA,NA,"..","/survey/selfserve/53b/g004/230146?list=1&ID=237305720742083","qw2m17jttujekzt8","237305720742083",770,2023-04-14 22:27:00,3,1,1,1,1,1,1,2,50,2,"",2,"",4,7,3,3,3,2,2,2,3,3,3,3,3,3,3,1,1,3,3,2,3,3,3,3,3,4,4,3,3,2,2,3,1,2,NA,NA,"",NA,"",NA,NA,NA,"",1,3,NA,NA,NA,NA,NA,NA,NA,NA,NA,"",NA,"",0,0,0,0,0,0,0,0,1,0,"","",2,NA,NA,"",2,NA,NA,NA,NA,NA,"",3,2,NA,NA,NA,"",3,3,1,"k3opdpo343o4ä",2,NA,3,"","mewjmdf34j2","",NA,NA,1,"kljijoöhu8pibhi",2,NA,2,"","","",NA,NA,2,"",NA,NA,NA,"","","",3,3,2,"",NA,NA,NA,"","","",3,3,1,"kfeorkg45k3w",1,3,NA,"","","",NA,NA,2,"",NA,NA,NA,"","","",3,3,1,"ölwpoä3jk43pjpf3o2 ääjp3ä3p2qj3",1,3,NA,"","","",NA,NA,2,"",NA,NA,NA,"","","",3,3,2,"",NA,NA,NA,NA,"",NA,3,4,2,"",NA,NA,NA,"",3,3,2,"",NA,NA,NA,"","","",2,2,2,"",NA,NA,NA,"","","",3,3,2,"",NA,NA,NA,"","","",3,3,1,"jknjkguilzi hiog",NA,NA,NA,NA,"","",NA,NA,2,"",NA,NA,NA,NA,"","",3,3,0,1,0,1,0,1,0,0,0,0,"",0,1,1,0,0,0,0,0,0,0,"",0,0,0,1,0,0,1,0,0,0,"",2,1,NA,NA,NA,NA,2,NA,NA,NA,"",3,3,2,NA,2,2,3,3,3,3,2,"",3,3,4,3,52,45,3,3,3,3,3,2,4,3,3,2,3,3,3,2,3,2,3,3,3,3,3,3,3,3,3,2,2,2,3,3,3,3,3,3,3,3,3,3,4,4,4,3,3,3,3,3,3,3,3,3,4,4,4,3,3,3,3,3,3,3,3,3,3,3,4,3,2,3,4,3,3,3,3,4,4,4,4,3,2,3,3,4,2,3,4,3,3,3,4,4,4,4,4,3,4,3,3,2,2,3,4,4,4,3,3,3,3,3,3,3,837.14,5,"agm84hvhxksd1u2m",NA,NA,"..","/survey/selfserve/53b/g004/230372?list=1&ID=240475414751334","ce0rtk3tuhd4ykb7","240475414751334",30.1373,13.9523333333333,-14,82003,"01-08-2003",2003-08-01,237,19,9,19.09,7307,2003,20,4,3.5,2,2,3,3,3,3,2.5,3,3,3,1,6,NA,NA,NA,NA,2.8,3,3,3,3,4,3,3,3,3,3,3,3.2,3.45454545454545,4,3,3,3.25,3.33333333333333,3.66666666666667,3,3,3,3,2,2,2.66666666666667,38.41,40.07,38.71,40.07,45.16,40.41,31.62,38.09,43.5027582,33.3860082,49.9047895,40.5363995,2.22222222222222,3,3,3,2.9,2.75,3,2.77777777777778,2.33333333333333,3,3,46.43,40.07,38.71,53.35,55.62,49.47,41.53,38.09,55.198682,45.081932,54.3165101,44.9481201,2.55555555555556,3,2,3,3,2.83333333333333,2.5,3,3,2.90909090909091,2.8,3.33333333333333,2.66666666666667,2.83333333333333,2.66666666666667,2.66666666666667,3,3,2.5,3.2,3,3,3.375,3.16666666666667,4,3,3.07692307692308,3,3,3.25,3,3.5,3,3.5,3.2,3.5,3.75,4,4,3.3,2.66666666666667,3.66666666666667,3.5,3,3.6,1,6,3,3,3,4,3
"146",378,"ktmmwef54z522759","03/01/2023 16:09","qualified,/Age/gcKvr,20230301_12:51_v2,/Gender/X0TrF,/HomeOffice/oPdDr,/Total/Total",3,1,1,1,1,1,1,2,54,1,5,"",5,1,"",2,1,5,10.1998,39,40,2,NA,NA,NA,6,"","Kreditberater",8,10,1,2,3,3,2,1,45,17,NA,NA,NA,NA,NA,NA,NA,NA,1,2,NA,NA,NA,NA,NA,NA,NA,NA,3,2,3,3,2,1,3,2,2,2,3,2,3,2,2,1,1,2,2,2,1,2,2,1,2,2,1,2,2,3,4,2,9,3,4,3,4,3,4,3,3,3,3,4,2,3,3,2,3,3,3,4,3,3,4,3,4,3,3,3,4,5,5,3,2,1,3,4,4,3,4,4,4,4,3,4,4,4,2,3,4,5,2,1,4,1,87,1,5,6,5,5,5,3,5,3,3,3,3,3,3,2,3,2,2,1,3,2,1,2,2,2,2,2,2,1,3,2,2,2,2,2,3,4,2,4,2,2,3,3,2,4,4,3,4,3,4,4,4,4,3,4,3,3,3,2,4,4,3,3,4,3,3,3,3,4,4,4,4,5,4,3,4,4,4,4,1,793.784,4,NA,12,NA,5,6,"03/01/2023 15:56",NA,NA,NA,1,"Mozilla/5.0 (Windows NT 10.0; Win64; x64; rv:109.0) Gecko/20100101 Firefox/110.0","8p3ad9hxywgsp7m8","mddgq7pkafzq0a5g",NA,NA,"..","/survey/selfserve/53b/g004/230146?list=1&ID=237301716004891","mddgq7pkafzq0a5g","237301716004891",736,2023-04-14 19:33:00,3,1,1,1,1,1,1,2,54,2,"",2,"",4,6,3,2,2,3,3,3,3,3,1,2,1,0,1,0,1,1,1,2,1,2,3,2,3,2,2,3,2,1,1,2,1,1,1,1,"",9,"",NA,NA,NA,"",NA,NA,NA,NA,NA,NA,NA,NA,NA,NA,NA,"",NA,"",0,0,1,0,0,0,1,0,0,0,"","",1,2,3,"",2,NA,NA,NA,NA,NA,"",3,2,NA,NA,NA,"",4,4,2,"",NA,NA,NA,"","","",5,4,2,"",NA,NA,NA,"","","",4,4,2,"",NA,NA,NA,"","","",3,2,2,"",NA,NA,NA,"","","",1,1,2,"",NA,NA,NA,"","","",2,2,2,"",NA,NA,NA,"","","",1,1,1,"berufsbezogene Fortbildungskurse",2,NA,4,"","","fachliche Fortbildung",NA,NA,2,"",NA,NA,NA,"","","",3,3,2,"",NA,NA,NA,NA,"",NA,4,4,1,"Betriebsarzt",1,3,NA,"",NA,NA,1,"Gleitzeit",1,4,NA,"","","",NA,NA,3,"",NA,NA,NA,"","","",2,1,2,"",NA,NA,NA,"","","",2,2,2,"",NA,NA,NA,NA,"","",1,1,2,"",NA,NA,NA,NA,"","",2,2,1,0,0,0,0,0,0,0,0,0,"",0,0,1,0,0,1,0,0,0,0,"",0,0,1,0,0,0,0,0,0,0,"",1,1,NA,NA,NA,NA,1,1,4,NA,"",NA,NA,1,1,2,2,4,4,3,4,2,"",2,2,2,1,0,0,1,4,3,2,4,3,4,4,4,3,4,3,4,3,4,4,3,2,3,4,3,3,2,3,3,2,3,3,2,2,3,4,4,4,3,4,3,3,4,3,4,5,3,4,4,3,4,4,3,4,3,4,3,3,2,4,3,4,2,3,3,4,4,3,2,3,3,2,2,2,2,3,2,1,1,2,1,1,1,1,2,4,4,3,3,2,3,4,3,3,2,3,3,2,3,3,4,3,2,3,3,4,4,3,2,4,3,4,2,4,863.03,5,"ubdy456ebz2ypuzs",NA,NA,"..","/survey/selfserve/53b/g004/230372?list=1&ID=241183254218835","ubdy456ebz2ypuzs","241183254218835",13.2297333333333,14.3838333333333,-1,101998,"01-10-1998",1998-10-01,295,24,7,24.07,9072,1998,25,2.66666666666667,2,2,2.66666666666667,2,1,2,1.5,2,1.5,1.66666666666667,1.5,2,4.2,3.4,3.25,3,3.25,2.8,3.33333333333333,3.33333333333333,3.66666666666667,3,3.66666666666667,3.75,3.4,4,3,4,3,5.2,3.72727272727273,3.6,4,3.66666666666667,3.16666666666667,3,3.33333333333333,3.33333333333333,3,4,3,2,2,3.16666666666667,46.43,40.07,38.71,47.67,45.16,40.41,49.59,38.09,56.5122398,46.3954898,48.8421447,39.4737547,1.88888888888889,4,4,4,2.6,3.25,2.16666666666667,2.77777777777778,3,3,2.33333333333333,46.43,48.33,46.92,47.67,45.16,40.41,41.53,38.09,47.7394182,37.6226682,57.7744122,48.4060222,0.888888888888889,4,4,3,4,2.5,3,2.25,3.75,3.45454545454545,3.2,4,3.33333333333333,3.16666666666667,3.66666666666667,3,3.33333333333333,2.66666666666667,2.5,3.66666666666667,3,2,3.25,3.16666666666667,3.5,4,3.23076923076923,3.4,3.25,3,2.28571428571429,1.16666666666667,1.5,3,3.2,3.25,2.5,3,4,3.3,3.33333333333333,3.33333333333333,3.25,3.25,2.8,2,3,3.66666666666667,3.5,3.33333333333333,3.66666666666667,4
"147",380,"frcewuk54q43d3v0","03/01/2023 16:26","qualified,/Age/gcKvr,20230301_12:51_v2,/Gender/X0TrF,/HomeOffice/oPdDr,/Total/Total",3,1,1,1,1,1,1,2,54,1,5,"",4,1,"",2,1,2,5.2006,40,42,2,NA,NA,NA,4,"","indoor sales",6,14,1,2,3,3,2,1,45,17,NA,NA,NA,NA,NA,NA,NA,NA,1,2,NA,NA,NA,NA,NA,NA,NA,NA,3,2,5,5,4,5,5,3,4,3,3,4,3,2,1,5,4,2,5,2,2,3,3,2,2,2,2,4,1,4,1,3,4,1,2,3,3,3,2,3,4,3,3,2,3,2,1,3,4,1,3,2,4,4,5,5,4,4,3,4,1,1,2,4,1,1,1,5,5,2,3,2,1,1,1,1,4,1,3,4,3,5,3,2,3,1,10,9,5,5,5,6,6,4,7,4,3,2,4,2,2,1,1,2,2,0,0,3,1,0,1,0,3,1,2,4,1,3,4,3,1,4,3,5,4,5,4,5,4,5,5,4,4,3,4,5,3,3,3,3,3,2,3,3,4,5,5,5,5,5,4,5,2,4,4,4,4,5,4,4,2,1,3,4,4,3,1,989.909,5,NA,10,NA,5,6,"03/01/2023 16:03",NA,NA,NA,1,"Mozilla/5.0 (Windows NT 6.1; Win64; x64) AppleWebKit/537.36 (KHTML, like Gecko) Chrome/109.0.0.0 Safari/537.36","aexw24csqasn6ytq","zvz89d0f1wy7x2yu",NA,NA,"..","/survey/selfserve/53b/g004/230146?list=1&ID=237301715982502","zvz89d0f1wy7x2yu","237301715982502",633,2023-04-14 15:59:00,3,1,1,1,1,1,1,2,54,2,"",2,"",4,9,5,4,4,5,3,3,2,1,1,3,1,0,1,1,0,0,0,3,3,2,4,3,2,3,4,2,3,4,2,4,1,2,NA,NA,"",NA,"",NA,NA,NA,"",1,5,NA,NA,NA,NA,NA,NA,NA,NA,NA,"",NA,"",0,0,0,0,0,0,0,1,0,0,"","",2,NA,NA,"",2,NA,NA,NA,NA,NA,"",0,2,NA,NA,NA,"",1,1,2,"",NA,NA,NA,"","","",2,2,2,"",NA,NA,NA,"","","",1,1,2,"",NA,NA,NA,"","","",1,1,2,"",NA,NA,NA,"","","",1,1,2,"",NA,NA,NA,"","","",3,3,2,"",NA,NA,NA,"","","",3,3,1,"sprachen",1,4,NA,"","","",NA,NA,1,"neues mobilar",1,5,NA,"","","",NA,NA,2,"",NA,NA,NA,NA,"",NA,1,1,2,"",NA,NA,NA,"",1,1,1,"homeoffice",1,4,NA,"","","",NA,NA,2,"",NA,NA,NA,"","","",1,1,2,"",NA,NA,NA,"","","",1,1,2,"",NA,NA,NA,NA,"","",1,1,2,"",NA,NA,NA,NA,"","",1,1,0,0,0,1,0,0,0,0,0,0,"",0,0,0,1,0,0,0,0,0,0,"",0,0,0,1,0,0,0,0,0,0,"",3,1,NA,NA,NA,NA,2,NA,NA,NA,"",1,1,2,NA,2,2,2,2,1,2,2,"",4,4,3,2,15,10,5,5,4,5,5,5,4,4,3,4,2,4,5,5,4,5,5,5,4,4,4,4,5,4,3,3,2,4,3,3,5,4,4,4,5,3,5,5,4,4,5,3,4,5,5,4,2,4,4,3,4,3,2,4,5,5,4,4,1,3,5,3,4,5,4,4,2,2,1,1,1,2,2,2,1,1,3,3,3,2,2,4,3,3,3,3,2,2,3,2,4,4,4,4,4,3,2,3,4,2,3,3,4,3,2,3,3,3,2,3,1092.84,5,"zvz89d0f1wy7x2yu",NA,NA,"..","/survey/selfserve/53b/g004/230372?list=1&ID=241166931199179","zvz89d0f1wy7x2yu","241166931199179",16.4984833333333,18.214,1,52006,"01-05-2006",2006-05-01,204,17,0,17,6303,2006,17,4.66666666666667,5,3.33333333333333,3.33333333333333,1.5,4.5,3.5,2,3,2,2.66666666666667,2,1,2.6,2.8,3,2.33333333333333,2.75,2.4,3.88888888888889,3.33333333333333,4.66666666666667,3.66666666666667,2.33333333333333,1,3,2.5,3.33333333333333,2.5,3.33333333333333,5.4,3.36363636363636,4,3,2.66666666666667,4.16666666666667,3.33333333333333,5,4.66666666666667,3.66666666666667,4.16666666666667,5,2,3,3.16666666666667,38.41,40.07,46.92,40.07,55.62,49.47,56.79,52.42,70.2455869,60.1288369,48.2995462,38.9311562,1,5,3,2,2.8,1.75,3.5,4.44444444444444,4,4.33333333333333,5,32.56,30.31,28.32,31.48,45.16,40.41,49.59,52.42,65.4973979,55.3806479,32.9547483,23.5863583,0.777777777777778,4,3,4,2,3.16666666666667,2.25,3.625,1.75,4.09090909090909,4.8,3.66666666666667,3.33333333333333,4.5,4.66666666666667,5,4,4.33333333333333,3,4.33333333333333,2,3,3,3.16666666666667,2.5,5,4.23076923076923,4,4.5,4.25,1.57142857142857,2.16666666666667,2,3.21428571428571,3.2,2.25,4,4,2,2.7,2.66666666666667,2.33333333333333,3,2.75,1.8,1,3,4.33333333333333,4.5,4.33333333333333,4.33333333333333,4.25
"148",382,"rm6vjstng0xccnbu","03/01/2023 16:44","qualified,/Age/gcKvr,20230301_12:51_v2,/Gender/X0TrF,/HomeOffice/oPdDr,/Total/Total",3,1,1,1,1,1,1,2,42,1,3,"",2,1,"",4,2,4,6.2012,40,40,2,NA,NA,NA,12,"Studentenwerke","Stellv. Betriebsstellenleiter",7,2,1,2,4,4,2,2,41,7,12,NA,NA,NA,NA,NA,NA,NA,1,2,2,NA,NA,NA,NA,NA,NA,NA,1,2,3,4,5,5,5,4,5,4,4,4,3,2,2,3,3,3,3,1,2,3,3,3,3,2,2,5,5,10,1,1,6,5,NA,NA,NA,NA,NA,NA,NA,NA,NA,NA,NA,NA,3,2,3,1,1,3,5,4,3,3,3,2,2,4,5,3,5,5,1,3,1,5,5,2,1,2,1,3,1,1,1,1,1,1,1,5,1,1,1,NA,NA,0,3,2,1,1,1,5,8,2,3,2,4,3,2,2,1,0,6,6,4,5,0,0,3,0,2,5,3,1,1,5,1,2,2,5,3,3,4,1,6,4,4,3,2,5,5,5,4,4,4,5,5,5,5,5,5,5,5,5,5,5,5,5,4,1,2,3,4,4,3,4,4,4,5,5,5,1,1,1,1,2396.016,12,NA,11,NA,1,1,"03/01/2023 16:03",NA,NA,NA,1,"Mozilla/5.0 (iPhone; CPU iPhone OS 16_3_1 like Mac OS X) AppleWebKit/605.1.15 (KHTML, like Gecko) Version/16.3 Mobile/15E148 Safari/604.1","b7hawz93g09nzjkr","55t83jfurks86rj2",NA,NA,"si","/survey/selfserve/53b/g004/230146?list=1&ID=237301716024405","55t83jfurks86rj2","237301716024405",905,2023-04-16 13:46:00,3,1,1,1,1,1,1,2,42,2,"",2,"",4,9,2,1,1,1,4,1,1,1,0,0,6,0,0,0,0,3,0,3,2,5,3,1,2,5,1,2,1,1,1,5,1,1,2,NA,"",NA,"",1,5,NA,"",NA,NA,0,1,1,0,0,1,0,1,0,"",8,"",0,0,0,0,0,0,0,1,0,0,"","",1,3,NA,"",2,NA,NA,NA,NA,NA,"",2,1,2,NA,2,"",NA,NA,1,"Massagen",1,5,NA,"","","",NA,NA,1,"Seminare",1,4,NA,"","","",NA,NA,2,"",NA,NA,NA,"","","",4,3,1,"Seminare",2,NA,2,"","","",NA,NA,1,"Belehrungen",1,4,NA,"","","",NA,NA,3,"",NA,NA,NA,"","","",3,5,2,"",NA,NA,NA,"","","",5,5,3,"",NA,NA,NA,"","","",3,3,2,"",NA,NA,NA,NA,"",NA,5,5,2,"",NA,NA,NA,"",3,3,1,"Verkürzen der Arbeitszeit",2,NA,2,"","","",NA,NA,2,"",NA,NA,NA,"","","",5,5,1,"Kindergarten Zuschuss",2,NA,2,"","","",NA,NA,2,"",NA,NA,NA,NA,"","",5,4,2,"",NA,NA,NA,NA,"","",5,5,0,0,0,0,0,0,0,0,1,0,"",0,0,0,0,0,0,0,0,1,0,"",0,0,0,0,0,0,0,0,1,0,"",1,1,NA,NA,NA,NA,1,2,NA,2,"",NA,NA,1,1,1,1,3,4,5,5,2,"",1,1,1,1,0,0,1,5,5,5,5,5,5,5,5,5,5,5,5,5,5,5,5,5,5,5,5,5,5,5,4,4,4,4,4,4,5,5,5,5,5,5,5,5,5,5,5,5,5,5,5,4,4,4,1,1,5,4,4,5,5,4,5,5,5,5,5,5,5,5,5,5,5,5,1,1,1,1,2,1,1,1,2,1,1,2,2,5,5,5,5,5,5,5,5,5,5,5,5,5,5,5,5,5,5,5,5,5,5,5,5,5,5,5,5,5,1459.09,5,"hskkgh4fcrqhjwb1",NA,NA,"..","/survey/selfserve/53b/g004/230372?list=1&ID=241166931207254","hskkgh4fcrqhjwb1","241166931207254",39.9336,24.3181666666667,0,62012,"01-06-2012",2012-06-01,131,10,11,10.11,4080,2012,11,4,5,4.33333333333333,3.66666666666667,2,3,3,1.5,3,3,3,2,NA,4.6,NA,NA,NA,NA,2,3.22222222222222,4,3,2.66666666666667,1.66666666666667,1.5,1,1,1,1,1,1.6,4.72727272727273,4.6,4.66666666666667,5,4.16666666666667,5,5,4.66666666666667,2,3.83333333333333,1,5,5,3.66666666666667,52.83,40.07,46.92,40.07,45.16,49.47,49.59,52.42,62.9078605,52.7911105,52.2095892,42.8411992,2.66666666666667,1,1,1,1.5,1.25,1.66666666666667,3.33333333333333,4,3,3,52.83,54.05,53.98,60.77,35.81,55.25,56.79,52.42,62.5061232,52.3893732,64.0032288,54.6348388,1,1,1,4,1,1.58333333333333,1.25,1.75,4.25,5,5,5,5,5,5,5,5,5,4,5,5,5,4.375,4.5,4,1,4.61538461538461,4.2,4.75,5,2.28571428571429,1.16666666666667,2,5,5,5,5,5,1,4.6,5,3.66666666666667,5,5,3,1,1,5,5,5,5,5
"149",384,"bz63z3gwgk9pdvmu","03/01/2023 19:36","qualified,/Gender/p47uy,/Age/gcKvr,20230301_12:51_v2,/HomeOffice/oPdDr,/Total/Total",3,1,1,1,1,1,1,1,45,1,5,"",3,1,"",1,2,2,3.2013,30,30,2,NA,NA,NA,4,"","Hausdame",7,15,1,2,4,4,2,2,50,45,8,NA,NA,NA,NA,NA,NA,NA,3,3,2,NA,NA,NA,NA,NA,NA,NA,4,2,2,2,2,5,5,5,5,5,2,5,3,1,1,5,5,1,2,3,1,5,5,3,3,3,4,5,1,10,6,7,8,7,NA,NA,NA,NA,NA,NA,NA,NA,NA,NA,NA,NA,5,4,5,1,4,3,5,5,5,5,5,5,5,5,5,4,1,2,1,1,1,5,5,3,2,3,1,1,1,1,3,4,1,1,4,5,1,1,1,NA,NA,3,7,5,3,5,4,4,8,3,2,2,1,2,1,2,1,1,5,3,4,4,2,4,2,0,2,4,4,4,1,3,2,5,4,3,4,4,2,2,2,4,1,1,1,5,4,4,5,5,5,4,4,4,1,2,3,3,3,5,5,5,5,5,5,5,5,4,4,4,4,3,3,3,4,2,4,3,4,2,1,12693.977,12,NA,11,NA,1,1,"03/01/2023 16:04",NA,NA,NA,1,"Mozilla/5.0 (iPhone; CPU iPhone OS 16_0 like Mac OS X) AppleWebKit/605.1.15 (KHTML, like Gecko) Version/16.0 Mobile/15E148 Safari/604.1","8v85af9fg0x8cp3s","tx53g8s4hg9g3dx8",NA,NA,"si","/survey/selfserve/53b/g004/230146?list=1&ID=237301715991594","tx53g8s4hg9g3dx8","237301715991594",199,2023-04-09 20:51:00,3,1,1,1,1,1,1,1,45,2,"",2,"",5,8,4,3,3,2,4,2,2,2,3,5,1,3,3,1,1,1,0,3,2,4,4,2,2,4,2,5,5,4,1,3,1,2,NA,NA,"",NA,"",NA,NA,NA,"",1,3,NA,NA,NA,NA,NA,NA,NA,NA,NA,"",NA,"",0,0,0,0,0,0,1,1,1,0,"","",2,NA,NA,"",2,NA,NA,NA,NA,NA,"",0,2,NA,NA,NA,"",1,1,2,"",NA,NA,NA,"","","",1,1,2,"",NA,NA,NA,"","","",1,1,2,"",NA,NA,NA,"","","",1,1,2,"",NA,NA,NA,"","","",1,1,2,"",NA,NA,NA,"","","",1,1,2,"",NA,NA,NA,"","","",1,1,2,"",NA,NA,NA,"","","",4,4,2,"",NA,NA,NA,"","","",5,5,2,"",NA,NA,NA,NA,"",NA,1,1,2,"",NA,NA,NA,"",1,1,2,"",NA,NA,NA,"","","",1,1,2,"",NA,NA,NA,"","","",1,1,2,"",NA,NA,NA,"","","",1,1,2,"",NA,NA,NA,NA,"","",1,1,2,"",NA,NA,NA,NA,"","",1,1,0,0,0,0,0,0,0,0,0,1,"nichts",0,0,0,1,0,0,0,0,0,0,"",0,0,0,1,0,0,0,0,0,0,"",2,1,NA,NA,NA,NA,2,NA,NA,NA,"",1,1,2,NA,2,2,3,3,3,3,2,"",1,1,1,1,0,0,1,5,5,5,5,5,5,4,5,4,2,4,4,5,4,5,5,5,5,5,5,5,5,5,2,2,2,3,3,3,3,3,2,1,1,1,1,1,1,1,1,1,1,1,1,5,2,4,5,4,5,2,1,4,5,4,2,3,3,3,4,4,3,4,4,4,3,3,3,3,2,3,3,1,1,3,1,1,1,2,1,5,5,5,5,3,1,1,1,1,3,4,4,4,1,1,1,1,3,1,1,1,1,1,1,3,4,3,3,1,1265.09,5,"7n7why3985bmrusm",NA,NA,"..","/survey/selfserve/53b/g004/230372?list=1&ID=240475414779001","c9x9q3wwzgfbqsdx","240475414779001",211.566283333333,21.0848333333333,-3,32013,"01-03-2013",2013-03-01,122,10,2,10.02,3807,2013,10,2,5,5,3.33333333333333,1,5,1.5,2,5,3,4,3.5,1,7.6,NA,NA,NA,NA,3.8,4.77777777777778,4.33333333333333,5,5,2.66666666666667,1,2.6,3.5,2,3.5,2,4.8,3.90909090909091,4.6,4.33333333333333,2.33333333333333,4.41666666666667,3,5,5,4.66666666666667,3.5,4,3,4,3.83333333333333,46.43,48.33,46.92,60.77,55.62,55.25,49.59,52.42,64.4923447,54.3755947,61.6324314,52.2640414,2.77777777777778,2,3,3,3,2.75,3.16666666666667,2.33333333333333,3.33333333333333,1.66666666666667,2,38.41,40.07,38.71,53.35,35.81,49.47,49.59,45.66,58.4810784,48.3643284,48.5804615,39.2120715,2,2,2,1,3,2.5,2,2.75,3,4.45454545454545,5,4.66666666666667,3.33333333333333,4.83333333333333,4.33333333333333,5,5,5,2.5,1.33333333333333,1,2,2.75,3.16666666666667,1.5,3,3.61538461538462,3.6,3.5,3.75,2.85714285714286,1.33333333333333,1.5,3.07142857142857,4.6,1,3.75,1,3,1.2,1,1.66666666666667,1,3.25,1.2,1,5,2.66666666666667,1,1,1,1
"150",386,"ykv5t00rfhunhv8t","03/01/2023 16:20","qualified,/Age/gcKvr,20230301_12:51_v2,/Gender/X0TrF,/HomeOffice/ZRYex,/Total/Total",3,1,1,1,1,1,1,2,50,1,3,"",2,1,"",1,1,4,1.2018,40,40,2,NA,NA,NA,11,"","Servicetechniker",4,2,4,1,NA,NA,NA,NA,NA,NA,NA,NA,NA,NA,NA,NA,NA,NA,NA,NA,NA,NA,NA,NA,NA,NA,NA,NA,NA,2,4,4,3,4,2,4,4,4,3,4,4,3,3,2,3,2,3,3,2,4,3,4,4,4,4,3,5,4,6,6,6,6,3,3,4,4,3,4,4,4,3,3,3,3,3,3,3,3,3,3,3,3,3,3,3,3,3,3,4,4,4,2,2,2,4,4,4,4,3,4,2,2,1,1,1,2,4,1,3,4,4,1,3,2,40,0,2,1,1,1,5,3,9,3,1,1,1,2,2,3,1,0,0,1,0,0,0,0,0,0,1,5,1,1,1,1,3,2,1,2,1,4,1,1,1,4,2,3,1,3,3,3,3,3,3,3,3,3,3,3,3,3,3,3,3,3,3,3,3,3,3,3,3,3,3,3,3,3,3,3,3,3,3,3,1,787.651,4,NA,10,NA,5,6,"03/01/2023 16:06",NA,NA,NA,1,"Mozilla/5.0 (Windows NT 10.0; Win64; x64) AppleWebKit/537.36 (KHTML, like Gecko) Chrome/110.0.0.0 Safari/537.36","jycxrpgy2nakt2zq","t5uzzrnra0zsqgrr",NA,NA,"..","/survey/selfserve/53b/g004/230146?list=1&ID=237305720748062","01fzq1s89c8zjgan","237305720748062",496,2023-04-14 13:36:00,3,1,1,1,1,1,1,2,50,2,"",2,"",3,8,3,1,1,1,2,2,3,2,2,2,2,0,2,2,1,0,1,2,3,3,3,3,3,3,3,3,3,3,3,3,1,1,2,NA,"",NA,"",2,NA,2,"",NA,NA,0,1,0,1,0,0,0,0,0,"",2,"",0,0,0,0,0,0,1,0,0,0,"","",1,2,2,"",2,NA,NA,NA,NA,NA,"",3,2,NA,NA,NA,"",2,2,2,"",NA,NA,NA,"","","",2,2,2,"",NA,NA,NA,"","","",2,2,2,"",NA,NA,NA,"","","",2,2,2,"",NA,NA,NA,"","","",2,2,1,"Erste Hilfe-Kurs,  Unterrweisung Betriebssicherheit",1,4,NA,"","","",NA,NA,2,"",NA,NA,NA,"","","",4,4,1,"Online-Seminare",1,3,NA,"","","",NA,NA,1,"höhenverstellbare Tische, ergonomische Maus.",2,NA,2,"","","",NA,NA,2,"",NA,NA,NA,NA,"",NA,3,3,2,"",NA,NA,NA,"",3,3,1,"Homeoffice",1,4,NA,"","","",NA,NA,3,"",NA,NA,NA,"","","",3,3,2,"",NA,NA,NA,"","","",2,2,2,"",NA,NA,NA,NA,"","",2,2,2,"",NA,NA,NA,NA,"","",2,2,0,0,0,1,0,0,0,0,0,0,"",0,0,0,0,0,0,0,0,0,1,"nichts",0,0,0,1,0,0,0,0,0,0,"",3,1,NA,NA,NA,NA,1,2,NA,2,"",NA,NA,1,1,1,3,3,3,3,3,2,"",4,1,3,2,40,0,2,4,4,4,4,4,4,4,4,4,4,4,3,3,3,4,4,4,2,3,3,2,3,2,2,3,2,2,3,3,4,4,4,4,4,4,4,4,4,4,4,4,4,4,4,3,3,3,3,3,3,2,2,3,3,3,3,3,3,3,3,3,3,3,3,3,3,3,3,3,3,3,3,3,3,3,3,3,3,1,1,3,3,3,3,3,3,3,3,3,3,3,3,3,3,3,3,3,3,3,3,3,3,3,3,3,3,3,3,3,1841.3,5,"xpqkewwg7vg389yk",NA,NA,"..","/survey/selfserve/53b/g004/230372?list=1&ID=241166931153077","xpqkewwg7vg389yk","241166931153077",13.1275166666667,30.6883333333333,0,12018,"01-01-2018",2018-01-01,64,5,4,5.04,2040,2018,5,3.66666666666667,3,4,3.66666666666667,3,2.5,2.5,2.5,3.5,4,3.66666666666667,4,NA,5.6,3.2,4,3,3.41666666666667,3,3,3,3,3,3.66666666666667,1.5,2.2,1.5,2.66666666666667,1.5,2.66666666666667,2,3,3,3,3,3,3,3,3,3,3,3,3,3,3,46.43,54.05,53.98,60.77,55.62,49.47,41.53,52.42,55.1707827,45.0540327,69.1484154,59.7800254,0.111111111111111,1,5,4,2,2.75,1.5,2,2,1.33333333333333,2.66666666666667,46.43,54.05,53.98,60.77,55.62,49.47,41.53,45.66,52.6043487,42.4875987,68.912897,59.544507,1.33333333333333,3,3,3,3,3,3,3,3,4,4,4,4,3,3,4,2.66666666666667,2.33333333333333,2.5,4,3,3,2.75,3,2,3,3,3,3,3,3,3,1,3,3,3,3,3,3,3,3,3,3,3,2.8,1,1,4,4,4,4,4
"151",387,"jkj1z5g2jcr5su11","03/01/2023 16:24","qualified,20230301_12:51_v2,/Gender/X0TrF,/Age/b3xfu,/HomeOffice/ZRYex,/Total/Total",3,1,1,1,1,1,1,2,62,2,5,"",4,1,"",1,1,6,1.2011,38,38,2,NA,NA,NA,4,"","Softwareentwickler",7,2,1,2,2,2,1,NA,53,NA,NA,NA,NA,NA,NA,NA,NA,NA,1,NA,NA,NA,NA,NA,NA,NA,NA,NA,NA,2,3,4,2,4,3,4,4,4,4,4,3,3,2,3,2,2,2,1,1,3,3,2,2,3,3,3,1,3,4,4,5,5,2,2,3,4,3,4,4,3,2,2,3,3,2,2,2,2,1,3,3,3,3,2,2,2,3,3,2,3,4,3,1,1,3,4,4,3,4,4,1,1,1,1,3,3,5,2,5,2,5,1,1,3,96,7,3,2,1,1,1,4,8,3,2,2,2,3,2,3,2,3,3,2,4,2,2,1,2,1,3,2,3,3,2,4,3,4,2,3,2,4,1,1,1,1,5,2,1,4,4,4,4,3,3,3,3,4,3,3,3,3,4,4,4,4,3,3,3,2,3,2,3,3,4,4,4,4,4,3,3,3,3,2,1,1026.395,4,NA,10,NA,5,6,"03/01/2023 16:06",NA,NA,NA,1,"Mozilla/5.0 (Windows NT 10.0; Win64; x64) AppleWebKit/537.36 (KHTML, like Gecko) Chrome/110.0.0.0 Safari/537.36 Edg/110.0.1587.50","jqfd1unuuysz0800","b8y2nshq3wffsc60",NA,NA,"..","/survey/selfserve/53b/g004/230146?list=1&ID=237305720743128","fdumtfd4c8tbfm0k","237305720743128",500,2023-04-14 13:33:00,3,1,1,1,1,1,1,2,63,2,"",2,"",4,8,3,2,1,2,3,1,3,2,2,3,1,1,1,1,1,1,2,2,2,2,3,3,2,3,3,4,3,4,2,4,1,3,NA,NA,"",NA,"",NA,NA,NA,"",3,4,NA,NA,NA,NA,NA,NA,NA,NA,NA,"",NA,"",0,0,0,0,0,0,1,1,0,0,"","",3,NA,NA,"",3,NA,NA,NA,NA,NA,"",0,3,NA,NA,NA,"",3,3,3,"",NA,NA,NA,"","","",2,1,3,"",NA,NA,NA,"","","",3,2,3,"",NA,NA,NA,"","","",1,1,3,"",NA,NA,NA,"","","",1,1,3,"",NA,NA,NA,"","","",2,1,3,"",NA,NA,NA,"","","",2,1,1,"fachspezifische Dinge",1,2,NA,"","","",NA,NA,3,"",NA,NA,NA,"","","",1,1,3,"",NA,NA,NA,NA,"",NA,1,1,3,"",NA,NA,NA,"",2,2,1,"Teilzeitangebote, Homeoffice",1,5,NA,"","","",NA,NA,3,"",NA,NA,NA,"","","",1,1,3,"",NA,NA,NA,"","","",1,1,3,"",NA,NA,NA,NA,"","",3,1,3,"",NA,NA,NA,NA,"","",1,1,0,0,0,1,0,0,0,0,0,0,"",0,0,0,1,0,0,0,0,0,0,"",0,0,0,1,0,0,0,0,0,0,"",3,1,NA,NA,NA,NA,1,1,4,NA,"",NA,NA,3,NA,3,3,3,3,2,3,2,"",4,4,5,3,97,8,5,4,4,4,5,5,4,3,3,4,4,4,4,3,4,4,4,4,4,4,4,3,3,2,3,3,2,2,2,3,4,4,4,3,3,3,3,4,4,4,4,4,4,4,3,3,3,4,3,3,4,3,3,4,4,5,3,4,2,4,3,4,5,4,5,4,1,2,1,3,3,3,4,1,2,4,2,1,1,2,1,4,2,3,3,4,4,4,3,3,2,2,3,2,2,3,2,2,1,2,2,2,3,3,3,2,3,3,3,2,1492.19,5,"b8y2nshq3wffsc60",NA,NA,"..","/survey/selfserve/53b/g004/230372?list=1&ID=241183337777180","fdumtfd4c8tbfm0k","241183337777180",17.1065833333333,24.8698333333333,1,12011,"01-01-2011",2011-01-01,148,12,4,12.04,4597,2011,12,3,3.5,4,3.66666666666667,2.5,2.5,2,1,3,2,3,3,1,4.2,2.4,3.5,3,2.91666666666667,1.8,2.66666666666667,3,2.33333333333333,2.66666666666667,3.66666666666667,1,3.6,3,4,3,4,1.6,3.45454545454545,3.8,3,3.33333333333333,3.16666666666667,3.33333333333333,4,3,2.33333333333333,3.66666666666667,3,3,4,3.33333333333333,46.43,48.33,46.92,53.35,45.16,49.47,41.53,45.66,52.4018383,42.2850883,60.0807144,50.7123244,2.22222222222222,4,2,3,2.9,2.25,3.33333333333333,2,2.33333333333333,2.33333333333333,1.33333333333333,46.43,48.33,53.98,53.35,45.16,55.25,41.53,45.66,52.4313539,42.3146039,63.6404248,54.2720348,1.44444444444444,4,3,2,2,2.75,2.25,3,2.75,4,4.4,3.33333333333333,4,3.58333333333333,3.66666666666667,4,4,2.66666666666667,2.5,3.66666666666667,3,3,3.25,3.33333333333333,3,4,4.07692307692308,3.8,4,4.5,2.42857142857143,1.83333333333333,1.5,2.92857142857143,3.2,3.5,2.25,2,5,2.7,2.33333333333333,3,2.75,2.75,2.4,1,2,4,3,3.33333333333333,4,3.75
"152",389,"sc78a20tzbd57fxj","03/01/2023 18:26","qualified,/Age/gcKvr,20230301_12:51_v2,/Gender/X0TrF,/HomeOffice/oPdDr,/Total/Total",3,1,1,1,1,1,1,2,45,1,3,"",3,1,"",2,1,4,4.2012,40,45,2,NA,NA,NA,1,"","Industriekaufmann",6,1,1,2,3,3,2,1,1,2,NA,NA,NA,NA,NA,NA,NA,NA,1,2,NA,NA,NA,NA,NA,NA,NA,NA,3,2,3,3,3,4,2,3,3,3,3,3,3,2,4,4,3,3,3,2,3,3,3,3,3,3,3,2,2,7,7,7,7,4,3,4,4,3,4,4,4,4,3,3,4,4,3,3,3,3,3,3,2,3,4,3,2,4,4,3,4,4,4,2,1,1,3,4,4,4,4,4,1,1,1,1,3,3,3,4,3,4,4,1,2,2,20,0,5,5,4,5,4,4,9,2,2,2,3,2,2,1,2,1,0,1,2,0,1,0,1,0,3,3,3,3,3,3,3,3,3,3,3,3,2,3,4,2,4,3,2,3,3,3,3,3,3,3,3,3,3,3,3,3,3,3,3,3,3,3,3,3,3,3,3,3,3,3,3,4,3,2,3,2,3,3,1,5960.555,4,NA,10,NA,5,6,"03/01/2023 16:07",NA,NA,NA,1,"Mozilla/5.0 (Windows NT 10.0; Win64; x64) AppleWebKit/537.36 (KHTML, like Gecko) Chrome/109.0.0.0 Safari/537.36","8n117rfpcv9amb7v","mp5p2rp45j5q07a5",NA,NA,"..","/survey/selfserve/53b/g004/230146?list=1&ID=237301715988735","mp5p2rp45j5q07a5","237301715988735",813,2023-04-15 12:11:00,3,1,1,1,1,1,1,2,45,2,"",2,"",4,8,3,2,2,2,2,1,1,1,1,3,2,3,2,1,1,1,0,2,3,3,3,3,2,2,2,3,2,3,2,3,1,2,NA,NA,"",NA,"",NA,NA,NA,"",3,3,NA,NA,NA,NA,NA,NA,NA,NA,NA,"",NA,"",0,0,0,0,0,0,1,1,0,0,"","",2,NA,NA,"",2,NA,NA,NA,NA,NA,"",3,2,NA,NA,NA,"",3,2,2,"",NA,NA,NA,"","","",2,5,2,"",NA,NA,NA,"","","",4,4,2,"",NA,NA,NA,"","","",2,2,2,"",NA,NA,NA,"","","",2,2,1,"Sicherheitsbelehrungen",1,4,NA,"","","",NA,NA,2,"",NA,NA,NA,"","","",3,3,2,"",NA,NA,NA,"","","",4,4,2,"",NA,NA,NA,"","","",2,2,2,"",NA,NA,NA,NA,"",NA,4,4,2,"",NA,NA,NA,"",4,4,2,"",NA,NA,NA,"","","",3,3,2,"",NA,NA,NA,"","","",3,3,2,"",NA,NA,NA,"","","",3,2,2,"",NA,NA,NA,NA,"","",3,2,2,"",NA,NA,NA,NA,"","",2,2,0,0,0,0,0,1,0,0,0,0,"",0,0,0,1,0,0,0,0,0,0,"",0,0,0,1,0,0,0,0,0,0,"",2,1,NA,NA,NA,NA,2,NA,NA,NA,"",4,4,2,NA,2,2,5,4,4,3,2,"",3,1,3,2,20,3,4,4,4,4,4,3,4,3,4,2,3,4,4,4,4,5,5,4,4,4,3,4,3,3,3,3,2,2,2,2,5,4,4,4,4,5,3,4,4,4,4,4,4,3,3,4,3,4,3,4,4,4,4,3,3,3,2,4,3,3,3,4,4,3,3,3,2,2,1,2,1,2,2,3,3,4,3,2,3,2,2,4,3,4,4,4,4,2,3,3,3,3,4,4,3,3,3,3,2,2,2,3,3,4,3,3,4,3,3,3,10482.21,5,"znxn5usez3amk8rm",NA,NA,"..","/survey/selfserve/53b/g004/230372?list=1&ID=241183254207617","znxn5usez3amk8rm","241183254207617",99.3425833333333,174.7035,3,42012,"01-04-2012",2012-04-01,133,11,1,11.01,4141,2012,11,3,3,3,3,3,3.5,3,2.5,3,3,2.66666666666667,3,2,6.4,3.4,3.75,4,3.66666666666667,3,3.11111111111111,2.66666666666667,3,3.66666666666667,4,1,3.2,3,3.33333333333333,3,3.33333333333333,4.6,3,3,3,3,3,3,3,3,3,3.16666666666667,4,4,3,3.33333333333333,52.83,48.33,46.92,47.67,55.62,49.47,56.79,45.66,66.4268301,56.3100801,56.0530836,46.6846936,0.666666666666667,3,3,3,3,3,3,2.88888888888889,3.33333333333333,3,2.33333333333333,46.43,48.33,46.92,53.35,55.62,55.25,56.79,52.42,69.8507001,59.7339501,57.009619,47.641229,1.55555555555556,3,4,3,3,2.75,2.75,2.75,4,3.54545454545455,3.8,3.66666666666667,3,3.91666666666667,4,4.66666666666667,3.66666666666667,3.33333333333333,2.33333333333333,3.93333333333333,3,2,3.5,3.33333333333333,4,3,3.15384615384615,3.2,3,3.25,1.71428571428571,3,2,3.42857142857143,3.8,3,3.5,3,4,3,3,2.66666666666667,3.25,3.25,2.2,2,4,4.33333333333333,4,4,4,3.5
